Unnamed: 0,id,title,title_zh,authors,url,subjects,subject_split
515,arXiv:2407.19103,FedAR: Addressing Client Unavailability in Federated Learning with Local Update Approximation and Rectification,FedAR：通过局部更新近似和校正来解决联合学习中的客户端不可用问题,"Chutian Jiang, Hansong Zhou, Xiaonan Zhang, Shayok Chakraborty",https://arxiv.org/pdf/2407.19103.pdf,"Subjects:
Machine Learning (cs.LG); Distributed, Parallel, and Cluster Computing (cs.DC)","Machine Learning (cs.LG),  Distributed, Parallel, and Cluster Computing (cs.DC)"
516,arXiv:2407.19102,The Computational Complexity of Factored Graphs,因式图的计算复杂性,"Shreya Gupta, Boyang Huang, Russell Impagliazzo, Stanley Woo, Christopher Ye",https://arxiv.org/pdf/2407.19102.pdf,"Subjects:
Computational Complexity (cs.CC)",Computational Complexity (cs.CC)
517,arXiv:2407.19101,The Variable Time-stepping DLN-Ensemble Algorithms for Incompressible Navier-Stokes Equations,不可压缩Navier-Stokes方程的变时步DLN集成算法,Wenlong Pei,https://arxiv.org/pdf/2407.19101.pdf,"Subjects:
Numerical Analysis (math.NA)",Numerical Analysis (math.NA)
518,arXiv:2407.19099,Sponsored is the New Organic: Implications of Sponsored Results on Quality of Search Results in the Amazon Marketplace,赞助是新的有机：赞助结果对亚马逊市场搜索结果质量的影响,"Abhisek Dash, Saptarshi Ghosh, Animesh Mukherjee, Abhijnan Chakraborty, Krishna P. Gummadi",https://arxiv.org/pdf/2407.19099.pdf,"Subjects:
Computers and Society (cs.CY); Computational Engineering, Finance, and Science (cs.CE); Information Retrieval (cs.IR)","Computers and Society (cs.CY),  Computational Engineering, Finance, and Science (cs.CE),  Information Retrieval (cs.IR)"
519,arXiv:2407.19098,Evaluating Human-AI Collaboration: A Review and Methodological Framework,评估人类与人工智能的协作：综述和方法框架,"George Fragiadakis, Christos Diou, George Kousiouris, Mara Nikolaidou",https://arxiv.org/pdf/2407.19098.pdf,"Subjects:
Human-Computer Interaction (cs.HC); Artificial Intelligence (cs.AI)","Human-Computer Interaction (cs.HC),  Artificial Intelligence (cs.AI)"
520,arXiv:2407.19097,NARVis: Neural Accelerated Rendering for Real-Time Scientific Point Cloud Visualization,NARVis:用于实时科学点云可视化的神经加速渲染,"Srinidhi Hegde, Kaur Kullman, Thomas Grubb, Leslie Lait, Stephen Guimond, Matthias Zwicker",https://arxiv.org/pdf/2407.19097.pdf,"Subjects:
Graphics (cs.GR); Computer Vision and Pattern Recognition (cs.CV); Human-Computer Interaction (cs.HC); Machine Learning (cs.LG)","Graphics (cs.GR),  Computer Vision and Pattern Recognition (cs.CV),  Human-Computer Interaction (cs.HC),  Machine Learning (cs.LG)"
521,arXiv:2407.19096,AI Companions Reduce Loneliness,AI伴侣减少孤独感,"Julian De Freitas, Ahmet K Uguralp, Zeliha O Uguralp, Puntoni Stefano",https://arxiv.org/pdf/2407.19096.pdf,"Subjects:
Computers and Society (cs.CY); Artificial Intelligence (cs.AI)","Computers and Society (cs.CY),  Artificial Intelligence (cs.AI)"
522,arXiv:2407.19095,Towards A More Reasonable Semantic Web,迈向更合理的语义网,"Vleer Doing, Ryan Wisnesky",https://arxiv.org/pdf/2407.19095.pdf,"Subjects:
Databases (cs.DB)",Databases (cs.DB)
523,arXiv:2407.19094,Solving Robotics Problems in Zero-Shot with Vision-Language Models,用视觉语言模型解决零样本机器人问题,"Zidan Wang, Rui Shen, Bradly Stadie",https://arxiv.org/pdf/2407.19094.pdf,"Subjects:
Artificial Intelligence (cs.AI); Robotics (cs.RO)","Artificial Intelligence (cs.AI),  Robotics (cs.RO)"
524,arXiv:2407.19092,Boosted generalized normal distributions: Integrating machine learning with operations knowledge,强化广义正态分布：将机器学习与操作知识相结合,"Ragip Gurlek, Francis de Vericourt, Donald K. K. Lee",https://arxiv.org/pdf/2407.19092.pdf,"Subjects:
Machine Learning (cs.LG); Methodology (stat.ME); Machine Learning (stat.ML)","Machine Learning (cs.LG),  Methodology (stat.ME),  Machine Learning (stat.ML)"
525,arXiv:2407.19090,MetaHive: A Cache-Optimized Metadata Management for Heterogeneous Key-Value Stores,MetaHive：异构键值存储的缓存优化元数据管理,"Alireza Heidari, Amirhossein Ahmadi, Zefeng Zhi, Wei Zhang",https://arxiv.org/pdf/2407.19090.pdf,"Subjects:
Databases (cs.DB); Information Retrieval (cs.IR)","Databases (cs.DB),  Information Retrieval (cs.IR)"
526,arXiv:2407.19089,Many-Shot In-Context Learning for Molecular Inverse Design,分子逆向设计的多镜头上下文学习,"Saeed Moayedpour, Alejandro Corrochano-Navarro, Faryad Sahneh, Shahriar Noroozizadeh, Alexander Koetter, Jiri Vymetal, Lorenzo Kogler-Anele, Pablo Mas, Yasser Jangjou, Sizhen Li, Michael Bailey, Marc Bianciotto, Hans Matter, Christoph Grebner, Gerhard Hessler, Ziv Bar-Joseph, Sven Jager",https://arxiv.org/pdf/2407.19089.pdf,"Subjects:
Computation and Language (cs.CL); Artificial Intelligence (cs.AI)","Computation and Language (cs.CL),  Artificial Intelligence (cs.AI)"
527,arXiv:2407.19088,Unpopular Opinion: Generative Artificial Intelligence Is Not Eroding Academic Integrity,不受欢迎的观点：生成性人工智能不会侵蚀学术诚信,"Myles Joshua Toledo Tan, Nicholle Mae Amor Tan Maravilla",https://arxiv.org/pdf/2407.19088.pdf,"Subjects:
Computers and Society (cs.CY)",Computers and Society (cs.CY)
528,arXiv:2407.19087,Evaluating the Capability of LLMs in Identifying Compilation Errors in Configurable Systems,评估LLM在可配置系统中识别编译错误的能力,"Lucas Albuquerque, Rohit Gheyi, Márcio Ribeiro",https://arxiv.org/pdf/2407.19087.pdf,"Subjects:
Software Engineering (cs.SE)",Software Engineering (cs.SE)
529,arXiv:2407.19082,Regularized Multi-Decoder Ensemble for an Error-Aware Scene Representation Network,误差感知场景表示网络的正则化多解码器集成,"Tianyu Xiong, Skylar W. Wurster, Hanqi Guo, Tom Peterka, Han-Wei Shen",https://arxiv.org/pdf/2407.19082.pdf,"Subjects:
Machine Learning (cs.LG); Artificial Intelligence (cs.AI); Computer Vision and Pattern Recognition (cs.CV); Graphics (cs.GR); Human-Computer Interaction (cs.HC)","Machine Learning (cs.LG),  Artificial Intelligence (cs.AI),  Computer Vision and Pattern Recognition (cs.CV),  Graphics (cs.GR),  Human-Computer Interaction (cs.HC)"
530,arXiv:2407.19079,UniForensics: Face Forgery Detection via General Facial Representation,UniForensics：通过通用面部表示进行面部伪造检测,"Ziyuan Fang, Hanqing Zhao, Tianyi Wei, Wenbo Zhou, Ming Wan, Zhanyi Wang, Weiming Zhang, Nenghai Yu",https://arxiv.org/pdf/2407.19079.pdf,"Subjects:
Computer Vision and Pattern Recognition (cs.CV)",Computer Vision and Pattern Recognition (cs.CV)
531,arXiv:2407.19078,Practical Marketplace Optimization at Uber Using Causally-Informed Machine Learning,使用因果信息机器学习在优步进行实际市场优化,"Bobby Chen, Siyu Chen, Jason Dowlatabadi, Yu Xuan Hong, Vinayak Iyer, Uday Mantripragada, Rishabh Narang, Apoorv Pandey, Zijun Qin, Abrar Sheikh, Hongtao Sun, Jiaqi Sun, Matthew Walker, Kaichen Wei, Chen Xu, Jingnan Yang, Allen T. Zhang, Guoqing Zhang",https://arxiv.org/pdf/2407.19078.pdf,"Subjects:
Machine Learning (cs.LG); Machine Learning (stat.ML)","Machine Learning (cs.LG),  Machine Learning (stat.ML)"
532,arXiv:2407.19077,Flexible graph convolutional network for 3D human pose estimation,用于三维人体姿态估计的柔性图卷积网络,"Abu Taib Mohammed Shahjahan, A. Ben Hamza",https://arxiv.org/pdf/2407.19077.pdf,"Subjects:
Computer Vision and Pattern Recognition (cs.CV)",Computer Vision and Pattern Recognition (cs.CV)
533,arXiv:2407.19074,Parsimonious Universal Function Approximator for Elastic and Elasto-Plastic Cavity Expansion Problems,弹性和弹塑性空腔膨胀问题的解析通用函数逼近器,"Xiao-Xuan Chen, Pin Zhang, Hai-Sui Yu, Zhen-Yu Yin, Brian Sheil",https://arxiv.org/pdf/2407.19074.pdf,"Subjects:
Computational Engineering, Finance, and Science (cs.CE); Machine Learning (cs.LG)","Computational Engineering, Finance, and Science (cs.CE),  Machine Learning (cs.LG)"
534,arXiv:2407.19072,Configural processing as an optimized strategy for robust object recognition in neural networks,配置处理作为神经网络中鲁棒目标识别的优化策略,"Hojin Jang, Pawan Sinha, Xavier Boix",https://arxiv.org/pdf/2407.19072.pdf,"Subjects:
Computer Vision and Pattern Recognition (cs.CV); Artificial Intelligence (cs.AI)","Computer Vision and Pattern Recognition (cs.CV),  Artificial Intelligence (cs.AI)"
535,arXiv:2407.19071,Addressing Behavior Model Inaccuracies for Safe Motion Control in Uncertain Dynamic Environments,解决不确定动态环境下安全运动控制的行为模型不准确问题,"Minjun Sung, Hunmin Kim, Naira Hovakimyan",https://arxiv.org/pdf/2407.19071.pdf,"Subjects:
Robotics (cs.RO); Systems and Control (eess.SY)","Robotics (cs.RO),  Systems and Control (eess.SY)"
536,arXiv:2407.19070,Les leaders facilitent-ils l'appropriation des syst{\`e}mes d'information collaboratifs dans les {\'e}quipes ?,这些领导人是否有助于将信息协作系统用于装备？,"Thomas Stenger (CEREGE (Poitiers, La Rochelle)), Pierre Laniray (CEREGE (Poitiers, La Rochelle)), Laurent Chevalier (CEREGE (Poitiers, La Rochelle))",https://arxiv.org/pdf/2407.19070.pdf,"Subjects:
Human-Computer Interaction (cs.HC)",Human-Computer Interaction (cs.HC)
537,arXiv:2407.19065,A Recipe for Success? Exploring Strategies for Improving Non-Visual Access to Cooking Instructions,成功的秘诀？探索改善烹饪说明非视觉访问的策略,"Franklin Mingzhe Li, Ashley Wang, Patrick Carrington, Shaun K. Kane",https://arxiv.org/pdf/2407.19065.pdf,"Subjects:
Human-Computer Interaction (cs.HC)",Human-Computer Interaction (cs.HC)
538,arXiv:2407.19056,OfficeBench: Benchmarking Language Agents across Multiple Applications for Office Automation,OfficeBench：跨多个应用程序对语言代理进行基准测试，以实现办公自动化,"Zilong Wang, Yuedong Cui, Li Zhong, Zimin Zhang, Da Yin, Bill Yuchen Lin, Jingbo Shang",https://arxiv.org/pdf/2407.19056.pdf,"Subjects:
Computation and Language (cs.CL)",Computation and Language (cs.CL)
539,arXiv:2407.19055,Effective Large Language Model Debugging with Best-first Tree Search,使用最佳第一树搜索进行有效的大型语言模型调试,"Jialin Song, Jonathan Raiman, Bryan Catanzaro",https://arxiv.org/pdf/2407.19055.pdf,"Subjects:
Software Engineering (cs.SE); Artificial Intelligence (cs.AI); Machine Learning (cs.LG)","Software Engineering (cs.SE),  Artificial Intelligence (cs.AI),  Machine Learning (cs.LG)"
540,arXiv:2407.19053,A Study of Using Multimodal LLMs for Non-Crash Functional Bug Detection in Android Apps,Android应用程序中使用多模态LLM进行非崩溃功能错误检测的研究,"Bangyan Ju, Jin Yang, Tingting Yu, Tamerlan Abdullayev, Yuanyuan Wu, Dingbang Wang, Yu Zhao",https://arxiv.org/pdf/2407.19053.pdf,"Subjects:
Software Engineering (cs.SE)",Software Engineering (cs.SE)
541,arXiv:2407.19051,Towards a Transformer-Based Pre-trained Model for IoT Traffic Classification,基于变压器的物联网流量分类预训练模型,"Bruna Bazaluk, Mosab Hamdan, Mustafa Ghaleb, Mohammed S. M. Gismalla, Flavio S. Correa da Silva, Daniel Macêdo Batista",https://arxiv.org/pdf/2407.19051.pdf,"Subjects:
Networking and Internet Architecture (cs.NI); Artificial Intelligence (cs.AI)","Networking and Internet Architecture (cs.NI),  Artificial Intelligence (cs.AI)"
542,arXiv:2407.19046,Real-time Uncertainty-Aware Motion Planning for Magnetic-based Navigation,基于磁导航的实时不确定性感知运动规划,"Aditya Penumarti, Kristy Waters, Humberto Ramos, Kevin Brink, Jane Shin",https://arxiv.org/pdf/2407.19046.pdf,"Subjects:
Robotics (cs.RO); Systems and Control (eess.SY)","Robotics (cs.RO),  Systems and Control (eess.SY)"
543,arXiv:2407.19044,Advancing Neural Network Performance through Emergence-Promoting Initialization Scheme,通过涌现促进初始化方案提高神经网络性能,"Johnny Jingze Li, Vivek Kurien George, Gabriel A. Silva",https://arxiv.org/pdf/2407.19044.pdf,"Subjects:
Machine Learning (cs.LG); Computer Vision and Pattern Recognition (cs.CV)","Machine Learning (cs.LG),  Computer Vision and Pattern Recognition (cs.CV)"
544,arXiv:2407.19041,Optimizing Numerical Estimation and Operational Efficiency in the Legal Domain through Large Language Models,通过大型语言模型优化法律领域的数值估计和运算效率,"Jia-Hong Huang, Chao-Chun Yang, Yixian Shen, Alessio M. Pacces, Evangelos Kanoulas",https://arxiv.org/pdf/2407.19041.pdf,"Subjects:
Artificial Intelligence (cs.AI); Computation and Language (cs.CL)","Artificial Intelligence (cs.AI),  Computation and Language (cs.CL)"
545,arXiv:2407.19040,A Fault Prognostic System for the Turbine Guide Bearings of a Hydropower Plant Using Long-Short Term Memory (LSTM),基于长短期记忆（LSTM）的水电站水轮机导轴承故障预测系统,"Yasir Saleem Afridi, Mian Ibad Ali Shah, Adnan Khan, Atia Kareem, Laiq Hasan",https://arxiv.org/pdf/2407.19040.pdf,"Subjects:
Artificial Intelligence (cs.AI); Systems and Control (eess.SY)","Artificial Intelligence (cs.AI),  Systems and Control (eess.SY)"
546,arXiv:2407.19039,GraphBPE: Molecular Graphs Meet Byte-Pair Encoding,GraphBPE：分子图符合字节对编码,"Yuchen Shen, Barnabás Póczos",https://arxiv.org/pdf/2407.19039.pdf,"Subjects:
Machine Learning (cs.LG); Artificial Intelligence (cs.AI); Chemical Physics (physics.chem-ph); Biomolecules (q-bio.BM)","Machine Learning (cs.LG),  Artificial Intelligence (cs.AI),  Chemical Physics (physics.chem-ph),  Biomolecules (q-bio.BM)"
547,arXiv:2407.19035,ScalingGaussian: Enhancing 3D Content Creation with Generative Gaussian Splatting,ScalingGaussian：通过生成高斯散布增强3D内容创建,"Shen Chen, Jiale Zhou, Zhongyu Jiang, Tianfang Zhang, Zongkai Wu, Jenq-Neng Hwang, Lei Li",https://arxiv.org/pdf/2407.19035.pdf,"Subjects:
Computer Vision and Pattern Recognition (cs.CV)",Computer Vision and Pattern Recognition (cs.CV)
548,arXiv:2407.19034,MangaUB: A Manga Understanding Benchmark for Large Multimodal Models,MangaUB：大型多模态模型的漫画理解基准,"Hikaru Ikuta, Leslie Wöhler, Kiyoharu Aizawa",https://arxiv.org/pdf/2407.19034.pdf,"Subjects:
Computer Vision and Pattern Recognition (cs.CV); Multimedia (cs.MM)","Computer Vision and Pattern Recognition (cs.CV),  Multimedia (cs.MM)"
549,arXiv:2407.19031,Artificial neural networks on graded vector spaces,梯度向量空间上的人工神经网络,T. Shaska,https://arxiv.org/pdf/2407.19031.pdf,"Subjects:
Artificial Intelligence (cs.AI)",Artificial Intelligence (cs.AI)
550,arXiv:2407.19025,Adaptive Target Tracking Using Retrospective Cost Input Estimation,基于回溯成本输入估计的自适应目标跟踪,"Shashank Verma, Sneha Sanjeevini, E. Dogan Sumer, Dennis S. Bernstein",https://arxiv.org/pdf/2407.19025.pdf,"Subjects:
Systems and Control (eess.SY)",Systems and Control (eess.SY)
551,arXiv:2407.19014,Sparse Refinement for Efficient High-Resolution Semantic Segmentation,稀疏细化实现高效高分辨率语义分割,"Zhijian Liu, Zhuoyang Zhang, Samir Khaki, Shang Yang, Haotian Tang, Chenfeng Xu, Kurt Keutzer, Song Han",https://arxiv.org/pdf/2407.19014.pdf,"Subjects:
Computer Vision and Pattern Recognition (cs.CV)",Computer Vision and Pattern Recognition (cs.CV)
552,arXiv:2407.19001,PromptCCD: Learning Gaussian Mixture Prompt Pool for Continual Category Discovery,PromptCCD：用于连续类别发现的高斯混合学习提示池,"Fernando Julio Cendra, Bingchen Zhao, Kai Han",https://arxiv.org/pdf/2407.19001.pdf,"Subjects:
Computer Vision and Pattern Recognition (cs.CV)",Computer Vision and Pattern Recognition (cs.CV)
553,arXiv:2407.18999,Graph-based Unsupervised Disentangled Representation Learning via Multimodal Large Language Models,基于图的多模态大语言模型无监督解耦表示学习,"Baao Xie, Qiuyu Chen, Yunnan Wang, Zequn Zhang, Xin Jin, Wenjun Zeng",https://arxiv.org/pdf/2407.18999.pdf,"Subjects:
Computer Vision and Pattern Recognition (cs.CV); Machine Learning (cs.LG)","Computer Vision and Pattern Recognition (cs.CV),  Machine Learning (cs.LG)"
554,arXiv:2407.18998,Towards a Cyber Information Ontology,迈向网络信息本体论,"David Limbaugh, Mark Jensen, John Beverley",https://arxiv.org/pdf/2407.18998.pdf,"Subjects:
Artificial Intelligence (cs.AI)",Artificial Intelligence (cs.AI)
555,arXiv:2407.18996,A maturity framework for data driven maintenance,数据驱动维护的成熟度框架,"Chris Rijsdijk, Mike van de Wijnckel, Tiedo Tinga",https://arxiv.org/pdf/2407.18996.pdf,"Subjects:
Artificial Intelligence (cs.AI); Machine Learning (cs.LG); Systems and Control (eess.SY)","Artificial Intelligence (cs.AI),  Machine Learning (cs.LG),  Systems and Control (eess.SY)"
556,arXiv:2407.18995,SWIFT: Semantic Watermarking for Image Forgery Thwarting,SWIFT：用于防止图像伪造的语义水印技术,"Gautier Evennou, Vivien Chappelier, Ewa Kijak, Teddy Furon",https://arxiv.org/pdf/2407.18995.pdf,"Subjects:
Cryptography and Security (cs.CR); Artificial Intelligence (cs.AI); Computer Vision and Pattern Recognition (cs.CV); Multimedia (cs.MM)","Cryptography and Security (cs.CR),  Artificial Intelligence (cs.AI),  Computer Vision and Pattern Recognition (cs.CV),  Multimedia (cs.MM)"
557,arXiv:2407.18994,Online Test Synthesis From Requirements: Enhancing Reinforcement Learning with Game Theory,基于需求的在线测试综合：用博弈论加强强化学习,"Ocan Sankur (DEVINE, UR), Thierry Jéron (DEVINE, UR), Nicolas Markey (DEVINE, UR), David Mentré (MERCE-France), Reiya Noguchi",https://arxiv.org/pdf/2407.18994.pdf,"Subjects:
Artificial Intelligence (cs.AI); Computer Science and Game Theory (cs.GT); Machine Learning (cs.LG)","Artificial Intelligence (cs.AI),  Computer Science and Game Theory (cs.GT),  Machine Learning (cs.LG)"
558,arXiv:2407.18992,Towards Automated Solution Recipe Generation for Industrial Asset Management with LLM,利用LLM实现工业资产管理解决方案配方的自动化生成,"Nianjun Zhou, Dhaval Patel, Shuxin Lin, Fearghal O'Donncha",https://arxiv.org/pdf/2407.18992.pdf,"Subjects:
Artificial Intelligence (cs.AI)",Artificial Intelligence (cs.AI)
559,arXiv:2407.18990,Stay Tuned: An Empirical Study of the Impact of Hyperparameters on LLM Tuning in Real-World Applications,保持调谐：超参数对实际应用中LLM调谐影响的实证研究,"Alon Halfon, Shai Gretz, Ofir Arviv, Artem Spector, Orith Toledo-Ronen, Yoav Katz, Liat Ein-Dor, Michal Shmueli-Scheuer, Noam Slonim",https://arxiv.org/pdf/2407.18990.pdf,"Subjects:
Machine Learning (cs.LG); Artificial Intelligence (cs.AI); Computation and Language (cs.CL)","Machine Learning (cs.LG),  Artificial Intelligence (cs.AI),  Computation and Language (cs.CL)"
560,arXiv:2407.18989,Machine Learning for Equitable Load Shedding: Real-time Solution via Learning Binding Constraints,公平减载的机器学习：通过学习绑定约束的实时解决方案,"Yuqi Zhou, Joseph Severino, Sanjana Vijayshankar, Juliette Ugirumurera, Jibo Sanyal",https://arxiv.org/pdf/2407.18989.pdf,"Subjects:
Systems and Control (eess.SY); Artificial Intelligence (cs.AI)","Systems and Control (eess.SY),  Artificial Intelligence (cs.AI)"
561,arXiv:2407.18987,State estimation for a class of nonlinear time-varying uncertain system under multiharmonic disturbance,一类非线性时变不确定系统在多谐扰动下的状态估计,"Alexey A. Margun, Van H. Bui, Alexey A. Bobtsov, Denis V. Efimov",https://arxiv.org/pdf/2407.18987.pdf,"Subjects:
Systems and Control (eess.SY)",Systems and Control (eess.SY)
562,arXiv:2407.18986,TERIME: An improved RIME algorithm with enhanced exploration and exploitation for robust parameter extraction of photovoltaic models,TERIME：一种改进的RIME算法，对光伏模型的鲁棒参数提取进行了增强的探索和开发,"Shi-Shun Chen, Yu-Tong Jiang, Wen-Bin Chen, Xiao-Yang Li",https://arxiv.org/pdf/2407.18986.pdf,"Subjects:
Systems and Control (eess.SY)",Systems and Control (eess.SY)
563,arXiv:2407.18985,Implementation and Applications of WakeWords Integrated with Speaker Recognition: A Case Study,WakewWords与说话人识别集成的实现与应用：案例研究,"Alexandre Costa Ferro Filho, Elisa Ayumi Masasi de Oliveira, Iago Alves Brito, Pedro Martins Bittencourt",https://arxiv.org/pdf/2407.18985.pdf,"Subjects:
Sound (cs.SD); Audio and Speech Processing (eess.AS)","Sound (cs.SD),  Audio and Speech Processing (eess.AS)"
564,arXiv:2407.18982,Low-Latency Privacy-Preserving Deep Learning Design via Secure MPC,通过安全MPC实现低延迟隐私保护的深度学习设计,"Ke Lin, Yasir Glani, Ping Luo",https://arxiv.org/pdf/2407.18982.pdf,"Subjects:
Cryptography and Security (cs.CR); Artificial Intelligence (cs.AI); Distributed, Parallel, and Cluster Computing (cs.DC); Machine Learning (cs.LG)","Cryptography and Security (cs.CR),  Artificial Intelligence (cs.AI),  Distributed, Parallel, and Cluster Computing (cs.DC),  Machine Learning (cs.LG)"
565,arXiv:2407.18981,Prompt Injection Attacks on Large Language Models in Oncology,肿瘤学中大型语言模型的快速注射攻击,"Jan Clusmann, Dyke Ferber, Isabella C. Wiest, Carolin V. Schneider, Titus J. Brinker, Sebastian Foersch, Daniel Truhn, Jakob N. Kather",https://arxiv.org/pdf/2407.18981.pdf,"Subjects:
Cryptography and Security (cs.CR); Artificial Intelligence (cs.AI)","Cryptography and Security (cs.CR),  Artificial Intelligence (cs.AI)"
566,arXiv:2407.18977,Industrial Practices of Requirements Engineering for ML-Enabled Systems in Brazil,巴西ML系统需求工程的工业实践,"Antonio Pedro Santos Alves, Marcos Kalinowski, Daniel Mendez, Hugo Villamizar, Kelly Azevedo, Tatiana Escovedo, Helio Lopes",https://arxiv.org/pdf/2407.18977.pdf,"Subjects:
Software Engineering (cs.SE)",Software Engineering (cs.SE)
567,arXiv:2407.18970,Region Guided Attention Network for Retinal Vessel Segmentation,视网膜血管分割的区域引导注意力网络,"Syed Javed, Tariq M. Khan, Abdul Qayyum, Arcot Sowmya, Imran Razzak",https://arxiv.org/pdf/2407.18970.pdf,"Subjects:
Computer Vision and Pattern Recognition (cs.CV)",Computer Vision and Pattern Recognition (cs.CV)
568,arXiv:2407.18968,Intelligence Analysis of Language Models,语言模型的智能分析,"Liane Galanti, Ethan Baron",https://arxiv.org/pdf/2407.18968.pdf,"Subjects:
Artificial Intelligence (cs.AI)",Artificial Intelligence (cs.AI)
569,arXiv:2407.18966,Towards A Post-Quantum Cryptography in Blockchain I: Basic Review on Theoretical Cryptography and Quantum Information Theory,迈向区块链中的后量子密码学I：理论密码学和量子信息理论的基本回顾,Tatsuru Kikuchi,https://arxiv.org/pdf/2407.18966.pdf,"Subjects:
Cryptography and Security (cs.CR); Computational Finance (q-fin.CP)","Cryptography and Security (cs.CR),  Computational Finance (q-fin.CP)"
570,arXiv:2407.18965,Generative AI Augmented Induction-based Formal Verification,基于生成人工智能增强归纳的形式化验证,"Aman Kumar, Deepak Narayan Gadde",https://arxiv.org/pdf/2407.18965.pdf,"Subjects:
Artificial Intelligence (cs.AI)",Artificial Intelligence (cs.AI)
571,arXiv:2407.18963,Investigation of discontinuous Galerkin methods in adjoint gradient-based aerodynamic shape optimization,基于伴随梯度的气动形状优化中间断伽辽金方法的研究,"Yiwei Feng, Lili Lv, Tiegang Liu, Kun Wang, Bangcheng Ai",https://arxiv.org/pdf/2407.18963.pdf,"Subjects:
Numerical Analysis (math.NA); Optimization and Control (math.OC)","Numerical Analysis (math.NA),  Optimization and Control (math.OC)"
572,arXiv:2407.18962,Autonomous Navigation of Unmanned Vehicle Through Deep Reinforcement Learning,通过深度强化学习实现无人驾驶车辆的自主导航,"Letian Xu, Jiabei Liu, Haopeng Zhao, Tianyao Zheng, Tongzhou Jiang, Lipeng Liu",https://arxiv.org/pdf/2407.18962.pdf,"Subjects:
Robotics (cs.RO); Machine Learning (cs.LG)","Robotics (cs.RO),  Machine Learning (cs.LG)"
573,arXiv:2407.18961,MMAU: A Holistic Benchmark of Agent Capabilities Across Diverse Domains,MMAU：跨不同领域的代理能力的整体基准,"Guoli Yin, Haoping Bai, Shuang Ma, Feng Nan, Yanchao Sun, Zhaoyang Xu, Shen Ma, Jiarui Lu, Xiang Kong, Aonan Zhang, Dian Ang Yap, Yizhe zhang, Karsten Ahnert, Vik Kamath, Mathias Berglund, Dominic Walsh, Tobias Gindele, Juergen Wiest, Zhengfeng Lai, Xiaoming Wang, Jiulong Shan, Meng Cao, Ruoming Pang, Zirui Wang",https://arxiv.org/pdf/2407.18961.pdf,"Subjects:
Artificial Intelligence (cs.AI)",Artificial Intelligence (cs.AI)
574,arXiv:2407.18956,MIOV: Reordering MOVI for even better locality,MIOV：重新排序MOVI以获得更好的位置,"Peter Perešíni, Nathaniel K. Brown, Travis Gagie, Ben Langmead",https://arxiv.org/pdf/2407.18956.pdf,"Subjects:
Data Structures and Algorithms (cs.DS)",Data Structures and Algorithms (cs.DS)
575,arXiv:2407.18955,Real Face Video Animation Platform,真实人脸视频动画平台,"Xiaokai Chen, Xuan Liu, Donglin Di, Yongjia Ma, Wei Chen, Tonghua Su",https://arxiv.org/pdf/2407.18955.pdf,"Subjects:
Computer Vision and Pattern Recognition (cs.CV)",Computer Vision and Pattern Recognition (cs.CV)
576,arXiv:2407.18953,Evaluating Front-end & Back-end of Human Automation Interaction Applications A Hypothetical Benchmark,评估人机交互应用程序的前端和后端——一个假设基准,Gonçalo Hora de Carvalho,https://arxiv.org/pdf/2407.18953.pdf,"Subjects:
Human-Computer Interaction (cs.HC)",Human-Computer Interaction (cs.HC)
