Unnamed: 0,id,title,title_zh,authors,url,subjects,subject_split
1001,arXiv:2407.18287,Estimating the number of clusters of a Block Markov Chain,块马尔可夫链簇数的估计,"Thomas van Vuren, Thomas Cronk, Jaron Sanders",https://arxiv.org/pdf/2407.18287.pdf,"Subjects:
Machine Learning (stat.ML); Machine Learning (cs.LG); Probability (math.PR)","Machine Learning (stat.ML),  Machine Learning (cs.LG),  Probability (math.PR)"
1002,arXiv:2407.18251,Sparse vs Contiguous Adversarial Pixel Perturbations in Multimodal Models: An Empirical Analysis,多模态模型中稀疏与连续对抗像素扰动的实证分析,"Cristian-Alexandru Botocan, Raphael Meier, Ljiljana Dolamic",https://arxiv.org/pdf/2407.18251.pdf,"Subjects:
Computer Vision and Pattern Recognition (cs.CV); Cryptography and Security (cs.CR); Machine Learning (cs.LG)","Computer Vision and Pattern Recognition (cs.CV),  Cryptography and Security (cs.CR),  Machine Learning (cs.LG)"
1003,arXiv:2407.18249,Trajectory-aligned Space-time Tokens for Few-shot Action Recognition,用于少镜头动作识别的轨迹对齐时空标记,"Pulkit Kumar, Namitha Padmanabhan, Luke Luo, Sai Saketh Rambhatla, Abhinav Shrivastava",https://arxiv.org/pdf/2407.18249.pdf,"Subjects:
Computer Vision and Pattern Recognition (cs.CV)",Computer Vision and Pattern Recognition (cs.CV)
1004,arXiv:2407.18248,Self-Training with Direct Preference Optimization Improves Chain-of-Thought Reasoning,直接偏好优化的自我训练改善了思维推理链,"Tianduo Wang, Shichen Li, Wei Lu",https://arxiv.org/pdf/2407.18248.pdf,"Subjects:
Computation and Language (cs.CL)",Computation and Language (cs.CL)
1005,arXiv:2407.18247,RegionDrag: Fast Region-Based Image Editing with Diffusion Models,RegionDrag：基于扩散模型的快速区域图像编辑,"Jingyi Lu, Xinghui Li, Kai Han",https://arxiv.org/pdf/2407.18247.pdf,"Subjects:
Computer Vision and Pattern Recognition (cs.CV)",Computer Vision and Pattern Recognition (cs.CV)
1006,arXiv:2407.18245,VGGHeads: A Large-Scale Synthetic Dataset for 3D Human Heads,VGGHeads:3D人体头部的大规模合成数据集,"Orest Kupyn, Eugene Khvedchenia, Christian Rupprecht",https://arxiv.org/pdf/2407.18245.pdf,"Subjects:
Computer Vision and Pattern Recognition (cs.CV); Machine Learning (cs.LG)","Computer Vision and Pattern Recognition (cs.CV),  Machine Learning (cs.LG)"
1007,arXiv:2407.18244,RefMask3D: Language-Guided Transformer for 3D Referring Segmentation,RefMask3D：用于3D参考分割的语言引导转换器,"Shuting He, Henghui Ding",https://arxiv.org/pdf/2407.18244.pdf,"Subjects:
Computer Vision and Pattern Recognition (cs.CV)",Computer Vision and Pattern Recognition (cs.CV)
1008,arXiv:2407.18243,BIV-Priv-Seg: Locating Private Content in Images Taken by People With Visual Impairments,BIV Priv Seg：在视障人士拍摄的图像中定位私人内容,"Yu-Yun Tseng, Tanusree Sharma, Lotus Zhang, Abigale Stangl, Leah Findlater, Yang Wang, Danna Gurari Yu-Yun Tseng, Tanusree Sharma, Lotus Zhang, Abigale Stangl, Leah Findlater, Yang Wang, Danna Gurari",https://arxiv.org/pdf/2407.18243.pdf,"Subjects:
Computer Vision and Pattern Recognition (cs.CV)",Computer Vision and Pattern Recognition (cs.CV)
1009,arXiv:2407.18242,LoRA-Pro: Are Low-Rank Adapters Properly Optimized?,LoRA Pro：低秩适配器是否经过适当优化？,"Zhengbo Wang, Jian Liang",https://arxiv.org/pdf/2407.18242.pdf,"Subjects:
Machine Learning (cs.LG); Artificial Intelligence (cs.AI); Computation and Language (cs.CL)","Machine Learning (cs.LG),  Artificial Intelligence (cs.AI),  Computation and Language (cs.CL)"
1010,arXiv:2407.18241,Numerical Literals in Link Prediction: A Critical Examination of Models and Datasets,链接预测中的数值文字：模型和数据集的批判性检验,"Moritz Blum, Basil Ell, Hannes Ill, Philipp Cimiano",https://arxiv.org/pdf/2407.18241.pdf,"Subjects:
Machine Learning (cs.LG); Databases (cs.DB)","Machine Learning (cs.LG),  Databases (cs.DB)"
1011,arXiv:2407.18240,CodedVO: Coded Visual Odometry,CodedVO：编码视觉测臭,"Sachin Shah, Naitri Rajyaguru, Chahat Deep Singh, Christopher Metzler, Yiannis Aloimonos",https://arxiv.org/pdf/2407.18240.pdf,"Subjects:
Robotics (cs.RO); Computer Vision and Pattern Recognition (cs.CV)","Robotics (cs.RO),  Computer Vision and Pattern Recognition (cs.CV)"
1012,arXiv:2407.18232,LION: Linear Group RNN for 3D Object Detection in Point Clouds,LION:用于点云中三维目标检测的线性群RNN,"Zhe Liu, Jinghua Hou, Xinyu Wang, Xiaoqing Ye, Jingdong Wang, Hengshuang Zhao, Xiang Bai",https://arxiv.org/pdf/2407.18232.pdf,"Subjects:
Computer Vision and Pattern Recognition (cs.CV)",Computer Vision and Pattern Recognition (cs.CV)
1013,arXiv:2407.18228,"Parameterized Algorithms on Integer Sets with Small Doubling: Integer Programming, Subset Sum and k-SUM",小倍数整数集的参数化算法：整数规划、子集求和和和k-Sum,"Tim Randolph, Karol Węgrzycki",https://arxiv.org/pdf/2407.18228.pdf,"Subjects:
Data Structures and Algorithms (cs.DS)",Data Structures and Algorithms (cs.DS)
1014,arXiv:2407.18227,Automated Ensemble Multimodal Machine Learning for Healthcare,医疗保健领域的自动化集成多模态机器学习,"Fergus Imrie, Stefan Denner, Lucas S. Brunschwig, Klaus Maier-Hein, Mihaela van der Schaar",https://arxiv.org/pdf/2407.18227.pdf,"Subjects:
Machine Learning (cs.LG)",Machine Learning (cs.LG)
1015,arXiv:2407.18220,Detecting and explaining (in)equivalence of context-free grammars,检测和解释上下文无关语法的等价性,"Marko Schmellenkamp, Thomas Zeume, Sven Argo, Sandra Kiefer, Cedric Siems, Fynn Stebel",https://arxiv.org/pdf/2407.18220.pdf,"Subjects:
Formal Languages and Automata Theory (cs.FL); Computers and Society (cs.CY); Programming Languages (cs.PL)","Formal Languages and Automata Theory (cs.FL),  Computers and Society (cs.CY),  Programming Languages (cs.PL)"
1016,arXiv:2407.18219,Recursive Introspection: Teaching Language Model Agents How to Self-Improve,递归反思：教授语言模型代理如何自我提升,"Yuxiao Qu, Tianjun Zhang, Naman Garg, Aviral Kumar",https://arxiv.org/pdf/2407.18219.pdf,"Subjects:
Machine Learning (cs.LG); Artificial Intelligence (cs.AI); Computation and Language (cs.CL)","Machine Learning (cs.LG),  Artificial Intelligence (cs.AI),  Computation and Language (cs.CL)"
1017,arXiv:2407.18218,An NKCS Model of Bookchins Communalism,Bookchins公社主义的NKCS模型,Larry Bull,https://arxiv.org/pdf/2407.18218.pdf,"Subjects:
Neural and Evolutionary Computing (cs.NE)",Neural and Evolutionary Computing (cs.NE)
1018,arXiv:2407.18216,Fast computation of the period and of the shortest cover of a string using its Character-Distance-Sampling representation,利用字符距离采样表示法快速计算字符串的周期和最短覆盖,"Thierry Lecroq, Francesco Pio Marino",https://arxiv.org/pdf/2407.18216.pdf,"Subjects:
Data Structures and Algorithms (cs.DS)",Data Structures and Algorithms (cs.DS)
1019,arXiv:2407.18215,Tool-Assisted Learning of Computational Reductions,计算约简的工具辅助学习,"Tristan Kneisel, Elias Radtke, Marko Schmellenkamp, Fabian Vehlken, Thomas Zeume",https://arxiv.org/pdf/2407.18215.pdf,"Subjects:
Computers and Society (cs.CY); Human-Computer Interaction (cs.HC)","Computers and Society (cs.CY),  Human-Computer Interaction (cs.HC)"
1020,arXiv:2407.18213,Exploring Scaling Trends in LLM Robustness,探索LLM稳健性的扩展趋势,"Nikolaus Howe, Michał Zajac, Ian McKenzie, Oskar Hollinsworth, Tom Tseng, Pierre-Luc Bacon, Adam Gleave",https://arxiv.org/pdf/2407.18213.pdf,"Subjects:
Machine Learning (cs.LG); Artificial Intelligence (cs.AI); Computation and Language (cs.CL); Cryptography and Security (cs.CR)","Machine Learning (cs.LG),  Artificial Intelligence (cs.AI),  Computation and Language (cs.CL),  Cryptography and Security (cs.CR)"
1021,arXiv:2407.18209,SuperFlow: A Fully-Customized RTL-to-GDS Design Automation Flow for Adiabatic Quantum-Flux-Parametron Superconducting Circuits,SuperFlow：绝热量子通量参数化超导电路的完全定制RTL到GDS设计自动化流程,"Yanyue Xie, Peiyan Dong, Geng Yuan, Zhengang Li, Masoud Zabihi, Chao Wu, Sung-En Chang, Xufeng Zhang, Xue Lin, Caiwen Ding, Nobuyuki Yoshikawa, Olivia Chen, Yanzhi Wang",https://arxiv.org/pdf/2407.18209.pdf,"Subjects:
Emerging Technologies (cs.ET); Hardware Architecture (cs.AR)","Emerging Technologies (cs.ET),  Hardware Architecture (cs.AR)"
1022,arXiv:2407.18207,Geometry Fidelity for Spherical Images,球面图像的几何保真度,"Anders Christensen, Nooshin Mojab, Khushman Patel, Karan Ahuja, Zeynep Akata, Ole Winther, Mar Gonzalez-Franco, Andrea Colaco",https://arxiv.org/pdf/2407.18207.pdf,"Subjects:
Computer Vision and Pattern Recognition (cs.CV); Machine Learning (cs.LG)","Computer Vision and Pattern Recognition (cs.CV),  Machine Learning (cs.LG)"
1023,arXiv:2407.18201,"Semi-Classical Subspaces, The No Synchronization Law, and More",半经典子空间、无同步定律等,Samuel Epstein,https://arxiv.org/pdf/2407.18201.pdf,"Subjects:
Computational Complexity (cs.CC); Quantum Physics (quant-ph)","Computational Complexity (cs.CC),  Quantum Physics (quant-ph)"
1024,arXiv:2407.18200,Sparse Incremental Aggregation in Multi-Hop Federated Learning,多跳联合学习中的稀疏增量聚合,"Sourav Mukherjee, Nasrin Razmi, Armin Dekorsy, Petar Popovski, Bho Matthiesen",https://arxiv.org/pdf/2407.18200.pdf,"Subjects:
Distributed, Parallel, and Cluster Computing (cs.DC); Machine Learning (cs.LG); Signal Processing (eess.SP)","Distributed, Parallel, and Cluster Computing (cs.DC),  Machine Learning (cs.LG),  Signal Processing (eess.SP)"
1025,arXiv:2407.18184,AsEP: Benchmarking Deep Learning Methods for Antibody-specific Epitope Prediction,AsEP：用于抗体特异性表位预测的深度学习基准方法,"Chunan Liu, Lilian Denzler, Yihong Chen, Andrew Martin, Brooks Paige",https://arxiv.org/pdf/2407.18184.pdf,"Subjects:
Machine Learning (cs.LG)",Machine Learning (cs.LG)
1026,arXiv:2407.18183,Signaling Rate and Performance of RIS Reconfiguration and Handover Management in Next Generation Mobile Networks,下一代移动网络中RIS重构和切换管理的信令速率和性能,"Mounir Bensalem, Admela Jukan",https://arxiv.org/pdf/2407.18183.pdf,"Subjects:
Networking and Internet Architecture (cs.NI)",Networking and Internet Architecture (cs.NI)
1027,arXiv:2407.18181,Gene Regulatory Network Inference from Pre-trained Single-Cell Transcriptomics Transformer with Joint Graph Learning,基于联合图学习的预训练单细胞转录组变换器的基因调控网络推理,"Sindhura Kommu, Yizhi Wang, Yue Wang, Xuan Wang",https://arxiv.org/pdf/2407.18181.pdf,"Subjects:
Machine Learning (cs.LG); Artificial Intelligence (cs.AI)","Machine Learning (cs.LG),  Artificial Intelligence (cs.AI)"
1028,arXiv:2407.18178,"PianoMime: Learning a Generalist, Dexterous Piano Player from Internet Demonstrations",皮亚诺米姆：从网络演示中学习一位全能、灵巧的钢琴演奏家,"Cheng Qian, Julen Urain, Kevin Zakka, Jan Peters",https://arxiv.org/pdf/2407.18178.pdf,"Subjects:
Computer Vision and Pattern Recognition (cs.CV); Artificial Intelligence (cs.AI); Robotics (cs.RO)","Computer Vision and Pattern Recognition (cs.CV),  Artificial Intelligence (cs.AI),  Robotics (cs.RO)"
1029,arXiv:2407.18175,Quasar-ViT: Hardware-Oriented Quantization-Aware Architecture Search for Vision Transformers,Quasar ViT：面向硬件的量化感知架构视觉变换器搜索,"Zhengang Li, Alec Lu, Yanyue Xie, Zhenglun Kong, Mengshu Sun, Hao Tang, Zhong Jia Xue, Peiyan Dong, Caiwen Ding, Yanzhi Wang, Xue Lin, Zhenman Fang",https://arxiv.org/pdf/2407.18175.pdf,"Subjects:
Machine Learning (cs.LG); Artificial Intelligence (cs.AI); Computer Vision and Pattern Recognition (cs.CV)","Machine Learning (cs.LG),  Artificial Intelligence (cs.AI),  Computer Vision and Pattern Recognition (cs.CV)"
1030,arXiv:2407.18170,RIDA: A Robust Attack Framework on Incomplete Graphs,RIDA：一种针对不完全图的鲁棒攻击框架,"Jianke Yu, Hanchen Wang, Chen Chen, Xiaoyang Wang, Wenjie Zhang, Ying Zhang",https://arxiv.org/pdf/2407.18170.pdf,"Subjects:
Machine Learning (cs.LG)",Machine Learning (cs.LG)
1031,arXiv:2407.18169,In Search of Metrics to Guide Developer-Based Refactoring Recommendations,寻找指标来指导基于开发人员的重构建议,"Mikel Robredo, Matteo Esposito, Fabio Palomba, Rafael Peñaloza, Valentina Lenarduzzi",https://arxiv.org/pdf/2407.18169.pdf,"Subjects:
Software Engineering (cs.SE)",Software Engineering (cs.SE)
1032,arXiv:2407.18159,Optimal Assignment and Motion Control in Two-Class Continuum Swarms,两类连续群最优分配与运动控制,"Max Emerick, Stacy Patterson, Bassam Bamieh",https://arxiv.org/pdf/2407.18159.pdf,"Subjects:
Systems and Control (eess.SY); Optimization and Control (math.OC)","Systems and Control (eess.SY),  Optimization and Control (math.OC)"
1033,arXiv:2407.18157,Enhanced Privacy Bound for Shuffle Model with Personalized Privacy,具有个性化隐私的Shuffle模型的增强隐私约束,"Yixuan Liu, Yuhan Liu, Li Xiong, Yujie Gu, Hong Chen",https://arxiv.org/pdf/2407.18157.pdf,"Subjects:
Cryptography and Security (cs.CR); Databases (cs.DB)","Cryptography and Security (cs.CR),  Databases (cs.DB)"
1034,arXiv:2407.18155,Test2VA: Reusing GUI Test Cases for Voice Assistant Features Development in Mobile Applications,Test2VA：在移动应用程序中重用GUI测试用例进行语音助手功能开发,"Garrett Weaver, Xue Qin",https://arxiv.org/pdf/2407.18155.pdf,"Subjects:
Software Engineering (cs.SE)",Software Engineering (cs.SE)
1035,arXiv:2407.18154,Identification of a time-varying SIR Model for Covid-19,新冠肺炎时变SIR模型的识别,"Walter HMendes aselein, Diego Eckhard",https://arxiv.org/pdf/2407.18154.pdf,"Subjects:
Systems and Control (eess.SY); Physics and Society (physics.soc-ph); Populations and Evolution (q-bio.PE)","Systems and Control (eess.SY),  Physics and Society (physics.soc-ph),  Populations and Evolution (q-bio.PE)"
1036,arXiv:2407.18148,StraightLine: An End-to-End Resource-Aware Scheduler for Machine Learning Application Requests,StraightLine：用于机器学习应用程序请求的端到端资源感知调度器,"Cheng-Wei Ching, Boyuan Guan, Hailu Xu, Liting Hu",https://arxiv.org/pdf/2407.18148.pdf,"Subjects:
Distributed, Parallel, and Cluster Computing (cs.DC); Machine Learning (cs.LG)","Distributed, Parallel, and Cluster Computing (cs.DC),  Machine Learning (cs.LG)"
1037,arXiv:2407.18147,The FIGNEWS Shared Task on News Media Narratives,FIGNEWS在新闻媒体叙事中的共同任务,"Wajdi Zaghouani (1), Mustafa Jarrar (2), Nizar Habash (3), Houda Bouamor (4), Imed Zitouni (5), Mona Diab (6), Samhaa R. El-Beltagy (7), Muhammed AbuOdeh (3) ((1) Northwestern University in Qatar, (2) Birzeit University, (3) New York University Abu Dhabi, (4) Carnegie Mellon University Qatar, (5) Google, (6) Carnegie Mellon University, (7) Newgiza University)",https://arxiv.org/pdf/2407.18147.pdf,"Subjects:
Computation and Language (cs.CL)",Computation and Language (cs.CL)
1038,arXiv:2407.18146,Adaptable Deep Joint Source-and-Channel Coding for Small Satellite Applications,适用于小卫星应用的自适应深联合信源和信道编码,"Olga Kondrateva, Stefan Dietzel, Björn Scheuermann",https://arxiv.org/pdf/2407.18146.pdf,"Subjects:
Networking and Internet Architecture (cs.NI)",Networking and Internet Architecture (cs.NI)
1039,arXiv:2407.18145,Taxonomy-Aware Continual Semantic Segmentation in Hyperbolic Spaces for Open-World Perception,开放世界感知的双曲空间分类感知连续语义分割,"Julia Hindel, Daniele Cattaneo, Abhinav Valada",https://arxiv.org/pdf/2407.18145.pdf,"Subjects:
Computer Vision and Pattern Recognition (cs.CV); Artificial Intelligence (cs.AI); Robotics (cs.RO)","Computer Vision and Pattern Recognition (cs.CV),  Artificial Intelligence (cs.AI),  Robotics (cs.RO)"
1040,arXiv:2407.18143,Maximum Entropy On-Policy Actor-Critic via Entropy Advantage Estimation,基于熵优势估计的政策参与者批判的最大熵,"Jean Seong Bjorn Choe, Jong-Kook Kim",https://arxiv.org/pdf/2407.18143.pdf,"Subjects:
Machine Learning (cs.LG); Artificial Intelligence (cs.AI)","Machine Learning (cs.LG),  Artificial Intelligence (cs.AI)"
1041,arXiv:2407.18141,IRIS: Wireless Ring for Vision-based Smart Home Interaction,IRIS：基于视觉的智能家居交互无线环,"Maruchi Kim, Antonio Glenn, Bandhav Veluri, Yunseo Lee, Eyoel Gebre, Aditya Bagaria, Shwetak Patel, Shyamnath Gollakota",https://arxiv.org/pdf/2407.18141.pdf,"Subjects:
Human-Computer Interaction (cs.HC); Emerging Technologies (cs.ET); Machine Learning (cs.LG); Image and Video Processing (eess.IV)","Human-Computer Interaction (cs.HC),  Emerging Technologies (cs.ET),  Machine Learning (cs.LG),  Image and Video Processing (eess.IV)"
1042,arXiv:2407.18140,Influence Vectors Control for Robots Using Cellular-like Binary Actuators,基于细胞型二元执行器的机器人影响向量控制,"Alexandre Girard, Jean-Sébastien Plante",https://arxiv.org/pdf/2407.18140.pdf,"Subjects:
Robotics (cs.RO)",Robotics (cs.RO)
1043,arXiv:2407.18137,XS-VID: An Extremely Small Video Object Detection Dataset,XS-VID：一个极小的视频对象检测数据集,"Jiahao Guo, Ziyang Xu, Lianjun Wu, Fei Gao, Wenyu Liu, Xinggang Wang",https://arxiv.org/pdf/2407.18137.pdf,"Subjects:
Computer Vision and Pattern Recognition (cs.CV)",Computer Vision and Pattern Recognition (cs.CV)
1044,arXiv:2407.18134,$\mathbb{X}$-Sample Contrastive Loss: Improving Contrastive Learning with Sample Similarity Graphs,$\mathbb{X}$-样本对比损失：用样本相似图改进对比学习,"Vlad Sobal, Mark Ibrahim, Randall Balestriero, Vivien Cabannes, Diane Bouchacourt, Pietro Astolfi, Kyunghyun Cho, Yann LeCun",https://arxiv.org/pdf/2407.18134.pdf,"Subjects:
Computer Vision and Pattern Recognition (cs.CV); Machine Learning (cs.LG)","Computer Vision and Pattern Recognition (cs.CV),  Machine Learning (cs.LG)"
1045,arXiv:2407.18131,Reachability for Multi-Priced Timed Automata with Positive and Negative Rates,具有正负速率的多价格时间自动机的可达性,"Andrew Scoones, Mahsa Shirmohammadi, James Worrell",https://arxiv.org/pdf/2407.18131.pdf,"Subjects:
Formal Languages and Automata Theory (cs.FL)",Formal Languages and Automata Theory (cs.FL)
1046,arXiv:2407.18129,Dallah: A Dialect-Aware Multimodal Large Language Model for Arabic,Dallah：一种方言感知的阿拉伯语多模态大型语言模型,"Fakhraddin Alwajih, Gagan Bhatia, Muhammad Abdul-Mageed",https://arxiv.org/pdf/2407.18129.pdf,"Subjects:
Computation and Language (cs.CL); Artificial Intelligence (cs.AI)","Computation and Language (cs.CL),  Artificial Intelligence (cs.AI)"
1047,arXiv:2407.18128,Estimating Earthquake Magnitude in Sentinel-1 Imagery via Ranking,通过排名估算Sentinel-1图像中的地震震级,"Daniele Rege Cambrin, Isaac Corley, Paolo Garza, Peyman Najafirad",https://arxiv.org/pdf/2407.18128.pdf,"Subjects:
Computer Vision and Pattern Recognition (cs.CV); Image and Video Processing (eess.IV)","Computer Vision and Pattern Recognition (cs.CV),  Image and Video Processing (eess.IV)"
1048,arXiv:2407.18125,Self-supervised pre-training with diffusion model for few-shot landmark detection in x-ray images,基于扩散模型的自监督预训练用于x射线图像中少镜头地标检测,"Roberto Di Via, Francesca Odone, Vito Paolo Pastore",https://arxiv.org/pdf/2407.18125.pdf,"Subjects:
Computer Vision and Pattern Recognition (cs.CV); Artificial Intelligence (cs.AI)","Computer Vision and Pattern Recognition (cs.CV),  Artificial Intelligence (cs.AI)"
1049,arXiv:2407.18124,"PIR Codes, Unequal-Data-Demand Codes, and the Griesmer Bound",PIR代码、不等数据需求代码和Griesmer界限,"Henk D.L. Hollmann, Martin Puškin, Ago-Erik Riet",https://arxiv.org/pdf/2407.18124.pdf,"Subjects:
Information Theory (cs.IT); Combinatorics (math.CO)","Information Theory (cs.IT),  Combinatorics (math.CO)"
1050,arXiv:2407.18122,"On de Bruijn Arrays Codes, Part I: Nonlinear Codes",关于de Bruijn阵列码，第一部分：非线性码,Tuvi Etzion,https://arxiv.org/pdf/2407.18122.pdf,"Subjects:
Information Theory (cs.IT)",Information Theory (cs.IT)
1051,arXiv:2407.18121,Efficient Inference of Vision Instruction-Following Models with Elastic Cache,基于弹性缓存的视觉指令跟踪模型的高效推理,"Zuyan Liu, Benlin Liu, Jiahui Wang, Yuhao Dong, Guangyi Chen, Yongming Rao, Ranjay Krishna, Jiwen Lu",https://arxiv.org/pdf/2407.18121.pdf,"Subjects:
Computer Vision and Pattern Recognition (cs.CV)",Computer Vision and Pattern Recognition (cs.CV)
1052,arXiv:2407.18119,Tracking linguistic information in transformer-based sentence embeddings through targeted sparsification,通过有针对性的稀疏化跟踪基于变换器的句子嵌入中的语言信息,"Vivi Nastase, Paola Merlo",https://arxiv.org/pdf/2407.18119.pdf,"Subjects:
Computation and Language (cs.CL)",Computation and Language (cs.CL)
1053,arXiv:2407.18114,Unsupervised Training of Neural Cellular Automata on Edge Devices,边缘设备上神经细胞自动机的无监督训练,"John Kalkhof, Amin Ranem, Anirban Mukhopadhyay",https://arxiv.org/pdf/2407.18114.pdf,"Subjects:
Machine Learning (cs.LG)",Machine Learning (cs.LG)
1054,arXiv:2407.18112,Keypoint Promptable Re-Identification,关键点可提示重新识别,"Vladimir Somers, Christophe De Vleeschouwer, Alexandre Alahi",https://arxiv.org/pdf/2407.18112.pdf,"Subjects:
Computer Vision and Pattern Recognition (cs.CV)",Computer Vision and Pattern Recognition (cs.CV)
1055,arXiv:2407.18110,MapTune: Advancing ASIC Technology Mapping via Reinforcement Learning Guided Library Tuning,MapTune：通过强化学习引导库调优推进ASIC技术映射,"Mingju Liu, Daniel Robinson, Yingjie Li, Cunxi Yu",https://arxiv.org/pdf/2407.18110.pdf,"Subjects:
Hardware Architecture (cs.AR); Artificial Intelligence (cs.AI)","Hardware Architecture (cs.AR),  Artificial Intelligence (cs.AI)"
1056,arXiv:2407.18108,Graph Neural Ordinary Differential Equations for Coarse-Grained Socioeconomic Dynamics,粗粒度社会经济动力学的图神经常微分方程,"James Koch, Pranab Roy Chowdhury, Heng Wan, Parin Bhaduri, Jim Yoon, Vivek Srikrishnan, W. Brent Daniel",https://arxiv.org/pdf/2407.18108.pdf,"Subjects:
Machine Learning (cs.LG); Computers and Society (cs.CY); Social and Information Networks (cs.SI); Physics and Society (physics.soc-ph)","Machine Learning (cs.LG),  Computers and Society (cs.CY),  Social and Information Networks (cs.SI),  Physics and Society (physics.soc-ph)"
1057,arXiv:2407.18100,"DINOv2 Rocks Geological Image Analysis: Classification, Segmentation, and Interpretability",DINOv2岩石地质图像分析：分类、分割和可解释性,"Florent Brondolo, Samuel Beaussant",https://arxiv.org/pdf/2407.18100.pdf,"Subjects:
Computer Vision and Pattern Recognition (cs.CV); Geophysics (physics.geo-ph)","Computer Vision and Pattern Recognition (cs.CV),  Geophysics (physics.geo-ph)"
1058,arXiv:2407.18099,"Pose, Velocity and Landmark Position Estimation Using IMU and Bearing Measurements",使用IMU和方位测量进行姿态、速度和地标位置估计,"Miaomiao Wang, Abdelhamid Tayebi",https://arxiv.org/pdf/2407.18099.pdf,"Subjects:
Systems and Control (eess.SY); Robotics (cs.RO)","Systems and Control (eess.SY),  Robotics (cs.RO)"
1059,arXiv:2407.18098,Unraveling the Web of Disinformation: Exploring the Larger Context of State-Sponsored Influence Campaigns on Twitter,揭开虚假信息之网：探索推特上国家支持的影响力运动的更大背景,"Mohammad Hammas Saeed, Shiza Ali, Pujan Paudel, Jeremy Blackburn, Gianluca Stringhini",https://arxiv.org/pdf/2407.18098.pdf,"Subjects:
Computers and Society (cs.CY); Social and Information Networks (cs.SI)","Computers and Society (cs.CY),  Social and Information Networks (cs.SI)"
1060,arXiv:2407.18097,SSTD: Stripe-Like Space Target Detection using Single-Point Supervision,SSTD：使用单点监督的条状空间目标检测,"Zijian Zhu, Ali Zia, Xuesong Li, Bingbing Dan, Yuebo Ma, Enhai Liu, Rujin Zhao",https://arxiv.org/pdf/2407.18097.pdf,"Subjects:
Computer Vision and Pattern Recognition (cs.CV)",Computer Vision and Pattern Recognition (cs.CV)
1061,arXiv:2407.18096,Privacy Threats and Countermeasures in Federated Learning for Internet of Things: A Systematic Review,物联网联合学习中的隐私威胁与对策：系统综述,"Adel ElZemity, Budi Arief",https://arxiv.org/pdf/2407.18096.pdf,"Subjects:
Cryptography and Security (cs.CR); Artificial Intelligence (cs.AI)","Cryptography and Security (cs.CR),  Artificial Intelligence (cs.AI)"
1062,arXiv:2407.18092,Strategic Cost Selection in Participatory Budgeting,参与式预算中的战略成本选择,"Piotr Faliszewski, Łukasz Janeczko, Andrzej Kaczmarczyk, Grzegorz Lisowski, Piotr Skowron, Stanisław Szufa",https://arxiv.org/pdf/2407.18092.pdf,"Subjects:
Computer Science and Game Theory (cs.GT); Multiagent Systems (cs.MA)","Computer Science and Game Theory (cs.GT),  Multiagent Systems (cs.MA)"
1063,arXiv:2407.18090,"On the Minimisation of Deterministic and History-Deterministic Generalised (co)B\""uchi Automata","论确定性和历史确定性广义（共）B""uchi自动机的最小化","Antonio Casares, Olivier Idir, Denis Kuperberg, Corto Mascle, Aditya Prakash",https://arxiv.org/pdf/2407.18090.pdf,"Subjects:
Formal Languages and Automata Theory (cs.FL)",Formal Languages and Automata Theory (cs.FL)
1064,arXiv:2407.18086,Revealing urban area from mobile positioning data,从移动定位数据中揭示城市区域,Gergő Pintér,https://arxiv.org/pdf/2407.18086.pdf,"Subjects:
Social and Information Networks (cs.SI); Physics and Society (physics.soc-ph)","Social and Information Networks (cs.SI),  Physics and Society (physics.soc-ph)"
