Unnamed: 0,id,title,title_zh,authors,url,subjects,subject_split
0,arXiv:2407.20232,Specify and Edit: Overcoming Ambiguity in Text-Based Image Editing,指定和编辑：克服基于文本的图像编辑中的歧义,"Ekaterina Iakovleva, Fabio Pizzati, Philip Torr, Stéphane Lathuilière",https://arxiv.org/pdf/2407.20232.pdf,"Subjects:
Computer Vision and Pattern Recognition (cs.CV); Artificial Intelligence (cs.AI); Machine Learning (cs.LG)","Computer Vision and Pattern Recognition (cs.CV),  Artificial Intelligence (cs.AI),  Machine Learning (cs.LG)"
1,arXiv:2407.20230,SAPG: Split and Aggregate Policy Gradients,SAPG：分割和聚合政策梯度,"Jayesh Singla, Ananye Agarwal, Deepak Pathak",https://arxiv.org/pdf/2407.20230.pdf,"Subjects:
Machine Learning (cs.LG); Artificial Intelligence (cs.AI); Computer Vision and Pattern Recognition (cs.CV); Robotics (cs.RO); Systems and Control (eess.SY)","Machine Learning (cs.LG),  Artificial Intelligence (cs.AI),  Computer Vision and Pattern Recognition (cs.CV),  Robotics (cs.RO),  Systems and Control (eess.SY)"
2,arXiv:2407.20229,Improving 2D Feature Representations by 3D-Aware Fine-Tuning,通过3D感知微调改进2D特征表示,"Yuanwen Yue, Anurag Das, Francis Engelmann, Siyu Tang, Jan Eric Lenssen",https://arxiv.org/pdf/2407.20229.pdf,"Subjects:
Computer Vision and Pattern Recognition (cs.CV)",Computer Vision and Pattern Recognition (cs.CV)
3,arXiv:2407.20228,FlexAttention for Efficient High-Resolution Vision-Language Models,FlexAttention用于高效的高分辨率视觉语言模型,"Junyan Li, Delin Chen, Tianle Cai, Peihao Chen, Yining Hong, Zhenfang Chen, Yikang Shen, Chuang Gan",https://arxiv.org/pdf/2407.20228.pdf,"Subjects:
Computer Vision and Pattern Recognition (cs.CV)",Computer Vision and Pattern Recognition (cs.CV)
4,arXiv:2407.20226,Models of random spanning trees,随机生成树模型,"Eric Babson, Moon Duchin, Annina Iseli, Pietro Poggi-Corradini, Dylan Thurston, Jamie Tucker-Foltz",https://arxiv.org/pdf/2407.20226.pdf,"Subjects:
Discrete Mathematics (cs.DM); Combinatorics (math.CO); Probability (math.PR)","Discrete Mathematics (cs.DM),  Combinatorics (math.CO),  Probability (math.PR)"
5,arXiv:2407.20224,Can Editing LLMs Inject Harm?,编辑LLM会带来伤害吗？,"Canyu Chen, Baixiang Huang, Zekun Li, Zhaorun Chen, Shiyang Lai, Xiongxiao Xu, Jia-Chen Gu, Jindong Gu, Huaxiu Yao, Chaowei Xiao, Xifeng Yan, William Yang Wang, Philip Torr, Dawn Song, Kai Shu",https://arxiv.org/pdf/2407.20224.pdf,"Subjects:
Computation and Language (cs.CL)",Computation and Language (cs.CL)
6,arXiv:2407.20223,Correspondence-Free SE(3) Point Cloud Registration in RKHS via Unsupervised Equivariant Learning,通过无监督等变学习在RKHS中实现无通信SE（3）点云注册,"Ray Zhang, Zheming Zhou, Min Sun, Omid Ghasemalizadeh, Cheng-Hao Kuo, Ryan Eustice, Maani Ghaffari, Arnie Sen",https://arxiv.org/pdf/2407.20223.pdf,"Subjects:
Computer Vision and Pattern Recognition (cs.CV); Robotics (cs.RO)","Computer Vision and Pattern Recognition (cs.CV),  Robotics (cs.RO)"
7,arXiv:2407.20219,Global Structure-from-Motion Revisited,从运动看全球结构,"Linfei Pan, Dániel Baráth, Marc Pollefeys, Johannes L. Schönberger",https://arxiv.org/pdf/2407.20219.pdf,"Subjects:
Computer Vision and Pattern Recognition (cs.CV)",Computer Vision and Pattern Recognition (cs.CV)
8,arXiv:2407.20214,SANGRIA: Surgical Video Scene Graph Optimization for Surgical Workflow Prediction,SANGRIA：用于手术工作流程预测的手术视频场景图优化,"Çağhan Köksal, Ghazal Ghazaei, Felix Holm, Azade Farshad, Nassir Navab",https://arxiv.org/pdf/2407.20214.pdf,"Subjects:
Computer Vision and Pattern Recognition (cs.CV); Artificial Intelligence (cs.AI)","Computer Vision and Pattern Recognition (cs.CV),  Artificial Intelligence (cs.AI)"
9,arXiv:2407.20213,Registering Neural 4D Gaussians for Endoscopic Surgery,神经4D高斯配准用于内窥镜手术,"Yiming Huang, Beilei Cui, Ikemura Kei, Jiekai Zhang, Long Bai, Hongliang Ren",https://arxiv.org/pdf/2407.20213.pdf,"Subjects:
Robotics (cs.RO); Computer Vision and Pattern Recognition (cs.CV)","Robotics (cs.RO),  Computer Vision and Pattern Recognition (cs.CV)"
10,arXiv:2407.20212,Distributed Quantum Approximate Optimization Algorithm on Integrated High-Performance Computing and Quantum Computing Systems for Large-Scale Optimization,用于大规模优化的集成高性能计算和量子计算系统的分布式量子近似优化算法,"Seongmin Kim, Tengfei Luo, Eungkyu Lee, In-Saeng Suh",https://arxiv.org/pdf/2407.20212.pdf,"Subjects:
Distributed, Parallel, and Cluster Computing (cs.DC); Computational Engineering, Finance, and Science (cs.CE)","Distributed, Parallel, and Cluster Computing (cs.DC),  Computational Engineering, Finance, and Science (cs.CE)"
11,arXiv:2407.20209,Characterizing Dynamical Stability of Stochastic Gradient Descent in Overparameterized Learning,过参数化学习中随机梯度下降的动态稳定性表征,"Dennis Chemnitz, Maximilian Engel",https://arxiv.org/pdf/2407.20209.pdf,"Subjects:
Machine Learning (cs.LG); Dynamical Systems (math.DS); Probability (math.PR)","Machine Learning (cs.LG),  Dynamical Systems (math.DS),  Probability (math.PR)"
12,arXiv:2407.20208,Supertrust: Evolution-based superalignment strategy for safe coexistence,超级信任：基于进化的安全共存超级对齐策略,James M. Mazzu,https://arxiv.org/pdf/2407.20208.pdf,"Subjects:
Artificial Intelligence (cs.AI); Machine Learning (cs.LG); Neural and Evolutionary Computing (cs.NE)","Artificial Intelligence (cs.AI),  Machine Learning (cs.LG),  Neural and Evolutionary Computing (cs.NE)"
13,arXiv:2407.20207,QAEA-DR: A Unified Text Augmentation Framework for Dense Retrieval,QAEA-DR：一个用于密集检索的统一文本增强框架,"Hongming Tan, Shaoxiong Zhan, Hai Lin, Hai-Tao Zheng, Wai Kin (Victor)Chan",https://arxiv.org/pdf/2407.20207.pdf,"Subjects:
Computation and Language (cs.CL); Artificial Intelligence (cs.AI); Information Retrieval (cs.IR)","Computation and Language (cs.CL),  Artificial Intelligence (cs.AI),  Information Retrieval (cs.IR)"
14,arXiv:2407.20205,Fast computation of permanents over $\mathbb{F}_3$ via $\mathbb{F}_2$ arithmetic,$\mathbb上永久值的快速计算{F}_3$通过$\mathbb{F}_2$算术,Danny Scheinerman,https://arxiv.org/pdf/2407.20205.pdf,"Subjects:
Data Structures and Algorithms (cs.DS); Combinatorics (math.CO)","Data Structures and Algorithms (cs.DS),  Combinatorics (math.CO)"
15,arXiv:2407.20204,Constant-Cost Communication is not Reducible to k-Hamming Distance,恒定成本通信不能简化为k-Hamming距离,"Yuting Fang, Mika Göös, Nathaniel Harms, Pooya Hatami",https://arxiv.org/pdf/2407.20204.pdf,"Subjects:
Computational Complexity (cs.CC)",Computational Complexity (cs.CC)
16,arXiv:2407.20203,"Privileged Reinforcement and Communication Learning for Distributed, Bandwidth-limited Multi-robot Exploration",分布式带宽受限多机器人探索的特权强化和通信学习,"Yixiao Ma, Jingsong Liang, Yuhong Cao, Derek Ming Siang Tan, Guillaume Sartoretti",https://arxiv.org/pdf/2407.20203.pdf,"Subjects:
Robotics (cs.RO)",Robotics (cs.RO)
17,arXiv:2407.20197,Learning Random Numbers to Realize Appendable Memory System for Artificial Intelligence to Acquire New Knowledge after Deployment,学习随机数实现人工智能可追加记忆系统部署后获取新知识,Kazunori D Yamada,https://arxiv.org/pdf/2407.20197.pdf,"Subjects:
Machine Learning (cs.LG); Artificial Intelligence (cs.AI); Neural and Evolutionary Computing (cs.NE)","Machine Learning (cs.LG),  Artificial Intelligence (cs.AI),  Neural and Evolutionary Computing (cs.NE)"
18,arXiv:2407.20194,Radiance Fields for Robotic Teleoperation,机器人遥操作的辐射场,"Maximum Wilder-Smith, Vaishakh Patil, Marco Hutter",https://arxiv.org/pdf/2407.20194.pdf,"Subjects:
Robotics (cs.RO)",Robotics (cs.RO)
19,arXiv:2407.20192,Time series forecasting with high stakes: A field study of the air cargo industry,高风险时间序列预测：航空货运业的实地研究,"Abhinav Garg, Naman Shukla",https://arxiv.org/pdf/2407.20192.pdf,"Subjects:
Machine Learning (cs.LG); Systems and Control (eess.SY)","Machine Learning (cs.LG),  Systems and Control (eess.SY)"
20,arXiv:2407.20189,Aligning Query Representation with Rewritten Query and Relevance Judgments in Conversational Search,会话搜索中查询表示与重写查询和相关性判断的对齐,"Fengran Mo, Chen Qu, Kelong Mao, Yihong Wu, Zhan Su, Kaiyu Huang, Jian-Yun Nie",https://arxiv.org/pdf/2407.20189.pdf,"Subjects:
Information Retrieval (cs.IR); Computation and Language (cs.CL)","Information Retrieval (cs.IR),  Computation and Language (cs.CL)"
21,arXiv:2407.20187,Eliminating Majority Illusion is Easy,消除多数错觉很容易,"Jack Dippel, Max Dupré la Tour, April Niu, Sanjukta Roy, Adrian Vetta",https://arxiv.org/pdf/2407.20187.pdf,"Subjects:
Multiagent Systems (cs.MA)",Multiagent Systems (cs.MA)
22,arXiv:2407.20183,MindSearch: Mimicking Human Minds Elicits Deep AI Searcher,MindSearch:模仿人类思维，引发深度人工智能搜索,"Zehui Chen, Kuikun Liu, Qiuchen Wang, Jiangning Liu, Wenwei Zhang, Kai Chen, Feng Zhao",https://arxiv.org/pdf/2407.20183.pdf,"Subjects:
Computation and Language (cs.CL); Artificial Intelligence (cs.AI)","Computation and Language (cs.CL),  Artificial Intelligence (cs.AI)"
23,arXiv:2407.20181,Blockchain for Large Language Model Security and Safety: A Holistic Survey,区块链用于大型语言模型安全：一项全面调查,"Caleb Geren, Amanda Board, Gaby G. Dagher, Tim Andersen, Jun Zhuang",https://arxiv.org/pdf/2407.20181.pdf,"Subjects:
Cryptography and Security (cs.CR); Artificial Intelligence (cs.AI); Distributed, Parallel, and Cluster Computing (cs.DC); Machine Learning (cs.LG)","Cryptography and Security (cs.CR),  Artificial Intelligence (cs.AI),  Distributed, Parallel, and Cluster Computing (cs.DC),  Machine Learning (cs.LG)"
24,arXiv:2407.20179,Theia: Distilling Diverse Vision Foundation Models for Robot Learning,Theia：提炼机器人学习的多样化视觉基础模型,"Jinghuan Shang, Karl Schmeckpeper, Brandon B. May, Maria Vittoria Minniti, Tarik Kelestemur, David Watkins, Laura Herlant",https://arxiv.org/pdf/2407.20179.pdf,"Subjects:
Robotics (cs.RO); Artificial Intelligence (cs.AI); Computer Vision and Pattern Recognition (cs.CV); Machine Learning (cs.LG)","Robotics (cs.RO),  Artificial Intelligence (cs.AI),  Computer Vision and Pattern Recognition (cs.CV),  Machine Learning (cs.LG)"
25,arXiv:2407.20177,AutoScale: Automatic Prediction of Compute-optimal Data Composition for Training LLMs,AutoScale：训练LLM的计算最优数据组合的自动预测,"Feiyang Kang, Yifan Sun, Bingbing Wen, Si Chen, Dawn Song, Rafid Mahmood, Ruoxi Jia",https://arxiv.org/pdf/2407.20177.pdf,"Subjects:
Machine Learning (cs.LG); Artificial Intelligence (cs.AI); Computation and Language (cs.CL); Machine Learning (stat.ML)","Machine Learning (cs.LG),  Artificial Intelligence (cs.AI),  Computation and Language (cs.CL),  Machine Learning (stat.ML)"
26,arXiv:2407.20176,Emotion-Driven Melody Harmonization via Melodic Variation and Functional Representation,通过旋律变异和功能表征实现情感驱动的旋律协调,"Jingyue Huang, Yi-Hsuan Yang",https://arxiv.org/pdf/2407.20176.pdf,"Subjects:
Sound (cs.SD); Artificial Intelligence (cs.AI); Audio and Speech Processing (eess.AS)","Sound (cs.SD),  Artificial Intelligence (cs.AI),  Audio and Speech Processing (eess.AS)"
27,arXiv:2407.20175,Towards Localized Fine-Grained Control for Facial Expression Generation,面向面部表情生成的局部精细控制,"Tuomas Varanka, Huai-Qian Khor, Yante Li, Mengting Wei, Hanwei Kung, Nicu Sebe, Guoying Zhao",https://arxiv.org/pdf/2407.20175.pdf,"Subjects:
Computer Vision and Pattern Recognition (cs.CV)",Computer Vision and Pattern Recognition (cs.CV)
28,arXiv:2407.20174,Advancing Multimodal Large Language Models in Chart Question Answering with Visualization-Referenced Instruction Tuning,利用可视化参考指令调优推进图表问答中的多模态大型语言模型,"Xingchen Zeng, Haichuan Lin, Yilin Ye, Wei Zeng",https://arxiv.org/pdf/2407.20174.pdf,"Subjects:
Computer Vision and Pattern Recognition (cs.CV); Artificial Intelligence (cs.AI)","Computer Vision and Pattern Recognition (cs.CV),  Artificial Intelligence (cs.AI)"
29,arXiv:2407.20171,Diffusion Feedback Helps CLIP See Better,扩散反馈帮助CLIP看得更好,"Wenxuan Wang, Quan Sun, Fan Zhang, Yepeng Tang, Jing Liu, Xinlong Wang",https://arxiv.org/pdf/2407.20171.pdf,"Subjects:
Computer Vision and Pattern Recognition (cs.CV)",Computer Vision and Pattern Recognition (cs.CV)
30,arXiv:2407.20170,Propagation of Uncertainty with the Koopman Operator,Koopman算子的不确定性传播,"Simone Servadio, Giovanni Lavezzi, Christian Hofmann, Di Wu, Richard Linares",https://arxiv.org/pdf/2407.20170.pdf,"Subjects:
Information Theory (cs.IT)",Information Theory (cs.IT)
31,arXiv:2407.20165,Meta-Learning for Adaptive Control with Automated Mirror Descent,用于自动镜像下降自适应控制的元学习,"Sunbochen Tang, Haoyuan Sun, Navid Azizan",https://arxiv.org/pdf/2407.20165.pdf,"Subjects:
Systems and Control (eess.SY)",Systems and Control (eess.SY)
32,arXiv:2407.20164,Language-Conditioned Offline RL for Multi-Robot Navigation,多机器人导航的语言条件离线RL,"Steven Morad, Ajay Shankar, Jan Blumenkamp, Amanda Prorok",https://arxiv.org/pdf/2407.20164.pdf,"Subjects:
Robotics (cs.RO); Artificial Intelligence (cs.AI); Machine Learning (cs.LG)","Robotics (cs.RO),  Artificial Intelligence (cs.AI),  Machine Learning (cs.LG)"
33,arXiv:2407.20158,Machine Learning for predicting chaotic systems,用于预测混沌系统的机器学习,"Christof Schötz, Alistair White, Maximilian Gelbrecht, Niklas Boers",https://arxiv.org/pdf/2407.20158.pdf,"Subjects:
Machine Learning (cs.LG); Chaotic Dynamics (nlin.CD)","Machine Learning (cs.LG),  Chaotic Dynamics (nlin.CD)"
34,arXiv:2407.20157,rLLM: Relational Table Learning with LLMs,rLLM：使用LLM进行关系表学习,"Weichen Li, Xiaotong Huang, Jianwu Zheng, Zheng Wang, Chaokun Wang, Li Pan, Jianhua Li",https://arxiv.org/pdf/2407.20157.pdf,"Subjects:
Artificial Intelligence (cs.AI)",Artificial Intelligence (cs.AI)
35,arXiv:2407.20156,Autonomous and Teleoperation Control of a Drawing Robot Avatar,绘图机器人化身的自主遥操作控制,"Lingyun Chen, Abdeldjallil Naceri, Abdalla Swikir, Sandra Hirche, Sami Haddadin",https://arxiv.org/pdf/2407.20156.pdf,"Subjects:
Robotics (cs.RO)",Robotics (cs.RO)
36,arXiv:2407.20155,GsPINN: A novel fast Green kernel solver based on symmetric Physics-Informed neural networks,GsPINN：一种基于对称物理信息神经网络的新型快速格林核求解器,"Xiaopei Jiao, Fansheng Xiong",https://arxiv.org/pdf/2407.20155.pdf,"Subjects:
Numerical Analysis (math.NA)",Numerical Analysis (math.NA)
37,arXiv:2407.20152,Hierarchically Disentangled Recurrent Network for Factorizing System Dynamics of Multi-scale Systems,用于分解多尺度系统动力学的分层解耦循环网络,"Rahul Ghosh, Zac McEachran, Arvind Renganathan, Kelly Lindsay, Somya Sharma, Michael Steinbach, John Nieber, Christopher Duffy, Vipin Kumar",https://arxiv.org/pdf/2407.20152.pdf,"Subjects:
Machine Learning (cs.LG)",Machine Learning (cs.LG)
38,arXiv:2407.20143,ByteCheckpoint: A Unified Checkpointing System for LLM Development,ByteCheckpoint：一个用于LLM开发的统一检查点系统,"Borui Wan, Mingji Han, Yiyao Sheng, Zhichao Lai, Mofan Zhang, Junda Zhang, Yanghua Peng, Haibin Lin, Xin Liu, Chuan Wu",https://arxiv.org/pdf/2407.20143.pdf,"Subjects:
Artificial Intelligence (cs.AI)",Artificial Intelligence (cs.AI)
39,arXiv:2407.20141,DDAP: Dual-Domain Anti-Personalization against Text-to-Image Diffusion Models,DDAP：针对文本到图像扩散模型的双域反个性化,"Jing Yang, Runping Xi, Yingxin Lai, Xun Lin, Zitong Yu",https://arxiv.org/pdf/2407.20141.pdf,"Subjects:
Computer Vision and Pattern Recognition (cs.CV)",Computer Vision and Pattern Recognition (cs.CV)
40,arXiv:2407.20130,To accept or not to accept? An IRT-TOE Framework to Understand Educators' Resistance to Generative AI in Higher Education,接受还是不接受？IRT-TOE框架用于理解高等教育中教育工作者对生成性人工智能的抵制,"Jan-Erik Kalmus, Anastasija Nikiforova",https://arxiv.org/pdf/2407.20130.pdf,"Subjects:
Computers and Society (cs.CY); Artificial Intelligence (cs.AI); Emerging Technologies (cs.ET); Human-Computer Interaction (cs.HC); Information Theory (cs.IT)","Computers and Society (cs.CY),  Artificial Intelligence (cs.AI),  Emerging Technologies (cs.ET),  Human-Computer Interaction (cs.HC),  Information Theory (cs.IT)"
41,arXiv:2407.20124,AxiomVision: Accuracy-Guaranteed Adaptive Visual Model Selection for Perspective-Aware Video Analytics,AxiomVision：用于透视感知视频分析的精度保证自适应视觉模型选择,"Xiangxiang Dai, Zeyu Zhang, Peng Yang, Yuedong Xu, Xutong Liu, John C.S. Lui",https://arxiv.org/pdf/2407.20124.pdf,"Subjects:
Multimedia (cs.MM); Artificial Intelligence (cs.AI)","Multimedia (cs.MM),  Artificial Intelligence (cs.AI)"
42,arXiv:2407.20122,Tightening the Evaluation of PAC Bounds Using Formal Verification Results,利用形式化验证结果加强PAC边界的评估,"Thomas Walker, Alessio Lomuscio",https://arxiv.org/pdf/2407.20122.pdf,"Subjects:
Machine Learning (cs.LG)",Machine Learning (cs.LG)
43,arXiv:2407.20121,EXIT: An EXplicit Interest Transfer Framework for Cross-Domain Recommendation,EXIT：一个跨领域推荐的利益转移框架,"Lei Huang, Weitao Li, Chenrui Zhang, Jinpeng Wang, Xianchun Yi, Sheng Chen",https://arxiv.org/pdf/2407.20121.pdf,"Subjects:
Information Retrieval (cs.IR); Artificial Intelligence (cs.AI)","Information Retrieval (cs.IR),  Artificial Intelligence (cs.AI)"
44,arXiv:2407.20119,Adaptive Self-supervised Robust Clustering for Unstructured Data with Unknown Cluster Number,未知簇数非结构化数据的自适应自监督鲁棒聚类,"Chen-Lu Ding, Jiancan Wu, Wei Lin, Shiyang Shen, Xiang Wang, Yancheng Yuan",https://arxiv.org/pdf/2407.20119.pdf,"Subjects:
Machine Learning (cs.LG); Artificial Intelligence (cs.AI)","Machine Learning (cs.LG),  Artificial Intelligence (cs.AI)"
45,arXiv:2407.20114,FiCo-ITR: bridging fine-grained and coarse-grained image-text retrieval for comparative performance analysis,FiCo ITR：桥接细粒度和粗粒度图像文本检索，用于比较性能分析,"Mikel Williams-Lekuona, Georgina Cosma",https://arxiv.org/pdf/2407.20114.pdf,"Subjects:
Information Retrieval (cs.IR); Artificial Intelligence (cs.AI); Computer Vision and Pattern Recognition (cs.CV)","Information Retrieval (cs.IR),  Artificial Intelligence (cs.AI),  Computer Vision and Pattern Recognition (cs.CV)"
46,arXiv:2407.20111,Enhancing Anti-spoofing Countermeasures Robustness through Joint Optimization and Transfer Learning,通过联合优化和迁移学习增强反欺骗对策的稳健性,"Yikang Wang, Xingming Wang, Hiromitsu Nishizaki, Ming Li",https://arxiv.org/pdf/2407.20111.pdf,"Subjects:
Sound (cs.SD); Audio and Speech Processing (eess.AS); Signal Processing (eess.SP)","Sound (cs.SD),  Audio and Speech Processing (eess.AS),  Signal Processing (eess.SP)"
47,arXiv:2407.20109,Diffusion-DICE: In-Sample Diffusion Guidance for Offline Reinforcement Learning,扩散DICE：离线强化学习的样本内扩散指导,"Liyuan Mao, Haoran Xu, Weinan Zhang, Xianyuan Zhan, Amy Zhang",https://arxiv.org/pdf/2407.20109.pdf,"Subjects:
Machine Learning (cs.LG); Artificial Intelligence (cs.AI)","Machine Learning (cs.LG),  Artificial Intelligence (cs.AI)"
48,arXiv:2407.20105,Strong Copyright Protection for Language Models via Adaptive Model Fusion,通过自适应模型融合为语言模型提供强大的版权保护,"Javier Abad, Konstantin Donhauser, Francesco Pinto, Fanny Yang",https://arxiv.org/pdf/2407.20105.pdf,"Subjects:
Machine Learning (cs.LG); Cryptography and Security (cs.CR)","Machine Learning (cs.LG),  Cryptography and Security (cs.CR)"
49,arXiv:2407.20103,What Can Interactive Visualization do for Participatory Budgeting in Chicago?,交互式可视化可以为芝加哥的参与式预算做些什么？,"Alex Kale, Danni Liu, Maria Gabriela Ayala, Harper Schwab, Andrew McNutt",https://arxiv.org/pdf/2407.20103.pdf,"Subjects:
Human-Computer Interaction (cs.HC)",Human-Computer Interaction (cs.HC)
50,arXiv:2407.20100,F-KANs: Federated Kolmogorov-Arnold Networks,F-KAN：联合Kolmogorov-Arnold网络,"Engin Zeydan, Cristian J. Vaca-Rubio, Luis Blanco, Roberto Pereira, Marius Caus, Abdullah Aydeger",https://arxiv.org/pdf/2407.20100.pdf,"Subjects:
Machine Learning (cs.LG); Artificial Intelligence (cs.AI); Cryptography and Security (cs.CR); Networking and Internet Architecture (cs.NI)","Machine Learning (cs.LG),  Artificial Intelligence (cs.AI),  Cryptography and Security (cs.CR),  Networking and Internet Architecture (cs.NI)"
51,arXiv:2407.20099,RSC-SNN: Exploring the Trade-off Between Adversarial Robustness and Accuracy in Spiking Neural Networks via Randomized Smoothing Coding,RSC-SNN：通过随机平滑编码探索尖峰神经网络中对抗鲁棒性和准确性之间的权衡,"Keming Wu, Man Yao, Yuhong Chou, Xuerui Qiu, Rui Yang, Bo Xu, Guoqi Li",https://arxiv.org/pdf/2407.20099.pdf,"Subjects:
Computer Vision and Pattern Recognition (cs.CV)",Computer Vision and Pattern Recognition (cs.CV)
52,arXiv:2407.20095,Crafting Generative Art through Genetic Improvement: Managing Creative Outputs in Diverse Fitness Landscapes,通过基因改良打造生成艺术：在不同健身环境中管理创造性产出,"Erik M. Fredericks, Denton Bobeldyk, Jared M. Moore",https://arxiv.org/pdf/2407.20095.pdf,"Subjects:
Neural and Evolutionary Computing (cs.NE)",Neural and Evolutionary Computing (cs.NE)
53,arXiv:2407.20090,Infrared Small Target Detection based on Adjustable Sensitivity Strategy and Multi-Scale Fusion,基于可调灵敏度策略和多尺度融合的红外小目标检测,"Jinmiao Zhao, Zelin Shi, Chuang Yu, Yunpeng Liu",https://arxiv.org/pdf/2407.20090.pdf,"Subjects:
Computer Vision and Pattern Recognition (cs.CV)",Computer Vision and Pattern Recognition (cs.CV)
54,arXiv:2407.20089,Performance Study of Various Relay Nodes in 5G Wireless Network,5G无线网络中各种中继节点的性能研究,"Jianghong Luo, Ashwin Sampath, Navid Abedini, Tao Luo",https://arxiv.org/pdf/2407.20089.pdf,"Subjects:
Networking and Internet Architecture (cs.NI); Systems and Control (eess.SY)","Networking and Internet Architecture (cs.NI),  Systems and Control (eess.SY)"
55,arXiv:2407.20088,"As Transparent as Possible, System Implementation Governance Using Process Mining",尽可能透明，使用流程挖掘进行系统实现治理,Negin Maddah,https://arxiv.org/pdf/2407.20088.pdf,"Subjects:
Systems and Control (eess.SY)",Systems and Control (eess.SY)
56,arXiv:2407.20083,An Energy-based Model for Word-level AutoCompletion in Computer-aided Translation,基于能量的计算机辅助翻译单词级自动补全模型,"Cheng Yang, Guoping Huang, Mo Yu, Zhirui Zhang, Siheng Li, Mingming Yang, Shuming Shi, Yujiu Yang, Lemao Liu",https://arxiv.org/pdf/2407.20083.pdf,"Subjects:
Computation and Language (cs.CL)",Computation and Language (cs.CL)
57,arXiv:2407.20080,UniTTA: Unified Benchmark and Versatile Framework Towards Realistic Test-Time Adaptation,UniTTA：面向现实测试时间自适应的统一基准和通用框架,"Chaoqun Du, Yulin Wang, Jiayi Guo, Yizeng Han, Jie Zhou, Gao Huang",https://arxiv.org/pdf/2407.20080.pdf,"Subjects:
Computer Vision and Pattern Recognition (cs.CV); Machine Learning (cs.LG)","Computer Vision and Pattern Recognition (cs.CV),  Machine Learning (cs.LG)"
58,arXiv:2407.20078,Background Semantics Matter: Cross-Task Feature Exchange Network for Clustered Infrared Small Target Detection With Sky-Annotated Dataset,背景语义很重要：基于天空标注数据集的集群红外小目标检测跨任务特征交换网络,"Yimian Dai, Mengxuan Xiao, Yiming Zhu, Huan Wang, Kehua Guo, Jian Yang",https://arxiv.org/pdf/2407.20078.pdf,"Subjects:
Computer Vision and Pattern Recognition (cs.CV)",Computer Vision and Pattern Recognition (cs.CV)
59,arXiv:2407.20076,Investigating the Impact of Semi-Supervised Methods with Data Augmentation on Offensive Language Detection in Romanian Language,数据增强半监督方法对罗马尼亚语攻击性语言检测的影响研究,"Elena Beatrice Nicola, Dumitru Clementin Cercel, Florin Pop",https://arxiv.org/pdf/2407.20076.pdf,"Subjects:
Computation and Language (cs.CL)",Computation and Language (cs.CL)
60,arXiv:2407.20070,An Interpretable Rule Creation Method for Black-Box Models based on Surrogate Trees -- SRules,基于代理树的黑箱模型可解释规则创建方法——SRules,"Mario Parrón Verdasco, Esteban García-Cuesta",https://arxiv.org/pdf/2407.20070.pdf,"Subjects:
Machine Learning (cs.LG)",Machine Learning (cs.LG)
61,arXiv:2407.20068,Unleash the Power of Ellipsis: Accuracy-enhanced Sparse Vector Technique with Exponential Noise,释放椭圆的力量：具有指数噪声的精度增强稀疏矢量技术,"Yuhan Liu, Sheng Wang, Yixuan Liu, Feifei Li, Hong Chen",https://arxiv.org/pdf/2407.20068.pdf,"Subjects:
Cryptography and Security (cs.CR); Artificial Intelligence (cs.AI)","Cryptography and Security (cs.CR),  Artificial Intelligence (cs.AI)"
62,arXiv:2407.20067,xAI-Drop: Don't Use What You Cannot Explain,xAI Drop：不要使用你无法解释的东西,"Vincenzo Marco De Luca, Antonio Longa, Andrea Passerini, Pietro Liò",https://arxiv.org/pdf/2407.20067.pdf,"Subjects:
Machine Learning (cs.LG); Artificial Intelligence (cs.AI)","Machine Learning (cs.LG),  Artificial Intelligence (cs.AI)"
