Unnamed: 0,id,title,title_zh,authors,url,subjects,subject_split
1439,arXiv:2407.17347,AI Emergency Preparedness: Examining the federal government's ability to detect and respond to AI-related national security threats,人工智能应急准备：考察联邦政府检测和应对人工智能相关国家安全威胁的能力,"Akash Wasil, Everett Smith, Corin Katzke, Justin Bullock",https://arxiv.org/pdf/2407.17347.pdf,"Subjects:
Computers and Society (cs.CY)",Computers and Society (cs.CY)
1440,arXiv:2407.17346,Insider Threats Mitigation: Role of Penetration Testing,内部威胁缓解：渗透测试的作用,Krutarth Chauhan,https://arxiv.org/pdf/2407.17346.pdf,"Subjects:
Cryptography and Security (cs.CR)",Cryptography and Security (cs.CR)
1441,arXiv:2407.17344,Label Alignment and Reassignment with Generalist Large Language Model for Enhanced Cross-Domain Named Entity Recognition,基于广义大语言模型的标签对齐和重新分配，用于增强跨域命名实体识别,"Ke Bao, Chonghuan Yang",https://arxiv.org/pdf/2407.17344.pdf,"Subjects:
Computation and Language (cs.CL)",Computation and Language (cs.CL)
1442,arXiv:2407.17339,Preliminary study on artificial intelligence methods for cybersecurity threat detection in computer networks based on raw data packets,基于原始数据包的计算机网络安全威胁检测人工智能方法初探,"Aleksander Ogonowski, Michał Żebrowski, Arkadiusz Ćwiek, Tobiasz Jarosiewicz, Konrad Klimaszewski, Adam Padee, Piotr Wasiuk, Michał Wójcik",https://arxiv.org/pdf/2407.17339.pdf,"Subjects:
Computer Vision and Pattern Recognition (cs.CV); Artificial Intelligence (cs.AI); Cryptography and Security (cs.CR)","Computer Vision and Pattern Recognition (cs.CV),  Artificial Intelligence (cs.AI),  Cryptography and Security (cs.CR)"
1443,arXiv:2407.17336,Cascaded Light Propagation Volumes using Spherical Radial Basis Functions,基于球面径向基函数的级联光传播体积,"Ludovic Silvestre, João Pereira",https://arxiv.org/pdf/2407.17336.pdf,"Subjects:
Computer Vision and Pattern Recognition (cs.CV); Graphics (cs.GR)","Computer Vision and Pattern Recognition (cs.CV),  Graphics (cs.GR)"
1444,arXiv:2407.17333,Global and Local Confidence Based Fraud Detection Graph Neural Network,基于全局和局部置信度的欺诈检测图神经网络,"Jiaxun Liu, Yue Tian, Guanjun Liu",https://arxiv.org/pdf/2407.17333.pdf,"Subjects:
Machine Learning (cs.LG)",Machine Learning (cs.LG)
1445,arXiv:2407.17332,A Systematic Analytical Design Procedure for Distributed Amplifiers,分布式放大器的系统分析设计程序,"Elham Amiri, Mojtaba Joodaki",https://arxiv.org/pdf/2407.17332.pdf,"Subjects:
Emerging Technologies (cs.ET); Systems and Control (eess.SY); Applied Physics (physics.app-ph)","Emerging Technologies (cs.ET),  Systems and Control (eess.SY),  Applied Physics (physics.app-ph)"
1446,arXiv:2407.17331,Multi-label Cluster Discrimination for Visual Representation Learning,视觉表征学习中的多标签聚类判别,"Xiang An, Kaicheng Yang, Xiangzi Dai, Ziyong Feng, Jiankang Deng",https://arxiv.org/pdf/2407.17331.pdf,"Subjects:
Computer Vision and Pattern Recognition (cs.CV)",Computer Vision and Pattern Recognition (cs.CV)
1447,arXiv:2407.17328,DarSwin-Unet: Distortion Aware Encoder-Decoder Architecture,DarSwin Unet：失真感知编码器-解码器架构,"Akshaya Athwale, Ichrak Shili, Émile Bergeron, Ola Ahmad, Jean-François Lalonde",https://arxiv.org/pdf/2407.17328.pdf,"Subjects:
Computer Vision and Pattern Recognition (cs.CV)",Computer Vision and Pattern Recognition (cs.CV)
1448,arXiv:2407.17321,Energy Efficiency Optimization in Integrated Satellite-Terrestrial UAV-Enabled Cell-Free Massive MIMO,星地无人机集成无蜂窝大规模MIMO的能效优化,"Thong-Nhat Tran, Giovanni Interdonato",https://arxiv.org/pdf/2407.17321.pdf,"Subjects:
Information Theory (cs.IT); Signal Processing (eess.SP)","Information Theory (cs.IT),  Signal Processing (eess.SP)"
1449,arXiv:2407.17319,Exploring Commercial Vehicle Detouring Patterns through the Application of Probe Trajectory Data,通过应用探测轨迹数据探索商用车排毒模式,"Mark Franz PhD, Sara Zahedian PhD, Dhairya Parekh, Tahsin Emtenam PhD, Greg Jordan",https://arxiv.org/pdf/2407.17319.pdf,"Subjects:
Computational Engineering, Finance, and Science (cs.CE)","Computational Engineering, Finance, and Science (cs.CE)"
1450,arXiv:2407.17316,Lossy Data Compression By Adaptive Mesh Coarsening,自适应网格粗化的有损数据压缩,"N. Böing, J. Holke, C. Hergl, L. Spataro, G. Gassner, A. Basermann",https://arxiv.org/pdf/2407.17316.pdf,"Subjects:
Distributed, Parallel, and Cluster Computing (cs.DC)","Distributed, Parallel, and Cluster Computing (cs.DC)"
1451,arXiv:2407.17314,Edge-Cloud Continuum Orchestration of Critical Services: A Smart-City Approach,关键服务的边缘云连续编排：一种智慧城市方法,"Rodrigo Rosmaninho, Duarte Raposo, Pedro Rito, Susana Sargento",https://arxiv.org/pdf/2407.17314.pdf,"Subjects:
Distributed, Parallel, and Cluster Computing (cs.DC)","Distributed, Parallel, and Cluster Computing (cs.DC)"
1452,arXiv:2407.17312,Physical Adversarial Attack on Monocular Depth Estimation via Shape-Varying Patches,通过形状变化补丁对单眼深度估计的物理对抗攻击,"Chenxing Zhao, Yang Li, Shihao Wu, Wenyi Tan, Shuangju Zhou, Quan Pan",https://arxiv.org/pdf/2407.17312.pdf,"Subjects:
Computer Vision and Pattern Recognition (cs.CV)",Computer Vision and Pattern Recognition (cs.CV)
1453,arXiv:2407.17311,The Magnificent Seven Challenges and Opportunities in Domain-Specific Accelerator Design for Autonomous Systems,自主系统领域特定加速器设计的七大挑战和机遇,"Sabrina M. Neuman, Brian Plancher, Vijay Janapa Reddi",https://arxiv.org/pdf/2407.17311.pdf,"Subjects:
Hardware Architecture (cs.AR); Robotics (cs.RO); Systems and Control (eess.SY)","Hardware Architecture (cs.AR),  Robotics (cs.RO),  Systems and Control (eess.SY)"
1454,arXiv:2407.17310,LangOcc: Self-Supervised Open Vocabulary Occupancy Estimation via Volume Rendering,LangOcc：通过体绘制进行自我监督的开放词汇占用率估计,"Simon Boeder, Fabian Gigengack, Benjamin Risse",https://arxiv.org/pdf/2407.17310.pdf,"Subjects:
Computer Vision and Pattern Recognition (cs.CV)",Computer Vision and Pattern Recognition (cs.CV)
1455,arXiv:2407.17305,Continual Learning in Bio-plausible Spiking Neural Networks with Hebbian and Spike Timing Dependent Plasticity: A Survey and Perspective,具有Hebbian和Spike时间依赖可塑性的生物似然Spiking神经网络的连续学习：综述与展望,Ali Safa,https://arxiv.org/pdf/2407.17305.pdf,"Subjects:
Neural and Evolutionary Computing (cs.NE)",Neural and Evolutionary Computing (cs.NE)
1456,arXiv:2407.17303,MoveLight: Enhancing Traffic Signal Control through Movement-Centric Deep Reinforcement Learning,MoveLight：通过以运动为中心的深度强化学习增强交通信号控制,"Junqi Shao, Chenhao Zheng, Yuxuan Chen, Yucheng Huang, Rui Zhang",https://arxiv.org/pdf/2407.17303.pdf,"Subjects:
Machine Learning (cs.LG)",Machine Learning (cs.LG)
1457,arXiv:2407.17291,How Good (Or Bad) Are LLMs at Detecting Misleading Visualizations?,LLM在检测误导性视觉效果方面有多好（或有多差）？,"Leo Yu-Ho Lo, Huamin Qu",https://arxiv.org/pdf/2407.17291.pdf,"Subjects:
Human-Computer Interaction (cs.HC); Artificial Intelligence (cs.AI); Computation and Language (cs.CL); Computer Vision and Pattern Recognition (cs.CV)","Human-Computer Interaction (cs.HC),  Artificial Intelligence (cs.AI),  Computation and Language (cs.CL),  Computer Vision and Pattern Recognition (cs.CV)"
1458,arXiv:2407.17289,Static and Dynamic Verification of OCaml Programs: The Gospel Ecosystem (Extended Version),OCaml程序的静态和动态验证：福音生态系统（扩展版）,"Tiago Lopes Soares, Ion Chirica, Mário Pereira",https://arxiv.org/pdf/2407.17289.pdf,"Subjects:
Logic in Computer Science (cs.LO)",Logic in Computer Science (cs.LO)
1459,arXiv:2407.17287,Software Defined Vehicles for Development of Deterministic Services,用于开发确定性服务的软件定义工具,"Pedro Veloso Teixeira, Duarte Raposo, Rui Lopes, Susana Sargento",https://arxiv.org/pdf/2407.17287.pdf,"Subjects:
Distributed, Parallel, and Cluster Computing (cs.DC); Networking and Internet Architecture (cs.NI)","Distributed, Parallel, and Cluster Computing (cs.DC),  Networking and Internet Architecture (cs.NI)"
1460,arXiv:2407.17284,A Novel Two-Step Fine-Tuning Pipeline for Cold-Start Active Learning in Text Classification Tasks,一种用于文本分类任务冷启动主动学习的新型两步微调流水线,"Fabiano Belém, Washington Cunha, Celso França, Claudio Andrade, Leonardo Rocha, Marcos André Gonçalves",https://arxiv.org/pdf/2407.17284.pdf,"Subjects:
Machine Learning (cs.LG); Databases (cs.DB); Information Retrieval (cs.IR)","Machine Learning (cs.LG),  Databases (cs.DB),  Information Retrieval (cs.IR)"
1461,arXiv:2407.17277,From Data to Predictive Control: A Framework for Stochastic Linear Systems with Output Measurements,从数据到预测控制：具有输出测量的随机线性系统框架,"Haldun Balim, Andrea Carron, Melanie N. Zeilinger, Johannes Köhler",https://arxiv.org/pdf/2407.17277.pdf,"Subjects:
Systems and Control (eess.SY); Optimization and Control (math.OC)","Systems and Control (eess.SY),  Optimization and Control (math.OC)"
1462,arXiv:2407.17276,SoK: Bridging Trust into the Blockchain. A Systematic Review on On-Chain Identity,SoK：将信任连接到区块链。链上身份的系统评价,"Awid Vaziry, Kaustabh Barman, Patrick Herbke",https://arxiv.org/pdf/2407.17276.pdf,"Subjects:
Cryptography and Security (cs.CR); Computers and Society (cs.CY); Distributed, Parallel, and Cluster Computing (cs.DC)","Cryptography and Security (cs.CR),  Computers and Society (cs.CY),  Distributed, Parallel, and Cluster Computing (cs.DC)"
1463,arXiv:2407.17275,Reacting on human stubbornness in human-machine trajectory planning,人机轨迹规划中对人类固执的反应,"Julian Schneider, Niels Straky, Simon Meyer, Balint Varga, Sören Hohmann",https://arxiv.org/pdf/2407.17275.pdf,"Subjects:
Robotics (cs.RO); Systems and Control (eess.SY)","Robotics (cs.RO),  Systems and Control (eess.SY)"
1464,arXiv:2407.17274,Revolutionizing Text-to-Image Retrieval as Autoregressive Token-to-Voken Generation,将文本到图像检索作为Voken生成的自回归标记进行革命,"Yongqi Li, Hongru Cai, Wenjie Wang, Leigang Qu, Yinwei Wei, Wenjie Li, Liqiang Nie, Tat-Seng Chua",https://arxiv.org/pdf/2407.17274.pdf,"Subjects:
Multimedia (cs.MM); Artificial Intelligence (cs.AI); Computer Vision and Pattern Recognition (cs.CV)","Multimedia (cs.MM),  Artificial Intelligence (cs.AI),  Computer Vision and Pattern Recognition (cs.CV)"
1465,arXiv:2407.17273,Component Matching as a Graph Matching Problem,组件匹配作为一个图匹配问题,Suresh Kamath,https://arxiv.org/pdf/2407.17273.pdf,"Subjects:
Software Engineering (cs.SE)",Software Engineering (cs.SE)
1466,arXiv:2407.17272,DenseTrack: Drone-based Crowd Tracking via Density-aware Motion-appearance Synergy,DenseTrack：通过密度感知运动外观协同进行基于无人机的人群跟踪,"Yi Lei, Huilin Zhu, Jingling Yuan, Guangli Xiang, Xian Zhong, Shengfeng He",https://arxiv.org/pdf/2407.17272.pdf,"Subjects:
Computer Vision and Pattern Recognition (cs.CV)",Computer Vision and Pattern Recognition (cs.CV)
1467,arXiv:2407.17269,Advanced Penetration Testing for Enhancing 5G Security,增强5G安全的高级渗透测试,Shari-Ann Smith-Haynes,https://arxiv.org/pdf/2407.17269.pdf,"Subjects:
Cryptography and Security (cs.CR)",Cryptography and Security (cs.CR)
1468,arXiv:2407.17267,M4: Multi-Proxy Multi-Gate Mixture of Experts Network for Multiple Instance Learning in Histopathology Image Analysis,M4：用于组织病理学图像分析中多实例学习的多代理多门混合专家网络,"Junyu Li, Ye Zhang, Wen Shu, Xiaobing Feng, Yingchun Wang, Pengju Yan, Xiaolin Li, Chulin Sha, Min He",https://arxiv.org/pdf/2407.17267.pdf,"Subjects:
Computer Vision and Pattern Recognition (cs.CV)",Computer Vision and Pattern Recognition (cs.CV)
1469,arXiv:2407.17265,SCIsegV2: A Universal Tool for Segmentation of Intramedullary Lesions in Spinal Cord Injury,SCIsegV2：脊髓损伤髓内病变分割的通用工具,"Enamundram Naga Karthik, Jan Valošek, Lynn Farner, Dario Pfyffer, Simon Schading-Sassenhausen, Anna Lebret, Gergely David, Andrew C. Smith, Kenneth A. Weber II, Maryam Seif, RHSCIR Network Imaging Group, Patrick Freund, Julien Cohen-Adad",https://arxiv.org/pdf/2407.17265.pdf,"Subjects:
Computer Vision and Pattern Recognition (cs.CV); Artificial Intelligence (cs.AI)","Computer Vision and Pattern Recognition (cs.CV),  Artificial Intelligence (cs.AI)"
1470,arXiv:2407.17261,Embedding-Free Transformer with Inference Spatial Reduction for Efficient Semantic Segmentation,嵌入带有推理空间缩减的自由变换器以实现高效的语义分割,"Hyunwoo Yu, Yubin Cho, Beoungwoo Kang, Seunghun Moon, Kyeongbo Kong, Suk-Ju Kang",https://arxiv.org/pdf/2407.17261.pdf,"Subjects:
Computer Vision and Pattern Recognition (cs.CV)",Computer Vision and Pattern Recognition (cs.CV)
1471,arXiv:2407.17259,Spatial Conceptual Modeling: Anchoring Knowledge in the Real World,空间概念建模：将知识锚定在现实世界中,Hans-Georg Fill,https://arxiv.org/pdf/2407.17259.pdf,"Subjects:
Human-Computer Interaction (cs.HC)",Human-Computer Interaction (cs.HC)
1472,arXiv:2407.17258,A New Scalar Auxiliary Variable Approach for Gradient Flows,一种新的梯度流标量辅助变量方法,"Jinpeng Zhang, Xiaoping Wang",https://arxiv.org/pdf/2407.17258.pdf,"Subjects:
Numerical Analysis (math.NA)",Numerical Analysis (math.NA)
1473,arXiv:2407.17257,An MDP-Based Approach for Distribution System Control with PV Generation and Battery Storage,基于MDP的光伏发电和电池储能配电系统控制方法,"Robert Sosnowski, Marcin Baszynski, Charalambos Konstantinou",https://arxiv.org/pdf/2407.17257.pdf,"Subjects:
Systems and Control (eess.SY)",Systems and Control (eess.SY)
1474,arXiv:2407.17256,Critical Infrastructure Security: Penetration Testing and Exploit Development Perspectives,关键基础设施安全：渗透测试和开发前景,Papa Kobina Orleans-Bosomtwe,https://arxiv.org/pdf/2407.17256.pdf,"Subjects:
Cryptography and Security (cs.CR)",Cryptography and Security (cs.CR)
1475,arXiv:2407.17253,The impact of differences in facial features between real speakers and 3D face models on synthesized lip motions,真实说话者和3D人脸模型之间面部特征差异对合成嘴唇运动的影响,"Rabab Algadhy, Yoshihiko Gotoh, Steve Maddock",https://arxiv.org/pdf/2407.17253.pdf,"Subjects:
Graphics (cs.GR)",Graphics (cs.GR)
1476,arXiv:2407.17251,Applications of Dual Complex Adjoint Matrix in Eigenvalue Computation of Dual Quaternion Hermitian Matrix,对偶复伴随矩阵在对偶四元数厄米特矩阵特征值计算中的应用,"Yongjun Chen, Liping Zhang",https://arxiv.org/pdf/2407.17251.pdf,"Subjects:
Numerical Analysis (math.NA); Rings and Algebras (math.RA)","Numerical Analysis (math.NA),  Rings and Algebras (math.RA)"
1477,arXiv:2407.17246,Channel-Aware Low-Rank Adaptation in Time Series Forecasting,时间序列预测中的信道感知低秩自适应,"Tong Nie, Yuewen Mei, Guoyang Qin, Jian Sun, Wei Ma",https://arxiv.org/pdf/2407.17246.pdf,"Subjects:
Machine Learning (cs.LG)",Machine Learning (cs.LG)
1478,arXiv:2407.17240,Ranking Plausible Patches by Historic Feature Frequencies,按历史特征频率对合理补丁进行排名,"Shifat Sahariar Bhuiyan, Abhishek Tiwari, Yu Pei, Carlo A. Furia",https://arxiv.org/pdf/2407.17240.pdf,"Subjects:
Software Engineering (cs.SE)",Software Engineering (cs.SE)
1479,arXiv:2407.17238,Pretrained Visual Representations in Reinforcement Learning,强化学习中的预训练视觉表征,"Emlyn Williams, Athanasios Polydoros",https://arxiv.org/pdf/2407.17238.pdf,"Subjects:
Robotics (cs.RO); Machine Learning (cs.LG)","Robotics (cs.RO),  Machine Learning (cs.LG)"
1480,arXiv:2407.17234,Intent-guided Heterogeneous Graph Contrastive Learning for Recommendation,基于意图引导的异构图对比学习推荐,"Lei Sang, Yu Wang, Yi Zhang, Yiwen Zhang, Xindong Wu",https://arxiv.org/pdf/2407.17234.pdf,"Subjects:
Information Retrieval (cs.IR)",Information Retrieval (cs.IR)
1481,arXiv:2407.17230,Improving ICD coding using Chapter based Named Entities and Attentional Models,使用基于章节的命名实体和注意模型改进ICD编码,"Abhijith R. Beeravolu, Mirjam Jonkman, Sami Azam, Friso De Boer",https://arxiv.org/pdf/2407.17230.pdf,"Subjects:
Computation and Language (cs.CL); Artificial Intelligence (cs.AI)","Computation and Language (cs.CL),  Artificial Intelligence (cs.AI)"
1482,arXiv:2407.17229,LPGen: Enhancing High-Fidelity Landscape Painting Generation through Diffusion Model,LPGen：通过扩散模型增强高保真风景画的生成,"Wanggong Yang, Xiaona Wang, Yingrui Qiu, Yifei Zhao",https://arxiv.org/pdf/2407.17229.pdf,"Subjects:
Computer Vision and Pattern Recognition (cs.CV)",Computer Vision and Pattern Recognition (cs.CV)
1483,arXiv:2407.17227,LEAN-GitHub: Compiling GitHub LEAN repositories for a versatile LEAN prover,LEAN GitHub：为多功能LEAN证明者编译GitHub LEAN存储库,"Zijian Wu, Jiayu Wang, Dahua Lin, Kai Chen",https://arxiv.org/pdf/2407.17227.pdf,"Subjects:
Artificial Intelligence (cs.AI); Computation and Language (cs.CL)","Artificial Intelligence (cs.AI),  Computation and Language (cs.CL)"
1484,arXiv:2407.17226,Sublinear Regret for An Actor-Critic Algorithm in Continuous-Time Linear-Quadratic Reinforcement Learning,连续时间线性二次强化学习中行为体批评算法的次线性回归,"Yilie Huang, Yanwei Jia, Xun Yu Zhou",https://arxiv.org/pdf/2407.17226.pdf,"Subjects:
Machine Learning (cs.LG); Artificial Intelligence (cs.AI)","Machine Learning (cs.LG),  Artificial Intelligence (cs.AI)"
1485,arXiv:2407.17219,Graph Neural Networks: A suitable Alternative to MLPs in Latent 3D Medical Image Classification?,图神经网络：潜在3D医学图像分类中MLP的合适替代方案？,"Johannes Kiechle, Daniel M. Lang, Stefan M. Fischer, Lina Felsner, Jan C. Peeken, Julia A. Schnabel",https://arxiv.org/pdf/2407.17219.pdf,"Subjects:
Computer Vision and Pattern Recognition (cs.CV)",Computer Vision and Pattern Recognition (cs.CV)
1486,arXiv:2407.17215,Formalizing UML State Machines for Automated Verification -- A Survey,UML状态机形式化用于自动验证——综述,"Étienne André, Shuang Liu, Yang Liu, Christine Choppy, Jun Sun, Jin Song Dong",https://arxiv.org/pdf/2407.17215.pdf,"Subjects:
Software Engineering (cs.SE); Logic in Computer Science (cs.LO)","Software Engineering (cs.SE),  Logic in Computer Science (cs.LO)"
1487,arXiv:2407.17213,Spectrum-Informed Multistage Neural Networks: Multiscale Function Approximators of Machine Precision,基于频谱的多级神经网络：机器精度的多尺度函数逼近器,"Jakin Ng, Yongji Wang, Ching-Yao Lai",https://arxiv.org/pdf/2407.17213.pdf,"Subjects:
Machine Learning (cs.LG)",Machine Learning (cs.LG)
1488,arXiv:2407.17211,Testing Large Language Models on Driving Theory Knowledge and Skills for Connected Autonomous Vehicles,互联自动驾驶汽车驾驶理论知识和技能的大型语言模型测试,"Zuoyin Tang, Jianhua He, Dashuai Pei, Kezhong Liu, Tao Gao",https://arxiv.org/pdf/2407.17211.pdf,"Subjects:
Artificial Intelligence (cs.AI); Networking and Internet Architecture (cs.NI); Robotics (cs.RO)","Artificial Intelligence (cs.AI),  Networking and Internet Architecture (cs.NI),  Robotics (cs.RO)"
1489,arXiv:2407.17209,Nonverbal Immediacy Analysis in Education: A Multimodal Computational Model,教育中的非言语即时性分析：一个多模态计算模型,"Uroš Petković, Jonas Frenkel, Olaf Hellwich, Rebecca Lazarides",https://arxiv.org/pdf/2407.17209.pdf,"Subjects:
Computer Vision and Pattern Recognition (cs.CV); Artificial Intelligence (cs.AI); Human-Computer Interaction (cs.HC); Machine Learning (cs.LG)","Computer Vision and Pattern Recognition (cs.CV),  Artificial Intelligence (cs.AI),  Human-Computer Interaction (cs.HC),  Machine Learning (cs.LG)"
1490,arXiv:2407.17208,Simple Grid Polygon Online Exploration Revisited,简单网格多边形在线探索再探,"Maximilian Brock, Martin Brückmann, Elmar Langetepe, Raphael Wude",https://arxiv.org/pdf/2407.17208.pdf,"Subjects:
Computational Geometry (cs.CG); Data Structures and Algorithms (cs.DS)","Computational Geometry (cs.CG),  Data Structures and Algorithms (cs.DS)"
1491,arXiv:2407.17206,Take a Step and Reconsider: Sequence Decoding for Self-Improved Neural Combinatorial Optimization,迈出一步，重新思考：自改进神经组合优化的序列解码,"Jonathan Pirnay, Dominik G. Grimm",https://arxiv.org/pdf/2407.17206.pdf,"Subjects:
Machine Learning (cs.LG); Artificial Intelligence (cs.AI)","Machine Learning (cs.LG),  Artificial Intelligence (cs.AI)"
1492,arXiv:2407.17205,The Sketchfab 3D Creative Commons Collection (S3D3C),Sketchfab 3D知识共享合集（S3D3C）,"Florian Spiess, Raphael Waltenspül, Heiko Schuldt",https://arxiv.org/pdf/2407.17205.pdf,"Subjects:
Multimedia (cs.MM)",Multimedia (cs.MM)
1493,arXiv:2407.17201,MoULDyS: Monitoring of Autonomous Systems in the Presence of Uncertainties,MoULDyS：在存在不确定性的情况下对自主系统的监控,"Bineet Ghosh, Étienne André",https://arxiv.org/pdf/2407.17201.pdf,"Subjects:
Systems and Control (eess.SY)",Systems and Control (eess.SY)
1494,arXiv:2407.17197,ALPI: Auto-Labeller with Proxy Injection for 3D Object Detection using 2D Labels Only,ALPI：仅使用2D标签进行3D对象检测的代理注入自动贴标机,"Saad Lahlali, Nicolas Granger, Hervé Le Borgne, Quoc-Cuong Pham",https://arxiv.org/pdf/2407.17197.pdf,"Subjects:
Computer Vision and Pattern Recognition (cs.CV); Artificial Intelligence (cs.AI)","Computer Vision and Pattern Recognition (cs.CV),  Artificial Intelligence (cs.AI)"
1495,arXiv:2407.17193,Unpaired Photo-realistic Image Deraining with Energy-informed Diffusion Model,基于能量信息扩散模型的无遮挡照片真实感图像去噪,"Yuanbo Wen, Tao Gao, Ting Chen",https://arxiv.org/pdf/2407.17193.pdf,"Subjects:
Computer Vision and Pattern Recognition (cs.CV)",Computer Vision and Pattern Recognition (cs.CV)
1496,arXiv:2407.17190,Fusing LLMs and KGs for Formal Causal Reasoning behind Financial Risk Contagion,将LLMs和KG融合起来，进行金融风险传染背后的形式因果推理,"Guanyuan Yu, Xv Wang, Qing Li, Yu Zhao",https://arxiv.org/pdf/2407.17190.pdf,"Subjects:
Computational Engineering, Finance, and Science (cs.CE)","Computational Engineering, Finance, and Science (cs.CE)"
1497,arXiv:2407.17186,Semantic Vehicle-to-Everything (V2X) Communications Towards 6G,面向6G的语义车到万物（V2X）通信,"Tengfei Lyu, Md. Noor-A-Rahim, Aisling O'Driscoll, Dirk Pesch",https://arxiv.org/pdf/2407.17186.pdf,"Subjects:
Networking and Internet Architecture (cs.NI)",Networking and Internet Architecture (cs.NI)
1498,arXiv:2407.17183,Robust Point Cloud Registration in Robotic Inspection with Locally Consistent Gaussian Mixture Model,基于局部一致高斯混合模型的机器人检测鲁棒点云配准,"Lingjie Su, Wei Xu, Wenlong Li",https://arxiv.org/pdf/2407.17183.pdf,"Subjects:
Robotics (cs.RO)",Robotics (cs.RO)
1499,arXiv:2407.17182,Solving the Electrical Impedance Tomography Problem with a DeepONet Type Neural Network: Theory and Application,用DeepONet型神经网络解决电阻抗断层成像问题：理论与应用,"Anuj Abhishek, Thilo Strauss",https://arxiv.org/pdf/2407.17182.pdf,"Subjects:
Machine Learning (cs.LG)",Machine Learning (cs.LG)
1500,arXiv:2407.17174,NarrationDep: Narratives on Social Media For Automatic Depression Detection,叙述描述：社交媒体上的叙述用于自动抑郁检测,"Hamad Zogan, Imran Razzak, Shoaib Jameel, Guandong Xu",https://arxiv.org/pdf/2407.17174.pdf,"Subjects:
Computation and Language (cs.CL); Machine Learning (cs.LG)","Computation and Language (cs.CL),  Machine Learning (cs.LG)"
1501,arXiv:2407.17172,Speech Editing -- a Summary,语音编辑综述,"Tobias Kässmann, Yining Liu, Danni Liu",https://arxiv.org/pdf/2407.17172.pdf,"Subjects:
Sound (cs.SD); Computation and Language (cs.CL); Audio and Speech Processing (eess.AS)","Sound (cs.SD),  Computation and Language (cs.CL),  Audio and Speech Processing (eess.AS)"
1502,arXiv:2407.17171,Deep Learning Reduced Order Modelling on Parametric and Data driven domains,参数化和数据驱动领域的深度学习降阶建模,"Martina Bukač (1), Iva Manojlović (2), Boris Muha (3), Domagoj Vlah (2) ((1) University of Notre Dame, Notre Dame, IN, (2) University of Zagreb Faculty of Electrical Engineering and Computing, (3) Department of Mathematics, Faculty of Science, University of Zagreb)",https://arxiv.org/pdf/2407.17171.pdf,"Subjects:
Numerical Analysis (math.NA)",Numerical Analysis (math.NA)
1503,arXiv:2407.17170,Domain Generalized Recaptured Screen Image Identification Using SWIN Transformer,基于SWIN变换的域广义重捕获屏幕图像识别,"Preeti Mehta, Aman Sagar, Suchi Kumari",https://arxiv.org/pdf/2407.17170.pdf,"Subjects:
Computer Vision and Pattern Recognition (cs.CV)",Computer Vision and Pattern Recognition (cs.CV)
1504,arXiv:2407.17169,KnowTD-An Actionable Knowledge Representation System for Thermodynamics,KnowTD——一个可操作的热力学知识表示系统,"Luisa Vollmer, Sophie Fellenz, Fabian Jirasek, Heike Leitte, Hans Hasse",https://arxiv.org/pdf/2407.17169.pdf,"Subjects:
Computational Engineering, Finance, and Science (cs.CE)","Computational Engineering, Finance, and Science (cs.CE)"
