Unnamed: 0,id,title,title_zh,authors,url,subjects,subject_split
188,arXiv:2409.19051,Multimodal Markup Document Models for Graphic Design Completion,用于平面设计完成的多模态标记文档模型,"Kotaro Kikuchi, Naoto Inoue, Mayu Otani, Edgar Simo-Serra, Kota Yamaguchi",https://arxiv.org/pdf/2409.19051.pdf,"Subjects:
Computer Vision and Pattern Recognition (cs.CV); Artificial Intelligence (cs.AI); Multimedia (cs.MM)","Computer Vision and Pattern Recognition (cs.CV),  Artificial Intelligence (cs.AI),  Multimedia (cs.MM)"
189,arXiv:2409.19044,On the Inductive Bias of Stacking Towards Improving Reasoning,论堆叠对提高推理能力的归纳偏见,"Nikunj Saunshi, Stefani Karp, Shankar Krishnan, Sobhan Miryoosefi, Sashank J. Reddi, Sanjiv Kumar",https://arxiv.org/pdf/2409.19044.pdf,"Subjects:
Computation and Language (cs.CL); Artificial Intelligence (cs.AI); Machine Learning (cs.LG)","Computation and Language (cs.CL),  Artificial Intelligence (cs.AI),  Machine Learning (cs.LG)"
190,arXiv:2409.19039,Gaussian Heritage: 3D Digitization of Cultural Heritage with Integrated Object Segmentation,高斯遗产：集成对象分割的文化遗产三维数字化,"Mahtab Dahaghin, Myrna Castillo, Kourosh Riahidehkordi, Matteo Toso, Alessio Del Bue",https://arxiv.org/pdf/2409.19039.pdf,"Subjects:
Computer Vision and Pattern Recognition (cs.CV)",Computer Vision and Pattern Recognition (cs.CV)
191,arXiv:2409.19038,"Intention-aware policy graphs: answering what, how, and why in opaque agents",意图感知策略图：在不透明代理中回答什么、如何以及为什么,"Victor Gimenez-Abalos, Sergio Alvarez-Napagao, Adrian Tormos, Ulises Cortés, Javier Vázquez-Salceda",https://arxiv.org/pdf/2409.19038.pdf,"Subjects:
Artificial Intelligence (cs.AI); Machine Learning (cs.LG); Multiagent Systems (cs.MA); Robotics (cs.RO)","Artificial Intelligence (cs.AI),  Machine Learning (cs.LG),  Multiagent Systems (cs.MA),  Robotics (cs.RO)"
192,arXiv:2409.19037,Self-Replicating Mechanical Universal Turing Machine,自复制机械通用图灵机,Ralph P. Lano,https://arxiv.org/pdf/2409.19037.pdf,"Subjects:
Formal Languages and Automata Theory (cs.FL); Computation and Language (cs.CL)","Formal Languages and Automata Theory (cs.FL),  Computation and Language (cs.CL)"
193,arXiv:2409.19032,A Systematisation of Knowledge: Connecting European Digital Identities with Web3,知识的系统化：将欧洲数字身份与Web3联系起来,"Ben Biedermann, Matthew Scerri, Victoria Kozlova, Joshua Ellul",https://arxiv.org/pdf/2409.19032.pdf,"Subjects:
Cryptography and Security (cs.CR); Distributed, Parallel, and Cluster Computing (cs.DC)","Cryptography and Security (cs.CR),  Distributed, Parallel, and Cluster Computing (cs.DC)"
194,arXiv:2409.19029,Enhancing Productivity with AI During the Development of an ISMS: Case Kempower,在ISMS开发过程中利用人工智能提高生产力：案例Kempower,"Atro Niemeläinen, Muhammad Waseem, Tommi Mikkonen",https://arxiv.org/pdf/2409.19029.pdf,"Subjects:
Cryptography and Security (cs.CR); Software Engineering (cs.SE)","Cryptography and Security (cs.CR),  Software Engineering (cs.SE)"
195,arXiv:2409.19028,Exploring LLM-Driven Explanations for Quantum Algorithms,探索LLM驱动的量子算法解释,"Giordano d'Aloisio, Sophie Fortz, Carol Hanna, Daniel Fortunato, Avner Bensoussan, Eñaut Mendiluze Usandizaga, Federica Sarro",https://arxiv.org/pdf/2409.19028.pdf,"Subjects:
Computation and Language (cs.CL); Software Engineering (cs.SE); Quantum Physics (quant-ph)","Computation and Language (cs.CL),  Software Engineering (cs.SE),  Quantum Physics (quant-ph)"
196,arXiv:2409.19027,Code Generation and Algorithmic Problem Solving Using Llama 3.1 405B,使用Llama 3.1 405B进行代码生成和算法问题求解,"Aniket Deroy, Subhankar Maity",https://arxiv.org/pdf/2409.19027.pdf,"Subjects:
Computation and Language (cs.CL); Software Engineering (cs.SE)","Computation and Language (cs.CL),  Software Engineering (cs.SE)"
197,arXiv:2409.19025,Dealing with Controversy: An Emotion and Coping Strategy Corpus Based on Role Playing,应对争议：基于角色扮演的情绪与应对策略语料库,"Enrica Troiano, Sofie Labat, Marco Antonio Stranisci, Viviana Patti, Rossana Damiano, Roman Klinger",https://arxiv.org/pdf/2409.19025.pdf,"Subjects:
Computation and Language (cs.CL)",Computation and Language (cs.CL)
198,arXiv:2409.19024,Elephant in the Room: Unveiling the Impact of Reward Model Quality in Alignment,房间里的大象：揭示薪酬模型质量对一致性的影响,"Yan Liu, Xiaoyuan Yi, Xiaokang Chen, Jing Yao, Jingwei Yi, Daoguang Zan, Zheng Liu, Xing Xie, Tsung-Yi Ho",https://arxiv.org/pdf/2409.19024.pdf,"Subjects:
Computation and Language (cs.CL); Artificial Intelligence (cs.AI)","Computation and Language (cs.CL),  Artificial Intelligence (cs.AI)"
199,arXiv:2409.19022,Application of AI-based Models for Online Fraud Detection and Analysis,基于人工智能的网络欺诈检测与分析模型的应用,"Antonis Papasavva, Shane Johnson, Ed Lowther, Samantha Lundrigan, Enrico Mariconti, Anna Markovska, Nilufer Tuptuk",https://arxiv.org/pdf/2409.19022.pdf,"Subjects:
Computation and Language (cs.CL); Artificial Intelligence (cs.AI); Machine Learning (cs.LG)","Computation and Language (cs.CL),  Artificial Intelligence (cs.AI),  Machine Learning (cs.LG)"
200,arXiv:2409.19020,DiaSynth -- Synthetic Dialogue Generation Framework,DiaSynth——综合对话生成框架,"Sathya Krishnan Suresh, Wu Mengjun, Tushar Pranav, Eng Siong Chng",https://arxiv.org/pdf/2409.19020.pdf,"Subjects:
Computation and Language (cs.CL); Machine Learning (cs.LG)","Computation and Language (cs.CL),  Machine Learning (cs.LG)"
201,arXiv:2409.19019,RAGProbe: An Automated Approach for Evaluating RAG Applications,RAGProbe：一种评估RAG应用的自动化方法,"Shangeetha Sivasothy, Scott Barnett, Stefanus Kurniawan, Zafaryab Rasool, Rajesh Vasa",https://arxiv.org/pdf/2409.19019.pdf,"Subjects:
Computation and Language (cs.CL); Machine Learning (cs.LG)","Computation and Language (cs.CL),  Machine Learning (cs.LG)"
202,arXiv:2409.19015,Textless NLP -- Zero Resource Challenge with Low Resource Compute,无文本NLP——低资源计算的零资源挑战,"Krithiga Ramadass, Abrit Pal Singh, Srihari J, Sheetal Kalyani",https://arxiv.org/pdf/2409.19015.pdf,"Subjects:
Computation and Language (cs.CL); Artificial Intelligence (cs.AI); Machine Learning (cs.LG); Sound (cs.SD); Audio and Speech Processing (eess.AS)","Computation and Language (cs.CL),  Artificial Intelligence (cs.AI),  Machine Learning (cs.LG),  Sound (cs.SD),  Audio and Speech Processing (eess.AS)"
203,arXiv:2409.19014,FLEX: Expert-level False-Less EXecution Metric for Reliable Text-to-SQL Benchmark,FLEX：用于可靠文本到SQL基准测试的专家级少假执行度量,"Heegyu Kim, Taeyang Jeon, Seunghwan Choi, Seungtaek Choi, Hyunsouk Cho",https://arxiv.org/pdf/2409.19014.pdf,"Subjects:
Computation and Language (cs.CL); Information Retrieval (cs.IR); Machine Learning (cs.LG)","Computation and Language (cs.CL),  Information Retrieval (cs.IR),  Machine Learning (cs.LG)"
204,arXiv:2409.19013,Improving Academic Skills Assessment with NLP and Ensemble Learning,用NLP和集成学习提高学术技能评估,"Zhengpei Cheng, Yingyi Wu, Danyang Zhang, Jiacheng Hu, Yujian Long",https://arxiv.org/pdf/2409.19013.pdf,"Subjects:
Computation and Language (cs.CL); Artificial Intelligence (cs.AI); Computers and Society (cs.CY); Machine Learning (cs.LG)","Computation and Language (cs.CL),  Artificial Intelligence (cs.AI),  Computers and Society (cs.CY),  Machine Learning (cs.LG)"
205,arXiv:2409.19012,Lost in the Logic: An Evaluation of Large Language Models' Reasoning Capabilities on LSAT Logic Games,迷失在逻辑中：大型语言模型在LSAT逻辑游戏中的推理能力评估,Saumya Malik,https://arxiv.org/pdf/2409.19012.pdf,"Subjects:
Computation and Language (cs.CL); Artificial Intelligence (cs.AI)","Computation and Language (cs.CL),  Artificial Intelligence (cs.AI)"
206,arXiv:2409.19010,"A comprehensive study of on-device NLP applications -- VQA, automated Form filling, Smart Replies for Linguistic Codeswitching",设备上NLP应用的全面研究——VQA、自动表单填写、语言代码转换的智能回复,Naman Goyal,https://arxiv.org/pdf/2409.19010.pdf,"Subjects:
Computation and Language (cs.CL); Artificial Intelligence (cs.AI); Machine Learning (cs.LG)","Computation and Language (cs.CL),  Artificial Intelligence (cs.AI),  Machine Learning (cs.LG)"
207,arXiv:2409.19007,Rephrase and Contrast: Fine-Tuning Language Models for Enhanced Understanding of Communication and Computer Networks,改写与对比：微调语言模型以增强对通信和计算机网络的理解,"Liujianfu Wang, Yuyang Du, Jingqi Lin, Kexin Chen, Soung Chang Liew",https://arxiv.org/pdf/2409.19007.pdf,"Subjects:
Computation and Language (cs.CL)",Computation and Language (cs.CL)
208,arXiv:2409.19006,Towards Automated Patent Workflows: AI-Orchestrated Multi-Agent Framework for Intellectual Property Management and Analysis,迈向自动化专利工作流程：用于知识产权管理和分析的人工智能编排多代理框架,"Sakhinana Sagar Srinivas, Vijay Sri Vaikunth, Venkataramana Runkana",https://arxiv.org/pdf/2409.19006.pdf,"Subjects:
Computation and Language (cs.CL); Artificial Intelligence (cs.AI); Machine Learning (cs.LG)","Computation and Language (cs.CL),  Artificial Intelligence (cs.AI),  Machine Learning (cs.LG)"
209,arXiv:2409.19005,"What is a Digital Twin Anyway? Deriving the Definition for the Built Environment from over 15,000 Scientific Publications",什么是数字孪生？从15000多篇科学出版物中得出建筑环境的定义,"Mahmoud Abdelrahman, Edgardo Macatulad, Binyu Lei, Matias Quintana, Clayton Miller, Filip Biljecki",https://arxiv.org/pdf/2409.19005.pdf,"Subjects:
Computation and Language (cs.CL)",Computation and Language (cs.CL)
210,arXiv:2409.19001,Pay Attention to What Matters,注意重要的事情,"Pedro Luiz Silva, Antonio de Domenico, Ali Maatouk, Fadhel Ayed",https://arxiv.org/pdf/2409.19001.pdf,"Subjects:
Computation and Language (cs.CL); Artificial Intelligence (cs.AI)","Computation and Language (cs.CL),  Artificial Intelligence (cs.AI)"
211,arXiv:2409.18999,Enhancing TinyBERT for Financial Sentiment Analysis Using GPT-Augmented FinBERT Distillation,使用GPT增强FinBERT蒸馏增强TinyBERT进行金融情绪分析,Graison Jos Thomas,https://arxiv.org/pdf/2409.18999.pdf,"Subjects:
Computation and Language (cs.CL); Machine Learning (cs.LG)","Computation and Language (cs.CL),  Machine Learning (cs.LG)"
212,arXiv:2409.18998,Controlled LLM-based Reasoning for Clinical Trial Retrieval,基于LLM的临床试验检索推理,"Mael Jullien, Alex Bogatu, Harriet Unsworth, Andre Freitas",https://arxiv.org/pdf/2409.18998.pdf,"Subjects:
Computation and Language (cs.CL); Artificial Intelligence (cs.AI)","Computation and Language (cs.CL),  Artificial Intelligence (cs.AI)"
213,arXiv:2409.18997,"PropaInsight: Toward Deeper Understanding of Propaganda in Terms of Techniques, Appeals, and Intent",PropaInsight：从技术、诉求和意图的角度更深入地理解宣传,"Jiateng Liu, Lin Ai, Zizhou Liu, Payam Karisani, Zheng Hui, May Fung, Preslav Nakov, Julia Hirschberg, Heng Ji",https://arxiv.org/pdf/2409.18997.pdf,"Subjects:
Computation and Language (cs.CL); Artificial Intelligence (cs.AI); Social and Information Networks (cs.SI)","Computation and Language (cs.CL),  Artificial Intelligence (cs.AI),  Social and Information Networks (cs.SI)"
214,arXiv:2409.18996,From Linguistic Giants to Sensory Maestros: A Survey on Cross-Modal Reasoning with Large Language Models,从语言巨人到感官大师：大型语言模型的跨模态推理研究综述,"Shengsheng Qian, Zuyi Zhou, Dizhan Xue, Bing Wang, Changsheng Xu",https://arxiv.org/pdf/2409.18996.pdf,"Subjects:
Computation and Language (cs.CL); Artificial Intelligence (cs.AI); Computer Vision and Pattern Recognition (cs.CV); Machine Learning (cs.LG); Multimedia (cs.MM)","Computation and Language (cs.CL),  Artificial Intelligence (cs.AI),  Computer Vision and Pattern Recognition (cs.CV),  Machine Learning (cs.LG),  Multimedia (cs.MM)"
215,arXiv:2409.18995,Systematic Characterization of the Effectiveness of Alignment in Large Language Models for Categorical Decisions,大语言分类决策模型中对齐有效性的系统表征,Isaac Kohane,https://arxiv.org/pdf/2409.18995.pdf,"Subjects:
Computation and Language (cs.CL); Artificial Intelligence (cs.AI)","Computation and Language (cs.CL),  Artificial Intelligence (cs.AI)"
216,arXiv:2409.18992,A Review of Mechanistic Models of Event Comprehension,事件理解的力学模型综述,Tan T. Nguyen,https://arxiv.org/pdf/2409.18992.pdf,"Subjects:
Computation and Language (cs.CL); Artificial Intelligence (cs.AI); Computer Vision and Pattern Recognition (cs.CV)","Computation and Language (cs.CL),  Artificial Intelligence (cs.AI),  Computer Vision and Pattern Recognition (cs.CV)"
217,arXiv:2409.18991,Surveying the MLLM Landscape: A Meta-Review of Current Surveys,MLLM景观调查：当前调查的元综述,"Ming Li, Keyu Chen, Ziqian Bi, Ming Liu, Benji Peng, Qian Niu, Junyu Liu, Jinlang Wang, Sen Zhang, Xuanhe Pan, Jiawei Xu, Pohsun Feng",https://arxiv.org/pdf/2409.18991.pdf,"Subjects:
Computation and Language (cs.CL)",Computation and Language (cs.CL)
218,arXiv:2409.18989,SC-Phi2: A Fine-tuned Small Language Model for StarCraft II Macromanagement Tasks,SC-Phi2：《星际争霸II》宏观管理任务的微调小语言模型,"Muhammad Junaid Khan, Gita Sukthankar",https://arxiv.org/pdf/2409.18989.pdf,"Subjects:
Computation and Language (cs.CL); Artificial Intelligence (cs.AI)","Computation and Language (cs.CL),  Artificial Intelligence (cs.AI)"
219,arXiv:2409.18988,A Unified Framework to Classify Business Activities into International Standard Industrial Classification through Large Language Models for Circular Economy,通过循环经济大语言模型将商业活动分类为国际标准行业分类的统一框架,"Xiang Li, Lan Zhao, Junhao Ren, Yajuan Sun, Chuan Fu Tan, Zhiquan Yeo, Gaoxi Xiao",https://arxiv.org/pdf/2409.18988.pdf,"Subjects:
Computation and Language (cs.CL); Artificial Intelligence (cs.AI); General Economics (econ.GN)","Computation and Language (cs.CL),  Artificial Intelligence (cs.AI),  General Economics (econ.GN)"
220,arXiv:2409.18987,Efficient and Personalized Mobile Health Event Prediction via Small Language Models,基于小语言模型的高效个性化移动健康事件预测,"Xin Wang, Ting Dang, Vassilis Kostakos, Hong Jia",https://arxiv.org/pdf/2409.18987.pdf,"Subjects:
Computation and Language (cs.CL); Artificial Intelligence (cs.AI); Computers and Society (cs.CY); Machine Learning (cs.LG)","Computation and Language (cs.CL),  Artificial Intelligence (cs.AI),  Computers and Society (cs.CY),  Machine Learning (cs.LG)"
221,arXiv:2409.18986,Lab-AI -- Retrieval-Augmented Language Model for Personalized Lab Test Interpretation in Clinical Medicine,Lab AI——用于临床医学个性化实验室测试解释的检索增强语言模型,"Xiaoyu Wang, Haoyong Ouyang, Balu Bhasuran, Xiao Luo, Karim Hanna, Mia Liza A. Lustria, Zhe He",https://arxiv.org/pdf/2409.18986.pdf,"Subjects:
Computation and Language (cs.CL); Artificial Intelligence (cs.AI); Information Retrieval (cs.IR)","Computation and Language (cs.CL),  Artificial Intelligence (cs.AI),  Information Retrieval (cs.IR)"
222,arXiv:2409.18984,Harnessing Large Language Models: Fine-tuned BERT for Detecting Charismatic Leadership Tactics in Natural Language,利用大型语言模型：微调BERT以检测自然语言中的魅力型领导策略,"Yasser Saeid, Felix Neubürger, Stefanie Krügl, Helena Hüster, Thomas Kopinski, Ralf Lanwehr",https://arxiv.org/pdf/2409.18984.pdf,"Subjects:
Computation and Language (cs.CL); Artificial Intelligence (cs.AI); Machine Learning (cs.LG)","Computation and Language (cs.CL),  Artificial Intelligence (cs.AI),  Machine Learning (cs.LG)"
223,arXiv:2409.18982,Aligning Robot Navigation Behaviors with Human Intentions and Preferences,使机器人导航行为与人类意图和偏好相一致,Haresh Karnan,https://arxiv.org/pdf/2409.18982.pdf,"Subjects:
Robotics (cs.RO); Artificial Intelligence (cs.AI); Machine Learning (cs.LG)","Robotics (cs.RO),  Artificial Intelligence (cs.AI),  Machine Learning (cs.LG)"
224,arXiv:2409.18980,IW-Bench: Evaluating Large Multimodal Models for Converting Image-to-Web,IW Bench：评估用于将图像转换为网络的大型多模态模型,"Hongcheng Guo, Wei Zhang, Junhao Chen, Yaonan Gu, Jian Yang, Junjia Du, Binyuan Hui, Tianyu Liu, Jianxin Ma, Chang Zhou, Zhoujun Li",https://arxiv.org/pdf/2409.18980.pdf,"Subjects:
Computation and Language (cs.CL); Artificial Intelligence (cs.AI); Computer Vision and Pattern Recognition (cs.CV)","Computation and Language (cs.CL),  Artificial Intelligence (cs.AI),  Computer Vision and Pattern Recognition (cs.CV)"
225,arXiv:2409.18978,Pronoun Logic,Pronoun逻辑,"Rose Bohrer, Ashe Neth",https://arxiv.org/pdf/2409.18978.pdf,"Subjects:
Computation and Language (cs.CL)",Computation and Language (cs.CL)
226,arXiv:2409.18977,Dynamic Pricing based Near-Optimal Resource Allocation for Elastic Edge Offloading,基于动态定价的弹性边缘卸载的近最优资源分配,"Yun Xia, Hai Xue, Di Zhang, Shahid Mumtaz, Xiaolong Xu, Joel J. P. C. Rodrigues",https://arxiv.org/pdf/2409.18977.pdf,"Subjects:
Networking and Internet Architecture (cs.NI); Computer Science and Game Theory (cs.GT)","Networking and Internet Architecture (cs.NI),  Computer Science and Game Theory (cs.GT)"
227,arXiv:2409.18976,Prioritizing Risk Factors in Media Entrepreneurship on Social Networks: Hybrid Fuzzy Z-Number Approaches for Strategic Budget Allocation and Risk Management in Advertising Construction Campaigns,社交网络媒体创业风险因素的优先排序：广告建设活动战略预算分配和风险管理的混合模糊Z数方法,"Ahmad Gholizadeh Lonbar, Hamidreza Hasanzadeh, Fahimeh Asgari, Hajar Kazemi Naeini, Roya Shomali, Saeed Asadi",https://arxiv.org/pdf/2409.18976.pdf,"Subjects:
Computers and Society (cs.CY); Social and Information Networks (cs.SI)","Computers and Society (cs.CY),  Social and Information Networks (cs.SI)"
228,arXiv:2409.18974,Neural Product Importance Sampling via Warp Composition,通过经纱成分进行神经产品重要性抽样,"Joey Litalien, Miloš Hašan, Fujun Luan, Krishna Mullia, Iliyan Georgiev",https://arxiv.org/pdf/2409.18974.pdf,"Subjects:
Computer Vision and Pattern Recognition (cs.CV); Graphics (cs.GR)","Computer Vision and Pattern Recognition (cs.CV),  Graphics (cs.GR)"
229,arXiv:2409.18972,Instance Configuration for Sustainable Job Shop Scheduling,可持续作业车间调度的实例配置,"Christian Perez, Carlos March, Miguel A. Salido",https://arxiv.org/pdf/2409.18972.pdf,"Subjects:
Distributed, Parallel, and Cluster Computing (cs.DC); Optimization and Control (math.OC)","Distributed, Parallel, and Cluster Computing (cs.DC),  Optimization and Control (math.OC)"
230,arXiv:2409.18971,Early Joint Learning of Emotion Information Makes MultiModal Model Understand You Better,情感信息的早期联合学习使多模态模型更好地理解你,"Mengying Ge, Mingyang Li, Dongkai Tang, Pengbo Li, Kuo Liu, Shuhao Deng, Songbai Pu, Long Liu, Yang Song, Tao Zhang",https://arxiv.org/pdf/2409.18971.pdf,"Subjects:
Multimedia (cs.MM); Artificial Intelligence (cs.AI); Sound (cs.SD); Audio and Speech Processing (eess.AS)","Multimedia (cs.MM),  Artificial Intelligence (cs.AI),  Sound (cs.SD),  Audio and Speech Processing (eess.AS)"
231,arXiv:2409.18969,Integrating SPARQL and LLMs for Question Answering over Scholarly Data Sources,集成SPARQL和LLM，用于学术数据源的问答,"Fomubad Borista Fondi, Azanzi Jiomekong Fidel",https://arxiv.org/pdf/2409.18969.pdf,"Subjects:
Information Retrieval (cs.IR); Artificial Intelligence (cs.AI)","Information Retrieval (cs.IR),  Artificial Intelligence (cs.AI)"
232,arXiv:2409.18968,Safety challenges of AI in medicine,人工智能在医学中的安全挑战,"Xiaoye Wang, Nicole Xi Zhang, Hongyu He, Trang Nguyen, Kun-Hsing Yu, Hao Deng, Cynthia Brandt, Danielle S. Bitterman, Ling Pan, Ching-Yu Cheng, James Zou, Dianbo Liu",https://arxiv.org/pdf/2409.18968.pdf,"Subjects:
Computers and Society (cs.CY); Artificial Intelligence (cs.AI); Machine Learning (cs.LG)","Computers and Society (cs.CY),  Artificial Intelligence (cs.AI),  Machine Learning (cs.LG)"
233,arXiv:2409.15703,Agent-state based policies in POMDPs: Beyond belief-state MDPs,POMDP中基于代理状态的策略：超越信念状态MDP,"Amit Sinha, Aditya Mahajan",https://arxiv.org/pdf/2409.15703.pdf,"Subjects:
Systems and Control (eess.SY); Machine Learning (cs.LG)","Systems and Control (eess.SY),  Machine Learning (cs.LG)"
234,arXiv:2405.18887,4Doodle: Two-handed Gestures for Immersive Sketching of Architectural Models,4Doddle：用于沉浸式建筑模型素描的双手手势,"Fernando Fonseca, Maurício Sousa, Daniel Mendes, Alfredo Ferreira, Joaquim Jorge",https://arxiv.org/pdf/2405.18887.pdf,"Subjects:
Human-Computer Interaction (cs.HC); Computational Engineering, Finance, and Science (cs.CE); Graphics (cs.GR); Multimedia (cs.MM)","Human-Computer Interaction (cs.HC),  Computational Engineering, Finance, and Science (cs.CE),  Graphics (cs.GR),  Multimedia (cs.MM)"
235,arXiv:2310.04590,Deep Model Predictive Optimization,深度模型预测优化,"Jacob Sacks, Rwik Rana, Kevin Huang, Alex Spitzer, Guanya Shi, Byron Boots",https://arxiv.org/pdf/2310.04590.pdf,"Subjects:
Robotics (cs.RO); Artificial Intelligence (cs.AI); Machine Learning (cs.LG); Systems and Control (eess.SY)","Robotics (cs.RO),  Artificial Intelligence (cs.AI),  Machine Learning (cs.LG),  Systems and Control (eess.SY)"
236,arXiv:2409.20547,Annealing Flow Generative Model Towards Sampling High-Dimensional and Multi-Modal Distributions,面向采样高维多模态分布的退火流生成模型,"Dongze Wu, Yao Xie",https://arxiv.org/pdf/2409.20547.pdf,"Subjects:
Machine Learning (stat.ML); Machine Learning (cs.LG); Computation (stat.CO)","Machine Learning (stat.ML),  Machine Learning (cs.LG),  Computation (stat.CO)"
237,arXiv:2409.20516,Proposal of protocols for speech materials acquisition and presentation assisted by tools based on structured test signals,基于结构化测试信号的工具辅助语音材料采集和呈现协议建议,"Hideki Kawahara, Ken-Ichi Sakakibara, Mitsunori Mizumachi, Kohei Yatabe",https://arxiv.org/pdf/2409.20516.pdf,"Subjects:
Audio and Speech Processing (eess.AS); Sound (cs.SD); Signal Processing (eess.SP)","Audio and Speech Processing (eess.AS),  Sound (cs.SD),  Signal Processing (eess.SP)"
238,arXiv:2409.20509,A physics-compliant diagonal representation for wireless channels parametrized by beyond-diagonal reconfigurable intelligent surfaces,由超对角可重构智能表面参数化的无线信道的物理兼容对角表示,Philipp del Hougne,https://arxiv.org/pdf/2409.20509.pdf,"Subjects:
Signal Processing (eess.SP); Information Theory (cs.IT); Applied Physics (physics.app-ph)","Signal Processing (eess.SP),  Information Theory (cs.IT),  Applied Physics (physics.app-ph)"
239,arXiv:2409.20505,The Closed Geodetic Game: algorithms and strategies,封闭大地测量游戏：算法和策略,"Antoine Dailly, Harmender Gahlawat, Zin Mar Myint",https://arxiv.org/pdf/2409.20505.pdf,"Subjects:
Combinatorics (math.CO); Discrete Mathematics (cs.DM)","Combinatorics (math.CO),  Discrete Mathematics (cs.DM)"
240,arXiv:2409.20499,Crater Projection in Linear Pushbroom Camera Images,线性扫帚相机图像中的火山口投影,"Michela Mancini, Ava Thrasher, Carl De Vries, John Christian",https://arxiv.org/pdf/2409.20499.pdf,"Subjects:
Instrumentation and Methods for Astrophysics (astro-ph.IM); Computational Geometry (cs.CG); Image and Video Processing (eess.IV)","Instrumentation and Methods for Astrophysics (astro-ph.IM),  Computational Geometry (cs.CG),  Image and Video Processing (eess.IV)"
241,arXiv:2409.20484,"""What"" x ""When"" working memory representations using Laplace Neural Manifolds",使用拉普拉斯神经流形表示“什么”x“何时”工作记忆,"Aakash Sarkar, Chenyu Wang, Shangfu Zuo, Marc W. Howard",https://arxiv.org/pdf/2409.20484.pdf,"Subjects:
Neurons and Cognition (q-bio.NC); Neural and Evolutionary Computing (cs.NE)","Neurons and Cognition (q-bio.NC),  Neural and Evolutionary Computing (cs.NE)"
242,arXiv:2409.20427,Sufficient and Necessary Explanations (and What Lies in Between),充分和必要的解释（以及介于两者之间的解释）,"Beepul Bharti, Paul Yi, Jeremias Sulam",https://arxiv.org/pdf/2409.20427.pdf,"Subjects:
Machine Learning (stat.ML); Artificial Intelligence (cs.AI); Machine Learning (cs.LG)","Machine Learning (stat.ML),  Artificial Intelligence (cs.AI),  Machine Learning (cs.LG)"
243,arXiv:2409.20425,"Reprogrammable, in-materia matrix-vector multiplication with floppy modes",可重新编程的实物矩阵矢量乘法，采用软盘模式,"Theophile Louvet, Parisa Omidvar, Marc Serra-Garcia",https://arxiv.org/pdf/2409.20425.pdf,"Subjects:
Soft Condensed Matter (cond-mat.soft); Emerging Technologies (cs.ET)","Soft Condensed Matter (cond-mat.soft),  Emerging Technologies (cs.ET)"
244,arXiv:2409.20423,Stream-level flow matching from a Bayesian decision theoretic perspective,基于贝叶斯决策理论的流级流匹配,"Ganchao Wei, Li Ma",https://arxiv.org/pdf/2409.20423.pdf,"Subjects:
Machine Learning (stat.ML); Artificial Intelligence (cs.AI); Machine Learning (cs.LG)","Machine Learning (stat.ML),  Artificial Intelligence (cs.AI),  Machine Learning (cs.LG)"
