Unnamed: 0,id,title,title_zh,authors,url,subjects,subject_split
1428,arXiv:2410.16162,Sparkle: Mastering Basic Spatial Capabilities in Vision Language Models Elicits Generalization to Composite Spatial Reasoning,Sparkle：掌握视觉语言模型中的基本空间能力，引导对复合空间推理的泛化,"Yihong Tang, Ao Qu, Zhaokai Wang, Dingyi Zhuang, Zhaofeng Wu, Wei Ma, Shenhao Wang, Yunhan Zheng, Zhan Zhao, Jinhua Zhao",https://arxiv.org/pdf/2410.16162.pdf,"Subjects:
Computer Vision and Pattern Recognition (cs.CV); Computation and Language (cs.CL)","Computer Vision and Pattern Recognition (cs.CV),  Computation and Language (cs.CL)"
1429,arXiv:2410.16161,DMM: Distributed Matrix Mechanism for Differentially-Private Federated Learning using Packed Secret Sharing,DMM：基于分组秘密共享的差分私有联合学习分布式矩阵机制,"Alexander Bienstock, Ujjwal Kumar, Antigoni Polychroniadou",https://arxiv.org/pdf/2410.16161.pdf,"Subjects:
Cryptography and Security (cs.CR); Machine Learning (cs.LG)","Cryptography and Security (cs.CR),  Machine Learning (cs.LG)"
1430,arXiv:2410.16159,Metric as Transform: Exploring beyond Affine Transform for Interpretable Neural Network,度量即变换：探索仿射变换之外的可解释神经网络,Suman Sapkota,https://arxiv.org/pdf/2410.16159.pdf,"Subjects:
Machine Learning (cs.LG); Computer Vision and Pattern Recognition (cs.CV); Neural and Evolutionary Computing (cs.NE)","Machine Learning (cs.LG),  Computer Vision and Pattern Recognition (cs.CV),  Neural and Evolutionary Computing (cs.NE)"
1431,arXiv:2410.16156,Limpeh ga li gong: Challenges in Singlish Annotations,林培力功：新加坡式英语注释的挑战,"Lynnette Hui Xian Ng, Luo Qi Chan",https://arxiv.org/pdf/2410.16156.pdf,"Subjects:
Computation and Language (cs.CL); Information Retrieval (cs.IR)","Computation and Language (cs.CL),  Information Retrieval (cs.IR)"
1432,arXiv:2410.16155,A Troublemaker with Contagious Jailbreak Makes Chaos in Honest Towns,一名具有传染性的越狱麻烦制造者在诚实的城镇制造混乱,"Tianyi Men, Pengfei Cao, Zhuoran Jin, Yubo Chen, Kang Liu, Jun Zhao",https://arxiv.org/pdf/2410.16155.pdf,"Subjects:
Computation and Language (cs.CL)",Computation and Language (cs.CL)
1433,arXiv:2410.16154,Unsupervised Replay Strategies for Continual Learning with Limited Data,有限数据下持续学习的无监督回放策略,"Anthony Bazhenov, Pahan Dewasurendra, Giri P. Krishnan, Jean Erik Delanois",https://arxiv.org/pdf/2410.16154.pdf,"Subjects:
Machine Learning (cs.LG)",Machine Learning (cs.LG)
1434,arXiv:2410.16153,Pangea: A Fully Open Multilingual Multimodal LLM for 39 Languages,Pangea:39种语言的全开放多语言多模式法学硕士,"Xiang Yue, Yueqi Song, Akari Asai, Seungone Kim, Jean de Dieu Nyandwi, Simran Khanuja, Anjali Kantharuban, Lintang Sutawika, Sathyanarayanan Ramamoorthy, Graham Neubig",https://arxiv.org/pdf/2410.16153.pdf,"Subjects:
Computation and Language (cs.CL); Computer Vision and Pattern Recognition (cs.CV)","Computation and Language (cs.CL),  Computer Vision and Pattern Recognition (cs.CV)"
1435,arXiv:2410.16152,Warped Diffusion: Solving Video Inverse Problems with Image Diffusion Models,扭曲扩散：用图像扩散模型解决视频逆问题,"Giannis Daras, Weili Nie, Karsten Kreis, Alex Dimakis, Morteza Mardani, Nikola Borislavov Kovachki, Arash Vahdat",https://arxiv.org/pdf/2410.16152.pdf,"Subjects:
Computer Vision and Pattern Recognition (cs.CV); Artificial Intelligence (cs.AI); Machine Learning (cs.LG)","Computer Vision and Pattern Recognition (cs.CV),  Artificial Intelligence (cs.AI),  Machine Learning (cs.LG)"
1436,arXiv:2410.16151,"Small Contributions, Small Networks: Efficient Neural Network Pruning Based on Relative Importance",小贡献，小网络：基于相对重要性的高效神经网络修剪,"Mostafa Hussien, Mahmoud Afifi, Kim Khoa Nguyen, Mohamed Cheriet",https://arxiv.org/pdf/2410.16151.pdf,"Subjects:
Machine Learning (cs.LG); Artificial Intelligence (cs.AI); Neural and Evolutionary Computing (cs.NE)","Machine Learning (cs.LG),  Artificial Intelligence (cs.AI),  Neural and Evolutionary Computing (cs.NE)"
1437,arXiv:2410.16150,Modelling Structured Data Learning with Restricted Boltzmann Machines in the Teacher-Student Setting,在师生环境中用受限玻尔兹曼机建模结构化数据学习,"Robin Thériault, Francesco Tosello, Daniele Tantari",https://arxiv.org/pdf/2410.16150.pdf,"Subjects:
Machine Learning (cs.LG); Disordered Systems and Neural Networks (cond-mat.dis-nn)","Machine Learning (cs.LG),  Disordered Systems and Neural Networks (cond-mat.dis-nn)"
1438,arXiv:2410.16149,Denoising Hyperbolic-Valued Data by Relaxed Regularizations,用松弛正则化对双曲值数据进行去噪,"Robert Beinert, Jonas Bresch",https://arxiv.org/pdf/2410.16149.pdf,"Subjects:
Numerical Analysis (math.NA); Optimization and Control (math.OC)","Numerical Analysis (math.NA),  Optimization and Control (math.OC)"
1439,arXiv:2410.16148,PODTILE: Facilitating Podcast Episode Browsing with Auto-generated Chapters,PODTILE：使用自动生成的章节促进播客剧集浏览,"Azin Ghazimatin, Ekaterina Garmash, Gustavo Penha, Kristen Sheets, Martin Achenbach, Oguz Semerci, Remi Galvez, Marcus Tannenberg, Sahitya Mantravadi, Divya Narayanan, Ofeliya Kalaydzhyan, Douglas Cole, Ben Carterette, Ann Clifton, Paul N. Bennett, Claudia Hauff, Mounia Lalmas",https://arxiv.org/pdf/2410.16148.pdf,"Subjects:
Information Retrieval (cs.IR); Artificial Intelligence (cs.AI)","Information Retrieval (cs.IR),  Artificial Intelligence (cs.AI)"
1440,arXiv:2410.16146,Towards Combating Frequency Simplicity-biased Learning for Domain Generalization,对抗领域泛化中的频率简单性偏向学习,"Xilin He, Jingyu Hu, Qinliang Lin, Cheng Luo, Weicheng Xie, Siyang Song, Muhammad Haris Khan, Linlin Shen",https://arxiv.org/pdf/2410.16146.pdf,"Subjects:
Machine Learning (cs.LG); Computer Vision and Pattern Recognition (cs.CV)","Machine Learning (cs.LG),  Computer Vision and Pattern Recognition (cs.CV)"
1441,arXiv:2410.16144,"1-bit AI Infra: Part 1.1, Fast and Lossless BitNet b1.58 Inference on CPUs",1位人工智能基础设施：第1.1部分，快速无损的BitNet b1.58 CPU推理,"Jinheng Wang, Hansong Zhou, Ting Song, Shaoguang Mao, Shuming Ma, Hongyu Wang, Yan Xia, Furu Wei",https://arxiv.org/pdf/2410.16144.pdf,"Subjects:
Computation and Language (cs.CL)",Computation and Language (cs.CL)
1442,arXiv:2410.16141,AdChain: Decentralized Header Bidding,AdChain：去中心化头部竞价,"Behkish Nassirzadeh, Albert Heinle, Stefanos Leonardos, Anwar Hasan, Vijay Ganesh",https://arxiv.org/pdf/2410.16141.pdf,"Subjects:
Cryptography and Security (cs.CR); Distributed, Parallel, and Cluster Computing (cs.DC)","Cryptography and Security (cs.CR),  Distributed, Parallel, and Cluster Computing (cs.DC)"
1443,arXiv:2410.16140,Cooperative Multistatic Target Detection in Cell-Free Communication Networks,无蜂窝通信网络中的协同多基地目标检测,"Tianyu Yang, Shuangyang Li, Yi Song, Kangda Zhi, Giuseppe Caire",https://arxiv.org/pdf/2410.16140.pdf,"Subjects:
Information Theory (cs.IT); Signal Processing (eess.SP)","Information Theory (cs.IT),  Signal Processing (eess.SP)"
1444,arXiv:2410.16139,A Psycholinguistic Evaluation of Language Models' Sensitivity to Argument Roles,语言模型对论证角色敏感性的心理语言学评价,"Eun-Kyoung Rosa Lee, Sathvik Nair, Naomi Feldman",https://arxiv.org/pdf/2410.16139.pdf,"Subjects:
Computation and Language (cs.CL)",Computation and Language (cs.CL)
1445,arXiv:2410.16138,Theoretical Insights into Line Graph Transformation on Graph Learning,图学习中线图变换的理论见解,"Fan Yang, Xingyue Huang",https://arxiv.org/pdf/2410.16138.pdf,"Subjects:
Machine Learning (cs.LG); Combinatorics (math.CO); Machine Learning (stat.ML)","Machine Learning (cs.LG),  Combinatorics (math.CO),  Machine Learning (stat.ML)"
1446,arXiv:2410.16137,Privacy as Social Norm: Systematically Reducing Dysfunctional Privacy Concerns on Social Media,隐私作为社会规范：系统地减少社交媒体上功能失调的隐私问题,"JaeWon Kim, Soobin Cho, Robert Wolfe, Jishnu Hari Nair, Alexis Hiniker",https://arxiv.org/pdf/2410.16137.pdf,"Subjects:
Human-Computer Interaction (cs.HC)",Human-Computer Interaction (cs.HC)
1447,arXiv:2410.16135,Beyond 2:4: exploring V:N:M sparsity for efficient transformer inference on GPUs,超越2:4：探索V:N:M稀疏性，在GPU上进行高效的变换器推理,"Kang Zhao, Tao Yuan, Han Bao, Zhenfeng Su, Chang Gao, Zhaofeng Sun, Zichen Liang, Liping Jing, Jianfei Chen",https://arxiv.org/pdf/2410.16135.pdf,"Subjects:
Machine Learning (cs.LG); Artificial Intelligence (cs.AI)","Machine Learning (cs.LG),  Artificial Intelligence (cs.AI)"
1448,arXiv:2410.16132,A Data-driven Crowd Simulation Framework Integrating Physics-informed Machine Learning with Navigation Potential Fields,一种将物理机器学习与导航势场相结合的数据驱动人群模拟框架,"Runkang Guo, Bin Chen, Qi Zhang, Yong Zhao, Xiao Wang, Zhengqiu Zhu",https://arxiv.org/pdf/2410.16132.pdf,"Subjects:
Artificial Intelligence (cs.AI)",Artificial Intelligence (cs.AI)
1449,arXiv:2410.16131,Constrained Truthful Obnoxious Two-Facility Location with Optional Preferences,具有可选偏好的约束真实厌恶的两个设施位置,"Panagiotis Kanellopoulos, Alexandros A. Voudouris",https://arxiv.org/pdf/2410.16131.pdf,"Subjects:
Computer Science and Game Theory (cs.GT)",Computer Science and Game Theory (cs.GT)
1450,arXiv:2410.16128,SMART: Self-learning Meta-strategy Agent for Reasoning Tasks,SMART：用于推理任务的自学习元策略代理,"Rongxing Liu, Kumar Shridhar, Manish Prajapat, Patrick Xia, Mrinmaya Sachan",https://arxiv.org/pdf/2410.16128.pdf,"Subjects:
Artificial Intelligence (cs.AI); Machine Learning (cs.LG)","Artificial Intelligence (cs.AI),  Machine Learning (cs.LG)"
1451,arXiv:2410.16124,MNIST-Nd: a set of naturalistic datasets to benchmark clustering across dimensions,MNIST-Nd：一组用于跨维度聚类的自然数据集,"Polina Turishcheva, Laura Hansel, Martin Ritzert, Marissa A. Weis, Alexander S. Ecker",https://arxiv.org/pdf/2410.16124.pdf,"Subjects:
Machine Learning (cs.LG); Machine Learning (stat.ML)","Machine Learning (cs.LG),  Machine Learning (stat.ML)"
1452,arXiv:2410.16121,Extracting Spatiotemporal Data from Gradients with Large Language Models,利用大型语言模型从梯度中提取时空数据,"Lele Zheng, Yang Cao, Renhe Jiang, Kenjiro Taura, Yulong Shen, Sheng Li, Masatoshi Yoshikawa",https://arxiv.org/pdf/2410.16121.pdf,"Subjects:
Machine Learning (cs.LG); Cryptography and Security (cs.CR)","Machine Learning (cs.LG),  Cryptography and Security (cs.CR)"
1453,arXiv:2410.16120,Learning SQL from within: integrating database exercises into the database itself,从内部学习SQL：将数据库练习集成到数据库本身,Aristide Grange,https://arxiv.org/pdf/2410.16120.pdf,"Subjects:
Databases (cs.DB)",Databases (cs.DB)
1454,arXiv:2410.16119,SeaDAG: Semi-autoregressive Diffusion for Conditional Directed Acyclic Graph Generation,SeaDAG：条件有向无环图生成的半自回归扩散,"Xinyi Zhou, Xing Li, Yingzhao Lian, Yiwen Wang, Lei Chen, Mingxuan Yuan, Jianye Hao, Guangyong Chen, Pheng Ann Heng",https://arxiv.org/pdf/2410.16119.pdf,"Subjects:
Machine Learning (cs.LG); Artificial Intelligence (cs.AI)","Machine Learning (cs.LG),  Artificial Intelligence (cs.AI)"
1455,arXiv:2410.16115,Increasing Interpretability of Neural Networks By Approximating Human Visual Saliency,通过近似人类视觉显著性来提高神经网络的可解释性,"Aidan Boyd, Mohamed Trabelsi, Huseyin Uzunalioglu, Dan Kushnir",https://arxiv.org/pdf/2410.16115.pdf,"Subjects:
Computer Vision and Pattern Recognition (cs.CV)",Computer Vision and Pattern Recognition (cs.CV)
1456,arXiv:2410.16110,DUMBO: Making durable read-only transactions fly on hardware transactional memory,DUMBO：让持久的只读事务在硬件事务存储器上运行,"João Barreto, Daniel Castro, Paolo Romano, Alexandro Baldassin",https://arxiv.org/pdf/2410.16110.pdf,"Subjects:
Distributed, Parallel, and Cluster Computing (cs.DC)","Distributed, Parallel, and Cluster Computing (cs.DC)"
1457,arXiv:2410.16109,Interpreting Microbiome Relative Abundance Data Using Symbolic Regression,用符号回归解释微生物组相对丰度数据,"Swagatam Haldar, Christoph Stein-Thoeringer, Vadim Borisov",https://arxiv.org/pdf/2410.16109.pdf,"Subjects:
Machine Learning (cs.LG); Quantitative Methods (q-bio.QM)","Machine Learning (cs.LG),  Quantitative Methods (q-bio.QM)"
1458,arXiv:2410.16107,Do LLMs write like humans? Variation in grammatical and rhetorical styles,LLMs写得像人类吗？语法和修辞风格的变化,"Alex Reinhart, David West Brown, Ben Markey, Michael Laudenbach, Kachatad Pantusen, Ronald Yurko, Gordon Weinberg",https://arxiv.org/pdf/2410.16107.pdf,"Subjects:
Computation and Language (cs.CL)",Computation and Language (cs.CL)
1459,arXiv:2410.16105,Addressing Spectral Bias of Deep Neural Networks by Multi-Grade Deep Learning,通过多级深度学习解决深度神经网络的谱偏差,"Ronglong Fang, Yuesheng Xu",https://arxiv.org/pdf/2410.16105.pdf,"Subjects:
Machine Learning (cs.LG); Artificial Intelligence (cs.AI)","Machine Learning (cs.LG),  Artificial Intelligence (cs.AI)"
1460,arXiv:2410.16104,A Deep Unfolding-Based Scalarization Approach for Power Control in D2D Networks,基于深度展开的D2D网络功率控制标量化方法,"Jan Christian Hauffen, Peter Jung, Giuseppe Caire",https://arxiv.org/pdf/2410.16104.pdf,"Subjects:
Information Theory (cs.IT); Signal Processing (eess.SP)","Information Theory (cs.IT),  Signal Processing (eess.SP)"
1461,arXiv:2410.16103,LDAdam: Adaptive Optimization from Low-Dimensional Gradient Statistics,LDAdam：基于低维梯度统计的自适应优化,"Thomas Robert, Mher Safaryan, Ionut-Vlad Modoranu, Dan Alistarh",https://arxiv.org/pdf/2410.16103.pdf,"Subjects:
Machine Learning (cs.LG); Optimization and Control (math.OC); Machine Learning (stat.ML)","Machine Learning (cs.LG),  Optimization and Control (math.OC),  Machine Learning (stat.ML)"
1462,arXiv:2410.16102,Semantics of Sets of Programs,程序集的语义,"Jinwoo Kim, Shaan Nagy, Thomas Reps, Loris D'Antoni",https://arxiv.org/pdf/2410.16102.pdf,"Subjects:
Programming Languages (cs.PL)",Programming Languages (cs.PL)
1463,arXiv:2410.16100,ExDBN: Exact learning of Dynamic Bayesian Networks,ExDBN：动态贝叶斯网络的精确学习,"Pavel Rytir, Ales Wodecki, Georgios Korpas, Jakub Marecek",https://arxiv.org/pdf/2410.16100.pdf,"Subjects:
Machine Learning (cs.LG); Machine Learning (stat.ML)","Machine Learning (cs.LG),  Machine Learning (stat.ML)"
1464,arXiv:2410.16098,Defending Against Attack on the Cloned: In-Band Active Man-in-the-Middle Detection for the Signal Protocol,针对信号协议的克隆：带内主动中间人检测的防御攻击,"Wil Liam Teng, Kasper Rasmussen",https://arxiv.org/pdf/2410.16098.pdf,"Subjects:
Cryptography and Security (cs.CR)",Cryptography and Security (cs.CR)
1465,arXiv:2410.16095,LMHaze: Intensity-aware Image Dehazing with a Large-scale Multi-intensity Real Haze Dataset,LMHaze：基于大规模多强度真实霾数据集的强度感知图像去模糊,"Ruikun Zhang, Hao Yang, Yan Yang, Ying Fu, Liyuan Pan",https://arxiv.org/pdf/2410.16095.pdf,"Subjects:
Computer Vision and Pattern Recognition (cs.CV)",Computer Vision and Pattern Recognition (cs.CV)
1466,arXiv:2410.16094,Streaming and Communication Complexity of Load-Balancing via Matching Contractors,通过匹配承包商实现负载平衡的流媒体和通信复杂性,"Sepehr Assadi, Aaron Bernstein, Zachary Langley, Lap Chi Lau, Robert Wang",https://arxiv.org/pdf/2410.16094.pdf,"Subjects:
Data Structures and Algorithms (cs.DS)",Data Structures and Algorithms (cs.DS)
1467,arXiv:2410.16093,"Final Report for CHESS: Cloud, High-Performance Computing, and Edge for Science and Security",CHESS最终报告：云、高性能计算和边缘科学与安全,"Nathan Tallent, Jan Strube, Luanzheng Guo, Hyungro Lee, Jesun Firoz, Sayan Ghosh, Bo Fang, Oceane Bel, Steven Spurgeon, Sarah Akers, Christina Doty, Erol Cromwell",https://arxiv.org/pdf/2410.16093.pdf,"Subjects:
Distributed, Parallel, and Cluster Computing (cs.DC); Computer Vision and Pattern Recognition (cs.CV); Performance (cs.PF); Systems and Control (eess.SY)","Distributed, Parallel, and Cluster Computing (cs.DC),  Computer Vision and Pattern Recognition (cs.CV),  Performance (cs.PF),  Systems and Control (eess.SY)"
1468,arXiv:2410.16092,ChangeGuard: Validating Code Changes via Pairwise Learning-Guided Execution,ChangeGuard：通过成对学习引导执行验证代码更改,"Lars Gröninger, Beatriz Souza, Michael Pradel",https://arxiv.org/pdf/2410.16092.pdf,"Subjects:
Software Engineering (cs.SE)",Software Engineering (cs.SE)
1469,arXiv:2410.16090,Analysing the Residual Stream of Language Models Under Knowledge Conflicts,知识冲突下语言模型的剩余流分析,"Yu Zhao, Xiaotang Du, Giwon Hong, Aryo Pradipta Gema, Alessio Devoto, Hongru Wang, Xuanli He, Kam-Fai Wong, Pasquale Minervini",https://arxiv.org/pdf/2410.16090.pdf,"Subjects:
Computation and Language (cs.CL)",Computation and Language (cs.CL)
1470,arXiv:2410.16089,Multi-Sensor Fusion for UAV Classification Based on Feature Maps of Image and Radar Data,基于图像和雷达数据特征图的无人机分类多传感器融合,"Nikos Sakellariou (1), Antonios Lalas (1), Konstantinos Votis (1), Dimitrios Tzovaras (1) ((1) Centre for Research and Technology Hellas, Information Technologies Institute)",https://arxiv.org/pdf/2410.16089.pdf,"Subjects:
Artificial Intelligence (cs.AI); Signal Processing (eess.SP)","Artificial Intelligence (cs.AI),  Signal Processing (eess.SP)"
1471,arXiv:2410.16088,Fine-Tuning LLMs for Reliable Medical Question-Answering Services,微调LLM以提供可靠的医疗问答服务,"Ali Anaissi, Ali Braytee, Junaid Akram",https://arxiv.org/pdf/2410.16088.pdf,"Subjects:
Computation and Language (cs.CL); Artificial Intelligence (cs.AI)","Computation and Language (cs.CL),  Artificial Intelligence (cs.AI)"
1472,arXiv:2410.16083,Critical Example Mining for Vehicle Trajectory Prediction using Flow-based Generative Models,基于流生成模型的车辆轨迹预测临界实例挖掘,"Zhezhang Ding, Huijing Zhao",https://arxiv.org/pdf/2410.16083.pdf,"Subjects:
Artificial Intelligence (cs.AI)",Artificial Intelligence (cs.AI)
1473,arXiv:2410.16080,Unleashing the Potential of Multi-Channel Fusion in Retrieval for Personalized Recommendations,挖掘多通道融合在个性化推荐检索中的潜力,"Junjie Huang, Jiarui Qin, Jianghao Lin, Ziming Feng, Yong Yu, Weinan Zhang",https://arxiv.org/pdf/2410.16080.pdf,"Subjects:
Information Retrieval (cs.IR)",Information Retrieval (cs.IR)
1474,arXiv:2410.16079,SAIM: Scalable Analog Ising Machine for Solving Quadratic Binary Optimization Problems,SAIM：用于求解二次二进制优化问题的可扩展模拟伊辛机,"Sasan Razmkhah, Jui-Yu Huang, Mehdi Kamal, Massoud Pedram",https://arxiv.org/pdf/2410.16079.pdf,"Subjects:
Hardware Architecture (cs.AR); Emerging Technologies (cs.ET)","Hardware Architecture (cs.AR),  Emerging Technologies (cs.ET)"
1475,arXiv:2410.16077,CartesianMoE: Boosting Knowledge Sharing among Experts via Cartesian Product Routing in Mixture-of-Experts,CartesianMoE：通过混合专家中的笛卡尔乘积路由促进专家之间的知识共享,"Zhenpeng Su, Xing Wu, Zijia Lin, Yizhe Xiong, Minxuan Lv, Guangyuan Ma, Hui Chen, Songlin Hu, Guiguang Ding",https://arxiv.org/pdf/2410.16077.pdf,"Subjects:
Machine Learning (cs.LG); Computation and Language (cs.CL)","Machine Learning (cs.LG),  Computation and Language (cs.CL)"
1476,arXiv:2410.16070,On-Device LLMs for SMEs: Challenges and Opportunities,面向中小企业的设备LLMs：挑战与机遇,"Jeremy Stephen Gabriel Yee, Pai Chet Ng, Zhengkui Wang, Ian McLoughlin, Aik Beng Ng, Simon See",https://arxiv.org/pdf/2410.16070.pdf,"Subjects:
Artificial Intelligence (cs.AI); Computation and Language (cs.CL)","Artificial Intelligence (cs.AI),  Computation and Language (cs.CL)"
1477,arXiv:2410.16069,Rolling the DICE on Idiomaticity: How LLMs Fail to Grasp Context,在习语上滚动DICE：LLMs如何无法掌握语境,"Maggie Mi, Aline Villavicencio, Nafise Sadat Moosavi",https://arxiv.org/pdf/2410.16069.pdf,"Subjects:
Computation and Language (cs.CL)",Computation and Language (cs.CL)
1478,arXiv:2410.16063,Integrated Image-Text Based on Semi-supervised Learning for Small Sample Instance Segmentation,基于半监督学习的集成图像文本小样本实例分割,"Ruting Chi, Zhiyi Huang, Yuexing Han",https://arxiv.org/pdf/2410.16063.pdf,"Subjects:
Computer Vision and Pattern Recognition (cs.CV); Artificial Intelligence (cs.AI)","Computer Vision and Pattern Recognition (cs.CV),  Artificial Intelligence (cs.AI)"
1479,arXiv:2410.16062,Surprise! Uniform Information Density Isn't the Whole Story: Predicting Surprisal Contours in Long-form Discourse,惊喜！统一信息密度不是全部：预测长篇话语中的意外轮廓,"Eleftheria Tsipidi, Franz Nowak, Ryan Cotterell, Ethan Wilcox, Mario Giulianelli, Alex Warstadt",https://arxiv.org/pdf/2410.16062.pdf,"Subjects:
Computation and Language (cs.CL)",Computation and Language (cs.CL)
1480,arXiv:2410.16061,Virtual Reality Games: Extending Unity Learn Games to VR,虚拟现实游戏：将Unity学习游戏扩展到VR,"Ryan P. McMahan, Nayan N. Chawla, Christian S. Cassell, Christopher Peerapon Lee",https://arxiv.org/pdf/2410.16061.pdf,"Subjects:
Human-Computer Interaction (cs.HC)",Human-Computer Interaction (cs.HC)
1481,arXiv:2410.16058,Shorter Is Different: Characterizing the Dynamics of Short-Form Video Platforms,短片不一样：描述短片视频平台的动态,"Zhilong Chen, Peijie Liu, Jinghua Piao, Fengli Xu, Yong Li",https://arxiv.org/pdf/2410.16058.pdf,"Subjects:
Multimedia (cs.MM); Computers and Society (cs.CY); Computation (stat.CO)","Multimedia (cs.MM),  Computers and Society (cs.CY),  Computation (stat.CO)"
1482,arXiv:2410.16057,Label Filling via Mixed Supervision for Medical Image Segmentation from Noisy Annotations,基于混合监督的标签填充用于从噪声注释中分割医学图像,"Ming Li, Wei Shen, Qingli Li, Yan Wang",https://arxiv.org/pdf/2410.16057.pdf,"Subjects:
Computer Vision and Pattern Recognition (cs.CV)",Computer Vision and Pattern Recognition (cs.CV)
1483,arXiv:2410.16052,Near-Optimal Algorithm for Non-Stationary Kernelized Bandits,非平稳核化带的近似最优算法,"Shogo Iwazaki, Shion Takeno",https://arxiv.org/pdf/2410.16052.pdf,"Subjects:
Machine Learning (cs.LG); Machine Learning (stat.ML)","Machine Learning (cs.LG),  Machine Learning (stat.ML)"
1484,arXiv:2410.16050,Optimization of an eigenvalue arising in optimal insulation with a lower bound,具有下界的最优绝缘中特征值的优化,"Sören Bartels, Giuseppe Buttazzo, Hedwig Keller",https://arxiv.org/pdf/2410.16050.pdf,"Subjects:
Numerical Analysis (math.NA); Optimization and Control (math.OC)","Numerical Analysis (math.NA),  Optimization and Control (math.OC)"
1485,arXiv:2410.16049,Dirty-Waters: Detecting Software Supply Chain Smells,脏水：检测软件供应链气味,"Raphina Liu, Sofia Bobadilla, Benoit Baudry, Martin Monperrus",https://arxiv.org/pdf/2410.16049.pdf,"Subjects:
Software Engineering (cs.SE); Cryptography and Security (cs.CR)","Software Engineering (cs.SE),  Cryptography and Security (cs.CR)"
1486,arXiv:2410.16044,Large Language Models Know What To Say But Not When To Speak,大型语言模型知道该说什么，但不知道什么时候该说,"Muhammad Umair, Vasanth Sarathy, JP de Ruiter",https://arxiv.org/pdf/2410.16044.pdf,"Subjects:
Computation and Language (cs.CL)",Computation and Language (cs.CL)
1487,arXiv:2410.16038,Benchmarking Pathology Foundation Models: Adaptation Strategies and Scenarios,基准病理学基础模型：适应策略和情景,"Jeaung Lee, Jeewoo Lim, Keunho Byeon, Jin Tae Kwak",https://arxiv.org/pdf/2410.16038.pdf,"Subjects:
Computer Vision and Pattern Recognition (cs.CV)",Computer Vision and Pattern Recognition (cs.CV)
1488,arXiv:2410.16037,Improving the Multi-label Atomic Activity Recognition by Robust Visual Feature and Advanced Attention @ ROAD++ Atomic Activity Recognition 2024,通过鲁棒视觉特征和高级注意力改进多标签原子活动识别@ROAD++原子活动识别2024,"Jiamin Cao, Lingqi Wang, Kexin Zhang, Yuting Yang, Licheng Jiao, Yuwei Guo",https://arxiv.org/pdf/2410.16037.pdf,"Subjects:
Computer Vision and Pattern Recognition (cs.CV)",Computer Vision and Pattern Recognition (cs.CV)
1489,arXiv:2410.16033,TreeBoN: Enhancing Inference-Time Alignment with Speculative Tree-Search and Best-of-N Sampling,TreeBoN：通过推测树搜索和N优抽样增强推理时间对齐,"Jiahao Qiu, Yifu Lu, Yifan Zeng, Jiacheng Guo, Jiayi Geng, Huazheng Wang, Kaixuan Huang, Yue Wu, Mengdi Wang",https://arxiv.org/pdf/2410.16033.pdf,"Subjects:
Computation and Language (cs.CL); Artificial Intelligence (cs.AI); Machine Learning (cs.LG)","Computation and Language (cs.CL),  Artificial Intelligence (cs.AI),  Machine Learning (cs.LG)"
1490,arXiv:2410.16032,TimeMixer++: A General Time Series Pattern Machine for Universal Predictive Analysis,TimeMixer++：一种用于通用预测分析的通用时间序列模式机,"Shiyu Wang, Jiawei Li, Xiaoming Shi, Zhou Ye, Baichuan Mo, Wenze Lin, Shengtong Ju, Zhixuan Chu, Ming Jin",https://arxiv.org/pdf/2410.16032.pdf,"Subjects:
Machine Learning (cs.LG); Artificial Intelligence (cs.AI)","Machine Learning (cs.LG),  Artificial Intelligence (cs.AI)"
