Unnamed: 0,id,title,title_zh,authors,url,subjects,subject_split
993,arXiv:2410.16999,AGSENet: A Robust Road Ponding Detection Method for Proactive Traffic Safety,AGSENet：一种用于主动交通安全的鲁棒道路积水检测方法,"Ronghui Zhang, Shangyu Yang, Dakang Lyu, Zihan Wang, Junzhou Chen, Yilong Ren, Bolin Gao, Zhihan Lv",https://arxiv.org/pdf/2410.16999.pdf,"Subjects:
Computer Vision and Pattern Recognition (cs.CV)",Computer Vision and Pattern Recognition (cs.CV)
994,arXiv:2410.16997,On Optimal Battery Sizing for Electric Vehicles,电动汽车电池尺寸优化研究,"Felix Wieberneit, Emanuele Crisostomi, Anthony Quinn, Homayoun Hamedmoghadam, Pietro Ferraro, Robert Shorten",https://arxiv.org/pdf/2410.16997.pdf,"Subjects:
Systems and Control (eess.SY)",Systems and Control (eess.SY)
995,arXiv:2410.16995,E-3DGS: Gaussian Splatting with Exposure and Motion Events,E-3DGS：带有曝光和运动事件的高斯散斑,"Xiaoting Yin, Hao Shi, Yuhan Bao, Zhenshan Bing, Yiyi Liao, Kailun Yang, Kaiwei Wang",https://arxiv.org/pdf/2410.16995.pdf,"Subjects:
Computer Vision and Pattern Recognition (cs.CV); Robotics (cs.RO); Image and Video Processing (eess.IV)","Computer Vision and Pattern Recognition (cs.CV),  Robotics (cs.RO),  Image and Video Processing (eess.IV)"
996,arXiv:2410.16991,An Eye for an AI: Evaluating GPT-4o's Visual Perception Skills and Geometric Reasoning Skills Using Computer Graphics Questions,人工智能之眼：使用计算机图形学问题评估GPT-4o的视觉感知技能和几何推理技能,"Tony Haoran Feng (1), Paul Denny (1), Burkhard C. Wünsche (1), Andrew Luxton-Reilly (1), Jacqueline Whalley (2) ((1) University of Auckland, (2) Auckland University of Technology)",https://arxiv.org/pdf/2410.16991.pdf,"Subjects:
Artificial Intelligence (cs.AI); Graphics (cs.GR)","Artificial Intelligence (cs.AI),  Graphics (cs.GR)"
997,arXiv:2410.16990,A Wrinkling Model for General Hyperelastic Materials based on Tension Field Theory,基于张力场理论的一般超弹性材料起皱模型,"H.M. Verhelst, M. Möller, J.H. Den Besten",https://arxiv.org/pdf/2410.16990.pdf,"Subjects:
Numerical Analysis (math.NA)",Numerical Analysis (math.NA)
998,arXiv:2410.16983,Order Matters: Exploring Order Sensitivity in Multimodal Large Language Models,顺序问题：探索多模态大型语言模型中的顺序敏感性,"Zhijie Tan, Xu Chu, Weiping Li, Tong Mo",https://arxiv.org/pdf/2410.16983.pdf,"Subjects:
Artificial Intelligence (cs.AI)",Artificial Intelligence (cs.AI)
999,arXiv:2410.16982,Sample-Efficient Geometry Reconstruction from Euclidean Distances using Non-Convex Optimization,使用非凸优化从欧几里德距离进行样本高效几何重建,"Ipsita Ghosh, Abiy Tasissa, Christian Kümmerle",https://arxiv.org/pdf/2410.16982.pdf,"Subjects:
Machine Learning (cs.LG)",Machine Learning (cs.LG)
1000,arXiv:2410.16981,Proleptic Temporal Ensemble for Improving the Speed of Robot Tasks Generated by Imitation Learning,提高模仿学习机器人任务生成速度的Proptic时态集成,"Hyeonjun Park, Daegyu Lim, Seungyeon Kim, Sumin Park",https://arxiv.org/pdf/2410.16981.pdf,"Subjects:
Robotics (cs.RO)",Robotics (cs.RO)
1001,arXiv:2410.16980,Electrode SOC and SOH estimation with electrode-level ECMs,利用电极级ECM估算电极SOC和SOH,"Iker Lopetegi, Sergio Fernandez, Gregory L. Plett, M. Scott Trimboli, Unai Iraola",https://arxiv.org/pdf/2410.16980.pdf,"Subjects:
Systems and Control (eess.SY)",Systems and Control (eess.SY)
1002,arXiv:2410.16978,Multi-Layer Gaussian Splatting for Immersive Anatomy Visualization,用于沉浸式解剖可视化的多层高斯散斑,"Constantin Kleinbeck, Hannah Schieber, Klaus Engel, Ralf Gutjahr, Daniel Roth",https://arxiv.org/pdf/2410.16978.pdf,"Subjects:
Graphics (cs.GR); Computer Vision and Pattern Recognition (cs.CV)","Graphics (cs.GR),  Computer Vision and Pattern Recognition (cs.CV)"
1003,arXiv:2410.16977,IPL: Leveraging Multimodal Large Language Models for Intelligent Product Listing,IPL：利用多模态大型语言模型进行智能产品上市,"Kang Chen, Qingheng Zhang, Chengbao Lian, Yixin Ji, Xuwei Liu, Shuguang Han, Guoqiang Wu, Fei Huang, Jufeng Chen",https://arxiv.org/pdf/2410.16977.pdf,"Subjects:
Computation and Language (cs.CL)",Computation and Language (cs.CL)
1004,arXiv:2410.16975,Publishing Neural Networks in Drug Discovery Might Compromise Training Data Privacy,在药物发现中发布神经网络可能会损害训练数据的隐私,"Fabian P. Krüger, Johan Östman, Lewis Mervin, Igor V. Tetko, Ola Engkvist",https://arxiv.org/pdf/2410.16975.pdf,"Subjects:
Cryptography and Security (cs.CR); Machine Learning (cs.LG)","Cryptography and Security (cs.CR),  Machine Learning (cs.LG)"
1005,arXiv:2410.16973,Learning Mathematical Rules with Large Language Models,用大型语言模型学习数学规则,"Nelson Vadori, Antoine Gorceix, Bastien Le Chenadec, Ahmad Rammal, Manuela Veloso",https://arxiv.org/pdf/2410.16973.pdf,"Subjects:
Computation and Language (cs.CL); Artificial Intelligence (cs.AI); Machine Learning (cs.LG)","Computation and Language (cs.CL),  Artificial Intelligence (cs.AI),  Machine Learning (cs.LG)"
1006,arXiv:2410.16972,Sample-efficient Bayesian Optimisation Using Known Invariances,使用已知不变量进行样本高效贝叶斯优化,"Theodore Brown, Alexandru Cioba, Ilija Bogunovic",https://arxiv.org/pdf/2410.16972.pdf,"Subjects:
Machine Learning (cs.LG)",Machine Learning (cs.LG)
1007,arXiv:2410.16964,The Parameterized Complexity Landscape of the Unsplittable Flow Problem,不可分裂流问题的参数化复杂性景观,"Robert Ganian, Mathis Rocton, Daniel Unterberger",https://arxiv.org/pdf/2410.16964.pdf,"Subjects:
Data Structures and Algorithms (cs.DS)",Data Structures and Algorithms (cs.DS)
1008,arXiv:2410.16960,Iterative Cut-Based PWA Approximation of Multi-Dimensional Nonlinear Systems,基于迭代切割的多维非线性系统PWA近似,"Leila Gharavi, Bart De Schutter, Simone Baldi",https://arxiv.org/pdf/2410.16960.pdf,"Subjects:
Systems and Control (eess.SY)",Systems and Control (eess.SY)
1009,arXiv:2410.16959,"Evaluation of a Data Annotation Platform for Large, Time-Series Datasets in Intensive Care: Mixed Methods Study",重症监护中大型时间序列数据集数据注释平台的评估：混合方法研究,"Marceli Wac, Raul Santos-Rodriguez, Chris McWilliams, Christopher Bourdeaux",https://arxiv.org/pdf/2410.16959.pdf,"Subjects:
Human-Computer Interaction (cs.HC)",Human-Computer Interaction (cs.HC)
1010,arXiv:2410.16958,Leaky ReLUs That Differ in Forward and Backward Pass Facilitate Activation Maximization in Deep Neural Networks,前向和后向通道不同的泄漏ReLU有助于深度神经网络中的激活最大化,"Christoph Linse, Erhardt Barth, Thomas Martinetz",https://arxiv.org/pdf/2410.16958.pdf,"Subjects:
Computer Vision and Pattern Recognition (cs.CV)",Computer Vision and Pattern Recognition (cs.CV)
1011,arXiv:2410.16956,Towards an Assisted Simulation Planning for Co-Simulation of Cyber-Physical Energy Systems,面向信息物理能源系统协同仿真的辅助仿真规划,"Jan Sören Schwarz, Cornelius Steinbrink, Sebastian Lehnhoff",https://arxiv.org/pdf/2410.16956.pdf,"Subjects:
Computational Engineering, Finance, and Science (cs.CE)","Computational Engineering, Finance, and Science (cs.CE)"
1012,arXiv:2410.16955,PGCS: Physical Law embedded Generative Cloud Synthesis in Remote Sensing Images,PGCS：遥感图像中嵌入物理定律的生成云合成,"Liying Xu, Huifang Li, Huanfeng Shen, Mingyang Lei, Tao Jiang",https://arxiv.org/pdf/2410.16955.pdf,"Subjects:
Computer Vision and Pattern Recognition (cs.CV); Image and Video Processing (eess.IV)","Computer Vision and Pattern Recognition (cs.CV),  Image and Video Processing (eess.IV)"
1013,arXiv:2410.16954,LoRA-C: Parameter-Efficient Fine-Tuning of Robust CNN for IoT Devices,LoRA-C：物联网设备鲁棒CNN的参数高效微调,"Chuntao Ding, Xu Cao, Jianhang Xie, Linlin Fan, Shangguang Wang, Zhichao Lu",https://arxiv.org/pdf/2410.16954.pdf,"Subjects:
Distributed, Parallel, and Cluster Computing (cs.DC)","Distributed, Parallel, and Cluster Computing (cs.DC)"
1014,arXiv:2410.16953,Towards Real Zero-Shot Camouflaged Object Segmentation without Camouflaged Annotations,无伪装注释的零样本真实伪装目标分割,"Cheng Lei, Jie Fan, Xinran Li, Tianzhu Xiang, Ao Li, Ce Zhu, Le Zhang",https://arxiv.org/pdf/2410.16953.pdf,"Subjects:
Computer Vision and Pattern Recognition (cs.CV)",Computer Vision and Pattern Recognition (cs.CV)
1015,arXiv:2410.16950,Breaking ReAct Agents: Foot-in-the-Door Attack Will Get You In,打破重演特工：脚踏门攻击会让你进去,"Itay Nakash, George Kour, Guy Uziel, Ateret Anaby-Tavor",https://arxiv.org/pdf/2410.16950.pdf,"Subjects:
Cryptography and Security (cs.CR); Artificial Intelligence (cs.AI)","Cryptography and Security (cs.CR),  Artificial Intelligence (cs.AI)"
1016,arXiv:2410.16947,ISImed: A Framework for Self-Supervised Learning using Intrinsic Spatial Information in Medical Images,ISImed：利用医学图像中的内在空间信息进行自我监督学习的框架,"Nabil Jabareen, Dongsheng Yuan, Sören Lukassen",https://arxiv.org/pdf/2410.16947.pdf,"Subjects:
Computer Vision and Pattern Recognition (cs.CV); Machine Learning (cs.LG)","Computer Vision and Pattern Recognition (cs.CV),  Machine Learning (cs.LG)"
1017,arXiv:2410.16943,FlightAR: AR Flight Assistance Interface with Multiple Video Streams and Object Detection Aimed at Immersive Drone Control,FlightAR：针对沉浸式无人机控制的多视频流和目标检测的AR飞行辅助接口,"Oleg Sautenkov, Selamawit Asfaw, Yasheerah Yaqoot, Muhammad Ahsan Mustafa, Aleksey Fedoseev, Daria Trinitatova, Dzmitry Tsetserukou",https://arxiv.org/pdf/2410.16943.pdf,"Subjects:
Robotics (cs.RO)",Robotics (cs.RO)
1018,arXiv:2410.16942,DiP-GO: A Diffusion Pruner via Few-step Gradient Optimization,DiP GO：一种基于少步梯度优化的扩散修剪器,"Haowei Zhu, Dehua Tang, Ji Liu, Mingjie Lu, Jintu Zheng, Jinzhang Peng, Dong Li, Yu Wang, Fan Jiang, Lu Tian, Spandan Tiwari, Ashish Sirasao, Jun-Hai Yong, Bin Wang, Emad Barsoum",https://arxiv.org/pdf/2410.16942.pdf,"Subjects:
Computer Vision and Pattern Recognition (cs.CV)",Computer Vision and Pattern Recognition (cs.CV)
1019,arXiv:2410.16941,Business Process Simulation: Probabilistic Modeling of Intermittent Resource Availability and Multitasking Behavior,业务流程仿真：间歇资源可用性和多任务行为的概率建模,"Orlenys López-Pintado, Marlon Dumas",https://arxiv.org/pdf/2410.16941.pdf,"Subjects:
Machine Learning (cs.LG)",Machine Learning (cs.LG)
1020,arXiv:2410.16939,LIMIS: Towards Language-based Interactive Medical Image Segmentation,LIMIS：迈向基于语言的交互式医学图像分割,"Lena Heinemann, Alexander Jaus, Zdravko Marinov, Moon Kim, Maria Francesca Spadea, Jens Kleesiek, Rainer Stiefelhagen",https://arxiv.org/pdf/2410.16939.pdf,"Subjects:
Computer Vision and Pattern Recognition (cs.CV)",Computer Vision and Pattern Recognition (cs.CV)
1021,arXiv:2410.16938,Cooperative Trajectory Planning: Principles for Human-Machine System Design on Trajectory Level,协同轨迹规划：轨迹级人机系统设计原则,"Julian Schneider, Balint Varga, Sören Hohmann",https://arxiv.org/pdf/2410.16938.pdf,"Subjects:
Systems and Control (eess.SY)",Systems and Control (eess.SY)
1022,arXiv:2410.16937,MOSAIK 3.0: Combining Time-Stepped and Discrete Event Simulation,MOSAIK 3.0：结合时间步进和离散事件模拟,"Annika Ofenloch, Jan Sören Schwarz, Deborah Tolk, Tobias Brandt, Reef Eilers, Rebeca Ramirez",https://arxiv.org/pdf/2410.16937.pdf,"Subjects:
Computational Engineering, Finance, and Science (cs.CE)","Computational Engineering, Finance, and Science (cs.CE)"
1023,arXiv:2410.16935,Graph Neural Networks for Edge Signals: Orientation Equivariance and Invariance,边缘信号的图神经网络：方向等方差和不变性,"Dominik Fuchsgruber, Tim Poštuvan, Stephan Günnemann, Simon Geisler",https://arxiv.org/pdf/2410.16935.pdf,"Subjects:
Machine Learning (cs.LG)",Machine Learning (cs.LG)
1024,arXiv:2410.16930,Math Neurosurgery: Isolating Language Models' Math Reasoning Abilities Using Only Forward Passes,数学神经外科：仅使用正向传递隔离语言模型的数学推理能力,"Bryan R. Christ, Zack Gottesman, Jonathan Kropko, Thomas Hartvigsen",https://arxiv.org/pdf/2410.16930.pdf,"Subjects:
Computation and Language (cs.CL); Artificial Intelligence (cs.AI)","Computation and Language (cs.CL),  Artificial Intelligence (cs.AI)"
1025,arXiv:2410.16929,CUBIT: Concurrent Updatable Bitmap Indexing (Extended Version),CUBIT：并行可更新位图索引（扩展版）,"Junchang Wang, Manos Athanassoulis",https://arxiv.org/pdf/2410.16929.pdf,"Subjects:
Databases (cs.DB)",Databases (cs.DB)
1026,arXiv:2410.16928,xLSTM-Mixer: Multivariate Time Series Forecasting by Mixing via Scalar Memories,xLSTM混合器：通过标量记忆混合进行多元时间序列预测,"Maurice Kraus, Felix Divo, Devendra Singh Dhami, Kristian Kersting",https://arxiv.org/pdf/2410.16928.pdf,"Subjects:
Machine Learning (cs.LG)",Machine Learning (cs.LG)
1027,arXiv:2410.16927,Revealing Hidden Bias in AI: Lessons from Large Language Models,揭示人工智能中隐藏的偏见：来自大型语言模型的教训,"Django Beatty, Kritsada Masanthia, Teepakorn Kaphol, Niphan Sethi",https://arxiv.org/pdf/2410.16927.pdf,"Subjects:
Artificial Intelligence (cs.AI); Computers and Society (cs.CY)","Artificial Intelligence (cs.AI),  Computers and Society (cs.CY)"
1028,arXiv:2410.16926,Pyramid Vector Quantization for LLMs,LLM的金字塔矢量量化,"Tycho F. A. van der Ouderaa, Maximilian L. Croci, Agrin Hilmkil, James Hensman",https://arxiv.org/pdf/2410.16926.pdf,"Subjects:
Machine Learning (cs.LG)",Machine Learning (cs.LG)
1029,arXiv:2410.16924,SleepCoT: A Lightweight Personalized Sleep Health Model via Chain-of-Thought Distillation,SleepCoT：一种基于思维链蒸馏的轻量级个性化睡眠健康模型,"Huimin Zheng, Xiaofeng Xing, Xiangmin Xu",https://arxiv.org/pdf/2410.16924.pdf,"Subjects:
Artificial Intelligence (cs.AI)",Artificial Intelligence (cs.AI)
1030,arXiv:2410.16923,A Toolbox for Design of Experiments for Energy Systems in Co-Simulation and Hardware Tests,能量系统联合仿真与硬件测试实验设计工具箱,"Jan Sören Schwarz, Leonard Enrique Ramos Perez, Minh Cong Pham, Kai Heussen, Quoc Tuan Tran",https://arxiv.org/pdf/2410.16923.pdf,"Subjects:
Computational Engineering, Finance, and Science (cs.CE)","Computational Engineering, Finance, and Science (cs.CE)"
1031,arXiv:2410.16922,Direction-Constrained Control for Efficient Physical Human-Robot Interaction under Hierarchical Tasks,分层任务下高效物理人机交互的方向约束控制,"Mengxin Xu, Weiwei Wan, Hesheng Wang, Kensuke Harada",https://arxiv.org/pdf/2410.16922.pdf,"Subjects:
Robotics (cs.RO)",Robotics (cs.RO)
1032,arXiv:2410.16919,EnvBridge: Bridging Diverse Environments with Cross-Environment Knowledge Transfer for Embodied AI,EnvBridge：通过跨环境知识转移连接不同环境，实现物化人工智能,"Tomoyuki Kagaya, Yuxuan Lou, Thong Jing Yuan, Subramanian Lakshmi, Jayashree Karlekar, Sugiri Pranata, Natsuki Murakami, Akira Kinose, Koki Oguri, Felix Wick, Yang You",https://arxiv.org/pdf/2410.16919.pdf,"Subjects:
Robotics (cs.RO); Artificial Intelligence (cs.AI); Computation and Language (cs.CL); Machine Learning (cs.LG)","Robotics (cs.RO),  Artificial Intelligence (cs.AI),  Computation and Language (cs.CL),  Machine Learning (cs.LG)"
1033,arXiv:2410.16910,Hierarchical Clustering for Conditional Diffusion in Image Generation,图像生成中条件扩散的层次聚类,"Jorge da Silva Goncalves, Laura Manduchi, Moritz Vandenhirtz, Julia E. Vogt",https://arxiv.org/pdf/2410.16910.pdf,"Subjects:
Computer Vision and Pattern Recognition (cs.CV)",Computer Vision and Pattern Recognition (cs.CV)
1034,arXiv:2410.16908,Mitigating Vanishing Activations in Deep CapsNets Using Channel Pruning,使用通道修剪减轻深CapsNets中消失的激活,"Siddharth Sahu, Abdulrahman Altahhan",https://arxiv.org/pdf/2410.16908.pdf,"Subjects:
Computer Vision and Pattern Recognition (cs.CV); Artificial Intelligence (cs.AI)","Computer Vision and Pattern Recognition (cs.CV),  Artificial Intelligence (cs.AI)"
1035,arXiv:2410.16901,Bayes without Underfitting: Fully Correlated Deep Learning Posteriors via Alternating Projections,贝叶斯无欠拟合：通过交替投影实现完全相关的深度学习后验,"Marco Miani, Hrittik Roy, Søren Hauberg",https://arxiv.org/pdf/2410.16901.pdf,"Subjects:
Machine Learning (cs.LG); Machine Learning (stat.ML)","Machine Learning (cs.LG),  Machine Learning (stat.ML)"
1036,arXiv:2410.16897,Enhancing Generalization in Convolutional Neural Networks through Regularization with Edge and Line Features,通过边和线特征正则化增强卷积神经网络的泛化能力,"Christoph Linse, Beatrice Brückner, Thomas Martinetz",https://arxiv.org/pdf/2410.16897.pdf,"Subjects:
Computer Vision and Pattern Recognition (cs.CV)",Computer Vision and Pattern Recognition (cs.CV)
1037,arXiv:2410.16892,VistaDream: Sampling multiview consistent images for single-view scene reconstruction,VistaDream：为单视图场景重建采样多视图一致图像,"Haiping Wang, Yuan Liu, Ziwei Liu, Wenping Wang, Zhen Dong, Bisheng Yang",https://arxiv.org/pdf/2410.16892.pdf,"Subjects:
Computer Vision and Pattern Recognition (cs.CV)",Computer Vision and Pattern Recognition (cs.CV)
1038,arXiv:2410.16888,Unsupervised Time Series Anomaly Prediction with Importance-based Generative Contrastive Learning,基于重要性生成对比学习的无监督时间序列异常预测,"Kai Zhao, Zhihao Zhuang, Chenjuan Guo, Hao Miao, Yunyao Cheng, Bin Yang",https://arxiv.org/pdf/2410.16888.pdf,"Subjects:
Machine Learning (cs.LG)",Machine Learning (cs.LG)
1039,arXiv:2410.16887,Distribution of Responsibility During the Usage of AI-Based Exoskeletons for Upper Limb Rehabilitation,使用基于人工智能的外骨骼进行上肢康复过程中的责任分配,"Huaxi (Yulin)Zhang, Melanie Fontaine, Marianne Huchard, Baptiste Mereaux, Olivier Remy-Neris",https://arxiv.org/pdf/2410.16887.pdf,"Subjects:
Robotics (cs.RO)",Robotics (cs.RO)
1040,arXiv:2410.16884,Network Inversion for Training-Like Data Reconstruction,用于类训练数据重建的网络反演,"Pirzada Suhail, Amit Sethi",https://arxiv.org/pdf/2410.16884.pdf,"Subjects:
Computer Vision and Pattern Recognition (cs.CV)",Computer Vision and Pattern Recognition (cs.CV)
1041,arXiv:2410.16882,Large Language Model-based Augmentation for Imbalanced Node Classification on Text-Attributed Graphs,基于大语言模型的文本属性图非平衡节点分类增广,"Leyao Wang, Yu Wang, Bo Ni, Yuying Zhao, Tyler Derr",https://arxiv.org/pdf/2410.16882.pdf,"Subjects:
Artificial Intelligence (cs.AI); Machine Learning (cs.LG); Social and Information Networks (cs.SI)","Artificial Intelligence (cs.AI),  Machine Learning (cs.LG),  Social and Information Networks (cs.SI)"
1042,arXiv:2410.16881,Just In Time Transformers,准时制变压器,"Ahmed Ala Eddine Benali, Massimo Cafaro, Italo Epicoco, Marco Pulimeno, Enrico Junior Schioppa",https://arxiv.org/pdf/2410.16881.pdf,"Subjects:
Machine Learning (cs.LG)",Machine Learning (cs.LG)
1043,arXiv:2410.16879,Contrasting Attitudes Towards Current and Future AI Applications for Computerised Interpretation of ECG: A Clinical Stakeholder Interview Study,对比对当前和未来心电图计算机解释人工智能应用的态度：一项临床利益相关者访谈研究,"Lukas Hughes-Noehrer, Leda Channer, Gabriel Strain, Gregory Yates, Richard Body, Caroline Jay",https://arxiv.org/pdf/2410.16879.pdf,"Subjects:
Computers and Society (cs.CY); Artificial Intelligence (cs.AI); Machine Learning (cs.LG); Signal Processing (eess.SP)","Computers and Society (cs.CY),  Artificial Intelligence (cs.AI),  Machine Learning (cs.LG),  Signal Processing (eess.SP)"
1044,arXiv:2410.16875,Edge-Spreading Raptor-Like LDPC Codes for 6G Wireless Systems,6G无线系统中的边缘扩频类猛禽LDPC码,"Yuqing Ren, Leyu Zhang, Yifei Shen, Wenqing Song, Emmanuel Boutillon, Alexios Balatsoukas-Stimming, Andreas Burg",https://arxiv.org/pdf/2410.16875.pdf,"Subjects:
Information Theory (cs.IT)",Information Theory (cs.IT)
1045,arXiv:2410.16872,CK4Gen: A Knowledge Distillation Framework for Generating High-Utility Synthetic Survival Datasets in Healthcare,CK4Gen：一个用于生成医疗保健中高效用综合生存数据集的知识蒸馏框架,"Nicholas I-Hsien Kuo, Blanca Gallego, Louisa Jorm",https://arxiv.org/pdf/2410.16872.pdf,"Subjects:
Machine Learning (cs.LG)",Machine Learning (cs.LG)
1046,arXiv:2410.16871,"Error Feedback under $(L_0,L_1)$-Smoothness: Normalization and Momentum",$（L_0，L_1）$下的误差反馈——平滑度：归一化和动量,"Sarit Khirirat, Abdurakhmon Sadiev, Artem Riabinin, Eduard Gorbunov, Peter Richtárik",https://arxiv.org/pdf/2410.16871.pdf,"Subjects:
Machine Learning (cs.LG)",Machine Learning (cs.LG)
1047,arXiv:2410.16868,Rethinking generalization of classifiers in separable classes scenarios and over-parameterized regimes,对可分离类场景和过参数化状态下分类器泛化的再思考,"Julius Martinetz, Christoph Linse, Thomas Martinetz",https://arxiv.org/pdf/2410.16868.pdf,"Subjects:
Machine Learning (cs.LG); Computer Vision and Pattern Recognition (cs.CV)","Machine Learning (cs.LG),  Computer Vision and Pattern Recognition (cs.CV)"
1048,arXiv:2410.16865,Polycubes via Dual Loops,通过双环连接的多边形,"Maxim Snoep, Bettina Speckmann, Kevin Verbeek",https://arxiv.org/pdf/2410.16865.pdf,"Subjects:
Computational Geometry (cs.CG); Graphics (cs.GR)","Computational Geometry (cs.CG),  Graphics (cs.GR)"
1049,arXiv:2410.16864,Pedestrian motion prediction evaluation for urban autonomous driving,城市自动驾驶行人运动预测评价,"Dmytro Zabolotnii, Yar Muhammad, Naveed Muhammad",https://arxiv.org/pdf/2410.16864.pdf,"Subjects:
Robotics (cs.RO); Artificial Intelligence (cs.AI)","Robotics (cs.RO),  Artificial Intelligence (cs.AI)"
1050,arXiv:2410.16857,Nash Meets Wertheimer: Using Good Continuation in Jigsaw Puzzles,纳什遇见韦特海默：在拼图游戏中使用良好的连续性,"Marina Khoroshiltseva, Luca Palmieri, Sinem Aslan, Sebastiano Vascon, Marcello Pelillo",https://arxiv.org/pdf/2410.16857.pdf,"Subjects:
Computer Science and Game Theory (cs.GT); Computer Vision and Pattern Recognition (cs.CV)","Computer Science and Game Theory (cs.GT),  Computer Vision and Pattern Recognition (cs.CV)"
1051,arXiv:2410.16855,Tracing the Development of the Virtual Particle Concept Using Semantic Change Detection,利用语义变化检测追踪虚拟粒子概念的发展,"Michael Zichert, Adrian Wüthrich",https://arxiv.org/pdf/2410.16855.pdf,"Subjects:
Computation and Language (cs.CL); History and Philosophy of Physics (physics.hist-ph)","Computation and Language (cs.CL),  History and Philosophy of Physics (physics.hist-ph)"
1052,arXiv:2410.16853,Bridging the Modality Gap: Dimension Information Alignment and Sparse Spatial Constraint for Image-Text Matching,弥合模态差距：图像文本匹配的维度信息对齐和稀疏空间约束,"Xiang Ma, Xuemei Li, Lexin Fang, Caiming Zhang",https://arxiv.org/pdf/2410.16853.pdf,"Subjects:
Computer Vision and Pattern Recognition (cs.CV); Information Retrieval (cs.IR)","Computer Vision and Pattern Recognition (cs.CV),  Information Retrieval (cs.IR)"
1053,arXiv:2410.16851,Toolpath Generation for High Density Spatial Fiber Printing Guided by Principal Stresses,主应力引导下高密度空间光纤印刷的刀具轨迹生成,"Tianyu Zhang, Tao Liu, Neelotpal Dutta, Yongxue Chen, Renbo Su, Zhizhou Zhang, Weiming Wang, Charlie C.L. Wang",https://arxiv.org/pdf/2410.16851.pdf,"Subjects:
Graphics (cs.GR); Computational Geometry (cs.CG)","Graphics (cs.GR),  Computational Geometry (cs.CG)"
1054,arXiv:2410.16848,ETHIC: Evaluating Large Language Models on Long-Context Tasks with High Information Coverage,ETHIC：在具有高信息覆盖率的长上下文任务中评估大型语言模型,"Taewhoo Lee, Chanwoong Yoon, Kyochul Jang, Donghyeon Lee, Minju Song, Hyunjae Kim, Jaewoo Kang",https://arxiv.org/pdf/2410.16848.pdf,"Subjects:
Computation and Language (cs.CL)",Computation and Language (cs.CL)
1055,arXiv:2410.16846,Safe Load Balancing in Software-Defined-Networking,软件定义网络中的安全负载平衡,"Lam Dinh, Pham Tran Anh Quang, Jérémie Leguay",https://arxiv.org/pdf/2410.16846.pdf,"Subjects:
Networking and Internet Architecture (cs.NI); Machine Learning (cs.LG)","Networking and Internet Architecture (cs.NI),  Machine Learning (cs.LG)"
1056,arXiv:2410.16845,Fast Graph Sharpness-Aware Minimization for Enhancing and Accelerating Few-Shot Node Classification,快速图锐度感知最小化增强和加速少镜头节点分类,"Yihong Luo, Yuhan Chen, Siya Qiu, Yiwei Wang, Chen Zhang, Yan Zhou, Xiaochun Cao, Jing Tang",https://arxiv.org/pdf/2410.16845.pdf,"Subjects:
Machine Learning (cs.LG); Artificial Intelligence (cs.AI)","Machine Learning (cs.LG),  Artificial Intelligence (cs.AI)"
1057,arXiv:2410.16843,Trustworthy Alignment of Retrieval-Augmented Large Language Models via Reinforcement Learning,通过强化学习实现检索增强大型语言模型的可信对齐,"Zongmeng Zhang, Yufeng Shi, Jinhua Zhu, Wengang Zhou, Xiang Qi, Peng Zhang, Houqiang Li",https://arxiv.org/pdf/2410.16843.pdf,"Subjects:
Computation and Language (cs.CL)",Computation and Language (cs.CL)
