Unnamed: 0,id,title,title_zh,authors,url,subjects,subject_split
491,arXiv:2410.18012,MiniFed : Integrating LLM-based Agentic-Workflow for Simulating FOMC Meeting,MiniFed：集成基于LLM的代理工作流以模拟FOMC会议,"Sungil Seok, Qiyuan Yang, Juan Feng, Shuide Wen, Wenming Yang",https://arxiv.org/pdf/2410.18012.pdf,"Subjects:
Social and Information Networks (cs.SI)",Social and Information Networks (cs.SI)
492,arXiv:2410.18007,Effective Finite Time Stability Control for Human-Machine Shared Vehicle Following System,人机共享车辆跟驰系统的有效有限时间稳定性控制,"Zihan Wang, Mengran Li, Ronghui Zhang, Jing Zhao, Chuan Hu, Xiaolei Ma, Zhijun Qiu",https://arxiv.org/pdf/2410.18007.pdf,"Subjects:
Systems and Control (eess.SY)",Systems and Control (eess.SY)
493,arXiv:2410.18005,Random space-time sampling and reconstruction of sparse bandlimited graph diffusion field,稀疏带限图扩散场的随机时空采样与重构,"Longxiu Huang, Dongyang Li, Sui Tang, Qing Yao",https://arxiv.org/pdf/2410.18005.pdf,"Subjects:
Numerical Analysis (math.NA); Information Theory (cs.IT)","Numerical Analysis (math.NA),  Information Theory (cs.IT)"
494,arXiv:2410.18003,Inferring stability properties of chaotic systems on autoencoders' latent spaces,在自编码器的潜在空间上推断混沌系统的稳定性,"Elise Özalp, Luca Magri",https://arxiv.org/pdf/2410.18003.pdf,"Subjects:
Machine Learning (cs.LG); Chaotic Dynamics (nlin.CD)","Machine Learning (cs.LG),  Chaotic Dynamics (nlin.CD)"
495,arXiv:2410.18002,"Digital Network Twins for Next-generation Wireless: Creation, Optimization, and Challenges",下一代无线数字网络双胞胎：创建、优化和挑战,"Yuchen Liu, Zhiyuan Peng, Zifan Zhang, Hanzhi Yu, Mingzhe Chen",https://arxiv.org/pdf/2410.18002.pdf,"Subjects:
Networking and Internet Architecture (cs.NI)",Networking and Internet Architecture (cs.NI)
496,arXiv:2410.18001,Benchmarking Foundation Models on Exceptional Cases: Dataset Creation and Validation,特殊情况下的基准基础模型：数据集创建和验证,"Suho Kang, Jungyang Park, Joonseo Ha, SoMin Kim, JinHyeong Kim, Subeen Park, Kyungwoo Song",https://arxiv.org/pdf/2410.18001.pdf,"Subjects:
Artificial Intelligence (cs.AI)",Artificial Intelligence (cs.AI)
497,arXiv:2410.17998,Estimating the Spectral Moments of the Kernel Integral Operator from Finite Sample Matrices,从有限样本矩阵估计核积分算子的谱矩,"Chanwoo Chun, SueYeon Chung, Daniel D. Lee",https://arxiv.org/pdf/2410.17998.pdf,"Subjects:
Machine Learning (cs.LG); Spectral Theory (math.SP); Statistics Theory (math.ST); Machine Learning (stat.ML)","Machine Learning (cs.LG),  Spectral Theory (math.SP),  Statistics Theory (math.ST),  Machine Learning (stat.ML)"
498,arXiv:2410.17997,Characterization of the multiplicity of solutions for camera pose given two vertically-aligned landmarks and accelerometer,给定两个垂直对齐的界标和加速度计的相机姿态解的多样性特征,Alexander R. Pruss,https://arxiv.org/pdf/2410.17997.pdf,"Subjects:
Computer Vision and Pattern Recognition (cs.CV)",Computer Vision and Pattern Recognition (cs.CV)
499,arXiv:2410.17991,AI driven health recommender,AI驱动的健康推荐器,"K. Vignesh, B. Pranavi, Ch. Sreenidhi",https://arxiv.org/pdf/2410.17991.pdf,"Subjects:
Artificial Intelligence (cs.AI)",Artificial Intelligence (cs.AI)
500,arXiv:2410.17989,Striking a New Chord: Neural Networks in Music Information Dynamics,谱写新的和弦：音乐信息动力学中的神经网络,"Farshad Jafari, Claire Arthur",https://arxiv.org/pdf/2410.17989.pdf,"Subjects:
Information Theory (cs.IT)",Information Theory (cs.IT)
501,arXiv:2410.17988,A Pipeline for Segmenting and Structuring RGB-D Data for Robotics Applications,用于机器人应用的RGB-D数据分段和结构化管道,"Zhiwu Zheng, Lauren Mentzer, Berk Iskender, Michael Price, Colm Prendergast, Audren Cloitre",https://arxiv.org/pdf/2410.17988.pdf,"Subjects:
Computer Vision and Pattern Recognition (cs.CV); Robotics (cs.RO)","Computer Vision and Pattern Recognition (cs.CV),  Robotics (cs.RO)"
502,arXiv:2410.17986,Federated Transformer: Multi-Party Vertical Federated Learning on Practical Fuzzily Linked Data,联邦变换器：基于实际模糊关联数据的多方垂直联邦学习,"Zhaomin Wu, Junyi Hou, Yiqun Diao, Bingsheng He",https://arxiv.org/pdf/2410.17986.pdf,"Subjects:
Machine Learning (cs.LG); Artificial Intelligence (cs.AI); Cryptography and Security (cs.CR)","Machine Learning (cs.LG),  Artificial Intelligence (cs.AI),  Cryptography and Security (cs.CR)"
503,arXiv:2410.17983,Robust Two-View Geometry Estimation with Implicit Differentiation,具有隐式微分的鲁棒双视图几何估计,"Vladislav Pyatov, Iaroslav Koshelev, Stamatis Lefkimmiatis",https://arxiv.org/pdf/2410.17983.pdf,"Subjects:
Computer Vision and Pattern Recognition (cs.CV); Robotics (cs.RO)","Computer Vision and Pattern Recognition (cs.CV),  Robotics (cs.RO)"
504,arXiv:2410.17980,Stick-breaking Attention,断棍注意,"Shawn Tan, Yikang Shen, Songlin Yang, Aaron Courville, Rameswar Panda",https://arxiv.org/pdf/2410.17980.pdf,"Subjects:
Machine Learning (cs.LG)",Machine Learning (cs.LG)
505,arXiv:2410.17973,Together We Can: Multilingual Automatic Post-Editing for Low-Resource Languages,携手共进：低资源语言的多语言自动帖子编辑,"Sourabh Deoghare, Diptesh Kanojia, Pushpak Bhattacharyya",https://arxiv.org/pdf/2410.17973.pdf,"Subjects:
Computation and Language (cs.CL)",Computation and Language (cs.CL)
506,arXiv:2410.17972,Dependency Graph Parsing as Sequence Labeling,依赖图解析作为序列标记,"Ana Ezquerro, David Vilares, Carlos Gómez-Rodríguez",https://arxiv.org/pdf/2410.17972.pdf,"Subjects:
Computation and Language (cs.CL)",Computation and Language (cs.CL)
507,arXiv:2410.17971,Dynamic Spectrum Access for Ambient Backscatter Communication-assisted D2D Systems with Quantum Reinforcement Learning,基于量子强化学习的环境背散射通信辅助D2D系统的动态频谱接入,"Nguyen Van Huynh, Bolun Zhang, Dinh-Hieu Tran, Dinh Thai Hoang, Diep N. Nguyen, Gan Zheng, Dusit Niyato, Quoc-Viet Pham",https://arxiv.org/pdf/2410.17971.pdf,"Subjects:
Networking and Internet Architecture (cs.NI); Artificial Intelligence (cs.AI)","Networking and Internet Architecture (cs.NI),  Artificial Intelligence (cs.AI)"
508,arXiv:2410.17970,Optical Generative Models,光学生成模型,"Shiqi Chen, Yuhang Li, Hanlong Chen, Aydogan Ozcan",https://arxiv.org/pdf/2410.17970.pdf,"Subjects:
Neural and Evolutionary Computing (cs.NE); Machine Learning (cs.LG); Applied Physics (physics.app-ph); Optics (physics.optics)","Neural and Evolutionary Computing (cs.NE),  Machine Learning (cs.LG),  Applied Physics (physics.app-ph),  Optics (physics.optics)"
509,arXiv:2410.17967,POMDP-Driven Cognitive Massive MIMO Radar: Joint Target Detection-Tracking In Unknown Disturbances,POMDP驱动的认知大规模MIMO雷达：未知干扰下的联合目标检测跟踪,"Imad Bouhou, Stefano Fortunati, Leila Gharsalli, Alexandre Renaux",https://arxiv.org/pdf/2410.17967.pdf,"Subjects:
Machine Learning (cs.LG); Signal Processing (eess.SP); Applications (stat.AP)","Machine Learning (cs.LG),  Signal Processing (eess.SP),  Applications (stat.AP)"
510,arXiv:2410.17963,A Time-Aware Approach to Early Detection of Anorexia: UNSL at eRisk 2024,一种时间感知的厌食症早期检测方法：eRisk 2024上的UNSL,"Horacio Thompson, Marcelo Errecalde",https://arxiv.org/pdf/2410.17963.pdf,"Subjects:
Computers and Society (cs.CY); Computation and Language (cs.CL); Machine Learning (cs.LG)","Computers and Society (cs.CY),  Computation and Language (cs.CL),  Machine Learning (cs.LG)"
511,arXiv:2410.17961,Closed-form merging of parameter-efficient modules for Federated Continual Learning,联邦连续学习中参数高效模块的闭式合并,"Riccardo Salami, Pietro Buzzega, Matteo Mosconi, Jacopo Bonato, Luigi Sabetta, Simone Calderara",https://arxiv.org/pdf/2410.17961.pdf,"Subjects:
Machine Learning (cs.LG); Artificial Intelligence (cs.AI)","Machine Learning (cs.LG),  Artificial Intelligence (cs.AI)"
512,arXiv:2410.17960,Zeitenwenden: Detecting changes in the German political discourse,Zeitenwenden：检测德国政治话语的变化,"Kai-Robin Lange, Jonas Rieger, Niklas Benner, Carsten Jentsch",https://arxiv.org/pdf/2410.17960.pdf,"Subjects:
Computation and Language (cs.CL)",Computation and Language (cs.CL)
513,arXiv:2410.17958,Lower Bounds for Convexity Testing,凸性测试的下限,"Xi Chen, Anindya De, Shivam Nadimpalli, Rocco A. Servedio, Erik Waingarten",https://arxiv.org/pdf/2410.17958.pdf,"Subjects:
Computational Complexity (cs.CC); Data Structures and Algorithms (cs.DS)","Computational Complexity (cs.CC),  Data Structures and Algorithms (cs.DS)"
514,arXiv:2410.17957,MCUBERT: Memory-Efficient BERT Inference on Commodity Microcontrollers,MCUBERT：商品微控制器上的内存高效BERT推理,"Zebin Yang, Renze Chen, Taiqiang Wu, Ngai Wong, Yun Liang, Runsheng Wang, Ru Huang, Meng Li",https://arxiv.org/pdf/2410.17957.pdf,"Subjects:
Machine Learning (cs.LG); Artificial Intelligence (cs.AI)","Machine Learning (cs.LG),  Artificial Intelligence (cs.AI)"
515,arXiv:2410.17954,ExpertFlow: Optimized Expert Activation and Token Allocation for Efficient Mixture-of-Experts Inference,ExpertFlow：优化专家激活和令牌分配，实现专家推理的有效混合,"Xin He, Shunkang Zhang, Yuxin Wang, Haiyan Yin, Zihao Zeng, Shaohuai Shi, Zhenheng Tang, Xiaowen Chu, Ivor Tsang, Ong Yew Soon",https://arxiv.org/pdf/2410.17954.pdf,"Subjects:
Artificial Intelligence (cs.AI); Computation and Language (cs.CL)","Artificial Intelligence (cs.AI),  Computation and Language (cs.CL)"
516,arXiv:2410.17952,SimRAG: Self-Improving Retrieval-Augmented Generation for Adapting Large Language Models to Specialized Domains,SimRAG：用于使大型语言模型适应特定领域的自改进检索增强生成,"Ran Xu, Hui Liu, Sreyashi Nag, Zhenwei Dai, Yaochen Xie, Xianfeng Tang, Chen Luo, Yang Li, Joyce C. Ho, Carl Yang, Qi He",https://arxiv.org/pdf/2410.17952.pdf,"Subjects:
Computation and Language (cs.CL); Artificial Intelligence (cs.AI); Information Retrieval (cs.IR); Machine Learning (cs.LG)","Computation and Language (cs.CL),  Artificial Intelligence (cs.AI),  Information Retrieval (cs.IR),  Machine Learning (cs.LG)"
517,arXiv:2410.17950,Benchmarking Floworks against OpenAI & Anthropic: A Novel Framework for Enhanced LLM Function Calling,将Flowworks与OpenAI和Anthropic进行对标：一种增强LLM函数调用的新框架,"Nirav Bhan, Shival Gupta, Sai Manaswini, Ritik Baba, Narun Yadav, Hillori Desai, Yash Choudhary, Aman Pawar, Sarthak Shrivastava, Sudipta Biswas",https://arxiv.org/pdf/2410.17950.pdf,"Subjects:
Artificial Intelligence (cs.AI)",Artificial Intelligence (cs.AI)
518,arXiv:2410.17948,Generalized Resubstitution for Regression Error Estimation,回归误差估计的广义恢复,"Diego Marcondes, Ulisses Braga-Neto",https://arxiv.org/pdf/2410.17948.pdf,"Subjects:
Machine Learning (cs.LG)",Machine Learning (cs.LG)
519,arXiv:2410.17947,Role of hydrogen in decarbonizing China's electricity and hard-to-abate sectors,氢在中国电力脱碳和难以减排行业中的作用,"Haozhe Yang, Gang He, Eric Masanet, Ranjit Deshmukh",https://arxiv.org/pdf/2410.17947.pdf,"Subjects:
Systems and Control (eess.SY)",Systems and Control (eess.SY)
520,arXiv:2410.17945,"Theoretically Grounded Pruning of Large Ground Sets for Constrained, Discrete Optimization",约束离散优化的大型地面修剪理论基础,"Ankur Nath, Alan Kuhnle",https://arxiv.org/pdf/2410.17945.pdf,"Subjects:
Data Structures and Algorithms (cs.DS); Machine Learning (cs.LG)","Data Structures and Algorithms (cs.DS),  Machine Learning (cs.LG)"
521,arXiv:2410.17943,"Optimizing Travel Itineraries with AI Algorithms in a Microservices Architecture: Balancing Cost, Time, Preferences, and Sustainability",在微服务架构中使用AI算法优化旅行路线：平衡成本、时间、偏好和可持续性,"Biman Barua, M. Shamim Kaiser",https://arxiv.org/pdf/2410.17943.pdf,"Subjects:
Software Engineering (cs.SE); Artificial Intelligence (cs.AI); Computers and Society (cs.CY); Machine Learning (cs.LG)","Software Engineering (cs.SE),  Artificial Intelligence (cs.AI),  Computers and Society (cs.CY),  Machine Learning (cs.LG)"
522,arXiv:2410.17941,Spiking Graph Neural Network on Riemannian Manifolds,黎曼流形上的尖峰图神经网络,"Li Sun, Zhenhao Huang, Qiqi Wan, Hao Peng, Philip S. Yu",https://arxiv.org/pdf/2410.17941.pdf,"Subjects:
Machine Learning (cs.LG)",Machine Learning (cs.LG)
523,arXiv:2410.17938,Polytope Division Method: A Scalable Sampling Method for Problems with High-dimensional Parameters,多面体分割法：一种高维参数问题的可扩展采样方法,"Evie Nielen, Oliver Tse, Karen Veroy",https://arxiv.org/pdf/2410.17938.pdf,"Subjects:
Numerical Analysis (math.NA)",Numerical Analysis (math.NA)
524,arXiv:2410.17937,Toward path-invariant embeddings for local distance source characterization,局部距离源特征的路径不变嵌入,"Lisa Linville, Chengping Chai, Nathan Marthindale, Jacob Smith, Scott Stewart, Asmeret Naugle",https://arxiv.org/pdf/2410.17937.pdf,"Subjects:
Computational Engineering, Finance, and Science (cs.CE)","Computational Engineering, Finance, and Science (cs.CE)"
525,arXiv:2410.17936,Reconfigurable Hydrostatics: Toward Multifunctional and Powerful Wearable Robotics,可重构流体静力学：迈向多功能、强大的可穿戴机器人,"Jeff Denis, Frederic Laberge, Jean-Sebastien Plante, Alexandre Girard",https://arxiv.org/pdf/2410.17936.pdf,"Subjects:
Robotics (cs.RO); Systems and Control (eess.SY)","Robotics (cs.RO),  Systems and Control (eess.SY)"
526,arXiv:2410.17933,Multi-Continental Healthcare Modelling Using Blockchain-Enabled Federated Learning,基于区块链的联邦学习的多大陆医疗保健建模,"Rui Sun, Zhipeng Wang, Hengrui Zhang, Ming Jiang, Yizhe Wen, Jiqun Zhang, Jiahao Sun, Shuoying Zhang, Erwu Liu, Kezhi Li",https://arxiv.org/pdf/2410.17933.pdf,"Subjects:
Machine Learning (cs.LG); Artificial Intelligence (cs.AI); Cryptography and Security (cs.CR)","Machine Learning (cs.LG),  Artificial Intelligence (cs.AI),  Cryptography and Security (cs.CR)"
527,arXiv:2410.17932,VR-Splatting: Foveated Radiance Field Rendering via 3D Gaussian Splatting and Neural Points,VR散点：通过3D高斯散点和神经点进行聚焦辐射场渲染,"Linus Franke, Laura Fink, Marc Stamminger",https://arxiv.org/pdf/2410.17932.pdf,"Subjects:
Computer Vision and Pattern Recognition (cs.CV); Graphics (cs.GR)","Computer Vision and Pattern Recognition (cs.CV),  Graphics (cs.GR)"
528,arXiv:2410.17931,ARAS: An Adaptive Low-Cost ReRAM-Based Accelerator for DNNs,ARAS:一种基于ReRAM的自适应低成本DNN加速器,"Mohammad Sabri, Marc Riera, Antonio González",https://arxiv.org/pdf/2410.17931.pdf,"Subjects:
Hardware Architecture (cs.AR)",Hardware Architecture (cs.AR)
529,arXiv:2410.17928,"SJMalloc: the security-conscious, fast, thread-safe and memory-efficient heap allocator",SJMalloc：具有安全意识、快速、线程安全和内存高效的堆分配器,Stephan Bauroth,https://arxiv.org/pdf/2410.17928.pdf,"Subjects:
Operating Systems (cs.OS); Cryptography and Security (cs.CR)","Operating Systems (cs.OS),  Cryptography and Security (cs.CR)"
530,arXiv:2410.17927,Dynamic Modeling and Vibration Analysis of Large Deployable Mesh Reflectors,大型可展开网状反射器的动力学建模与振动分析,"Jiajun Zhang, Christian Kazoleas, Weidong Zhu, Kai Zhou, Sichen Yuan",https://arxiv.org/pdf/2410.17927.pdf,"Subjects:
Computational Engineering, Finance, and Science (cs.CE); Applied Physics (physics.app-ph)","Computational Engineering, Finance, and Science (cs.CE),  Applied Physics (physics.app-ph)"
531,arXiv:2410.17925,Securing Stack Smashing Protection in WebAssembly Applications,确保WebAssembly应用程序中的堆栈崩溃保护,"Quentin Michaud, Yohan Pipereau, Olivier Levillain, Dhouha Ayed",https://arxiv.org/pdf/2410.17925.pdf,"Subjects:
Cryptography and Security (cs.CR)",Cryptography and Security (cs.CR)
532,arXiv:2410.17922,Guide for Defense (G4D): Dynamic Guidance for Robust and Balanced Defense in Large Language Models,防御指南（G4D）：大型语言模型中稳健和平衡防御的动态指导,"He Cao, Weidi Luo, Yu Wang, Zijing Liu, Bing Feng, Yuan Yao, Yu Li",https://arxiv.org/pdf/2410.17922.pdf,"Subjects:
Artificial Intelligence (cs.AI)",Artificial Intelligence (cs.AI)
533,arXiv:2410.17920,Gaze-Assisted Medical Image Segmentation,凝视辅助医学图像分割,"Leila Khaertdinova, Ilya Pershin, Tatiana Shmykova, Bulat Ibragimov",https://arxiv.org/pdf/2410.17920.pdf,"Subjects:
Computer Vision and Pattern Recognition (cs.CV)",Computer Vision and Pattern Recognition (cs.CV)
534,arXiv:2410.17918,Addressing Asynchronicity in Clinical Multimodal Fusion via Individualized Chest X-ray Generation,通过个性化胸部X射线生成解决临床多模式融合中的异步性,"Wenfang Yao, Chen Liu, Kejing Yin, William K. Cheung, Jing Qin",https://arxiv.org/pdf/2410.17918.pdf,"Subjects:
Computer Vision and Pattern Recognition (cs.CV); Artificial Intelligence (cs.AI); Machine Learning (cs.LG)","Computer Vision and Pattern Recognition (cs.CV),  Artificial Intelligence (cs.AI),  Machine Learning (cs.LG)"
535,arXiv:2410.17917,regAL: Python Package for Active Learning of Regression Problems,regAL：用于主动学习回归问题的Python包,"Elizaveta Surzhikova, Jonny Proppe",https://arxiv.org/pdf/2410.17917.pdf,"Subjects:
Machine Learning (cs.LG); Software Engineering (cs.SE)","Machine Learning (cs.LG),  Software Engineering (cs.SE)"
536,arXiv:2410.17913,Deep learning for model correction of dynamical systems with data scarcity,数据稀缺动态系统模型校正的深度学习,"Caroline Tatsuoka, Dongbin Xiu",https://arxiv.org/pdf/2410.17913.pdf,"Subjects:
Machine Learning (cs.LG); Dynamical Systems (math.DS); Machine Learning (stat.ML)","Machine Learning (cs.LG),  Dynamical Systems (math.DS),  Machine Learning (stat.ML)"
537,arXiv:2410.17910,Slot: Provenance-Driven APT Detection through Graph Reinforcement Learning,Slot：通过图强化学习进行源驱动APT检测,"Wei Qiao, Yebo Feng, Teng Li, Zijian Zhang, Zhengzi Xu, Zhuo Ma, Yulong Shen, JianFeng Ma, Yang Liu",https://arxiv.org/pdf/2410.17910.pdf,"Subjects:
Cryptography and Security (cs.CR)",Cryptography and Security (cs.CR)
538,arXiv:2410.17909,AI as a Bridge Across Ages: Exploring The Opportunities of Artificial Intelligence in Supporting Inter-Generational Communication in Virtual Reality,人工智能作为跨越时代的桥梁：探索人工智能在虚拟现实中支持代际交流的机会,"Qiuxin Du, Xiaoying Wei, Jiawei Li, Emily Kuang, Jie Hao, Dongdong Weng, Mingming Fan",https://arxiv.org/pdf/2410.17909.pdf,"Subjects:
Human-Computer Interaction (cs.HC)",Human-Computer Interaction (cs.HC)
539,arXiv:2410.17907,Adaptive Test Generation with Qgrams,基于Qgrams的自适应测试生成,"Matteo Biagiola, Robert Feldt, Paolo Tonella",https://arxiv.org/pdf/2410.17907.pdf,"Subjects:
Software Engineering (cs.SE)",Software Engineering (cs.SE)
540,arXiv:2410.17906,Leveraging Deep Learning for Time Series Extrinsic Regression in predicting photometric metallicity of Fundamental-mode RR Lyrae Stars,利用深度学习进行时间序列外部回归预测天琴座RR基模恒星的光度金属丰度,"Lorenzo Monti, Tatiana Muraveva, Gisella Clementini, Alessia Garofalo",https://arxiv.org/pdf/2410.17906.pdf,"Subjects:
Artificial Intelligence (cs.AI); Instrumentation and Methods for Astrophysics (astro-ph.IM)","Artificial Intelligence (cs.AI),  Instrumentation and Methods for Astrophysics (astro-ph.IM)"
541,arXiv:2410.17904,Reinforcement Learning under Latent Dynamics: Toward Statistical and Algorithmic Modularity,潜在动力学下的强化学习：迈向统计和算法模块化,"Philip Amortila, Dylan J. Foster, Nan Jiang, Akshay Krishnamurthy, Zakaria Mhammedi",https://arxiv.org/pdf/2410.17904.pdf,"Subjects:
Machine Learning (cs.LG); Artificial Intelligence (cs.AI); Optimization and Control (math.OC); Machine Learning (stat.ML)","Machine Learning (cs.LG),  Artificial Intelligence (cs.AI),  Optimization and Control (math.OC),  Machine Learning (stat.ML)"
542,arXiv:2410.17901,ELAICHI: Enhancing Low-resource TTS by Addressing Infrequent and Low-frequency Character Bigrams,ELAICHI：通过解决不常见和低频字符双元组来增强低资源TTS,"Srija Anand, Praveen Srinivasa Varadhan, Mehak Singal, Mitesh M. Khapra",https://arxiv.org/pdf/2410.17901.pdf,"Subjects:
Computation and Language (cs.CL); Audio and Speech Processing (eess.AS)","Computation and Language (cs.CL),  Audio and Speech Processing (eess.AS)"
543,arXiv:2410.17898,Scalable Offline Reinforcement Learning for Mean Field Games,平均场游戏的可扩展离线强化学习,"Axel Brunnbauer, Julian Lemmel, Zahra Babaiee, Sophie Neubauer, Radu Grosu",https://arxiv.org/pdf/2410.17898.pdf,"Subjects:
Machine Learning (cs.LG); Multiagent Systems (cs.MA)","Machine Learning (cs.LG),  Multiagent Systems (cs.MA)"
544,arXiv:2410.17897,Value Residual Learning For Alleviating Attention Concentration In Transformers,价值残差学习缓解变压器注意力集中,"Zhanchao Zhou, Tianyi Wu, Zhiyun Jiang, Zhenzhong Lan",https://arxiv.org/pdf/2410.17897.pdf,"Subjects:
Computation and Language (cs.CL)",Computation and Language (cs.CL)
545,arXiv:2410.17891,Scaling Diffusion Language Models via Adaptation from Autoregressive Models,通过自适应自回归模型来缩放扩散语言模型,"Shansan Gong, Shivam Agarwal, Yizhe Zhang, Jiacheng Ye, Lin Zheng, Mukai Li, Chenxin An, Peilin Zhao, Wei Bi, Jiawei Han, Hao Peng, Lingpeng Kong",https://arxiv.org/pdf/2410.17891.pdf,"Subjects:
Computation and Language (cs.CL)",Computation and Language (cs.CL)
546,arXiv:2410.17886,SpeakGer: A meta-data enriched speech corpus of German state and federal parliaments,SpeakGer：一个富含元数据的德国州和联邦议会语音语料库,"Kai-Robin Lange, Carsten Jentsch",https://arxiv.org/pdf/2410.17886.pdf,"Subjects:
Computation and Language (cs.CL)",Computation and Language (cs.CL)
547,arXiv:2410.17885,R-CoT: Reverse Chain-of-Thought Problem Generation for Geometric Reasoning in Large Multimodal Models,R-CoT：大型多模态模型中几何推理的逆向思维链问题生成,"Linger Deng, Yuliang Liu, Bohan Li, Dongliang Luo, Liang Wu, Chengquan Zhang, Pengyuan Lyu, Ziyang Zhang, Gang Zhang, Errui Ding, Yingying Zhu, Xiang Bai",https://arxiv.org/pdf/2410.17885.pdf,"Subjects:
Artificial Intelligence (cs.AI); Computer Vision and Pattern Recognition (cs.CV)","Artificial Intelligence (cs.AI),  Computer Vision and Pattern Recognition (cs.CV)"
548,arXiv:2410.17883,Lightweight Neural App Control,轻量级神经应用程序控制,"Filippos Christianos, Georgios Papoudakis, Thomas Coste, Jianye Hao, Jun Wang, Kun Shao",https://arxiv.org/pdf/2410.17883.pdf,"Subjects:
Artificial Intelligence (cs.AI)",Artificial Intelligence (cs.AI)
549,arXiv:2410.17882,Identifiable Representation and Model Learning for Latent Dynamic Systems,潜在动态系统的可识别表示和模型学习,"Congxi Zhang, Yongchun Xie",https://arxiv.org/pdf/2410.17882.pdf,"Subjects:
Machine Learning (cs.LG); Systems and Control (eess.SY); Machine Learning (stat.ML)","Machine Learning (cs.LG),  Systems and Control (eess.SY),  Machine Learning (stat.ML)"
550,arXiv:2410.17881,AdaRankGrad: Adaptive Gradient-Rank and Moments for Memory-Efficient LLMs Training and Fine-Tuning,AdaRankGrad：用于记忆高效LLM训练和微调的自适应梯度秩和矩,"Yehonathan Refael, Jonathan Svirsky, Boris Shustin, Wasim Huleihel, Ofir Lindenbaum",https://arxiv.org/pdf/2410.17881.pdf,"Subjects:
Machine Learning (cs.LG)",Machine Learning (cs.LG)
551,arXiv:2410.17880,A utility-based spatial analysis of residential street-level conditions; A case study of Rotterdam,基于效用的住宅街道级条件空间分析；鹿特丹案例研究,"Sander van Cranenburgh, Francisco Garrido-Valenzuela",https://arxiv.org/pdf/2410.17880.pdf,"Subjects:
Computer Vision and Pattern Recognition (cs.CV)",Computer Vision and Pattern Recognition (cs.CV)
552,arXiv:2410.17878,Relaxed Equivariance via Multitask Learning,通过多任务学习放松均衡,"Ahmed A. Elhag, T. Konstantin Rusch, Francesco Di Giovanni, Michael Bronstein",https://arxiv.org/pdf/2410.17878.pdf,"Subjects:
Machine Learning (cs.LG)",Machine Learning (cs.LG)
553,arXiv:2410.17875,Understanding Layer Significance in LLM Alignment,理解LLM对齐中的层意义,"Guangyuan Shi, Zexin Lu, Xiaoyu Dong, Wenlong Zhang, Xuanyu Zhang, Yujie Feng, Xiao-Ming Wu",https://arxiv.org/pdf/2410.17875.pdf,"Subjects:
Computation and Language (cs.CL); Artificial Intelligence (cs.AI)","Computation and Language (cs.CL),  Artificial Intelligence (cs.AI)"
554,arXiv:2410.17872,A Method to Reduce the Complexity of Computing the Complete Weight Distribution of Polar Codes,一种降低极坐标码全权分布计算复杂度的方法,"Zhichao Liu, Zhiming Ma, Guiying Yan",https://arxiv.org/pdf/2410.17872.pdf,"Subjects:
Information Theory (cs.IT)",Information Theory (cs.IT)
555,arXiv:2410.17865,Population stratification for prediction of mortality in post-AKI patients,预测急性肾损伤后患者死亡率的人群分层,"Flavio S. Correa da Silva, Simon Sawhney",https://arxiv.org/pdf/2410.17865.pdf,"Subjects:
Machine Learning (cs.LG)",Machine Learning (cs.LG)
556,arXiv:2410.17859,DataTales: A Benchmark for Real-World Intelligent Data Narration,数据销售：现实世界智能数据叙述的基准,"Yajing Yang, Qian Liu, Min-Yen Kan",https://arxiv.org/pdf/2410.17859.pdf,"Subjects:
Artificial Intelligence (cs.AI)",Artificial Intelligence (cs.AI)
