Unnamed: 0,id,title,title_zh,authors,url,subjects,subject_split
357,arXiv:2409.18895,Multi-Source Hard and Soft Information Fusion Approach for Accurate Cryptocurrency Price Movement Prediction,加密货币价格走势准确预测的多源软硬信息融合方法,"Saeed Mohammadi Dashtaki, Mehdi Hosseini Chagahi, Behzad Moshiri, Md. Jalil Piran",https://arxiv.org/pdf/2409.18895.pdf,"Subjects:
Machine Learning (cs.LG); Artificial Intelligence (cs.AI)","Machine Learning (cs.LG),  Artificial Intelligence (cs.AI)"
358,arXiv:2409.18893,HM3: Hierarchical Multi-Objective Model Merging for Pretrained Models,HM3：预训练模型的分层多目标模型合并,"Yu Zhou, Xingyu Wu, Jibin Wu, Liang Feng, Kay Chen Tan",https://arxiv.org/pdf/2409.18893.pdf,"Subjects:
Machine Learning (cs.LG)",Machine Learning (cs.LG)
359,arXiv:2409.18892,IDGen: Item Discrimination Induced Prompt Generation for LLM Evaluation,IDGen:LLM评估的项目判别诱导提示生成,"Fan Lin, Shuyi Xie, Yong Dai, Wenlin Yao, Tianjiao Lang, Zishan Xu, Zhichao Hu, Xiao Xiao, Yuhong Liu, Yu Zhang",https://arxiv.org/pdf/2409.18892.pdf,"Subjects:
Computation and Language (cs.CL)",Computation and Language (cs.CL)
360,arXiv:2409.18885,HR-Extreme: A High-Resolution Dataset for Extreme Weather Forecasting,HR Extreme：用于极端天气预报的高分辨率数据集,"Nian Ran, Peng Xiao, Yue Wang, Wesley Shi, Jianxin Lin, Qi Meng, Richard Allmendinger",https://arxiv.org/pdf/2409.18885.pdf,"Subjects:
Machine Learning (cs.LG)",Machine Learning (cs.LG)
361,arXiv:2409.18884,An Overview and Catalogue of Dependency Challenges in Open Source Software Package Registries,开源软件包注册表中的依赖性挑战概述和目录,"Tom Mens, Alexandre Decan",https://arxiv.org/pdf/2409.18884.pdf,"Subjects:
Software Engineering (cs.SE)",Software Engineering (cs.SE)
362,arXiv:2409.18881,Explainable Artifacts for Synthetic Western Blot Source Attribution,合成蛋白质印迹来源归因的可解释伪影,"João Phillipe Cardenuto, Sara Mandelli, Daniel Moreira, Paolo Bestagini, Edward Delp, Anderson Rocha",https://arxiv.org/pdf/2409.18881.pdf,"Subjects:
Computer Vision and Pattern Recognition (cs.CV)",Computer Vision and Pattern Recognition (cs.CV)
363,arXiv:2409.18878,Suicide Phenotyping from Clinical Notes in Safety-Net Psychiatric Hospital Using Multi-Label Classification with Pre-Trained Language Models,使用预先训练的语言模型进行多标签分类，从安全网精神病院的临床记录中识别自杀表型,"Zehan Li, Yan Hu, Scott Lane, Salih Selek, Lokesh Shahani, Rodrigo Machado-Vieira, Jair Soares, Hua Xu, Hongfang Liu, Ming Huang",https://arxiv.org/pdf/2409.18878.pdf,"Subjects:
Computation and Language (cs.CL); Artificial Intelligence (cs.AI); Computers and Society (cs.CY); Information Retrieval (cs.IR)","Computation and Language (cs.CL),  Artificial Intelligence (cs.AI),  Computers and Society (cs.CY),  Information Retrieval (cs.IR)"
364,arXiv:2409.18877,UniEmoX: Cross-modal Semantic-Guided Large-Scale Pretraining for Universal Scene Emotion Perception,UniEmoX：跨模态语义引导的大规模场景情感感知预训练,"Chuang Chen, Xiao Sun, Zhi Liu",https://arxiv.org/pdf/2409.18877.pdf,"Subjects:
Artificial Intelligence (cs.AI); Computer Vision and Pattern Recognition (cs.CV)","Artificial Intelligence (cs.AI),  Computer Vision and Pattern Recognition (cs.CV)"
365,arXiv:2409.18876,CemiFace: Center-based Semi-hard Synthetic Face Generation for Face Recognition,CemiFace：基于中心的半硬合成人脸识别算法,"Zhonglin Sun, Siyang Song, Ioannis Patras, Georgios Tzimiropoulos",https://arxiv.org/pdf/2409.18876.pdf,"Subjects:
Computer Vision and Pattern Recognition (cs.CV)",Computer Vision and Pattern Recognition (cs.CV)
366,arXiv:2409.18874,CESNET-TimeSeries24: Time Series Dataset for Network Traffic Anomaly Detection and Forecasting,CESNET-TimeSeries24：用于网络流量异常检测和预测的时间序列数据集,"Josef Koumar, Karel Hynek, Tomáš Čejka, Pavel Šiška",https://arxiv.org/pdf/2409.18874.pdf,"Subjects:
Machine Learning (cs.LG); Artificial Intelligence (cs.AI)","Machine Learning (cs.LG),  Artificial Intelligence (cs.AI)"
367,arXiv:2409.18869,Emu3: Next-Token Prediction is All You Need,Emu3：下一个代币预测是你所需要的,"Xinlong Wang, Xiaosong Zhang, Zhengxiong Luo, Quan Sun, Yufeng Cui, Jinsheng Wang, Fan Zhang, Yueze Wang, Zhen Li, Qiying Yu, Yingli Zhao, Yulong Ao, Xuebin Min, Tao Li, Boya Wu, Bo Zhao, Bowen Zhang, Liangdong Wang, Guang Liu, Zheqi He, Xi Yang, Jingjing Liu, Yonghua Lin, Tiejun Huang, Zhongyuan Wang",https://arxiv.org/pdf/2409.18869.pdf,"Subjects:
Computer Vision and Pattern Recognition (cs.CV)",Computer Vision and Pattern Recognition (cs.CV)
368,arXiv:2409.18868,Individuation in Neural Models with and without Visual Grounding,有视觉接地和无视觉接地的神经模型的个体化,"Alexey Tikhonov, Lisa Bylinina, Ivan P. Yamshchikov",https://arxiv.org/pdf/2409.18868.pdf,"Subjects:
Computation and Language (cs.CL); Artificial Intelligence (cs.AI); Machine Learning (cs.LG)","Computation and Language (cs.CL),  Artificial Intelligence (cs.AI),  Machine Learning (cs.LG)"
369,arXiv:2409.18867,Robust and efficient data-driven predictive control,稳健高效的数据驱动预测控制,"Mohammad Alsalti, Manuel Barkey, Victor G. Lopez, Matthias A. Müller",https://arxiv.org/pdf/2409.18867.pdf,"Subjects:
Systems and Control (eess.SY)",Systems and Control (eess.SY)
370,arXiv:2409.18866,MCUBench: A Benchmark of Tiny Object Detectors on MCUs,MCUBench:MCU上微小物体探测器的基准,"Sudhakar Sah, Darshan C. Ganji, Matteo Grimaldi, Ravish Kumar, Alexander Hoffman, Honnesh Rohmetra, Ehsan Saboori",https://arxiv.org/pdf/2409.18866.pdf,"Subjects:
Computer Vision and Pattern Recognition (cs.CV)",Computer Vision and Pattern Recognition (cs.CV)
371,arXiv:2409.18862,"Safe Decentralized Multi-Agent Control using Black-Box Predictors, Conformal Decision Policies, and Control Barrier Functions",使用黑盒预测器、共形决策策略和控制屏障函数的安全分散多智能体控制,"Sacha Huriot, Hussein Sibai",https://arxiv.org/pdf/2409.18862.pdf,"Subjects:
Systems and Control (eess.SY); Multiagent Systems (cs.MA); Robotics (cs.RO)","Systems and Control (eess.SY),  Multiagent Systems (cs.MA),  Robotics (cs.RO)"
372,arXiv:2409.18860,LW2G: Learning Whether to Grow for Prompt-based Continual Learning,LW2G：学习是否成长为基于提示的持续学习,"Qian Feng, Dawei Zhou, Hanbin Zhao, Chao Zhang, Hui Qian",https://arxiv.org/pdf/2409.18860.pdf,"Subjects:
Computer Vision and Pattern Recognition (cs.CV)",Computer Vision and Pattern Recognition (cs.CV)
373,arXiv:2409.18859,Challenges of Generating Structurally Diverse Graphs,生成结构多样图的挑战,"Fedor Velikonivtsev, Mikhail Mironov, Liudmila Prokhorenkova",https://arxiv.org/pdf/2409.18859.pdf,"Subjects:
Machine Learning (cs.LG)",Machine Learning (cs.LG)
374,arXiv:2409.18858,Predicting and analyzing memorization within fine-tuned Large Language Models,在微调的大型语言模型中预测和分析记忆,"Jérémie Dentan, Davide Buscaldi, Aymen Shabou, Sonia Vanier",https://arxiv.org/pdf/2409.18858.pdf,"Subjects:
Cryptography and Security (cs.CR)",Cryptography and Security (cs.CR)
375,arXiv:2409.18857,Mitigating Selection Bias with Node Pruning and Auxiliary Options,通过节点修剪和辅助选项减轻选择偏差,"Hyeong Kyu Choi, Weijie Xu, Chi Xue, Stephanie Eckman, Chandan K. Reddy",https://arxiv.org/pdf/2409.18857.pdf,"Subjects:
Artificial Intelligence (cs.AI)",Artificial Intelligence (cs.AI)
376,arXiv:2409.18852,Space-time 2D Gaussian Splatting for Accurate Surface Reconstruction under Complex Dynamic Scenes,复杂动态场景下精确曲面重建的时空二维高斯散斑,"Shuo Wang, Binbin Huang, Ruoyu Wang, Shenghua Gao",https://arxiv.org/pdf/2409.18852.pdf,"Subjects:
Computer Vision and Pattern Recognition (cs.CV)",Computer Vision and Pattern Recognition (cs.CV)
377,arXiv:2409.18850,Two Sparse Matrices are Better than One: Sparsifying Neural Networks with Double Sparse Factorization,两个稀疏矩阵优于一个：用双稀疏因子化稀疏神经网络,"Vladimír Boža, Vladimír Macko",https://arxiv.org/pdf/2409.18850.pdf,"Subjects:
Machine Learning (cs.LG)",Machine Learning (cs.LG)
378,arXiv:2409.18841,RNC: Efficient RRAM-aware NAS and Compilation for DNNs on Resource-Constrained Edge Devices,RNC：资源受限边缘设备上高效的RRAM感知NAS和DNN编译,"Kam Chi Loong, Shihao Han, Sishuo Liu, Ning Lin, Zhongrui Wang",https://arxiv.org/pdf/2409.18841.pdf,"Subjects:
Neural and Evolutionary Computing (cs.NE)",Neural and Evolutionary Computing (cs.NE)
379,arXiv:2409.18839,MinerU: An Open-Source Solution for Precise Document Content Extraction,MinerU：一种用于精确文档内容提取的开源解决方案,"Bin Wang, Chao Xu, Xiaomeng Zhao, Linke Ouyang, Fan Wu, Zhiyuan Zhao, Rui Xu, Kaiwen Liu, Yuan Qu, Fukai Shang, Bo Zhang, Liqun Wei, Zhihao Sui, Wei Li, Botian Shi, Yu Qiao, Dahua Lin, Conghui He",https://arxiv.org/pdf/2409.18839.pdf,"Subjects:
Computer Vision and Pattern Recognition (cs.CV)",Computer Vision and Pattern Recognition (cs.CV)
380,arXiv:2409.18835,Accelerating stencils on the Tenstorrent Grayskull RISC-V accelerator,Tenstorrent Grayskul RISC-V加速器上的加速模板,"Nick Brown, Ryan Barton",https://arxiv.org/pdf/2409.18835.pdf,"Subjects:
Distributed, Parallel, and Cluster Computing (cs.DC)","Distributed, Parallel, and Cluster Computing (cs.DC)"
381,arXiv:2409.18832,Classification and regression of trajectories rendered as images via 2D Convolutional Neural Networks,通过二维卷积神经网络对渲染为图像的轨迹进行分类和回归,"Mariaclaudia Nicolai, Raffaella Fiamma Cabini, Diego Ulisse Pizzagalli",https://arxiv.org/pdf/2409.18832.pdf,"Subjects:
Computer Vision and Pattern Recognition (cs.CV); Machine Learning (cs.LG)","Computer Vision and Pattern Recognition (cs.CV),  Machine Learning (cs.LG)"
382,arXiv:2409.18827,ARLBench: Flexible and Efficient Benchmarking for Hyperparameter Optimization in Reinforcement Learning,ARLBench：强化学习中超参数优化的灵活高效基准测试,"Jannis Becktepe, Julian Dierkes, Carolin Benjamins, Aditya Mohan, David Salinas, Raghu Rajan, Frank Hutter, Holger Hoos, Marius Lindauer, Theresa Eimer",https://arxiv.org/pdf/2409.18827.pdf,"Subjects:
Machine Learning (cs.LG)",Machine Learning (cs.LG)
383,arXiv:2409.18826,YOLOv8-ResCBAM: YOLOv8 Based on An Effective Attention Module for Pediatric Wrist Fracture Detection,YOLOv8-ResCBAM:YOLOv8基于儿童手腕骨折检测的有效注意力模块,"Rui-Yang Ju, Chun-Tse Chien, Jen-Shiun Chiang",https://arxiv.org/pdf/2409.18826.pdf,"Subjects:
Computer Vision and Pattern Recognition (cs.CV)",Computer Vision and Pattern Recognition (cs.CV)
384,arXiv:2409.18824,Fully integrating the Flang Fortran compiler with standard MLIR,将Flang Fortran编译器与标准MLIR完全集成,Nick Brown,https://arxiv.org/pdf/2409.18824.pdf,"Subjects:
Distributed, Parallel, and Cluster Computing (cs.DC); Programming Languages (cs.PL)","Distributed, Parallel, and Cluster Computing (cs.DC),  Programming Languages (cs.PL)"
385,arXiv:2409.18821,Data Generation for Testing Complex Queries,用于测试复杂查询的数据生成,"Sunanda Somwase, Parismita Das, S. Sudarshan",https://arxiv.org/pdf/2409.18821.pdf,"Subjects:
Databases (cs.DB)",Databases (cs.DB)
386,arXiv:2409.18820,An $11/6$-Approximation Algorithm for Vertex Cover on String Graphs,字符串图顶点覆盖的$11/6$近似算法,"Édouard Bonnet, Paweł Rzążewski",https://arxiv.org/pdf/2409.18820.pdf,"Subjects:
Data Structures and Algorithms (cs.DS); Computational Geometry (cs.CG); Discrete Mathematics (cs.DM); Combinatorics (math.CO)","Data Structures and Algorithms (cs.DS),  Computational Geometry (cs.CG),  Discrete Mathematics (cs.DM),  Combinatorics (math.CO)"
387,arXiv:2409.18819,Local Transcription Models in Home Care Nursing in Switzerland: an Interdisciplinary Case Study,瑞士家庭护理中的本地转录模型：跨学科案例研究,"Jeremy Kramer, Tetiana Kravchenko, Beatrice Kaufmann, Friederike J.S. Thilo, Mascha Kurpicz-Briki",https://arxiv.org/pdf/2409.18819.pdf,"Subjects:
Computation and Language (cs.CL)",Computation and Language (cs.CL)
388,arXiv:2409.18817,Facility Location Problem with Aleatory Agents,警报代理的设施选址问题,"Gennaro Auricchio, Jie Zhang",https://arxiv.org/pdf/2409.18817.pdf,"Subjects:
Computer Science and Game Theory (cs.GT); Multiagent Systems (cs.MA)","Computer Science and Game Theory (cs.GT),  Multiagent Systems (cs.MA)"
389,arXiv:2409.18813,"EyeTrAES: Fine-grained, Low-Latency Eye Tracking via Adaptive Event Slicing",EyeTrAES：通过自适应事件切片实现细粒度、低延迟的眼动追踪,"Argha Sen, Nuwan Bandara, Ila Gokarn, Thivya Kandappu, Archan Misra",https://arxiv.org/pdf/2409.18813.pdf,"Subjects:
Computer Vision and Pattern Recognition (cs.CV); Human-Computer Interaction (cs.HC)","Computer Vision and Pattern Recognition (cs.CV),  Human-Computer Interaction (cs.HC)"
390,arXiv:2409.18812,LLMs4Synthesis: Leveraging Large Language Models for Scientific Synthesis,LLMs4Synthesis：利用大型语言模型进行科学综合,"Hamed Babaei Giglou, Jennifer D'Souza, Sören Auer",https://arxiv.org/pdf/2409.18812.pdf,"Subjects:
Computation and Language (cs.CL); Artificial Intelligence (cs.AI); Digital Libraries (cs.DL)","Computation and Language (cs.CL),  Artificial Intelligence (cs.AI),  Digital Libraries (cs.DL)"
391,arXiv:2409.18811,Moldable Development Patterns,可模制开发模式,"Oscar Nierstrasz, Tudor Gîrba",https://arxiv.org/pdf/2409.18811.pdf,"Subjects:
Software Engineering (cs.SE)",Software Engineering (cs.SE)
392,arXiv:2409.18807,LLM With Tools: A Survey,LLM与工具：调查,Zhuocheng Shen,https://arxiv.org/pdf/2409.18807.pdf,"Subjects:
Artificial Intelligence (cs.AI)",Artificial Intelligence (cs.AI)
393,arXiv:2409.18806,Path Following Model Predictive Control of a Coupled Autonomous Underwater Vehicle,耦合自主水下航行器的路径跟踪模型预测控制,"Isah A. Jimoh, Hong Yue",https://arxiv.org/pdf/2409.18806.pdf,"Subjects:
Systems and Control (eess.SY)",Systems and Control (eess.SY)
394,arXiv:2409.18800,MiniVLN: Efficient Vision-and-Language Navigation by Progressive Knowledge Distillation,MiniVLN：通过渐进式知识蒸馏实现高效视觉和语言导航,"Junyou Zhu, Yanyuan Qiao, Siqi Zhang, Xingjian He, Qi Wu, Jing Liu",https://arxiv.org/pdf/2409.18800.pdf,"Subjects:
Computer Vision and Pattern Recognition (cs.CV)",Computer Vision and Pattern Recognition (cs.CV)
395,arXiv:2409.18799,Drawing the boundaries between Blockchain and Blockchain-like systems: A Comprehensive Survey on Distributed Ledger Technologies,划定区块链和类区块链系统之间的界限：分布式账本技术综述,"Badr Bellaj, Aafaf Ouaddah, Noel Crespi, Abdelatif Mezrioui, Emmanuel Bertin",https://arxiv.org/pdf/2409.18799.pdf,"Subjects:
Cryptography and Security (cs.CR); Distributed, Parallel, and Cluster Computing (cs.DC)","Cryptography and Security (cs.CR),  Distributed, Parallel, and Cluster Computing (cs.DC)"
396,arXiv:2409.18798,Esports Debut as a Medal Event at 2023 Asian Games: Exploring Public Perceptions with BERTopic and GPT-4 Topic Fine-Tuning,电子竞技作为奖牌项目亮相2023年亚运会：用BERTopic和GPT-4 Topic微调探索公众认知,"Tyreal Yizhou Qian, Bo Yu, Weizhe Li, Chenglong Xu",https://arxiv.org/pdf/2409.18798.pdf,"Subjects:
Human-Computer Interaction (cs.HC); Artificial Intelligence (cs.AI); Machine Learning (cs.LG)","Human-Computer Interaction (cs.HC),  Artificial Intelligence (cs.AI),  Machine Learning (cs.LG)"
397,arXiv:2409.18797,Supervised Learning Model for Key Frame Identification from Cow Teat Videos,奶牛乳头视频关键帧识别的监督学习模型,"Minghao Wang, Pinxue Lin",https://arxiv.org/pdf/2409.18797.pdf,"Subjects:
Computer Vision and Pattern Recognition (cs.CV); Artificial Intelligence (cs.AI); Machine Learning (cs.LG); Image and Video Processing (eess.IV)","Computer Vision and Pattern Recognition (cs.CV),  Artificial Intelligence (cs.AI),  Machine Learning (cs.LG),  Image and Video Processing (eess.IV)"
398,arXiv:2409.18796,Hierarchical Federated ADMM,分层联邦ADMM,"Seyed Mohammad Azimi-Abarghouyi, Nicola Bastianello, Karl H. Johansson, Viktoria Fodor",https://arxiv.org/pdf/2409.18796.pdf,"Subjects:
Machine Learning (cs.LG); Artificial Intelligence (cs.AI); Distributed, Parallel, and Cluster Computing (cs.DC); Information Theory (cs.IT); Systems and Control (eess.SY)","Machine Learning (cs.LG),  Artificial Intelligence (cs.AI),  Distributed, Parallel, and Cluster Computing (cs.DC),  Information Theory (cs.IT),  Systems and Control (eess.SY)"
399,arXiv:2409.18794,Open-Nav: Exploring Zero-Shot Vision-and-Language Navigation in Continuous Environment with Open-Source LLMs,Open-Nav:使用开源LLM探索连续环境中的零样本视觉和语言导航,"Yanyuan Qiao, Wenqi Lyu, Hui Wang, Zixu Wang, Zerui Li, Yuan Zhang, Mingkui Tan, Qi Wu",https://arxiv.org/pdf/2409.18794.pdf,"Subjects:
Robotics (cs.RO); Computer Vision and Pattern Recognition (cs.CV)","Robotics (cs.RO),  Computer Vision and Pattern Recognition (cs.CV)"
400,arXiv:2409.18792,asQ: parallel-in-time finite element simulations using ParaDiag for geoscientific models and beyond,asQ：使用ParaDiag进行地球科学模型及其他模型的并行时间有限元模拟,"Joshua Hope-Collins, Abdalaziz Hamdan, Werner Bauer, Lawrence Mitchell, Colin Cotter",https://arxiv.org/pdf/2409.18792.pdf,"Subjects:
Numerical Analysis (math.NA)",Numerical Analysis (math.NA)
401,arXiv:2409.18788,Excavating in the Wild: The GOOSE-Ex Dataset for Semantic Segmentation,在野外挖掘：用于语义分割的GOOSE-Ex数据集,"Raphael Hagmanns, Peter Mortimer, Miguel Granero, Thorsten Luettel, Janko Petereit",https://arxiv.org/pdf/2409.18788.pdf,"Subjects:
Robotics (cs.RO); Computer Vision and Pattern Recognition (cs.CV)","Robotics (cs.RO),  Computer Vision and Pattern Recognition (cs.CV)"
402,arXiv:2409.18787,Asymptotic tracking control of dynamic reference over homomorphically encrypted data with finite modulus,有限模同态加密数据动态参考的渐近跟踪控制,"Shuai Feng, Junsoo Kim",https://arxiv.org/pdf/2409.18787.pdf,"Subjects:
Systems and Control (eess.SY)",Systems and Control (eess.SY)
403,arXiv:2409.18786,A Survey on the Honesty of Large Language Models,大型语言模型诚信调查,"Siheng Li, Cheng Yang, Taiqiang Wu, Chufan Shi, Yuji Zhang, Xinyu Zhu, Zesen Cheng, Deng Cai, Mo Yu, Lemao Liu, Jie Zhou, Yujiu Yang, Ngai Wong, Xixin Wu, Wai Lam",https://arxiv.org/pdf/2409.18786.pdf,"Subjects:
Computation and Language (cs.CL); Artificial Intelligence (cs.AI)","Computation and Language (cs.CL),  Artificial Intelligence (cs.AI)"
404,arXiv:2409.18785,Student-Oriented Teacher Knowledge Refinement for Knowledge Distillation,面向学生的教师知识提炼与知识提炼,"Chaomin Shen, Yaomin Huang, Haokun Zhu, Jinsong Fan, Guixu Zhang",https://arxiv.org/pdf/2409.18785.pdf,"Subjects:
Computer Vision and Pattern Recognition (cs.CV)",Computer Vision and Pattern Recognition (cs.CV)
405,arXiv:2409.18779,Hello SME! Generating Fast Matrix Multiplication Kernels Using the Scalable Matrix Extension,你好，中小企业！利用可扩展矩阵扩展生成快速矩阵乘法核,"Stefan Remke, Alexander Breuer",https://arxiv.org/pdf/2409.18779.pdf,"Subjects:
Distributed, Parallel, and Cluster Computing (cs.DC)","Distributed, Parallel, and Cluster Computing (cs.DC)"
406,arXiv:2409.18778,HardCore Generation: Generating Hard UNSAT Problems for Data Augmentation,硬核生成：为数据增强生成硬UNSAT问题,"Joseph Cotnareanu, Zhanguang Zhang, Hui-Ling Zhen, Yingxue Zhang, Mark Coates",https://arxiv.org/pdf/2409.18778.pdf,"Subjects:
Machine Learning (cs.LG); Artificial Intelligence (cs.AI)","Machine Learning (cs.LG),  Artificial Intelligence (cs.AI)"
407,arXiv:2409.18775,A POMDP-based hierarchical planning framework for manipulation under pose uncertainty,基于POMDP的姿态不确定性操纵分层规划框架,"Muhammad Suhail Saleem, Rishi Veerapaneni, Maxim Likhachev",https://arxiv.org/pdf/2409.18775.pdf,"Subjects:
Robotics (cs.RO)",Robotics (cs.RO)
408,arXiv:2409.18772,A method of using RSVD in residual calculation of LowBit GEMM,一种在低比特GEMM残差计算中使用RSVD的方法,Hongyaoxing Gu,https://arxiv.org/pdf/2409.18772.pdf,"Subjects:
Mathematical Software (cs.MS); Machine Learning (cs.LG)","Mathematical Software (cs.MS),  Machine Learning (cs.LG)"
409,arXiv:2409.18770,Relighting from a Single Image: Datasets and Deep Intrinsic-based Architecture,从单一图像中重新照明：数据集和基于深层内在的架构,"Yixiong Yang, Hassan Ahmed Sial, Ramon Baldrich, Maria Vanrell",https://arxiv.org/pdf/2409.18770.pdf,"Subjects:
Computer Vision and Pattern Recognition (cs.CV)",Computer Vision and Pattern Recognition (cs.CV)
410,arXiv:2409.18769,State-of-the-Art Periorbital Distance Prediction and Disease Classification Using Periorbital Features,基于眼眶特征的最新眼眶距离预测和疾病分类,"George R. Nahass, Ghasem Yazdanpanah, Madison Cheung, Alex Palacios, Jeffery Peterson, Kevin Heinze, Sasha Hubschman, Chad A. Purnell, Pete Setabutr, Ann Q. Tran, Darvin Yi",https://arxiv.org/pdf/2409.18769.pdf,"Subjects:
Computer Vision and Pattern Recognition (cs.CV); Artificial Intelligence (cs.AI)","Computer Vision and Pattern Recognition (cs.CV),  Artificial Intelligence (cs.AI)"
411,arXiv:2409.18768,Learning from Demonstration with Implicit Nonlinear Dynamics Models,从隐式非线性动力学模型的演示中学习,"Peter David Fagan, Subramanian Ramamoorthy",https://arxiv.org/pdf/2409.18768.pdf,"Subjects:
Artificial Intelligence (cs.AI); Machine Learning (cs.LG); Robotics (cs.RO); Systems and Control (eess.SY)","Artificial Intelligence (cs.AI),  Machine Learning (cs.LG),  Robotics (cs.RO),  Systems and Control (eess.SY)"
412,arXiv:2409.18766,Dual Pricing to Prioritize Renewable Energy and Consumer Preferences in Electricity Markets,双重定价优先考虑电力市场中的可再生能源和消费者偏好,"Emilie Jong, Samuel Chevalier, Spyros Chatzivasileiadis, Shie Mannor",https://arxiv.org/pdf/2409.18766.pdf,"Subjects:
Systems and Control (eess.SY)",Systems and Control (eess.SY)
413,arXiv:2409.18764,Charting the Future: Using Chart Question-Answering for Scalable Evaluation of LLM-Driven Data Visualizations,描绘未来：使用图表问答对LLM驱动的数据可视化进行可扩展评估,"James Ford, Xingmeng Zhao, Dan Schumacher, Anthony Rios",https://arxiv.org/pdf/2409.18764.pdf,"Subjects:
Computer Vision and Pattern Recognition (cs.CV); Computation and Language (cs.CL)","Computer Vision and Pattern Recognition (cs.CV),  Computation and Language (cs.CL)"
414,arXiv:2409.18757,$L_2$-approximation using randomized lattice algorithms,$L_2$-使用随机格算法的近似,"Mou Cai, Takashi Goda, Yoshihito Kazashi",https://arxiv.org/pdf/2409.18757.pdf,"Subjects:
Numerical Analysis (math.NA)",Numerical Analysis (math.NA)
415,arXiv:2409.18755,Transparency evaluation for the Kinematic Design of the Harnesses through Human-Exoskeleton Interaction Modeling,通过人体外骨骼交互建模对安全带运动学设计的透明度评估,"Riccardo Bezzini, Carlo Alberto Avizzano, Francesco Porcini, Alessandro Filippeschi",https://arxiv.org/pdf/2409.18755.pdf,"Subjects:
Robotics (cs.RO); Systems and Control (eess.SY)","Robotics (cs.RO),  Systems and Control (eess.SY)"
416,arXiv:2409.18753,Enhancing Explainability in Multimodal Large Language Models Using Ontological Context,使用本体语境增强多模态大型语言模型的可解释性,"Jihen Amara, Birgitta König-Ries, Sheeba Samuel",https://arxiv.org/pdf/2409.18753.pdf,"Subjects:
Computer Vision and Pattern Recognition (cs.CV)",Computer Vision and Pattern Recognition (cs.CV)
417,arXiv:2409.18752,"Royal Reveals: LiDAR Mapping of Kronborg Castle, Echoes of Hamlet's Halls",皇家揭秘：克伦堡城堡的激光雷达测绘，哈姆雷特大厅的回声,"Leon Davies, Simon Sølvsten",https://arxiv.org/pdf/2409.18752.pdf,"Subjects:
Robotics (cs.RO)",Robotics (cs.RO)
418,arXiv:2409.18750,Temporal queries for dynamic temporal forests,动态时态森林的时态查询,"Davide Bilò, Luciano Gualà, Stefano Leucci, Guido Proietti, Alessandro Straziota",https://arxiv.org/pdf/2409.18750.pdf,"Subjects:
Data Structures and Algorithms (cs.DS)",Data Structures and Algorithms (cs.DS)
419,arXiv:2409.18749,TensorSocket: Shared Data Loading for Deep Learning Training,TensorSocket：深度学习训练的共享数据加载,"Ties Robroek (IT University of Copenhagen), Neil Kim Nielsen (IT University of Copenhagen), Pınar Tözün (IT University of Copenhagen)",https://arxiv.org/pdf/2409.18749.pdf,"Subjects:
Machine Learning (cs.LG); Distributed, Parallel, and Cluster Computing (cs.DC)","Machine Learning (cs.LG),  Distributed, Parallel, and Cluster Computing (cs.DC)"
420,arXiv:2409.18747,Cottention: Linear Transformers With Cosine Attention,Cotention：具有Cosine注意力的线性变压器,"Gabriel Mongaras, Trevor Dohm, Eric C. Larson",https://arxiv.org/pdf/2409.18747.pdf,"Subjects:
Machine Learning (cs.LG)",Machine Learning (cs.LG)
421,arXiv:2409.18745,A study on the effects of mixed explicit and implicit communications in human-virtual-agent interactions,人类虚拟代理交互中混合显式和隐式通信的影响研究,"Ana Christina Almada Campos, Bruno Vilhena Adorno",https://arxiv.org/pdf/2409.18745.pdf,"Subjects:
Robotics (cs.RO)",Robotics (cs.RO)
