Unnamed: 0,id,title,title_zh,authors,url,subjects,subject_split
550,arXiv:2409.18461,Towards Diverse Device Heterogeneous Federated Learning via Task Arithmetic Knowledge Integration,通过任务算术知识集成实现异构设备异构联合学习,"Mahdi Morafah, Vyacheslav Kungurtsev, Hojin Chang, Chen Chen, Bill Lin",https://arxiv.org/pdf/2409.18461.pdf,"Subjects:
Machine Learning (cs.LG); Artificial Intelligence (cs.AI); Computer Vision and Pattern Recognition (cs.CV); Distributed, Parallel, and Cluster Computing (cs.DC)","Machine Learning (cs.LG),  Artificial Intelligence (cs.AI),  Computer Vision and Pattern Recognition (cs.CV),  Distributed, Parallel, and Cluster Computing (cs.DC)"
551,arXiv:2409.18459,FoodMLLM-JP: Leveraging Multimodal Large Language Models for Japanese Recipe Generation,FoodMLLM JP：利用多模态大语言模型生成日本食谱,"Yuki Imajuku, Yoko Yamakata, Kiyoharu Aizawa",https://arxiv.org/pdf/2409.18459.pdf,"Subjects:
Computer Vision and Pattern Recognition (cs.CV); Multimedia (cs.MM)","Computer Vision and Pattern Recognition (cs.CV),  Multimedia (cs.MM)"
552,arXiv:2409.18458,Enhancing Crime Scene Investigations through Virtual Reality and Deep Learning Techniques,通过虚拟现实和深度学习技术加强犯罪现场调查,"Antonino Zappalà (1), Luca Guarnera (1), Vincenzo Rinaldi (2), Salvatore Livatino (3), Sebastiano Battiato (1) ((1) University of Catania, (2) University of Dundee, (3) University of Hertfordshire)",https://arxiv.org/pdf/2409.18458.pdf,"Subjects:
Computer Vision and Pattern Recognition (cs.CV)",Computer Vision and Pattern Recognition (cs.CV)
553,arXiv:2409.18457,DynaWeightPnP: Toward global real-time 3D-2D solver in PnP without correspondences,DynaWeightPnP：朝向PnP中无对应的全局实时3D-2D求解器,"Jingwei Song, Maani Ghaffari",https://arxiv.org/pdf/2409.18457.pdf,"Subjects:
Computer Vision and Pattern Recognition (cs.CV); Robotics (cs.RO)","Computer Vision and Pattern Recognition (cs.CV),  Robotics (cs.RO)"
554,arXiv:2409.18455,Review of Digital Asset Development with Graph Neural Network Unlearning,基于图神经网络去学习的数字资产开发综述,Zara Lisbon,https://arxiv.org/pdf/2409.18455.pdf,"Subjects:
Machine Learning (cs.LG); Artificial Intelligence (cs.AI)","Machine Learning (cs.LG),  Artificial Intelligence (cs.AI)"
555,arXiv:2409.18454,Leveraging Long-Context Large Language Models for Multi-Document Understanding and Summarization in Enterprise Applications,利用长上下文大语言模型实现企业应用中的多文档理解和摘要,"Aditi Godbole, Jabin Geevarghese George, Smita Shandilya",https://arxiv.org/pdf/2409.18454.pdf,"Subjects:
Computation and Language (cs.CL); Artificial Intelligence (cs.AI)","Computation and Language (cs.CL),  Artificial Intelligence (cs.AI)"
556,arXiv:2409.18452,Exploiting Physical Human-Robot Interaction to Provide a Unique Rolling Experience with a Riding Ballbot,利用物理人机交互为骑乘球机器人提供独特的滚动体验,"Chenzhang Xiao, Seung Yun Song, Yu Chen, Mahshid Mansouri, João Ramos, Adam W. Bleakney, William R. Norris, Elizabeth T. Hsiao-Wecksler",https://arxiv.org/pdf/2409.18452.pdf,"Subjects:
Robotics (cs.RO)",Robotics (cs.RO)
557,arXiv:2409.18449,Towards Personal Data Sharing Autonomy:A Task-driven Data Capsule Sharing System,迈向个人数据共享自治：任务驱动的数据胶囊共享系统,"Qiuyun Lyu, Yilong Zhou, Yizhi Ren, Zheng Wang, Yunchuan Guo",https://arxiv.org/pdf/2409.18449.pdf,"Subjects:
Cryptography and Security (cs.CR)",Cryptography and Security (cs.CR)
558,arXiv:2409.18448,Hierarchical Federated Learning with Multi-Timescale Gradient Correction,具有多时间尺度梯度校正的分层联合学习,"Wenzhi Fang, Dong-Jun Han, Evan Chen, Shiqiang Wang, Christopher G. Brinton",https://arxiv.org/pdf/2409.18448.pdf,"Subjects:
Machine Learning (cs.LG)",Machine Learning (cs.LG)
559,arXiv:2409.18446,Exploring Language Model Generalization in Low-Resource Extractive QA,低资源抽取QA中语言模型泛化的探索,"Saptarshi Sengupta, Wenpeng Yin, Preslav Nakov, Shreya Ghosh, Suhang Wang",https://arxiv.org/pdf/2409.18446.pdf,"Subjects:
Computation and Language (cs.CL)",Computation and Language (cs.CL)
560,arXiv:2409.18444,Cost-Aware Dynamic Cloud Workflow Scheduling using Self-Attention and Evolutionary Reinforcement Learning,基于自我注意和进化强化学习的成本感知动态云工作流调度,"Ya Shen, Gang Chen, Hui Ma, Mengjie Zhang",https://arxiv.org/pdf/2409.18444.pdf,"Subjects:
Artificial Intelligence (cs.AI)",Artificial Intelligence (cs.AI)
561,arXiv:2409.18442,Gradient-free Decoder Inversion in Latent Diffusion Models,潜在扩散模型中的无梯度解码器反转,"Seongmin Hong, Suh Yoon Jeon, Kyeonghyun Lee, Ernest K. Ryu, Se Young Chun",https://arxiv.org/pdf/2409.18442.pdf,"Subjects:
Machine Learning (cs.LG); Computer Vision and Pattern Recognition (cs.CV)","Machine Learning (cs.LG),  Computer Vision and Pattern Recognition (cs.CV)"
562,arXiv:2409.18439,State-free Reinforcement Learning,无状态强化学习,"Mingyu Chen, Aldo Pacchiano, Xuezhou Zhang",https://arxiv.org/pdf/2409.18439.pdf,"Subjects:
Machine Learning (cs.LG); Artificial Intelligence (cs.AI)","Machine Learning (cs.LG),  Artificial Intelligence (cs.AI)"
563,arXiv:2409.18438,Physics Augmented Tuple Transformer for Autism Severity Level Detection,用于自闭症严重程度检测的物理增强元组变换器,"Chinthaka Ranasingha, Harshala Gammulle, Tharindu Fernando, Sridha Sridharan, Clinton Fookes",https://arxiv.org/pdf/2409.18438.pdf,"Subjects:
Artificial Intelligence (cs.AI)",Artificial Intelligence (cs.AI)
564,arXiv:2409.18435,Multi-agent Reinforcement Learning for Dynamic Dispatching in Material Handling Systems,物料搬运系统动态调度的多智能体强化学习,"Xian Yeow Lee, Haiyan Wang, Daisuke Katsumata, Takaharu Matsui, Chetan Gupta",https://arxiv.org/pdf/2409.18435.pdf,"Subjects:
Machine Learning (cs.LG); Artificial Intelligence (cs.AI); Multiagent Systems (cs.MA)","Machine Learning (cs.LG),  Artificial Intelligence (cs.AI),  Multiagent Systems (cs.MA)"
565,arXiv:2409.18434,Get It For Free: Radar Segmentation without Expert Labels and Its Application in Odometry and Localization,免费获取：无专家标签的雷达分割及其在测距和定位中的应用,"Siru Li, Ziyang Hong, Yushuai Chen, Liang Hu, Jiahu Qin",https://arxiv.org/pdf/2409.18434.pdf,"Subjects:
Robotics (cs.RO)",Robotics (cs.RO)
566,arXiv:2409.18433,Easy2Hard-Bench: Standardized Difficulty Labels for Profiling LLM Performance and Generalization,Easy2Hard Bench：用于分析LLM性能和泛化的标准化难度标签,"Mucong Ding, Chenghao Deng, Jocelyn Choo, Zichu Wu, Aakriti Agrawal, Avi Schwarzschild, Tianyi Zhou, Tom Goldstein, John Langford, Anima Anandkumar, Furong Huang",https://arxiv.org/pdf/2409.18433.pdf,"Subjects:
Machine Learning (cs.LG); Artificial Intelligence (cs.AI); Computation and Language (cs.CL)","Machine Learning (cs.LG),  Artificial Intelligence (cs.AI),  Computation and Language (cs.CL)"
567,arXiv:2409.18431,Search3D: Hierarchical Open-Vocabulary 3D Segmentation,Search3D：分层开放词汇3D分割,"Ayca Takmaz, Alexandros Delitzas, Robert W. Sumner, Francis Engelmann, Johanna Wald, Federico Tombari",https://arxiv.org/pdf/2409.18431.pdf,"Subjects:
Computer Vision and Pattern Recognition (cs.CV)",Computer Vision and Pattern Recognition (cs.CV)
568,arXiv:2409.18429,Joint Optimization of Data- and Model-Driven Probing Beams and Beam Predictor,数据和模型驱动探测梁与梁预测器的联合优化,"Tianheng Lu, Fan Meng, Zhilei Zhang, Yongming Huang, Cheng Zhang, Xiaoyu Bai",https://arxiv.org/pdf/2409.18429.pdf,"Subjects:
Information Theory (cs.IT); Signal Processing (eess.SP)","Information Theory (cs.IT),  Signal Processing (eess.SP)"
569,arXiv:2409.18428,Improving Multilingual ASR in the Wild Using Simple N-best Re-ranking,使用简单的N-best重新排序改进多语言ASR,"Brian Yan, Vineel Pratap, Shinji Watanabe, Michael Auli",https://arxiv.org/pdf/2409.18428.pdf,"Subjects:
Computation and Language (cs.CL); Sound (cs.SD); Audio and Speech Processing (eess.AS)","Computation and Language (cs.CL),  Sound (cs.SD),  Audio and Speech Processing (eess.AS)"
570,arXiv:2409.18427,Neural Collaborative Filtering to Detect Anomalies in Human Semantic Trajectories,神经协同过滤检测人类语义轨迹中的异常,"Yueyang Liu, Lance Kennedy, Hossein Amiri, Andreas Züfle",https://arxiv.org/pdf/2409.18427.pdf,"Subjects:
Machine Learning (cs.LG); Information Retrieval (cs.IR); Social and Information Networks (cs.SI)","Machine Learning (cs.LG),  Information Retrieval (cs.IR),  Social and Information Networks (cs.SI)"
571,arXiv:2409.18426,Dual Cone Gradient Descent for Training Physics-Informed Neural Networks,双锥梯度下降训练物理神经网络,"Youngsik Hwang, Dong-Young Lim",https://arxiv.org/pdf/2409.18426.pdf,"Subjects:
Machine Learning (cs.LG); Analysis of PDEs (math.AP); Numerical Analysis (math.NA); Optimization and Control (math.OC); Machine Learning (stat.ML)","Machine Learning (cs.LG),  Analysis of PDEs (math.AP),  Numerical Analysis (math.NA),  Optimization and Control (math.OC),  Machine Learning (stat.ML)"
572,arXiv:2409.18423,A physics-driven sensor placement optimization methodology for temperature field reconstruction,一种用于温度场重建的物理驱动传感器布局优化方法,"Xu Liu, Wen Yao, Wei Peng, Zhuojia Fu, Zixue Xiang, Xiaoqian Chen",https://arxiv.org/pdf/2409.18423.pdf,"Subjects:
Machine Learning (cs.LG)",Machine Learning (cs.LG)
573,arXiv:2409.18419,Robust Network Learning via Inverse Scale Variational Sparsification,基于逆尺度变分稀疏的鲁棒网络学习,"Zhiling Zhou, Zirui Liu, Chengming Xu, Yanwei Fu, Xinwei Sun",https://arxiv.org/pdf/2409.18419.pdf,"Subjects:
Computer Vision and Pattern Recognition (cs.CV); Machine Learning (cs.LG)","Computer Vision and Pattern Recognition (cs.CV),  Machine Learning (cs.LG)"
574,arXiv:2409.18418,A3: Active Adversarial Alignment for Source-Free Domain Adaptation,A3：主动对抗对齐用于无源域自适应,"Chrisantus Eze, Christopher Crick",https://arxiv.org/pdf/2409.18418.pdf,"Subjects:
Machine Learning (cs.LG); Artificial Intelligence (cs.AI); Computer Vision and Pattern Recognition (cs.CV)","Machine Learning (cs.LG),  Artificial Intelligence (cs.AI),  Computer Vision and Pattern Recognition (cs.CV)"
575,arXiv:2409.18417,VickreyFeedback: Cost-efficient Data Construction for Reinforcement Learning from Human Feedback,VickreyFeedback：基于人类反馈的强化学习的经济高效的数据构建,"Guoxi Zhang, Jiuding Duan",https://arxiv.org/pdf/2409.18417.pdf,"Subjects:
Machine Learning (cs.LG); Artificial Intelligence (cs.AI); Computation and Language (cs.CL); Computer Science and Game Theory (cs.GT); General Economics (econ.GN)","Machine Learning (cs.LG),  Artificial Intelligence (cs.AI),  Computation and Language (cs.CL),  Computer Science and Game Theory (cs.GT),  General Economics (econ.GN)"
576,arXiv:2409.18412,SciDFM: A Large Language Model with Mixture-of-Experts for Science,SciDFM：一个混合了科学专家的大型语言模型,"Liangtai Sun, Danyu Luo, Da Ma, Zihan Zhao, Baocai Chen, Zhennan Shen, Su Zhu, Lu Chen, Xin Chen, Kai Yu",https://arxiv.org/pdf/2409.18412.pdf,"Subjects:
Computation and Language (cs.CL); Artificial Intelligence (cs.AI)","Computation and Language (cs.CL),  Artificial Intelligence (cs.AI)"
577,arXiv:2409.18411,BoT-Drive: Hierarchical Behavior and Trajectory Planning for Autonomous Driving using POMDPs,BoT Drive：使用POMDP的自动驾驶分层行为和轨迹规划,"Xuanjin Jin, Chendong Zeng, Shengfa Zhu, Chunxiao Liu, Panpan Cai",https://arxiv.org/pdf/2409.18411.pdf,"Subjects:
Robotics (cs.RO); Artificial Intelligence (cs.AI)","Robotics (cs.RO),  Artificial Intelligence (cs.AI)"
578,arXiv:2409.18409,Generative Retrieval Meets Multi-Graded Relevance,生成检索满足多级相关性,"Yubao Tang, Ruqing Zhang, Jiafeng Guo, Maarten de Rijke, Wei Chen, Xueqi Cheng",https://arxiv.org/pdf/2409.18409.pdf,"Subjects:
Information Retrieval (cs.IR)",Information Retrieval (cs.IR)
579,arXiv:2409.18408,Query matching for spatio-temporal action detection with query-based object detector,基于查询的对象检测器的时空动作检测查询匹配,"Shimon Hori, Kazuki Omi, Toru Tamaki",https://arxiv.org/pdf/2409.18408.pdf,"Subjects:
Computer Vision and Pattern Recognition (cs.CV)",Computer Vision and Pattern Recognition (cs.CV)
580,arXiv:2409.18405,Word2Wave: Language Driven Mission Programming for Efficient Subsea Deployments of Marine Robots,Word2Wave：用于海洋机器人高效海底部署的语言驱动任务编程,"Ruo Chen, David Blow, Adnan Abdullah, Md Jahidul Islam",https://arxiv.org/pdf/2409.18405.pdf,"Subjects:
Robotics (cs.RO)",Robotics (cs.RO)
581,arXiv:2409.18403,SpecCFA: Enhancing Control Flow Attestation/Auditing via Application-Aware Sub-Path Speculation,SpecCFA：通过应用感知子路径推测增强控制流认证/审计,"Adam Caulfield, Liam Tyler, Ivan De Oliveira Nunes",https://arxiv.org/pdf/2409.18403.pdf,"Subjects:
Cryptography and Security (cs.CR)",Cryptography and Security (cs.CR)
582,arXiv:2409.18402,Embed and Emulate: Contrastive representations for simulation-based inference,嵌入和仿真：基于仿真的推理的对比表示,"Ruoxi Jiang, Peter Y. Lu, Rebecca Willett",https://arxiv.org/pdf/2409.18402.pdf,"Subjects:
Machine Learning (cs.LG); Machine Learning (stat.ML)","Machine Learning (cs.LG),  Machine Learning (stat.ML)"
583,arXiv:2409.18401,"GenesisTex2: Stable, Consistent and High-Quality Text-to-Texture Generation",GenesisTex2：稳定、一致和高质量的文本到纹理生成,"Jiawei Lu, Yingpeng Zhang, Zengjun Zhao, He Wang, Kun Zhou, Tianjia Shao",https://arxiv.org/pdf/2409.18401.pdf,"Subjects:
Computer Vision and Pattern Recognition (cs.CV); Artificial Intelligence (cs.AI)","Computer Vision and Pattern Recognition (cs.CV),  Artificial Intelligence (cs.AI)"
584,arXiv:2409.18399,Multimodal Trajectory Prediction for Autonomous Driving on Unstructured Roads using Deep Convolutional Network,基于深度卷积网络的非结构化道路自动驾驶多模态轨迹预测,"Lei Li, Zhifa Chen, Jian Wang, Bin Zhou, Guizhen Yu, Xiaoxuan Chen",https://arxiv.org/pdf/2409.18399.pdf,"Subjects:
Artificial Intelligence (cs.AI)",Artificial Intelligence (cs.AI)
585,arXiv:2409.18395,Code Vulnerability Repair with Large Language Model using Context-Aware Prompt Tuning,使用上下文感知提示调优修复大型语言模型的代码漏洞,"Arshiya Khan, Guannan Liu, Xing Gao",https://arxiv.org/pdf/2409.18395.pdf,"Subjects:
Cryptography and Security (cs.CR); Artificial Intelligence (cs.AI)","Cryptography and Security (cs.CR),  Artificial Intelligence (cs.AI)"
586,arXiv:2409.18394,An Augmented Reality Interface for Teleoperating Robot Manipulators: Reducing Demonstrator Task Load through Digital Twin Control,遥操作机器人操作器的增强现实界面：通过数字双控减少演示任务负荷,"Aliyah Smith, Monroe Kennedy III",https://arxiv.org/pdf/2409.18394.pdf,"Subjects:
Robotics (cs.RO)",Robotics (cs.RO)
587,arXiv:2409.18393,"Social media algorithms can curb misinformation, but do they?",社交媒体算法可以遏制错误信息，但它们真的可以吗？,"Chhandak Bagchi, Filippo Menczer, Jennifer Lundquist, Monideepa Tarafdar, Anthony Paik, Przemyslaw A. Grabowicz",https://arxiv.org/pdf/2409.18393.pdf,"Subjects:
Social and Information Networks (cs.SI); Computers and Society (cs.CY)","Social and Information Networks (cs.SI),  Computers and Society (cs.CY)"
588,arXiv:2409.18391,Crank-Nicolson-type iterative decoupled algorithms for Biot's consolidation model using total pressure,基于总压的Biot固结模型的Crank-Nicolson型迭代解耦算法,"Huipeng Gu, Mingchao Cai, Jingzhi Li",https://arxiv.org/pdf/2409.18391.pdf,"Subjects:
Numerical Analysis (math.NA)",Numerical Analysis (math.NA)
589,arXiv:2409.18390,"Speech to Reality: On-Demand Production using Natural Language, 3D Generative AI, and Discrete Robotic Assembly",语音到现实：使用自然语言、3D生成人工智能和离散机器人装配的按需生产,"Alexander Htet Kyaw, Se Hwan Jeon, Miana Smith, Neil Gershenfeld",https://arxiv.org/pdf/2409.18390.pdf,"Subjects:
Robotics (cs.RO); Artificial Intelligence (cs.AI); Human-Computer Interaction (cs.HC)","Robotics (cs.RO),  Artificial Intelligence (cs.AI),  Human-Computer Interaction (cs.HC)"
590,arXiv:2409.18388,Scale Free Projections Arise from Bipartite Random Networks,二分随机网络的无标度投影,"Josh Johnston, Tim Andersen",https://arxiv.org/pdf/2409.18388.pdf,"Subjects:
Social and Information Networks (cs.SI); Discrete Mathematics (cs.DM); Physics and Society (physics.soc-ph)","Social and Information Networks (cs.SI),  Discrete Mathematics (cs.DM),  Physics and Society (physics.soc-ph)"
591,arXiv:2409.18387,Simpler Gradient Methods for Blind Super-Resolution with Lower Iteration Complexity,具有较低迭代复杂度的盲超分辨率的更简单梯度方法,"Jinsheng Li, Wei Cui, Xu Zhang",https://arxiv.org/pdf/2409.18387.pdf,"Subjects:
Information Theory (cs.IT)",Information Theory (cs.IT)
592,arXiv:2409.18386,ChARLES: Change-Aware Recovery of Latent Evolution Semantics in Relational Data,ChARLES：关系数据中潜在进化语义的变化感知恢复,"Shiyi He, Alexandra Meliou, Anna Fariha",https://arxiv.org/pdf/2409.18386.pdf,"Subjects:
Databases (cs.DB)",Databases (cs.DB)
593,arXiv:2409.18385,Robo-CSK-Organizer: Commonsense Knowledge to Organize Detected Objects for Multipurpose Robots,Robo-CSK Organizer：为多用途机器人组织检测对象的常识知识,"Rafael Hidalgo, Jesse Parron, Aparna S. Varde, Weitian Wang",https://arxiv.org/pdf/2409.18385.pdf,"Subjects:
Robotics (cs.RO); Artificial Intelligence (cs.AI)","Robotics (cs.RO),  Artificial Intelligence (cs.AI)"
594,arXiv:2409.18383,AquaMILR+: Design of an untethered limbless robot for complex aquatic terrain navigation,AquaMILR+：用于复杂水上地形导航的无约束无肢机器人设计,"Matthew Fernandez, Tianyu Wang, Galen Tunnicliffe, Donoven Dortilus, Peter Gunnarson, John O. Dabiri, Daniel I. Goldman",https://arxiv.org/pdf/2409.18383.pdf,"Subjects:
Robotics (cs.RO)",Robotics (cs.RO)
595,arXiv:2409.18382,CurricuLLM: Automatic Task Curricula Design for Learning Complex Robot Skills using Large Language Models,CurricuLLM：使用大型语言模型学习复杂机器人技能的自动任务课程设计,"Kanghyun Ryu, Qiayuan Liao, Zhongyu Li, Koushil Sreenath, Negar Mehr",https://arxiv.org/pdf/2409.18382.pdf,"Subjects:
Robotics (cs.RO); Machine Learning (cs.LG); Systems and Control (eess.SY)","Robotics (cs.RO),  Machine Learning (cs.LG),  Systems and Control (eess.SY)"
596,arXiv:2409.18375,AM-MTEEG: Multi-task EEG classification based on impulsive associative memory,基于脉冲联想记忆的多任务脑电分类,"Junyan Li, Bin Hu, Zhi-Hong Guan",https://arxiv.org/pdf/2409.18375.pdf,"Subjects:
Neural and Evolutionary Computing (cs.NE); Neurons and Cognition (q-bio.NC)","Neural and Evolutionary Computing (cs.NE),  Neurons and Cognition (q-bio.NC)"
597,arXiv:2409.18372,You Only Speak Once to See,你只说一次话就能看到,"Wenhao Yang, Jianguo Wei, Wenhuan Lu, Lei Li",https://arxiv.org/pdf/2409.18372.pdf,"Subjects:
Computer Vision and Pattern Recognition (cs.CV)",Computer Vision and Pattern Recognition (cs.CV)
598,arXiv:2409.18370,Discovery and inversion of the viscoelastic wave equation in inhomogeneous media,非均匀介质粘弹性波动方程的发现与反演,"Su Chen, Yi Ding, Hiroe Miyake, Xiaojun Li",https://arxiv.org/pdf/2409.18370.pdf,"Subjects:
Machine Learning (cs.LG); Geophysics (physics.geo-ph)","Machine Learning (cs.LG),  Geophysics (physics.geo-ph)"
599,arXiv:2409.18365,Defect Prediction with Content-based Features,基于内容特征的缺陷预测,"Hung Viet Pham, Tung Thanh Nguyen",https://arxiv.org/pdf/2409.18365.pdf,"Subjects:
Software Engineering (cs.SE); Computation and Language (cs.CL); Machine Learning (cs.LG)","Software Engineering (cs.SE),  Computation and Language (cs.CL),  Machine Learning (cs.LG)"
600,arXiv:2409.18364,Multi-hypotheses Conditioned Point Cloud Diffusion for 3D Human Reconstruction from Occluded Images,基于多假设条件的点云扩散用于遮挡图像的三维人体重建,"Donghwan Kim, Tae-Kyun Kim",https://arxiv.org/pdf/2409.18364.pdf,"Subjects:
Computer Vision and Pattern Recognition (cs.CV); Artificial Intelligence (cs.AI); Machine Learning (cs.LG)","Computer Vision and Pattern Recognition (cs.CV),  Artificial Intelligence (cs.AI),  Machine Learning (cs.LG)"
601,arXiv:2409.18361,iWalker: Imperative Visual Planning for Walking Humanoid Robot,iWalker：行走类人机器人的必要视觉规划,"Xiao Lin, Yuhao Huang, Taimeng Fu, Xiaobin Xiong, Chen Wang",https://arxiv.org/pdf/2409.18361.pdf,"Subjects:
Robotics (cs.RO); Systems and Control (eess.SY)","Robotics (cs.RO),  Systems and Control (eess.SY)"
602,arXiv:2409.18360,Architecture for Protecting Data Privacy in Decentralized Social Networks,去中心化社交网络中保护数据隐私的架构,"Quang Cao, Katerina Vgena, Aikaterini-Georgia Mavroeidi, Christos Kalloniatis, Xun Yi, Son Hoang Dau",https://arxiv.org/pdf/2409.18360.pdf,"Subjects:
Cryptography and Security (cs.CR)",Cryptography and Security (cs.CR)
603,arXiv:2409.18359,Generative AI for fast and accurate Statistical Computation of Fluids,用于快速准确计算流体统计的生成式人工智能,"Roberto Molinaro, Samuel Lanthaler, Bogdan Raonić, Tobias Rohner, Victor Armegioiu, Zhong Yi Wan, Fei Sha, Siddhartha Mishra, Leonardo Zepeda-Núñez",https://arxiv.org/pdf/2409.18359.pdf,"Subjects:
Machine Learning (cs.LG); Numerical Analysis (math.NA); Fluid Dynamics (physics.flu-dyn)","Machine Learning (cs.LG),  Numerical Analysis (math.NA),  Fluid Dynamics (physics.flu-dyn)"
604,arXiv:2409.18356,FedDCL: a federated data collaboration learning as a hybrid-type privacy-preserving framework based on federated learning and data collaboration,FedDCL：一种基于联邦学习和数据协作的混合型隐私保护框架——联邦数据协作学习,"Akira Imakura, Tetsuya Sakurai",https://arxiv.org/pdf/2409.18356.pdf,"Subjects:
Machine Learning (cs.LG); Cryptography and Security (cs.CR)","Machine Learning (cs.LG),  Cryptography and Security (cs.CR)"
605,arXiv:2409.18355,SinoSynth: A Physics-based Domain Randomization Approach for Generalizable CBCT Image Enhancement,SinoSynth：一种基于物理的可泛化CBCT图像增强的域随机化方法,"Yunkui Pang, Yilin Liu, Xu Chen, Pew-Thian Yap, Jun Lian",https://arxiv.org/pdf/2409.18355.pdf,"Subjects:
Computer Vision and Pattern Recognition (cs.CV)",Computer Vision and Pattern Recognition (cs.CV)
606,arXiv:2409.18353,Energy Efficient Beamforming Training in Terahertz Communication Systems,太赫兹通信系统中的节能波束形成训练,"Li-Hsiang Shen, Kai-Ten Feng, Lie-Liang Yang",https://arxiv.org/pdf/2409.18353.pdf,"Subjects:
Information Theory (cs.IT); Signal Processing (eess.SP)","Information Theory (cs.IT),  Signal Processing (eess.SP)"
607,arXiv:2409.18352,A New 10-mg SMA-Based Fast Bimorph Actuator for Microrobotics,一种用于微机器人的新型10mg SMA快速双压电晶片执行器,"Conor K. Trygstad, Elijah K. Blankenship, Nestor O. Perez-Arancibia",https://arxiv.org/pdf/2409.18352.pdf,"Subjects:
Robotics (cs.RO)",Robotics (cs.RO)
608,arXiv:2409.18351,Tracking Software Security Topics,跟踪软件安全主题,"Phong Minh Vu, Tung Thanh Nguyen",https://arxiv.org/pdf/2409.18351.pdf,"Subjects:
Software Engineering (cs.SE); Artificial Intelligence (cs.AI); Cryptography and Security (cs.CR); Information Retrieval (cs.IR)","Software Engineering (cs.SE),  Artificial Intelligence (cs.AI),  Cryptography and Security (cs.CR),  Information Retrieval (cs.IR)"
609,arXiv:2409.18347,Progress Towards Submersible Microrobots: A Novel 13-mg Low-Power SMA-Based Actuator for Underwater Propulsion,潜水微型机器人的进展：一种新型的13mg低功率SMA水下推进执行器,"Cody R. Longwell, Conor K. Trygstad, Francisco M. F. R. Goncalves, Ke Xu, Nestor O. Perez-Arancibia",https://arxiv.org/pdf/2409.18347.pdf,"Subjects:
Robotics (cs.RO)",Robotics (cs.RO)
610,arXiv:2409.18346,MultiClimate: Multimodal Stance Detection on Climate Change Videos,MultiClimate：气候变化视频的多模态姿态检测,"Jiawen Wang, Longfei Zuo, Siyao Peng, Barbara Plank",https://arxiv.org/pdf/2409.18346.pdf,"Subjects:
Computation and Language (cs.CL); Computer Vision and Pattern Recognition (cs.CV)","Computation and Language (cs.CL),  Computer Vision and Pattern Recognition (cs.CV)"
611,arXiv:2409.18345,A Generalized LLM-Augmented BIM Framework: Application to a Speech-to-BIM system,广义LLM增强BIM框架：在语音到BIM系统中的应用,"Ghang Lee, Suhyung Jang, Seokho Hyun",https://arxiv.org/pdf/2409.18345.pdf,"Subjects:
Computation and Language (cs.CL); Artificial Intelligence (cs.AI); Human-Computer Interaction (cs.HC)","Computation and Language (cs.CL),  Artificial Intelligence (cs.AI),  Human-Computer Interaction (cs.HC)"
612,arXiv:2409.18343,Improving Agent Behaviors with RL Fine-tuning for Autonomous Driving,利用RL微调改善自动驾驶代理行为,"Zhenghao Peng, Wenjie Luo, Yiren Lu, Tianyi Shen, Cole Gulino, Ari Seff, Justin Fu",https://arxiv.org/pdf/2409.18343.pdf,"Subjects:
Artificial Intelligence (cs.AI)",Artificial Intelligence (cs.AI)
613,arXiv:2409.18342,Exploring Time-Space trade-offs for synchronized in Lilliput,探索利力浦特同步的时空权衡,"Dave Dice, Alex Kogan",https://arxiv.org/pdf/2409.18342.pdf,"Subjects:
Operating Systems (cs.OS)",Operating Systems (cs.OS)
