Unnamed: 0,id,title,title_zh,authors,url,subjects,subject_split
128,arXiv:2409.03977,Bi-modality Images Transfer with a Discrete Process Matching Method,基于离散过程匹配方法的双模态图像传输,"Zhe Xiong, Qiaoqiao Ding, Xiaoqun Zhang",https://arxiv.org/pdf/2409.03977.pdf,"Subjects:
Image and Video Processing (eess.IV); Computer Vision and Pattern Recognition (cs.CV); Machine Learning (cs.LG)","Image and Video Processing (eess.IV),  Computer Vision and Pattern Recognition (cs.CV),  Machine Learning (cs.LG)"
129,arXiv:2409.03974,Hardness of sampling for the anti-ferromagnetic Ising model on random graphs,随机图上反铁磁伊辛模型的采样硬度,"Neng Huang, Will Perkins, Aaron Potechin",https://arxiv.org/pdf/2409.03974.pdf,"Subjects:
Probability (math.PR); Computational Complexity (cs.CC); Data Structures and Algorithms (cs.DS)","Probability (math.PR),  Computational Complexity (cs.CC),  Data Structures and Algorithms (cs.DS)"
130,arXiv:2409.03962,Average Causal Effect Estimation in DAGs with Hidden Variables: Extensions of Back-Door and Front-Door Criteria,隐变量DAGs中的平均因果关系估计：后门和前门标准的扩展,"Anna Guo, Razieh Nabi",https://arxiv.org/pdf/2409.03962.pdf,"Subjects:
Methodology (stat.ME); Machine Learning (cs.LG); Machine Learning (stat.ML)","Methodology (stat.ME),  Machine Learning (cs.LG),  Machine Learning (stat.ML)"
131,arXiv:2409.03933,A deep learning approach to wall-shear stress quantification: From numerical training to zero-shot experimental application,壁剪切应力量化的深度学习方法：从数值训练到零样本实验应用,"Esther Lagemann, Julia Roeb, Steven L. Brunton, Christian Lagemann",https://arxiv.org/pdf/2409.03933.pdf,"Subjects:
Fluid Dynamics (physics.flu-dyn); Artificial Intelligence (cs.AI)","Fluid Dynamics (physics.flu-dyn),  Artificial Intelligence (cs.AI)"
132,arXiv:2409.03917,qSAT: Design of an Efficient Quantum Satisfiability Solver for Hardware Equivalence Checking,qSAT：一种用于硬件等效性检查的高效量子可满足性求解器的设计,"Abhoy Kole, Mohammed E. Djeridane, Lennart Weingarten, Kamalika Datta, Rolf Drechsler",https://arxiv.org/pdf/2409.03917.pdf,"Subjects:
Quantum Physics (quant-ph); Emerging Technologies (cs.ET)","Quantum Physics (quant-ph),  Emerging Technologies (cs.ET)"
133,arXiv:2409.03904,Multiple right hand side multigrid for domain wall fermions with a multigrid preconditioned block conjugate gradient algorithm,基于多重网格预处理块共轭梯度算法的域壁费米子多重右侧多重网格,Peter A Boyle,https://arxiv.org/pdf/2409.03904.pdf,"Subjects:
High Energy Physics - Lattice (hep-lat); Distributed, Parallel, and Cluster Computing (cs.DC); Numerical Analysis (math.NA)","High Energy Physics - Lattice (hep-lat),  Distributed, Parallel, and Cluster Computing (cs.DC),  Numerical Analysis (math.NA)"
134,arXiv:2409.03903,"Deriving differential approximation results for $k\,$CSPs from combinatorial designs",从组合设计中推导$k\，$CSP的微分近似结果,"Jean-François Culus, Sophie Toulouse",https://arxiv.org/pdf/2409.03903.pdf,"Subjects:
Combinatorics (math.CO); Computational Complexity (cs.CC)","Combinatorics (math.CO),  Computational Complexity (cs.CC)"
135,arXiv:2409.03892,Active Sampling of Interpolation Points to Identify Dominant Subspaces for Model Reduction,插值点主动采样以识别模型降阶的主要子空间,"Celine Reddig, Pawan Goyal, Igor Pontes Duff, Peter Benner",https://arxiv.org/pdf/2409.03892.pdf,"Subjects:
Machine Learning (stat.ML); Machine Learning (cs.LG); Dynamical Systems (math.DS); Numerical Analysis (math.NA)","Machine Learning (stat.ML),  Machine Learning (cs.LG),  Dynamical Systems (math.DS),  Numerical Analysis (math.NA)"
136,arXiv:2409.03889,Recon-all-clinical: Cortical surface reconstruction and analysis of heterogeneous clinical brain MRI,Recon all临床：皮质表面重建和异质性临床脑MRI分析,"Karthik Gopinath, Douglas N. Greve, Colin Magdamo, Steve Arnold, Sudeshna Das, Oula Puonti, Juan Eugenio Iglesias",https://arxiv.org/pdf/2409.03889.pdf,"Subjects:
Image and Video Processing (eess.IV); Computer Vision and Pattern Recognition (cs.CV)","Image and Video Processing (eess.IV),  Computer Vision and Pattern Recognition (cs.CV)"
137,arXiv:2409.03871,Inferring Global Exponential Stability Properties using Lie-bracket Approximations,利用李括号近似推断全局指数稳定性,"Marc Weber, Bahman Gharesifard, Christian Ebenbauer",https://arxiv.org/pdf/2409.03871.pdf,"Subjects:
Optimization and Control (math.OC); Systems and Control (eess.SY)","Optimization and Control (math.OC),  Systems and Control (eess.SY)"
138,arXiv:2409.03833,AI forecasting of higher-order wave modes of spinning binary black hole mergers,旋转二元黑洞合并高阶波模的人工智能预测,"Victoria Tiki, Kiet Pham, Eliu Huerta",https://arxiv.org/pdf/2409.03833.pdf,"Subjects:
General Relativity and Quantum Cosmology (gr-qc); Instrumentation and Methods for Astrophysics (astro-ph.IM); Artificial Intelligence (cs.AI)","General Relativity and Quantum Cosmology (gr-qc),  Instrumentation and Methods for Astrophysics (astro-ph.IM),  Artificial Intelligence (cs.AI)"
139,arXiv:2409.03806,Mpox Screen Lite: AI-Driven On-Device Offline Mpox Screening for Low-Resource African Mpox Emergency Response,猴痘屏幕精简版：AI-Driven On-Device Offline猴痘低资源非洲猴痘紧急响应筛查,"Yudara Kularathne, Prathapa Janitha, Sithira Ambepitiya",https://arxiv.org/pdf/2409.03806.pdf,"Subjects:
Image and Video Processing (eess.IV); Artificial Intelligence (cs.AI); Computer Vision and Pattern Recognition (cs.CV)","Image and Video Processing (eess.IV),  Artificial Intelligence (cs.AI),  Computer Vision and Pattern Recognition (cs.CV)"
140,arXiv:2409.03805,Exploratory Visual Analysis for Increasing Data Readiness in Artificial Intelligence Projects,探索性可视化分析提高人工智能项目中的数据准备度,"Mattias Tiger, Daniel Jakobsson, Anders Ynnerman, Fredrik Heintz, Daniel Jönsson",https://arxiv.org/pdf/2409.03805.pdf,"Subjects:
Methodology (stat.ME); Artificial Intelligence (cs.AI)","Methodology (stat.ME),  Artificial Intelligence (cs.AI)"
141,arXiv:2409.03803,OGRePy: An Object-Oriented General Relativity Package for Python,OGRePy：面向对象的Python广义相对论包,Barak Shoshany,https://arxiv.org/pdf/2409.03803.pdf,"Subjects:
General Relativity and Quantum Cosmology (gr-qc); Mathematical Software (cs.MS); Symbolic Computation (cs.SC); Differential Geometry (math.DG)","General Relativity and Quantum Cosmology (gr-qc),  Mathematical Software (cs.MS),  Symbolic Computation (cs.SC),  Differential Geometry (math.DG)"
142,arXiv:2409.03801,Resultant: Incremental Effectiveness on Likelihood for Unsupervised Out-of-Distribution Detection,结果：无监督分布外检测的可能性的增量有效性,"Yewen Li, Chaojie Wang, Xiaobo Xia, Xu He, Ruyi An, Dong Li, Tongliang Liu, Bo An, Xinrun Wang",https://arxiv.org/pdf/2409.03801.pdf,"Subjects:
Machine Learning (stat.ML); Machine Learning (cs.LG)","Machine Learning (stat.ML),  Machine Learning (cs.LG)"
143,arXiv:2409.03794,Evaluating Machine Learning-based Skin Cancer Diagnosis,评估基于机器学习的皮肤癌症诊断,Tanish Jain,https://arxiv.org/pdf/2409.03794.pdf,"Subjects:
Image and Video Processing (eess.IV); Computer Vision and Pattern Recognition (cs.CV); Machine Learning (cs.LG)","Image and Video Processing (eess.IV),  Computer Vision and Pattern Recognition (cs.CV),  Machine Learning (cs.LG)"
144,arXiv:2409.03773,CoPRA: Bridging Cross-domain Pretrained Sequence Models with Complex Structures for Protein-RNA Binding Affinity Prediction,CoPRA：连接具有复杂结构的跨域预训练序列模型，用于预测蛋白质与RNA的结合亲和力,"Rong Han, Xiaohong Liu, Tong Pan, Jing Xu, Xiaoyu Wang, Wuyang Lan, Zhenyu Li, Zixuan Wang, Jiangning Song, Guangyu Wang, Ting Chen",https://arxiv.org/pdf/2409.03773.pdf,"Subjects:
Biomolecules (q-bio.BM); Machine Learning (cs.LG)","Biomolecules (q-bio.BM),  Machine Learning (cs.LG)"
145,arXiv:2409.03772,Exploiting XAI maps to improve MS lesion segmentation and detection in MRI,利用XAI图谱改进MRI中MS病变的分割和检测,"Federico Spagnolo, Nataliia Molchanova, Mario Ocampo Pineda, Lester Melie-Garcia, Meritxell Bach Cuadra, Cristina Granziera, Vincent Andrearczyk, Adrien Depeursinge",https://arxiv.org/pdf/2409.03772.pdf,"Subjects:
Image and Video Processing (eess.IV); Computer Vision and Pattern Recognition (cs.CV); Machine Learning (cs.LG)","Image and Video Processing (eess.IV),  Computer Vision and Pattern Recognition (cs.CV),  Machine Learning (cs.LG)"
146,arXiv:2409.03762,Combining supervised and unsupervised learning methods to predict financial market movements,结合监督和无监督学习方法预测金融市场走势,"Gabriel Rodrigues Palma, Mariusz Skoczeń, Phil Maguire",https://arxiv.org/pdf/2409.03762.pdf,"Subjects:
Statistical Finance (q-fin.ST); Machine Learning (cs.LG)","Statistical Finance (q-fin.ST),  Machine Learning (cs.LG)"
