Unnamed: 0,id,title,title_zh,authors,url,subjects,subject_split
68,arXiv:2409.03844,MetaBGM: Dynamic Soundtrack Transformation For Continuous Multi-Scene Experiences With Ambient Awareness And Personalization,MetaBGM：动态音轨转换，实现环境感知和个性化的连续多场景体验,"Haoxuan Liu, Zihao Wang, Haorong Hong, Youwei Feng, Jiaxin Yu, Han Diao, Yunfei Xu, Kejun Zhang",https://arxiv.org/pdf/2409.03844.pdf,"Subjects:
Sound (cs.SD); Artificial Intelligence (cs.AI); Human-Computer Interaction (cs.HC); Multimedia (cs.MM); Audio and Speech Processing (eess.AS)","Sound (cs.SD),  Artificial Intelligence (cs.AI),  Human-Computer Interaction (cs.HC),  Multimedia (cs.MM),  Audio and Speech Processing (eess.AS)"
69,arXiv:2409.03843,Persona Setting Pitfall: Persistent Outgroup Biases in Large Language Models Arising from Social Identity Adoption,人物设定陷阱：社会认同采用导致的大型语言模型中持续存在的外群体偏见,"Wenchao Dong, Assem Zhunis, Dongyoung Jeong, Hyojin Chin, Jiyoung Han, Meeyoung Cha",https://arxiv.org/pdf/2409.03843.pdf,"Subjects:
Computation and Language (cs.CL)",Computation and Language (cs.CL)
70,arXiv:2409.03841,The Interference Broadcast Channel with Reconfigurable Intelligent Surfaces: A Cooperative Sum-Rate Maximization Approach,具有可重构智能表面的干扰广播信道：一种协作求和速率最大化方法,"Konstantinos D. Katsanos, Paolo Di Lorenzo, George C. Alexandropoulos",https://arxiv.org/pdf/2409.03841.pdf,"Subjects:
Information Theory (cs.IT); Signal Processing (eess.SP)","Information Theory (cs.IT),  Signal Processing (eess.SP)"
71,arXiv:2409.03838,APITestGenie: Automated API Test Generation through Generative AI,APITestGenie：通过Generative AI自动生成API测试,"André Pereira, Bruno Lima, João Pascoal Faria",https://arxiv.org/pdf/2409.03838.pdf,"Subjects:
Software Engineering (cs.SE)",Software Engineering (cs.SE)
72,arXiv:2409.03834,Sequential bi-level regularized inversion with application to hidden reaction law discovery,序贯双层正则化反演及其在隐反律发现中的应用,Tram Thi Ngoc Nguyen,https://arxiv.org/pdf/2409.03834.pdf,"Subjects:
Numerical Analysis (math.NA); Analysis of PDEs (math.AP); Optimization and Control (math.OC)","Numerical Analysis (math.NA),  Analysis of PDEs (math.AP),  Optimization and Control (math.OC)"
73,arXiv:2409.03817,Neural Entropy,神经熵,Akhil Premkumar,https://arxiv.org/pdf/2409.03817.pdf,"Subjects:
Machine Learning (cs.LG); Statistical Mechanics (cond-mat.stat-mech); Information Theory (cs.IT)","Machine Learning (cs.LG),  Statistical Mechanics (cond-mat.stat-mech),  Information Theory (cs.IT)"
74,arXiv:2409.03811,PARCO: Learning Parallel Autoregressive Policies for Efficient Multi-Agent Combinatorial Optimization,PARCO：学习并行自回归策略以实现高效的多智能体组合优化,"Federico Berto, Chuanbo Hua, Laurin Luttmann, Jiwoo Son, Junyoung Park, Kyuree Ahn, Changhyun Kwon, Lin Xie, Jinkyoo Park",https://arxiv.org/pdf/2409.03811.pdf,"Subjects:
Multiagent Systems (cs.MA); Artificial Intelligence (cs.AI)","Multiagent Systems (cs.MA),  Artificial Intelligence (cs.AI)"
75,arXiv:2409.03810,How Do Your Code LLMs Perform? Empowering Code Instruction Tuning with High-Quality Data,你的LLM代码表现如何？利用高质量数据实现代码指令调优,"Yejie Wang, Keqing He, Dayuan Fu, Zhuoma Gongque, Heyang Xu, Yanxu Chen, Zhexu Wang, Yujia Fu, Guanting Dong, Muxi Diao, Jingang Wang, Mengdi Zhang, Xunliang Cai, Weiran Xu",https://arxiv.org/pdf/2409.03810.pdf,"Subjects:
Software Engineering (cs.SE); Artificial Intelligence (cs.AI); Computation and Language (cs.CL); Machine Learning (cs.LG)","Software Engineering (cs.SE),  Artificial Intelligence (cs.AI),  Computation and Language (cs.CL),  Machine Learning (cs.LG)"
76,arXiv:2409.03807,Accelerate Neural Subspace-Based Reduced-Order Solver of Deformable Simulation by Lipschitz Optimization,用Lipschitz优化方法加速基于神经子空间的可变形仿真降阶求解器,"Aoran Lyu, Shixian Zhao, Chuhua Xian, Zhihao Cen, Hongmin Cai, Guoxin Fang",https://arxiv.org/pdf/2409.03807.pdf,"Subjects:
Machine Learning (cs.LG); Graphics (cs.GR)","Machine Learning (cs.LG),  Graphics (cs.GR)"
77,arXiv:2409.03800,Flat-earth communities on Brazilian Telegram: when faith is used to question the existence of gravity as a physics phenomenon,巴西电报上的平地社区：当信仰被用来质疑重力作为一种物理现象的存在时,Ergon Cugler de Moraes Silva,https://arxiv.org/pdf/2409.03800.pdf,"Subjects:
Computers and Society (cs.CY)",Computers and Society (cs.CY)
78,arXiv:2409.03798,Interpretable Cyber Threat Detection for Enterprise Industrial Networks: A Computational Design Science Approach,企业工业网络的可解释网络威胁检测：一种计算设计科学方法,"Prabhat Kumar, A.K.M. Najmul Islam",https://arxiv.org/pdf/2409.03798.pdf,"Subjects:
Cryptography and Security (cs.CR)",Cryptography and Security (cs.CR)
79,arXiv:2409.03797,NESTFUL: A Benchmark for Evaluating LLMs on Nested Sequences of API Calls,NESTFUL:评估API调用嵌套序列LLM的基准,"Kinjal Basu, Ibrahim Abdelaziz, Kelsey Bradford, Maxwell Crouse, Kiran Kate, Sadhana Kumaravel, Saurabh Goyal, Asim Munawar, Yara Rizk, Xin Wang, Luis Lastras, Pavan Kapanipathi",https://arxiv.org/pdf/2409.03797.pdf,"Subjects:
Artificial Intelligence (cs.AI); Computation and Language (cs.CL)","Artificial Intelligence (cs.AI),  Computation and Language (cs.CL)"
80,arXiv:2409.03796,Protecting Activity Sensing Data Privacy Using Hierarchical Information Dissociation,利用分层信息分离保护活动感知数据隐私,"Guangjing Wang, Hanqing Guo, Yuanda Wang, Bocheng Chen, Ce Zhou, Qiben Yan",https://arxiv.org/pdf/2409.03796.pdf,"Subjects:
Cryptography and Security (cs.CR); Artificial Intelligence (cs.AI); Machine Learning (cs.LG)","Cryptography and Security (cs.CR),  Artificial Intelligence (cs.AI),  Machine Learning (cs.LG)"
81,arXiv:2409.03795,Security Implications and Mitigation Strategies in MPLS Networks,MPLS网络中的安全影响和缓解策略,Ayush Thakur,https://arxiv.org/pdf/2409.03795.pdf,"Subjects:
Cryptography and Security (cs.CR); Artificial Intelligence (cs.AI); Networking and Internet Architecture (cs.NI)","Cryptography and Security (cs.CR),  Artificial Intelligence (cs.AI),  Networking and Internet Architecture (cs.NI)"
82,arXiv:2409.03793,Safeguarding AI Agents: Developing and Analyzing Safety Architectures,保护人工智能代理：开发和分析安全架构,"Ishaan Domkundwar, Mukunda N S",https://arxiv.org/pdf/2409.03793.pdf,"Subjects:
Cryptography and Security (cs.CR); Artificial Intelligence (cs.AI)","Cryptography and Security (cs.CR),  Artificial Intelligence (cs.AI)"
83,arXiv:2409.03792,Experimental evaluation of architectural software performance design patterns in microservices,微服务架构软件性能设计模式的实验评估,"Willem Meijer, Catia Trubiani, Aldeida Aleti",https://arxiv.org/pdf/2409.03792.pdf,"Subjects:
Software Engineering (cs.SE)",Software Engineering (cs.SE)
84,arXiv:2409.03791,Unveiling the Digital Fingerprints: Analysis of Internet attacks based on website fingerprints,揭示数字指纹：基于网站指纹的互联网攻击分析,"Blerim Rexha, Arbena Musa, Kamer Vishi, Edlira Martiri",https://arxiv.org/pdf/2409.03791.pdf,"Subjects:
Cryptography and Security (cs.CR)",Cryptography and Security (cs.CR)
85,arXiv:2409.03789,BreachSeek: A Multi-Agent Automated Penetration Tester,BreachSeek：一个多代理自动渗透测试仪,"Ibrahim Alshehri, Adnan Alshehri, Abdulrahman Almalki, Majed Bamardouf, Alaqsa Akbar",https://arxiv.org/pdf/2409.03789.pdf,"Subjects:
Cryptography and Security (cs.CR); Artificial Intelligence (cs.AI)","Cryptography and Security (cs.CR),  Artificial Intelligence (cs.AI)"
86,arXiv:2409.03788,HSF: Defending against Jailbreak Attacks with Hidden State Filtering,HSF：通过隐藏状态过滤防御越狱攻击,"Cheng Qian, Hainan Zhang, Lei Sha, Zhiming Zheng",https://arxiv.org/pdf/2409.03788.pdf,"Subjects:
Cryptography and Security (cs.CR); Artificial Intelligence (cs.AI); Computation and Language (cs.CL); Machine Learning (cs.LG)","Cryptography and Security (cs.CR),  Artificial Intelligence (cs.AI),  Computation and Language (cs.CL),  Machine Learning (cs.LG)"
87,arXiv:2409.03784,N-Way Joint Mutual Exclusion Does Not Imply Any Pairwise Mutual Exclusion for Propositions,N-Way联合互斥并不意味着命题的任何成对互斥,Roy S. Freedman,https://arxiv.org/pdf/2409.03784.pdf,"Subjects:
Discrete Mathematics (cs.DM)",Discrete Mathematics (cs.DM)
88,arXiv:2409.03782,Assessing the Uncertainty and Robustness of Object Detection Models for Detecting Stickers on Laptops,评估用于检测笔记本电脑贴纸的目标检测模型的不确定性和稳健性,"Chengjie Lu, Jiahui Wu, Shaukat Ali, Mikkel Labori Olsen",https://arxiv.org/pdf/2409.03782.pdf,"Subjects:
Computer Vision and Pattern Recognition (cs.CV)",Computer Vision and Pattern Recognition (cs.CV)
89,arXiv:2409.03781,"It's Not You, It's Me: The Impact of Choice Models and Ranking Strategies on Gender Imbalance in Music Recommendation",不是你，是我：选择模型和排名策略对音乐推荐中性别失衡的影响,"Andres Ferraro, Michael D. Ekstrand, Christine Bauer",https://arxiv.org/pdf/2409.03781.pdf,"Subjects:
Information Retrieval (cs.IR)",Information Retrieval (cs.IR)
90,arXiv:2409.03780,Operational Safety in Human-in-the-loop Human-in-the-plant Autonomous Systems,人在回路中的操作安全人在工厂自主系统,"Ayan Banerjee, Aranyak Maity, Imane Lamrani, Sandeep K.S. Gupta",https://arxiv.org/pdf/2409.03780.pdf,"Subjects:
Human-Computer Interaction (cs.HC); Robotics (cs.RO)","Human-Computer Interaction (cs.HC),  Robotics (cs.RO)"
91,arXiv:2409.03779,ChatGPT and Its Educational Impact: Insights from a Software Development Competition,ChatGPT及其教育影响：来自软件开发竞赛的见解,"Sunhee Hwang, Yudoo Kim, Heejin Lee",https://arxiv.org/pdf/2409.03779.pdf,"Subjects:
Computers and Society (cs.CY); Software Engineering (cs.SE)","Computers and Society (cs.CY),  Software Engineering (cs.SE)"
92,arXiv:2409.03778,Two Pareto Optimum-based Heuristic Algorithms for Minimizing Tardiness and Late Jobs in the Single Machine Flowshop Problem,基于帕累托最优的两种启发式算法，用于最小化单机流水车间问题中的延迟和后期作业,"Matthew Gradwohl, Guidio Sewa, Oke Blessing Oghojafor, Richard Wilouwou, Muminu Adamu, Christopher Thron",https://arxiv.org/pdf/2409.03778.pdf,"Subjects:
Distributed, Parallel, and Cluster Computing (cs.DC); Optimization and Control (math.OC)","Distributed, Parallel, and Cluster Computing (cs.DC),  Optimization and Control (math.OC)"
93,arXiv:2409.03777,A Greedy Hierarchical Approach to Whole-Network Filter-Pruning in CNNs,一种贪婪的层次化CNN全网滤波器修剪方法,"Kiran Purohit, Anurag Reddy Parvathgari, Sourangshu Bhattacharya",https://arxiv.org/pdf/2409.03777.pdf,"Subjects:
Computer Vision and Pattern Recognition (cs.CV); Machine Learning (cs.LG)","Computer Vision and Pattern Recognition (cs.CV),  Machine Learning (cs.LG)"
94,arXiv:2409.03776,Federated Learning Approach to Mitigate Water Wastage,减少水资源浪费的联合学习方法,"Sina Hajer Ahmadi, Amruta Pranadika Mahashabde",https://arxiv.org/pdf/2409.03776.pdf,"Subjects:
Computers and Society (cs.CY); Machine Learning (cs.LG)","Computers and Society (cs.CY),  Machine Learning (cs.LG)"
95,arXiv:2409.03774,A Consistency Analysis Method for Traffic Sequence Charts,交通序列图的一致性分析方法,Jan Steffen Becker,https://arxiv.org/pdf/2409.03774.pdf,"Subjects:
Systems and Control (eess.SY)",Systems and Control (eess.SY)
96,arXiv:2409.03771,Distributed Path Compression for Piecewise Linear Morse-Smale Segmentations and Connected Components,分段线性Morse信号分段和连通分量的分布式路径压缩,"Michael Will, Jonas Lukasczyk, Julien Tierny, Christoph Garth",https://arxiv.org/pdf/2409.03771.pdf,"Subjects:
Distributed, Parallel, and Cluster Computing (cs.DC)","Distributed, Parallel, and Cluster Computing (cs.DC)"
97,arXiv:2409.03770,A Cost-effective Edge Computing Gateway for Smart Buildings,一种经济高效的智能建筑边缘计算网关,"Simon Madsen, Benjamin Staugaard, Zheng Ma, Salman Yussof, Bo Jørgensen",https://arxiv.org/pdf/2409.03770.pdf,"Subjects:
Networking and Internet Architecture (cs.NI)",Networking and Internet Architecture (cs.NI)
98,arXiv:2409.03769,"Representation Learning of Complex Assemblies, An Effort to Improve Corporate Scope 3 Emissions Calculation",复杂装配的表示学习，努力改进企业范围3的排放计算,"Ajay Chatterjee, Srikanth Ranganathan",https://arxiv.org/pdf/2409.03769.pdf,"Subjects:
Computers and Society (cs.CY); Machine Learning (cs.LG)","Computers and Society (cs.CY),  Machine Learning (cs.LG)"
99,arXiv:2409.03768,FFT reconstruction of signals from MIMO sampled data,MIMO采样数据信号的FFT重构,"Dong Cheng, Xiaoxiao Hu, Kit Ian Kou",https://arxiv.org/pdf/2409.03768.pdf,"Subjects:
Information Theory (cs.IT); Signal Processing (eess.SP); Classical Analysis and ODEs (math.CA)","Information Theory (cs.IT),  Signal Processing (eess.SP),  Classical Analysis and ODEs (math.CA)"
100,arXiv:2409.03767,EMCNet : Graph-Nets for Electron Micrographs Classification,EMCNet：电子显微图像分类的图论,"Sakhinana Sagar Srinivas, Rajat Kumar Sarkar, Venkataramana Runkana",https://arxiv.org/pdf/2409.03767.pdf,"Subjects:
Computer Vision and Pattern Recognition (cs.CV); Machine Learning (cs.LG)","Computer Vision and Pattern Recognition (cs.CV),  Machine Learning (cs.LG)"
101,arXiv:2409.03766,OpenCap markerless motion capture estimation of lower extremity kinematics and dynamics in cycling,自行车运动中下肢运动学和动力学的OpenCap无标记运动捕捉估计,"Reza Kakavand, Reza Ahmadi, Atousa Parsaei, W. Brent Edwards, Amin Komeili",https://arxiv.org/pdf/2409.03766.pdf,"Subjects:
Computer Vision and Pattern Recognition (cs.CV)",Computer Vision and Pattern Recognition (cs.CV)
102,arXiv:2409.03765,"AI and Entrepreneurship: Facial Recognition Technology Detects Entrepreneurs, Outperforming Human Experts",人工智能与创业：面部识别技术检测企业家，表现优于人类专家,"Martin Obschonka, Christian Fisch, Tharindu Fernando, Clinton Fookes",https://arxiv.org/pdf/2409.03765.pdf,"Subjects:
Computer Vision and Pattern Recognition (cs.CV); Image and Video Processing (eess.IV)","Computer Vision and Pattern Recognition (cs.CV),  Image and Video Processing (eess.IV)"
103,arXiv:2409.03764,Modeling Human Strategy for Flattening Wrinkled Cloth Using Neural Networks,基于神经网络的折皱布料压平策略建模,"Nilay Kant, Ashrut Aryal, Rajiv Ranganathan, Ranjan Mukherjee, Charles Owen",https://arxiv.org/pdf/2409.03764.pdf,"Subjects:
Computer Vision and Pattern Recognition (cs.CV); Image and Video Processing (eess.IV)","Computer Vision and Pattern Recognition (cs.CV),  Image and Video Processing (eess.IV)"
104,arXiv:2409.03763,A Dataset for Mechanical Mechanisms,机械机构数据集,"Farshid Ghezelbash, Amir Hossein Eskandari, Amir J Bidhendi",https://arxiv.org/pdf/2409.03763.pdf,"Subjects:
Computer Vision and Pattern Recognition (cs.CV)",Computer Vision and Pattern Recognition (cs.CV)
105,arXiv:2409.03761,Efficient Scene Appearance Aggregation for Level-of-Detail Rendering,用于细节级渲染的高效场景外观聚合,"Yang Zhou, Tao Huang, Ravi Ramamoorthi, Pradeep Sen, Ling-Qi Yan",https://arxiv.org/pdf/2409.03761.pdf,"Subjects:
Computer Vision and Pattern Recognition (cs.CV); Graphics (cs.GR)","Computer Vision and Pattern Recognition (cs.CV),  Graphics (cs.GR)"
106,arXiv:2409.03760,Rethinking Deep Learning: Propagating Information in Neural Networks without Backpropagation and Statistical Optimization,重新思考深度学习：在没有反向传播和统计优化的情况下在神经网络中传播信息,Kei Itoh,https://arxiv.org/pdf/2409.03760.pdf,"Subjects:
Machine Learning (cs.LG)",Machine Learning (cs.LG)
107,arXiv:2409.03759,VERA: Validation and Evaluation of Retrieval-Augmented Systems,VERA：检索增强系统的验证与评估,"Tianyu Ding, Adi Banerjee, Laurent Mombaerts, Yunhong Li, Tarik Borogovac, Juan Pablo De la Cruz Weinstein",https://arxiv.org/pdf/2409.03759.pdf,"Subjects:
Information Retrieval (cs.IR); Artificial Intelligence (cs.AI)","Information Retrieval (cs.IR),  Artificial Intelligence (cs.AI)"
108,arXiv:2409.03758,Post-quantum encryption algorithms of high-degree 3-variable polynomial congruences: BS cryptosystems and BS key generation,高阶三元多项式相合的后量子加密算法：BS密码系统和BS密钥生成,Nicholas J.Daras,https://arxiv.org/pdf/2409.03758.pdf,"Subjects:
Cryptography and Security (cs.CR)",Cryptography and Security (cs.CR)
109,arXiv:2405.15334,Detection and Positive Reconstruction of Cognitive Distortion sentences: Mandarin Dataset and Evaluation,认知扭曲句的检测与实证重建：普通话数据集与评价,"Shuya Lin, Yuxiong Wang, Jonathan Dong, Shiguang Ni",https://arxiv.org/pdf/2405.15334.pdf,"Subjects:
Computation and Language (cs.CL); Human-Computer Interaction (cs.HC)","Computation and Language (cs.CL),  Human-Computer Interaction (cs.HC)"
110,arXiv:2409.04424,Exploring Foundation Models for Synthetic Medical Imaging: A Study on Chest X-Rays and Fine-Tuning Techniques,探索合成医学成像的基础模型：胸部X射线和微调技术研究,"Davide Clode da Silva, Marina Musse Bernardes, Nathalia Giacomini Ceretta, Gabriel Vaz de Souza, Gabriel Fonseca Silva, Rafael Heitor Bordini, Soraia Raupp Musse",https://arxiv.org/pdf/2409.04424.pdf,"Subjects:
Image and Video Processing (eess.IV); Computer Vision and Pattern Recognition (cs.CV); Graphics (cs.GR)","Image and Video Processing (eess.IV),  Computer Vision and Pattern Recognition (cs.CV),  Graphics (cs.GR)"
111,arXiv:2409.04406,Quantum Kernel Methods under Scrutiny: A Benchmarking Study,审查下的量子核方法：基准研究,"Jan Schnabel, Marco Roth",https://arxiv.org/pdf/2409.04406.pdf,"Subjects:
Quantum Physics (quant-ph); Machine Learning (cs.LG)","Quantum Physics (quant-ph),  Machine Learning (cs.LG)"
112,arXiv:2409.04387,Best Linear Unbiased Estimate from Privatized Histograms,私有化直方图的最佳线性无偏估计,"Jordan Awan, Adam Edwards, Paul Bartholomew, Andrew Sillers",https://arxiv.org/pdf/2409.04387.pdf,"Subjects:
Computation (stat.CO); Cryptography and Security (cs.CR); Applications (stat.AP)","Computation (stat.CO),  Cryptography and Security (cs.CR),  Applications (stat.AP)"
113,arXiv:2409.04369,A high-order procedure for computing globally optimal Wannier functions in one-dimensional crystalline insulators,一维晶体绝缘体全局最优Wannier函数的高阶计算方法,"Abinand Gopal, Hanwen Zhang",https://arxiv.org/pdf/2409.04369.pdf,"Subjects:
Mathematical Physics (math-ph); Numerical Analysis (math.NA); Computational Physics (physics.comp-ph)","Mathematical Physics (math-ph),  Numerical Analysis (math.NA),  Computational Physics (physics.comp-ph)"
114,arXiv:2409.04368,The Impact of Scanner Domain Shift on Deep Learning Performance in Medical Imaging: an Experimental Study,扫描域偏移对医学成像深度学习性能的影响：一项实验研究,"Gregory Szumel, Brian Guo, Darui Lu, Rongze Gui, Tingyu Wang, Nicholas Konz, Maciej A. Mazurowski",https://arxiv.org/pdf/2409.04368.pdf,"Subjects:
Image and Video Processing (eess.IV); Artificial Intelligence (cs.AI); Computer Vision and Pattern Recognition (cs.CV)","Image and Video Processing (eess.IV),  Artificial Intelligence (cs.AI),  Computer Vision and Pattern Recognition (cs.CV)"
115,arXiv:2409.04365,Leveraging Machine Learning for Official Statistics: A Statistical Manifesto,利用机器学习进行官方统计：统计宣言,"Marco Puts, David Salgado, Piet Daas",https://arxiv.org/pdf/2409.04365.pdf,"Subjects:
Machine Learning (stat.ML); Machine Learning (cs.LG); Methodology (stat.ME)","Machine Learning (stat.ML),  Machine Learning (cs.LG),  Methodology (stat.ME)"
116,arXiv:2409.04175,"CISCA and CytoDArk0: a Cell Instance Segmentation and Classification method for histo(patho)logical image Analyses and a new, open, Nissl-stained dataset for brain cytoarchitecture studies",CISCA和CytoDArk0：一种用于组织（病理）图像分析的细胞实例分割和分类方法，以及一种用于脑细胞结构研究的新的开放尼氏染色数据集,"Valentina Vadori, Jean-Marie Graïc, Antonella Peruffo, Giulia Vadori, Livio Finos, Enrico Grisan",https://arxiv.org/pdf/2409.04175.pdf,"Subjects:
Image and Video Processing (eess.IV); Computer Vision and Pattern Recognition (cs.CV); Machine Learning (cs.LG); Quantitative Methods (q-bio.QM)","Image and Video Processing (eess.IV),  Computer Vision and Pattern Recognition (cs.CV),  Machine Learning (cs.LG),  Quantitative Methods (q-bio.QM)"
117,arXiv:2409.04143,An efficient hp-Variational PINNs framework for incompressible Navier-Stokes equations,求解不可压缩Navier-Stokes方程的高效hp变分PINN框架,"Thivin Anandh, Divij Ghose, Ankit Tyagi, Abhineet Gupta, Suranjan Sarkar, Sashikumaar Ganesan",https://arxiv.org/pdf/2409.04143.pdf,"Subjects:
Fluid Dynamics (physics.flu-dyn); Machine Learning (cs.LG); Computational Physics (physics.comp-ph)","Fluid Dynamics (physics.flu-dyn),  Machine Learning (cs.LG),  Computational Physics (physics.comp-ph)"
118,arXiv:2409.04140,Half-VAE: An Encoder-Free VAE to Bypass Explicit Inverse Mapping,半VAE：一种绕过显式逆映射的无编码器VAE,"Yuan-Hao Wei, Yan-Jie Sun, Chen Zhang",https://arxiv.org/pdf/2409.04140.pdf,"Subjects:
Machine Learning (stat.ML); Machine Learning (cs.LG)","Machine Learning (stat.ML),  Machine Learning (cs.LG)"
119,arXiv:2409.04137,Optical Coherence Tomography Angiography-OCTA dataset for the study of Diabetic Retinopathy,用于糖尿病视网膜病变研究的光学相干断层扫描血管造影OCTA数据集,"Pooja Bidwai, Shilpa Gite, Biswajeet Pradhan, Aditi Gupta, Kishore pahuja",https://arxiv.org/pdf/2409.04137.pdf,"Subjects:
Image and Video Processing (eess.IV); Computer Vision and Pattern Recognition (cs.CV)","Image and Video Processing (eess.IV),  Computer Vision and Pattern Recognition (cs.CV)"
120,arXiv:2409.04075,Automatic Generation of Examinations in the Automatic Control Courses,自动控制课程考试的自动生成,"Alexander Stotsky, Torsten Wik",https://arxiv.org/pdf/2409.04075.pdf,"Subjects:
Optimization and Control (math.OC); Information Theory (cs.IT)","Optimization and Control (math.OC),  Information Theory (cs.IT)"
121,arXiv:2409.04072,Study of Brain Network in Alzheimers Disease Using Wavelet-Based Graph Theory Method,基于小波图论方法的阿尔茨海默病脑网络研究,"Ali Khazaee, Abdolreza Mohammadi, Ruairi Oreally",https://arxiv.org/pdf/2409.04072.pdf,"Subjects:
Neurons and Cognition (q-bio.NC); Machine Learning (cs.LG)","Neurons and Cognition (q-bio.NC),  Machine Learning (cs.LG)"
122,arXiv:2409.04050,EigenSR: Eigenimage-Bridged Pre-Trained RGB Learners for Single Hyperspectral Image Super-Resolution,EigenSR：用于单幅高光谱图像超分辨率的特征图像桥接预训练RGB学习器,"Xi Su, Xiangfei Shen, Mingyang Wan, Jing Nie, Lihui Chen, Haijun Liu, Xichuan Zhou",https://arxiv.org/pdf/2409.04050.pdf,"Subjects:
Image and Video Processing (eess.IV); Computer Vision and Pattern Recognition (cs.CV)","Image and Video Processing (eess.IV),  Computer Vision and Pattern Recognition (cs.CV)"
123,arXiv:2409.04026,Efficient Fault-Tolerant Quantum Protocol for Differential Privacy in the Shuffle Model,Shuffle模型中用于差分隐私的高效容错量子协议,"Hassan Jameel Asghar, Arghya Mukherjee, Gavin K. Brennen",https://arxiv.org/pdf/2409.04026.pdf,"Subjects:
Quantum Physics (quant-ph); Cryptography and Security (cs.CR)","Quantum Physics (quant-ph),  Cryptography and Security (cs.CR)"
124,arXiv:2409.04014,"Development of the Listening in Spatialized Noise-Sentences (LiSN-S) Test in Brazilian Portuguese: Presentation Software, Speech Stimuli, and Sentence Equivalence",巴西葡萄牙语空间化噪声句子听力（LiSN-S）测试的发展：演示软件、语音刺激和句子等效,"Bruno S. Masiero, Leticia R. Borges, Harvey Dillon, Maria Francisca Colella-Santos",https://arxiv.org/pdf/2409.04014.pdf,"Subjects:
Audio and Speech Processing (eess.AS); Sound (cs.SD)","Audio and Speech Processing (eess.AS),  Sound (cs.SD)"
125,arXiv:2409.04010,Quantum multi-row iteration algorithm for linear systems with non-square coefficient matrices,非平方系数矩阵线性系统的量子多行迭代算法,"Weitao Lin, Guojing Tian, Xiaoming Sun",https://arxiv.org/pdf/2409.04010.pdf,"Subjects:
Quantum Physics (quant-ph); Emerging Technologies (cs.ET)","Quantum Physics (quant-ph),  Emerging Technologies (cs.ET)"
126,arXiv:2409.03990,Development of Advanced FEM Simulation Technology for Pre-Operative Surgical Planning,先进有限元仿真技术在术前手术计划中的应用,"Zhanyue Zhao, Yiwei Jiang, Charles Bales, Yang Wang, Gregory Fischer",https://arxiv.org/pdf/2409.03990.pdf,"Subjects:
Medical Physics (physics.med-ph); Robotics (cs.RO)","Medical Physics (physics.med-ph),  Robotics (cs.RO)"
127,arXiv:2409.03980,Entry-Specific Matrix Estimation under Arbitrary Sampling Patterns through the Lens of Network Flows,从网络流的角度看任意采样模式下的入口特定矩阵估计,"Yudong Chen, Xumei Xi, Christina Lee Yu",https://arxiv.org/pdf/2409.03980.pdf,"Subjects:
Machine Learning (stat.ML); Machine Learning (cs.LG)","Machine Learning (stat.ML),  Machine Learning (cs.LG)"
