Unnamed: 0,id,title,title_zh,authors,url,subjects,subject_split
502,arXiv:2409.17669,Impact of opinion formation phenomena in epidemic dynamics: kinetic modeling on networks,流行病动力学中意见形成现象的影响：网络动力学建模,"Giacomo Albi, Elisa Calzola, Giacomo Dimarco, Mattia Zanella",https://arxiv.org/pdf/2409.17669.pdf,"Subjects:
Physics and Society (physics.soc-ph); Numerical Analysis (math.NA)","Physics and Society (physics.soc-ph),  Numerical Analysis (math.NA)"
503,arXiv:2409.17658,Powers of large matrices on GPU platforms to compute the Roman domination number of cylindrical graphs,GPU平台上大矩阵计算柱面图罗马支配数的能力,"J.A. Martínez, E.M. Garzón, M.L. Puertas",https://arxiv.org/pdf/2409.17658.pdf,"Subjects:
Combinatorics (math.CO); Discrete Mathematics (cs.DM)","Combinatorics (math.CO),  Discrete Mathematics (cs.DM)"
504,arXiv:2409.17643,Efficient Fairness-Performance Pareto Front Computation,有效公平性能帕累托前沿计算,"Mark Kozdoba, Binyamin Perets, Shie Mannor",https://arxiv.org/pdf/2409.17643.pdf,"Subjects:
Machine Learning (stat.ML); Machine Learning (cs.LG)","Machine Learning (stat.ML),  Machine Learning (cs.LG)"
505,arXiv:2409.17635,FlowMAC: Conditional Flow Matching for Audio Coding at Low Bit Rates,FlowMAC：低比特率音频编码的条件流匹配,"Nicola Pia, Martin Strauss, Markus Multrus, Bernd Edler",https://arxiv.org/pdf/2409.17635.pdf,"Subjects:
Audio and Speech Processing (eess.AS); Machine Learning (cs.LG); Sound (cs.SD)","Audio and Speech Processing (eess.AS),  Machine Learning (cs.LG),  Sound (cs.SD)"
506,arXiv:2409.17591,Conjugate Bayesian Two-step Change Point Detection for Hawkes Process,霍克斯过程的共轭贝叶斯两步变点检测,"Zeyue Zhang, Xiaoling Lu, Feng Zhou",https://arxiv.org/pdf/2409.17591.pdf,"Subjects:
Machine Learning (stat.ML); Machine Learning (cs.LG)","Machine Learning (stat.ML),  Machine Learning (cs.LG)"
507,arXiv:2409.17583,Let the Quantum Creep In: Designing Quantum Neural Network Models by Gradually Swapping Out Classical Components,让量子潜入：通过逐步替换经典组件来设计量子神经网络模型,"Peiyong Wang, Casey. R. Myers, Lloyd C. L. Hollenberg, Udaya Parampalli",https://arxiv.org/pdf/2409.17583.pdf,"Subjects:
Quantum Physics (quant-ph); Artificial Intelligence (cs.AI); Computer Vision and Pattern Recognition (cs.CV); Machine Learning (cs.LG)","Quantum Physics (quant-ph),  Artificial Intelligence (cs.AI),  Computer Vision and Pattern Recognition (cs.CV),  Machine Learning (cs.LG)"
508,arXiv:2409.17544,Optimizing the Induced Correlation in Omnibus Joint Graph Embeddings,优化全向关节图嵌入中的诱导相关性,"Konstantinos Pantazis, Michael Trosset, William N. Frost, Carey E. Priebe, Vince Lyzinski",https://arxiv.org/pdf/2409.17544.pdf,"Subjects:
Machine Learning (stat.ML); Machine Learning (cs.LG); Statistics Theory (math.ST); Methodology (stat.ME)","Machine Learning (stat.ML),  Machine Learning (cs.LG),  Statistics Theory (math.ST),  Methodology (stat.ME)"
509,arXiv:2409.17525,When A Man Says He Is Pregnant: ERP Evidence for A Rational Account of Speaker-contextualized Language Comprehension,当一个男人说他怀孕了：ERP证据对说话者语境化语言理解的理性解释,"Hanlin Wu, Zhenguang G. Cai",https://arxiv.org/pdf/2409.17525.pdf,"Subjects:
Neurons and Cognition (q-bio.NC); Computation and Language (cs.CL)","Neurons and Cognition (q-bio.NC),  Computation and Language (cs.CL)"
510,arXiv:2409.17510,NeuroPath: A Neural Pathway Transformer for Joining the Dots of Human Connectomes,NeuroPath:连接人类连接体点的神经通路转换器,"Ziquan Wei, Tingting Dan, Jiaqi Ding, Paul J Laurienti, Guorong Wu",https://arxiv.org/pdf/2409.17510.pdf,"Subjects:
Neurons and Cognition (q-bio.NC); Artificial Intelligence (cs.AI); Computer Vision and Pattern Recognition (cs.CV); Machine Learning (cs.LG)","Neurons and Cognition (q-bio.NC),  Artificial Intelligence (cs.AI),  Computer Vision and Pattern Recognition (cs.CV),  Machine Learning (cs.LG)"
511,arXiv:2409.17505,Sequential Kernelized Stein Discrepancy,序列核化Stein差异,"Diego Martinez-Taboada, Aaditya Ramdas",https://arxiv.org/pdf/2409.17505.pdf,"Subjects:
Machine Learning (stat.ML); Machine Learning (cs.LG)","Machine Learning (stat.ML),  Machine Learning (cs.LG)"
512,arXiv:2409.17503,Shape-intensity knowledge distillation for robust medical image segmentation,用于鲁棒医学图像分割的形状强度知识提取,"Wenhui Dong, Bo Du, Yongchao Xu",https://arxiv.org/pdf/2409.17503.pdf,"Subjects:
Image and Video Processing (eess.IV); Computer Vision and Pattern Recognition (cs.CV)","Image and Video Processing (eess.IV),  Computer Vision and Pattern Recognition (cs.CV)"
513,arXiv:2409.17488,Optimal control of stochastic reaction networks with entropic control cost and emergence of mode-switching strategies,具有熵控制代价的随机反应网络的最优控制和模式切换策略的出现,"Shuhei A. Horiguchi, Tetsuya J. Kobayashi",https://arxiv.org/pdf/2409.17488.pdf,"Subjects:
Populations and Evolution (q-bio.PE); Systems and Control (eess.SY); Optimization and Control (math.OC); Biological Physics (physics.bio-ph); Molecular Networks (q-bio.MN)","Populations and Evolution (q-bio.PE),  Systems and Control (eess.SY),  Optimization and Control (math.OC),  Biological Physics (physics.bio-ph),  Molecular Networks (q-bio.MN)"
514,arXiv:2409.17466,Adjusting Regression Models for Conditional Uncertainty Calibration,调整回归模型进行条件不确定性校准,"Ruijiang Gao, Mingzhang Yin, James McInerney, Nathan Kallus",https://arxiv.org/pdf/2409.17466.pdf,"Subjects:
Machine Learning (stat.ML); Artificial Intelligence (cs.AI); Machine Learning (cs.LG)","Machine Learning (stat.ML),  Artificial Intelligence (cs.AI),  Machine Learning (cs.LG)"
515,arXiv:2409.17452,Description-based Controllable Text-to-Speech with Cross-Lingual Voice Control,基于描述的可控文本到语音的跨语言语音控制,"Ryuichi Yamamoto, Yuma Shirahata, Masaya Kawamura, Kentaro Tachibana",https://arxiv.org/pdf/2409.17452.pdf,"Subjects:
Audio and Speech Processing (eess.AS); Computation and Language (cs.CL); Machine Learning (cs.LG); Sound (cs.SD)","Audio and Speech Processing (eess.AS),  Computation and Language (cs.CL),  Machine Learning (cs.LG),  Sound (cs.SD)"
516,arXiv:2409.17451,Study of Subjective and Objective Quality in Super-Resolution Enhanced Broadcast Images on a Novel SR-IQA Dataset,基于新型SR-IQA数据集的超分辨率增强广播图像主客观质量研究,"Yongrok Kim, Junha Shin, Juhyun Lee, Hyunsuk Ko",https://arxiv.org/pdf/2409.17451.pdf,"Subjects:
Image and Video Processing (eess.IV); Computer Vision and Pattern Recognition (cs.CV)","Image and Video Processing (eess.IV),  Computer Vision and Pattern Recognition (cs.CV)"
517,arXiv:2409.17425,Website visits can predict angler presence using machine learning,网站访问可以使用机器学习预测垂钓者的存在,"Julia S. Schmid (1), Sean Simmons (2), Mark A. Lewis (1 and 3 and 4 and 5), Mark S. Poesch (5), Pouria Ramazi (6) ((1) Department of Mathematical and Statistical Sciences, University of Alberta, Edmonton, Alberta, Canada, (2) Anglers Atlas, Goldstream Publishing, Prince George, British Columbia, Canada, (3) Department of Mathematics and Statistics, University of Victoria, Victoria, British Columbia, Canada, (4) Department of Biology, University of Victoria, Victoria, British Columbia, Canada, (5) Department of Biological Sciences, University of Alberta, Edmonton, Alberta, Canada, (6) Department of Mathematics and Statistics, Brock University, St. Catharines, Ontario, Canada)",https://arxiv.org/pdf/2409.17425.pdf,"Subjects:
Physics and Society (physics.soc-ph); Machine Learning (cs.LG)","Physics and Society (physics.soc-ph),  Machine Learning (cs.LG)"
518,arXiv:2409.17421,Solar Active Regions Emergence Prediction Using Long Short-Term Memory Networks,利用长短期记忆网络预测太阳活动区的出现,"Spiridon Kasapis, Irina N. Kitiashvili, Alexander G. Kosovichev, John T. Stefan",https://arxiv.org/pdf/2409.17421.pdf,"Subjects:
Solar and Stellar Astrophysics (astro-ph.SR); Artificial Intelligence (cs.AI); Machine Learning (cs.LG)","Solar and Stellar Astrophysics (astro-ph.SR),  Artificial Intelligence (cs.AI),  Machine Learning (cs.LG)"
519,arXiv:2409.17364,Exploring synthetic data for cross-speaker style transfer in style representation based TTS,基于风格表示的TTS中跨说话者风格转换的合成数据探索,"Lucas H. Ueda, Leonardo B. de M. M. Marques, Flávio O. Simões, Mário U. Neto, Fernando Runstein, Bianca Dal Bó, Paula D. P. Costa",https://arxiv.org/pdf/2409.17364.pdf,"Subjects:
Audio and Speech Processing (eess.AS); Sound (cs.SD)","Audio and Speech Processing (eess.AS),  Sound (cs.SD)"
520,arXiv:2409.17354,Multi-scale decomposition of sea surface height snapshots using machine learning,基于机器学习的海面高度快照多尺度分解,"Jingwen Lyu, Yue Wang, Christian Pedersen, Spencer Jones, Dhruv Balwada",https://arxiv.org/pdf/2409.17354.pdf,"Subjects:
Atmospheric and Oceanic Physics (physics.ao-ph); Computer Vision and Pattern Recognition (cs.CV)","Atmospheric and Oceanic Physics (physics.ao-ph),  Computer Vision and Pattern Recognition (cs.CV)"
521,arXiv:2409.17320,Accelerating Multi-Block Constrained Optimization Through Learning to Optimize,通过学习优化加速多块约束优化,"Ling Liang, Cameron Austin, Haizhao Yang",https://arxiv.org/pdf/2409.17320.pdf,"Subjects:
Optimization and Control (math.OC); Machine Learning (cs.LG)","Optimization and Control (math.OC),  Machine Learning (cs.LG)"
522,arXiv:2409.17317,Towards a complete classification of holographic entropy inequalities,全息熵不等式的完整分类,"Ning Bao, Keiichiro Furuya, Joydeep Naskar",https://arxiv.org/pdf/2409.17317.pdf,"Subjects:
High Energy Physics - Theory (hep-th); Discrete Mathematics (cs.DM); Quantum Physics (quant-ph)","High Energy Physics - Theory (hep-th),  Discrete Mathematics (cs.DM),  Quantum Physics (quant-ph)"
523,arXiv:2409.17306,Bounds on the Complete Forcing Number of Graphs,图的完全强制数的边界,"Javad B. Ebrahimi, Aref Nemayande, Elahe Tohidi",https://arxiv.org/pdf/2409.17306.pdf,"Subjects:
Combinatorics (math.CO); Discrete Mathematics (cs.DM)","Combinatorics (math.CO),  Discrete Mathematics (cs.DM)"
524,arXiv:2409.17304,Democratizing Signal Processing and Machine Learning: Math Learning Equity for Elementary and Middle School Students,信号处理和机器学习民主化：中小学生数学学习公平,"Namrata Vaswani, Mohamed Y. Selim, Renee Serrell Gibert",https://arxiv.org/pdf/2409.17304.pdf,"Subjects:
History and Overview (math.HO); Computers and Society (cs.CY)","History and Overview (math.HO),  Computers and Society (cs.CY)"
525,arXiv:2409.17299,High-Performance Implementation of the Optimized Event Generator for Strong-Field QED Plasma Simulations,强场QED等离子体模拟优化事件发生器的高性能实现,"Elena Panova, Valentin Volokitin, Aleksei Bashinov, Alexander Muraviev, Evgeny Efimenko, Iosif Meyerov",https://arxiv.org/pdf/2409.17299.pdf,"Subjects:
Computational Physics (physics.comp-ph); Distributed, Parallel, and Cluster Computing (cs.DC)","Computational Physics (physics.comp-ph),  Distributed, Parallel, and Cluster Computing (cs.DC)"
526,arXiv:2409.17298,"Sparsity, Regularization and Causality in Agricultural Yield: The Case of Paddy Rice in Peru",农业产量的稀疏性、规律性和因果性——以秘鲁水稻为例,"Rita Rocio Guzman-Lopez, Luis Huamanchumo, Kevin Fernandez, Oscar Cutipa-Luque, Yhon Tiahuallpa, Helder Rojas",https://arxiv.org/pdf/2409.17298.pdf,"Subjects:
Methodology (stat.ME); Machine Learning (cs.LG); Applications (stat.AP); Machine Learning (stat.ML)","Methodology (stat.ME),  Machine Learning (cs.LG),  Applications (stat.AP),  Machine Learning (stat.ML)"
527,arXiv:2409.17294,"Schr\""odinger bridge based deep conditional generative learning",基于薛定谔桥的深度条件生成学习,Hanwen Huang,https://arxiv.org/pdf/2409.17294.pdf,"Subjects:
Machine Learning (stat.ML); Machine Learning (cs.LG)","Machine Learning (stat.ML),  Machine Learning (cs.LG)"
528,arXiv:2409.17276,Multiview Canonical Correlation Analysis for Automatic Pathological Speech Detection,用于自动病理语音检测的多视图典型相关分析,"Yacouba Kaloga, Shakeel A. Sheikh, Ina Kodrasi",https://arxiv.org/pdf/2409.17276.pdf,"Subjects:
Audio and Speech Processing (eess.AS); Machine Learning (cs.LG); Sound (cs.SD)","Audio and Speech Processing (eess.AS),  Machine Learning (cs.LG),  Sound (cs.SD)"
529,arXiv:2409.17273,"An Integrated Deep Learning Framework for Effective Brain Tumor Localization, Segmentation, and Classification from Magnetic Resonance Images",用于从磁共振图像中有效定位、分割和分类脑肿瘤的集成深度学习框架,"Pandiyaraju V, Shravan Venkatraman, Abeshek A, Aravintakshan S A, Pavan Kumar S, Madhan S",https://arxiv.org/pdf/2409.17273.pdf,"Subjects:
Image and Video Processing (eess.IV); Computer Vision and Pattern Recognition (cs.CV); Machine Learning (cs.LG)","Image and Video Processing (eess.IV),  Computer Vision and Pattern Recognition (cs.CV),  Machine Learning (cs.LG)"
530,arXiv:2409.17256,AIM 2024 Challenge on Efficient Video Super-Resolution for AV1 Compressed Content,AIM 2024挑战AV1压缩内容的高效视频超分辨率,"Marcos V Conde, Zhijun Lei, Wen Li, Christos Bampis, Ioannis Katsavounidis, Radu Timofte",https://arxiv.org/pdf/2409.17256.pdf,"Subjects:
Image and Video Processing (eess.IV); Computer Vision and Pattern Recognition (cs.CV); Graphics (cs.GR); Multimedia (cs.MM)","Image and Video Processing (eess.IV),  Computer Vision and Pattern Recognition (cs.CV),  Graphics (cs.GR),  Multimedia (cs.MM)"
531,arXiv:2409.17228,Disk2Planet: A Robust and Automated Machine Learning Tool for Parameter Inference in Disk-Planet Systems,Disk2Planet：一种用于盘行星系统参数推断的鲁棒和自动化机器学习工具,"Shunyuan Mao, Ruobing Dong, Kwang Moo Yi, Lu Lu, Sifan Wang, Paris Perdikaris",https://arxiv.org/pdf/2409.17228.pdf,"Subjects:
Earth and Planetary Astrophysics (astro-ph.EP); Artificial Intelligence (cs.AI); Machine Learning (cs.LG)","Earth and Planetary Astrophysics (astro-ph.EP),  Artificial Intelligence (cs.AI),  Machine Learning (cs.LG)"
532,arXiv:2409.17189,Decentralized Federated Learning with Gradient Tracking over Time-Varying Directed Networks,时变有向网络上的梯度跟踪分散联合学习,"Duong Thuy Anh Nguyen, Su Wang, Duong Tung Nguyen, Angelia Nedich, H. Vincent Poor",https://arxiv.org/pdf/2409.17189.pdf,"Subjects:
Optimization and Control (math.OC); Machine Learning (cs.LG)","Optimization and Control (math.OC),  Machine Learning (cs.LG)"
533,arXiv:2409.17187,Applications and Novel Regularization of the Thin-Film Equation,薄膜方程的新正则化及其应用,Khang Ee Pang,https://arxiv.org/pdf/2409.17187.pdf,"Subjects:
Fluid Dynamics (physics.flu-dyn); Numerical Analysis (math.NA)","Fluid Dynamics (physics.flu-dyn),  Numerical Analysis (math.NA)"
534,arXiv:2409.17186,Don't Trust A Single Gerrymandering Metric,不要相信单一的Gerrymandering指标,"Thomas Ratliff, Stephanie Somersille, Ellen Veomett",https://arxiv.org/pdf/2409.17186.pdf,"Subjects:
Physics and Society (physics.soc-ph); Computers and Society (cs.CY)","Physics and Society (physics.soc-ph),  Computers and Society (cs.CY)"
535,arXiv:2409.17183,Transfer learning for financial data predictions: a systematic review,金融数据预测的迁移学习：系统综述,V. Lanzetta,https://arxiv.org/pdf/2409.17183.pdf,"Subjects:
Trading and Market Microstructure (q-fin.TR); Artificial Intelligence (cs.AI); Machine Learning (cs.LG); Computational Finance (q-fin.CP)","Trading and Market Microstructure (q-fin.TR),  Artificial Intelligence (cs.AI),  Machine Learning (cs.LG),  Computational Finance (q-fin.CP)"
536,arXiv:2409.17178,MODEL&CO: Exoplanet detection in angular differential imaging by learning across multiple observations,MODEL&CO：通过在多次观测中学习，在角差分成像中检测系外行星,"Théo Bodrito, Olivier Flasseur, Julien Mairal, Jean Ponce, Maud Langlois, Anne-Marie Lagrange",https://arxiv.org/pdf/2409.17178.pdf,"Subjects:
Instrumentation and Methods for Astrophysics (astro-ph.IM); Earth and Planetary Astrophysics (astro-ph.EP); Computer Vision and Pattern Recognition (cs.CV); Data Analysis, Statistics and Probability (physics.data-an)","Instrumentation and Methods for Astrophysics (astro-ph.IM),  Earth and Planetary Astrophysics (astro-ph.EP),  Computer Vision and Pattern Recognition (cs.CV),  Data Analysis, Statistics and Probability (physics.data-an)"
537,arXiv:2409.17146,Molmo and PixMo: Open Weights and Open Data for State-of-the-Art Multimodal Models,Molmo和PixMo：最先进的多模态模型的开放权重和开放数据,"Matt Deitke, Christopher Clark, Sangho Lee, Rohun Tripathi, Yue Yang, Jae Sung Park, Mohammadreza Salehi, Niklas Muennighoff, Kyle Lo, Luca Soldaini, Jiasen Lu, Taira Anderson, Erin Bransom, Kiana Ehsani, Huong Ngo, YenSung Chen, Ajay Patel, Mark Yatskar, Chris Callison-Burch, Andrew Head, Rose Hendrix, Favyen Bastani, Eli VanderBilt, Nathan Lambert, Yvonne Chou, Arnavi Chheda, Jenna Sparks, Sam Skjonsberg, Michael Schmitz, Aaron Sarnat, Byron Bischoff, Pete Walsh, Chris Newell, Piper Wolters, Tanmay Gupta, Kuo-Hao Zeng, Jon Borchardt, Dirk Groeneveld, Jen Dumas, Crystal Nam, Sophie Lebrecht, Caitlin Wittlif, Carissa Schoenick, Oscar Michel, Ranjay Krishna, Luca Weihs, Noah A. Smith, Hannaneh Hajishirzi, Ross Girshick, Ali Farhadi, Aniruddha Kembhavi",https://arxiv.org/pdf/2409.17146.pdf,"Subjects:
Computer Vision and Pattern Recognition (cs.CV); Computation and Language (cs.CL); Machine Learning (cs.LG)","Computer Vision and Pattern Recognition (cs.CV),  Computation and Language (cs.CL),  Machine Learning (cs.LG)"
538,arXiv:2409.17145,DreamWaltz-G: Expressive 3D Gaussian Avatars from Skeleton-Guided 2D Diffusion,DreamWaltz-G：来自骨架引导的2D扩散的表现性3D高斯化身,"Yukun Huang, Jianan Wang, Ailing Zeng, Zheng-Jun Zha, Lei Zhang, Xihui Liu",https://arxiv.org/pdf/2409.17145.pdf,"Subjects:
Computer Vision and Pattern Recognition (cs.CV); Graphics (cs.GR); Machine Learning (cs.LG)","Computer Vision and Pattern Recognition (cs.CV),  Graphics (cs.GR),  Machine Learning (cs.LG)"
539,arXiv:2409.17144,Differential Privacy Regularization: Protecting Training Data Through Loss Function Regularization,差分隐私正则化：通过损失函数正则化保护训练数据,"Francisco Aguilera-Martínez, Fernando Berzal",https://arxiv.org/pdf/2409.17144.pdf,"Subjects:
Machine Learning (cs.LG); Artificial Intelligence (cs.AI); Cryptography and Security (cs.CR); Neural and Evolutionary Computing (cs.NE)","Machine Learning (cs.LG),  Artificial Intelligence (cs.AI),  Cryptography and Security (cs.CR),  Neural and Evolutionary Computing (cs.NE)"
540,arXiv:2409.17143,Attention Prompting on Image for Large Vision-Language Models,大型视觉语言模型对图像的注意力提示,"Runpeng Yu, Weihao Yu, Xinchao Wang",https://arxiv.org/pdf/2409.17143.pdf,"Subjects:
Computer Vision and Pattern Recognition (cs.CV); Artificial Intelligence (cs.AI)","Computer Vision and Pattern Recognition (cs.CV),  Artificial Intelligence (cs.AI)"
541,arXiv:2409.17141,FineZip : Pushing the Limits of Large Language Models for Practical Lossless Text Compression,FineZip：突破大型语言模型的极限，实现实用的无损文本压缩,"Fazal Mittu, Yihuan Bu, Akshat Gupta, Ashok Devireddy, Alp Eren Ozdarendeli, Anant Singh, Gopala Anumanchipalli",https://arxiv.org/pdf/2409.17141.pdf,"Subjects:
Computation and Language (cs.CL); Artificial Intelligence (cs.AI); Machine Learning (cs.LG)","Computation and Language (cs.CL),  Artificial Intelligence (cs.AI),  Machine Learning (cs.LG)"
542,arXiv:2409.17140,Turn Every Application into an Agent: Towards Efficient Human-Agent-Computer Interaction with API-First LLM-Based Agents,将每个应用程序变成一个代理：与基于API-First LLM的代理实现高效的人机交互,"Junting Lu, Zhiyang Zhang, Fangkai Yang, Jue Zhang, Lu Wang, Chao Du, Qingwei Lin, Saravan Rajmohan, Dongmei Zhang, Qi Zhang",https://arxiv.org/pdf/2409.17140.pdf,"Subjects:
Artificial Intelligence (cs.AI)",Artificial Intelligence (cs.AI)
543,arXiv:2409.17139,Learning with Dynamics: Autonomous Regulation of UAV Based Communication Networks with Dynamic UAV Crew,动态学习：无人机通信网络与动态无人机机组人员的自主调节,"Ran Zhang, Bowei Li, Liyuan Zhang, Jiang (Linda)Xie, Miao Wang",https://arxiv.org/pdf/2409.17139.pdf,"Subjects:
Systems and Control (eess.SY); Machine Learning (cs.LG); Networking and Internet Architecture (cs.NI)","Systems and Control (eess.SY),  Machine Learning (cs.LG),  Networking and Internet Architecture (cs.NI)"
544,arXiv:2409.17137,PACE: marrying generalization in PArameter-efficient fine-tuning with Consistency rEgularization,PACE：将PArameter中的泛化与一致性均衡化相结合,"Yao Ni, Shan Zhang, Piotr Koniusz",https://arxiv.org/pdf/2409.17137.pdf,"Subjects:
Machine Learning (cs.LG); Computer Vision and Pattern Recognition (cs.CV)","Machine Learning (cs.LG),  Computer Vision and Pattern Recognition (cs.CV)"
545,arXiv:2409.17136,Adaptive Cost Model for Query Optimization,查询优化的自适应成本模型,"Nikita Vasilenko, Alexander Demin, Denis Ponomaryov",https://arxiv.org/pdf/2409.17136.pdf,"Subjects:
Databases (cs.DB)",Databases (cs.DB)
546,arXiv:2409.17134,Streaming Neural Images,流式神经图像,"Marcos V. Conde, Andy Bigos, Radu Timofte",https://arxiv.org/pdf/2409.17134.pdf,"Subjects:
Computer Vision and Pattern Recognition (cs.CV); Image and Video Processing (eess.IV)","Computer Vision and Pattern Recognition (cs.CV),  Image and Video Processing (eess.IV)"
547,arXiv:2409.17132,"Complex-Phase, Data-Driven Identification of Grid-Forming Inverter Dynamics",复杂相位、数据驱动的并网逆变器动力学辨识,"Anna Büttner, Hans Würfel, Sebastian Liemann, Johannes Schiffer, Frank Hellmann",https://arxiv.org/pdf/2409.17132.pdf,"Subjects:
Systems and Control (eess.SY)",Systems and Control (eess.SY)
548,arXiv:2409.17131,Enhancing robot reliability for health-care facilities by means of Human-Aware Navigation Planning,通过人类感知导航规划提高医疗机构机器人的可靠性,"Olga E. Sorokoletova, Lucca Iocchi",https://arxiv.org/pdf/2409.17131.pdf,"Subjects:
Robotics (cs.RO)",Robotics (cs.RO)
549,arXiv:2409.17130,Assessing the Level of Toxicity Against Distinct Groups in Bangla Social Media Comments: A Comprehensive Investigation,评估孟加拉国社交媒体评论中不同群体的毒性水平：一项综合调查,"Mukaffi Bin Moin, Pronay Debnath, Usafa Akther Rifa, Rijeet Bin Anis",https://arxiv.org/pdf/2409.17130.pdf,"Subjects:
Computation and Language (cs.CL)",Computation and Language (cs.CL)
550,arXiv:2409.17128,NetScaNDN: A Scalable and Flexible Testbed To Evaluate NDN on Multiple Infrastructures,NetScaNDN：一个可扩展且灵活的测试平台，用于评估多种基础设施上的NDN,"Amir Esmaeili, Maryam Fazli",https://arxiv.org/pdf/2409.17128.pdf,"Subjects:
Networking and Internet Architecture (cs.NI)",Networking and Internet Architecture (cs.NI)
551,arXiv:2409.17126,"Blox-Net: Generative Design-for-Robot-Assembly Using VLM Supervision, Physics Simulation, and a Robot with Reset",Blox-Net：使用VLM监督、物理仿真和带复位的机器人进行机器人装配的生成设计,"Andrew Goldberg, Kavish Kondap, Tianshuang Qiu, Zehan Ma, Letian Fu, Justin Kerr, Huang Huang, Kaiyuan Chen, Kuan Fang, Ken Goldberg",https://arxiv.org/pdf/2409.17126.pdf,"Subjects:
Robotics (cs.RO); Artificial Intelligence (cs.AI); Machine Learning (cs.LG)","Robotics (cs.RO),  Artificial Intelligence (cs.AI),  Machine Learning (cs.LG)"
552,arXiv:2409.17125,On-orbit Servicing for Spacecraft Collision Avoidance With Autonomous Decision Making,自主决策航天器避碰在轨服务,"Susmitha Patnala, Adam Abdin",https://arxiv.org/pdf/2409.17125.pdf,"Subjects:
Artificial Intelligence (cs.AI)",Artificial Intelligence (cs.AI)
553,arXiv:2409.17124,PokeFlex: Towards a Real-World Dataset of Deformable Objects for Robotic Manipulation,PokeFlex：面向机器人操纵的可变形物体的真实世界数据集,"Jan Obrist, Miguel Zamora, Hehui Zheng, Juan Zarate, Robert K. Katzschmann, Stelian Coros",https://arxiv.org/pdf/2409.17124.pdf,"Subjects:
Robotics (cs.RO)",Robotics (cs.RO)
554,arXiv:2409.17120,"Deep Learning and Machine Learning, Advancing Big Data Analytics and Management: Handy Appetizer",深度学习和机器学习，推进大数据分析和管理：方便的胃口,"Benji Peng, Xuanhe Pan, Yizhu Wen, Ziqian Bi, Keyu Chen, Ming Li, Ming Liu, Qian Niu, Junyu Liu, Jinlang Wang, Sen Zhang, Jiawei Xu, Pohsun Feng",https://arxiv.org/pdf/2409.17120.pdf,"Subjects:
Computation and Language (cs.CL); Machine Learning (cs.LG)","Computation and Language (cs.CL),  Machine Learning (cs.LG)"
555,arXiv:2409.17119,Small data deep learning methodology for in-field disease detection,用于现场疾病检测的小数据深度学习方法,"David Herrera-Poyato, Jacinto Domínguez-Rull, Rosana Montes, Inés Hernánde, Ignacio Barrio, Carlos Poblete-Echeverria, Javier Tardaguila, Francisco Herrera, Andrés Herrera-Poyatos",https://arxiv.org/pdf/2409.17119.pdf,"Subjects:
Computer Vision and Pattern Recognition (cs.CV)",Computer Vision and Pattern Recognition (cs.CV)
556,arXiv:2409.17116,Hierarchical Tri-manual Planning for Vision-assisted Fruit Harvesting with Quadrupedal Robots,四足机器人视觉辅助水果收获的分层三手动规划,"Zhichao Liu, Jingzong Zhou, Konstantinos Karydis",https://arxiv.org/pdf/2409.17116.pdf,"Subjects:
Robotics (cs.RO)",Robotics (cs.RO)
