Unnamed: 0,id,title,title_zh,authors,url,subjects,subject_split
994,arXiv:2409.16316,Surface solar radiation: AI satellite retrieval can outperform Heliosat and generalizes well to other climate zones,地表太阳辐射：人工智能卫星检索可以超越Heliosat，并很好地推广到其他气候带,"K. R. Schuurman, A. Meyer",https://arxiv.org/pdf/2409.16316.pdf,"Subjects:
Atmospheric and Oceanic Physics (physics.ao-ph); Artificial Intelligence (cs.AI); Machine Learning (cs.LG)","Atmospheric and Oceanic Physics (physics.ao-ph),  Artificial Intelligence (cs.AI),  Machine Learning (cs.LG)"
995,arXiv:2409.16313,SEA-ViT: Sea Surface Currents Forecasting Using Vision Transformer and GRU-Based Spatio-Temporal Covariance Modeling,SEA ViT：使用视觉变换器和基于GRU的时空协方差模型预测海面洋流,Teerapong Panboonyuen,https://arxiv.org/pdf/2409.16313.pdf,"Subjects:
Atmospheric and Oceanic Physics (physics.ao-ph); Machine Learning (cs.LG)","Atmospheric and Oceanic Physics (physics.ao-ph),  Machine Learning (cs.LG)"
996,arXiv:2409.16312,SEE: Semantically Aligned EEG-to-Text Translation,参见：语义对齐的EEG到文本翻译,"Yitian Tao, Yan Liang, Luoyu Wang, Yongqing Li, Qing Yang, Han Zhang",https://arxiv.org/pdf/2409.16312.pdf,"Subjects:
Quantitative Methods (q-bio.QM); Artificial Intelligence (cs.AI); Signal Processing (eess.SP)","Quantitative Methods (q-bio.QM),  Artificial Intelligence (cs.AI),  Signal Processing (eess.SP)"
997,arXiv:2409.16311,New Insights into Global Warming: End-to-End Visual Analysis and Prediction of Temperature Variations,全球变暖的新见解：端到端的可视化分析和温度变化预测,"Meihua Zhou, Nan Wan, Tianlong Zheng, Hanwen Xu, Li Yang, Tingting Wang",https://arxiv.org/pdf/2409.16311.pdf,"Subjects:
Atmospheric and Oceanic Physics (physics.ao-ph); Human-Computer Interaction (cs.HC); Applications (stat.AP)","Atmospheric and Oceanic Physics (physics.ao-ph),  Human-Computer Interaction (cs.HC),  Applications (stat.AP)"
998,arXiv:2409.16302,How Redundant Is the Transformer Stack in Speech Representation Models?,语音表示模型中的变换器堆栈有多冗余？,"Teresa Dorszewski, Albert Kjøller Jacobsen, Lenka Tětková, Lars Kai Hansen",https://arxiv.org/pdf/2409.16302.pdf,"Subjects:
Audio and Speech Processing (eess.AS); Computation and Language (cs.CL); Machine Learning (cs.LG); Sound (cs.SD)","Audio and Speech Processing (eess.AS),  Computation and Language (cs.CL),  Machine Learning (cs.LG),  Sound (cs.SD)"
999,arXiv:2409.16298,BetterBodies: Reinforcement Learning guided Diffusion for Antibody Sequence Design,BetterBodies：强化学习引导的抗体序列设计扩散,"Yannick Vogt, Mehdi Naouar, Maria Kalweit, Christoph Cornelius Miething, Justus Duyster, Joschka Boedecker, Gabriel Kalweit",https://arxiv.org/pdf/2409.16298.pdf,"Subjects:
Biomolecules (q-bio.BM); Machine Learning (cs.LG)","Biomolecules (q-bio.BM),  Machine Learning (cs.LG)"
1000,arXiv:2409.16295,Efficient Training of Self-Supervised Speech Foundation Models on a Compute Budget,基于计算预算的自监督语音基础模型的高效训练,"Andy T. Liu, Yi-Cheng Lin, Haibin Wu, Stefan Winkler, Hung-yi Lee",https://arxiv.org/pdf/2409.16295.pdf,"Subjects:
Audio and Speech Processing (eess.AS); Computation and Language (cs.CL); Machine Learning (cs.LG); Sound (cs.SD)","Audio and Speech Processing (eess.AS),  Computation and Language (cs.CL),  Machine Learning (cs.LG),  Sound (cs.SD)"
1001,arXiv:2409.16290,Computer Aided Detection and Classification of mammograms using Convolutional Neural Network,基于卷积神经网络的乳腺X线照片计算机辅助检测与分类,"Kashif Ishaq, Muhammad Mustagis",https://arxiv.org/pdf/2409.16290.pdf,"Subjects:
Image and Video Processing (eess.IV); Computer Vision and Pattern Recognition (cs.CV)","Image and Video Processing (eess.IV),  Computer Vision and Pattern Recognition (cs.CV)"
1002,arXiv:2409.14486,Unsupervised Word Discovery: Boundary Detection with Clustering vs. Dynamic Programming,无监督单词发现：聚类与动态规划的边界检测,"Simon Malan, Benjamin van Niekerk, Herman Kamper",https://arxiv.org/pdf/2409.14486.pdf,"Subjects:
Audio and Speech Processing (eess.AS); Computation and Language (cs.CL); Sound (cs.SD)","Audio and Speech Processing (eess.AS),  Computation and Language (cs.CL),  Sound (cs.SD)"
1003,arXiv:2409.16288,Self-Supervised Any-Point Tracking by Contrastive Random Walks,通过对比随机行走进行自我监督的任意点跟踪,"Ayush Shrivastava, Andrew Owens",https://arxiv.org/pdf/2409.16288.pdf,"Subjects:
Computer Vision and Pattern Recognition (cs.CV)",Computer Vision and Pattern Recognition (cs.CV)
1004,arXiv:2409.16287,Articulated Object Manipulation using Online Axis Estimation with SAM2-Based Tracking,基于SAM2跟踪的在线轴估计关节对象操纵,"Xi Wang, Tianxing Chen, Qiaojun Yu, Tianling Xu, Zanxin Chen, Yiting Fu, Cewu Lu, Yao Mu, Ping Luo",https://arxiv.org/pdf/2409.16287.pdf,"Subjects:
Robotics (cs.RO); Artificial Intelligence (cs.AI); Graphics (cs.GR); Machine Learning (cs.LG)","Robotics (cs.RO),  Artificial Intelligence (cs.AI),  Graphics (cs.GR),  Machine Learning (cs.LG)"
1005,arXiv:2409.16285,Age of Gossip in Networks with Multiple Views of a Source,多源视角下的网络八卦时代,"Kian J. Khojastepour, Matin Mortaheb, Sennur Ulukus",https://arxiv.org/pdf/2409.16285.pdf,"Subjects:
Information Theory (cs.IT); Networking and Internet Architecture (cs.NI); Signal Processing (eess.SP); Systems and Control (eess.SY)","Information Theory (cs.IT),  Networking and Internet Architecture (cs.NI),  Signal Processing (eess.SP),  Systems and Control (eess.SY)"
1006,arXiv:2409.16283,Gen2Act: Human Video Generation in Novel Scenarios enables Generalizable Robot Manipulation,Gen2Act：在新场景中生成人类视频，实现机器人操作的通用化,"Homanga Bharadhwaj, Debidatta Dwibedi, Abhinav Gupta, Shubham Tulsiani, Carl Doersch, Ted Xiao, Dhruv Shah, Fei Xia, Dorsa Sadigh, Sean Kirmani",https://arxiv.org/pdf/2409.16283.pdf,"Subjects:
Robotics (cs.RO); Computer Vision and Pattern Recognition (cs.CV); Machine Learning (cs.LG); Image and Video Processing (eess.IV)","Robotics (cs.RO),  Computer Vision and Pattern Recognition (cs.CV),  Machine Learning (cs.LG),  Image and Video Processing (eess.IV)"
1007,arXiv:2409.16280,MonoFormer: One Transformer for Both Diffusion and Autoregression,MonoFormer：一种用于扩散和自回归的变压器,"Chuyang Zhao, Yuxing Song, Wenhao Wang, Haocheng Feng, Errui Ding, Yifan Sun, Xinyan Xiao, Jingdong Wang",https://arxiv.org/pdf/2409.16280.pdf,"Subjects:
Computer Vision and Pattern Recognition (cs.CV)",Computer Vision and Pattern Recognition (cs.CV)
1008,arXiv:2409.16279,On 1-Planar Graphs with Bounded Cop-Number,关于具有有界对数的1-平面图,"Prosenjit Bose, Jean-Lou De Carufel, Anil Maheshwari, Karthik Murali",https://arxiv.org/pdf/2409.16279.pdf,"Subjects:
Discrete Mathematics (cs.DM); Combinatorics (math.CO)","Discrete Mathematics (cs.DM),  Combinatorics (math.CO)"
1009,arXiv:2409.16278,Semantic Refocused Tuning for Open-Vocabulary Panoptic Segmentation,开放词汇泛视切分的语义重聚焦调整,"Yong Xien Chng, Xuchong Qiu, Yizeng Han, Kai Ding, Wan Ding, Gao Huang",https://arxiv.org/pdf/2409.16278.pdf,"Subjects:
Computer Vision and Pattern Recognition (cs.CV)",Computer Vision and Pattern Recognition (cs.CV)
1010,arXiv:2409.16275,Generative Factor Chaining: Coordinated Manipulation with Diffusion-based Factor Graph,生成因子链：基于扩散因子图的协同操作,"Utkarsh A. Mishra, Yongxin Chen, Danfei Xu",https://arxiv.org/pdf/2409.16275.pdf,"Subjects:
Robotics (cs.RO)",Robotics (cs.RO)
1011,arXiv:2409.16271,AIM 2024 Challenge on UHD Blind Photo Quality Assessment,AIM 2024对UHD盲人照片质量评估的挑战,"Vlad Hosu, Marcos V. Conde, Lorenzo Agnolucci, Nabajeet Barman, Saman Zadtootaghaj, Radu Timofte",https://arxiv.org/pdf/2409.16271.pdf,"Subjects:
Computer Vision and Pattern Recognition (cs.CV)",Computer Vision and Pattern Recognition (cs.CV)
1012,arXiv:2409.16269,Bound-preserving OEDG schemes for Aw-Rascle-Zhang traffic models on networks,网络上Aw-Rascle-Chuang流量模型的边界保持OEDG方案,"Wei Chen, Shumo Cui, Kailiang Wu, Tao Xiong",https://arxiv.org/pdf/2409.16269.pdf,"Subjects:
Numerical Analysis (math.NA)",Numerical Analysis (math.NA)
1013,arXiv:2409.16267,Performance Comparison of HTTP/3 and HTTP/2: Proxy vs. Non-Proxy Environments,HTTP/3和HTTP/2的性能比较：代理与非代理环境,"Fan Liu, John Dehart, Jyoti Parwatikar, Behrooz Farkiani, Patrick Crowley",https://arxiv.org/pdf/2409.16267.pdf,"Subjects:
Networking and Internet Architecture (cs.NI)",Networking and Internet Architecture (cs.NI)
1014,arXiv:2409.16266,REBEL: Rule-based and Experience-enhanced Learning with LLMs for Initial Task Allocation in Multi-Human Multi-Robot Teams,REBEL：基于规则和经验增强的学习，用于多人多机器人团队的初始任务分配,"Arjun Gupte, Ruiqi Wang, Vishnunandan L.N. Venkatesh, Taehyeon Kim, Dezhong Zhao, Byung-Cheol Min",https://arxiv.org/pdf/2409.16266.pdf,"Subjects:
Robotics (cs.RO)",Robotics (cs.RO)
1015,arXiv:2409.16262,Extended one-dimensional reduced model for blood flow within a stenotic artery,狭窄动脉内血流的扩展一维简化模型,"Suncica Canic, Shihan Guo, Yifan Wang, Xiaohe Yue, Haibiao Zheng",https://arxiv.org/pdf/2409.16262.pdf,"Subjects:
Numerical Analysis (math.NA)",Numerical Analysis (math.NA)
1016,arXiv:2409.16261,CDChat: A Large Multimodal Model for Remote Sensing Change Description,CDChat：遥感变化描述的大型多模态模型,"Mubashir Noman, Noor Ahsan, Muzammal Naseer, Hisham Cholakkal, Rao Muhammad Anwer, Salman Khan, Fahad Shahbaz Khan",https://arxiv.org/pdf/2409.16261.pdf,"Subjects:
Computer Vision and Pattern Recognition (cs.CV)",Computer Vision and Pattern Recognition (cs.CV)
1017,arXiv:2409.16258,SWARM: Replicating Shared Disaggregated-Memory Data in No Time,SWARM:立即复制共享的分解内存数据,"Antoine Murat, Clément Burgelin, Athanasios Xygkis, Igor Zablotchi, Marcos K. Aguilera, Rachid Guerraoui",https://arxiv.org/pdf/2409.16258.pdf,"Subjects:
Distributed, Parallel, and Cluster Computing (cs.DC)","Distributed, Parallel, and Cluster Computing (cs.DC)"
1018,arXiv:2409.16257,Pressure stability in explicitly coupled simulations of poromechanics with application to CO$_2$ sequestration,孔隙力学显式耦合模拟中的压力稳定性及其在二氧化碳封存中的应用,"Ryan M. Aronson, Pavel Tomin, Nicola Castelletto, François P. Hamon, J. A. White, Hamdi A. Tchelepi",https://arxiv.org/pdf/2409.16257.pdf,"Subjects:
Numerical Analysis (math.NA)",Numerical Analysis (math.NA)
1019,arXiv:2409.16256,A Critical Review of Safe Reinforcement Learning Techniques in Smart Grid Applications,智能电网应用中安全强化学习技术述评,"Van-Hai Bui, Srijita Das, Akhtar Hussain, Guilherme Vieira Hollweg, Wencong Su",https://arxiv.org/pdf/2409.16256.pdf,"Subjects:
Systems and Control (eess.SY)",Systems and Control (eess.SY)
1020,arXiv:2409.16253,Learning To Help: Training Models to Assist Legacy Devices,学习帮助：训练模型以辅助传统设备,"Yu Wu, Anand Sarwate",https://arxiv.org/pdf/2409.16253.pdf,"Subjects:
Machine Learning (cs.LG)",Machine Learning (cs.LG)
1021,arXiv:2409.16252,Fields of The World: A Machine Learning Benchmark Dataset For Global Agricultural Field Boundary Segmentation,世界田地：全球农田边界分割的机器学习基准数据集,"Hannah Kerner, Snehal Chaudhari, Aninda Ghosh, Caleb Robinson, Adeel Ahmad, Eddie Choi, Nathan Jacobs, Chris Holmes, Matthias Mohr, Rahul Dodhia, Juan M. Lavista Ferres, Jennifer Marcus",https://arxiv.org/pdf/2409.16252.pdf,"Subjects:
Computer Vision and Pattern Recognition (cs.CV); Artificial Intelligence (cs.AI); Machine Learning (cs.LG)","Computer Vision and Pattern Recognition (cs.CV),  Artificial Intelligence (cs.AI),  Machine Learning (cs.LG)"
1022,arXiv:2409.16243,A fast and sound tagging method for discontinuous named-entity recognition,一种快速可靠的非连续命名实体识别标记方法,Caio Corro,https://arxiv.org/pdf/2409.16243.pdf,"Subjects:
Computation and Language (cs.CL)",Computation and Language (cs.CL)
1023,arXiv:2409.16241,LLM Echo Chamber: personalized and automated disinformation,LLM回声室：个性化和自动化的虚假信息,Tony Ma,https://arxiv.org/pdf/2409.16241.pdf,"Subjects:
Artificial Intelligence (cs.AI); Computers and Society (cs.CY)","Artificial Intelligence (cs.AI),  Computers and Society (cs.CY)"
1024,arXiv:2409.16239,Label-Augmented Dataset Distillation,标签增强数据集蒸馏,"Seoungyoon Kang, Youngsun Lim, Hyunjung Shim",https://arxiv.org/pdf/2409.16239.pdf,"Subjects:
Computer Vision and Pattern Recognition (cs.CV); Artificial Intelligence (cs.AI)","Computer Vision and Pattern Recognition (cs.CV),  Artificial Intelligence (cs.AI)"
1025,arXiv:2409.16238,Efficiently Learning Probabilistic Logical Models by Cheaply Ranking Mined Rules,利用廉价排序挖掘规则高效学习概率逻辑模型,"Jonathan Feldstein, Dominic Phillips, Efthymia Tsamoura",https://arxiv.org/pdf/2409.16238.pdf,"Subjects:
Artificial Intelligence (cs.AI)",Artificial Intelligence (cs.AI)
1026,arXiv:2409.16235,EuroLLM: Multilingual Language Models for Europe,EuroLLM：欧洲的多语言模型,"Pedro Henrique Martins, Patrick Fernandes, João Alves, Nuno M. Guerreiro, Ricardo Rei, Duarte M. Alves, José Pombal, Amin Farajian, Manuel Faysse, Mateusz Klimaszewski, Pierre Colombo, Barry Haddow, José G. C. de Souza, Alexandra Birch, André F. T. Martins",https://arxiv.org/pdf/2409.16235.pdf,"Subjects:
Computation and Language (cs.CL)",Computation and Language (cs.CL)
1027,arXiv:2409.16231,"Predicting Deterioration in Mild Cognitive Impairment with Survival Transformers, Extreme Gradient Boosting and Cox Proportional Hazard Modelling",使用生存变压器、极端梯度增强和Cox比例风险模型预测轻度认知障碍的恶化,"Henry Musto, Daniel Stamate, Doina Logofatu, Daniel Stahl",https://arxiv.org/pdf/2409.16231.pdf,"Subjects:
Machine Learning (cs.LG); Artificial Intelligence (cs.AI); Neural and Evolutionary Computing (cs.NE)","Machine Learning (cs.LG),  Artificial Intelligence (cs.AI),  Neural and Evolutionary Computing (cs.NE)"
1028,arXiv:2409.16228,Fast Extrinsic Calibration for Multiple Inertial Measurement Units in Visual-Inertial System,视觉惯性系统中多个惯性测量单元的快速外部校准,"Youwei Yu, Yanqing Liu, Fengjie Fu, Sihan He, Dongchen Zhu, Lei Wang, Xiaolin Zhang, Jiamao Li",https://arxiv.org/pdf/2409.16228.pdf,"Subjects:
Robotics (cs.RO)",Robotics (cs.RO)
1029,arXiv:2409.16227,Low-degree Security of the Planted Random Subgraph Problem,种植随机子图问题的低安全性,"Andrej Bogdanov, Chris Jones, Alon Rosen, Ilias Zadik",https://arxiv.org/pdf/2409.16227.pdf,"Subjects:
Cryptography and Security (cs.CR); Data Structures and Algorithms (cs.DS); Statistics Theory (math.ST)","Cryptography and Security (cs.CR),  Data Structures and Algorithms (cs.DS),  Statistics Theory (math.ST)"
1030,arXiv:2409.16225,VideoPatchCore: An Effective Method to Memorize Normality for Video Anomaly Detection,VideoPatchCore：一种有效的视频异常检测记忆正态性的方法,"Sunghyun Ahn, Youngwan Jo, Kijung Lee, Sanghyun Park",https://arxiv.org/pdf/2409.16225.pdf,"Subjects:
Computer Vision and Pattern Recognition (cs.CV)",Computer Vision and Pattern Recognition (cs.CV)
1031,arXiv:2409.16223,"Fine-Tuning is Fine, if Calibrated",如果已校准，微调即为微调,"Zheda Mai, Arpita Chowdhury, Ping Zhang, Cheng-Hao Tu, Hong-You Chen, Vardaan Pahuja, Tanya Berger-Wolf, Song Gao, Charles Stewart, Yu Su, Wei-Lun Chao",https://arxiv.org/pdf/2409.16223.pdf,"Subjects:
Machine Learning (cs.LG); Artificial Intelligence (cs.AI); Computer Vision and Pattern Recognition (cs.CV)","Machine Learning (cs.LG),  Artificial Intelligence (cs.AI),  Computer Vision and Pattern Recognition (cs.CV)"
1032,arXiv:2409.16220,Towards Enhancing Linked Data Retrieval in Conversational UIs using Large Language Models,使用大型语言模型增强会话式UI中的关联数据检索,"Omar Mussa, Omer Rana, Benoît Goossens, Pablo Orozco-Terwengel, Charith Perera",https://arxiv.org/pdf/2409.16220.pdf,"Subjects:
Information Retrieval (cs.IR); Artificial Intelligence (cs.AI); Computation and Language (cs.CL)","Information Retrieval (cs.IR),  Artificial Intelligence (cs.AI),  Computation and Language (cs.CL)"
1033,arXiv:2409.16218,Problem-oriented AutoML in Clustering,聚类中面向问题的AutoML,"Matheus Camilo da Silva, Gabriel Marques Tavares, Eric Medvet, Sylvio Barbon Junior",https://arxiv.org/pdf/2409.16218.pdf,"Subjects:
Machine Learning (cs.LG); Artificial Intelligence (cs.AI)","Machine Learning (cs.LG),  Artificial Intelligence (cs.AI)"
1034,arXiv:2409.16217,Twinning Commercial Network Traces on Experimental Open RAN Platforms,实验性开放RAN平台上的结对商业网络痕迹,"Leonardo Bonati, Ravis Shirkhani, Claudio Fiandrino, Stefano Maxenti, Salvatore D'Oro, Michele Polese, Tommaso Melodia",https://arxiv.org/pdf/2409.16217.pdf,"Subjects:
Networking and Internet Architecture (cs.NI)",Networking and Internet Architecture (cs.NI)
1035,arXiv:2409.16215,Tiny Robotics Dataset and Benchmark for Continual Object Detection,用于连续目标检测的微型机器人数据集和基准,"Francesco Pasti, Riccardo De Monte, Davide Dalle Pezze, Gian Antonio Susto, Nicola Bellotto",https://arxiv.org/pdf/2409.16215.pdf,"Subjects:
Robotics (cs.RO); Computer Vision and Pattern Recognition (cs.CV)","Robotics (cs.RO),  Computer Vision and Pattern Recognition (cs.CV)"
1036,arXiv:2409.16214,TE-PINN: Quaternion-Based Orientation Estimation using Transformer-Enhanced Physics-Informed Neural Networks,TE-PINN：基于变压器增强物理信息神经网络的四元数方向估计,Arman Asgharpoor Golroudbari,https://arxiv.org/pdf/2409.16214.pdf,"Subjects:
Robotics (cs.RO); Signal Processing (eess.SP); Systems and Control (eess.SY)","Robotics (cs.RO),  Signal Processing (eess.SP),  Systems and Control (eess.SY)"
1037,arXiv:2409.16213,Deep Learning for Precision Agriculture: Post-Spraying Evaluation and Deposition Estimation,精准农业的深度学习：喷洒后评估和沉积估算,"Harry Rogers, Tahmina Zebin, Grzegorz Cielniak, Beatriz De La Iglesia, Ben Magri",https://arxiv.org/pdf/2409.16213.pdf,"Subjects:
Computer Vision and Pattern Recognition (cs.CV); Machine Learning (cs.LG)","Computer Vision and Pattern Recognition (cs.CV),  Machine Learning (cs.LG)"
1038,arXiv:2409.16211,MaskBit: Embedding-free Image Generation via Bit Tokens,MaskBit：通过比特令牌嵌入免费图像生成,"Mark Weber, Lijun Yu, Qihang Yu, Xueqing Deng, Xiaohui Shen, Daniel Cremers, Liang-Chieh Chen",https://arxiv.org/pdf/2409.16211.pdf,"Subjects:
Computer Vision and Pattern Recognition (cs.CV); Machine Learning (cs.LG)","Computer Vision and Pattern Recognition (cs.CV),  Machine Learning (cs.LG)"
1039,arXiv:2409.16209,LLMCount: Enhancing Stationary mmWave Detection with Multimodal-LLM,LLMCount：利用多模LLM增强平稳毫米波检测,"Boyan Li, Shengyi Ding, Deen Ma, Yixuan Wu, Hongjie Liao, Kaiyuan Hu",https://arxiv.org/pdf/2409.16209.pdf,"Subjects:
Computer Vision and Pattern Recognition (cs.CV)",Computer Vision and Pattern Recognition (cs.CV)
1040,arXiv:2409.16208,Context-Based Meta Reinforcement Learning for Robust and Adaptable Peg-in-Hole Assembly Tasks,基于上下文的元强化学习用于鲁棒和适应性的钻孔装配任务,"Ahmed Shokry, Walid Gomaa, Tobias Zaenker, Murad Dawood, Shady A. Maged, Mohammed I. Awad, Maren Bennewitz",https://arxiv.org/pdf/2409.16208.pdf,"Subjects:
Robotics (cs.RO)",Robotics (cs.RO)
1041,arXiv:2409.16205,"Segmentation Strategies in Deep Learning for Prostate Cancer Diagnosis: A Comparative Study of Mamba, SAM, and YOLO",深度学习用于前列腺癌症诊断的分割策略：Mamba、SAM和YOLO的比较研究,"Ali Badiezadeh, Amin Malekmohammadi, Seyed Mostafa Mirhassani, Parisa Gifani, Majid Vafaeezadeh",https://arxiv.org/pdf/2409.16205.pdf,"Subjects:
Computer Vision and Pattern Recognition (cs.CV)",Computer Vision and Pattern Recognition (cs.CV)
1042,arXiv:2409.16203,Facial Expression-Enhanced TTS: Combining Face Representation and Emotion Intensity for Adaptive Speech,面部表情增强TTS：结合面部表情和情绪强度进行自适应语音,"Yunji Chu, Yunseob Shim, Unsang Park",https://arxiv.org/pdf/2409.16203.pdf,"Subjects:
Sound (cs.SD); Artificial Intelligence (cs.AI); Audio and Speech Processing (eess.AS)","Sound (cs.SD),  Artificial Intelligence (cs.AI),  Audio and Speech Processing (eess.AS)"
1043,arXiv:2409.16202,CJEval: A Benchmark for Assessing Large Language Models Using Chinese Junior High School Exam Data,CJEval：使用中国初中考试数据评估大型语言模型的基准,"Qian-Wen Zhang, Haochen Wang, Fang Li, Siyu An, Lingfeng Qiao, Liangcai Gao, Di Yin, Xing Sun",https://arxiv.org/pdf/2409.16202.pdf,"Subjects:
Artificial Intelligence (cs.AI)",Artificial Intelligence (cs.AI)
1044,arXiv:2409.16198,Leveraging Estimated Transferability Over Human Intuition for Model Selection in Text Ranking,利用人类直觉的估计可转移性进行文本排名中的模型选择,"Jun Bai, Zhuofan Chen, Zhenzi Li, Hanhua Hong, Jianfei Zhang, Chen Li, Chenghua Lin, Wenge Rong",https://arxiv.org/pdf/2409.16198.pdf,"Subjects:
Artificial Intelligence (cs.AI)",Artificial Intelligence (cs.AI)
1045,arXiv:2409.16197,Second Order Bounds for Contextual Bandits with Function Approximation,函数逼近下上下文土匪的二阶边界,Aldo Pacchiano,https://arxiv.org/pdf/2409.16197.pdf,"Subjects:
Machine Learning (cs.LG); Artificial Intelligence (cs.AI); Machine Learning (stat.ML)","Machine Learning (cs.LG),  Artificial Intelligence (cs.AI),  Machine Learning (stat.ML)"
1046,arXiv:2409.16195,On the tractability and approximability of non-submodular cardinality-based $s$-$t$ cut problems in hypergraphs,超图中基于非子模基数的$s$-$t$割问题的可处理性和近似性,"Vedangi Bengali, Nate Veldt",https://arxiv.org/pdf/2409.16195.pdf,"Subjects:
Data Structures and Algorithms (cs.DS); Computational Complexity (cs.CC); Discrete Mathematics (cs.DM)","Data Structures and Algorithms (cs.DS),  Computational Complexity (cs.CC),  Discrete Mathematics (cs.DM)"
1047,arXiv:2409.16191,HelloBench: Evaluating Long Text Generation Capabilities of Large Language Models,HelloBench：评估大型语言模型的长文本生成能力,"Haoran Que, Feiyu Duan, Liqun He, Yutao Mou, Wangchunshu Zhou, Jiaheng Liu, Wenge Rong, Zekun Moore Wang, Jian Yang, Ge Zhang, Junran Peng, Zhaoxiang Zhang, Songyang Zhang, Kai Chen",https://arxiv.org/pdf/2409.16191.pdf,"Subjects:
Computation and Language (cs.CL)",Computation and Language (cs.CL)
1048,arXiv:2409.16190,A Universal Multi-Vehicle Cooperative Decision-Making Approach in Structured Roads by Mixed-Integer Potential Game,基于混合整数势博弈的结构化道路通用多车协同决策方法,"Chengzhen Meng, Zhenmin Huang, Jun Ma",https://arxiv.org/pdf/2409.16190.pdf,"Subjects:
Robotics (cs.RO)",Robotics (cs.RO)
1049,arXiv:2409.16186,System-Level Performance Metrics Sensitivity of an Electrified Heavy-Duty Mobile Manipulator,电动重型移动机械手的系统级性能指标灵敏度,"Mohammad Bahari, Alvaro Paz, Jouni Mattila",https://arxiv.org/pdf/2409.16186.pdf,"Subjects:
Systems and Control (eess.SY)",Systems and Control (eess.SY)
1050,arXiv:2409.16185,Refactoring-aware Block Tracking in Commit History,提交历史中的重构感知块跟踪,"Mohammed Tayeeb Hasan, Nikolaos Tsantalis, Pouria Alikhanifard",https://arxiv.org/pdf/2409.16185.pdf,"Subjects:
Software Engineering (cs.SE)",Software Engineering (cs.SE)
1051,arXiv:2409.16183,Expert-level vision-language foundation model for real-world radiology and comprehensive evaluation,用于真实放射学和综合评估的专家级视觉语言基础模型,"Xiaohong Liu, Guoxing Yang, Yulin Luo, Jiaji Mao, Xiang Zhang, Ming Gao, Shanghang Zhang, Jun Shen, Guangyu Wang",https://arxiv.org/pdf/2409.16183.pdf,"Subjects:
Computer Vision and Pattern Recognition (cs.CV)",Computer Vision and Pattern Recognition (cs.CV)
1052,arXiv:2409.16182,TiM4Rec: An Efficient Sequential Recommendation Model Based on Time-Aware Structured State Space Duality Model,TiM4Rec：一种基于时间感知结构状态空间对偶模型的高效序贯推荐模型,"Hao Fan, Mengyi Zhu, Yanrong Hu, Hailin Feng, Zhijie He, Hongjiu Liu, Qingyang Liu",https://arxiv.org/pdf/2409.16182.pdf,"Subjects:
Information Retrieval (cs.IR)",Information Retrieval (cs.IR)
1053,arXiv:2409.16181,SPIBOT: A Drone-Tethered Mobile Gripper for Robust Aerial Object Retrieval in Dynamic Environments,SPIBOT：一种用于动态环境中稳健空中目标检索的无人机系留移动抓取器,"Gyuree Kang, Ozan Güneş, Seungwook Lee, Maulana Bisyir Azhari, David Hyunchul Shim",https://arxiv.org/pdf/2409.16181.pdf,"Subjects:
Robotics (cs.RO)",Robotics (cs.RO)
1054,arXiv:2409.16178,SDFit: 3D Object Pose and Shape by Fitting a Morphable SDF to a Single Image,SDFit：通过将可变形SDF拟合到单个图像来实现3D对象姿势和形状,"Dimitrije Antić, Sai Kumar Dwivedi, Shashank Tripathi, Theo Gevers, Dimitrios Tzionas",https://arxiv.org/pdf/2409.16178.pdf,"Subjects:
Computer Vision and Pattern Recognition (cs.CV)",Computer Vision and Pattern Recognition (cs.CV)
1055,arXiv:2409.16176,Cyber Knowledge Completion Using Large Language Models,使用大型语言模型完成网络知识,"Braden K Webb, Sumit Purohit, Rounak Meyur",https://arxiv.org/pdf/2409.16176.pdf,"Subjects:
Cryptography and Security (cs.CR); Artificial Intelligence (cs.AI)","Cryptography and Security (cs.CR),  Artificial Intelligence (cs.AI)"
