Unnamed: 0,id,title,title_zh,authors,url,subjects,subject_split
1500,arXiv:2409.15977,TCSinger: Zero-Shot Singing Voice Synthesis with Style Transfer and Multi-Level Style Control,TCSinger：具有风格转移和多层次风格控制的零样本歌声合成,"Yu Zhang, Ziyue Jiang, Ruiqi Li, Changhao Pan, Jinzheng He, Rongjie Huang, Chuxin Wang, Zhou Zhao",https://arxiv.org/pdf/2409.15977.pdf,"Subjects:
Audio and Speech Processing (eess.AS); Computation and Language (cs.CL); Sound (cs.SD)","Audio and Speech Processing (eess.AS),  Computation and Language (cs.CL),  Sound (cs.SD)"
1501,arXiv:2409.15937,Numerical determination of the width and shape of the effective string using Stochastic Normalizing Flows,利用随机归一化流数值确定有效弦的宽度和形状,"Michele Caselle, Elia Cellini, Alessandro Nada",https://arxiv.org/pdf/2409.15937.pdf,"Subjects:
High Energy Physics - Lattice (hep-lat); Machine Learning (cs.LG); High Energy Physics - Theory (hep-th)","High Energy Physics - Lattice (hep-lat),  Machine Learning (cs.LG),  High Energy Physics - Theory (hep-th)"
1502,arXiv:2409.15925,Identifying early tumour states in a Cahn-Hilliard-reaction-diffusion model,在Cahn-Hilliard反应扩散模型中识别早期肿瘤状态,"Abramo Agosti, Elena Beretta, Cecilia Cavaterra, Matteo Fornoni, Elisabetta Rocca",https://arxiv.org/pdf/2409.15925.pdf,"Subjects:
Analysis of PDEs (math.AP); Numerical Analysis (math.NA); Optimization and Control (math.OC)","Analysis of PDEs (math.AP),  Numerical Analysis (math.NA),  Optimization and Control (math.OC)"
1503,arXiv:2409.15916,Deep convolutional framelets for dose reconstruction in BNCT with Compton camera detector,用于康普顿相机探测器BNCT剂量重建的深卷积小帧,"Angelo Didonna, Dayron Ramos Lopez, Giuseppe Iaselli, Nicola Amoroso, Nicola Ferrara, Gabriella Maria Incoronata Pugliese",https://arxiv.org/pdf/2409.15916.pdf,"Subjects:
Medical Physics (physics.med-ph); Machine Learning (cs.LG)","Medical Physics (physics.med-ph),  Machine Learning (cs.LG)"
1504,arXiv:2409.15897,"ESPnet-Codec: Comprehensive Training and Evaluation of Neural Codecs for Audio, Music, and Speech",ESPnet编解码器：音频、音乐和语音神经编解码器的综合训练和评估,"Jiatong Shi, Jinchuan Tian, Yihan Wu, Jee-weon Jung, Jia Qi Yip, Yoshiki Masuyama, William Chen, Yuning Wu, Yuxun Tang, Massa Baali, Dareen Alharhi, Dong Zhang, Ruifan Deng, Tejes Srivastava, Haibin Wu, Alexander H. Liu, Bhiksha Raj, Qin Jin, Ruihua Song, Shinji Watanabe",https://arxiv.org/pdf/2409.15897.pdf,"Subjects:
Audio and Speech Processing (eess.AS); Sound (cs.SD)","Audio and Speech Processing (eess.AS),  Sound (cs.SD)"
1505,arXiv:2409.15888,Investigating Gender Bias in Lymph-node Segmentation with Anatomical Priors,利用解剖学先验研究淋巴结分割中的性别偏见,"Ricardo Coimbra Brioso, Damiano Dei, Nicola Lambri, Pietro Mancosu, Marta Scorsetti, Daniele Loiacono",https://arxiv.org/pdf/2409.15888.pdf,"Subjects:
Image and Video Processing (eess.IV); Computer Vision and Pattern Recognition (cs.CV)","Image and Video Processing (eess.IV),  Computer Vision and Pattern Recognition (cs.CV)"
1506,arXiv:2409.15884,Interpolation filter design for sample rate independent audio effect RNNs,采样率无关音频效果RNN的插值滤波器设计,"Alistair Carson, Alec Wright, Stefan Bilbao",https://arxiv.org/pdf/2409.15884.pdf,"Subjects:
Audio and Speech Processing (eess.AS); Sound (cs.SD); Signal Processing (eess.SP)","Audio and Speech Processing (eess.AS),  Sound (cs.SD),  Signal Processing (eess.SP)"
1507,arXiv:2409.15883,Unsupervised dMRI Artifact Detection via Angular Resolution Enhancement and Cycle Consistency Learning,通过角分辨率增强和循环一致性学习进行无监督dMRI伪影检测,"Sheng Chen, Zihao Tang, Xinyi Wang, Chenyu Wang, Weidong Cai",https://arxiv.org/pdf/2409.15883.pdf,"Subjects:
Image and Video Processing (eess.IV); Computer Vision and Pattern Recognition (cs.CV)","Image and Video Processing (eess.IV),  Computer Vision and Pattern Recognition (cs.CV)"
1508,arXiv:2409.15869,Whisper in Medusa's Ear: Multi-head Efficient Decoding for Transformer-based ASR,美杜莎耳边的低语：基于变压器的ASR的多头高效解码,"Yael Segal-Feldman, Aviv Shamsian, Aviv Navon, Gill Hetz, Joseph Keshet",https://arxiv.org/pdf/2409.15869.pdf,"Subjects:
Audio and Speech Processing (eess.AS); Artificial Intelligence (cs.AI); Machine Learning (cs.LG); Sound (cs.SD)","Audio and Speech Processing (eess.AS),  Artificial Intelligence (cs.AI),  Machine Learning (cs.LG),  Sound (cs.SD)"
1509,arXiv:2409.15844,Adaptive Learn-then-Test: Statistically Valid and Efficient Hyperparameter Selection,自适应学习然后测试：统计有效和高效的超参数选择,"Matteo Zecchin, Osvaldo Simeone",https://arxiv.org/pdf/2409.15844.pdf,"Subjects:
Machine Learning (stat.ML); Artificial Intelligence (cs.AI); Information Theory (cs.IT); Machine Learning (cs.LG); Methodology (stat.ME)","Machine Learning (stat.ML),  Artificial Intelligence (cs.AI),  Information Theory (cs.IT),  Machine Learning (cs.LG),  Methodology (stat.ME)"
1510,arXiv:2409.15799,WeSep: A Scalable and Flexible Toolkit Towards Generalizable Target Speaker Extraction,WeSep：一个可扩展且灵活的工具包，旨在实现可泛化的目标说话者提取,"Shuai Wang, Ke Zhang, Shaoxiong Lin, Junjie Li, Xuefei Wang, Meng Ge, Jianwei Yu, Yanmin Qian, Haizhou Li",https://arxiv.org/pdf/2409.15799.pdf,"Subjects:
Audio and Speech Processing (eess.AS); Sound (cs.SD)","Audio and Speech Processing (eess.AS),  Sound (cs.SD)"
1511,arXiv:2409.15798,Positioning Error Compensation by Channel Knowledge Map in UAV Communication Missions,无人机通信任务中基于信道知识图的定位误差补偿,"Chiya Zhang, Ting Wang, Chunlong He",https://arxiv.org/pdf/2409.15798.pdf,"Subjects:
Signal Processing (eess.SP); Networking and Internet Architecture (cs.NI)","Signal Processing (eess.SP),  Networking and Internet Architecture (cs.NI)"
1512,arXiv:2409.15784,Deep-learning real-time phase retrieval of imperfect diffraction patterns from X-ray free-electron lasers,X射线自由电子激光器不完美衍射图案的深度学习实时相位恢复,"Sung Yun Lee, Do Hyung Cho, Chulho Jung, Daeho Sung, Daewoong Nam, Sangsoo Kim, Changyong Song",https://arxiv.org/pdf/2409.15784.pdf,"Subjects:
Applied Physics (physics.app-ph); Materials Science (cond-mat.mtrl-sci); Machine Learning (cs.LG); Optics (physics.optics)","Applied Physics (physics.app-ph),  Materials Science (cond-mat.mtrl-sci),  Machine Learning (cs.LG),  Optics (physics.optics)"
1513,arXiv:2409.15782,M-Vec: Matryoshka Speaker Embeddings with Flexible Dimensions,M-Vec：具有灵活尺寸的Matryoshka扬声器嵌入件,"Shuai Wang, Pengcheng Zhu, Haizhou Li",https://arxiv.org/pdf/2409.15782.pdf,"Subjects:
Audio and Speech Processing (eess.AS); Sound (cs.SD)","Audio and Speech Processing (eess.AS),  Sound (cs.SD)"
1514,arXiv:2409.15767,Representation Loss Minimization with Randomized Selection Strategy for Efficient Environmental Fake Audio Detection,利用随机选择策略最小化表示损失，实现高效的环境假音频检测,"Orchid Chetia Phukan, Girish, Mohd Mujtaba Akhtar, Swarup Ranjan Behera, Nitin Choudhury, Arun Balaji Buduru, Rajesh Sharma, S.R Mahadeva Prasanna",https://arxiv.org/pdf/2409.15767.pdf,"Subjects:
Audio and Speech Processing (eess.AS); Sound (cs.SD)","Audio and Speech Processing (eess.AS),  Sound (cs.SD)"
1515,arXiv:2409.15765,User-Centric Cell-Free Massive MIMO With RIS-Integrated Antenna Arrays,以用户为中心的无蜂窝大规模MIMO与RIS集成天线阵列,"Özlem Tuğfe Demir, Emil Björnson",https://arxiv.org/pdf/2409.15765.pdf,"Subjects:
Signal Processing (eess.SP); Information Theory (cs.IT)","Signal Processing (eess.SP),  Information Theory (cs.IT)"
1516,arXiv:2409.15745,ManiNeg: Manifestation-guided Multimodal Pretraining for Mammography Classification,ManiNeg：基于表现引导的多模式乳腺X线分类预训练,"Xujun Li, Xin Wei, Jing Jiang, Danxiang Chen, Wei Zhang, Jinpeng Li",https://arxiv.org/pdf/2409.15745.pdf,"Subjects:
Image and Video Processing (eess.IV); Computer Vision and Pattern Recognition (cs.CV)","Image and Video Processing (eess.IV),  Computer Vision and Pattern Recognition (cs.CV)"
1517,arXiv:2409.15744,ViKL: A Mammography Interpretation Framework via Multimodal Aggregation of Visual-knowledge-linguistic Features,ViKL：一个通过视觉知识语言特征的多模态聚合的乳腺X线解读框架,"Xin Wei, Yaling Tao, Changde Du, Gangming Zhao, Yizhou Yu, Jinpeng Li",https://arxiv.org/pdf/2409.15744.pdf,"Subjects:
Image and Video Processing (eess.IV); Computer Vision and Pattern Recognition (cs.CV)","Image and Video Processing (eess.IV),  Computer Vision and Pattern Recognition (cs.CV)"
1518,arXiv:2409.15742,Enhancing Open-Set Speaker Identification through Rapid Tuning with Speaker Reciprocal Points and Negative Sample,通过扬声器互易点和负采样的快速调谐来增强开集扬声器识别,"Zhiyong Chen, Zhiqi Ai, Xinnuo Li, Shugong Xu",https://arxiv.org/pdf/2409.15742.pdf,"Subjects:
Audio and Speech Processing (eess.AS); Sound (cs.SD)","Audio and Speech Processing (eess.AS),  Sound (cs.SD)"
1519,arXiv:2409.15741,StyleFusion TTS: Multimodal Style-control and Enhanced Feature Fusion for Zero-shot Text-to-speech Synthesis,StyleFusion TTS：用于零样本文本到速度合成的多模式样式控制和增强的特征融合,"Zhiyong Chen, Xinnuo Li, Zhiqi Ai, Shugong Xu",https://arxiv.org/pdf/2409.15741.pdf,"Subjects:
Audio and Speech Processing (eess.AS); Sound (cs.SD)","Audio and Speech Processing (eess.AS),  Sound (cs.SD)"
1520,arXiv:2409.15734,Trust-Region Sequential Quadratic Programming for Stochastic Optimization with Random Models,随机模型随机优化的信赖域序列二次规划,"Yuchen Fang, Sen Na, Michael W. Mahoney, Mladen Kolar",https://arxiv.org/pdf/2409.15734.pdf,"Subjects:
Optimization and Control (math.OC); Machine Learning (cs.LG); Numerical Analysis (math.NA); Computation (stat.CO); Machine Learning (stat.ML)","Optimization and Control (math.OC),  Machine Learning (cs.LG),  Numerical Analysis (math.NA),  Computation (stat.CO),  Machine Learning (stat.ML)"
1521,arXiv:2409.15720,Optimization of partially isolated quantum harmonic oscillator memory systems by mean square decoherence time criteria,基于均方退相干时间准则优化部分隔离量子谐振子存储系统,"Igor G. Vladimirov, Ian R. Petersen",https://arxiv.org/pdf/2409.15720.pdf,"Subjects:
Quantum Physics (quant-ph); Systems and Control (eess.SY); Optimization and Control (math.OC)","Quantum Physics (quant-ph),  Systems and Control (eess.SY),  Optimization and Control (math.OC)"
1522,arXiv:2409.15697,dnaGrinder: a lightweight and high-capacity genomic foundation model,dnaGrinder：一种轻量级、高容量的基因组基础模型,"Qihang Zhao, Chi Zhang, Weixiong Zhang",https://arxiv.org/pdf/2409.15697.pdf,"Subjects:
Genomics (q-bio.GN); Artificial Intelligence (cs.AI); Computational Engineering, Finance, and Science (cs.CE); Computation and Language (cs.CL)","Genomics (q-bio.GN),  Artificial Intelligence (cs.AI),  Computational Engineering, Finance, and Science (cs.CE),  Computation and Language (cs.CL)"
1523,arXiv:2409.15675,Northeast Materials Database (NEMAD): Enabling Discovery of High Transition Temperature Magnetic Compounds,东北材料数据库（NEMAD）：发现高转变温度磁性化合物,"Suman Itani, Yibo Zhang, Jiadong Zang",https://arxiv.org/pdf/2409.15675.pdf,"Subjects:
Materials Science (cond-mat.mtrl-sci); Machine Learning (cs.LG); Computational Physics (physics.comp-ph)","Materials Science (cond-mat.mtrl-sci),  Machine Learning (cs.LG),  Computational Physics (physics.comp-ph)"
1524,arXiv:2409.15672,Language-based Audio Moment Retrieval,基于语言的音频矩检索,"Hokuto Munakata, Taichi Nishimura, Shota Nakada, Tatsuya Komatsu",https://arxiv.org/pdf/2409.15672.pdf,"Subjects:
Audio and Speech Processing (eess.AS); Computation and Language (cs.CL); Sound (cs.SD)","Audio and Speech Processing (eess.AS),  Computation and Language (cs.CL),  Sound (cs.SD)"
1525,arXiv:2409.15623,Safe Guard: an LLM-agent for Real-time Voice-based Hate Speech Detection in Social Virtual Reality,Safe Guard:一种用于社交虚拟现实中基于语音的实时仇恨语音检测的LLM代理,"Yiwen Xu, Qinyang Hou, Hongyu Wan, Mirjana Prpa",https://arxiv.org/pdf/2409.15623.pdf,"Subjects:
Audio and Speech Processing (eess.AS); Artificial Intelligence (cs.AI); Sound (cs.SD)","Audio and Speech Processing (eess.AS),  Artificial Intelligence (cs.AI),  Sound (cs.SD)"
1526,arXiv:2409.15603,A revisit on well-posedness of a boundary value problem of a stationary advection equation without the separation condition,对无分离条件的平稳平流方程边值问题适定性的再探讨,"Masaki Imagawa, Daisuke Kawagoe",https://arxiv.org/pdf/2409.15603.pdf,"Subjects:
Analysis of PDEs (math.AP); Numerical Analysis (math.NA)","Analysis of PDEs (math.AP),  Numerical Analysis (math.NA)"
1527,arXiv:2409.15586,TFT-multi: simultaneous forecasting of vital sign trajectories in the ICU,TFT multi：ICU生命体征轨迹的同步预测,"Rosemary Y. He, Jeffrey N. Chiang",https://arxiv.org/pdf/2409.15586.pdf,"Subjects:
Signal Processing (eess.SP); Artificial Intelligence (cs.AI)","Signal Processing (eess.SP),  Artificial Intelligence (cs.AI)"
1528,arXiv:2409.15582,Generalization vs. Specialization under Concept Shift,概念转换下的泛化与专业化,"Alex Nguyen, David J. Schwab, Vudtiwat Ngampruetikorn",https://arxiv.org/pdf/2409.15582.pdf,"Subjects:
Machine Learning (stat.ML); Machine Learning (cs.LG)","Machine Learning (stat.ML),  Machine Learning (cs.LG)"
1529,arXiv:2409.15559,LDPC Codes in Cooperative Communication,协作通信中的LDPC码,Ali Mehrban,https://arxiv.org/pdf/2409.15559.pdf,"Subjects:
Signal Processing (eess.SP); Systems and Control (eess.SY)","Signal Processing (eess.SP),  Systems and Control (eess.SY)"
1530,arXiv:2409.15552,Time-Adaptive PIROCK Method with Error Control for Multi-Fluid and Single-Fluid MHD Systems,多流体和单流体MHD系统误差控制的时间自适应PIROCK方法,"Q. M. Wargnier, G. Vilmart, J. Martínez-Sykora, V. H. Hansteen, B. De Pontieu",https://arxiv.org/pdf/2409.15552.pdf,"Subjects:
Solar and Stellar Astrophysics (astro-ph.SR); Numerical Analysis (math.NA)","Solar and Stellar Astrophysics (astro-ph.SR),  Numerical Analysis (math.NA)"
1531,arXiv:2409.15551,"Revise, Reason, and Recognize: LLM-Based Emotion Recognition via Emotion-Specific Prompts and ASR Error Correction",修正、推理和识别：基于LLM的情绪识别，通过情绪特定提示和ASR纠错,"Yuanchao Li, Yuan Gong, Chao-Han Huck Yang, Peter Bell, Catherine Lai",https://arxiv.org/pdf/2409.15551.pdf,"Subjects:
Audio and Speech Processing (eess.AS); Artificial Intelligence (cs.AI); Computation and Language (cs.CL); Multimedia (cs.MM); Sound (cs.SD)","Audio and Speech Processing (eess.AS),  Artificial Intelligence (cs.AI),  Computation and Language (cs.CL),  Multimedia (cs.MM),  Sound (cs.SD)"
1532,arXiv:2409.15548,Nothing Conformal about Adaptive Conformal Inference,自适应共形推理没有任何共形性,Johan Hallberg Szabadváry,https://arxiv.org/pdf/2409.15548.pdf,"Subjects:
Machine Learning (stat.ML); Machine Learning (cs.LG)","Machine Learning (stat.ML),  Machine Learning (cs.LG)"
1533,arXiv:2409.15546,A Novel Framework for the Automated Characterization of Gram-Stained Blood Culture Slides Using a Large-Scale Vision Transformer,一种使用大规模视觉变换器自动表征革兰氏染色血培养载玻片的新框架,"Jack McMahon, Naofumi Tomita, Elizabeth S. Tatishev, Adrienne A. Workman, Cristina R Costales, Niaz Banaei, Isabella W. Martin, Saeed Hassanpour",https://arxiv.org/pdf/2409.15546.pdf,"Subjects:
Image and Video Processing (eess.IV); Computer Vision and Pattern Recognition (cs.CV)","Image and Video Processing (eess.IV),  Computer Vision and Pattern Recognition (cs.CV)"
1534,arXiv:2409.15545,Rethinking Emotion Bias in Music via Frechet Audio Distance,通过Frechet音频距离重新思考音乐中的情感偏见,"Yuanchao Li, Azalea Gui, Dimitra Emmanouilidou, Hannes Gamper",https://arxiv.org/pdf/2409.15545.pdf,"Subjects:
Audio and Speech Processing (eess.AS); Computation and Language (cs.CL); Multimedia (cs.MM); Sound (cs.SD)","Audio and Speech Processing (eess.AS),  Computation and Language (cs.CL),  Multimedia (cs.MM),  Sound (cs.SD)"
1535,arXiv:2409.15537,Quasi-Monte Carlo integration for feedback control under uncertainty,不确定条件下反馈控制的准蒙特卡罗积分,"Philipp A. Guth, Peter Kritzer, Karl Kunisch",https://arxiv.org/pdf/2409.15537.pdf,"Subjects:
Optimization and Control (math.OC); Numerical Analysis (math.NA)","Optimization and Control (math.OC),  Numerical Analysis (math.NA)"
1536,arXiv:2409.15525,Speech2rtMRI: Speech-Guided Diffusion Model for Real-time MRI Video of the Vocal Tract during Speech,Speech2rtMRI：语音引导下声道实时MRI视频的扩散模型,"Hong Nguyen, Sean Foley, Kevin Huang, Xuan Shi, Tiantian Feng, Shrikanth Narayanan",https://arxiv.org/pdf/2409.15525.pdf,"Subjects:
Image and Video Processing (eess.IV); Computer Vision and Pattern Recognition (cs.CV); Sound (cs.SD); Audio and Speech Processing (eess.AS)","Image and Video Processing (eess.IV),  Computer Vision and Pattern Recognition (cs.CV),  Sound (cs.SD),  Audio and Speech Processing (eess.AS)"
1537,arXiv:2409.15511,Bayesian computation with generative diffusion models by Multilevel Monte Carlo,基于多层蒙特卡罗生成扩散模型的贝叶斯计算,"Abdul-Lateef Haji-Ali, Marcelo Pereyra, Luke Shaw, Konstantinos Zygalakis",https://arxiv.org/pdf/2409.15511.pdf,"Subjects:
Computation (stat.CO); Computer Vision and Pattern Recognition (cs.CV); Machine Learning (cs.LG)","Computation (stat.CO),  Computer Vision and Pattern Recognition (cs.CV),  Machine Learning (cs.LG)"
1538,arXiv:2409.15501,Adenocarcinoma Segmentation Using Pre-trained Swin-UNet with Parallel Cross-Attention for Multi-Domain Imaging,使用预训练的Swin-UNet并行交叉注意进行多域成像的腺癌分割,"Abdul Qayyum, Moona Mazher Imran Razzak, Steven A Niederer",https://arxiv.org/pdf/2409.15501.pdf,"Subjects:
Image and Video Processing (eess.IV); Computer Vision and Pattern Recognition (cs.CV)","Image and Video Processing (eess.IV),  Computer Vision and Pattern Recognition (cs.CV)"
1539,arXiv:2409.15500,Sticky coupling as a control variate for sensitivity analysis,粘性耦合作为灵敏度分析的控制变量,"Shiva Darshan, Andreas Eberle, Gabriel Stoltz",https://arxiv.org/pdf/2409.15500.pdf,"Subjects:
Probability (math.PR); Numerical Analysis (math.NA); Statistics Theory (math.ST); Computation (stat.CO)","Probability (math.PR),  Numerical Analysis (math.NA),  Statistics Theory (math.ST),  Computation (stat.CO)"
1540,arXiv:2409.15491,Computational Pathology for Accurate Prediction of Breast Cancer Recurrence: Development and Validation of a Deep Learning-based Tool,精确预测癌症复发的计算病理学：基于深度学习的工具的开发和验证,"Ziyu Su, Yongxin Guo, Robert Wesolowski, Gary Tozbikian, Nathaniel S. O'Connell, M. Khalid Khan Niazi, Metin N. Gurcan",https://arxiv.org/pdf/2409.15491.pdf,"Subjects:
Image and Video Processing (eess.IV); Artificial Intelligence (cs.AI); Quantitative Methods (q-bio.QM)","Image and Video Processing (eess.IV),  Artificial Intelligence (cs.AI),  Quantitative Methods (q-bio.QM)"
1541,arXiv:2409.15484,Blind Localization of Early Room Reflections with Arbitrary Microphone Array,任意麦克风阵列对早期房间反射的盲定位,"Yogev Hadadi, Vladimir Tourbabin, Zamir Ben-Hur, David Lou Alon, Boaz Rafaely",https://arxiv.org/pdf/2409.15484.pdf,"Subjects:
Audio and Speech Processing (eess.AS); Sound (cs.SD)","Audio and Speech Processing (eess.AS),  Sound (cs.SD)"
1542,arXiv:2409.15459,Position-building in competition with real-world constraints,在与现实世界的竞争中建立地位,Neil A. Chriss,https://arxiv.org/pdf/2409.15459.pdf,"Subjects:
Trading and Market Microstructure (q-fin.TR); Computer Science and Game Theory (cs.GT)","Trading and Market Microstructure (q-fin.TR),  Computer Science and Game Theory (cs.GT)"
1543,arXiv:2409.15448,Optimization-based Verification of Discrete-time Control Barrier Functions: A Branch-and-Bound Approach,离散时间控制屏障函数的优化验证：分支定界方法,"Erfan Shakhesi, W.P.M.H. Heemels, Alexander Katriniok",https://arxiv.org/pdf/2409.15448.pdf,"Subjects:
Optimization and Control (math.OC); Systems and Control (eess.SY)","Optimization and Control (math.OC),  Systems and Control (eess.SY)"
1544,arXiv:2409.15397,The ParlaSpeech Collection of Automatically Generated Speech and Text Datasets from Parliamentary Proceedings,ParlaSpeech从议会程序中自动生成的语音和文本数据集集合,"Nikola Ljubešić, Peter Rupnik, Danijel Koržinek",https://arxiv.org/pdf/2409.15397.pdf,"Subjects:
Audio and Speech Processing (eess.AS); Computation and Language (cs.CL); Machine Learning (cs.LG); Sound (cs.SD)","Audio and Speech Processing (eess.AS),  Computation and Language (cs.CL),  Machine Learning (cs.LG),  Sound (cs.SD)"
1545,arXiv:2409.15388,Two hardness results for the maximum 2-edge-colorable subgraph problem in bipartite graphs,二分图中最大2边可着色子图问题的两个硬度结果,Vahan Mkrtchyan,https://arxiv.org/pdf/2409.15388.pdf,"Subjects:
Combinatorics (math.CO); Discrete Mathematics (cs.DM)","Combinatorics (math.CO),  Discrete Mathematics (cs.DM)"
1546,arXiv:2409.15384,BurstM: Deep Burst Multi-scale SR using Fourier Space with Optical Flow,BurstM：使用傅里叶空间和光流的深突发多尺度SR,"EungGu Kang, Byeonghun Lee, Sunghoon Im, Kyong Hwan Jin",https://arxiv.org/pdf/2409.15384.pdf,"Subjects:
Image and Video Processing (eess.IV); Computer Vision and Pattern Recognition (cs.CV); Machine Learning (cs.LG)","Image and Video Processing (eess.IV),  Computer Vision and Pattern Recognition (cs.CV),  Machine Learning (cs.LG)"
1547,arXiv:2409.15378,Toward Automated Clinical Transcriptions,迈向自动化临床转录,"Mitchell A. Klusty, W. Vaiden Logan, Samuel E. Armstrong, Aaron D. Mullen, Caroline N. Leach, Jeff Talbert, V. K. Cody Bumgardner",https://arxiv.org/pdf/2409.15378.pdf,"Subjects:
Audio and Speech Processing (eess.AS); Artificial Intelligence (cs.AI); Computation and Language (cs.CL); Sound (cs.SD)","Audio and Speech Processing (eess.AS),  Artificial Intelligence (cs.AI),  Computation and Language (cs.CL),  Sound (cs.SD)"
1548,arXiv:2409.15374,Explainable AI for Autism Diagnosis: Identifying Critical Brain Regions Using fMRI Data,自闭症诊断的可解释人工智能：使用fMRI数据识别关键脑区,"Suryansh Vidya, Kush Gupta, Amir Aly, Andy Wills, Emmanuel Ifeachor, Rohit Shankar",https://arxiv.org/pdf/2409.15374.pdf,"Subjects:
Image and Video Processing (eess.IV); Artificial Intelligence (cs.AI); Computer Vision and Pattern Recognition (cs.CV); Machine Learning (cs.LG)","Image and Video Processing (eess.IV),  Artificial Intelligence (cs.AI),  Computer Vision and Pattern Recognition (cs.CV),  Machine Learning (cs.LG)"
1549,arXiv:2409.15357,A Joint Spectro-Temporal Relational Thinking Based Acoustic Modeling Framework,基于联合光谱-时间关系思维的声学建模框架,"Zheng Nan, Ting Dang, Vidhyasaharan Sethu, Beena Ahmed",https://arxiv.org/pdf/2409.15357.pdf,"Subjects:
Audio and Speech Processing (eess.AS); Computation and Language (cs.CL); Machine Learning (cs.LG); Sound (cs.SD)","Audio and Speech Processing (eess.AS),  Computation and Language (cs.CL),  Machine Learning (cs.LG),  Sound (cs.SD)"
1550,arXiv:2409.15356,TCG CREST System Description for the Second DISPLACE Challenge,TCG CREST系统在第二次DISPLAYE挑战赛中的描述,"Nikhil Raghav, Subhajit Saha, Md Sahidullah, Swagatam Das",https://arxiv.org/pdf/2409.15356.pdf,"Subjects:
Audio and Speech Processing (eess.AS); Machine Learning (cs.LG); Sound (cs.SD)","Audio and Speech Processing (eess.AS),  Machine Learning (cs.LG),  Sound (cs.SD)"
1551,arXiv:2409.15353,Contextualization of ASR with LLM using phonetic retrieval-based augmentation,使用基于语音检索的增强对ASR和LLM进行语境化,"Zhihong Lei, Xingyu Na, Mingbin Xu, Ernest Pusateri, Christophe Van Gysel, Yuanyuan Zhang, Shiyi Han, Zhen Huang",https://arxiv.org/pdf/2409.15353.pdf,"Subjects:
Audio and Speech Processing (eess.AS); Computation and Language (cs.CL); Machine Learning (cs.LG); Sound (cs.SD)","Audio and Speech Processing (eess.AS),  Computation and Language (cs.CL),  Machine Learning (cs.LG),  Sound (cs.SD)"
1552,arXiv:2409.15351,Classification of Covering Spaces and Canonical Change of Basepoint,覆盖空间的分类与基点的典型变化,"Jelle Wemmenhove, Cosmin Manea, Jim Portegies",https://arxiv.org/pdf/2409.15351.pdf,"Subjects:
Algebraic Topology (math.AT); Logic in Computer Science (cs.LO); Logic (math.LO)","Algebraic Topology (math.AT),  Logic in Computer Science (cs.LO),  Logic (math.LO)"
1553,arXiv:2409.15350,A Large Dataset of Spontaneous Speech with the Accent Spoken in S\~ao Paulo for Automatic Speech Recognition Evaluation,用于自动语音识别评估的圣保罗口音自发语音大数据集,"Rodrigo Lima, Sidney Evaldo Leal, Arnaldo Candido Junior, Sandra Maria Aluísio",https://arxiv.org/pdf/2409.15350.pdf,"Subjects:
Audio and Speech Processing (eess.AS); Computation and Language (cs.CL)","Audio and Speech Processing (eess.AS),  Computation and Language (cs.CL)"
