id,title,title_zh,authors,url,subjects,subject_split
arXiv:2601.02360,Heterogeneous Low-Bandwidth Pre-Training of LLMs,大语言模型的异构低带宽预训练,"Yazan Obeidi, Amir Sarfi, Joel Lidin, Paul Janson, Eugene Belilovsky",https://arxiv.org/pdf/2601.02360,"Subjects:
Machine Learning (cs.LG)",Machine Learning (cs.LG)
arXiv:2601.02359,ExposeAnyone: Personalized Audio-to-Expression Diffusion Models Are Robust Zero-Shot Face Forgery Detectors,ExposeAnyone：个性化音频到表情扩散模型是鲁棒的零样本人脸伪造检测器,"Kaede Shiohara, Toshihiko Yamasaki, Vladislav Golyanik",https://arxiv.org/pdf/2601.02359,"Subjects:
Computer Vision and Pattern Recognition (cs.CV)",Computer Vision and Pattern Recognition (cs.CV)
arXiv:2601.02358,VINO: A Unified Visual Generator with Interleaved OmniModal Context,VINO：一种具有交错全模态上下文的统一视觉生成器,"Junyi Chen, Tong He, Zhoujie Fu, Pengfei Wan, Kun Gai, Weicai Ye",https://arxiv.org/pdf/2601.02358,"Subjects:
Computer Vision and Pattern Recognition (cs.CV)",Computer Vision and Pattern Recognition (cs.CV)
arXiv:2601.02357,DARC: Drum accompaniment generation with fine-grained rhythm control,DARC：具有细粒度节奏控制的鼓伴奏生成,Trey Brosnan,https://arxiv.org/pdf/2601.02357,"Subjects:
Sound (cs.SD); Artificial Intelligence (cs.AI); Audio and Speech Processing (eess.AS)","Sound (cs.SD),  Artificial Intelligence (cs.AI),  Audio and Speech Processing (eess.AS)"
arXiv:2601.02356,Talk2Move: Reinforcement Learning for Text-Instructed Object-Level Geometric Transformation in Scenes,Talk2Move：基于文本指令的场景中对象级几何变换的强化学习,"Jing Tan, Zhaoyang Zhang, Yantao Shen, Jiarui Cai, Shuo Yang, Jiajun Wu, Wei Xia, Zhuowen Tu, Stefano Soatto",https://arxiv.org/pdf/2601.02356,"Subjects:
Computer Vision and Pattern Recognition (cs.CV)",Computer Vision and Pattern Recognition (cs.CV)
arXiv:2601.02353,Meta-Learning Guided Pruning for Few-Shot Plant Pathology on Edge Devices,元学习引导的边缘设备小样本植物病理学剪枝,"Shahnawaz Alam, Mohammed Mudassir Uddin, Mohammed Kaif Pasha",https://arxiv.org/pdf/2601.02353,"Subjects:
Computer Vision and Pattern Recognition (cs.CV); Machine Learning (cs.LG)","Computer Vision and Pattern Recognition (cs.CV),  Machine Learning (cs.LG)"
arXiv:2601.02349,PRIMAD-LID: A Developed Framework for Computational Reproducibility,PRIMAD-LID：一种计算可复现性开发框架,"Meznah Aloqalaa, Stian Soiland-Reyes, Carole Goble",https://arxiv.org/pdf/2601.02349,"Subjects:
Computational Engineering, Finance, and Science (cs.CE)","Computational Engineering, Finance, and Science (cs.CE)"
arXiv:2601.02346,Falcon-H1R: Pushing the Reasoning Frontiers with a Hybrid Model for Efficient Test-Time Scaling,Falcon-H1R：通过混合模型推动推理边界的高效测试时扩展,"Falcon LLM Team, Iheb Chaabane, Puneesh Khanna, Suhail Mohmad, Slim Frikha, Shi Hu, Abdalgader Abubaker, Reda Alami, Mikhail Lubinets, Mohamed El Amine Seddik, Hakim Hacid",https://arxiv.org/pdf/2601.02346,"Subjects:
Artificial Intelligence (cs.AI)",Artificial Intelligence (cs.AI)
arXiv:2601.02345,Question Answering for Multi-Release Systems: A Case Study at Ciena,多版本系统问答：Ciena案例研究,"Parham Khamsepour, Mark Cole, Ish Ashraf, Sandeep Puri, Mehrdad Sabetzadeh, Shiva Nejati",https://arxiv.org/pdf/2601.02345,"Subjects:
Software Engineering (cs.SE)",Software Engineering (cs.SE)
arXiv:2601.02339,Joint Semantic and Rendering Enhancements in 3D Gaussian Modeling with Anisotropic Local Encoding,基于各向异性局部编码的3D高斯建模中的联合语义与渲染增强,"Jingming He, Chongyi Li, Shiqi Wang, Sam Kwong",https://arxiv.org/pdf/2601.02339,"Subjects:
Computer Vision and Pattern Recognition (cs.CV)",Computer Vision and Pattern Recognition (cs.CV)
arXiv:2601.02337,Robust Persona-Aware Toxicity Detection with Prompt Optimization and Learned Ensembling,基于提示优化和学习集成的鲁棒人格感知毒性检测,"Berk Atil, Rebecca J. Passonneau, Ninareh Mehrabi",https://arxiv.org/pdf/2601.02337,"Subjects:
Computation and Language (cs.CL)",Computation and Language (cs.CL)
arXiv:2601.02330,Error-Building Decoding of Linear Block Codes,线性分组码的错误构建解码,"Guoda Qiu, Ling Liu, Yuejun Wei, Liping Li",https://arxiv.org/pdf/2601.02330,"Subjects:
Information Theory (cs.IT)",Information Theory (cs.IT)
arXiv:2601.02329,BEDS: Bayesian Emergent Dissipative Structures,BEDS：贝叶斯涌现耗散结构,Laurent Caraffa,https://arxiv.org/pdf/2601.02329,"Subjects:
Computer Vision and Pattern Recognition (cs.CV)",Computer Vision and Pattern Recognition (cs.CV)
arXiv:2601.02320,Estimating Text Temperature,文本温度估计,Nikolay Mikhaylovskiy,https://arxiv.org/pdf/2601.02320,"Subjects:
Computation and Language (cs.CL)",Computation and Language (cs.CL)
arXiv:2601.02318,Fusion2Print: Deep Flash-Non-Flash Fusion for Contactless Fingerprint Matching,Fusion2Print：深度闪光-非闪光融合用于非接触式指纹匹配,"Roja Sahoo, Anoop Namboodiri",https://arxiv.org/pdf/2601.02318,"Subjects:
Computer Vision and Pattern Recognition (cs.CV)",Computer Vision and Pattern Recognition (cs.CV)
arXiv:2601.02316,"DatBench: Discriminative, Faithful, and Efficient VLM Evaluations",DatBench：判别性、保真性和高效视觉语言模型评估,"Siddharth Joshi, Haoli Yin, Rishabh Adiga, Ricardo Monti, Aldo Carranza, Alex Fang, Alvin Deng, Amro Abbas, Brett Larsen, Cody Blakeney, Darren Teh, David Schwab, Fan Pan, Haakon Mongstad, Jack Urbanek, Jason Lee, Jason Telanoff, Josh Wills, Kaleigh Mentzer, Luke Merrick, Parth Doshi, Paul Burstein, Pratyush Maini, Scott Loftin, Spandan Das, Tony Jiang, Vineeth Dorna, Zhengping Wang, Bogdan Gaza, Ari Morcos, Matthew Leavitt",https://arxiv.org/pdf/2601.02316,"Subjects:
Machine Learning (cs.LG); Artificial Intelligence (cs.AI)","Machine Learning (cs.LG),  Artificial Intelligence (cs.AI)"
arXiv:2601.02315,Prithvi-Complimentary Adaptive Fusion Encoder (CAFE): unlocking full-potential for flood inundation mapping,Prithvi-互补自适应融合编码器（CAFE）：释放洪水淹没制图的全部潜力,"Saurabh Kaushik, Lalit Maurya, Beth Tellman",https://arxiv.org/pdf/2601.02315,"Subjects:
Computer Vision and Pattern Recognition (cs.CV)",Computer Vision and Pattern Recognition (cs.CV)
arXiv:2601.02314,Project Ariadne: A Structural Causal Framework for Auditing Faithfulness in LLM Agents,阿里阿德涅计划：用于审计大语言模型代理保真度的结构因果框架,Sourena Khanzadeh,https://arxiv.org/pdf/2601.02314,"Subjects:
Artificial Intelligence (cs.AI)",Artificial Intelligence (cs.AI)
arXiv:2601.02313,"Game of Coding: Coding Theory in the Presence of Rational Adversaries, Motivated by Decentralized Machine Learning",博弈论编码：存在理性对手的编码理论，受去中心化机器学习启发,"Hanzaleh Akbari Nodehi, Viveck R. Cadambe, Mohammad Ali Maddah-Ali",https://arxiv.org/pdf/2601.02313,"Subjects:
Machine Learning (cs.LG)",Machine Learning (cs.LG)
arXiv:2601.02311,Placement Semantics for Distributed Deep Learning: A Systematic Framework for Analyzing Parallelism Strategies,分布式深度学习的放置语义：分析并行策略的系统框架,Deep Pankajbhai Mehta,https://arxiv.org/pdf/2601.02311,"Subjects:
Distributed, Parallel, and Cluster Computing (cs.DC); Artificial Intelligence (cs.AI)","Distributed, Parallel, and Cluster Computing (cs.DC),  Artificial Intelligence (cs.AI)"
arXiv:2601.02310,"Temporal Kolmogorov-Arnold Networks (T-KAN) for High-Frequency Limit Order Book Forecasting: Efficiency, Interpretability, and Alpha Decay",用于高频限价单簿预测的时间Kolmogorov-Arnold网络(T-KAN)：效率、可解释性与阿尔法衰减,Ahmad Makinde,https://arxiv.org/pdf/2601.02310,"Subjects:
Machine Learning (cs.LG)",Machine Learning (cs.LG)
arXiv:2601.02309,360DVO: Deep Visual Odometry for Monocular 360-Degree Camera,360DVO：面向单目360度相机的深度视觉里程计,"Xiaopeng Guo, Yinzhe Xu, Huajian Huang, Sai-Kit Yeung",https://arxiv.org/pdf/2601.02309,"Subjects:
Computer Vision and Pattern Recognition (cs.CV)",Computer Vision and Pattern Recognition (cs.CV)
arXiv:2601.02307,Differential Privacy for Transformer Embeddings of Text with Nonparametric Variational Information Bottleneck,基于非参数变分信息瓶颈的文本Transformer嵌入差分隐私保护,"Dina El Zein, James Henderson",https://arxiv.org/pdf/2601.02307,"Subjects:
Machine Learning (cs.LG)",Machine Learning (cs.LG)
arXiv:2601.02306,Cold-Starting Podcast Ads and Promotions with Multi-Task Learning on Spotify,基于多任务学习的Spotify播客广告冷启动,"Shivam Verma, Hannes Karlbom, Yu Zhao, Nick Topping, Vivian Chen, Kieran Stanley, Bharath Rengarajan",https://arxiv.org/pdf/2601.02306,"Subjects:
Information Retrieval (cs.IR)",Information Retrieval (cs.IR)
arXiv:2601.02304,Octopus: A Lightweight Entity-Aware System for Multi-Table Data Discovery and Cell-Level Retrieval,章鱼：面向多表数据发现和单元级检索的轻量级实体感知系统,"Wen-Zhi Li, Sainyam Galhotra",https://arxiv.org/pdf/2601.02304,"Subjects:
Databases (cs.DB)",Databases (cs.DB)
arXiv:2601.02303,Classifying several dialectal Nawatl varieties,纳瓦特尔方言变体分类,"Juan-José Guzmán-Landa, Juan-Manuel Torres-Moreno, Miguel Figueroa-Saavedra, Carlos-Emiliano González-Gallardo, Graham Ranger, Martha Lorena-Avendaño-Garrido",https://arxiv.org/pdf/2601.02303,"Subjects:
Computation and Language (cs.CL)",Computation and Language (cs.CL)
arXiv:2601.02301,Generative Site-Specific Beamforming for Next-Generation Spatial Intelligence,面向下一代空间智能的生成式站点特异性波束成形,"Zhaolin Wang, Zihao Zhou, Cheng-Jie Zhao, Yuanwei Liu",https://arxiv.org/pdf/2601.02301,"Subjects:
Information Theory (cs.IT)",Information Theory (cs.IT)
arXiv:2601.02299,SortWaste: A Densely Annotated Dataset for Object Detection in Industrial Waste Sorting,SortWaste：工业废弃物分拣的密集标注目标检测数据集,"Sara Inácio, Hugo Proença, João C. Neves",https://arxiv.org/pdf/2601.02299,"Subjects:
Computer Vision and Pattern Recognition (cs.CV)",Computer Vision and Pattern Recognition (cs.CV)
arXiv:2601.02298,Power-of-Two Quantization-Aware-Training (PoT-QAT) in Large Language Models (LLMs),大语言模型中的二的幂量化感知训练(PoT-QAT),Mahmoud Elgenedy,https://arxiv.org/pdf/2601.02298,"Subjects:
Computation and Language (cs.CL); Signal Processing (eess.SP)","Computation and Language (cs.CL),  Signal Processing (eess.SP)"
arXiv:2601.02295,CycleVLA: Proactive Self-Correcting Vision-Language-Action Models via Subtask Backtracking and Minimum Bayes Risk Decoding,CycleVLA：通过子任务回溯和最小贝叶斯风险解码实现主动自校正的视觉-语言-动作模型,"Chenyang Ma, Guangyu Yang, Kai Lu, Shitong Xu, Bill Byrne, Niki Trigoni, Andrew Markham",https://arxiv.org/pdf/2601.02295,"Subjects:
Robotics (cs.RO)",Robotics (cs.RO)
arXiv:2601.02289,Rank-based Geographical Regularization: Revisiting Contrastive Self-Supervised Learning for Multispectral Remote Sensing Imagery,基于排序的地理正则化：多光谱遥感影像对比自监督学习的再审视,"Tom Burgert, Leonard Hackel, Paolo Rota, Begüm Demir",https://arxiv.org/pdf/2601.02289,"Subjects:
Computer Vision and Pattern Recognition (cs.CV)",Computer Vision and Pattern Recognition (cs.CV)
arXiv:2601.02286,BigSUMO: A Scalable Framework for Big Data Traffic Analytics and Parallel Simulation,BigSUMO：面向大数据交通分析与并行模拟的可扩展框架,"Rahul Sengupta, Nooshin Yousefzadeh, Manav Sanghvi, Yash Ranjan, Anand Rangarajan, Sanjay Ranka, Yashaswi Karnati, Jeremy Dilmore, Tushar Patel, Ryan Casburn",https://arxiv.org/pdf/2601.02286,"Subjects:
Distributed, Parallel, and Cluster Computing (cs.DC)","Distributed, Parallel, and Cluster Computing (cs.DC)"
arXiv:2601.02285,"pdfQA: Diverse, Challenging, and Realistic Question Answering over PDFs",pdfQA：面向PDF文档的多样化、具有挑战性且现实的问答系统,"Tobias Schimanski, Imene Kolli, Jingwei Ni, Yu Fan, Ario Saeid Vaghefi, Elliott Ash, Markus Leippold",https://arxiv.org/pdf/2601.02285,"Subjects:
Computation and Language (cs.CL); Artificial Intelligence (cs.AI)","Computation and Language (cs.CL),  Artificial Intelligence (cs.AI)"
arXiv:2601.02283,An Automatic Pipeline for the Integration of Python-Based Tools into the Galaxy Platform: Application to the anvi'o Framework,Python工具集成Galaxy平台的自动化流水线：以anvi'o框架为例,"Fabio Cumbo, Jayadev Joshi, Daniel Blankenberg",https://arxiv.org/pdf/2601.02283,"Subjects:
Other Computer Science (cs.OH)",Other Computer Science (cs.OH)
arXiv:2601.02281,InfiniteVGGT: Visual Geometry Grounded Transformer for Endless Streams,InfiniteVGGT：面向无限流的视觉几何基础Transformer,"Shuai Yuan, Yantai Yang, Xiaotian Yang, Xupeng Zhang, Zhonghao Zhao, Lingming Zhang, Zhipeng Zhang",https://arxiv.org/pdf/2601.02281,"Subjects:
Computer Vision and Pattern Recognition (cs.CV)",Computer Vision and Pattern Recognition (cs.CV)
arXiv:2601.02278,Multi-mode Fault Diagnosis Datasets of Three-phase Asynchronous Motor Under Variable Working Conditions,三相异步电机在可变工况下的多模式故障诊断数据集,"Shijin Chen, Zeyi Liu, Chenyang Li, Dongliang Zou, Xiao He, Donghua Zhou",https://arxiv.org/pdf/2601.02278,"Subjects:
Systems and Control (eess.SY)",Systems and Control (eess.SY)
arXiv:2601.02275,Machine Learning Guided Cooling Optimization for Data Centers,面向数据中心的机器学习引导冷却优化,"Shrenik Jadhav, Zheng Liu",https://arxiv.org/pdf/2601.02275,"Subjects:
Systems and Control (eess.SY); Applications (stat.AP)","Systems and Control (eess.SY),  Applications (stat.AP)"
arXiv:2601.02273,TopoLoRA-SAM: Topology-Aware Parameter-Efficient Adaptation of Foundation Segmenters for Thin-Structure and Cross-Domain Binary Semantic Segmentation,TopoLoRA-SAM：面向细长结构和跨域二值语义分割的基础分割器拓扑感知高效参数适应,Salim Khazem,https://arxiv.org/pdf/2601.02273,"Subjects:
Computer Vision and Pattern Recognition (cs.CV); Artificial Intelligence (cs.AI); Machine Learning (cs.LG)","Computer Vision and Pattern Recognition (cs.CV),  Artificial Intelligence (cs.AI),  Machine Learning (cs.LG)"
arXiv:2601.02270,Modeling Inter-drone Interference as a Service in Skyway Networks,Skyway网络中无人机间干扰建模服务,"Gabriel Timothy, Syeda Amna Rizvi, Muhammad Umair, Athman Bouguettaya, Balsam Alkouz",https://arxiv.org/pdf/2601.02270,"Subjects:
Emerging Technologies (cs.ET)",Emerging Technologies (cs.ET)
arXiv:2601.02267,DiffProxy: Multi-View Human Mesh Recovery via Diffusion-Generated Dense Proxies,DiffProxy：通过扩散生成密集代理的多视角人体网格恢复,"Renke Wang, Zhenyu Zhang, Ying Tai, Jian Yang",https://arxiv.org/pdf/2601.02267,"Subjects:
Computer Vision and Pattern Recognition (cs.CV)",Computer Vision and Pattern Recognition (cs.CV)
arXiv:2601.02264,POSEIDON: Physics-Optimized Seismic Energy Inference and Detection Operating Network,POSEIDON：基于物理优化的地震能量推断与检测操作网络,"Boris Kriuk, Fedor Kriuk",https://arxiv.org/pdf/2601.02264,"Subjects:
Machine Learning (cs.LG)",Machine Learning (cs.LG)
arXiv:2601.02257,Improved Accuracy for Private Continual Cardinality Estimation in Fully Dynamic Streams via Matrix Factorization,通过矩阵分解提升全动态流中隐私保护持续基数估计的准确性,"Joel Daniel Andersson, Palak Jain, Satchit Sivakumar",https://arxiv.org/pdf/2601.02257,"Subjects:
Cryptography and Security (cs.CR); Data Structures and Algorithms (cs.DS); Machine Learning (cs.LG)","Cryptography and Security (cs.CR),  Data Structures and Algorithms (cs.DS),  Machine Learning (cs.LG)"
arXiv:2601.02256,VAR RL Done Right: Tackling Asynchronous Policy Conflicts in Visual Autoregressive Generation,正确实现VAR强化学习：解决视觉自回归生成中的异步策略冲突,"Shikun Sun, Liao Qu, Huichao Zhang, Yiheng Liu, Yangyang Song, Xian Li, Xu Wang, Yi Jiang, Daniel K. Du, Xinglong Wu, Jia Jia",https://arxiv.org/pdf/2601.02256,"Subjects:
Computer Vision and Pattern Recognition (cs.CV); Machine Learning (cs.LG)","Computer Vision and Pattern Recognition (cs.CV),  Machine Learning (cs.LG)"
arXiv:2601.02254,Vouchsafe: A Zero-Infrastructure Capability Graph Model for Offline Identity and Trust,Vouchsafe：面向离线身份与信任的零基础设施能力图模型,Jay Kuri,https://arxiv.org/pdf/2601.02254,"Subjects:
Cryptography and Security (cs.CR); Distributed, Parallel, and Cluster Computing (cs.DC)","Cryptography and Security (cs.CR),  Distributed, Parallel, and Cluster Computing (cs.DC)"
arXiv:2601.02253,Neuro-Channel Networks: A Multiplication-Free Architecture by Biological Signal Transmission,神经通道网络：基于生物信号传输的无乘法架构,"Emrah Mete, Emin Erkan Korkmaz",https://arxiv.org/pdf/2601.02253,"Subjects:
Machine Learning (cs.LG); Hardware Architecture (cs.AR); Computer Vision and Pattern Recognition (cs.CV)","Machine Learning (cs.LG),  Hardware Architecture (cs.AR),  Computer Vision and Pattern Recognition (cs.CV)"
arXiv:2601.02251,Deciding Serializability in Network Systems,网络系统中序列化决策的判定方法,"Guy Amir, Mark Barbone, Nicolas Amat, Jules Jacobs",https://arxiv.org/pdf/2601.02251,"Subjects:
Formal Languages and Automata Theory (cs.FL); Distributed, Parallel, and Cluster Computing (cs.DC); Logic in Computer Science (cs.LO); Programming Languages (cs.PL)","Formal Languages and Automata Theory (cs.FL),  Distributed, Parallel, and Cluster Computing (cs.DC),  Logic in Computer Science (cs.LO),  Programming Languages (cs.PL)"
arXiv:2601.02249,SLGNet: Synergizing Structural Priors and Language-Guided Modulation for Multimodal Object Detection,SLGNet：融合结构先验与语言引导调制的多模态目标检测,"Xiantai Xiang, Guangyao Zhou, Zixiao Wen, Wenshuai Li, Ben Niu, Feng Wang, Lijia Huang, Qiantong Wang, Yuhan Liu, Zongxu Pan, Yuxin Hu",https://arxiv.org/pdf/2601.02249,"Subjects:
Computer Vision and Pattern Recognition (cs.CV)",Computer Vision and Pattern Recognition (cs.CV)
arXiv:2601.02248,"Automatic Assertion Mining in Assertion-Based Verification: Techniques, Challenges, and Future Directions",基于断言的验证中的自动断言挖掘：技术、挑战与未来方向,"Mohammad Reza Heidari Iman, Giorgio Di Natale, Katell Morin-Allory",https://arxiv.org/pdf/2601.02248,"Subjects:
Software Engineering (cs.SE)",Software Engineering (cs.SE)
arXiv:2601.02246,"A Comparative Study of Custom CNNs, Pre-trained Models, and Transfer Learning Across Multiple Visual Datasets",自定义CNN、预训练模型与迁移学习在多视觉数据集上的对比研究,Annoor Sharara Akhand,https://arxiv.org/pdf/2601.02246,"Subjects:
Computer Vision and Pattern Recognition (cs.CV); Artificial Intelligence (cs.AI); Machine Learning (cs.LG)","Computer Vision and Pattern Recognition (cs.CV),  Artificial Intelligence (cs.AI),  Machine Learning (cs.LG)"
arXiv:2601.02245,MOZAIK: A Privacy-Preserving Analytics Platform for IoT Data Using MPC and FHE,MOZAIK：基于MPC与FHE的物联网数据隐私保护分析平台,"Michiel Van Kenhove, Erik Pohle, Leonard Schild, Martin Zbudila, Merlijn Sebrechts, Filip De Turck, Bruno Volckaert, Aysajan Abidin",https://arxiv.org/pdf/2601.02245,"Subjects:
Cryptography and Security (cs.CR)",Cryptography and Security (cs.CR)
arXiv:2601.02244,Characterizing All Locally Exponentially Stabilizing Controllers as a Linear Feedback Plus Learnable Nonlinear Youla Dynamics,表征所有局部指数稳定控制器为线性反馈与可学习非线性Youla动力学的组合,Luca Furieri,https://arxiv.org/pdf/2601.02244,"Subjects:
Systems and Control (eess.SY)",Systems and Control (eess.SY)
arXiv:2601.02243,Optimal Dispatch of Electricity and Water in Renewable-Integrated Desalination Plants,可再生能源集成淡化厂中电力与水的最优调度,"Ahmed S. Alahmed, Audun Botterud, Saurabh Amin, Ali T. Al-Awami",https://arxiv.org/pdf/2601.02243,"Subjects:
Systems and Control (eess.SY); Theoretical Economics (econ.TH)","Systems and Control (eess.SY),  Theoretical Economics (econ.TH)"
arXiv:2601.02242,VIBE: Visual Instruction Based Editor,VIBE：基于视觉指令的编辑器,"Grigorii Alekseenko, Aleksandr Gordeev, Irina Tolstykh, Bulat Suleimanov, Vladimir Dokholyan, Georgii Fedorov, Sergey Yakubson, Aleksandra Tsybina, Mikhail Chernyshov, Maksim Kuprashevich",https://arxiv.org/pdf/2601.02242,"Subjects:
Computer Vision and Pattern Recognition (cs.CV); Artificial Intelligence (cs.AI); Machine Learning (cs.LG)","Computer Vision and Pattern Recognition (cs.CV),  Artificial Intelligence (cs.AI),  Machine Learning (cs.LG)"
arXiv:2601.02240,Enabling Deep Reinforcement Learning Research for Energy Saving in Open RAN,面向开放RAN节能的深度强化学习研究实现,"Matteo Bordin, Andrea Lacava, Michele Polese, Francesca Cuomo, Tommaso Melodia",https://arxiv.org/pdf/2601.02240,"Subjects:
Networking and Internet Architecture (cs.NI)",Networking and Internet Architecture (cs.NI)
arXiv:2601.02238,NQC2: A Non-Intrusive QEMU Code Coverage Plugin,NQC2：非侵入式QEMU代码覆盖率插件,"Nils Bosbach, Alwalid Salama, Lukas Jünger, Mark Burton, Niko Zurstraßen, Rebecca Pelke, Rainer Leupers",https://arxiv.org/pdf/2601.02238,"Subjects:
Software Engineering (cs.SE)",Software Engineering (cs.SE)
arXiv:2601.02237,Quantum AI for Cybersecurity: A hybrid Quantum-Classical models for attack path analysis,量子AI在网络安全中的应用：混合量子-经典模型的攻击路径分析,"Jessica A. Sciammarelli, Waqas Ahmed",https://arxiv.org/pdf/2601.02237,"Subjects:
Cryptography and Security (cs.CR); Quantum Physics (quant-ph)","Cryptography and Security (cs.CR),  Quantum Physics (quant-ph)"
arXiv:2601.02236,CD4LM: Consistency Distillation and aDaptive Decoding for Diffusion Language Models,CD4LM：扩散语言模型的一致性蒸馏与自适应解码,"Yihao Liang, Ze Wang, Hao Chen, Ximeng Sun, Jialian Wu, Xiaodong Yu, Jiang Liu, Emad Barsoum, Zicheng Liu, Niraj K. Jha",https://arxiv.org/pdf/2601.02236,"Subjects:
Computation and Language (cs.CL)",Computation and Language (cs.CL)
arXiv:2601.02232,ELLA: Efficient Lifelong Learning for Adapters in Large Language Models,ELLA：面向大语言模型适配器的高效终身学习,"Shristi Das Biswas, Yue Zhang, Anwesan Pal, Radhika Bhargava, Kaushik Roy",https://arxiv.org/pdf/2601.02232,"Subjects:
Machine Learning (cs.LG)",Machine Learning (cs.LG)
arXiv:2601.02228,FMVP: Masked Flow Matching for Adversarial Video Purification,FMVP：对抗性视频净化的掩码流匹配方法,"Duoxun Tang, Xueyi Zhang, Chak Hin Wang, Xi Xiao, Dasen Dai, Xinhang Jiang, Wentao Shi, Rui Li, Qing Li",https://arxiv.org/pdf/2601.02228,"Subjects:
Computer Vision and Pattern Recognition (cs.CV)",Computer Vision and Pattern Recognition (cs.CV)
arXiv:2601.02224,From XAI to Stories: A Factorial Study of LLM-Generated Explanation Quality,从XAI到故事：LLM生成解释质量的因子研究,"Fabian Lukassen, Jan Herrmann, Christoph Weisser, Benjamin Saefken, Thomas Kneib",https://arxiv.org/pdf/2601.02224,"Subjects:
Computation and Language (cs.CL)",Computation and Language (cs.CL)
arXiv:2601.02218,MLIR-Smith: A Novel Random Program Generator for Evaluating Compiler Pipelines,MLIR-Smith：一种用于评估编译器流水线的新型随机程序生成器,"Berke Ates, Filip Dobrosavljević, Theodoros Theodoridis, Zhendong Su",https://arxiv.org/pdf/2601.02218,"Subjects:
Programming Languages (cs.PL); Software Engineering (cs.SE)","Programming Languages (cs.PL),  Software Engineering (cs.SE)"
arXiv:2601.02215,LLM-Empowered Functional Safety and Security by Design in Automotive Systems,大语言模型赋能的汽车系统设计中的功能安全与安全设计,"Nenad Petrovic, Vahid Zolfaghari, Fengjunjie Pan, Alois Knoll",https://arxiv.org/pdf/2601.02215,"Subjects:
Software Engineering (cs.SE); Artificial Intelligence (cs.AI)","Software Engineering (cs.SE),  Artificial Intelligence (cs.AI)"
arXiv:2601.02214,Cooperation in Virtual Reality: Exploring Environmental Decision-Making through a Real-Effort Threshold Public Goods Game,虚拟现实中的合作：通过真实努力阈值公共物品游戏探索环境决策,"Manuela Chessa, Michela Chessa, Lorenzo Gerini, Matteo Martini, Kaloyana Naneva, Fabio Solari",https://arxiv.org/pdf/2601.02214,"Subjects:
Human-Computer Interaction (cs.HC)",Human-Computer Interaction (cs.HC)
arXiv:2601.02213,Quantized SO(3)-Equivariant Graph Neural Networks for Efficient Molecular Property Prediction,量化SO(3)等变图神经网络用于高效分子属性预测,"Haoyu Zhou, Ping Xue, Tianfan Fu, Hao Zhang",https://arxiv.org/pdf/2601.02213,"Subjects:
Machine Learning (cs.LG)",Machine Learning (cs.LG)
arXiv:2601.02212,Prior-Guided DETR for Ultrasound Nodule Detection,先验引导DETR用于超声结节检测,"Jingjing Wang, Zhuo Xiao, Xinning Yao, Bo Liu, Lijuan Niu, Xiangzhi Bai, Fugen Zhou",https://arxiv.org/pdf/2601.02212,"Subjects:
Computer Vision and Pattern Recognition (cs.CV)",Computer Vision and Pattern Recognition (cs.CV)
arXiv:2601.02211,Unraveling MMDiT Blocks: Training-free Analysis and Enhancement of Text-conditioned Diffusion,解构MMDiT模块：无训练分析与文本条件扩散增强,"Binglei Li, Mengping Yang, Zhiyu Tan, Junping Zhang, Hao Li",https://arxiv.org/pdf/2601.02211,"Subjects:
Computer Vision and Pattern Recognition (cs.CV)",Computer Vision and Pattern Recognition (cs.CV)
