id,title,title_zh,authors,url,subjects,subject_split
arXiv:2601.01086,Decision-Aware Semantic State Synchronization in Compute-First Networking,计算优先网络中的决策感知语义状态同步,"Jianpeng Qi, Chao Liu, Chengrui Wang, Rui Wang, Junyu Dong, Yanwei Yu",https://arxiv.org/pdf/2601.01086,"Subjects:
Networking and Internet Architecture (cs.NI)",Networking and Internet Architecture (cs.NI)
arXiv:2601.01085,"Luminark: Training-free, Probabilistically-Certified Watermarking for General Vision Generative Models",Luminark：一种无需训练的概率认证水印方法，适用于通用视觉生成模型,"Jiayi Xu, Zhang Zhang, Yuanrui Zhang, Ruitao Chen, Yixian Xu, Tianyu He, Di He",https://arxiv.org/pdf/2601.01085,"Subjects:
Computer Vision and Pattern Recognition (cs.CV); Artificial Intelligence (cs.AI)","Computer Vision and Pattern Recognition (cs.CV),  Artificial Intelligence (cs.AI)"
arXiv:2601.01084,A UAV-Based Multispectral and RGB Dataset for Multi-Stage Paddy Crop Monitoring in Indian Agricultural Fields,基于无人机的多光谱和RGB数据集用于印度农业田的多阶段水稻作物监测,"Adari Rama Sukanya, Puvvula Roopesh Naga Sri Sai, Kota Moses, Rimalapudi Sarvendranath",https://arxiv.org/pdf/2601.01084,"Subjects:
Computer Vision and Pattern Recognition (cs.CV); Image and Video Processing (eess.IV)","Computer Vision and Pattern Recognition (cs.CV),  Image and Video Processing (eess.IV)"
arXiv:2601.01082,Discount Model Search for Quality Diversity Optimization in High-Dimensional Measure Spaces,高维度量空间中质量多样性优化的折扣模型搜索,"Bryon Tjanaka, Henry Chen, Matthew C. Fontaine, Stefanos Nikolaidis",https://arxiv.org/pdf/2601.01082,"Subjects:
Machine Learning (cs.LG); Neural and Evolutionary Computing (cs.NE)","Machine Learning (cs.LG),  Neural and Evolutionary Computing (cs.NE)"
arXiv:2601.01081,SaddleScape V1.0: A Python Package for Constructing Solution Landscapes via High-index Saddle Dynamics,SaddleScape V1.0：通过高指数鞍点动力学构建解决方案景观的Python包,"Yuyang Liu, Hua Su, Zixiang Xiao, Lei Zhang, Jin Zhao",https://arxiv.org/pdf/2601.01081,"Subjects:
Numerical Analysis (math.NA)",Numerical Analysis (math.NA)
arXiv:2601.01079,A Novel Approach of Solving Polynomial Equations Over Binary Extension Fields,二进制扩展域上求解多项式方程的一种新方法,"Leilei Yu, Yunghsiang S. Han, Pingping Li, Jiasheng Yuan",https://arxiv.org/pdf/2601.01079,"Subjects:
Information Theory (cs.IT)",Information Theory (cs.IT)
arXiv:2601.01076,Scalable Data-Driven Reachability Analysis and Control via Koopman Operators with Conformal Coverage Guarantees,基于Koopman算子的可扩展数据驱动可达性分析与控制：具有保形覆盖保证,"Devesh Nath, Haoran Yin, Glen Chou",https://arxiv.org/pdf/2601.01076,"Subjects:
Systems and Control (eess.SY); Artificial Intelligence (cs.AI); Machine Learning (cs.LG); Robotics (cs.RO); Optimization and Control (math.OC)","Systems and Control (eess.SY),  Artificial Intelligence (cs.AI),  Machine Learning (cs.LG),  Robotics (cs.RO),  Optimization and Control (math.OC)"
arXiv:2601.01075,Flow Equivariant World Models: Memory for Partially Observed Dynamic Environments,流等变世界模型：部分可观测动态环境的记忆,"Hansen Jin Lillemark, Benhao Huang, Fangneng Zhan, Yilun Du, Thomas Anderson Keller",https://arxiv.org/pdf/2601.01075,"Subjects:
Machine Learning (cs.LG); Artificial Intelligence (cs.AI); Computer Vision and Pattern Recognition (cs.CV)","Machine Learning (cs.LG),  Artificial Intelligence (cs.AI),  Computer Vision and Pattern Recognition (cs.CV)"
arXiv:2601.01073,Gendered Pathways in AI Companionship: Cross-Community Behavior and Toxicity Patterns on Reddit,AI伴侣中的性别化路径：Reddit跨社区行为与毒性模式分析,"Erica Coppolillo, Emilio Ferrara",https://arxiv.org/pdf/2601.01073,"Subjects:
Social and Information Networks (cs.SI); Artificial Intelligence (cs.AI)","Social and Information Networks (cs.SI),  Artificial Intelligence (cs.AI)"
arXiv:2601.01072,Flow Matching Transport for Quasi-Monte Carlo Integration,用于准蒙特卡洛积分的流匹配传输方法,"Zhijun Zeng, Jianlong Chen",https://arxiv.org/pdf/2601.01072,"Subjects:
Numerical Analysis (math.NA)",Numerical Analysis (math.NA)
arXiv:2601.01069,Revisiting Weighted Strategy for Non-stationary Parametric Bandits and MDPs,非平稳参数化老虎机与MDP的加权策略再研究,"Jing Wang, Peng Zhao, Zhi-Hua Zhou",https://arxiv.org/pdf/2601.01069,"Subjects:
Machine Learning (cs.LG); Machine Learning (stat.ML)","Machine Learning (cs.LG),  Machine Learning (stat.ML)"
arXiv:2601.01068,Post-Quantum Cryptography for Intelligent Transportation Systems: An Implementation-Focused Review,面向智能交通系统的后量子密码学：以实现为导向的综述,"Abdullah Al Mamun, Akid Abrar, Mizanur Rahman, M Sabbir Salek, Mashrur Chowdhury",https://arxiv.org/pdf/2601.01068,"Subjects:
Cryptography and Security (cs.CR)",Cryptography and Security (cs.CR)
arXiv:2601.01067,Topological Mapping and Navigation using a Monocular Camera based on AnyLoc,基于AnyLoc的单目相机拓扑地图构建与导航,"Wenzheng Zhang, Yoshitaka Hara, Sousuke Nakamura",https://arxiv.org/pdf/2601.01067,"Subjects:
Robotics (cs.RO)",Robotics (cs.RO)
arXiv:2601.01065,Tiny Machine Learning for Real-Time Aquaculture Monitoring: A Case Study in Morocco,微型机器学习在实时水产养殖监测中的应用：摩洛哥案例研究,"Achraf Hsain, Yahya Zaki, Othman Abaakil, Hibat-allah Bekkar, Yousra Chtouki",https://arxiv.org/pdf/2601.01065,"Subjects:
Machine Learning (cs.LG); Signal Processing (eess.SP); Systems and Control (eess.SY)","Machine Learning (cs.LG),  Signal Processing (eess.SP),  Systems and Control (eess.SY)"
arXiv:2601.01064,Efficient Hyperspectral Image Reconstruction Using Lightweight Separate Spectral Transformers,基于轻量级分离光谱变换器的高效高光谱图像重建,"Jianan Li, Wangcai Zhao, Tingfa Xu",https://arxiv.org/pdf/2601.01064,"Subjects:
Computer Vision and Pattern Recognition (cs.CV); Image and Video Processing (eess.IV)","Computer Vision and Pattern Recognition (cs.CV),  Image and Video Processing (eess.IV)"
arXiv:2601.01062,SPoRC-VIST: A Benchmark for Evaluating Generative Natural Narrative in Vision-Language Models,SPoRC-VIST：评估视觉-语言模型生成自然叙事的基准,Yunlin Zeng,https://arxiv.org/pdf/2601.01062,"Subjects:
Machine Learning (cs.LG); Artificial Intelligence (cs.AI); Computer Vision and Pattern Recognition (cs.CV)","Machine Learning (cs.LG),  Artificial Intelligence (cs.AI),  Computer Vision and Pattern Recognition (cs.CV)"
arXiv:2601.01061,A UCB Bandit Algorithm for General ML-Based Estimators,适用于通用机器学习估计器的上置信界老虎机算法,"Yajing Liu, Erkao Bao, Linqi Song",https://arxiv.org/pdf/2601.01061,"Subjects:
Machine Learning (cs.LG); Artificial Intelligence (cs.AI); Probability (math.PR)","Machine Learning (cs.LG),  Artificial Intelligence (cs.AI),  Probability (math.PR)"
arXiv:2601.01060,Unsupervised Text Style Transfer for Controllable Intensity,可控强度的无监督文本风格迁移,"Shuhuan Gu, Wenbiao Tao, Xinchen Ma, Kangkang He, Ye Guo, Xiang Li, Yunshi Lan",https://arxiv.org/pdf/2601.01060,"Subjects:
Computation and Language (cs.CL)",Computation and Language (cs.CL)
arXiv:2601.01056,Enhancing Histopathological Image Classification via Integrated HOG and Deep Features with Robust Noise Performance,通过集成HOG与深度特征提升组织病理图像分类的鲁棒性,"Ifeanyi Ezuma, Ugochukwu Ugwu",https://arxiv.org/pdf/2601.01056,"Subjects:
Computer Vision and Pattern Recognition (cs.CV); Artificial Intelligence (cs.AI)","Computer Vision and Pattern Recognition (cs.CV),  Artificial Intelligence (cs.AI)"
arXiv:2601.01054,Out-of-Band Power Side-Channel Detection for Semiconductor Supply Chain Integrity at Scale,面向半导体供应链完整性的规模化带外功率侧信道检测,"Rajiv Thummala, Katherine Winton, Luke Flores, Elizabeth Redmond, Gregory Falco",https://arxiv.org/pdf/2601.01054,"Subjects:
Cryptography and Security (cs.CR)",Cryptography and Security (cs.CR)
arXiv:2601.01053,Byzantine-Robust Federated Learning Framework with Post-Quantum Secure Aggregation for Real-Time Threat Intelligence Sharing in Critical IoT Infrastructure,拜占庭鲁棒联邦学习框架：面向关键物联网基础设施实时威胁情报共享的后量子安全聚合,"Milad Rahmati, Nima Rahmati",https://arxiv.org/pdf/2601.01053,"Subjects:
Cryptography and Security (cs.CR); Machine Learning (cs.LG)","Cryptography and Security (cs.CR),  Machine Learning (cs.LG)"
arXiv:2601.01050,EgoGrasp: World-Space Hand-Object Interaction Estimation from Egocentric Videos,EgoGrasp：基于第一视角视频的三维手-物交互估计,"Hongming Fu, Wenjia Wang, Xiaozhen Qiao, Shuo Yang, Zheng Liu, Bo Zhao",https://arxiv.org/pdf/2601.01050,"Subjects:
Computer Vision and Pattern Recognition (cs.CV); Artificial Intelligence (cs.AI); Graphics (cs.GR)","Computer Vision and Pattern Recognition (cs.CV),  Artificial Intelligence (cs.AI),  Graphics (cs.GR)"
arXiv:2601.01048,CuFuzz: Hardening CUDA Programs through Transformation and Fuzzing,CuFuzz：通过转换与模糊测试强化CUDA程序,"Saurabh Singh, Ruobing Han, Jaewon Lee, Seonjin Na, Yonghae Kim, Taesoo Kim, Hyesoon Kim",https://arxiv.org/pdf/2601.01048,"Subjects:
Cryptography and Security (cs.CR)",Cryptography and Security (cs.CR)
arXiv:2601.01046,KV-Embedding: Training-free Text Embedding via Internal KV Re-routing in Decoder-only LLMs,KV-Embedding：基于解码器型大语言模型内部KV重路由的无训练文本嵌入,"Yixuan Tang, Yi Yang",https://arxiv.org/pdf/2601.01046,"Subjects:
Computation and Language (cs.CL)",Computation and Language (cs.CL)
arXiv:2601.01045,Coarse-Grained Kullback--Leibler Control of Diffusion-Based Generative AI,基于扩散模型的生成式AI的粗粒度Kullback-Leibler控制,Tatsuaki Tsuruyama,https://arxiv.org/pdf/2601.01045,"Subjects:
Machine Learning (cs.LG)",Machine Learning (cs.LG)
arXiv:2601.01044,Evaluating transfer learning strategies for improving dairy cattle body weight prediction in small farms using depth-image and point-cloud data,评估迁移学习策略在小型农场奶牛体重预测中的应用：基于深度图像与点云数据,"Jin Wang, Angelo De Castro, Yuxi Zhang, Lucas Basolli Borsatto, Yuechen Guo, Victoria Bastos Primo, Ana Beatriz Montevecchio Bernardino, Gota Morota, Ricardo C Chebel, Haipeng Yu",https://arxiv.org/pdf/2601.01044,"Subjects:
Computer Vision and Pattern Recognition (cs.CV); Machine Learning (cs.LG)","Computer Vision and Pattern Recognition (cs.CV),  Machine Learning (cs.LG)"
arXiv:2601.01042,SeRe: A Security-Related Code Review Dataset Aligned with Real-World Review Activities,SeRe：一个与真实世界审查活动对齐的安全相关代码审查数据集,"Zixiao Zhao, Yanjie Jiang, Hui Liu, Kui Liu, Lu Zhang",https://arxiv.org/pdf/2601.01042,"Subjects:
Software Engineering (cs.SE)",Software Engineering (cs.SE)
arXiv:2601.01041,Deepfake Detection with Multi-Artifact Subspace Fine-Tuning and Selective Layer Masking,基于多工件子空间微调和选择性层掩码的深度伪造检测,"Xiang Zhang, Wenliang Weng, Daoyong Fu, Ziqiang Li, Zhangjie Fu",https://arxiv.org/pdf/2601.01041,"Subjects:
Computer Vision and Pattern Recognition (cs.CV); Multimedia (cs.MM)","Computer Vision and Pattern Recognition (cs.CV),  Multimedia (cs.MM)"
arXiv:2601.01037,Multi-Dimensional Prompt Chaining to Improve Open-Domain Dialogue Generation,多维提示链：提升开放域对话生成,Livia Leong Hui Teng,https://arxiv.org/pdf/2601.01037,"Subjects:
Computation and Language (cs.CL); Artificial Intelligence (cs.AI)","Computation and Language (cs.CL),  Artificial Intelligence (cs.AI)"
arXiv:2601.01036,Mono3DV: Monocular 3D Object Detection with 3D-Aware Bipartite Matching and Variational Query DeNoising,Mono3DV：基于三维感知二分匹配与变分查询去噪的单目三维物体检测,"Kiet Dang Vu, Trung Thai Tran, Kien Nguyen Do Trung, Duc Dung Nguyen",https://arxiv.org/pdf/2601.01036,"Subjects:
Computer Vision and Pattern Recognition (cs.CV)",Computer Vision and Pattern Recognition (cs.CV)
arXiv:2601.01031,A Multi-Port Concurrent Communication Model for handling Compute Intensive Tasks on Distributed Satellite System Constellations,一种用于处理分布式卫星系统星座上计算密集型任务的多端口并发通信模型,Bharadwaj Veeravalli,https://arxiv.org/pdf/2601.01031,"Subjects:
Distributed, Parallel, and Cluster Computing (cs.DC); Performance (cs.PF)","Distributed, Parallel, and Cluster Computing (cs.DC),  Performance (cs.PF)"
arXiv:2601.01027,A Platform for Interactive AI Character Experiences,交互式AI角色体验平台,"Rafael Wampfler, Chen Yang, Dillon Elste, Nikola Kovacevic, Philine Witzig, Markus Gross",https://arxiv.org/pdf/2601.01027,"Subjects:
Human-Computer Interaction (cs.HC); Artificial Intelligence (cs.AI); Computation and Language (cs.CL); Graphics (cs.GR)","Human-Computer Interaction (cs.HC),  Artificial Intelligence (cs.AI),  Computation and Language (cs.CL),  Graphics (cs.GR)"
arXiv:2601.01026,Enhanced Leukemic Cell Classification Using Attention-Based CNN and Data Augmentation,基于注意力机制的CNN与数据增强的白血病细胞分类增强,"Douglas Costa Braga, Daniel Oliveira Dantas",https://arxiv.org/pdf/2601.01026,"Subjects:
Computer Vision and Pattern Recognition (cs.CV); Artificial Intelligence (cs.AI); Machine Learning (cs.LG); Software Engineering (cs.SE)","Computer Vision and Pattern Recognition (cs.CV),  Artificial Intelligence (cs.AI),  Machine Learning (cs.LG),  Software Engineering (cs.SE)"
arXiv:2601.01024,ITSELF: Attention Guided Fine-Grained Alignment for Vision-Language Retrieval,ITSELF：基于注意力引导的细粒度对齐的视觉-语言检索,"Tien-Huy Nguyen, Huu-Loc Tran, Thanh Duc Ngo",https://arxiv.org/pdf/2601.01024,"Subjects:
Computer Vision and Pattern Recognition (cs.CV); Artificial Intelligence (cs.AI); Information Retrieval (cs.IR)","Computer Vision and Pattern Recognition (cs.CV),  Artificial Intelligence (cs.AI),  Information Retrieval (cs.IR)"
arXiv:2601.01023,Wireless Dataset Similarity: Measuring Distances in Supervised and Unsupervised Machine Learning,无线数据集相似性：监督与无监督机器学习中的距离度量,"João Morais, Sadjad Alikhani, Akshay Malhotra, Shahab Hamidi-Rad, Ahmed Alkhateeb",https://arxiv.org/pdf/2601.01023,"Subjects:
Machine Learning (cs.LG); Signal Processing (eess.SP)","Machine Learning (cs.LG),  Signal Processing (eess.SP)"
arXiv:2601.01022,Decoupling Amplitude and Phase Attention in Frequency Domain for RGB-Event based Visual Object Tracking,在频域中解耦振幅与相位注意力的RGB-事件视觉目标跟踪,"Shiao Wang, Xiao Wang, Haonan Zhao, Jiarui Xu, Bo Jiang, Lin Zhu, Xin Zhao, Yonghong Tian, Jin Tang",https://arxiv.org/pdf/2601.01022,"Subjects:
Computer Vision and Pattern Recognition (cs.CV); Artificial Intelligence (cs.AI); Machine Learning (cs.LG)","Computer Vision and Pattern Recognition (cs.CV),  Artificial Intelligence (cs.AI),  Machine Learning (cs.LG)"
arXiv:2601.01021,Expanding the Chaos: Neural Operator for Stochastic (Partial) Differential Equations,扩展混沌：用于随机（偏）微分方程的神经算子,"Dai Shi, Lequan Lin, Andi Han, Luke Thompson, José Miguel Hernández-Lobato, Zhiyong Wang, Junbin Gao",https://arxiv.org/pdf/2601.01021,"Subjects:
Machine Learning (cs.LG)",Machine Learning (cs.LG)
arXiv:2601.01016,Improving Variational Autoencoder using Random Fourier Transformation: An Aviation Safety Anomaly Detection Case-Study,基于随机傅里叶变换的变分自编码器改进：航空安全异常检测案例研究,"Ata Akbari Asanjan, Milad Memarzadeh, Bryan Matthews, Nikunj Oza",https://arxiv.org/pdf/2601.01016,"Subjects:
Machine Learning (cs.LG); Artificial Intelligence (cs.AI); Systems and Control (eess.SY)","Machine Learning (cs.LG),  Artificial Intelligence (cs.AI),  Systems and Control (eess.SY)"
arXiv:2601.01015,HyperJoin: LLM-augmented Hypergraph Link Prediction for Joinable Table Discovery,HyperJoin：用于可连接表发现的LLM增强型超图链接预测,"Shiyuan Liu, Jianwei Wang, Xuemin Lin, Lu Qin, Wenjie Zhang, Ying Zhang",https://arxiv.org/pdf/2601.01015,"Subjects:
Computation and Language (cs.CL); Databases (cs.DB)","Computation and Language (cs.CL),  Databases (cs.DB)"
arXiv:2601.01014,Geometric and Dynamic Scaling in Deep Transformers,深度Transformer中的几何与动态缩放,"Haoran Su, Chenyu You",https://arxiv.org/pdf/2601.01014,"Subjects:
Machine Learning (cs.LG); Artificial Intelligence (cs.AI)","Machine Learning (cs.LG),  Artificial Intelligence (cs.AI)"
arXiv:2601.01013,"Carroll Mechanisms: Opportunities, Challenges, and Agenda",Carroll机制：机遇、挑战与议程,"Philip N. Brown, Connor McCormick",https://arxiv.org/pdf/2601.01013,"Subjects:
Computer Science and Game Theory (cs.GT)",Computer Science and Game Theory (cs.GT)
arXiv:2601.01012,Bad News for Couples: Tight Lower Bounds for Fair Division of Indivisible Items,情侣的坏消息：不可分割物品公平分配的紧下界,Max Dupré la Tour,https://arxiv.org/pdf/2601.01012,"Subjects:
Computer Science and Game Theory (cs.GT)",Computer Science and Game Theory (cs.GT)
arXiv:2601.01011,Intention Collapse: Intention-Level Metrics for Reasoning in Language Models,意图坍缩：语言模型中的意图级推理指标,Patricio Vera,https://arxiv.org/pdf/2601.01011,"Subjects:
Computation and Language (cs.CL); Artificial Intelligence (cs.AI)","Computation and Language (cs.CL),  Artificial Intelligence (cs.AI)"
arXiv:2601.01009,Data-Driven Assessment of Concrete Mixture Compositions on Chloride Transport via Standalone Machine Learning Algorithms,基于独立机器学习算法的混凝土混合组成对氯离子传输的数据驱动评估,"Mojtaba Aliasghar-Mamaghani, Mohammadreza Khalafi",https://arxiv.org/pdf/2601.01009,"Subjects:
Machine Learning (cs.LG); Artificial Intelligence (cs.AI); Computational Engineering, Finance, and Science (cs.CE)","Machine Learning (cs.LG),  Artificial Intelligence (cs.AI),  Computational Engineering, Finance, and Science (cs.CE)"
arXiv:2601.01007,On solving nonlinear simultaneous equations arising from the double-exponential Sinc-collocation method for initial value problems,求解初始值问题中双指数Sinc配置法产生的非线性联立方程,Yusaku Yamamoto,https://arxiv.org/pdf/2601.01007,"Subjects:
Numerical Analysis (math.NA)",Numerical Analysis (math.NA)
arXiv:2601.01003,Contractive Diffusion Policies: Robust Action Diffusion via Contractive Score-Based Sampling with Differential Equations,收缩扩散策略：基于收缩得分采样的鲁棒动作扩散与微分方程,"Amin Abyaneh, Charlotte Morissette, Mohamad H. Danesh, Anas El Houssaini, David Meger, Gregory Dudek, Hsiu-Chin Lin",https://arxiv.org/pdf/2601.01003,"Subjects:
Machine Learning (cs.LG); Robotics (cs.RO)","Machine Learning (cs.LG),  Robotics (cs.RO)"
arXiv:2601.01002,Lightweight Channel Attention for Efficient CNNs,轻量级通道注意力机制用于高效卷积神经网络,"Prem Babu Kanaparthi, Tulasi Venkata Sri Varshini Padamata",https://arxiv.org/pdf/2601.01002,"Subjects:
Computer Vision and Pattern Recognition (cs.CV)",Computer Vision and Pattern Recognition (cs.CV)
arXiv:2601.00998,DVGBench: Implicit-to-Explicit Visual Grounding Benchmark in UAV Imagery with Large Vision-Language Models,DVGBench：基于大视觉-语言模型的无人机影像隐式到显式视觉定位基准测试,"Yue Zhou, Jue Chen, Zilun Zhang, Penghui Huang, Ran Ding, Zhentao Zou, PengFei Gao, Yuchen Wei, Ke Li, Xue Yang, Xue Jiang, Hongxin Yang, Jonathan Li",https://arxiv.org/pdf/2601.00998,"Subjects:
Computer Vision and Pattern Recognition (cs.CV)",Computer Vision and Pattern Recognition (cs.CV)
arXiv:2601.00996,VEAT Quantifies Implicit Associations in Text-to-Video Generator Sora and Reveals Challenges in Bias Mitigation,VEAT量化文本到视频生成器Sora中的隐式关联并揭示偏见缓解的挑战,"Yongxu Sun, Michael Saxon, Ian Yang, Anna-Maria Gueorguieva, Aylin Caliskan",https://arxiv.org/pdf/2601.00996,"Subjects:
Computers and Society (cs.CY); Artificial Intelligence (cs.AI)","Computers and Society (cs.CY),  Artificial Intelligence (cs.AI)"
arXiv:2601.00995,Grain-Aware Data Transformations: Type-Level Formal Verification at Zero Computational Cost,粒度感知数据转换：零计算成本的类型级形式验证,Nikos Karayannidis,https://arxiv.org/pdf/2601.00995,"Subjects:
Databases (cs.DB)",Databases (cs.DB)
arXiv:2601.00994,ElecTwit: A Framework for Studying Persuasion in Multi-Agent Social Systems,ElecTwit：研究多智能体社交系统中说服机制的框架,Michael Bao,https://arxiv.org/pdf/2601.00994,"Subjects:
Artificial Intelligence (cs.AI); Computers and Society (cs.CY)","Artificial Intelligence (cs.AI),  Computers and Society (cs.CY)"
arXiv:2601.00993,WildIng: A Wildlife Image Invariant Representation Model for Geographical Domain Shift,WildIng：面向地理领域迁移的野生动物图像不变表示模型,"Julian D. Santamaria, Claudia Isaza, Jhony H. Giraldo",https://arxiv.org/pdf/2601.00993,"Subjects:
Computer Vision and Pattern Recognition (cs.CV); Artificial Intelligence (cs.AI)","Computer Vision and Pattern Recognition (cs.CV),  Artificial Intelligence (cs.AI)"
arXiv:2601.00991,UnrealPose: Leveraging Game Engine Kinematics for Large-Scale Synthetic Human Pose Data,UnrealPose：利用游戏引擎运动学生成大规模合成人体姿态数据,"Joshua Kawaguchi, Saad Manzur, Emily Gao Wang, Maitreyi Sinha, Bryan Vela, Yunxi Wang, Brandon Vela, Wayne B. Hayes",https://arxiv.org/pdf/2601.00991,"Subjects:
Computer Vision and Pattern Recognition (cs.CV)",Computer Vision and Pattern Recognition (cs.CV)
arXiv:2601.00988,Few-Shot Video Object Segmentation in X-Ray Angiography Using Local Matching and Spatio-Temporal Consistency Loss,基于局部匹配与时空一致性损失的X射线血管造影小样本视频目标分割,"Lin Xi, Yingliang Ma, Xiahai Zhuang",https://arxiv.org/pdf/2601.00988,"Subjects:
Computer Vision and Pattern Recognition (cs.CV)",Computer Vision and Pattern Recognition (cs.CV)
arXiv:2601.00986,A Simple Weak Galerkin Finite Element Method for Convection-Diffusion-Reaction Equations on Nonconvex Polytopal Meshes,非凸多面体网格上对流-扩散-反应方程的简单弱Galerkin有限元方法,"Chunmei Wang, Shangyou Zhang",https://arxiv.org/pdf/2601.00986,"Subjects:
Numerical Analysis (math.NA)",Numerical Analysis (math.NA)
arXiv:2601.00981,Simulations of MRI Guided and Powered Ferric Applicators for Tetherless Delivery of Therapeutic Interventions,MRI引导与驱动的无系绳治疗干预铁磁敷料模拟,"Wenhui Chu, Khang Tran, Nikolaos V. Tsekos",https://arxiv.org/pdf/2601.00981,"Subjects:
Robotics (cs.RO); Computer Vision and Pattern Recognition (cs.CV); Systems and Control (eess.SY)","Robotics (cs.RO),  Computer Vision and Pattern Recognition (cs.CV),  Systems and Control (eess.SY)"
arXiv:2601.00979,The cost of cyclic permutations and remainder sums in the Euclidean algorithm,欧几里得算法中循环排列与余数和的代价分析,"Valentin Blomer, Kai-Uwe Bux",https://arxiv.org/pdf/2601.00979,"Subjects:
Data Structures and Algorithms (cs.DS)",Data Structures and Algorithms (cs.DS)
arXiv:2601.00978,From Perception to Symbolic Task Planning: Vision-Language Guided Human-Robot Collaborative Structured Assembly,从感知到符号任务规划：视觉-语言引导的人机协作结构化装配,"Yanyi Chen, Min Deng",https://arxiv.org/pdf/2601.00978,"Subjects:
Robotics (cs.RO)",Robotics (cs.RO)
arXiv:2601.00974,Improving the Graph Challenge Reference Implementation,改进图挑战参考实现,"Inna Voloshchuk, Hayden Jananthan, Chansup Byun, Jeremy Kepner",https://arxiv.org/pdf/2601.00974,"Subjects:
Networking and Internet Architecture (cs.NI); Discrete Mathematics (cs.DM); Performance (cs.PF); Software Engineering (cs.SE)","Networking and Internet Architecture (cs.NI),  Discrete Mathematics (cs.DM),  Performance (cs.PF),  Software Engineering (cs.SE)"
arXiv:2601.00972,Improved decoding algorithms for surface codes under independent bit-flip and phase-flip errors,独立比特翻转与相位翻转错误下表面码的改进解码算法,Louay Bazzi,https://arxiv.org/pdf/2601.00972,"Subjects:
Information Theory (cs.IT); Quantum Physics (quant-ph)","Information Theory (cs.IT),  Quantum Physics (quant-ph)"
arXiv:2601.00970,Zero-shot Forecasting by Simulation Alone,仅通过模拟的零样本预测,"Boris N. Oreshkin, Mayank Jauhari, Ravi Kiran Selvam, Malcolm Wolff, Wenhao Pan, Shankar Ramasubramanian, Kin G. Olivares, Tatiana Konstantinova, Andres Potapczynski, Mengfei Cao, Dmitry Efimov, Michael W. Mahoney, Andrew G. Wilson",https://arxiv.org/pdf/2601.00970,"Subjects:
Machine Learning (cs.LG)",Machine Learning (cs.LG)
arXiv:2601.00969,Value Vision-Language-Action Planning & Search,价值驱动的视觉-语言-动作规划与搜索,"Ali Salamatian, Ke (Steve)Ren, Kieran Pattison, Cyrus Neary",https://arxiv.org/pdf/2601.00969,"Subjects:
Robotics (cs.RO); Artificial Intelligence (cs.AI)","Robotics (cs.RO),  Artificial Intelligence (cs.AI)"
arXiv:2601.00968,Explainability-Guided Defense: Attribution-Aware Model Refinement Against Adversarial Data Attacks,可解释性引导的防御：对抗数据攻击的归因感知模型优化,"Longwei Wang, Mohammad Navid Nayyem, Abdullah Al Rakin, KC Santosh, Chaowei Zhang, Yang Zhou",https://arxiv.org/pdf/2601.00968,"Subjects:
Machine Learning (cs.LG)",Machine Learning (cs.LG)
