id,title,title_zh,authors,url,subjects,subject_split
arXiv:2601.01917,Distorted Distributional Policy Evaluation for Offline Reinforcement Learning,离线强化学习的扭曲分布策略评估,"Ryo Iwaki, Takayuki Osogami",https://arxiv.org/pdf/2601.01917,"Subjects:
Machine Learning (cs.LG)",Machine Learning (cs.LG)
arXiv:2601.01916,Toward Thermodynamic Reservoir Computing: Exploring SHA-256 ASICs as Potential Physical Substrates,热力学储层计算探索：SHA-256 ASIC作为潜在物理基质,"Francisco Angulo de Lafuente, Vladimir Veselov, Richard Goodman",https://arxiv.org/pdf/2601.01916,"Subjects:
Neural and Evolutionary Computing (cs.NE)",Neural and Evolutionary Computing (cs.NE)
arXiv:2601.01915,TalkPhoto: A Versatile Training-Free Conversational Assistant for Intelligent Image Editing,TalkPhoto：智能图像编辑的多功能免训练对话助手,"Yujie Hu, Zecheng Tang, Xu Jiang, Weiqi Li, Jian Zhang",https://arxiv.org/pdf/2601.01915,"Subjects:
Computer Vision and Pattern Recognition (cs.CV)",Computer Vision and Pattern Recognition (cs.CV)
arXiv:2601.01914,Learning Action Hierarchies via Hybrid Geometric Diffusion,通过混合几何扩散学习动作层次,"Arjun Ramesh Kaushik, Nalini K. Ratha, Venu Govindaraju",https://arxiv.org/pdf/2601.01914,"Subjects:
Computer Vision and Pattern Recognition (cs.CV)",Computer Vision and Pattern Recognition (cs.CV)
arXiv:2601.01910,MMP-A*: Multimodal Perception Enhanced Incremental Heuristic Search on Path Planning,MMP-A*：多模态感知增强的路径规划增量启发式搜索,"Minh Hieu Ha, Khanh Ly Ta, Hung Phan, Tung Doan, Tung Dao, Dao Tran, Huynh Thi Thanh Binh",https://arxiv.org/pdf/2601.01910,"Subjects:
Artificial Intelligence (cs.AI)",Artificial Intelligence (cs.AI)
arXiv:2601.01908,Nodule-DETR: A Novel DETR Architecture with Frequency-Channel Attention for Ultrasound Thyroid Nodule Detection,Nodule-DETR：用于超声甲状腺结节检测的频率-通道注意力新型DETR架构,"Jingjing Wang, Qianglin Liu, Zhuo Xiao, Xinning Yao, Bo Liu, Lu Li, Lijuan Niu, Fugen Zhou",https://arxiv.org/pdf/2601.01908,"Subjects:
Computer Vision and Pattern Recognition (cs.CV); Artificial Intelligence (cs.AI)","Computer Vision and Pattern Recognition (cs.CV),  Artificial Intelligence (cs.AI)"
arXiv:2601.01904,Evaluating Feature Dependent Noise in Preference-based Reinforcement Learning,基于偏好的强化学习中特征依赖噪声的评估,"Yuxuan Li, Harshith Reddy Kethireddy, Srijita Das",https://arxiv.org/pdf/2601.01904,"Subjects:
Machine Learning (cs.LG); Artificial Intelligence (cs.AI)","Machine Learning (cs.LG),  Artificial Intelligence (cs.AI)"
arXiv:2601.01903,TT-FSI: Scalable Faithful Shapley Interactions via Tensor-Train,TT-FSI：通过张量训练实现可扩展的忠实夏普利交互,"Ungsik Kim, Suwon Lee",https://arxiv.org/pdf/2601.01903,"Subjects:
Machine Learning (cs.LG)",Machine Learning (cs.LG)
arXiv:2601.01902,Energy Conserving Data Driven Discretizations for Maxwells Equations,麦克斯韦方程的能量守恒数据驱动离散化方法,Victory Obieke,https://arxiv.org/pdf/2601.01902,"Subjects:
Numerical Analysis (math.NA)",Numerical Analysis (math.NA)
arXiv:2601.01901,FedBiCross: A Bi-Level Optimization Framework to Tackle Non-IID Challenges in Data-Free One-Shot Federated Learning on Medical Data,FedBiCross：一种双层优化框架应对医学数据免数据单次联邦学习中的非独立同分布挑战,"Yuexuan Xia, Yinghao Zhang, Yalin Liu, Hong-Ning Dai, Yong Xia",https://arxiv.org/pdf/2601.01901,"Subjects:
Machine Learning (cs.LG)",Machine Learning (cs.LG)
arXiv:2601.01898,Multi-strategy Improved Northern Goshawk Optimization for WSN Coverage Enhancement,多策略改进的北鹰鸮优化算法用于无线传感器网络覆盖增强,"Yiran Tian, Yuanjia Liu",https://arxiv.org/pdf/2601.01898,"Subjects:
Neural and Evolutionary Computing (cs.NE)",Neural and Evolutionary Computing (cs.NE)
arXiv:2601.01897,A Hybrid Architecture for Multi-Stage Claim Document Understanding: Combining Vision-Language Models and Machine Learning for Real-Time Processing,多阶段索赔文档理解的混合架构：结合视觉-语言模型与机器学习实现实时处理,"Lilu Cheng, Jingjun Lu, Yi Xuan Chan, Quoc Khai Nguyen, John Bi, Sean Ho",https://arxiv.org/pdf/2601.01897,"Subjects:
Information Retrieval (cs.IR)",Information Retrieval (cs.IR)
arXiv:2601.01896,Tackling the Inherent Difficulty of Noise Filtering in RAG,应对RAG中噪声过滤固有难题,"Jingyu Liu, Jiaen Lin, Yong Liu",https://arxiv.org/pdf/2601.01896,"Subjects:
Computation and Language (cs.CL); Artificial Intelligence (cs.AI)","Computation and Language (cs.CL),  Artificial Intelligence (cs.AI)"
arXiv:2601.01895,An unstructured second-order subgrid method for the shallow water equations,浅水方程的非结构化二阶子网格方法,"Max Ebstrup Bitsch, Irene Torpe Heilmann, Allan Peter Engsig-Karup, Ole Rene Sørensen, Jesper Grooss",https://arxiv.org/pdf/2601.01895,"Subjects:
Numerical Analysis (math.NA)",Numerical Analysis (math.NA)
arXiv:2601.01894,An explicit scheme for stochastic Allen-Cahn equations with space-time white noise near the sharp interface limit,接近尖锐界面极限的随机Allen-Cahn方程显式方案,"Yingsong Jiang, Chenxu Pang, Xiaojie Wang",https://arxiv.org/pdf/2601.01894,"Subjects:
Numerical Analysis (math.NA)",Numerical Analysis (math.NA)
arXiv:2601.01892,Forget Less by Learning from Parents Through Hierarchical Relationships,通过层级关系从父级学习减少遗忘,"Arjun Ramesh Kaushik, Naresh Kumar Devulapally, Vishnu Suresh Lokhande, Nalini K. Ratha, Venu Govindaraju",https://arxiv.org/pdf/2601.01892,"Subjects:
Computer Vision and Pattern Recognition (cs.CV); Machine Learning (cs.LG)","Computer Vision and Pattern Recognition (cs.CV),  Machine Learning (cs.LG)"
arXiv:2601.01891,"Agentic AI in Remote Sensing: Foundations, Taxonomy, and Emerging Systems",遥感中的智能体AI：基础理论、分类体系与新兴系统,"Niloufar Alipour Talemi, Julia Boone, Fatemeh Afghah",https://arxiv.org/pdf/2601.01891,"Subjects:
Computer Vision and Pattern Recognition (cs.CV)",Computer Vision and Pattern Recognition (cs.CV)
arXiv:2601.01889,Approximation for stochastic time-space fractional cable equations driven by rough noise,粗糙噪声驱动的随机时空分数阶电缆方程近似,"Jiawei He, Jianhua Huang, Fang Su",https://arxiv.org/pdf/2601.01889,"Subjects:
Numerical Analysis (math.NA)",Numerical Analysis (math.NA)
arXiv:2601.01888,SafeLoad: Efficient Admission Control Framework for Identifying Memory-Overloading Queries in Cloud Data Warehouses,SafeLoad：云数据仓库中识别内存过载查询的高效准入控制框架,"Yifan Wu, Yuhan Li, Zhenhua Wang, Zhongle Xie, Dingyu Yang, Ke Chen, Lidan Shou, Bo Tang, Liang Lin, Huan Li, Gang Chen",https://arxiv.org/pdf/2601.01888,"Subjects:
Databases (cs.DB); Machine Learning (cs.LG)","Databases (cs.DB),  Machine Learning (cs.LG)"
arXiv:2601.01887,Safety at One Shot: Patching Fine-Tuned LLMs with A Single Instance,一次即安：通过单个实例修补微调大语言模型,"Jiawen Zhang, Lipeng He, Kejia Chen, Jian Lou, Jian Liu, Xiaohu Yang, Ruoxi Jia",https://arxiv.org/pdf/2601.01887,"Subjects:
Machine Learning (cs.LG); Artificial Intelligence (cs.AI)","Machine Learning (cs.LG),  Artificial Intelligence (cs.AI)"
arXiv:2601.01885,Agentic Memory: Learning Unified Long-Term and Short-Term Memory Management for Large Language Model Agents,智能体记忆：面向大语言模型智能体的统一长期与短期记忆管理学习,"Yi Yu, Liuyi Yao, Yuexiang Xie, Qingquan Tan, Jiaqi Feng, Yaliang Li, Libing Wu",https://arxiv.org/pdf/2601.01885,"Subjects:
Computation and Language (cs.CL)",Computation and Language (cs.CL)
arXiv:2601.01882,"Fixed-Size Dynamic Scale-Free Networks: Modeling, Stationarity, and Resilience",固定规模动态无标度网络：建模、平稳性与弹性,"Yichao Yao, Minyu Feng, Matjaž Perc, Jürgen Kurths",https://arxiv.org/pdf/2601.01882,"Subjects:
Social and Information Networks (cs.SI); Adaptation and Self-Organizing Systems (nlin.AO); Physics and Society (physics.soc-ph)","Social and Information Networks (cs.SI),  Adaptation and Self-Organizing Systems (nlin.AO),  Physics and Society (physics.soc-ph)"
arXiv:2601.01878,Theory Trace Card: Theory-Driven Socio-Cognitive Evaluation of LLMs,理论追踪卡：基于理论驱动的社会认知评估大语言模型,"Farzan Karimi-Malekabadi, Suhaib Abdurahman, Zhivar Sourati, Jackson Trager, Morteza Dehghani",https://arxiv.org/pdf/2601.01878,"Subjects:
Artificial Intelligence (cs.AI); Computers and Society (cs.CY)","Artificial Intelligence (cs.AI),  Computers and Society (cs.CY)"
arXiv:2601.01875,Toward Auditable Neuro-Symbolic Reasoning in Pathology: SQL as an Explicit Trace of Evidence,病理学中可审计的神经符号推理：SQL作为证据的显式追踪,"Kewen Cao, Jianxu Chen, Yongbing Zhang, Ye Zhang, Hongxiao Wang",https://arxiv.org/pdf/2601.01875,"Subjects:
Artificial Intelligence (cs.AI); Quantitative Methods (q-bio.QM)","Artificial Intelligence (cs.AI),  Quantitative Methods (q-bio.QM)"
arXiv:2601.01874,CogFlow: Bridging Perception and Reasoning through Knowledge Internalization for Visual Mathematical Problem Solving,CogFlow：通过知识内化连接感知与推理的视觉数学问题求解,"Shuhang Chen, Yunqiu Xu, Junjie Xie, Aojun Lu, Tao Feng, Zeying Huang, Ning Zhang, Yi Sun, Yi Yang, Hangjie Yuan",https://arxiv.org/pdf/2601.01874,"Subjects:
Computer Vision and Pattern Recognition (cs.CV); Artificial Intelligence (cs.AI)","Computer Vision and Pattern Recognition (cs.CV),  Artificial Intelligence (cs.AI)"
arXiv:2601.01872,CausalNav: A Long-term Embodied Navigation System for Autonomous Mobile Robots in Dynamic Outdoor Scenarios,CausalNav：自主移动机器人在动态户外场景中的长期具身导航系统,"Hongbo Duan, Shangyi Luo, Zhiyuan Deng, Yanbo Chen, Yuanhao Chiang, Yi Liu, Fangming Liu, Xueqian Wang",https://arxiv.org/pdf/2601.01872,"Subjects:
Robotics (cs.RO)",Robotics (cs.RO)
arXiv:2601.01870,Entity-Guided Multi-Task Learning for Infrared and Visible Image Fusion,实体引导的多任务学习用于红外与可见光图像融合,"Wenyu Shao, Hongbo Liu, Yunchuan Ma, Ruili Wang",https://arxiv.org/pdf/2601.01870,"Subjects:
Computer Vision and Pattern Recognition (cs.CV)",Computer Vision and Pattern Recognition (cs.CV)
arXiv:2601.01869,Exact Clique Number Manipulation via Edge Interdiction,通过边拦截实现精确团数操控,"Yi Zhou, Haoyu Jiang, Chenghao Zhu, André Rossi",https://arxiv.org/pdf/2601.01869,"Subjects:
Data Structures and Algorithms (cs.DS)",Data Structures and Algorithms (cs.DS)
arXiv:2601.01868,DermoGPT: Open Weights and Open Data for Morphology-Grounded Dermatological Reasoning MLLMs,DermoGPT：基于形态学的皮肤病学推理大语言模型的开放权重与开放数据,"Jinghan Ru, Siyuan Yan, Yuguo Yin, Yuexian Zou, Zongyuan Ge",https://arxiv.org/pdf/2601.01868,"Subjects:
Computation and Language (cs.CL)",Computation and Language (cs.CL)
arXiv:2601.01865,RRNet: Configurable Real-Time Video Enhancement with Arbitrary Local Lighting Variations,RRNet：可配置的实时视频增强方法应对任意局部光照变化,"Wenlong Yang, Canran Jin, Weihang Yuan, Chao Wang, Lifeng Sun",https://arxiv.org/pdf/2601.01865,"Subjects:
Computer Vision and Pattern Recognition (cs.CV)",Computer Vision and Pattern Recognition (cs.CV)
arXiv:2601.01862,Judging with Personality and Confidence: A Study on Personality-Conditioned LLM Relevance Assessment,基于个性与自信的判断：关于个性条件化大语言模型相关性评估的研究,"Nuo Chen, Hanpei Fang, Piaohong Wang, Jiqun Liu, Tetsuya Sakai, Xiao-Ming Wu",https://arxiv.org/pdf/2601.01862,"Subjects:
Computation and Language (cs.CL); Information Retrieval (cs.IR)","Computation and Language (cs.CL),  Information Retrieval (cs.IR)"
arXiv:2601.01860,High-Order Epistasis Detection Using Factorization Machine with Quadratic Optimization Annealing and MDR-Based Evaluation,使用二次优化退火和MDR评估的因子分解机进行高阶上位性检测,"Shuta Kikuchi, Shu Tanaka",https://arxiv.org/pdf/2601.01860,"Subjects:
Machine Learning (cs.LG); Quantum Physics (quant-ph)","Machine Learning (cs.LG),  Quantum Physics (quant-ph)"
arXiv:2601.01857,Jenius Agent: Towards Experience-Driven Accuracy Optimization in Real-World Scenarios,Jenius Agent：面向现实场景经验驱动的准确性优化,"Defei Xia, Bingfeng Pi, Shenbin Zhang, Song Hua, Yunfei Wei, Lei Zuo",https://arxiv.org/pdf/2601.01857,"Subjects:
Artificial Intelligence (cs.AI)",Artificial Intelligence (cs.AI)
arXiv:2601.01856,GCR: Geometry-Consistent Routing for Task-Agnostic Continual Anomaly Detection,GCR：几何一致路由用于任务无关的持续异常检测,"Joongwon Chae, Lihui Luo, Yang Liu, Runming Wang, Dongmei Yu, Zeming Liang, Xi Yuan, Dayan Zhang, Zhenglin Chen, Peiwu Qin, Ilmoon Chae",https://arxiv.org/pdf/2601.01856,"Subjects:
Computer Vision and Pattern Recognition (cs.CV)",Computer Vision and Pattern Recognition (cs.CV)
arXiv:2601.01847,ESGaussianFace: Emotional and Stylized Audio-Driven Facial Animation via 3D Gaussian Splatting,ESGaussianFace：通过3D高斯点绘实现情感化与风格化的音频驱动面部动画,"Chuhang Ma, Shuai Tan, Ye Pan, Jiaolong Yang, Xin Tong",https://arxiv.org/pdf/2601.01847,"Subjects:
Computer Vision and Pattern Recognition (cs.CV)",Computer Vision and Pattern Recognition (cs.CV)
arXiv:2601.01844,Clinical Knowledge Graph Construction and Evaluation with Multi-LLMs via Retrieval-Augmented Generation,基于检索增强生成的多大语言模型临床知识图谱构建与评估,"Udiptaman Das, Krishnasai B. Atmakuri, Duy Ho, Chi Lee, Yugyung Lee",https://arxiv.org/pdf/2601.01844,"Subjects:
Artificial Intelligence (cs.AI)",Artificial Intelligence (cs.AI)
arXiv:2601.01842,Towards Automated Lexicography: Generating and Evaluating Definitions for Learner's Dictionaries,迈向自动化词典编纂：学习者词典定义的生成与评估,"Yusuke Ide, Adam Nohejl, Joshua Tanner, Hitomi Yanaka, Christopher Lindsay, Taro Watanabe",https://arxiv.org/pdf/2601.01842,"Subjects:
Computation and Language (cs.CL)",Computation and Language (cs.CL)
arXiv:2601.01841,Improved Approximation Algorithms for the Multiple-Depot Split Delivery Vehicle Routing Problem,多仓库拆单配送车辆路径问题的改进近似算法,"Jingyang Zhao, Yonghang Su, Mingyu Xiao",https://arxiv.org/pdf/2601.01841,"Subjects:
Data Structures and Algorithms (cs.DS)",Data Structures and Algorithms (cs.DS)
arXiv:2601.01840,Tackling Resource-Constrained and Data-Heterogeneity in Federated Learning with Double-Weight Sparse Pack,通过双权重稀疏打包应对联邦学习中的资源约束与数据异质性,"Qiantao Yang, Liquan Chen, Mingfu Xue, Songze Li",https://arxiv.org/pdf/2601.01840,"Subjects:
Machine Learning (cs.LG); Distributed, Parallel, and Cluster Computing (cs.DC)","Machine Learning (cs.LG),  Distributed, Parallel, and Cluster Computing (cs.DC)"
arXiv:2601.01839,The Machine Learning Canvas: Empirical Findings on Why Strategy Matters More Than AI Code Generation,机器学习画布：关于策略为何比AI代码生成更重要的实证研究,Martin Prause,https://arxiv.org/pdf/2601.01839,"Subjects:
Software Engineering (cs.SE); Artificial Intelligence (cs.AI)","Software Engineering (cs.SE),  Artificial Intelligence (cs.AI)"
arXiv:2601.01838,Enhanced Open-Source NWDAF for Event-Driven Analytics in 5G Networks,增强型开源NWDAF用于5G网络的事件驱动分析,"Henok Daniel, Omar Alhussein, Jie Liang, Cheng Li, Ernesto Damiani",https://arxiv.org/pdf/2601.01838,"Subjects:
Networking and Internet Architecture (cs.NI)",Networking and Internet Architecture (cs.NI)
arXiv:2601.01836,COMPASS: A Framework for Evaluating Organization-Specific Policy Alignment in LLMs,COMPASS：评估组织特定政策对齐的大语言模型框架,"Dasol Choi, DongGeon Lee, Brigitta Jesica Kartono, Helena Berndt, Taeyoun Kwon, Joonwon Jang, Haon Park, Hwanjo Yu, Minsuk Kahng",https://arxiv.org/pdf/2601.01836,"Subjects:
Artificial Intelligence (cs.AI); Computers and Society (cs.CY)","Artificial Intelligence (cs.AI),  Computers and Society (cs.CY)"
arXiv:2601.01835,RSwinV2-MD: An Enhanced Residual SwinV2 Transformer for Monkeypox Detection from Skin Images,RSwinV2-MD：改进的残差SwinV2变换器用于皮肤图像猴痘检测,"Rashid Iqbal, Saddam Hussain Khan (Artificial Intelligence Lab, Department of Computer Systems Engineering, University of Engineering and Applied Sciences (UEAS), Swat 19060, Pakistan)",https://arxiv.org/pdf/2601.01835,"Subjects:
Computer Vision and Pattern Recognition (cs.CV); Artificial Intelligence (cs.AI)","Computer Vision and Pattern Recognition (cs.CV),  Artificial Intelligence (cs.AI)"
arXiv:2601.01833,FAROS: Robust Federated Learning with Adaptive Scaling against Backdoor Attacks,FAROS：通过自适应缩放实现鲁棒联邦学习抵御后门攻击,"Chenyu Hu, Qiming Hu, Sinan Chen, Nianyu Li, Mingyue Zhang, Jialong Li",https://arxiv.org/pdf/2601.01833,"Subjects:
Machine Learning (cs.LG)",Machine Learning (cs.LG)
arXiv:2601.01832,Yukthi Opus: A Multi-Chain Hybrid Metaheuristic for Large-Scale NP-Hard Optimization,Yukthi Opus：面向大规模NP难优化的多链混合元启发式算法,"SB Danush Vikraman, Hannah Abagail, Prasanna Kesavraj, Gajanan V Honnavar",https://arxiv.org/pdf/2601.01832,"Subjects:
Neural and Evolutionary Computing (cs.NE); Artificial Intelligence (cs.AI)","Neural and Evolutionary Computing (cs.NE),  Artificial Intelligence (cs.AI)"
arXiv:2601.01831,ARIES: A Scalable Multi-Agent Orchestration Framework for Real-Time Epidemiological Surveillance and Outbreak Monitoring,ARIES：面向实时流行病学监测与疫情监控的可扩展多智能体编排框架,"Aniket Wattamwar, Sampson Akwafuo",https://arxiv.org/pdf/2601.01831,"Subjects:
Multiagent Systems (cs.MA); Artificial Intelligence (cs.AI); Information Retrieval (cs.IR); Software Engineering (cs.SE)","Multiagent Systems (cs.MA),  Artificial Intelligence (cs.AI),  Information Retrieval (cs.IR),  Software Engineering (cs.SE)"
arXiv:2601.01829,RealPDEBench: A Benchmark for Complex Physical Systems with Real-World Data,RealPDEBench：一个用于复杂物理系统的基于真实世界数据的基准,"Peiyan Hu, Haodong Feng, Hongyuan Liu, Tongtong Yan, Wenhao Deng, Tianrun Gao, Rong Zheng, Haoren Zheng, Chenglei Yu, Chuanrui Wang, Kaiwen Li, Zhi-Ming Ma, Dezhi Zhou, Xingcai Lu, Dixia Fan, Tailin Wu",https://arxiv.org/pdf/2601.01829,"Subjects:
Machine Learning (cs.LG)",Machine Learning (cs.LG)
arXiv:2601.01828,Emergent Introspective Awareness in Large Language Models,大型语言模型中的涌现内省意识,Jack Lindsey,https://arxiv.org/pdf/2601.01828,"Subjects:
Computation and Language (cs.CL); Artificial Intelligence (cs.AI)","Computation and Language (cs.CL),  Artificial Intelligence (cs.AI)"
arXiv:2601.01827,Aspect Extraction from E-Commerce Product and Service Reviews,从电子商务产品和服务评论中进行方面抽取,"Valiant Lance D. Dionela, Fatima Kriselle S. Dy, Robin James M. Hombrebueno, Aaron Rae M. Nicolas, Charibeth K. Cheng, Raphael W. Gonda",https://arxiv.org/pdf/2601.01827,"Subjects:
Computation and Language (cs.CL); Machine Learning (cs.LG)","Computation and Language (cs.CL),  Machine Learning (cs.LG)"
arXiv:2601.01825,CSCBench: A PVC Diagnostic Benchmark for Commodity Supply Chain Reasoning,CSCBench：一个用于商品供应链推理的PVC诊断基准,"Yaxin Cui, Yuanqiang Zeng, Jiapeng Yan, Keling Lin, Kai Ji, Jianhui Zeng, Sheng Zhang, Xin Luo, Binzhu Su, Chaolai Shen, Jiahao Yu",https://arxiv.org/pdf/2601.01825,"Subjects:
Computation and Language (cs.CL)",Computation and Language (cs.CL)
arXiv:2601.01822,DisCo-FLoc: Using Dual-Level Visual-Geometric Contrasts to Disambiguate Depth-Aware Visual Floorplan Localization,DisCo-FLoc：利用双层视觉几何对比来消除深度感知的视觉平面图定位歧义,"Shiyong Meng, Tao Zou, Bolei Chen, Chaoxu Mu, Jianxin Wang",https://arxiv.org/pdf/2601.01822,"Subjects:
Robotics (cs.RO); Computer Vision and Pattern Recognition (cs.CV)","Robotics (cs.RO),  Computer Vision and Pattern Recognition (cs.CV)"
arXiv:2601.01818,Robust Egocentric Visual Attention Prediction Through Language-guided Scene Context-aware Learning,通过语言引导的场景上下文感知学习实现鲁棒的以自我为中心的视觉注意力预测,"Sungjune Park, Hongda Mao, Qingshuang Chen, Yong Man Ro, Yelin Kim",https://arxiv.org/pdf/2601.01818,"Subjects:
Computer Vision and Pattern Recognition (cs.CV)",Computer Vision and Pattern Recognition (cs.CV)
arXiv:2601.01816,Admissibility Alignment,可接受性对齐,Chris Duffey,https://arxiv.org/pdf/2601.01816,"Subjects:
Artificial Intelligence (cs.AI)",Artificial Intelligence (cs.AI)
arXiv:2601.01808,Sharp inverse statements for kernel approximation: Superconvergence and saturation,核逼近的精确逆命题：超收敛与饱和,Tizian Wenzel,https://arxiv.org/pdf/2601.01808,"Subjects:
Numerical Analysis (math.NA)",Numerical Analysis (math.NA)
arXiv:2601.01807,Adaptive Hybrid Optimizer based Framework for Lumpy Skin Disease Identification,基于自适应混合优化器的用于皮肤病变识别的框架,"Ubaidullah, Muhammad Abid Hussain, Mohsin Raza Jafri, Rozi Khan, Moid Sandhu, Abd Ullah Khan, Hyundong Shin",https://arxiv.org/pdf/2601.01807,"Subjects:
Computer Vision and Pattern Recognition (cs.CV); Artificial Intelligence (cs.AI)","Computer Vision and Pattern Recognition (cs.CV),  Artificial Intelligence (cs.AI)"
arXiv:2601.01804,Causality-Aware Temporal Projection for Video Understanding in Video-LLMs,视频-LLMs中基于因果感知的时间投影视频理解,"Zhengjian Kang, Qi Chen, Rui Liu, Kangtong Mo, Xingyu Zhang, Xiaoyu Deng, Ye Zhang",https://arxiv.org/pdf/2601.01804,"Subjects:
Computer Vision and Pattern Recognition (cs.CV)",Computer Vision and Pattern Recognition (cs.CV)
arXiv:2601.01803,Moments Matter:Stabilizing Policy Optimization using Return Distributions,时刻很重要：通过回报分布稳定策略优化,"Dennis Jabs, Aditya Mohan, Marius Lindauer",https://arxiv.org/pdf/2601.01803,"Subjects:
Machine Learning (cs.LG); Artificial Intelligence (cs.AI)","Machine Learning (cs.LG),  Artificial Intelligence (cs.AI)"
arXiv:2601.01802,PsychEval: A Multi-Session and Multi-Therapy Benchmark for High-Realism and Comprehensive AI Psychological Counselor,PsychEval：一个高真实感和全面的心理咨询AI的多会话多疗法基准,"Qianjun Pan, Junyi Wang, Jie Zhou, Yutao Yang, Junsong Li, Kaiyin Xu, Yougen Zhou, Yihan Li, Jingyuan Zhao, Qin Chen, Ningning Zhou, Kai Chen, Liang He",https://arxiv.org/pdf/2601.01802,"Subjects:
Artificial Intelligence (cs.AI)",Artificial Intelligence (cs.AI)
arXiv:2601.01800,"Sparse Threats, Focused Defense: Criticality-Aware Robust Reinforcement Learning for Safe Autonomous Driving",稀疏威胁与聚焦防御：面向安全自动驾驶的关键性感知鲁棒强化学习,"Qi Wei, Junchao Fan, Zhao Yang, Jianhua Wang, Jingkai Mao, Xiaolin Chang",https://arxiv.org/pdf/2601.01800,"Subjects:
Machine Learning (cs.LG); Artificial Intelligence (cs.AI)","Machine Learning (cs.LG),  Artificial Intelligence (cs.AI)"
arXiv:2601.01798,VerLM: Explaining Face Verification Using Natural Language,VerLM：使用自然语言解释人脸识别,"Syed Abdul Hannan, Hazim Bukhari, Thomas Cantalapiedra, Eman Ansar, Massa Baali, Rita Singh, Bhiksha Raj",https://arxiv.org/pdf/2601.01798,"Subjects:
Computer Vision and Pattern Recognition (cs.CV); Artificial Intelligence (cs.AI)","Computer Vision and Pattern Recognition (cs.CV),  Artificial Intelligence (cs.AI)"
arXiv:2601.01795,Information Flow in geophysical systems,地球物理系统中的信息流,Peter Jan van Leeuwen,https://arxiv.org/pdf/2601.01795,"Subjects:
Information Theory (cs.IT)",Information Theory (cs.IT)
arXiv:2601.01793,Distributed Federated Learning by Alternating Periods of Training,通过交替训练周期的分布式联邦学习,"Shamik Bhattacharyya, Rachel Kalpana Kalaimani",https://arxiv.org/pdf/2601.01793,"Subjects:
Machine Learning (cs.LG); Systems and Control (eess.SY)","Machine Learning (cs.LG),  Systems and Control (eess.SY)"
arXiv:2601.01792,HyperCLOVA X 8B Omni,HyperCLOVA X 8B Omni,NAVER Cloud HyperCLOVA X Team,https://arxiv.org/pdf/2601.01792,"Subjects:
Machine Learning (cs.LG); Artificial Intelligence (cs.AI); Computation and Language (cs.CL); Sound (cs.SD)","Machine Learning (cs.LG),  Artificial Intelligence (cs.AI),  Computation and Language (cs.CL),  Sound (cs.SD)"
arXiv:2601.01789,Information Gradient for Directed Acyclic Graphs: A Score-based Framework for End-to-End Mutual Information Maximization,有向无环图的信息梯度：基于评分的端到端互信息最大化框架,Tadashi Wadayama,https://arxiv.org/pdf/2601.01789,"Subjects:
Information Theory (cs.IT)",Information Theory (cs.IT)
arXiv:2601.01787,pMSz: A Distributed Parallel Algorithm for Correcting Extrema and Morse Smale Segmentations in Lossy Compression,pMSz：一种分布式并行算法用于在有损压缩中校正极值和Morse-Smale分割,"Yuxiao Li, Mingze Xia, Xin Liang, Bei Wang, Robert Underwood, Sheng Di, Hemant Sharma, Dishant Beniwal, Franck Cappello, Hanqi Guo",https://arxiv.org/pdf/2601.01787,"Subjects:
Distributed, Parallel, and Cluster Computing (cs.DC)","Distributed, Parallel, and Cluster Computing (cs.DC)"
arXiv:2601.01786,UnPII: Unlearning Personally Identifiable Information with Quantifiable Exposure Risk,UnPII：通过可量化暴露风险的个人身份信息遗忘,"Intae Jeon, Yujeong Kwon, Hyungjoon Koo",https://arxiv.org/pdf/2601.01786,"Subjects:
Machine Learning (cs.LG); Cryptography and Security (cs.CR)","Machine Learning (cs.LG),  Cryptography and Security (cs.CR)"
