id,title,title_zh,authors,url,subjects,subject_split
arXiv:2601.01488,Four Quadrants of Difficulty: A Simple Categorisation and its Limits,困难的四个象限：一种简单分类及其局限性,"Vanessa Toborek, Sebastian Müller, Christian Bauckhage",https://arxiv.org/pdf/2601.01488,"Subjects:
Computation and Language (cs.CL); Machine Learning (cs.LG)","Computation and Language (cs.CL),  Machine Learning (cs.LG)"
arXiv:2601.01487,DeepInv: A Novel Self-supervised Learning Approach for Fast and Accurate Diffusion Inversion,DeepInv：一种用于快速准确扩散反演的新型自监督学习方法,"Ziyue Zhang, Luxi Lin, Xiaolin Hu, Chao Chang, HuaiXi Wang, Yiyi Zhou, Rongrong Ji",https://arxiv.org/pdf/2601.01487,"Subjects:
Computer Vision and Pattern Recognition (cs.CV); Artificial Intelligence (cs.AI)","Computer Vision and Pattern Recognition (cs.CV),  Artificial Intelligence (cs.AI)"
arXiv:2601.01485,Higher-Order Domain Generalization in Magnetic Resonance-Based Assessment of Alzheimer's Disease,基于磁共振的阿尔茨海默病评估中的高阶领域泛化,"Zobia Batool, Diala Lteif, Vijaya B. Kolachalama, Huseyin Ozkan, Erchan Aptoula",https://arxiv.org/pdf/2601.01485,"Subjects:
Computer Vision and Pattern Recognition (cs.CV)",Computer Vision and Pattern Recognition (cs.CV)
arXiv:2601.01484,SGD-Based Knowledge Distillation with Bayesian Teachers: Theory and Guidelines,基于SGD的贝叶斯教师知识蒸馏：理论与指导,"Itai Morad, Nir Shlezinger, Yonina C. Eldar",https://arxiv.org/pdf/2601.01484,"Subjects:
Machine Learning (cs.LG)",Machine Learning (cs.LG)
arXiv:2601.01483,Unified Generation and Self-Verification for Vision-Language Models via Advantage Decoupled Preference Optimization,通过优势解耦偏好优化实现视觉-语言模型的统一生成与自验证,"Xinyu Qiu, Heng Jia, Zhengwen Zeng, Shuheng Shen, Changhua Meng, Yi Yang, Linchao Zhu",https://arxiv.org/pdf/2601.01483,"Subjects:
Computer Vision and Pattern Recognition (cs.CV)",Computer Vision and Pattern Recognition (cs.CV)
arXiv:2601.01481,Robust Ship Detection and Tracking Using Modified ViBe and Backwash Cancellation Algorithm,使用改进ViBe和回流消除算法的鲁棒船舶检测与跟踪,"Mohammad Hassan Saghafi, Seyed Majid Noorhosseini, Seyed Abolfazl Seyed Javadein, Hadi Khalili",https://arxiv.org/pdf/2601.01481,"Subjects:
Computer Vision and Pattern Recognition (cs.CV)",Computer Vision and Pattern Recognition (cs.CV)
arXiv:2601.01477,Can Legislation Be Made Machine-Readable in PROLEG?,PROLEG中法律能否实现机器可读？,"May-Myo Zin, Sabine Wehnert, Yuntao Kong, Ha-Thanh Nguyen, Wachara Fungwacharakorn, Jieying Xue, Michał Araszkiewicz, Randy Goebel, Ken Satoh, Le-Minh Nguyen",https://arxiv.org/pdf/2601.01477,"Subjects:
Computation and Language (cs.CL)",Computation and Language (cs.CL)
arXiv:2601.01475,"Multi-Subspace Multi-Modal Modeling for Diffusion Models: Estimation, Convergence and Mixture of Experts",扩散模型的多子空间多模态建模：估计、收敛与专家混合,"Ruofeng Yang, Yongcan Li, Bo Jiang, Cheng Chen, Shuai Li",https://arxiv.org/pdf/2601.01475,"Subjects:
Machine Learning (cs.LG)",Machine Learning (cs.LG)
arXiv:2601.01473,Accelerating Storage-Based Training for Graph Neural Networks,图神经网络存储训练加速方法,"Myung-Hwan Jang, Jeong-Min Park, Yunyong Ko, Sang-Wook Kim",https://arxiv.org/pdf/2601.01473,"Subjects:
Machine Learning (cs.LG); Artificial Intelligence (cs.AI); Databases (cs.DB)","Machine Learning (cs.LG),  Artificial Intelligence (cs.AI),  Databases (cs.DB)"
arXiv:2601.01472,Tapes as Stochastic Matrices of String Diagrams,作为字符串图示随机矩阵的磁带,"Filippo Bonchi, Cipriano Junior Cioffo",https://arxiv.org/pdf/2601.01472,"Subjects:
Logic in Computer Science (cs.LO); Category Theory (math.CT)","Logic in Computer Science (cs.LO),  Category Theory (math.CT)"
arXiv:2601.01467,A construction of an optimal base for conditional attribute and attributional condition implications in triadic contexts,三元语境中条件属性和属性条件蕴含的最优基构建,"Romuald Kwessy Mouona, Blaise Blériot Koguep Njionou, Etienne Romuald Temgoua Alomo, Rokia Missaoui, Leonard Kwuida",https://arxiv.org/pdf/2601.01467,"Subjects:
Artificial Intelligence (cs.AI)",Artificial Intelligence (cs.AI)
arXiv:2601.01465,Leveraging Flatness to Improve Information-Theoretic Generalization Bounds for SGD,利用平坦性改进SGD的信息论泛化界,"Ze Peng, Jian Zhang, Yisen Wang, Lei Qi, Yinghuan Shi, Yang Gao",https://arxiv.org/pdf/2601.01465,"Subjects:
Machine Learning (cs.LG)",Machine Learning (cs.LG)
arXiv:2601.01462,Convergence Analysis of PINNs for Fractional Diffusion Equations in Bounded Domains,有界域分数扩散方程物理信息神经网络的收敛性分析,"Elie Abdo, Lihui Chai, Ruimeng Hu, Xu Yang",https://arxiv.org/pdf/2601.01462,"Subjects:
Numerical Analysis (math.NA)",Numerical Analysis (math.NA)
arXiv:2601.01461,Bridging the gap: A comparative exploration of Speech-LLM and end-to-end architecture for multilingual conversational ASR,弥合差距：语音大语言模型与端到端架构在多语言对话ASR中的比较探索,"Yuxiang Mei, Dongxing Xu, Jiaen Liang, Yanhua Long",https://arxiv.org/pdf/2601.01461,"Subjects:
Computation and Language (cs.CL); Sound (cs.SD); Audio and Speech Processing (eess.AS)","Computation and Language (cs.CL),  Sound (cs.SD),  Audio and Speech Processing (eess.AS)"
arXiv:2601.01460,Domain Adaptation of Carotid Ultrasound Images using Generative Adversarial Network,基于生成对抗网络的颈动脉超声图像领域自适应,"Mohd Usama, Belal Ahmad, Christer Gronlund, Faleh Menawer R Althiyabi",https://arxiv.org/pdf/2601.01460,"Subjects:
Computer Vision and Pattern Recognition (cs.CV)",Computer Vision and Pattern Recognition (cs.CV)
arXiv:2601.01459,OV-InstructTTS: Towards Open-Vocabulary Instruct Text-to-Speech,OV-InstructTTS：迈向开放词汇指令文本到语音,"Yong Ren, Jiangyan Yi, Jianhua Tao, Haiyang Sun, Zhengqi Wen, Hao Gu, Le Xu, Ye Bai",https://arxiv.org/pdf/2601.01459,"Subjects:
Sound (cs.SD); Audio and Speech Processing (eess.AS)","Sound (cs.SD),  Audio and Speech Processing (eess.AS)"
arXiv:2601.01457,"Language as Prior, Vision as Calibration: Metric Scale Recovery for Monocular Depth Estimation",语言作为先验，视觉作为校准：单目深度估计的度量尺度恢复,"Mingxing Zhan, Li Zhang, Beibei Wang, Yingjie Wang, Zenglin Shi",https://arxiv.org/pdf/2601.01457,"Subjects:
Computer Vision and Pattern Recognition (cs.CV)",Computer Vision and Pattern Recognition (cs.CV)
arXiv:2601.01456,Rethinking Multimodal Few-Shot 3D Point Cloud Segmentation: From Fused Refinement to Decoupled Arbitration,重新思考多模态少样本三维点云分割：从融合优化到解耦仲裁,"Wentao Bian, Fenglei Xu",https://arxiv.org/pdf/2601.01456,"Subjects:
Computer Vision and Pattern Recognition (cs.CV); Artificial Intelligence (cs.AI); Machine Learning (cs.LG)","Computer Vision and Pattern Recognition (cs.CV),  Artificial Intelligence (cs.AI),  Machine Learning (cs.LG)"
arXiv:2601.01455,Security in the Era of Perceptive Networks: A Comprehensive Taxonomic Framework for Integrated Sensing and Communication Security,感知网络时代的安全：集成感知与通信安全的综合分类框架,"Chandra Thapa, Surya Nepal",https://arxiv.org/pdf/2601.01455,"Subjects:
Cryptography and Security (cs.CR)",Cryptography and Security (cs.CR)
arXiv:2601.01454,PartImageNet++ Dataset: Enhancing Visual Models with High-Quality Part Annotations,PartImageNet++数据集：通过高质量部件标注增强视觉模型,"Xiao Li, Zilong Liu, Yining Liu, Zhuhong Li, Na Dong, Sitian Qin, Xiaolin Hu",https://arxiv.org/pdf/2601.01454,"Subjects:
Computer Vision and Pattern Recognition (cs.CV)",Computer Vision and Pattern Recognition (cs.CV)
arXiv:2601.01452,Bayesian Subspace Gradient Estimation for Zeroth-Order Optimization of Large Language Models,用于大语言模型零阶优化的贝叶斯子空间梯度估计,"Jian Feng, Zhihong Huang",https://arxiv.org/pdf/2601.01452,"Subjects:
Machine Learning (cs.LG); Artificial Intelligence (cs.AI)","Machine Learning (cs.LG),  Artificial Intelligence (cs.AI)"
arXiv:2601.01449,Segmentation and Processing of German Court Decisions from Open Legal Data,德国法院判决的分割与处理：基于开放法律数据,"Harshil Darji, Martin Heckelmann, Christina Kratsch, Gerard de Melo",https://arxiv.org/pdf/2601.01449,"Subjects:
Computation and Language (cs.CL); Information Retrieval (cs.IR); Machine Learning (cs.LG)","Computation and Language (cs.CL),  Information Retrieval (cs.IR),  Machine Learning (cs.LG)"
arXiv:2601.01448,Adaptive Diffusion-based Augmentation for Recommendation,基于自适应扩散的推荐增强方法,"Na Li, Fanghui Sun, Yan Zou, Yangfu Zhu, Xiatian Zhu, Ying Ma",https://arxiv.org/pdf/2601.01448,"Subjects:
Information Retrieval (cs.IR)",Information Retrieval (cs.IR)
arXiv:2601.01446,iFlip: Iterative Feedback-driven Counterfactual Example Refinement,iFlip：迭代反馈驱动的反事实示例优化,"Yilong Wang, Qianli Wang, Nils Feldhus",https://arxiv.org/pdf/2601.01446,"Subjects:
Computation and Language (cs.CL); Machine Learning (cs.LG)","Computation and Language (cs.CL),  Machine Learning (cs.LG)"
arXiv:2601.01444,"RadixGraph: A Fast, Space-Optimized Data Structure for Dynamic Graph Storage (Extended Version)",RadixGraph：一种快速且空间优化的动态图存储数据结构（扩展版）,"Haoxuan Xie, Junfeng Liu, Siqiang Luo, Kai Wang",https://arxiv.org/pdf/2601.01444,"Subjects:
Databases (cs.DB)",Databases (cs.DB)
arXiv:2601.01439,In defense of the two-stage framework for open-set domain adaptive semantic segmentation,论两阶段框架在开放集域适应语义分割中的有效性,"Wenqi Ren, Weijie Wang, Meng Zheng, Ziyan Wu, Yang Tang, Zhun Zhong, Nicu Sebe",https://arxiv.org/pdf/2601.01439,"Subjects:
Computer Vision and Pattern Recognition (cs.CV)",Computer Vision and Pattern Recognition (cs.CV)
arXiv:2601.01438,Online Estimation and Manipulation of Articulated Objects,关节物体的在线估计与操作,"Russell Buchanan, Adrian Röfer, João Moura, Abhinav Valada, Sethu Vijayakumar",https://arxiv.org/pdf/2601.01438,"Subjects:
Robotics (cs.RO); Artificial Intelligence (cs.AI)","Robotics (cs.RO),  Artificial Intelligence (cs.AI)"
arXiv:2601.01436,Bithoven: Formal Safety for Expressive Bitcoin Smart Contracts,Bithoven：面向表达性比特币智能合约的形式化安全验证,"Hyunhum Cho, Ik Rae Jeong",https://arxiv.org/pdf/2601.01436,"Subjects:
Cryptography and Security (cs.CR); Programming Languages (cs.PL)","Cryptography and Security (cs.CR),  Programming Languages (cs.PL)"
arXiv:2601.01433,Adaptive finite difference methods for the Willmore flow: mesh redistribution algorithm and tangential velocity approach,Willmore流的自适应有限差分方法：网格再分布算法与切向速度方法,"Zhenghua Duan, Meng Li",https://arxiv.org/pdf/2601.01433,"Subjects:
Numerical Analysis (math.NA)",Numerical Analysis (math.NA)
arXiv:2601.01431,EdgeNeRF: Edge-Guided Regularization for Neural Radiance Fields from Sparse Views,EdgeNeRF：基于边缘引导正则化的稀疏视角神经辐射场,"Weiqi Yu, Yiyang Yao, Lin He, Jianming Lv",https://arxiv.org/pdf/2601.01431,"Subjects:
Computer Vision and Pattern Recognition (cs.CV)",Computer Vision and Pattern Recognition (cs.CV)
arXiv:2601.01430,Context-Aware Information Transfer via Digital Semantic Communication in UAV-Based Networks,基于无人机网络的数字语义通信中的上下文感知信息传输,"Poorvi Joshi, Mohan Gurusamy (National University of Singapore)",https://arxiv.org/pdf/2601.01430,"Subjects:
Systems and Control (eess.SY)",Systems and Control (eess.SY)
arXiv:2601.01426,SWE-Lego: Pushing the Limits of Supervised Fine-tuning for Software Issue Resolving,SWE-Lego：通过监督微调突破软件问题解决的极限,"Chaofan Tao, Jierun Chen, Yuxin Jiang, Kaiqi Kou, Shaowei Wang, Ruoyu Wang, Xiaohui Li, Sidi Yang, Yiming Du, Jianbo Dai, Zhiming Mao, Xinyu Wang, Lifeng Shang, Haoli Bai",https://arxiv.org/pdf/2601.01426,"Subjects:
Software Engineering (cs.SE); Computation and Language (cs.CL)","Software Engineering (cs.SE),  Computation and Language (cs.CL)"
arXiv:2601.01425,DreamID-V:Bridging the Image-to-Video Gap for High-Fidelity Face Swapping via Diffusion Transformer,DreamID-V：通过扩散变换器弥合图像到视频的高保真换脸,"Xu Guo, Fulong Ye, Xinghui Li, Pengqi Tu, Pengze Zhang, Qichao Sun, Songtao Zhao, Xiangwang Hou, Qian He",https://arxiv.org/pdf/2601.01425,"Subjects:
Computer Vision and Pattern Recognition (cs.CV)",Computer Vision and Pattern Recognition (cs.CV)
arXiv:2601.01424,Unveiling the Heart-Brain Connection: An Analysis of ECG in Cognitive Performance,揭示心脑连接：心电图在认知表现中的分析,"Akshay Sasi, Malavika Pradeep, Nusaibah Farrukh, Rahul Venugopal, Elizabeth Sherly",https://arxiv.org/pdf/2601.01424,"Subjects:
Machine Learning (cs.LG); Neurons and Cognition (q-bio.NC)","Machine Learning (cs.LG),  Neurons and Cognition (q-bio.NC)"
arXiv:2601.01417,A Depth Hierarchy for Computing the Maximum in ReLU Networks via Extremal Graph Theory,基于极值图论的ReLU网络最大值计算深度层次结构,Itay Safran,https://arxiv.org/pdf/2601.01417,"Subjects:
Machine Learning (cs.LG)",Machine Learning (cs.LG)
arXiv:2601.01416,AirSpatialBot: A Spatially-Aware Aerial Agent for Fine-Grained Vehicle Attribute Recognization and Retrieval,AirSpatialBot：面向细粒度车辆属性识别与检索的空间感知空中代理,"Yue Zhou, Ran Ding, Xue Yang, Xue Jiang, Xingzhao Liu",https://arxiv.org/pdf/2601.01416,"Subjects:
Computer Vision and Pattern Recognition (cs.CV)",Computer Vision and Pattern Recognition (cs.CV)
arXiv:2601.01415,A Tool for Semantic-Aware Spatial Corpus Construction,一种语义感知的空间语料库构建工具,"Wei Huang, Xieyang Wang, Jianqiu Xu, Guidong Zhang",https://arxiv.org/pdf/2601.01415,"Subjects:
Databases (cs.DB)",Databases (cs.DB)
arXiv:2601.01413,"GlycoPy: An Equation-Oriented and Object-Oriented Software for Hierarchical Modeling, Optimization, and Control in Python",GlycoPy：一种面向方程和面向对象的Python分层建模、优化与控制软件,"Yingjie Ma, Jing Guo, Richard D. Braatz",https://arxiv.org/pdf/2601.01413,"Subjects:
Software Engineering (cs.SE); Mathematical Software (cs.MS); Optimization and Control (math.OC)","Software Engineering (cs.SE),  Mathematical Software (cs.MS),  Optimization and Control (math.OC)"
arXiv:2601.01410,Reliable Grid Forecasting: State Space Models for Safety-Critical Energy Systems,可靠电网预测：面向安全关键型能源系统的状态空间模型,"Jisoo Lee, Sunki Hong",https://arxiv.org/pdf/2601.01410,"Subjects:
Systems and Control (eess.SY); Artificial Intelligence (cs.AI); Machine Learning (cs.LG)","Systems and Control (eess.SY),  Artificial Intelligence (cs.AI),  Machine Learning (cs.LG)"
arXiv:2601.01409,Sampling Strategy Design for Model Predictive Path Integral Control on Legged Robot Locomotion,基于模型预测路径积分控制的腿部机器人运动采样策略设计,"Chuyuan Tao, Fanxin Wang, Haolong Jiang, Jia He, Yiyang Chen, Qinglei Bu",https://arxiv.org/pdf/2601.01409,"Subjects:
Systems and Control (eess.SY); Robotics (cs.RO)","Systems and Control (eess.SY),  Robotics (cs.RO)"
arXiv:2601.01408,Mask-Guided Multi-Task Network for Face Attribute Recognition,面向人脸属性识别的掩膜引导多任务网络,"Gong Gao, Zekai Wang, Jian Zhao, Ziqi Xie, Xianhui Liu, Weidong Zhao",https://arxiv.org/pdf/2601.01408,"Subjects:
Computer Vision and Pattern Recognition (cs.CV)",Computer Vision and Pattern Recognition (cs.CV)
arXiv:2601.01407,From Emotion Classification to Emotional Reasoning: Enhancing Emotional Intelligence in Large Language Models,从情感分类到情感推理：增强大语言模型的情感智能,"Arjhun Sreedar, Rohan Pillay, Laukik Patade",https://arxiv.org/pdf/2601.01407,"Subjects:
Computation and Language (cs.CL)",Computation and Language (cs.CL)
arXiv:2601.01406,SwinIFS: Landmark Guided Swin Transformer For Identity Preserving Face Super Resolution,SwinIFS：基于关键点引导的Swin Transformer身份保持人脸超分辨率,"Habiba Kausar, Saeed Anwar, Omar Jamal Hammad, Abdul Bais",https://arxiv.org/pdf/2601.01406,"Subjects:
Computer Vision and Pattern Recognition (cs.CV); Artificial Intelligence (cs.AI)","Computer Vision and Pattern Recognition (cs.CV),  Artificial Intelligence (cs.AI)"
arXiv:2601.01405,Efficient Cover Construction for Ball Mapper via Accelerated Range Queries,通过加速范围查询实现Ball Mapper的高效覆盖构建,"Jay-Anne Bulauan, John Rick Manzanares",https://arxiv.org/pdf/2601.01405,"Subjects:
Computational Geometry (cs.CG); Machine Learning (cs.LG)","Computational Geometry (cs.CG),  Machine Learning (cs.LG)"
arXiv:2601.01403,A Graph-based Framework for Online Time Series Anomaly Detection Using Model Ensemble,基于图模型的在线时间序列异常检测框架：模型集成方法,"Zewei Yu, Jianqiu Xu, Caimin Li",https://arxiv.org/pdf/2601.01403,"Subjects:
Machine Learning (cs.LG); Artificial Intelligence (cs.AI)","Machine Learning (cs.LG),  Artificial Intelligence (cs.AI)"
arXiv:2601.01401,LANCET: Neural Intervention via Structural Entropy for Mitigating Faithfulness Hallucinations in LLMs,LANCET：通过结构熵神经干预缓解大语言模型忠实性幻觉,"Chenxu Wang, Chaozhuo Li, Pengbo Wang, Litian Zhang, Songyang Liu, Ji Qi, Jiahui Hu, Yushan Cai, Hao Zhao, Rui Pu",https://arxiv.org/pdf/2601.01401,"Subjects:
Computation and Language (cs.CL); Machine Learning (cs.LG)","Computation and Language (cs.CL),  Machine Learning (cs.LG)"
arXiv:2601.01400,EternalMath: A Living Benchmark of Frontier Mathematics that Evolves with Human Discovery,EternalMath：与人类发现同步演进的前沿数学动态基准,"Jicheng Ma, Guohua Wang, Xinhua Feng, Yiming Liu, Zhichao Hu, Yuhong Liu",https://arxiv.org/pdf/2601.01400,"Subjects:
Computation and Language (cs.CL)",Computation and Language (cs.CL)
arXiv:2601.01393,Evaluation of Convolutional Neural Network For Image Classification with Agricultural and Urban Datasets,基于卷积神经网络的图像分类评估：农业与城市数据集应用,"Shamik Shafkat Avro, Nazira Jesmin Lina, Shahanaz Sharmin",https://arxiv.org/pdf/2601.01393,"Subjects:
Computer Vision and Pattern Recognition (cs.CV)",Computer Vision and Pattern Recognition (cs.CV)
arXiv:2601.01392,SAFE-QAQ: End-to-End Slow-Thinking Audio-Text Fraud Detection via Reinforcement Learning,SAFE-QAQ：基于强化学习的端到端慢思考音频-文本欺诈检测,"Peidong Wang, Zhiming Ma, Xin Dai, Yongkang Liu, Shi Feng, Xiaocui Yang, Wenxing Hu, Zhihao Wang, Mingjun Pan, Li Yuan, Daling Wang",https://arxiv.org/pdf/2601.01392,"Subjects:
Sound (cs.SD); Computation and Language (cs.CL); Audio and Speech Processing (eess.AS)","Sound (cs.SD),  Computation and Language (cs.CL),  Audio and Speech Processing (eess.AS)"
arXiv:2601.01390,Derandomizing Pseudopolynomial Algorithms for Subset Sum,子集和问题伪多项式算法的去随机化,Timothy M. Chan,https://arxiv.org/pdf/2601.01390,"Subjects:
Data Structures and Algorithms (cs.DS)",Data Structures and Algorithms (cs.DS)
arXiv:2601.01388,AGIS: Fast Approximate Graph Pattern Mining with Structure-Informed Sampling,AGIS：基于结构信息采样的快速近似图模式挖掘,"Seoyong Lee, Jinho Lee",https://arxiv.org/pdf/2601.01388,"Subjects:
Data Structures and Algorithms (cs.DS)",Data Structures and Algorithms (cs.DS)
arXiv:2601.01387,Scale-Adaptive Power Flow Analysis with Local Topology Slicing and Multi-Task Graph Learning,基于局部拓扑切片与多任务图学习的自适应规模潮流分析,"Yongzhe Li, Lin Guan, Zihan Cai, Zuxian Lin, Jiyu Huang, Liukai Chen",https://arxiv.org/pdf/2601.01387,"Subjects:
Machine Learning (cs.LG); Artificial Intelligence (cs.AI)","Machine Learning (cs.LG),  Artificial Intelligence (cs.AI)"
arXiv:2601.01386,ParkGaussian: Surround-view 3D Gaussian Splatting for Autonomous Parking,ParkGaussian：面向自动驾驶泊车的环视3D高斯点绘,"Xiaobao Wei, Zhangjie Ye, Yuxiang Gu, Zunjie Zhu, Yunfei Guo, Yingying Shen, Shan Zhao, Ming Lu, Haiyang Sun, Bing Wang, Guang Chen, Rongfeng Lu, Hangjun Ye",https://arxiv.org/pdf/2601.01386,"Subjects:
Computer Vision and Pattern Recognition (cs.CV); Artificial Intelligence (cs.AI)","Computer Vision and Pattern Recognition (cs.CV),  Artificial Intelligence (cs.AI)"
arXiv:2601.01383,Data Complexity-aware Deep Model Performance Forecasting,数据复杂度感知的深度模型性能预测,"Yen-Chia Chen, Hsing-Kuo Pao, Hanjuan Huang",https://arxiv.org/pdf/2601.01383,"Subjects:
Machine Learning (cs.LG); Artificial Intelligence (cs.AI)","Machine Learning (cs.LG),  Artificial Intelligence (cs.AI)"
arXiv:2601.01378,Empowering Small Language Models with Factual Hallucination-Aware Reasoning for Financial Classification,通过事实性幻觉感知推理增强小语言模型的金融分类能力,"Han Yuan, Yilin Wu, Li Zhang, Zheng Ma",https://arxiv.org/pdf/2601.01378,"Subjects:
Artificial Intelligence (cs.AI)",Artificial Intelligence (cs.AI)
arXiv:2601.01375,"From Historical Puzzles to Grammatical Constraints: Circular Partitions, Generalized Run-Length Encodings, and Polynomial-Time Decidability",从历史谜题到语法约束：环形划分、广义游程编码与多项式时间判定性,"Omid Khormali, Ghaya Mtimet, Nuh Aydin",https://arxiv.org/pdf/2601.01375,"Subjects:
Formal Languages and Automata Theory (cs.FL); Discrete Mathematics (cs.DM); Combinatorics (math.CO)","Formal Languages and Automata Theory (cs.FL),  Discrete Mathematics (cs.DM),  Combinatorics (math.CO)"
arXiv:2601.01373,UltraEval-Audio: A Unified Framework for Comprehensive Evaluation of Audio Foundation Models,UltraEval-Audio：音频基础模型的统一综合评估框架,"Qundong Shi, Jie Zhou, Biyuan Lin, Junbo Cui, Guoyang Zeng, Yixuan Zhou, Ziyang Wang, Xin Liu, Zhen Luo, Yudong Wang, Zhiyuan Liu",https://arxiv.org/pdf/2601.01373,"Subjects:
Sound (cs.SD); Artificial Intelligence (cs.AI); Audio and Speech Processing (eess.AS)","Sound (cs.SD),  Artificial Intelligence (cs.AI),  Audio and Speech Processing (eess.AS)"
arXiv:2601.01372,Probabilistic verification algorithm for linear codes,线性码的概率验证算法,"Mingchao Li, Jiyou Li",https://arxiv.org/pdf/2601.01372,"Subjects:
Information Theory (cs.IT)",Information Theory (cs.IT)
arXiv:2601.01368,Causal discovery for linear causal model with correlated noise: an Adversarial Learning Approach,具有相关噪声的线性因果模型的因果发现：一种对抗学习方法,"Mujin Zhou, Junzhe Zhang",https://arxiv.org/pdf/2601.01368,"Subjects:
Machine Learning (cs.LG)",Machine Learning (cs.LG)
arXiv:2601.01366,KGCE: Knowledge-Augmented Dual-Graph Evaluator for Cross-Platform Educational Agent Benchmarking with Multimodal Language Models,KGCE：基于多模态语言模型的跨平台教育代理基准测试的知识增强双图评估器,"Zixian Liu, Sihao Liu, Yuqi Zhao",https://arxiv.org/pdf/2601.01366,"Subjects:
Artificial Intelligence (cs.AI)",Artificial Intelligence (cs.AI)
arXiv:2601.01364,Unsupervised SE(3) Disentanglement for in situ Macromolecular Morphology Identification from Cryo-Electron Tomography,无监督SE(3)解缠用于从冷冻电子断层扫描中进行原位大分子形态识别,"Mostofa Rafid Uddin, Mahek Vora, Qifeng Wu, Muyuan Chen, Min Xu",https://arxiv.org/pdf/2601.01364,"Subjects:
Computer Vision and Pattern Recognition (cs.CV)",Computer Vision and Pattern Recognition (cs.CV)
arXiv:2601.01363,A unified multimodal understanding and generation model for cross-disciplinary scientific research,面向跨学科科学研究的统一多模态理解与生成模型,"Xiaomeng Yang, Zhiyu Tan, Xiaohui Zhong, Mengping Yang, Qiusheng Huang, Lei Chen, Libo Wu, Hao Li",https://arxiv.org/pdf/2601.01363,"Subjects:
Artificial Intelligence (cs.AI)",Artificial Intelligence (cs.AI)
arXiv:2601.01362,Investigating the Multilingual Calibration Effects of Language Model Instruction-Tuning,语言模型指令调优的多语言校准效果研究,"Jerry Huang, Peng Lu, Qiuhao Zeng, Yusuke Iwasawa, Yutaka Matsuo, Sarath Chandar, Edison Marrese-Taylor, Irene Li",https://arxiv.org/pdf/2601.01362,"Subjects:
Computation and Language (cs.CL); Machine Learning (cs.LG); Machine Learning (stat.ML)","Computation and Language (cs.CL),  Machine Learning (cs.LG),  Machine Learning (stat.ML)"
arXiv:2601.01361,VARTS: A Tool for the Visualization and Analysis of Representative Time Series Data,VARTS：代表时间序列数据的可视化与分析工具,"Duosi Jin, Jianqiu Xu, Guidong Zhang",https://arxiv.org/pdf/2601.01361,"Subjects:
Graphics (cs.GR); Databases (cs.DB); Software Engineering (cs.SE)","Graphics (cs.GR),  Databases (cs.DB),  Software Engineering (cs.SE)"
arXiv:2601.01360,Garment Inertial Denoiser (GID): Endowing Accurate Motion Capture via Loose IMU Denoiser,服装惯性去噪器（GID）：通过松散IMU去噪器实现精确动作捕捉,"Jiawei Fang, Ruonan Zheng, Xiaoxia Gao, Shifan Jiang, Anjun Chen, Qi Ye, Shihui Guo",https://arxiv.org/pdf/2601.01360,"Subjects:
Computer Vision and Pattern Recognition (cs.CV); Human-Computer Interaction (cs.HC)","Computer Vision and Pattern Recognition (cs.CV),  Human-Computer Interaction (cs.HC)"
arXiv:2601.01357,Towards LLM-enabled autonomous combustion research: A literature-aware agent for self-corrective modeling workflows,面向LLM赋能的自主燃烧研究：一种具备文献感知能力的自校正建模代理,"Ke Xiao, Haoze Zhang, Runze Mao, Han Li, Zhi X. Chen",https://arxiv.org/pdf/2601.01357,"Subjects:
Machine Learning (cs.LG); Fluid Dynamics (physics.flu-dyn)","Machine Learning (cs.LG),  Fluid Dynamics (physics.flu-dyn)"
