Unnamed: 0,id,title,title_zh,authors,url,subjects,subject_split
523,arXiv:2411.14798,Facial Features Matter: a Dynamic Watermark based Proactive Deepfake Detection Approach,人脸特征很重要：一种基于动态水印的主动深度伪造检测方法,"Shulin Lan, Kanlin Liu, Yazhou Zhao, Chen Yang, Yingchao Wang, Xingshan Yao, Liehuang Zhu",https://arxiv.org/pdf/2411.14798.pdf,"Subjects:
Computer Vision and Pattern Recognition (cs.CV); Cryptography and Security (cs.CR); Machine Learning (cs.LG); Image and Video Processing (eess.IV)","Computer Vision and Pattern Recognition (cs.CV),  Cryptography and Security (cs.CR),  Machine Learning (cs.LG),  Image and Video Processing (eess.IV)"
524,arXiv:2411.14797,Continual SFT Matches Multimodal RLHF with Negative Supervision,连续SFT将多模态RLHF与负监督相匹配,"Ke Zhu, Yu Wang, Yanpeng Sun, Qiang Chen, Jiangjiang Liu, Gang Zhang, Jingdong Wang",https://arxiv.org/pdf/2411.14797.pdf,"Subjects:
Machine Learning (cs.LG); Artificial Intelligence (cs.AI); Computation and Language (cs.CL); Computer Vision and Pattern Recognition (cs.CV)","Machine Learning (cs.LG),  Artificial Intelligence (cs.AI),  Computation and Language (cs.CL),  Computer Vision and Pattern Recognition (cs.CV)"
525,arXiv:2411.14796,Adaptive Hyper-Graph Convolution Network for Skeleton-based Human Action Recognition with Virtual Connections,基于骨架的虚拟连接人体动作识别的自适应超图卷积网络,"Youwei Zhou, Tianyang Xu, Cong Wu, Xiaojun Wu, Josef Kittler",https://arxiv.org/pdf/2411.14796.pdf,"Subjects:
Computer Vision and Pattern Recognition (cs.CV); Machine Learning (cs.LG)","Computer Vision and Pattern Recognition (cs.CV),  Machine Learning (cs.LG)"
526,arXiv:2411.14795,De-biased Multimodal Electrocardiogram Analysis,去偏多模态心电图分析,"Haitao Li, Ziyu Li, Yiheng Mao, Ziyi Liu, Zhoujian Sun, Zhengxing Huang",https://arxiv.org/pdf/2411.14795.pdf,"Subjects:
Computation and Language (cs.CL)",Computation and Language (cs.CL)
527,arXiv:2411.14794,VideoEspresso: A Large-Scale Chain-of-Thought Dataset for Fine-Grained Video Reasoning via Core Frame Selection,VideoEspresso：通过核心帧选择进行细粒度视频推理的大规模思维链数据集,"Songhao Han, Wei Huang, Hairong Shi, Le Zhuo, Xiu Su, Shifeng Zhang, Xu Zhou, Xiaojuan Qi, Yue Liao, Si Liu",https://arxiv.org/pdf/2411.14794.pdf,"Subjects:
Computer Vision and Pattern Recognition (cs.CV); Artificial Intelligence (cs.AI); Computation and Language (cs.CL)","Computer Vision and Pattern Recognition (cs.CV),  Artificial Intelligence (cs.AI),  Computation and Language (cs.CL)"
528,arXiv:2411.14793,Style-Friendly SNR Sampler for Style-Driven Generation,风格驱动生成的风格友好型信噪比采样器,"Jooyoung Choi, Chaehun Shin, Yeongtak Oh, Heeseung Kim, Sungroh Yoon",https://arxiv.org/pdf/2411.14793.pdf,"Subjects:
Computer Vision and Pattern Recognition (cs.CV)",Computer Vision and Pattern Recognition (cs.CV)
529,arXiv:2411.14790,KBAlign: Efficient Self Adaptation on Specific Knowledge Bases,KBAlign：基于特定知识库的高效自适应,"Zheni Zeng, Yuxuan Chen, Shi Yu, Yukun Yan, Zhenghao Liu, Shuo Wang, Xu Han, Zhiyuan Liu, Maosong Sun",https://arxiv.org/pdf/2411.14790.pdf,"Subjects:
Computation and Language (cs.CL); Artificial Intelligence (cs.AI)","Computation and Language (cs.CL),  Artificial Intelligence (cs.AI)"
530,arXiv:2411.14789,Simplifying CLIP: Unleashing the Power of Large-Scale Models on Consumer-level Computers,简化CLIP：在消费级计算机上释放大规模模型的力量,Hongbo Liu,https://arxiv.org/pdf/2411.14789.pdf,"Subjects:
Machine Learning (cs.LG); Computer Vision and Pattern Recognition (cs.CV)","Machine Learning (cs.LG),  Computer Vision and Pattern Recognition (cs.CV)"
531,arXiv:2411.14788,Jovis: A Visualization Tool for PostgreSQL Query Optimizer,Jovis：PostgreSQL查询优化器的可视化工具,"Yoojin Choi, Juhee Han, Kyoseung Koo, Bongki Moon",https://arxiv.org/pdf/2411.14788.pdf,"Subjects:
Databases (cs.DB); Human-Computer Interaction (cs.HC)","Databases (cs.DB),  Human-Computer Interaction (cs.HC)"
532,arXiv:2411.14786,FastGrasp: Efficient Grasp Synthesis with Diffusion,FastGrasp：高效掌握扩散合成,"Xiaofei Wu, Tao Liu, Caoji Li, Yuexin Ma, Yujiao Shi, Xuming He",https://arxiv.org/pdf/2411.14786.pdf,"Subjects:
Robotics (cs.RO); Computer Vision and Pattern Recognition (cs.CV)","Robotics (cs.RO),  Computer Vision and Pattern Recognition (cs.CV)"
533,arXiv:2411.14783,Segmenting Action-Value Functions Over Time-Scales in SARSA using TD($\Delta$),使用TD（$\Delta$）对SARSA中随时间变化的动作值函数进行分段,Mahammad Humayoo,https://arxiv.org/pdf/2411.14783.pdf,"Subjects:
Machine Learning (cs.LG)",Machine Learning (cs.LG)
534,arXiv:2411.14781,Reconciling Semantic Controllability and Diversity for Remote Sensing Image Synthesis with Hybrid Semantic Embedding,通过混合语义嵌入协调遥感图像合成的语义可控性和多样性,"Junde Liu, Danpei Zhao, Bo Yuan, Wentao Li, Tian Li",https://arxiv.org/pdf/2411.14781.pdf,"Subjects:
Computer Vision and Pattern Recognition (cs.CV)",Computer Vision and Pattern Recognition (cs.CV)
535,arXiv:2411.14779,New families of non-Reed-Solomon MDS codes,非Reed-Solomon MDS码的新家族,"Lingfei Jin, Liming Ma, Chaoping Xing, Haiyan Zhou",https://arxiv.org/pdf/2411.14779.pdf,"Subjects:
Information Theory (cs.IT)",Information Theory (cs.IT)
536,arXiv:2411.14775,A Benchmark Dataset for Collaborative SLAM in Service Environments,服务环境中协同SLAM的基准数据集,"Harin Park, Inha Lee, Minje Kim, Hyungyu Park, Kyungdon Joo",https://arxiv.org/pdf/2411.14775.pdf,"Subjects:
Robotics (cs.RO); Computer Vision and Pattern Recognition (cs.CV)","Robotics (cs.RO),  Computer Vision and Pattern Recognition (cs.CV)"
537,arXiv:2411.14774,Resolution-Agnostic Transformer-based Climate Downscaling,基于分辨率不可知变压器的气候降尺度,"Declan Curran, Hira Saleem, Sanaa Hobeichi, Flora Salim",https://arxiv.org/pdf/2411.14774.pdf,"Subjects:
Computer Vision and Pattern Recognition (cs.CV); Artificial Intelligence (cs.AI)","Computer Vision and Pattern Recognition (cs.CV),  Artificial Intelligence (cs.AI)"
538,arXiv:2411.14773,Mode-conditioned music learning and composition: a spiking neural network inspired by neuroscience and psychology,模式条件音乐学习和作曲：受神经科学和心理学启发的尖峰神经网络,"Qian Liang, Yi Zeng, Menghaoran Tang",https://arxiv.org/pdf/2411.14773.pdf,"Subjects:
Sound (cs.SD); Artificial Intelligence (cs.AI); Audio and Speech Processing (eess.AS); Neurons and Cognition (q-bio.NC)","Sound (cs.SD),  Artificial Intelligence (cs.AI),  Audio and Speech Processing (eess.AS),  Neurons and Cognition (q-bio.NC)"
539,arXiv:2411.14771,Capacity Approximations for Insertion Channels with Small Insertion Probabilities,具有小插入概率的插入信道的容量近似,"Busra Tegin, Tolga M Duman",https://arxiv.org/pdf/2411.14771.pdf,"Subjects:
Information Theory (cs.IT)",Information Theory (cs.IT)
540,arXiv:2411.14770,Aim My Robot: Precision Local Navigation to Any Object,瞄准我的机器人：对任何物体的精确局部导航,"Xiangyun Meng, Xuning Yang, Sanghun Jung, Fabio Ramos, Srid Sadhan Jujjavarapu, Sanjoy Paul, Dieter Fox",https://arxiv.org/pdf/2411.14770.pdf,"Subjects:
Robotics (cs.RO)",Robotics (cs.RO)
541,arXiv:2411.14768,Grid and Road Expressions Are Complementary for Trajectory Representation Learning,网格和道路表达式在轨迹表示学习中是互补的,"Silin Zhou, Shuo Shang, Lisi Chen, Peng Han, Christian S. Jensen",https://arxiv.org/pdf/2411.14768.pdf,"Subjects:
Machine Learning (cs.LG); Artificial Intelligence (cs.AI)","Machine Learning (cs.LG),  Artificial Intelligence (cs.AI)"
542,arXiv:2411.14765,An Attention-based Framework for Fair Contrastive Learning,基于注意力的公平对比学习框架,"Stefan K. Nielsen, Tan M. Nguyen",https://arxiv.org/pdf/2411.14765.pdf,"Subjects:
Machine Learning (cs.LG)",Machine Learning (cs.LG)
543,arXiv:2411.14762,Efficient Long Video Tokenization via Coordinate-based Patch Reconstruction,通过基于坐标的补丁重建实现高效的长视频令牌化,"Huiwon Jang, Sihyun Yu, Jinwoo Shin, Pieter Abbeel, Younggyo Seo",https://arxiv.org/pdf/2411.14762.pdf,"Subjects:
Computer Vision and Pattern Recognition (cs.CV); Artificial Intelligence (cs.AI); Machine Learning (cs.LG)","Computer Vision and Pattern Recognition (cs.CV),  Artificial Intelligence (cs.AI),  Machine Learning (cs.LG)"
544,arXiv:2411.14760,The 1st Workshop on Human-Centered Recommender Systems,第一届以人为中心的推荐系统研讨会,"Kaike Zhang, Yunfan Wu, Yougang lyu, Du Su, Yingqiang Ge, Shuchang Liu, Qi Cao, Zhaochun Ren, Fei Sun",https://arxiv.org/pdf/2411.14760.pdf,"Subjects:
Information Retrieval (cs.IR)",Information Retrieval (cs.IR)
545,arXiv:2411.14759,Hammer: Towards Efficient Hot-Cold Data Identification via Online Learning,Hammer：通过在线学习实现高效的冷热数据识别,"Kai Lu, Siqi Zhao, Jiguang Wan",https://arxiv.org/pdf/2411.14759.pdf,"Subjects:
Machine Learning (cs.LG); Artificial Intelligence (cs.AI)","Machine Learning (cs.LG),  Artificial Intelligence (cs.AI)"
546,arXiv:2411.14756,KPG 193: A Synthetic Korean Power Grid Test System for Decarbonization Studies,KPG 193：韩国电网脱碳研究综合测试系统,"Geonho Song, Jip Kim",https://arxiv.org/pdf/2411.14756.pdf,"Subjects:
Systems and Control (eess.SY)",Systems and Control (eess.SY)
547,arXiv:2411.14755,FairAdapter: Detecting AI-generated Images with Improved Fairness,FairAdapter：检测AI生成的图像，提高公平性,"Feng Ding, Jun Zhang, Xinan He, Jianfeng Xu",https://arxiv.org/pdf/2411.14755.pdf,"Subjects:
Computer Vision and Pattern Recognition (cs.CV); Computers and Society (cs.CY)","Computer Vision and Pattern Recognition (cs.CV),  Computers and Society (cs.CY)"
548,arXiv:2411.14754,Subspace Collision: An Efficient and Accurate Framework for High-dimensional Approximate Nearest Neighbor Search,子空间碰撞：一种高效准确的高维近似最近邻搜索框架,"Jiuqi Wei, Xiaodong Lee, Zhenyu Liao, Themis Palpanas, Botao Peng",https://arxiv.org/pdf/2411.14754.pdf,"Subjects:
Databases (cs.DB)",Databases (cs.DB)
549,arXiv:2411.14751,TopoSD: Topology-Enhanced Lane Segment Perception with SDMap Prior,TopoSD：使用SDMap Prior增强车道段感知的拓扑,"Sen Yang, Minyue Jiang, Ziwei Fan, Xiaolu Xie, Xiao Tan, Yingying Li, Errui Ding, Liang Wang, Jingdong Wang",https://arxiv.org/pdf/2411.14751.pdf,"Subjects:
Computer Vision and Pattern Recognition (cs.CV); Artificial Intelligence (cs.AI); Machine Learning (cs.LG); Robotics (cs.RO)","Computer Vision and Pattern Recognition (cs.CV),  Artificial Intelligence (cs.AI),  Machine Learning (cs.LG),  Robotics (cs.RO)"
550,arXiv:2411.14750,Ordinal Multiple-instance Learning for Ulcerative Colitis Severity Estimation with Selective Aggregated Transformer,使用选择性聚合变换器进行溃疡性结肠炎严重程度估计的有序多实例学习,"Kaito Shiku, Kazuya Nishimura, Daiki Suehiro, Kiyohito Tanaka, Ryoma Bise",https://arxiv.org/pdf/2411.14750.pdf,"Subjects:
Computer Vision and Pattern Recognition (cs.CV); Machine Learning (cs.LG)","Computer Vision and Pattern Recognition (cs.CV),  Machine Learning (cs.LG)"
551,arXiv:2411.14745,Approximating the Held-Karp Bound for Metric TSP in Nearly Linear Work and Polylogarithmic Depth,近似线性功和多对数深度下度量TSP的保持Karp界,"Zhuan Khye Koh, Omri Weinstein, Sorrachai Yingchareonthawornchai",https://arxiv.org/pdf/2411.14745.pdf,"Subjects:
Data Structures and Algorithms (cs.DS)",Data Structures and Algorithms (cs.DS)
552,arXiv:2411.14744,Point Cloud Understanding via Attention-Driven Contrastive Learning,通过注意力驱动的对比学习理解点云,"Yi Wang, Jiaze Wang, Ziyu Guo, Renrui Zhang, Donghao Zhou, Guangyong Chen, Anfeng Liu, Pheng-Ann Heng",https://arxiv.org/pdf/2411.14744.pdf,"Subjects:
Computer Vision and Pattern Recognition (cs.CV); Artificial Intelligence (cs.AI); Machine Learning (cs.LG)","Computer Vision and Pattern Recognition (cs.CV),  Artificial Intelligence (cs.AI),  Machine Learning (cs.LG)"
553,arXiv:2411.14743,FOCUS: Knowledge-enhanced Adaptive Visual Compression for Few-shot Whole Slide Image Classification,FOCUS：用于少镜头全幻灯片图像分类的知识增强自适应视觉压缩,"Zhengrui Guo, Conghao Xiong, Jiabo Ma, Qichen Sun, Lishuang Feng, Jinzhuo Wang, Hao Chen",https://arxiv.org/pdf/2411.14743.pdf,"Subjects:
Computer Vision and Pattern Recognition (cs.CV); Artificial Intelligence (cs.AI); Quantitative Methods (q-bio.QM)","Computer Vision and Pattern Recognition (cs.CV),  Artificial Intelligence (cs.AI),  Quantitative Methods (q-bio.QM)"
554,arXiv:2411.14740,TEXGen: a Generative Diffusion Model for Mesh Textures,TEXGen：网格纹理的生成扩散模型,"Xin Yu, Ze Yuan, Yuan-Chen Guo, Ying-Tian Liu, JianHui Liu, Yangguang Li, Yan-Pei Cao, Ding Liang, Xiaojuan Qi",https://arxiv.org/pdf/2411.14740.pdf,"Subjects:
Computer Vision and Pattern Recognition (cs.CV); Artificial Intelligence (cs.AI); Graphics (cs.GR)","Computer Vision and Pattern Recognition (cs.CV),  Artificial Intelligence (cs.AI),  Graphics (cs.GR)"
555,arXiv:2411.14739,IRLab@iKAT24: Learned Sparse Retrieval with Multi-aspect LLM Query Generation for Conversational Search,IRLab@iKAT24：用于会话搜索的学习稀疏检索与多维LLM查询生成,"Simon Lupart, Zahra Abbasiantaeb, Mohammad Aliannejadi",https://arxiv.org/pdf/2411.14739.pdf,"Subjects:
Information Retrieval (cs.IR); Computation and Language (cs.CL)","Information Retrieval (cs.IR),  Computation and Language (cs.CL)"
556,arXiv:2411.14738,Universal and Context-Independent Triggers for Precise Control of LLM Outputs,用于精确控制LLM输出的通用和上下文无关触发器,"Jiashuo Liang, Guancheng Li, Yang Yu",https://arxiv.org/pdf/2411.14738.pdf,"Subjects:
Computation and Language (cs.CL); Artificial Intelligence (cs.AI); Cryptography and Security (cs.CR)","Computation and Language (cs.CL),  Artificial Intelligence (cs.AI),  Cryptography and Security (cs.CR)"
557,arXiv:2411.14737,AI Tailoring: Evaluating Influence of Image Features on Fashion Product Popularity,人工智能定制：评估图像特征对时尚产品流行度的影响,"Xiaomin Li, Junyi Sha",https://arxiv.org/pdf/2411.14737.pdf,"Subjects:
Computer Vision and Pattern Recognition (cs.CV); Machine Learning (cs.LG)","Computer Vision and Pattern Recognition (cs.CV),  Machine Learning (cs.LG)"
558,arXiv:2411.14735,Automatic Inference of Relational Object Invariants,关系对象不变量的自动推理,"Yusen Su, Jorge A. Navas, Arie Gurfinkel, Isabel Garcia-Contreras",https://arxiv.org/pdf/2411.14735.pdf,"Subjects:
Programming Languages (cs.PL)",Programming Languages (cs.PL)
559,arXiv:2411.14733,"FLARE: FP-Less PTQ and Low-ENOB ADC Based AMS-PiM for Error-Resilient, Fast, and Efficient Transformer Acceleration",FLARE：基于无FP PTQ和低ENOB ADC的AMS PiM，用于容错、快速和高效的变压器加速,"Donghyeon Yi, Seoyoung Lee, Jongho Kim, Junyoung Kim, Sohmyung Ha, Ik Joon Chang, Minkyu Je",https://arxiv.org/pdf/2411.14733.pdf,"Subjects:
Machine Learning (cs.LG); Image and Video Processing (eess.IV); Systems and Control (eess.SY)","Machine Learning (cs.LG),  Image and Video Processing (eess.IV),  Systems and Control (eess.SY)"
560,arXiv:2411.14730,Funhouse Mirror or Echo Chamber? A Methodological Approach to Teaching Critical AI Literacy Through Metaphors,Funhouse镜子还是回音室？通过隐喻教授批判性人工智能素养的方法论,"Jasper Roe (1), Leon Furze (2), Mike Perkins (3) ((1) James Cook University Singapore, Singapore, (2) Deakin University, Australia, (3) British University Vietnam, Vietnam)",https://arxiv.org/pdf/2411.14730.pdf,"Subjects:
Computers and Society (cs.CY)",Computers and Society (cs.CY)
561,arXiv:2411.14729,A Lightweight Edge-CNN-Transformer Model for Detecting Coordinated Cyber and Digital Twin Attacks in Cooperative Smart Farming,一种用于检测协同智能农业中网络和数字孪生攻击的轻量级边缘CNN变换器模型,"Lopamudra Praharaj, Deepti Gupta, Maanak Gupta",https://arxiv.org/pdf/2411.14729.pdf,"Subjects:
Cryptography and Security (cs.CR)",Cryptography and Security (cs.CR)
562,arXiv:2411.14728,K-GBS3FCM -- KNN Graph-Based Safe Semi-Supervised Fuzzy C-Means,K-GBS3FCM——基于KNN图的安全半监督模糊C均值,"Gabriel Santos, Rita Julia, Marcelo Nascimento",https://arxiv.org/pdf/2411.14728.pdf,"Subjects:
Machine Learning (cs.LG)",Machine Learning (cs.LG)
563,arXiv:2411.14727,Attributed Graph Clustering via Generalized Quaternion Representation Learning,基于广义四元数表示学习的属性图聚类,"Junyang Chen, Yiqun Zhang, Mengke Li, Yang Lu, Yiu-ming Cheung",https://arxiv.org/pdf/2411.14727.pdf,"Subjects:
Machine Learning (cs.LG)",Machine Learning (cs.LG)
564,arXiv:2411.14726,Enhancing Molecular Design through Graph-based Topological Reinforcement Learning,通过基于图的拓扑强化学习增强分子设计,Xiangyu Zhang,https://arxiv.org/pdf/2411.14726.pdf,"Subjects:
Machine Learning (cs.LG); Biomolecules (q-bio.BM)","Machine Learning (cs.LG),  Biomolecules (q-bio.BM)"
565,arXiv:2411.14725,Evaluating and Advancing Multimodal Large Language Models in Ability Lens,从能力视角评估和推进多模态大型语言模型,"Feng Chen, Chenhui Gou, Jing Liu, Yang Yang, Zhaoyang Li, Jiyuan Zhang, Zhenbang Sun, Bohan Zhuang, Qi Wu",https://arxiv.org/pdf/2411.14725.pdf,"Subjects:
Computer Vision and Pattern Recognition (cs.CV); Computation and Language (cs.CL); Machine Learning (cs.LG)","Computer Vision and Pattern Recognition (cs.CV),  Computation and Language (cs.CL),  Machine Learning (cs.LG)"
566,arXiv:2411.14723,Effective SAM Combination for Open-Vocabulary Semantic Segmentation,开放式词汇语义分割的有效SAM组合,"Minhyeok Lee, Suhwan Cho, Jungho Lee, Sunghun Yang, Heeseung Choi, Ig-Jae Kim, Sangyoun Lee",https://arxiv.org/pdf/2411.14723.pdf,"Subjects:
Computer Vision and Pattern Recognition (cs.CV)",Computer Vision and Pattern Recognition (cs.CV)
567,arXiv:2411.14721,MolReFlect: Towards In-Context Fine-grained Alignments between Molecules and Texts,MolReFlect:实现分子和文本之间的上下文细粒度对齐,"Jiatong Li, Yunqing Liu, Wei Liu, Jingdi Le, Di Zhang, Wenqi Fan, Dongzhan Zhou, Yuqiang Li, Qing Li",https://arxiv.org/pdf/2411.14721.pdf,"Subjects:
Computation and Language (cs.CL); Machine Learning (cs.LG); Quantitative Methods (q-bio.QM)","Computation and Language (cs.CL),  Machine Learning (cs.LG),  Quantitative Methods (q-bio.QM)"
568,arXiv:2411.14720,Optimizing Social Media Annotation of HPV Vaccine Skepticism and Misinformation Using Large Language Models: An Experimental Evaluation of In-Context Learning and Fine-Tuning Stance Detection Across Multiple Models,使用大型语言模型优化HPV疫苗怀疑和错误信息的社交媒体注释：跨多个模型的情境学习和微调立场检测的实验评估,"Luhang Sun, Varsha Pendyala, Yun-Shiuan Chuang, Shanglin Yang, Jonathan Feldman, Andrew Zhao, Munmun De Choudhury, Sijia Yang, Dhavan Shah",https://arxiv.org/pdf/2411.14720.pdf,"Subjects:
Computation and Language (cs.CL)",Computation and Language (cs.CL)
569,arXiv:2411.14718,GraphTheft: Quantifying Privacy Risks in Graph Prompt Learning,GraphTheft：量化图提示学习中的隐私风险,"Jiani Zhu, Xi Lin, Yuxin Qi, Qinghua Mao",https://arxiv.org/pdf/2411.14718.pdf,"Subjects:
Cryptography and Security (cs.CR)",Cryptography and Security (cs.CR)
570,arXiv:2411.14717,FedMLLM: Federated Fine-tuning MLLM on Multimodal Heterogeneity Data,FedMLLM：多模态非均匀数据的联邦微调MLLM,"Binqian Xu, Xiangbo Shu, Haiyang Mei, Guosen Xie, Basura Fernando, Mike Zheng Shou, Jinhui Tang",https://arxiv.org/pdf/2411.14717.pdf,"Subjects:
Machine Learning (cs.LG); Computation and Language (cs.CL); Computer Vision and Pattern Recognition (cs.CV)","Machine Learning (cs.LG),  Computation and Language (cs.CL),  Computer Vision and Pattern Recognition (cs.CV)"
571,arXiv:2411.14716,VisionPAD: A Vision-Centric Pre-training Paradigm for Autonomous Driving,VisionPAD：以视觉为中心的自动驾驶预训练范式,"Haiming Zhang, Wending Zhou, Yiyao Zhu, Xu Yan, Jiantao Gao, Dongfeng Bai, Yingjie Cai, Bingbing Liu, Shuguang Cui, Zhen Li",https://arxiv.org/pdf/2411.14716.pdf,"Subjects:
Computer Vision and Pattern Recognition (cs.CV); Machine Learning (cs.LG); Robotics (cs.RO)","Computer Vision and Pattern Recognition (cs.CV),  Machine Learning (cs.LG),  Robotics (cs.RO)"
572,arXiv:2411.14715,Any-to-3D Generation via Hybrid Diffusion Supervision,通过混合扩散监控实现任意到3D的生成,"Yijun Fan, Yiwei Ma, Jiayi Ji, Xiaoshuai Sun, Rongrong Ji",https://arxiv.org/pdf/2411.14715.pdf,"Subjects:
Computer Vision and Pattern Recognition (cs.CV)",Computer Vision and Pattern Recognition (cs.CV)
573,arXiv:2411.14713,LIBER: Lifelong User Behavior Modeling Based on Large Language Models,LIBER：基于大型语言模型的终身用户行为建模,"Chenxu Zhu, Shigang Quan, Bo Chen, Jianghao Lin, Xiaoling Cai, Hong Zhu, Xiangyang Li, Yunjia Xi, Weinan Zhang, Ruiming Tang",https://arxiv.org/pdf/2411.14713.pdf,"Subjects:
Information Retrieval (cs.IR); Artificial Intelligence (cs.AI)","Information Retrieval (cs.IR),  Artificial Intelligence (cs.AI)"
574,arXiv:2411.14711,Can GNNs Learn Link Heuristics? A Concise Review and Evaluation of Link Prediction Methods,GNN可以学习链接启发式吗？链路预测方法的简要回顾与评价,"Shuming Liang, Yu Ding, Zhidong Li, Bin Liang, Siqi Zhang, Yang Wang, Fang Chen",https://arxiv.org/pdf/2411.14711.pdf,"Subjects:
Social and Information Networks (cs.SI); Machine Learning (cs.LG)","Social and Information Networks (cs.SI),  Machine Learning (cs.LG)"
575,arXiv:2411.14708,Understanding LLM Embeddings for Regression,理解回归的LLM嵌入,"Eric Tang, Bangding Yang, Xingyou Song",https://arxiv.org/pdf/2411.14708.pdf,"Subjects:
Machine Learning (cs.LG); Artificial Intelligence (cs.AI); Computation and Language (cs.CL)","Machine Learning (cs.LG),  Artificial Intelligence (cs.AI),  Computation and Language (cs.CL)"
576,arXiv:2411.14707,"High-Bandwidth, Low-Computational Approach: Estimator-Based Control for Hybrid Flying Capacitor Multilevel Converters Using Multi-Cost Gradient Descent and State Feedforward",高带宽、低计算方法：基于多成本梯度下降和状态前馈的混合飞跨电容多电平变换器的估计器控制,Inhwi Hwang,https://arxiv.org/pdf/2411.14707.pdf,"Subjects:
Systems and Control (eess.SY)",Systems and Control (eess.SY)
577,arXiv:2411.14704,Cross-Modal Pre-Aligned Method with Global and Local Information for Remote-Sensing Image and Text Retrieval,基于全局和局部信息的遥感图像和文本检索跨模态预对准方法,"Zengbao Sun, Ming Zhao, Gaorui Liu, André Kaup",https://arxiv.org/pdf/2411.14704.pdf,"Subjects:
Computer Vision and Pattern Recognition (cs.CV); Information Retrieval (cs.IR)","Computer Vision and Pattern Recognition (cs.CV),  Information Retrieval (cs.IR)"
578,arXiv:2411.14701,Personalised 3D Human Digital Twin with Soft-Body Feet for Walking Simulation,用于行走模拟的具有柔软身体脚的个性化3D人体数字双胞胎,"Kum Yew Loke, Sherwin Stephen Chan, Mingyuan Lei, Henry Johan, Bingran Zuo, Wei Tech Ang",https://arxiv.org/pdf/2411.14701.pdf,"Subjects:
Robotics (cs.RO)",Robotics (cs.RO)
579,arXiv:2411.14700,Optimal Energy Dispatch of Grid-Connected Electric Vehicle Considering Lithium Battery Electrochemical Model,考虑锂电池电化学模型的并网电动汽车能量优化调度,"Yuanbo Chen, Kedi Zheng, Yuxuan Gu, Jianxiao Wang, Qixin Chen",https://arxiv.org/pdf/2411.14700.pdf,"Subjects:
Systems and Control (eess.SY)",Systems and Control (eess.SY)
580,arXiv:2411.14699,DNN based Two-stage Compensation Algorithm for THz Hybrid Beamforming with imperfect Hardware,基于DNN的硬件不完美THz混合波束形成两级补偿算法,"Wenqi Zhao, Chong Han, Ho-Jin Song, Emil Björnson",https://arxiv.org/pdf/2411.14699.pdf,"Subjects:
Information Theory (cs.IT); Signal Processing (eess.SP)","Information Theory (cs.IT),  Signal Processing (eess.SP)"
581,arXiv:2411.14698,Improving Mathematical Reasoning Capabilities of Small Language Models via Feedback-Driven Distillation,通过反馈驱动蒸馏提高小语言模型的数学推理能力,"Xunyu Zhu, Jian Li, Can Ma, Weiping Wang",https://arxiv.org/pdf/2411.14698.pdf,"Subjects:
Computation and Language (cs.CL); Artificial Intelligence (cs.AI)","Computation and Language (cs.CL),  Artificial Intelligence (cs.AI)"
582,arXiv:2411.14695,Anti-Forgetting Adaptation for Unsupervised Person Re-identification,无监督人再识别的反遗忘适应,"Hao Chen, Francois Bremond, Nicu Sebe, Shiliang Zhang",https://arxiv.org/pdf/2411.14695.pdf,"Subjects:
Computer Vision and Pattern Recognition (cs.CV); Machine Learning (cs.LG)","Computer Vision and Pattern Recognition (cs.CV),  Machine Learning (cs.LG)"
583,arXiv:2411.14694,A Data-Driven Pool Strategy for Price-Makers Under Imperfect Information,不完全信息下价格制定者的数据驱动池策略,"Kedi Zheng, Hongye Guo, Qixin Chen",https://arxiv.org/pdf/2411.14694.pdf,"Subjects:
Systems and Control (eess.SY); Machine Learning (cs.LG)","Systems and Control (eess.SY),  Machine Learning (cs.LG)"
584,arXiv:2411.14691,EV-PINN: A Physics-Informed Neural Network for Predicting Electric Vehicle Dynamics,EV-PINN：一种用于预测电动汽车动力学的物理信息神经网络,"Hansol Lim, Jee Won Lee, Jonathan Boyack, Jongseong Brad Choi",https://arxiv.org/pdf/2411.14691.pdf,"Subjects:
Machine Learning (cs.LG)",Machine Learning (cs.LG)
