Unnamed: 0,id,title,title_zh,authors,url,subjects,subject_split
349,arXiv:2411.15647,Circuit design in biology and machine learning. II. Anomaly detection,生物学和机器学习中的电路设计。二、异常检测,Steven A. Frank,https://arxiv.org/pdf/2411.15647.pdf,"Subjects:
Populations and Evolution (q-bio.PE); Machine Learning (cs.LG)","Populations and Evolution (q-bio.PE),  Machine Learning (cs.LG)"
350,arXiv:2411.15639,Ordering groups and the Identity Problem,排序组和身份问题,"Corentin Bodart, Laura Ciobanu, George Metcalfe",https://arxiv.org/pdf/2411.15639.pdf,"Subjects:
Group Theory (math.GR); Computational Complexity (cs.CC); Discrete Mathematics (cs.DM)","Group Theory (math.GR),  Computational Complexity (cs.CC),  Discrete Mathematics (cs.DM)"
351,arXiv:2411.15630,A 400Gbit Ethernet core enabling High Data Rate Streaming from FPGAs to Servers and GPUs in Radio Astronomy,400Gbit以太网核心，实现射电天文学中从FPGA到服务器和GPU的高数据速率流,"Wei Liu, Mitchell C. Burnett, Dan Werthimer, Jonathon Kocz",https://arxiv.org/pdf/2411.15630.pdf,"Subjects:
Instrumentation and Methods for Astrophysics (astro-ph.IM); Distributed, Parallel, and Cluster Computing (cs.DC)","Instrumentation and Methods for Astrophysics (astro-ph.IM),  Distributed, Parallel, and Cluster Computing (cs.DC)"
352,arXiv:2411.15624,Trans-Glasso: A Transfer Learning Approach to Precision Matrix Estimation,Trans-Glasso：一种用于精确矩阵估计的迁移学习方法,"Boxin Zhao, Cong Ma, Mladen Kolar",https://arxiv.org/pdf/2411.15624.pdf,"Subjects:
Machine Learning (stat.ML); Machine Learning (cs.LG); Methodology (stat.ME)","Machine Learning (stat.ML),  Machine Learning (cs.LG),  Methodology (stat.ME)"
353,arXiv:2411.15618,Accelerated Hydration Site Localization and Thermodynamic Profiling,加速水合位置定位和热力学分析,"Florian B. Hinz, Matthew R. Masters, Julia N. Kieu, Amr H. Mahmoud, Markus A. Lill",https://arxiv.org/pdf/2411.15618.pdf,"Subjects:
Biomolecules (q-bio.BM); Machine Learning (cs.LG)","Biomolecules (q-bio.BM),  Machine Learning (cs.LG)"
354,arXiv:2411.15617,Non-Reciprocal Reconfigurable Intelligent Surfaces,非互易可重构智能曲面,"Jiaqi Xu, Haoyu Wang, Rang Liu, Josef A. Nossek, A. Lee Swindlehurst",https://arxiv.org/pdf/2411.15617.pdf,"Subjects:
Signal Processing (eess.SP); Systems and Control (eess.SY)","Signal Processing (eess.SP),  Systems and Control (eess.SY)"
355,arXiv:2411.15596,Comparative Analysis of Resource-Efficient CNN Architectures for Brain Tumor Classification,用于脑肿瘤分类的资源高效CNN架构的比较分析,"Md Ashik Khan, Ankit Kumar Verma",https://arxiv.org/pdf/2411.15596.pdf,"Subjects:
Image and Video Processing (eess.IV); Computer Vision and Pattern Recognition (cs.CV)","Image and Video Processing (eess.IV),  Computer Vision and Pattern Recognition (cs.CV)"
356,arXiv:2411.15592,Classifier Enhanced Deep Learning Model for Erythroblast Differentiation with Limited Data,有限数据下红细胞分化的分类器增强深度学习模型,"Buddhadev Goswami, Adithya B. Somaraj, Prantar Chakrabarti, Ravindra Gudi, Nirmal Punjabi",https://arxiv.org/pdf/2411.15592.pdf,"Subjects:
Image and Video Processing (eess.IV); Computer Vision and Pattern Recognition (cs.CV)","Image and Video Processing (eess.IV),  Computer Vision and Pattern Recognition (cs.CV)"
357,arXiv:2411.15589,Deep Learning for THz Channel Estimation and Beamforming Prediction via Sub-6GHz Channel,通过Sub-6GHz信道进行THz信道估计和波束形成预测的深度学习,"Sagnik Bhattacharya, Abhishek K. Gupta",https://arxiv.org/pdf/2411.15589.pdf,"Subjects:
Signal Processing (eess.SP); Artificial Intelligence (cs.AI)","Signal Processing (eess.SP),  Artificial Intelligence (cs.AI)"
358,arXiv:2411.15576,MulModSeg: Enhancing Unpaired Multi-Modal Medical Image Segmentation with Modality-Conditioned Text Embedding and Alternating Training,MulModSeg：通过模态条件文本嵌入和交替训练增强非对映多模态医学图像分割,"Chengyin Li, Hui Zhu, Rafi Ibn Sultan, Hassan Bagher Ebadian, Prashant Khanduri, Chetty Indrin, Kundan Thind, Dongxiao Zhu",https://arxiv.org/pdf/2411.15576.pdf,"Subjects:
Image and Video Processing (eess.IV); Computer Vision and Pattern Recognition (cs.CV)","Image and Video Processing (eess.IV),  Computer Vision and Pattern Recognition (cs.CV)"
359,arXiv:2411.15548,An unconditional distribution learning advantage with shallow quantum circuits,浅量子电路的无条件分布学习优势,"N. Pirnay, S. Jerbi, J.-P. Seifert, J. Eisert",https://arxiv.org/pdf/2411.15548.pdf,"Subjects:
Quantum Physics (quant-ph); Artificial Intelligence (cs.AI)","Quantum Physics (quant-ph),  Artificial Intelligence (cs.AI)"
360,arXiv:2411.15526,Multi-scale Cascaded Large-Model for Whole-body ROI Segmentation,全身ROI分割的多尺度级联大模型,"Rui Hao, Dayu Tan, Yansen Su, Chunhou Zheng",https://arxiv.org/pdf/2411.15526.pdf,"Subjects:
Image and Video Processing (eess.IV); Computer Vision and Pattern Recognition (cs.CV)","Image and Video Processing (eess.IV),  Computer Vision and Pattern Recognition (cs.CV)"
361,arXiv:2411.15519,Risk Management with Feature-Enriched Generative Adversarial Networks (FE-GAN),特征丰富的生成对抗网络风险管理（FE-GAN）,Ling Chen,https://arxiv.org/pdf/2411.15519.pdf,"Subjects:
Risk Management (q-fin.RM); Machine Learning (cs.LG); Machine Learning (stat.ML)","Risk Management (q-fin.RM),  Machine Learning (cs.LG),  Machine Learning (stat.ML)"
362,arXiv:2411.15513,SPA: Efficient User-Preference Alignment against Uncertainty in Medical Image Segmentation,SPA：针对医学图像分割中的不确定性进行有效的用户偏好对齐,"Jiayuan Zhu, Junde Wu, Cheng Ouyang, Konstantinos Kamnitsas, Alison Noble",https://arxiv.org/pdf/2411.15513.pdf,"Subjects:
Image and Video Processing (eess.IV); Computer Vision and Pattern Recognition (cs.CV)","Image and Video Processing (eess.IV),  Computer Vision and Pattern Recognition (cs.CV)"
363,arXiv:2411.15504,Effects of Muscle Synergy during Overhead Work with a Passive Shoulder Exoskeleton: A Case Study,被动肩外骨骼在高空作业中肌肉协同作用的影响：案例研究,"Jin Tian, Baichun Wei, Chifu Yang, Suo Luo, Jiadong Feng, Ping Li, Changbing Chen, Yingjie Liu, Haiqi Zhu, Chunzhi Yi",https://arxiv.org/pdf/2411.15504.pdf,"Subjects:
Medical Physics (physics.med-ph); Robotics (cs.RO)","Medical Physics (physics.med-ph),  Robotics (cs.RO)"
364,arXiv:2411.15454,Extremal bounds for Gaussian trace estimation,高斯轨迹估计的极值界,Eric Hallman,https://arxiv.org/pdf/2411.15454.pdf,"Subjects:
Statistics Theory (math.ST); Numerical Analysis (math.NA); Probability (math.PR)","Statistics Theory (math.ST),  Numerical Analysis (math.NA),  Probability (math.PR)"
365,arXiv:2411.15425,Efficient Bitcoin Address Classification Using Quantum-Inspired Feature Selection,基于量子启发特征选择的高效比特币地址分类,"Ming-Fong Sie, Yen-Jui Chang, Chien-Lung Lin, Ching-Ray Chang, Shih-Wei Liao",https://arxiv.org/pdf/2411.15425.pdf,"Subjects:
Quantum Physics (quant-ph); Cryptography and Security (cs.CR)","Quantum Physics (quant-ph),  Cryptography and Security (cs.CR)"
366,arXiv:2411.15418,SPRINT Enables Interpretable and Ultra-Fast Virtual Screening against Thousands of Proteomes,SPRINT支持对数千种蛋白质组进行可解释和超快速的虚拟筛选,"Andrew T. McNutt, Abhinav K. Adduri, Caleb N. Ellington, Monica T. Dayao, Eric P. Xing, Hosein Mohimani, David R. Koes",https://arxiv.org/pdf/2411.15418.pdf,"Subjects:
Biomolecules (q-bio.BM); Machine Learning (cs.LG)","Biomolecules (q-bio.BM),  Machine Learning (cs.LG)"
367,arXiv:2411.15378,Improved Background Estimation for Gas Plume Identification in Hyperspectral Images,高光谱图像中气体羽流识别的改进背景估计,"Scout Jarman, Zigfried Hampel-Arias, Adra Carr, Kevin R. Moon",https://arxiv.org/pdf/2411.15378.pdf,"Subjects:
Image and Video Processing (eess.IV); Computer Vision and Pattern Recognition (cs.CV); Machine Learning (cs.LG)","Image and Video Processing (eess.IV),  Computer Vision and Pattern Recognition (cs.CV),  Machine Learning (cs.LG)"
368,arXiv:2411.15363,"The Polymatroid Representation of a Greedoid, and Associated Galois Connections",贪婪体的多重拟阵表示及其关联的伽罗瓦连接,"Robert Streit, Vijay K. Garg",https://arxiv.org/pdf/2411.15363.pdf,"Subjects:
Combinatorics (math.CO); Discrete Mathematics (cs.DM); Data Structures and Algorithms (cs.DS)","Combinatorics (math.CO),  Discrete Mathematics (cs.DM),  Data Structures and Algorithms (cs.DS)"
369,arXiv:2411.15351,Accelerating CALPHAD-based Phase Diagram Predictions in Complex Alloys Using Universal Machine Learning Potentials: Opportunities and Challenges,利用通用机器学习潜力加速复杂合金中基于CALPHAD的相图预测：机遇与挑战,"Siya Zhu, Raymundo Arróyave, Doğuhan Sarıtürk",https://arxiv.org/pdf/2411.15351.pdf,"Subjects:
Materials Science (cond-mat.mtrl-sci); Machine Learning (cs.LG)","Materials Science (cond-mat.mtrl-sci),  Machine Learning (cs.LG)"
370,arXiv:2411.15343,Galerkin Formulation of Path Integrals in Lattice Field Theory,格子场论中路径积分的Galerkin公式,"Brian K. Tran, Ben S. Southworth",https://arxiv.org/pdf/2411.15343.pdf,"Subjects:
High Energy Physics - Lattice (hep-lat); Mathematical Physics (math-ph); Numerical Analysis (math.NA)","High Energy Physics - Lattice (hep-lat),  Mathematical Physics (math-ph),  Numerical Analysis (math.NA)"
371,arXiv:2411.15332,Mera: Memory Reduction and Acceleration for Quantum Circuit Simulation via Redundancy Exploration,Mera：通过冗余探索实现量子电路模拟的内存减少和加速,"Yuhong Song, Edwin Hsing-Mean Sha, Longshan Xu, Qingfeng Zhuge, Zili Shao",https://arxiv.org/pdf/2411.15332.pdf,"Subjects:
Quantum Physics (quant-ph); Emerging Technologies (cs.ET)","Quantum Physics (quant-ph),  Emerging Technologies (cs.ET)"
372,arXiv:2411.15322,Deep Learning-Based Automatic Delineation of Liver Domes in kV Triggered Images for Online Breath-hold Reproducibility Verification of Liver Stereotactic Body Radiation Therapy,基于深度学习的kV触发图像中肝脏圆顶的自动描绘，用于肝脏立体定向放射治疗的在线屏气再现性验证,"Sugandima Weragoda, Ping Xia, Kevin Stephans, Neil Woody, Michael Martens, Robert Brown, Bingqi Guo",https://arxiv.org/pdf/2411.15322.pdf,"Subjects:
Medical Physics (physics.med-ph); Computer Vision and Pattern Recognition (cs.CV)","Medical Physics (physics.med-ph),  Computer Vision and Pattern Recognition (cs.CV)"
373,arXiv:2411.15315,Lie-Equivariant Quantum Graph Neural Networks,李等变量子图神经网络,"Jogi Suda Neto, Roy T. Forestano, Sergei Gleyzer, Kyoungchul Kong, Konstantin T. Matchev, Katia Matcheva",https://arxiv.org/pdf/2411.15315.pdf,"Subjects:
Quantum Physics (quant-ph); Machine Learning (cs.LG); High Energy Physics - Experiment (hep-ex); High Energy Physics - Phenomenology (hep-ph)","Quantum Physics (quant-ph),  Machine Learning (cs.LG),  High Energy Physics - Experiment (hep-ex),  High Energy Physics - Phenomenology (hep-ph)"
374,arXiv:2411.15306,Heavy-tailed Contamination is Easier than Adversarial Contamination,重尾污染比对抗性污染更容易,"Yeshwanth Cherapanamjeri, Daniel Lee",https://arxiv.org/pdf/2411.15306.pdf,"Subjects:
Statistics Theory (math.ST); Data Structures and Algorithms (cs.DS); Machine Learning (cs.LG); Methodology (stat.ME); Machine Learning (stat.ML)","Statistics Theory (math.ST),  Data Structures and Algorithms (cs.DS),  Machine Learning (cs.LG),  Methodology (stat.ME),  Machine Learning (stat.ML)"
375,arXiv:2411.15294,Imperfect-Information Games on Quantum Computers: A Case Study in Skat,量子计算机上的不完全信息博弈：以滑冰为例,"Erik Schulze, Ulrich Armbrüster, Gabriel Maresch, Stefan Edelkamp",https://arxiv.org/pdf/2411.15294.pdf,"Subjects:
Quantum Physics (quant-ph); Emerging Technologies (cs.ET); Computer Science and Game Theory (cs.GT)","Quantum Physics (quant-ph),  Emerging Technologies (cs.ET),  Computer Science and Game Theory (cs.GT)"
376,arXiv:2411.15283,A Plug-and-Play Temporal Normalization Module for Robust Remote Photoplethysmography,一种用于鲁棒远程光电容积描记术的即插即用时间归一化模块,"Kegang Wang, Jiankai Tang, Yantao Wei, Mingxuan Liu, Xin Liu, Yuntao Wang",https://arxiv.org/pdf/2411.15283.pdf,"Subjects:
Image and Video Processing (eess.IV); Computer Vision and Pattern Recognition (cs.CV)","Image and Video Processing (eess.IV),  Computer Vision and Pattern Recognition (cs.CV)"
377,arXiv:2411.15274,Feature-interactive Siamese graph encoder-based image analysis to predict STAS from histopathology images in lung cancer,基于特征交互暹罗图编码器的图像分析从癌症组织病理学图像预测STAS,"Liangrui Pan, Qingchun Liang, Wenwu Zeng, Yijun Peng, Zhenyu Zhao, Yiyi Liang, Jiadi Luo, Xiang Wang, Shaoliang Peng",https://arxiv.org/pdf/2411.15274.pdf,"Subjects:
Image and Video Processing (eess.IV); Artificial Intelligence (cs.AI); Computer Vision and Pattern Recognition (cs.CV)","Image and Video Processing (eess.IV),  Artificial Intelligence (cs.AI),  Computer Vision and Pattern Recognition (cs.CV)"
378,arXiv:2411.15269,MambaIRv2: Attentive State Space Restoration,MambaIRv2：专注的状态空间恢复,"Hang Guo, Yong Guo, Yaohua Zha, Yulun Zhang, Wenbo Li, Tao Dai, Shu-Tao Xia, Yawei Li",https://arxiv.org/pdf/2411.15269.pdf,"Subjects:
Image and Video Processing (eess.IV); Computer Vision and Pattern Recognition (cs.CV); Machine Learning (cs.LG)","Image and Video Processing (eess.IV),  Computer Vision and Pattern Recognition (cs.CV),  Machine Learning (cs.LG)"
379,arXiv:2411.15267,Proportional infinite-width infinite-depth limit for deep linear neural networks,深线性神经网络的比例无限宽无限深极限,"Federico Bassetti, Lucia Ladelli, Pietro Rotondo",https://arxiv.org/pdf/2411.15267.pdf,"Subjects:
Machine Learning (stat.ML); Disordered Systems and Neural Networks (cond-mat.dis-nn); Machine Learning (cs.LG); Probability (math.PR)","Machine Learning (stat.ML),  Disordered Systems and Neural Networks (cond-mat.dis-nn),  Machine Learning (cs.LG),  Probability (math.PR)"
380,arXiv:2411.15266,Continuous Design and Reprogramming of Totimorphic Structures for Space Applications,空间应用图腾结构的连续设计和重新编程,"Dominik Dold, Amy Thomas, Nicole Rosi, Jai Grover, Dario Izzo",https://arxiv.org/pdf/2411.15266.pdf,"Subjects:
Instrumentation and Methods for Astrophysics (astro-ph.IM); Disordered Systems and Neural Networks (cond-mat.dis-nn); Materials Science (cond-mat.mtrl-sci); Robotics (cs.RO); Classical Physics (physics.class-ph)","Instrumentation and Methods for Astrophysics (astro-ph.IM),  Disordered Systems and Neural Networks (cond-mat.dis-nn),  Materials Science (cond-mat.mtrl-sci),  Robotics (cs.RO),  Classical Physics (physics.class-ph)"
381,arXiv:2411.15255,OSMamba: Omnidirectional Spectral Mamba with Dual-Domain Prior Generator for Exposure Correction,OSMamba：用于曝光校正的具有双域先验发生器的全向光谱Mamba,"Gehui Li, Bin Chen, Chen Zhao, Lei Zhang, Jian Zhang",https://arxiv.org/pdf/2411.15255.pdf,"Subjects:
Image and Video Processing (eess.IV); Computer Vision and Pattern Recognition (cs.CV); Machine Learning (cs.LG)","Image and Video Processing (eess.IV),  Computer Vision and Pattern Recognition (cs.CV),  Machine Learning (cs.LG)"
382,arXiv:2411.15253,Unsupervised Machine Learning for Osteoporosis Diagnosis Using Singh Index Clustering on Hip Radiographs,基于髋关节X线片Singh指数聚类的无监督机器学习骨质疏松症诊断,"Vimaladevi Madhivanan, Kalavakonda Vijaya, Abhay Lal, Senthil Rithika, Shamala Karupusamy Subramaniam, Mohamed Sameer",https://arxiv.org/pdf/2411.15253.pdf,"Subjects:
Image and Video Processing (eess.IV); Computer Vision and Pattern Recognition (cs.CV); Machine Learning (cs.LG)","Image and Video Processing (eess.IV),  Computer Vision and Pattern Recognition (cs.CV),  Machine Learning (cs.LG)"
383,arXiv:2411.15251,Optimized Vessel Segmentation: A Structure-Agnostic Approach with Small Vessel Enhancement and Morphological Correction,优化血管分割：一种具有小血管增强和形态校正的结构不可知方法,"Dongning Song, Weijian Huang, Jiarun Liu, Md Jahidul Islam, Hao Yang, Shanshan Wang",https://arxiv.org/pdf/2411.15251.pdf,"Subjects:
Image and Video Processing (eess.IV); Artificial Intelligence (cs.AI); Computer Vision and Pattern Recognition (cs.CV)","Image and Video Processing (eess.IV),  Artificial Intelligence (cs.AI),  Computer Vision and Pattern Recognition (cs.CV)"
384,arXiv:2411.15248,J-Invariant Volume Shuffle for Self-Supervised Cryo-Electron Tomogram Denoising on Single Noisy Volume,单噪声体积上自监督低温电子断层图去噪的J-不变体积抖动,"Xiwei Liu, Mohamad Kassab, Min Xu, Qirong Ho",https://arxiv.org/pdf/2411.15248.pdf,"Subjects:
Image and Video Processing (eess.IV); Computer Vision and Pattern Recognition (cs.CV)","Image and Video Processing (eess.IV),  Computer Vision and Pattern Recognition (cs.CV)"
385,arXiv:2411.15243,Bio-inspired AI: Integrating Biological Complexity into Artificial Intelligence,仿生人工智能：将生物复杂性融入人工智能,"Nima Dehghani, Michael Levin",https://arxiv.org/pdf/2411.15243.pdf,"Subjects:
Neurons and Cognition (q-bio.NC); Artificial Intelligence (cs.AI); Computation and Language (cs.CL); Computer Vision and Pattern Recognition (cs.CV); Neural and Evolutionary Computing (cs.NE); Symbolic Computation (cs.SC)","Neurons and Cognition (q-bio.NC),  Artificial Intelligence (cs.AI),  Computation and Language (cs.CL),  Computer Vision and Pattern Recognition (cs.CV),  Neural and Evolutionary Computing (cs.NE),  Symbolic Computation (cs.SC)"
386,arXiv:2411.15234,Adaptive Intelligence: leveraging insights from adaptive behavior in animals to build flexible AI systems,适应性智能：利用动物适应性行为的见解构建灵活的人工智能系统,Mackenzie Weygandt Mathis,https://arxiv.org/pdf/2411.15234.pdf,"Subjects:
Neurons and Cognition (q-bio.NC); Artificial Intelligence (cs.AI)","Neurons and Cognition (q-bio.NC),  Artificial Intelligence (cs.AI)"
387,arXiv:2411.15233,Learning Volumetric Neural Deformable Models to Recover 3D Regional Heart Wall Motion from Multi-Planar Tagged MRI,学习体积神经可变形模型，从多平面标记MRI中恢复三维区域心壁运动,"Meng Ye, Bingyu Xin, Bangwei Guo, Leon Axel, Dimitris Metaxas",https://arxiv.org/pdf/2411.15233.pdf,"Subjects:
Image and Video Processing (eess.IV); Computer Vision and Pattern Recognition (cs.CV)","Image and Video Processing (eess.IV),  Computer Vision and Pattern Recognition (cs.CV)"
388,arXiv:2411.15202,A Comparison of Machine Learning Algorithms for Predicting Sea Surface Temperature in the Great Barrier Reef Region,大堡礁地区海面温度预测的机器学习算法比较,"Dennis Quayesam, Jacob Akubire, Oliveira Darkwah",https://arxiv.org/pdf/2411.15202.pdf,"Subjects:
Atmospheric and Oceanic Physics (physics.ao-ph); Machine Learning (cs.LG); Machine Learning (stat.ML)","Atmospheric and Oceanic Physics (physics.ao-ph),  Machine Learning (cs.LG),  Machine Learning (stat.ML)"
389,arXiv:2411.15183,Balancing property optimization and constraint satisfaction for constrained multi-property molecular optimization,约束多性质分子优化的平衡性质优化和约束满足,"Xin Xia, Yajie Zhang, Xiangxiang Zeng, Xingyi Zhang, Chunhou Zheng, Yansen Su",https://arxiv.org/pdf/2411.15183.pdf,"Subjects:
Chemical Physics (physics.chem-ph); Artificial Intelligence (cs.AI); Biomolecules (q-bio.BM)","Chemical Physics (physics.chem-ph),  Artificial Intelligence (cs.AI),  Biomolecules (q-bio.BM)"
390,arXiv:2411.15159,Adaptive Sensor Placement Inspired by Bee Foraging: Towards Efficient Environment Monitoring,受蜜蜂觅食启发的自适应传感器放置：实现高效的环境监测,Sai Krishna Reddy Sathi,https://arxiv.org/pdf/2411.15159.pdf,"Subjects:
Optimization and Control (math.OC); Artificial Intelligence (cs.AI); Neural and Evolutionary Computing (cs.NE); Robotics (cs.RO)","Optimization and Control (math.OC),  Artificial Intelligence (cs.AI),  Neural and Evolutionary Computing (cs.NE),  Robotics (cs.RO)"
391,arXiv:2411.15148,Coherence in Property Testing: Quantum-Classical Collapses and Separations,性质测试中的相干性：量子经典坍缩和分离,"Fernando Granha Jeronimo, Nir Magrafta, Joseph Slote, Pei Wu",https://arxiv.org/pdf/2411.15148.pdf,"Subjects:
Quantum Physics (quant-ph); Computational Complexity (cs.CC)","Quantum Physics (quant-ph),  Computational Complexity (cs.CC)"
392,arXiv:2411.15142,Data-driven Modeling of Granular Chains with Modern Koopman Theory,基于现代库普曼理论的颗粒链数据驱动建模,"Atoosa Parsa, James Bagrow, Corey S. O'Hern, Rebecca Kramer-Bottiglio, Josh Bongard",https://arxiv.org/pdf/2411.15142.pdf,"Subjects:
Soft Condensed Matter (cond-mat.soft); Machine Learning (cs.LG); Dynamical Systems (math.DS)","Soft Condensed Matter (cond-mat.soft),  Machine Learning (cs.LG),  Dynamical Systems (math.DS)"
393,arXiv:2411.10832,Small-signal stability of power systems with voltage droop,电压降电力系统的小信号稳定性,"Jakob Niehues, Robin Delabays, Frank Hellmann",https://arxiv.org/pdf/2411.10832.pdf,"Subjects:
Optimization and Control (math.OC); Systems and Control (eess.SY); Dynamical Systems (math.DS)","Optimization and Control (math.OC),  Systems and Control (eess.SY),  Dynamical Systems (math.DS)"
394,arXiv:2411.15139,DiffusionDrive: Truncated Diffusion Model for End-to-End Autonomous Driving,扩散驱动：端到端自动驾驶的截断扩散模型,"Bencheng Liao, Shaoyu Chen, Haoran Yin, Bo Jiang, Cheng Wang, Sixu Yan, Xinbang Zhang, Xiangyu Li, Ying Zhang, Qian Zhang, Xinggang Wang",https://arxiv.org/pdf/2411.15139.pdf,"Subjects:
Computer Vision and Pattern Recognition (cs.CV); Robotics (cs.RO)","Computer Vision and Pattern Recognition (cs.CV),  Robotics (cs.RO)"
395,arXiv:2411.15138,Material Anything: Generating Materials for Any 3D Object via Diffusion,Material Anything：通过扩散为任何3D对象生成材质,"Xin Huang, Tengfei Wang, Ziwei Liu, Qing Wang",https://arxiv.org/pdf/2411.15138.pdf,"Subjects:
Computer Vision and Pattern Recognition (cs.CV); Graphics (cs.GR)","Computer Vision and Pattern Recognition (cs.CV),  Graphics (cs.GR)"
396,arXiv:2411.15136,On Approximability of Satisfiable $k$-CSPs: VII,关于可满足的$k$-CSP的近似性：VII,"Amey Bhangale, Subhash Khot, Yang P. Liu, Dor Minzer",https://arxiv.org/pdf/2411.15136.pdf,"Subjects:
Computational Complexity (cs.CC); Combinatorics (math.CO)","Computational Complexity (cs.CC),  Combinatorics (math.CO)"
397,arXiv:2411.15133,On Approximability of Satisfiable $k$-CSPs: VI,关于可满足的$k$-CSP的近似性：VI,"Amey Bhangale, Subhash Khot, Yang P. Liu, Dor Minzer",https://arxiv.org/pdf/2411.15133.pdf,"Subjects:
Computational Complexity (cs.CC); Combinatorics (math.CO)","Computational Complexity (cs.CC),  Combinatorics (math.CO)"
398,arXiv:2411.15131,WildLMa: Long Horizon Loco-Manipulation in the Wild,WildLMa：野外长期操纵Loco,"Ri-Zhao Qiu, Yuchen Song, Xuanbin Peng, Sai Aneesh Suryadevara, Ge Yang, Minghuan Liu, Mazeyu Ji, Chengzhe Jia, Ruihan Yang, Xueyan Zou, Xiaolong Wang",https://arxiv.org/pdf/2411.15131.pdf,"Subjects:
Robotics (cs.RO); Computer Vision and Pattern Recognition (cs.CV); Machine Learning (cs.LG)","Robotics (cs.RO),  Computer Vision and Pattern Recognition (cs.CV),  Machine Learning (cs.LG)"
399,arXiv:2411.15130,Learning-based Trajectory Tracking for Bird-inspired Flapping-Wing Robots,基于学习的鸟翼扑翼机器人轨迹跟踪,"Jiaze Cai, Vishnu Sangli, Mintae Kim, Koushil Sreenath",https://arxiv.org/pdf/2411.15130.pdf,"Subjects:
Robotics (cs.RO); Systems and Control (eess.SY)","Robotics (cs.RO),  Systems and Control (eess.SY)"
400,arXiv:2411.15129,Measuring Bullshit in the Language Games played by ChatGPT,测量ChatGPT玩的语言游戏中的废话,"Alessandro Trevisan, Harry Giddens, Sarah Dillon, Alan F. Blackwell",https://arxiv.org/pdf/2411.15129.pdf,"Subjects:
Computation and Language (cs.CL); Artificial Intelligence (cs.AI); Human-Computer Interaction (cs.HC)","Computation and Language (cs.CL),  Artificial Intelligence (cs.AI),  Human-Computer Interaction (cs.HC)"
401,arXiv:2411.15128,Health AI Developer Foundations,健康人工智能开发者基金会,"Atilla P. Kiraly, Sebastien Baur, Kenneth Philbrick, Fereshteh Mahvar, Liron Yatziv, Tiffany Chen, Bram Sterling, Nick George, Fayaz Jamil, Jing Tang, Kai Bailey, Faruk Ahmed, Akshay Goel, Abbi Ward, Lin Yang, Andrew Sellergren, Yossi Matias, Avinatan Hassidim, Shravya Shetty, Daniel Golden, Shekoofeh Azizi, David F. Steiner, Yun Liu, Tim Thelin, Rory Pilgrim, Can Kirmizibayrak",https://arxiv.org/pdf/2411.15128.pdf,"Subjects:
Machine Learning (cs.LG); Artificial Intelligence (cs.AI); Computer Vision and Pattern Recognition (cs.CV); Multimedia (cs.MM); Image and Video Processing (eess.IV)","Machine Learning (cs.LG),  Artificial Intelligence (cs.AI),  Computer Vision and Pattern Recognition (cs.CV),  Multimedia (cs.MM),  Image and Video Processing (eess.IV)"
402,arXiv:2411.15127,PRIMUS: Pretraining IMU Encoders with Multimodal Self-Supervision,PRIMUS:具有多模态自监控的预训练IMU编码器,"Arnav M. Das, Chi Ian Tang, Fahim Kawsar, Mohammad Malekzadeh",https://arxiv.org/pdf/2411.15127.pdf,"Subjects:
Machine Learning (cs.LG)",Machine Learning (cs.LG)
