Unnamed: 0,id,title,title_zh,authors,url,subjects,subject_split
182,arXiv:2411.15331,GeoScatt-GNN: A Geometric Scattering Transform-Based Graph Neural Network Model for Ames Mutagenicity Prediction,GeoScatt-GNN：一种基于几何散射变换的Ames致突变性预测图神经网络模型,"Abdeljalil Zoubir, Badr Missaoui",https://arxiv.org/pdf/2411.15331.pdf,"Subjects:
Machine Learning (cs.LG); Artificial Intelligence (cs.AI); Image and Video Processing (eess.IV); Quantitative Methods (q-bio.QM)","Machine Learning (cs.LG),  Artificial Intelligence (cs.AI),  Image and Video Processing (eess.IV),  Quantitative Methods (q-bio.QM)"
183,arXiv:2411.15328,Dependence Induced Representations,依赖性引发的表征,"Xiangxiang Xu, Lizhong Zheng",https://arxiv.org/pdf/2411.15328.pdf,"Subjects:
Machine Learning (cs.LG); Machine Learning (stat.ML)","Machine Learning (cs.LG),  Machine Learning (stat.ML)"
184,arXiv:2411.15320,PPLqa: An Unsupervised Information-Theoretic Quality Metric for Comparing Generative Large Language Models,PPLqa：一种用于比较生成性大型语言模型的无监督信息论质量度量,"Gerald Friedland, Xin Huang, Yueying Cui, Vishaal Kapoor, Ashish Khetan, Sanjiv Das",https://arxiv.org/pdf/2411.15320.pdf,"Subjects:
Computation and Language (cs.CL); Artificial Intelligence (cs.AI)","Computation and Language (cs.CL),  Artificial Intelligence (cs.AI)"
185,arXiv:2411.15319,Scalable and Optimal Security Allocation in Networks against Stealthy Injection Attacks,网络中针对隐形注入攻击的可扩展和最优安全分配,"Anh Tung Nguyen, Sribalaji C. Anand, André M. H. Teixeira",https://arxiv.org/pdf/2411.15319.pdf,"Subjects:
Systems and Control (eess.SY)",Systems and Control (eess.SY)
186,arXiv:2411.15318,Direct And Inverse Dynamics Problems For A Three-wheel Mobile Robot With Two Drive Wheels,两轮驱动三轮移动机器人的正逆动力学问题,Roman Voliansky,https://arxiv.org/pdf/2411.15318.pdf,"Subjects:
Robotics (cs.RO); Optimization and Control (math.OC)","Robotics (cs.RO),  Optimization and Control (math.OC)"
187,arXiv:2411.15296,MME-Survey: A Comprehensive Survey on Evaluation of Multimodal LLMs,MME调查：多式联运LLM评估的综合调查,"Chaoyou Fu, Yi-Fan Zhang, Shukang Yin, Bo Li, Xinyu Fang, Sirui Zhao, Haodong Duan, Xing Sun, Ziwei Liu, Liang Wang, Caifeng Shan, Ran He",https://arxiv.org/pdf/2411.15296.pdf,"Subjects:
Computer Vision and Pattern Recognition (cs.CV); Artificial Intelligence (cs.AI); Computation and Language (cs.CL)","Computer Vision and Pattern Recognition (cs.CV),  Artificial Intelligence (cs.AI),  Computation and Language (cs.CL)"
188,arXiv:2411.15292,Influence functions and regularity tangents for efficient active learning,有效主动学习的影响函数和规律切线,Frederik Eaton,https://arxiv.org/pdf/2411.15292.pdf,"Subjects:
Machine Learning (cs.LG); Artificial Intelligence (cs.AI); Statistics Theory (math.ST); Machine Learning (stat.ML)","Machine Learning (cs.LG),  Artificial Intelligence (cs.AI),  Statistics Theory (math.ST),  Machine Learning (stat.ML)"
189,arXiv:2411.15291,Tag arrays,标记数组,Travis Gagie,https://arxiv.org/pdf/2411.15291.pdf,"Subjects:
Data Structures and Algorithms (cs.DS)",Data Structures and Algorithms (cs.DS)
190,arXiv:2411.15290,GreenMachine: Automatic Design of Zero-Cost Proxies for Energy-Efficient NAS,GreenMachine:节能NAS零成本代理的自动设计,"Gabriel Cortês, Nuno Lourenço, Penousal Machado",https://arxiv.org/pdf/2411.15290.pdf,"Subjects:
Machine Learning (cs.LG); Neural and Evolutionary Computing (cs.NE)","Machine Learning (cs.LG),  Neural and Evolutionary Computing (cs.NE)"
191,arXiv:2411.15288,There is no SAMantics! Exploring SAM as a Backbone for Visual Understanding Tasks,没有同样的滑稽动作！探索SAM作为视觉理解任务的基石,"Miguel Espinosa, Chenhongyi Yang, Linus Ericsson, Steven McDonagh, Elliot J. Crowley",https://arxiv.org/pdf/2411.15288.pdf,"Subjects:
Computer Vision and Pattern Recognition (cs.CV)",Computer Vision and Pattern Recognition (cs.CV)
192,arXiv:2411.15287,Sycophancy in Large Language Models: Causes and Mitigations,大型语言模型中的同义现象：原因和缓解措施,Lars Malmqvist,https://arxiv.org/pdf/2411.15287.pdf,"Subjects:
Computation and Language (cs.CL); Artificial Intelligence (cs.AI)","Computation and Language (cs.CL),  Artificial Intelligence (cs.AI)"
193,arXiv:2411.15285,Forecasting Unseen Points of Interest Visits Using Context and Proximity Priors,使用上下文和邻近先验预测看不见的兴趣点访问,"Ziyao Li, Shang-Ling Hsu, Cyrus Shahabi",https://arxiv.org/pdf/2411.15285.pdf,"Subjects:
Machine Learning (cs.LG); Artificial Intelligence (cs.AI)","Machine Learning (cs.LG),  Artificial Intelligence (cs.AI)"
194,arXiv:2411.15284,When Spatial meets Temporal in Action Recognition,当空间与时间在动作识别中相遇时,"Huilin Chen, Lei Wang, Yifan Chen, Tom Gedeon, Piotr Koniusz",https://arxiv.org/pdf/2411.15284.pdf,"Subjects:
Computer Vision and Pattern Recognition (cs.CV); Machine Learning (cs.LG)","Computer Vision and Pattern Recognition (cs.CV),  Machine Learning (cs.LG)"
195,arXiv:2411.15282,Totally $\Delta$-modular IPs with two non-zeros in most rows,总计$\Delta$-大多数行中有两个非零的模块化IP,Stefan Kober,https://arxiv.org/pdf/2411.15282.pdf,"Subjects:
Data Structures and Algorithms (cs.DS); Discrete Mathematics (cs.DM); Combinatorics (math.CO); Optimization and Control (math.OC)","Data Structures and Algorithms (cs.DS),  Discrete Mathematics (cs.DM),  Combinatorics (math.CO),  Optimization and Control (math.OC)"
196,arXiv:2411.15281,ElastiFormer: Learned Redundancy Reduction in Transformer via Self-Distillation,ElastiFormer：通过自蒸馏学习变压器冗余减少,"Junzhang Liu, Tingkai Liu, Yueyuan Sui, Stephen Xia",https://arxiv.org/pdf/2411.15281.pdf,"Subjects:
Machine Learning (cs.LG); Artificial Intelligence (cs.AI)","Machine Learning (cs.LG),  Artificial Intelligence (cs.AI)"
197,arXiv:2411.15279,Don't Mesh with Me: Generating Constructive Solid Geometry Instead of Meshes by Fine-Tuning a Code-Generation LLM,不要和我混在一起：通过微调代码生成LLM生成构造性实体几何而不是网格,"Maximilian Mews, Ansar Aynetdinov, Vivian Schiller, Peter Eisert, Alan Akbik",https://arxiv.org/pdf/2411.15279.pdf,"Subjects:
Machine Learning (cs.LG); Graphics (cs.GR)","Machine Learning (cs.LG),  Graphics (cs.GR)"
198,arXiv:2411.15277,Foundation Cures Personalization: Recovering Facial Personalized Models' Prompt Consistency,Foundation治愈个性化：恢复面部个性化模型的即时一致性,"Yiyang Cai, Zhengkai Jiang, Yulong Liu, Chunyang Jiang, Wei Xue, Wenhan Luo, Yike Guo",https://arxiv.org/pdf/2411.15277.pdf,"Subjects:
Computer Vision and Pattern Recognition (cs.CV)",Computer Vision and Pattern Recognition (cs.CV)
199,arXiv:2411.15276,Event USKT : U-State Space Model in Knowledge Transfer for Event Cameras,事件USKT：事件摄像机知识转移中的U-State空间模型,"Yuhui Lin, Jiahao Zhang, Siyuan Li, Jimin Xiao, Ding Xu, Wenjun Wu, Jiaxuan Lu",https://arxiv.org/pdf/2411.15276.pdf,"Subjects:
Computer Vision and Pattern Recognition (cs.CV); Artificial Intelligence (cs.AI)","Computer Vision and Pattern Recognition (cs.CV),  Artificial Intelligence (cs.AI)"
200,arXiv:2411.15272,Curriculum-enhanced GroupDRO: Challenging the Norm of Avoiding Curriculum Learning in Subpopulation Shift Setups,课程强化团体DRO：挑战亚群体迁移设置中回避课程学习的规范,Antonio Barbalau,https://arxiv.org/pdf/2411.15272.pdf,"Subjects:
Machine Learning (cs.LG); Artificial Intelligence (cs.AI)","Machine Learning (cs.LG),  Artificial Intelligence (cs.AI)"
201,arXiv:2411.15271,EADReg: Probabilistic Correspondence Generation with Efficient Autoregressive Diffusion Model for Outdoor Point Cloud Registration,EADReg：基于有效自回归扩散模型的室外点云配准概率对应生成,"Linrui Gong, Jiuming Liu, Junyi Ma, Lihao Liu, Yaonan Wang, Hesheng Wang",https://arxiv.org/pdf/2411.15271.pdf,"Subjects:
Computer Vision and Pattern Recognition (cs.CV); Artificial Intelligence (cs.AI)","Computer Vision and Pattern Recognition (cs.CV),  Artificial Intelligence (cs.AI)"
202,arXiv:2411.15270,BanglaEmbed: Efficient Sentence Embedding Models for a Low-Resource Language Using Cross-Lingual Distillation Techniques,BanglaEmbed：使用跨语言提取技术的低资源语言的高效句子嵌入模型,"Muhammad Rafsan Kabir, Md. Mohibur Rahman Nabil, Mohammad Ashrafuzzaman Khan",https://arxiv.org/pdf/2411.15270.pdf,"Subjects:
Computation and Language (cs.CL); Machine Learning (cs.LG)","Computation and Language (cs.CL),  Machine Learning (cs.LG)"
203,arXiv:2411.15268,ICT: Image-Object Cross-Level Trusted Intervention for Mitigating Object Hallucination in Large Vision-Language Models,ICT：减轻大视觉语言模型中对象幻觉的图像对象跨层可信干预,"Junzhe Chen, Tianshu Zhang, Shiyu Huang, Yuwei Niu, Linfeng Zhang, Lijie Wen, Xuming Hu",https://arxiv.org/pdf/2411.15268.pdf,"Subjects:
Computer Vision and Pattern Recognition (cs.CV); Computation and Language (cs.CL)","Computer Vision and Pattern Recognition (cs.CV),  Computation and Language (cs.CL)"
204,arXiv:2411.15265,Derivative-Free Diffusion Manifold-Constrained Gradient for Unified XAI,统一XAI的无导数扩散流形约束梯度,"Won Jun Kim, Hyungjin Chung, Jaemin Kim, Sangmin Lee, Byeongsu Sim, Jong Chul Ye",https://arxiv.org/pdf/2411.15265.pdf,"Subjects:
Computer Vision and Pattern Recognition (cs.CV); Machine Learning (cs.LG)","Computer Vision and Pattern Recognition (cs.CV),  Machine Learning (cs.LG)"
205,arXiv:2411.15263,AI-Driven Real-Time Monitoring of Ground-Nesting Birds: A Case Study on Curlew Detection Using YOLOv10,人工智能驱动的地面筑巢鸟类实时监测：使用YOLOv10进行卷羽检测的案例研究,"Carl Chalmers, Paul Fergus, Serge Wich, Steven N Longmore, Naomi Davies Walsh, Lee Oliver, James Warrington, Julieanne Quinlan, Katie Appleby",https://arxiv.org/pdf/2411.15263.pdf,"Subjects:
Computer Vision and Pattern Recognition (cs.CV); Artificial Intelligence (cs.AI)","Computer Vision and Pattern Recognition (cs.CV),  Artificial Intelligence (cs.AI)"
206,arXiv:2411.15262,MovieBench: A Hierarchical Movie Level Dataset for Long Video Generation,MovieBench：一种用于长视频生成的分层电影级数据集,"Weijia Wu, Mingyu Liu, Zeyu Zhu, Xi Xia, Haoen Feng, Wen Wang, Kevin Qinghong Lin, Chunhua Shen, Mike Zheng Shou",https://arxiv.org/pdf/2411.15262.pdf,"Subjects:
Computer Vision and Pattern Recognition (cs.CV)",Computer Vision and Pattern Recognition (cs.CV)
207,arXiv:2411.15260,VIVID-10M: A Dataset and Baseline for Versatile and Interactive Video Local Editing,VIVID-10M：用于多功能交互式视频本地编辑的数据集和基线,"Jiahao Hu, Tianxiong Zhong, Xuebo Wang, Boyuan Jiang, Xingye Tian, Fei Yang, Pengfei Wan, Di Zhang",https://arxiv.org/pdf/2411.15260.pdf,"Subjects:
Computer Vision and Pattern Recognition (cs.CV); Artificial Intelligence (cs.AI)","Computer Vision and Pattern Recognition (cs.CV),  Artificial Intelligence (cs.AI)"
208,arXiv:2411.15257,The Explabox: Model-Agnostic Machine Learning Transparency & Analysis,Explabox：模型无关机器学习透明度与分析,"Marcel Robeer, Michiel Bron, Elize Herrewijnen, Riwish Hoeseni, Floris Bex",https://arxiv.org/pdf/2411.15257.pdf,"Subjects:
Machine Learning (cs.LG); Artificial Intelligence (cs.AI); Software Engineering (cs.SE)","Machine Learning (cs.LG),  Artificial Intelligence (cs.AI),  Software Engineering (cs.SE)"
209,arXiv:2411.15254,A Unified Energy Management Framework for Multi-Timescale Forecasting in Smart Grids,智能电网多时间尺度预测的统一能源管理框架,"Dafang Zhao, Xihao Piao, Zheng Chen, Zhengmao Li, Ittetsu Taniguchi",https://arxiv.org/pdf/2411.15254.pdf,"Subjects:
Machine Learning (cs.LG); Artificial Intelligence (cs.AI)","Machine Learning (cs.LG),  Artificial Intelligence (cs.AI)"
210,arXiv:2411.15252,LocRef-Diffusion:Tuning-Free Layout and Appearance-Guided Generation,LocRef扩散：无调整布局和外观引导生成,"Fan Deng, Yaguang Wu, Xinyang Yu, Xiangjun Huang, Jian Yang, Guangyu Yan, Qiang Xu",https://arxiv.org/pdf/2411.15252.pdf,"Subjects:
Computer Vision and Pattern Recognition (cs.CV); Artificial Intelligence (cs.AI)","Computer Vision and Pattern Recognition (cs.CV),  Artificial Intelligence (cs.AI)"
211,arXiv:2411.15250,TPLogAD: Unsupervised Log Anomaly Detection Based on Event Templates and Key Parameters,TPLogAD：基于事件模板和关键参数的无监督日志异常检测,"Jiawei Lu, Chengrong Wu",https://arxiv.org/pdf/2411.15250.pdf,"Subjects:
Machine Learning (cs.LG); Artificial Intelligence (cs.AI); Computation and Language (cs.CL); Computers and Society (cs.CY)","Machine Learning (cs.LG),  Artificial Intelligence (cs.AI),  Computation and Language (cs.CL),  Computers and Society (cs.CY)"
212,arXiv:2411.15247,Reward Fine-Tuning Two-Step Diffusion Models via Learning Differentiable Latent-Space Surrogate Reward,通过学习可微分潜在空间替代奖励来精细调整两步扩散模型,"Zhiwei Jia, Yuesong Nan, Huixi Zhao, Gengdai Liu",https://arxiv.org/pdf/2411.15247.pdf,"Subjects:
Machine Learning (cs.LG)",Machine Learning (cs.LG)
213,arXiv:2411.15246,Exploring the Robustness and Transferability of Patch-Based Adversarial Attacks in Quantized Neural Networks,量化神经网络中基于补丁的对抗攻击的鲁棒性和可转移性研究,"Amira Guesmi, Bassem Ouni, Muhammad Shafique",https://arxiv.org/pdf/2411.15246.pdf,"Subjects:
Cryptography and Security (cs.CR)",Cryptography and Security (cs.CR)
214,arXiv:2411.15245,AnyText2: Visual Text Generation and Editing With Customizable Attributes,AnyText2：具有可定制属性的可视化文本生成和编辑,"Yuxiang Tuo, Yifeng Geng, Liefeng Bo",https://arxiv.org/pdf/2411.15245.pdf,"Subjects:
Computer Vision and Pattern Recognition (cs.CV)",Computer Vision and Pattern Recognition (cs.CV)
215,arXiv:2411.15244,Adversarial Prompt Distillation for Vision-Language Models,视觉语言模型的对抗性提示提取,"Lin Luo, Xin Wang, Bojia Zi, Shihao Zhao, Xingjun Ma",https://arxiv.org/pdf/2411.15244.pdf,"Subjects:
Computer Vision and Pattern Recognition (cs.CV); Artificial Intelligence (cs.AI)","Computer Vision and Pattern Recognition (cs.CV),  Artificial Intelligence (cs.AI)"
216,arXiv:2411.15242,The Zamba2 Suite: Technical Report,Zamba2套房：技术报告,"Paolo Glorioso, Quentin Anthony, Yury Tokpanov, Anna Golubeva, Vasudev Shyam, James Whittington, Jonathan Pilault, Beren Millidge",https://arxiv.org/pdf/2411.15242.pdf,"Subjects:
Machine Learning (cs.LG); Artificial Intelligence (cs.AI); Computation and Language (cs.CL)","Machine Learning (cs.LG),  Artificial Intelligence (cs.AI),  Computation and Language (cs.CL)"
217,arXiv:2411.15241,EfficientViM: Efficient Vision Mamba with Hidden State Mixer based State Space Duality,EfficientViM：基于状态空间二元性的隐藏状态混合器高效视觉曼巴,"Sanghyeok Lee, Joonmyung Choi, Hyunwoo J. Kim",https://arxiv.org/pdf/2411.15241.pdf,"Subjects:
Computer Vision and Pattern Recognition (cs.CV)",Computer Vision and Pattern Recognition (cs.CV)
218,arXiv:2411.15240,Is Attention All You Need For Actigraphy? Foundation Models of Wearable Accelerometer Data for Mental Health Research,你只需要注意活动吗？心理健康研究中可穿戴加速度计数据的基础模型,"Franklin Y. Ruan, Aiwei Zhang, Jenny Y. Oh, SouYoung Jin, Nicholas C Jacobson",https://arxiv.org/pdf/2411.15240.pdf,"Subjects:
Machine Learning (cs.LG); Artificial Intelligence (cs.AI); Human-Computer Interaction (cs.HC); Quantitative Methods (q-bio.QM)","Machine Learning (cs.LG),  Artificial Intelligence (cs.AI),  Human-Computer Interaction (cs.HC),  Quantitative Methods (q-bio.QM)"
219,arXiv:2411.15239,Faithful Label-free Knowledge Distillation,忠实的无标签知识提炼,"Evelyn J. Mannix, Liam Hodgkinson, Howard Bondell",https://arxiv.org/pdf/2411.15239.pdf,"Subjects:
Computer Vision and Pattern Recognition (cs.CV)",Computer Vision and Pattern Recognition (cs.CV)
220,arXiv:2411.15238,"Analysis of the impact of heterogeneous platoon for mixed traffic flow: control strategy, fuel consumption and emissions",异质车队对混合交通流的影响分析：控制策略、油耗和排放,"Yunxia Wu, Le Li, Zhihong Yao, Yi Wang, Gen Li, Yangsheng Jiang",https://arxiv.org/pdf/2411.15238.pdf,"Subjects:
Systems and Control (eess.SY)",Systems and Control (eess.SY)
221,arXiv:2411.15237,Stain-Invariant Representation for Tissue Classification in Histology Images,组织学图像中组织分类的染色不变表示,"Manahil Raza, Saad Bashir, Talha Qaiser, Nasir Rajpoot",https://arxiv.org/pdf/2411.15237.pdf,"Subjects:
Computer Vision and Pattern Recognition (cs.CV); Artificial Intelligence (cs.AI); Machine Learning (cs.LG)","Computer Vision and Pattern Recognition (cs.CV),  Artificial Intelligence (cs.AI),  Machine Learning (cs.LG)"
222,arXiv:2411.15236,Text Embedding is Not All You Need: Attention Control for Text-to-Image Semantic Alignment with Text Self-Attention Maps,文本嵌入并不是你所需要的全部：使用文本自关注图进行文本到图像语义对齐的注意力控制,"Jeeyung Kim, Erfan Esmaeili, Qiang Qiu",https://arxiv.org/pdf/2411.15236.pdf,"Subjects:
Computer Vision and Pattern Recognition (cs.CV); Machine Learning (cs.LG)","Computer Vision and Pattern Recognition (cs.CV),  Machine Learning (cs.LG)"
223,arXiv:2411.15235,CODE-CL: COnceptor-Based Gradient Projection for DEep Continual Learning,CODE-CL：基于感知器的梯度投影用于深度连续学习,"Marco Paul E. Apolinario, Kaushik Roy",https://arxiv.org/pdf/2411.15235.pdf,"Subjects:
Machine Learning (cs.LG); Artificial Intelligence (cs.AI); Computer Vision and Pattern Recognition (cs.CV); Neural and Evolutionary Computing (cs.NE)","Machine Learning (cs.LG),  Artificial Intelligence (cs.AI),  Computer Vision and Pattern Recognition (cs.CV),  Neural and Evolutionary Computing (cs.NE)"
224,arXiv:2411.15232,BiomedCoOp: Learning to Prompt for Biomedical Vision-Language Models,BiometricOp：学习提示生物医学视觉语言模型,"Taha Koleilat, Hojat Asgariandehkordi, Hassan Rivaz, Yiming Xiao",https://arxiv.org/pdf/2411.15232.pdf,"Subjects:
Computer Vision and Pattern Recognition (cs.CV); Computation and Language (cs.CL)","Computer Vision and Pattern Recognition (cs.CV),  Computation and Language (cs.CL)"
225,arXiv:2411.15231,IterIS: Iterative Inference-Solving Alignment for LoRA Merging,IterIS：迭代推理求解LoRA合并对齐,"Hongxu Chen, Runshi Li, Bowei Zhu, Zhen Wang, Long Chen",https://arxiv.org/pdf/2411.15231.pdf,"Subjects:
Machine Learning (cs.LG); Artificial Intelligence (cs.AI)","Machine Learning (cs.LG),  Artificial Intelligence (cs.AI)"
226,arXiv:2411.15230,A No Free Lunch Theorem for Human-AI Collaboration,人类与人工智能协作的无免费午餐定理,"Kenny Peng, Nikhil Garg, Jon Kleinberg",https://arxiv.org/pdf/2411.15230.pdf,"Subjects:
Artificial Intelligence (cs.AI); Human-Computer Interaction (cs.HC); Machine Learning (cs.LG)","Artificial Intelligence (cs.AI),  Human-Computer Interaction (cs.HC),  Machine Learning (cs.LG)"
227,arXiv:2411.15229,Learning-Enabled Adaptive Voltage Protection Against Load Alteration Attacks On Smart Grids,针对智能电网负载变化攻击的学习型自适应电压保护,"Anjana B., Suman Maiti, Sunandan Adhikary, Soumyajit Dey, Ashish R. Hota",https://arxiv.org/pdf/2411.15229.pdf,"Subjects:
Systems and Control (eess.SY); Cryptography and Security (cs.CR); Computer Science and Game Theory (cs.GT)","Systems and Control (eess.SY),  Cryptography and Security (cs.CR),  Computer Science and Game Theory (cs.GT)"
228,arXiv:2411.15224,Parameter Efficient Mamba Tuning via Projector-targeted Diagonal-centric Linear Transformation,通过投影仪目标对角线中心线性变换实现参数高效曼巴调谐,"Seokil Ham, Hee-Seon Kim, Sangmin Woo, Changick Kim",https://arxiv.org/pdf/2411.15224.pdf,"Subjects:
Machine Learning (cs.LG); Artificial Intelligence (cs.AI)","Machine Learning (cs.LG),  Artificial Intelligence (cs.AI)"
229,arXiv:2411.15223,An accuracy improving method for advertising click through rate prediction based on enhanced xDeepFM model,基于增强xDeepFM模型的广告点击率预测精度提升方法,"Xiaowei Xi, Song Leng, Yuqing Gong, Dalin Li",https://arxiv.org/pdf/2411.15223.pdf,"Subjects:
Machine Learning (cs.LG)",Machine Learning (cs.LG)
230,arXiv:2411.15222,Rethinking the Intermediate Features in Adversarial Attacks: Misleading Robotic Models via Adversarial Distillation,重新思考对抗性攻击中的中间特征：通过对抗性蒸馏误导机器人模型,"Ke Zhao (1), Huayang Huang (1), Miao Li (1), Yu Wu (1) ((1) Wuhan University)",https://arxiv.org/pdf/2411.15222.pdf,"Subjects:
Machine Learning (cs.LG); Artificial Intelligence (cs.AI); Robotics (cs.RO)","Machine Learning (cs.LG),  Artificial Intelligence (cs.AI),  Robotics (cs.RO)"
231,arXiv:2411.15221,Reflections from the 2024 Large Language Model (LLM) Hackathon for Applications in Materials Science and Chemistry,2024年材料科学与化学应用大型语言模型（LLM）黑客马拉松的反思,"Yoel Zimmermann, Adib Bazgir, Zartashia Afzal, Fariha Agbere, Qianxiang Ai, Nawaf Alampara, Alexander Al-Feghali, Mehrad Ansari, Dmytro Antypov, Amro Aswad, Jiaru Bai, Viktoriia Baibakova, Devi Dutta Biswajeet, Erik Bitzek, Joshua D. Bocarsly, Anna Borisova, Andres M Bran, L. Catherine Brinson, Marcel Moran Calderon, Alessandro Canalicchio, Victor Chen, Yuan Chiang, Defne Circi, Benjamin Charmes, Vikrant Chaudhary, Zizhang Chen, Min-Hsueh Chiu, Judith Clymo, Kedar Dabhadkar, Nathan Daelman, Archit Datar, Matthew L. Evans, Maryam Ghazizade Fard, Giuseppe Fisicaro, Abhijeet Sadashiv Gangan, Janine George, Jose D. Cojal Gonzalez, Michael Götte, Ankur K. Gupta, Hassan Harb, Pengyu Hong, Abdelrahman Ibrahim, Ahmed Ilyas, Alishba Imran, Kevin Ishimwe, Ramsey Issa, Kevin Maik Jablonka, Colin Jones, Tyler R. Josephson, Greg Juhasz, Sarthak Kapoor, Rongda Kang, Ghazal Khalighinejad, Sartaaj Khan, Sascha Klawohn, Suneel Kuman, Alvin Noe Ladines, Sarom Leang, Magdalena Lederbauer, Sheng-Lun Mark Liao, Hao Liu, Xuefeng Liu, Stanley Lo, Sandeep Madireddy, Piyush Ranjan Maharana, Shagun Maheshwari, Soroush Mahjoubi, José A. Márquez, Rob Mills, Trupti Mohanty, Bernadette Mohr, Seyed Mohamad Moosavi, Alexander Moßhammer, Amirhossein D. Naghdi, Aakash Naik, Oleksandr Narykov, Hampus Näsström, Xuan Vu Nguyen, Xinyi Ni, Dana O'Connor, Teslim Olayiwola, Federico Ottomano, Aleyna Beste Ozhan, Sebastian Pagel, Chiku Parida, Jaehee Park, Vraj Patel, Elena Patyukova, Martin Hoffmann Petersen, Luis Pinto, José M. Pizarro, Dieter Plessers, Tapashree Pradhan, Utkarsh Pratiush, Charishma Puli, Andrew Qin, Mahyar Rajabi, Francesco Ricci, Elliot Risch, Martiño Ríos-García",https://arxiv.org/pdf/2411.15221.pdf,"Subjects:
Machine Learning (cs.LG); Materials Science (cond-mat.mtrl-sci); Chemical Physics (physics.chem-ph)","Machine Learning (cs.LG),  Materials Science (cond-mat.mtrl-sci),  Chemical Physics (physics.chem-ph)"
232,arXiv:2411.15220,Sampling with Adaptive Variance for Multimodal Distributions,多模态分布的自适应方差采样,"Björn Engquist, Kui Ren, Yunan Yang",https://arxiv.org/pdf/2411.15220.pdf,"Subjects:
Machine Learning (cs.LG); Numerical Analysis (math.NA); Computation (stat.CO); Machine Learning (stat.ML)","Machine Learning (cs.LG),  Numerical Analysis (math.NA),  Computation (stat.CO),  Machine Learning (stat.ML)"
233,arXiv:2411.15218,Suspected Undeclared Use of Artificial Intelligence in the Academic Literature: An Analysis of the Academ-AI Dataset,学术文献中疑似未公开使用人工智能：Academ AI数据集分析,Alex Glynn,https://arxiv.org/pdf/2411.15218.pdf,"Subjects:
Digital Libraries (cs.DL); Artificial Intelligence (cs.AI); Computers and Society (cs.CY)","Digital Libraries (cs.DL),  Artificial Intelligence (cs.AI),  Computers and Society (cs.CY)"
234,arXiv:2411.15217,LPLgrad: Optimizing Active Learning Through Gradient Norm Sample Selection and Auxiliary Model Training,LPLgrad：通过梯度范数样本选择和辅助模型训练优化主动学习,"Shreen Gul, Mohamed Elmahallawy, Sanjay Madria, Ardhendu Tripathy",https://arxiv.org/pdf/2411.15217.pdf,"Subjects:
Machine Learning (cs.LG); Artificial Intelligence (cs.AI); Computer Vision and Pattern Recognition (cs.CV)","Machine Learning (cs.LG),  Artificial Intelligence (cs.AI),  Computer Vision and Pattern Recognition (cs.CV)"
235,arXiv:2411.15216,Dist Loss: Enhancing Regression in Few-Shot Region through Distribution Distance Constraint,距离损失：通过分布距离约束增强少镜头区域的回归,"Guangkun Nie, Gongzheng Tang, Shenda Hong",https://arxiv.org/pdf/2411.15216.pdf,"Subjects:
Machine Learning (cs.LG); Artificial Intelligence (cs.AI)","Machine Learning (cs.LG),  Artificial Intelligence (cs.AI)"
236,arXiv:2411.15215,S$^2$ALM: Sequence-Structure Pre-trained Large Language Model for Comprehensive Antibody Representation Learning,S$^2$ALM：用于综合抗体表示学习的序列结构预训练大型语言模型,"Mingze Yin, Hanjing Zhou, Jialu Wu, Yiheng Zhu, Yuxuan Zhan, Zitai Kong, Hongxia Xu, Chang-Yu Hsieh, Jintai Chen, Tingjun Hou, Jian Wu",https://arxiv.org/pdf/2411.15215.pdf,"Subjects:
Machine Learning (cs.LG); Artificial Intelligence (cs.AI); Biomolecules (q-bio.BM)","Machine Learning (cs.LG),  Artificial Intelligence (cs.AI),  Biomolecules (q-bio.BM)"
