id,title,title_zh,authors,url,subjects,subject_split
arXiv:2511.04883,Self-Interest and Systemic Benefits: Emergence of Collective Rationality in Mixed Autonomy Traffic Through Deep Reinforcement Learning,自我利益与系统性收益：通过深度强化学习在混合自主交通中集体理性的出现,"Di Chen, Jia Li, Michael Zhang",https://arxiv.org/pdf/2511.04883,"Subjects:
Machine Learning (cs.LG)",Machine Learning (cs.LG)
arXiv:2511.04882,Bit-Flipping Attack Exploration and Countermeasure in 5G Network,5G网络中的比特翻转攻击探索与对策,"Joon Kim, Chengwei Duan, Sandip Ray",https://arxiv.org/pdf/2511.04882,"Subjects:
Cryptography and Security (cs.CR); Networking and Internet Architecture (cs.NI)","Cryptography and Security (cs.CR),  Networking and Internet Architecture (cs.NI)"
arXiv:2511.04880,DMA: Online RAG Alignment with Human Feedback,DMA：通过人类反馈进行在线RAG对齐,"Yu Bai, Yukai Miao, Dawei Wang, Li Chen, Fei Long, Rundi Zhai, Dan Li, Yanyu Ren, Tianfeng Liu, Hongtao Xie, Ce Yang, Xuhui Cai",https://arxiv.org/pdf/2511.04880,"Subjects:
Artificial Intelligence (cs.AI)",Artificial Intelligence (cs.AI)
arXiv:2511.04875,Minimal and Mechanistic Conditions for Behavioral Self-Awareness in LLMs,LLM中行为自我意识的最小和机械条件,"Matthew Bozoukov, Matthew Nguyen, Shubkarman Singh, Bart Bussmann, Patrick Leask",https://arxiv.org/pdf/2511.04875,"Subjects:
Computation and Language (cs.CL); Artificial Intelligence (cs.AI); Machine Learning (cs.LG)","Computation and Language (cs.CL),  Artificial Intelligence (cs.AI),  Machine Learning (cs.LG)"
arXiv:2511.04872,Validating Vision Transformers for Otoscopy: Performance and Data-Leakage Effects,验证视觉变换器在耳镜检查中的表现和数据泄漏效应,"James Ndubuisi, Fernando Auat, Marta Vallejo",https://arxiv.org/pdf/2511.04872,"Subjects:
Computer Vision and Pattern Recognition (cs.CV)",Computer Vision and Pattern Recognition (cs.CV)
arXiv:2511.04871,Clinical-ComBAT: a diffusion-weighted MRI harmonization method for clinical applications,Clinical-ComBAT：一种用于临床应用的扩散加权MRI协调方法,"Gabriel Girard, Manon Edde, Félix Dumais, Yoan David, Matthieu Dumont, Guillaume Theaud, Jean-Christophe Houde, Arnaud Boré, Maxime Descoteaux, Pierre-Marc Jodoin",https://arxiv.org/pdf/2511.04871,"Subjects:
Computer Vision and Pattern Recognition (cs.CV); Applications (stat.AP)","Computer Vision and Pattern Recognition (cs.CV),  Applications (stat.AP)"
arXiv:2511.04869,"Trained on Tokens, Calibrated on Concepts: The Emergence of Semantic Calibration in LLMs",基于标记训练，基于概念校准：LLM中的语义校准的出现,"Preetum Nakkiran, Arwen Bradley, Adam Goliński, Eugene Ndiaye, Michael Kirchhof, Sinead Williamson",https://arxiv.org/pdf/2511.04869,"Subjects:
Computation and Language (cs.CL); Machine Learning (cs.LG); Machine Learning (stat.ML)","Computation and Language (cs.CL),  Machine Learning (cs.LG),  Machine Learning (stat.ML)"
arXiv:2511.04867,Optimal Selection Using Algorithmic Rankings with Side Information,使用带有附加信息的算法排名进行最佳选择,"Kate Donahue, Nicole Immorlica, Brendan Lucier",https://arxiv.org/pdf/2511.04867,"Subjects:
Computer Science and Game Theory (cs.GT)",Computer Science and Game Theory (cs.GT)
arXiv:2511.04865,FoodRL: A Reinforcement Learning Ensembling Framework For In-Kind Food Donation Forecasting,FoodRL：一种用于实物食品捐赠预测的强化学习集成框架,"Esha Sharma, Lauren Davis, Julie Ivy, Min Chi",https://arxiv.org/pdf/2511.04865,"Subjects:
Machine Learning (cs.LG)",Machine Learning (cs.LG)
arXiv:2511.04864,Self-Supervised Implicit Attention Priors for Point Cloud Reconstruction,用于点云重建的自监督隐式注意力先验,"Kyle Fogarty, Chenyue Cai, Jing Yang, Zhilin Guo, Cengiz Öztireli",https://arxiv.org/pdf/2511.04864,"Subjects:
Computer Vision and Pattern Recognition (cs.CV)",Computer Vision and Pattern Recognition (cs.CV)
arXiv:2511.04860,GPT-5 at CTFs: Case Studies From Top-Tier Cybersecurity Events,GPT-5在CTF中的表现：顶级网络安全事件的案例研究,"Reworr, Artem Petrov, Dmitrii Volkov",https://arxiv.org/pdf/2511.04860,"Subjects:
Cryptography and Security (cs.CR)",Cryptography and Security (cs.CR)
arXiv:2511.04856,Quantum Boltzmann Machines for Sample-Efficient Reinforcement Learning,用于样本高效强化学习的量子玻尔兹曼机,"Thore Gerlach, Michael Schenk, Verena Kain",https://arxiv.org/pdf/2511.04856,"Subjects:
Machine Learning (cs.LG); Quantum Physics (quant-ph)","Machine Learning (cs.LG),  Quantum Physics (quant-ph)"
arXiv:2511.04855,Epistemic Reject Option Prediction,认知拒绝选项预测,"Vojtech Franc, Jakub Paplham",https://arxiv.org/pdf/2511.04855,"Subjects:
Artificial Intelligence (cs.AI)",Artificial Intelligence (cs.AI)
arXiv:2511.04854,SigmaDock: Untwisting Molecular Docking With Fragment-Based SE(3) Diffusion,SigmaDock：通过基于片段的SE(3)扩散解开分子对接,"Alvaro Prat, Leo Zhang, Charlotte M. Deane, Yee Whye Teh, Garrett M. Morris",https://arxiv.org/pdf/2511.04854,"Subjects:
Machine Learning (cs.LG); Quantitative Methods (q-bio.QM)","Machine Learning (cs.LG),  Quantitative Methods (q-bio.QM)"
arXiv:2511.04853,Marionette: Data Structure Description and Management for Heterogeneous Computing,Marionette：异构计算的数据结构描述和管理,"Nuno dos Santos Fernandes, Pedro Tomás, Nuno Roma, Frank Winklmeier, Patricia Conde-Muíño",https://arxiv.org/pdf/2511.04853,"Subjects:
Distributed, Parallel, and Cluster Computing (cs.DC)","Distributed, Parallel, and Cluster Computing (cs.DC)"
arXiv:2511.04849,Software Defined Vehicle Code Generation: A Few-Shot Prompting Approach,软件定义车辆代码生成：一种少样本提示方法,"Quang-Dung Nguyen, Tri-Dung Tran, Thanh-Hieu Chu, Hoang-Loc Tran, Xiangwei Cheng, Dirk Slama",https://arxiv.org/pdf/2511.04849,"Subjects:
Software Engineering (cs.SE); Artificial Intelligence (cs.AI)","Software Engineering (cs.SE),  Artificial Intelligence (cs.AI)"
arXiv:2511.04848,Geometry Denoising with Preferred Normal Vectors,使用优选法向量进行几何去噪,"Manuel Weiß, Lukas Baumgärtner, Roland Herzog, Stephan Schmidt",https://arxiv.org/pdf/2511.04848,"Subjects:
Computer Vision and Pattern Recognition (cs.CV); Optimization and Control (math.OC)","Computer Vision and Pattern Recognition (cs.CV),  Optimization and Control (math.OC)"
arXiv:2511.04847,Grounded Test-Time Adaptation for LLM Agents,LLM代理的测试时适应,"Arthur Chen, Zuxin Liu, Jianguo Zhang, Akshara Prabhakar, Zhiwei Liu, Shelby Heinecke, Silvio Savarese, Victor Zhong, Caiming Xiong",https://arxiv.org/pdf/2511.04847,"Subjects:
Machine Learning (cs.LG)",Machine Learning (cs.LG)
arXiv:2511.04846,Persuading Stable Matching,稳定匹配中的劝说,"Jonathan Shaki, Jiarui Gan, Sarit Kraus",https://arxiv.org/pdf/2511.04846,"Subjects:
Computer Science and Game Theory (cs.GT); Multiagent Systems (cs.MA)","Computer Science and Game Theory (cs.GT),  Multiagent Systems (cs.MA)"
arXiv:2511.04845,Investigating U.S. Consumer Demand for Food Products with Innovative Transportation Certificates Based on Stated Preferences and Machine Learning Approaches,基于陈述偏好和机器学习方法调查美国消费者对创新运输证书的食品产品需求,"Jingchen Bi, Rodrigo Mesa-Arango",https://arxiv.org/pdf/2511.04845,"Subjects:
Machine Learning (cs.LG)",Machine Learning (cs.LG)
arXiv:2511.04844,Sublinear iterations can suffice even for DDPMs,即使对于DDPM，次线性迭代也可能足够,"Matthew S. Zhang, Stephen Huan, Jerry Huang, Nicholas M. Boffi, Sitan Chen, Sinho Chewi",https://arxiv.org/pdf/2511.04844,"Subjects:
Machine Learning (cs.LG); Statistics Theory (math.ST)","Machine Learning (cs.LG),  Statistics Theory (math.ST)"
arXiv:2511.04838,SPECTRA: Spectral Target-Aware Graph Augmentation for Imbalanced Molecular Property Regression,SPECTRA：用于不平衡分子属性回归的光谱目标感知图增强,"Brenda Nogueira, Meng Jiang, Nitesh V. Chawla, Nuno Moniz",https://arxiv.org/pdf/2511.04838,"Subjects:
Machine Learning (cs.LG); Spectral Theory (math.SP); Molecular Networks (q-bio.MN)","Machine Learning (cs.LG),  Spectral Theory (math.SP),  Molecular Networks (q-bio.MN)"
arXiv:2511.04837,Design Exploration for Protection and Cleaning of Solar Panels with Case Studies for Space Missions,太阳能电池板保护和清洁的设计探索及空间任务案例研究,"Cameron Robinson, Ganghee Jang",https://arxiv.org/pdf/2511.04837,"Subjects:
Robotics (cs.RO)",Robotics (cs.RO)
arXiv:2511.04835,Conformalized Non-uniform Sampling Strategies for Accelerated Sampling-based Motion Planning,用于加速基于采样的运动规划的保形化非均匀采样策略,"Shubham Natraj, Bruno Sinopoli, Yiannis Kantaros",https://arxiv.org/pdf/2511.04835,"Subjects:
Robotics (cs.RO)",Robotics (cs.RO)
arXiv:2511.04834,Prompt-Based Safety Guidance Is Ineffective for Unlearned Text-to-Image Diffusion Models,基于提示的安全指导对未学习的文本到图像扩散模型无效,"Jiwoo Shin, Byeonghu Na, Mina Kang, Wonhyeok Choi, Il-Chul Moon",https://arxiv.org/pdf/2511.04834,"Subjects:
Machine Learning (cs.LG); Artificial Intelligence (cs.AI); Computer Vision and Pattern Recognition (cs.CV)","Machine Learning (cs.LG),  Artificial Intelligence (cs.AI),  Computer Vision and Pattern Recognition (cs.CV)"
arXiv:2511.04831,Isaac Lab: A GPU-Accelerated Simulation Framework for Multi-Modal Robot Learning,Isaac实验室：一个用于多模态机器人学习的GPU加速仿真框架,"NVIDIA: Mayank Mittal, Pascal Roth, James Tigue, Antoine Richard, Octi Zhang, Peter Du, Antonio Serrano-Muñoz, Xinjie Yao, René Zurbrügg, Nikita Rudin, Lukasz Wawrzyniak, Milad Rakhsha, Alain Denzler, Eric Heiden, Ales Borovicka, Ossama Ahmed, Iretiayo Akinola, Abrar Anwar, Mark T. Carlson, Ji Yuan Feng, Animesh Garg, Renato Gasoto, Lionel Gulich, Yijie Guo, M. Gussert, Alex Hansen, Mihir Kulkarni, Chenran Li, Wei Liu, Viktor Makoviychuk, Grzegorz Malczyk, Hammad Mazhar, Masoud Moghani, Adithyavairavan Murali, Michael Noseworthy, Alexander Poddubny, Nathan Ratliff, Welf Rehberg, Clemens Schwarke, Ritvik Singh, James Latham Smith, Bingjie Tang, Ruchik Thaker, Matthew Trepte, Karl Van Wyk, Fangzhou Yu, Alex Millane, Vikram Ramasamy, Remo Steiner, Sangeeta Subramanian, Clemens Volk, CY Chen, Neel Jawale, Ashwin Varghese Kuruttukulam, Michael A. Lin, Ajay Mandlekar, Karsten Patzwaldt, John Welsh, Huihua Zhao, Fatima Anes, Jean-Francois Lafleche, Nicolas Moënne-Loccoz, Soowan Park, Rob Stepinski, Dirk Van Gelder, Chris Amevor, Jan Carius, Jumyung Chang, Anka He Chen, Pablo de Heras Ciechomski, Gilles Daviet, Mohammad Mohajerani, Julia von Muralt, Viktor Reutskyy, Michael Sauter, Simon Schirm, Eric L. Shi, Pierre Terdiman, Kenny Vilella, Tobias Widmer, Gordon Yeoman, Tiffany Chen, Sergey Grizan, Cathy Li, Lotus Li, Connor Smith, Rafael Wiltz, Kostas Alexis, Yan Chang, David Chu, Linxi ""Jim"" Fan, Farbod Farshidian, Ankur Handa, Spencer Huang, Marco Hutter, Yashraj Narang, Soha Pouya, Shiwei Sheng, Yuke Zhu",https://arxiv.org/pdf/2511.04831,"Subjects:
Robotics (cs.RO); Artificial Intelligence (cs.AI)","Robotics (cs.RO),  Artificial Intelligence (cs.AI)"
arXiv:2511.04830,Structure-preserving local discontinuous Galerkin discretization of conformational conversion systems,保持结构的局部不连续Galerkin离散化构象转换系统,"Paola F. Antonietti, Mattia Corti, Sergio Gómez, Ilaria Perugia",https://arxiv.org/pdf/2511.04830,"Subjects:
Numerical Analysis (math.NA)",Numerical Analysis (math.NA)
arXiv:2511.04827,Pixi: Unified Software Development and Distribution for Robotics and AI,Pixi：机器人和人工智能的统一软件开发和分发,"Tobias Fischer, Wolf Vollprecht, Bas Zalmstra, Ruben Arts, Tim de Jager, Alejandro Fontan, Adam D Hines, Michael Milford, Silvio Traversaro, Daniel Claes, Scarlett Raine",https://arxiv.org/pdf/2511.04827,"Subjects:
Robotics (cs.RO); Software Engineering (cs.SE)","Robotics (cs.RO),  Software Engineering (cs.SE)"
arXiv:2511.04826,Optimal Parallel Basis Finding in Graphic and Related Matroids,图形及相关拟阵中的最优并行基寻找,"Sanjeev Khanna, Aaron Putterman, Junkai Song",https://arxiv.org/pdf/2511.04826,"Subjects:
Data Structures and Algorithms (cs.DS); Computational Complexity (cs.CC)","Data Structures and Algorithms (cs.DS),  Computational Complexity (cs.CC)"
arXiv:2511.04825,Persistent reachability homology in machine learning applications,机器学习应用中的持久可达性同调,"Luigi Caputi, Nicholas Meadows, Henri Riihimäki",https://arxiv.org/pdf/2511.04825,"Subjects:
Machine Learning (cs.LG); Algebraic Topology (math.AT); Quantitative Methods (q-bio.QM)","Machine Learning (cs.LG),  Algebraic Topology (math.AT),  Quantitative Methods (q-bio.QM)"
arXiv:2511.04824,Agentic Refactoring: An Empirical Study of AI Coding Agents,代理重构：AI编码代理的实证研究,"Kosei Horikawa, Hao Li, Yutaro Kashiwa, Bram Adams, Hajimu Iida, Ahmed E. Hassan",https://arxiv.org/pdf/2511.04824,"Subjects:
Software Engineering (cs.SE)",Software Engineering (cs.SE)
arXiv:2511.04820,The Drain of Scientific Publishing,科学出版的消耗,"Fernanda Beigel, Dan Brockington, Paolo Crosetto, Gemma Derrick, Aileen Fyfe, Pablo Gomez Barreiro, Mark A. Hanson, Stefanie Haustein, Vincent Larivière, Christine Noe, Stephen Pinfield, James Wilsdon",https://arxiv.org/pdf/2511.04820,"Subjects:
Digital Libraries (cs.DL)",Digital Libraries (cs.DL)
arXiv:2511.04817,Dynamic Allocation of Public Goods with Approximate Core Equilibria,具有近似核心均衡的公共物品动态分配,"Chido Onyeze, David X. Lin, Siddhartha Banerjee, Éva Tardos",https://arxiv.org/pdf/2511.04817,"Subjects:
Computer Science and Game Theory (cs.GT)",Computer Science and Game Theory (cs.GT)
arXiv:2511.04814,A Standardized Benchmark for Multilabel Antimicrobial Peptide Classification,多标签抗菌肽分类的标准化基准,"Sebastian Ojeda, Rafael Velasquez, Nicolás Aparicio, Juanita Puentes, Paula Cárdenas, Nicolás Andrade, Gabriel González, Sergio Rincón, Carolina Muñoz-Camargo, Pablo Arbeláez",https://arxiv.org/pdf/2511.04814,"Subjects:
Machine Learning (cs.LG); Artificial Intelligence (cs.AI); Biomolecules (q-bio.BM)","Machine Learning (cs.LG),  Artificial Intelligence (cs.AI),  Biomolecules (q-bio.BM)"
arXiv:2511.04812,Unified Multimodal Diffusion Forcing for Forceful Manipulation,统一多模态扩散强制用于强力操控,"Zixuan Huang, Huaidian Hou, Dmitry Berenson",https://arxiv.org/pdf/2511.04812,"Subjects:
Robotics (cs.RO); Artificial Intelligence (cs.AI); Machine Learning (cs.LG)","Robotics (cs.RO),  Artificial Intelligence (cs.AI),  Machine Learning (cs.LG)"
arXiv:2511.04811,An Active Learning Pipeline for Biomedical Image Instance Segmentation with Minimal Human Intervention,一个用于生物医学图像实例分割的主动学习管道，具有最小的人类干预,"Shuo Zhao, Yu Zhou, Jianxu Chen",https://arxiv.org/pdf/2511.04811,"Subjects:
Computer Vision and Pattern Recognition (cs.CV); Artificial Intelligence (cs.AI); Machine Learning (cs.LG)","Computer Vision and Pattern Recognition (cs.CV),  Artificial Intelligence (cs.AI),  Machine Learning (cs.LG)"
arXiv:2511.04808,Sharp Minima Can Generalize: A Loss Landscape Perspective On Data,尖锐极小值可以泛化：数据的损失景观视角,"Raymond Fan, Bryce Sandlund, Lin Myat Ko",https://arxiv.org/pdf/2511.04808,"Subjects:
Machine Learning (cs.LG)",Machine Learning (cs.LG)
arXiv:2511.04807,Autoencoding Dynamics: Topological Limitations and Capabilities,自编码动力学：拓扑限制和能力,"Matthew D. Kvalheim, Eduardo D. Sontag",https://arxiv.org/pdf/2511.04807,"Subjects:
Machine Learning (cs.LG); Dynamical Systems (math.DS)","Machine Learning (cs.LG),  Dynamical Systems (math.DS)"
arXiv:2511.04805,PuzzleMoE: Efficient Compression of Large Mixture-of-Experts Models via Sparse Expert Merging and Bit-packed inference,PuzzleMoE：通过稀疏专家合并和位打包推理高效压缩大型专家混合模型,"Yushu Zhao, Zheng Wang, Minjia Zhang",https://arxiv.org/pdf/2511.04805,"Subjects:
Machine Learning (cs.LG); Artificial Intelligence (cs.AI)","Machine Learning (cs.LG),  Artificial Intelligence (cs.AI)"
arXiv:2511.04804,Simplex-FEM Networks (SiFEN): Learning A Triangulated Function Approximator,Simplex-FEM网络（SiFEN）：学习一个三角化函数逼近器,"Chaymae Yahyati, Ismail Lamaakal, Khalid El Makkaoui, Ibrahim Ouahbi, Yassine Maleh",https://arxiv.org/pdf/2511.04804,"Subjects:
Machine Learning (cs.LG)",Machine Learning (cs.LG)
arXiv:2511.04803,Data Efficiency and Transfer Robustness in Biomedical Image Segmentation: A Study of Redundancy and Forgetting with Cellpose,生物医学图像分割中的数据效率和迁移鲁棒性：冗余和遗忘的研究与Cellpose,"Shuo Zhao, Jianxu Chen",https://arxiv.org/pdf/2511.04803,"Subjects:
Computer Vision and Pattern Recognition (cs.CV); Artificial Intelligence (cs.AI); Machine Learning (cs.LG)","Computer Vision and Pattern Recognition (cs.CV),  Artificial Intelligence (cs.AI),  Machine Learning (cs.LG)"
arXiv:2511.04800,Explore Data Left Behind in Reinforcement Learning for Reasoning Language Models,探索强化学习中遗留的数据以推理语言模型,"Chenxi Liu, Junjie Liang, Yuqi Jia, Bochuan Cao, Yang Bai, Heng Huang, Xun Chen",https://arxiv.org/pdf/2511.04800,"Subjects:
Computation and Language (cs.CL)",Computation and Language (cs.CL)
arXiv:2511.04798,MDM: Manhattan Distance Mapping of DNN Weights for Parasitic-Resistance-Resilient Memristive Crossbars,MDM：用于寄生电阻抗性忆阻交叉的DNN权重的曼哈顿距离映射,"Matheus Farias, Wanghley Martins, H. T. Kung",https://arxiv.org/pdf/2511.04798,"Subjects:
Hardware Architecture (cs.AR); Artificial Intelligence (cs.AI); Emerging Technologies (cs.ET); Machine Learning (cs.LG)","Hardware Architecture (cs.AR),  Artificial Intelligence (cs.AI),  Emerging Technologies (cs.ET),  Machine Learning (cs.LG)"
arXiv:2511.04797,3D Gaussian Point Encoders,3D高斯点编码器,"Jim James, Ben Wilson, Simon Lucey, James Hays",https://arxiv.org/pdf/2511.04797,"Subjects:
Computer Vision and Pattern Recognition (cs.CV)",Computer Vision and Pattern Recognition (cs.CV)
arXiv:2511.04794,Pseudodeterministic Communication Complexity,伪确定性通信复杂度,"Mika Göös, Nathaniel Harms, Artur Riazanov, Anastasia Sofronova, Dmitry Sokolov, Weiqiang Yuan",https://arxiv.org/pdf/2511.04794,"Subjects:
Computational Complexity (cs.CC)",Computational Complexity (cs.CC)
arXiv:2511.04791,DuetServe: Harmonizing Prefill and Decode for LLM Serving via Adaptive GPU Multiplexing,DuetServe：通过自适应 GPU 多路复用协调预填充和解码以服务于大型语言模型,"Lei Gao, Chaoyi Jiang, Hossein Entezari Zarch, Daniel Wong, Murali Annavaram",https://arxiv.org/pdf/2511.04791,"Subjects:
Machine Learning (cs.LG)",Machine Learning (cs.LG)
arXiv:2511.04790,Causal Structure and Representation Learning with Biomedical Applications,因果结构与表示学习及其在生物医学中的应用,"Caroline Uhler, Jiaqi Zhang",https://arxiv.org/pdf/2511.04790,"Subjects:
Machine Learning (cs.LG); Artificial Intelligence (cs.AI); Machine Learning (stat.ML)","Machine Learning (cs.LG),  Artificial Intelligence (cs.AI),  Machine Learning (stat.ML)"
arXiv:2511.04789,Conditional Neural ODE for Longitudinal Parkinson's Disease Progression Forecasting,用于预测帕金森病进展的条件神经常微分方程,"Xiaoda Wang, Yuji Zhao, Kaiqiao Han, Xiao Luo, Sanne van Rooij, Jennifer Stevens, Lifang He, Liang Zhan, Yizhou Sun, Wei Wang, Carl Yang",https://arxiv.org/pdf/2511.04789,"Subjects:
Machine Learning (cs.LG)",Machine Learning (cs.LG)
arXiv:2511.04779,EETnet: a CNN for Gaze Detection and Tracking for Smart-Eyewear,EETnet：用于智能眼镜的凝视检测和跟踪的卷积神经网络,"Andrea Aspesi (1 and 2), Andrea Simpsi (1), Aaron Tognoli (1), Simone Mentasti (1), Luca Merigo (2), Matteo Matteucci (1) ((1) Department of Electronics, Information and Bioengineering (DEIB) Politecnico di Milano, (2) EssilorLuxottica)",https://arxiv.org/pdf/2511.04779,"Subjects:
Computer Vision and Pattern Recognition (cs.CV)",Computer Vision and Pattern Recognition (cs.CV)
arXiv:2511.04776,Quantifying the Climate Risk of Generative AI: Region-Aware Carbon Accounting with G-TRACE and the AI Sustainability Pyramid,量化生成式人工智能的气候风险：使用 G-TRACE 和 AI 可持续性金字塔进行区域感知碳核算,"Zahida Kausar, Seemab Latif, Raja Khurrum Shahzad, Mehwish Fatima",https://arxiv.org/pdf/2511.04776,"Subjects:
Computers and Society (cs.CY); Computation and Language (cs.CL)","Computers and Society (cs.CY),  Computation and Language (cs.CL)"
arXiv:2511.04775,Improved Additive Approximation Algorithms for APSP,改进的全源最短路径问题的加法近似算法,"Ce Jin, Yael Kirkpatrick, Michał Stawarz, Virginia Vassilevska Williams",https://arxiv.org/pdf/2511.04775,"Subjects:
Data Structures and Algorithms (cs.DS)",Data Structures and Algorithms (cs.DS)
arXiv:2511.04774,SLOFetch: Compressed-Hierarchical Instruction Prefetching for Cloud Microservices,SLOFetch：用于云微服务的压缩层次指令预取,"Liu Jiang, Zerui Bao, Shiqi Sheng, Di Zhu",https://arxiv.org/pdf/2511.04774,"Subjects:
Machine Learning (cs.LG); Hardware Architecture (cs.AR)","Machine Learning (cs.LG),  Hardware Architecture (cs.AR)"
arXiv:2511.04773,Global 3D Reconstruction of Clouds & Tropical Cyclones,云和热带气旋的全球三维重建,"Shirin Ermis, Cesar Aybar, Lilli Freischem, Stella Girtsou, Kyriaki-Margarita Bintsi, Emiliano Diaz Salas-Porras, Michael Eisinger, William Jones, Anna Jungbluth, Benoit Tremblay",https://arxiv.org/pdf/2511.04773,"Subjects:
Computer Vision and Pattern Recognition (cs.CV); Atmospheric and Oceanic Physics (physics.ao-ph)","Computer Vision and Pattern Recognition (cs.CV),  Atmospheric and Oceanic Physics (physics.ao-ph)"
arXiv:2511.04769,ReGen: Generative Robot Simulation via Inverse Design,ReGen：通过逆向设计进行生成式机器人模拟,"Phat Nguyen, Tsun-Hsuan Wang, Zhang-Wei Hong, Erfan Aasi, Andrew Silva, Guy Rosman, Sertac Karaman, Daniela Rus",https://arxiv.org/pdf/2511.04769,"Subjects:
Robotics (cs.RO)",Robotics (cs.RO)
arXiv:2511.04768,FuseFlow: A Fusion-Centric Compilation Framework for Sparse Deep Learning on Streaming Dataflow,FuseFlow：用于流数据流上的稀疏深度学习的融合中心编译框架,"Rubens Lacouture, Nathan Zhang, Ritvik Sharma, Marco Siracusa, Fredrik Kjolstad, Kunle Olukotun, Olivia Hsu",https://arxiv.org/pdf/2511.04768,"Subjects:
Machine Learning (cs.LG); Hardware Architecture (cs.AR); Programming Languages (cs.PL)","Machine Learning (cs.LG),  Hardware Architecture (cs.AR),  Programming Languages (cs.PL)"
arXiv:2511.04766,DARN: Dynamic Adaptive Regularization Networks for Efficient and Robust Foundation Model Adaptation,DARN：用于高效和稳健基础模型适应的动态自适应正则化网络,"Dhenenjay Yadav, Rohan Sawai",https://arxiv.org/pdf/2511.04766,"Subjects:
Computer Vision and Pattern Recognition (cs.CV)",Computer Vision and Pattern Recognition (cs.CV)
arXiv:2511.04760,When Data Falls Short: Grokking Below the Critical Threshold,当数据不足时：在临界阈值以下的领悟,"Vaibhav Singh, Eugene Belilovsky, Rahaf Aljundi",https://arxiv.org/pdf/2511.04760,"Subjects:
Machine Learning (cs.LG)",Machine Learning (cs.LG)
arXiv:2511.04758,ScheduleStream: Temporal Planning with Samplers for GPU-Accelerated Multi-Arm Task and Motion Planning & Scheduling,ScheduleStream：用于 GPU 加速的多臂任务和运动规划与调度的采样器时间规划,"Caelan Garrett, Fabio Ramos",https://arxiv.org/pdf/2511.04758,"Subjects:
Robotics (cs.RO); Artificial Intelligence (cs.AI); Multiagent Systems (cs.MA)","Robotics (cs.RO),  Artificial Intelligence (cs.AI),  Multiagent Systems (cs.MA)"
arXiv:2511.04755,EMO100DB: An Open Dataset of Improvised Songs with Emotion Data,EMO100DB：一个包含情感数据的即兴歌曲开放数据集,"Daeun Hwang, Saebyul Park",https://arxiv.org/pdf/2511.04755,"Subjects:
Sound (cs.SD); Information Retrieval (cs.IR); Multimedia (cs.MM)","Sound (cs.SD),  Information Retrieval (cs.IR),  Multimedia (cs.MM)"
arXiv:2511.04754,Surprisal reveals diversity gaps in image captioning and different scorers change the story,惊奇揭示了图像字幕中的多样性差距，不同的评分者改变了故事,"Nikolai Ilinykh, Simon Dobnik",https://arxiv.org/pdf/2511.04754,"Subjects:
Computation and Language (cs.CL)",Computation and Language (cs.CL)
arXiv:2511.04753,CPO: Condition Preference Optimization for Controllable Image Generation,CPO：用于可控图像生成的条件偏好优化,"Zonglin Lyu, Ming Li, Xinxin Liu, Chen Chen",https://arxiv.org/pdf/2511.04753,"Subjects:
Computer Vision and Pattern Recognition (cs.CV); Artificial Intelligence (cs.AI); Machine Learning (cs.LG)","Computer Vision and Pattern Recognition (cs.CV),  Artificial Intelligence (cs.AI),  Machine Learning (cs.LG)"
arXiv:2511.04751,Regularized GLISp for sensor-guided human-in-the-loop optimization,用于传感器引导的人机优化的正则化 GLISp,"Matteo Cercola, Michele Lomuscio, Dario Piga, Simone Formentin",https://arxiv.org/pdf/2511.04751,"Subjects:
Machine Learning (cs.LG)",Machine Learning (cs.LG)
