Unnamed: 0,id,title,title_zh,authors,url,subjects,subject_split
1435,arXiv:2407.05766,Multi-agent Reinforcement Learning-based Network Intrusion Detection System,基于多智能体强化学习的网络入侵检测系统,"Amine Tellache, Amdjed Mokhtari, Abdelaziz Amara Korba, Yacine Ghamri-Doudane",https://arxiv.org/pdf/2407.05766.pdf,"Subjects:
Cryptography and Security (cs.CR); Artificial Intelligence (cs.AI)","Cryptography and Security (cs.CR),  Artificial Intelligence (cs.AI)"
1436,arXiv:2407.05765,Enlarging Feature Support Overlap for Domain Generalization,扩展特征支持重叠以实现领域泛化,"Yaoyao Zhu, Xiuding Cai, Dong Miao, Yu Yao, Zhongliang Fu",https://arxiv.org/pdf/2407.05765.pdf,"Subjects:
Computer Vision and Pattern Recognition (cs.CV)",Computer Vision and Pattern Recognition (cs.CV)
1437,arXiv:2407.05754,Can We Benefit from Reconfigurable Intelligent Surfaces in Upper Mid-Band 6G Networks? A Critical Look for Promising Use Cases,我们能从中上频带6G网络中的可重构智能表面中受益吗？批判性地寻找有前景的用例,"Ferdi Kara, Özlem Tuğfe Demir, Emil Björnson",https://arxiv.org/pdf/2407.05754.pdf,"Subjects:
Networking and Internet Architecture (cs.NI)",Networking and Internet Architecture (cs.NI)
1438,arXiv:2407.05750,Large Language Models Understand Layouts,大型语言模型理解布局,"Weiming Li, Manni Duan, Dong An, Yan Shao",https://arxiv.org/pdf/2407.05750.pdf,"Subjects:
Computation and Language (cs.CL)",Computation and Language (cs.CL)
1439,arXiv:2407.05746,MSP-Podcast SER Challenge 2024: L'antenne du Ventoux Multimodal Self-Supervised Learning for Speech Emotion Recognition,2024年MSP播客SER挑战赛：用于语音情感识别的L'antenne du Ventoux多模态自监督学习,"Jarod Duret (LIA), Mickael Rouvier (LIA), Yannick Estève (LIA)",https://arxiv.org/pdf/2407.05746.pdf,"Subjects:
Artificial Intelligence (cs.AI); Sound (cs.SD); Audio and Speech Processing (eess.AS)","Artificial Intelligence (cs.AI),  Sound (cs.SD),  Audio and Speech Processing (eess.AS)"
1440,arXiv:2407.05740,Do Multilingual Large Language Models Mitigate Stereotype Bias?,多语言大型语言模型能否减轻刻板印象偏见？,"Shangrui Nie, Michael Fromm, Charles Welch, Rebekka Görge, Akbar Karimi, Joan Plepi, Nazia Afsan Mowmita, Nicolas Flores-Herr, Mehdi Ali, Lucie Flek",https://arxiv.org/pdf/2407.05740.pdf,"Subjects:
Computation and Language (cs.CL)",Computation and Language (cs.CL)
1441,arXiv:2407.05739,Multi-Bit Mechanism: A Novel Information Transmission Paradigm for Spiking Neural Networks,多位机制：一种新的尖峰神经网络信息传输范式,"Yongjun Xiao, Xianlong Tian, Yongqi Ding, Pei He, Mengmeng Jing, Lin Zuo",https://arxiv.org/pdf/2407.05739.pdf,"Subjects:
Neural and Evolutionary Computing (cs.NE); Artificial Intelligence (cs.AI)","Neural and Evolutionary Computing (cs.NE),  Artificial Intelligence (cs.AI)"
1442,arXiv:2407.05736,TransMA: an explainable multi-modal deep learning model for predicting properties of ionizable lipid nanoparticles in mRNA delivery,TransMA：一种可解释的多模态深度学习模型，用于预测mRNA递送中可电离脂质纳米颗粒的特性,"Kun Wu, Zixu Wang, Xiulong Yang, Yangyang Chen, Zhenqi Han, Jialu Zhang, Lizhuang Liu",https://arxiv.org/pdf/2407.05736.pdf,"Subjects:
Artificial Intelligence (cs.AI); Computer Vision and Pattern Recognition (cs.CV)","Artificial Intelligence (cs.AI),  Computer Vision and Pattern Recognition (cs.CV)"
1443,arXiv:2407.05735,An Earth Rover dataset recorded at the ICRA@40 party,地球漫游者数据集记录在ICRA@40聚会,"Qi Zhang, Zhihao Lin, Arnoud Visser",https://arxiv.org/pdf/2407.05735.pdf,"Subjects:
Robotics (cs.RO); Computer Vision and Pattern Recognition (cs.CV)","Robotics (cs.RO),  Computer Vision and Pattern Recognition (cs.CV)"
1444,arXiv:2407.05734,Empirical Study of Symmetrical Reasoning in Conversational Chatbots,会话聊天机器人中对称推理的实证研究,"Daniela N. Rim, Heeyoul Choi",https://arxiv.org/pdf/2407.05734.pdf,"Subjects:
Computation and Language (cs.CL)",Computation and Language (cs.CL)
1445,arXiv:2407.05733,Is GPT-4 Alone Sufficient for Automated Essay Scoring?: A Comparative Judgment Approach Based on Rater Cognition,仅GPT-4就足以进行自动论文评分吗？：基于评级认知的比较判断方法,"Seungju Kim, Meounggun Jo",https://arxiv.org/pdf/2407.05733.pdf,"Subjects:
Computation and Language (cs.CL); Computers and Society (cs.CY)","Computation and Language (cs.CL),  Computers and Society (cs.CY)"
1446,arXiv:2407.05732,FairPFN: Transformers Can do Counterfactual Fairness,FairPFN：变形金刚可以做到反事实的公平,"Jake Robertson, Noah Hollmann, Noor Awad, Frank Hutter",https://arxiv.org/pdf/2407.05732.pdf,"Subjects:
Machine Learning (cs.LG); Artificial Intelligence (cs.AI); Computers and Society (cs.CY)","Machine Learning (cs.LG),  Artificial Intelligence (cs.AI),  Computers and Society (cs.CY)"
1447,arXiv:2407.05726,Gait Patterns as Biomarkers: A Video-Based Approach for Classifying Scoliosis,步态模式作为生物标志物：一种基于视频的脊柱侧凸分类方法,"Zirui Zhou, Junhao Liang, Zizhao Peng, Chao Fan, Fengwei An, Shiqi Yu",https://arxiv.org/pdf/2407.05726.pdf,"Subjects:
Computer Vision and Pattern Recognition (cs.CV); Image and Video Processing (eess.IV)","Computer Vision and Pattern Recognition (cs.CV),  Image and Video Processing (eess.IV)"
1448,arXiv:2407.05724,Nonintrusive model order reduction for stochastic differential equations,随机微分方程的非侵入模型降阶,"M. A. Freitag, J. M. Nicolaus, M. Redmann",https://arxiv.org/pdf/2407.05724.pdf,"Subjects:
Numerical Analysis (math.NA)",Numerical Analysis (math.NA)
1449,arXiv:2407.05721,PsycoLLM: Enhancing LLM for Psychological Understanding and Evaluation,PsycoLLM：加强心理学理解和评估的法学硕士,"Jinpeng Hu, Tengteng Dong, Hui Ma, Peng Zou, Xiao Sun, Meng Wang",https://arxiv.org/pdf/2407.05721.pdf,"Subjects:
Computation and Language (cs.CL)",Computation and Language (cs.CL)
1450,arXiv:2407.05720,Comparison of robot morphologies and base positioning for welding applications,焊接应用中机器人形态和基座定位的比较,"Nicolas Gautier, Yves Guillermit, Yazid Sebsadji, Mathieu Porez (LS2N, LS2N - équipe ReV), Damien Chablat (LS2N, LS2N - équipe RoMas)",https://arxiv.org/pdf/2407.05720.pdf,"Subjects:
Robotics (cs.RO)",Robotics (cs.RO)
1451,arXiv:2407.05718,A Factuality and Diversity Reconciled Decoding Method for Knowledge-Grounded Dialogue Generation,一种基于知识的对话生成的事实性与多样性调和解码方法,"Chenxu Yang, Zheng Lin, Chong Tian, Liang Pang, Lanrui Wang, Zhengyang Tong, Qirong Ho, Yanan Cao, Weiping Wang",https://arxiv.org/pdf/2407.05718.pdf,"Subjects:
Computation and Language (cs.CL)",Computation and Language (cs.CL)
1452,arXiv:2407.05717,A New Framework for Nonlinear Kalman Filters,非线性卡尔曼滤波器的新框架,"Shida Jiang, Junzhe Shi, Scott Moura",https://arxiv.org/pdf/2407.05717.pdf,"Subjects:
Systems and Control (eess.SY); Robotics (cs.RO); Signal Processing (eess.SP)","Systems and Control (eess.SY),  Robotics (cs.RO),  Signal Processing (eess.SP)"
1453,arXiv:2407.05715,The Size-Change Principle for Mixed Inductive and Coinductive types,混合感应型和共感应型的尺寸变化原理,Pierre Hyvernat (LAMA),https://arxiv.org/pdf/2407.05715.pdf,"Subjects:
Logic in Computer Science (cs.LO)",Logic in Computer Science (cs.LO)
1454,arXiv:2407.05714,Implementing a hybrid approach in a knowledge engineering process to manage technical advice relating to feedback from the operation of complex sensitive equipment,在知识工程过程中实施混合方法，以管理与复杂敏感设备运行反馈相关的技术建议,"Alain Claude Hervé Berger, Sébastien Boblet, Thierry Cartié, Jean-Pierre Cotton, François Vexler",https://arxiv.org/pdf/2407.05714.pdf,"Subjects:
Artificial Intelligence (cs.AI)",Artificial Intelligence (cs.AI)
1455,arXiv:2407.05713,Short-term Object Interaction Anticipation with Disentangled Object Detection @ Ego4D Short Term Object Interaction Anticipation Challenge,具有解纠缠物体检测的短期物体交互预测@Ego4D短期物体交互预期挑战,"Hyunjin Cho, Dong Un Kang, Se Young Chun",https://arxiv.org/pdf/2407.05713.pdf,"Subjects:
Computer Vision and Pattern Recognition (cs.CV); Artificial Intelligence (cs.AI)","Computer Vision and Pattern Recognition (cs.CV),  Artificial Intelligence (cs.AI)"
1456,arXiv:2407.05712,MobilePortrait: Real-Time One-Shot Neural Head Avatars on Mobile Devices,MobilePortrait：移动设备上的实时一次性神经头化身,"Jianwen Jiang, Gaojie Lin, Zhengkun Rong, Chao Liang, Yongming Zhu, Jiaqi Yang, Tianyun Zhong",https://arxiv.org/pdf/2407.05712.pdf,"Subjects:
Computer Vision and Pattern Recognition (cs.CV); Artificial Intelligence (cs.AI)","Computer Vision and Pattern Recognition (cs.CV),  Artificial Intelligence (cs.AI)"
1457,arXiv:2407.05710,Saltzer & Schroeder for 2030: Security engineering principles in a world of AI,Saltzer&Schroeder展望2030：人工智能世界中的安全工程原理,"Nikhil Patnaik, Joseph Hallett, Awais Rashid",https://arxiv.org/pdf/2407.05710.pdf,"Subjects:
Software Engineering (cs.SE)",Software Engineering (cs.SE)
1458,arXiv:2407.05705,Fast and Continual Knowledge Graph Embedding via Incremental LoRA,基于增量LoRA的快速连续知识图嵌入,"Jiajun Liu, Wenjun Ke, Peng Wang, Jiahao Wang, Jinhua Gao, Ziyu Shang, Guozheng Li, Zijie Xu, Ke Ji, Yining Li",https://arxiv.org/pdf/2407.05705.pdf,"Subjects:
Artificial Intelligence (cs.AI)",Artificial Intelligence (cs.AI)
1459,arXiv:2407.05704,Narrowing the Gap between Adversarial and Stochastic MDPs via Policy Optimization,通过策略优化缩小对抗性MDP和随机MDP之间的差距,"Daniil Tiapkin (CMAP, LMO), Evgenii Chzhen (LMO, CELESTE), Gilles Stoltz (LMO, CELESTE)",https://arxiv.org/pdf/2407.05704.pdf,"Subjects:
Machine Learning (cs.LG)",Machine Learning (cs.LG)
1460,arXiv:2407.05703,LGRNet: Local-Global Reciprocal Network for Uterine Fibroid Segmentation in Ultrasound Videos,LGRNet：超声视频中子宫肌瘤分割的局部-全局互惠网络,"Huihui Xu, Yijun Yang, Angelica I Aviles-Rivero, Guang Yang, Jing Qin, Lei Zhu",https://arxiv.org/pdf/2407.05703.pdf,"Subjects:
Computer Vision and Pattern Recognition (cs.CV)",Computer Vision and Pattern Recognition (cs.CV)
1461,arXiv:2407.05700,InverseCoder: Unleashing the Power of Instruction-Tuned Code LLMs with Inverse-Instruct,InverseCoder：用反向指令释放指令调谐码LLM的力量,"Yutong Wu, Di Huang, Wenxuan Shi, Wei Wang, Lingzhe Gao, Shihao Liu, Ziyuan Nan, Kaizhao Yuan, Rui Zhang, Xishan Zhang, Zidong Du, Qi Guo, Yewen Pu, Dawei Yin, Xing Hu, Yunji Chen",https://arxiv.org/pdf/2407.05700.pdf,"Subjects:
Computation and Language (cs.CL); Artificial Intelligence (cs.AI); Software Engineering (cs.SE)","Computation and Language (cs.CL),  Artificial Intelligence (cs.AI),  Software Engineering (cs.SE)"
1462,arXiv:2407.05694,On the Limitations of Compute Thresholds as a Governance Strategy,论计算阈值作为治理策略的局限性,Sara Hooker,https://arxiv.org/pdf/2407.05694.pdf,"Subjects:
Artificial Intelligence (cs.AI); Computation and Language (cs.CL); Emerging Technologies (cs.ET); Machine Learning (cs.LG)","Artificial Intelligence (cs.AI),  Computation and Language (cs.CL),  Emerging Technologies (cs.ET),  Machine Learning (cs.LG)"
1463,arXiv:2407.05693,Sub-SA: Strengthen In-context Learning via Submodular Selective Annotation,Sub-SA：通过亚模块选择性注释加强情境学习,"Jian Qian, Miao Sun, Sifan Zhou, Ziyu Zhao, Ruizhi Hun, Patrick Chiang",https://arxiv.org/pdf/2407.05693.pdf,"Subjects:
Machine Learning (cs.LG); Artificial Intelligence (cs.AI); Computation and Language (cs.CL)","Machine Learning (cs.LG),  Artificial Intelligence (cs.AI),  Computation and Language (cs.CL)"
1464,arXiv:2407.05690,Pruning Large Language Models to Intra-module Low-rank Architecture with Transitional Activations,将大型语言模型修剪为具有过渡激活的模块内低阶架构,"Bowen Shen, Zheng Lin, Daren Zha, Wei Liu, Jian Luan, Bin Wang, Weiping Wang",https://arxiv.org/pdf/2407.05690.pdf,"Subjects:
Computation and Language (cs.CL); Artificial Intelligence (cs.AI)","Computation and Language (cs.CL),  Artificial Intelligence (cs.AI)"
1465,arXiv:2407.05689,Ten Years of Teaching Empirical Software Engineering in the context of Energy-efficient Software,节能软件背景下的实证软件工程教学十年,"Ivano Malavolta, Vincenzo Stoico, Patricia Lago",https://arxiv.org/pdf/2407.05689.pdf,"Subjects:
Software Engineering (cs.SE); Artificial Intelligence (cs.AI); Distributed, Parallel, and Cluster Computing (cs.DC)","Software Engineering (cs.SE),  Artificial Intelligence (cs.AI),  Distributed, Parallel, and Cluster Computing (cs.DC)"
1466,arXiv:2407.05688,Learning with Alignments: Tackling the Inter- and Intra-domain Shifts for Cross-multidomain Facial Expression Recognition,对齐学习：解决跨多域面部表情识别的域间和域内偏移,"Yuxiang Yang, Lu Wen, Xinyi Zeng, Yuanyuan Xu, Xi Wu, Jiliu Zhou, Yan Wang",https://arxiv.org/pdf/2407.05688.pdf,"Subjects:
Computer Vision and Pattern Recognition (cs.CV); Artificial Intelligence (cs.AI)","Computer Vision and Pattern Recognition (cs.CV),  Artificial Intelligence (cs.AI)"
1467,arXiv:2407.05687,Learning Lane Graphs from Aerial Imagery Using Transformers,使用变换器从航拍图像中学习车道图,"Martin Büchner, Simon Dorer, Abhinav Valada",https://arxiv.org/pdf/2407.05687.pdf,"Subjects:
Robotics (cs.RO); Computer Vision and Pattern Recognition (cs.CV)","Robotics (cs.RO),  Computer Vision and Pattern Recognition (cs.CV)"
1468,arXiv:2407.05684,Multi-Fidelity Bayesian Neural Network for Uncertainty Quantification in Transonic Aerodynamic Loads,用于跨音速气动载荷不确定性量化的多保真度贝叶斯神经网络,"Andrea Vaiuso, Gabriele Immordino, Marcello Righi, Andrea Da Ronch",https://arxiv.org/pdf/2407.05684.pdf,"Subjects:
Computational Engineering, Finance, and Science (cs.CE); Machine Learning (cs.LG)","Computational Engineering, Finance, and Science (cs.CE),  Machine Learning (cs.LG)"
1469,arXiv:2407.05682,Retrieved In-Context Principles from Previous Mistakes,从以前的错误中检索上下文原则,"Hao Sun, Yong Jiang, Bo Wang, Yingyan Hou, Yan Zhang, Pengjun Xie, Fei Huang",https://arxiv.org/pdf/2407.05682.pdf,"Subjects:
Computation and Language (cs.CL)",Computation and Language (cs.CL)
1470,arXiv:2407.05680,Fine-Grained Multi-View Hand Reconstruction Using Inverse Rendering,基于逆渲染的精细多视图手部重建,"Qijun Gan, Wentong Li, Jinwei Ren, Jianke Zhu",https://arxiv.org/pdf/2407.05680.pdf,"Subjects:
Computer Vision and Pattern Recognition (cs.CV); Artificial Intelligence (cs.AI)","Computer Vision and Pattern Recognition (cs.CV),  Artificial Intelligence (cs.AI)"
1471,arXiv:2407.05679,BEVWorld: A Multimodal World Model for Autonomous Driving via Unified BEV Latent Space,BEVWorld：通过统一BEV潜在空间实现自动驾驶的多模态世界模型,"Yumeng Zhang, Shi Gong, Kaixin Xiong, Xiaoqing Ye, Xiao Tan, Fan Wang, Jizhou Huang, Hua Wu, Haifeng Wang",https://arxiv.org/pdf/2407.05679.pdf,"Subjects:
Computer Vision and Pattern Recognition (cs.CV); Artificial Intelligence (cs.AI)","Computer Vision and Pattern Recognition (cs.CV),  Artificial Intelligence (cs.AI)"
1472,arXiv:2407.05678,Computational Power of Mobile Robots in Synchronous Environment: Discrete Version,同步环境下移动机器人的计算能力：离散版本,"Avisek Sharma, Pritam Goswami, Buddhadeb Sau",https://arxiv.org/pdf/2407.05678.pdf,"Subjects:
Distributed, Parallel, and Cluster Computing (cs.DC)","Distributed, Parallel, and Cluster Computing (cs.DC)"
1473,arXiv:2407.05674,LLM-Based Open-Domain Integrated Task and Knowledge Assistants with Programmable Policies,基于LLM的开放域集成任务和知识助理，具有可编程策略,"Harshit Joshi, Shicheng Liu, James Chen, Robert Weigle, Monica S. Lam",https://arxiv.org/pdf/2407.05674.pdf,"Subjects:
Artificial Intelligence (cs.AI); Computation and Language (cs.CL); Programming Languages (cs.PL)","Artificial Intelligence (cs.AI),  Computation and Language (cs.CL),  Programming Languages (cs.PL)"
1474,arXiv:2407.05671,MSTF: Multiscale Transformer for Incomplete Trajectory Prediction,MSTF：用于不完全轨迹预测的多尺度变换,"Zhanwen Liu, Chao Li, Nan Yang, Yang Wang, Jiaqi Ma, Guangliang Cheng, Xiangmo Zhao",https://arxiv.org/pdf/2407.05671.pdf,"Subjects:
Computer Vision and Pattern Recognition (cs.CV); Artificial Intelligence (cs.AI)","Computer Vision and Pattern Recognition (cs.CV),  Artificial Intelligence (cs.AI)"
1475,arXiv:2407.05669,Fractional Budget Allocation for Influence Maximization under General Marketing Strategies,一般营销策略下影响最大化的部分预算分配,"Akhil Bhimaraju, Eliot W. Robson, Lav R. Varshney, Abhishek K. Umrawal",https://arxiv.org/pdf/2407.05669.pdf,"Subjects:
Social and Information Networks (cs.SI); Artificial Intelligence (cs.AI); Data Structures and Algorithms (cs.DS); Machine Learning (stat.ML)","Social and Information Networks (cs.SI),  Artificial Intelligence (cs.AI),  Data Structures and Algorithms (cs.DS),  Machine Learning (stat.ML)"
1476,arXiv:2407.05667,"""One Soy Latte for Daniel"": Visual and Movement Communication of Intention from a Robot Waiter to a Group of Customers",“给丹尼尔一杯大豆拿铁”：机器人服务员与一群顾客的视觉和动作意图交流,"Seung Chan Hong, Leimin Tian, Akansel Cosgun, Dana Kulić",https://arxiv.org/pdf/2407.05667.pdf,"Subjects:
Robotics (cs.RO)",Robotics (cs.RO)
1477,arXiv:2407.05666,Enhancing Neural Radiance Fields with Depth and Normal Completion Priors from Sparse Views,从稀疏视角增强具有深度和正常完成先验的神经辐射场,"Jiawei Guo, HungChyun Chou, Ning Ding",https://arxiv.org/pdf/2407.05666.pdf,"Subjects:
Computer Vision and Pattern Recognition (cs.CV)",Computer Vision and Pattern Recognition (cs.CV)
1478,arXiv:2407.05657,DMSD-CDFSAR: Distillation from Mixed-Source Domain for Cross-Domain Few-shot Action Recognition,DMSD-CDFSAR：从混合源域中提取跨域少镜头动作识别,"Fei Guo, YiKang Wang, Han Qi, Li Zhu, Jing Sun",https://arxiv.org/pdf/2407.05657.pdf,"Subjects:
Computer Vision and Pattern Recognition (cs.CV)",Computer Vision and Pattern Recognition (cs.CV)
1479,arXiv:2407.05656,Multi-label Learning with Random Circular Vectors,随机循环向量的多标签学习,"Ken Nishida, Kojiro Machi, Kazuma Onishi, Katsuhiko Hayashi, Hidetaka Kamigaito",https://arxiv.org/pdf/2407.05656.pdf,"Subjects:
Machine Learning (cs.LG); Computation and Language (cs.CL)","Machine Learning (cs.LG),  Computation and Language (cs.CL)"
1480,arXiv:2407.05655,Constrained Online Recursive Source Separation Framework for Real-time Electrophysiological Signal Processing,实时电生理信号处理的约束在线递归源分离框架,"Li Yao, Zhao Haowen, Liu Yunfei, Zhang Xu",https://arxiv.org/pdf/2407.05655.pdf,"Subjects:
Human-Computer Interaction (cs.HC)",Human-Computer Interaction (cs.HC)
1481,arXiv:2407.05652,StmtTree: An Easy-to-Use yet Versatile Fortran Transformation Toolkit,StmtTree：一个易于使用但功能多样的Fortran转换工具包,"Jingbo Lin, Yi Yu, Zhang Yang, Yafan Zhao",https://arxiv.org/pdf/2407.05652.pdf,"Subjects:
Software Engineering (cs.SE)",Software Engineering (cs.SE)
1482,arXiv:2407.05650,The Dynamic Net Architecture: Learning Robust and Holistic Visual Representations Through Self-Organizing Networks,动态网络架构：通过自组织网络学习稳健和整体的视觉表示,"Pascal J. Sager, Jan M. Deriu, Benjamin F. Grewe, Thilo Stadelmann, Christoph von der Malsburg",https://arxiv.org/pdf/2407.05650.pdf,"Subjects:
Computer Vision and Pattern Recognition (cs.CV); Artificial Intelligence (cs.AI); Machine Learning (cs.LG); Neural and Evolutionary Computing (cs.NE)","Computer Vision and Pattern Recognition (cs.CV),  Artificial Intelligence (cs.AI),  Machine Learning (cs.LG),  Neural and Evolutionary Computing (cs.NE)"
1483,arXiv:2407.05649,Graph Attention with Random Rewiring,随机重新布线的图形注意力,"Tongzhou Liao, Barnabás Póczos",https://arxiv.org/pdf/2407.05649.pdf,"Subjects:
Machine Learning (cs.LG); Artificial Intelligence (cs.AI); Neural and Evolutionary Computing (cs.NE)","Machine Learning (cs.LG),  Artificial Intelligence (cs.AI),  Neural and Evolutionary Computing (cs.NE)"
1484,arXiv:2407.05647,Learning to Adapt Category Consistent Meta-Feature of CLIP for Few-Shot Classification,学习适应CLIP的类别一致元特征进行少镜头分类,"Jiaying Shi, Xuetong Xue, Shenghui Xu",https://arxiv.org/pdf/2407.05647.pdf,"Subjects:
Computer Vision and Pattern Recognition (cs.CV)",Computer Vision and Pattern Recognition (cs.CV)
1485,arXiv:2407.05645,OneDiff: A Generalist Model for Image Difference,OneDiff：图像差异的广义模型,"Erdong Hu, Longteng Guo, Tongtian Yue, Zijia Zhao, Shuning Xue, Jing Liu",https://arxiv.org/pdf/2407.05645.pdf,"Subjects:
Computer Vision and Pattern Recognition (cs.CV); Multimedia (cs.MM)","Computer Vision and Pattern Recognition (cs.CV),  Multimedia (cs.MM)"
1486,arXiv:2407.05643,Spatial Non-Stationary Dual-Wideband Channel Estimation for XL-MIMO Systems,XL-MIMO系统的空间非平稳双宽带信道估计,"Anzheng Tang, Jun-Bo Wang, Yijin Pan, Tuo Wu, Chuanwen Chang, Yijian Chen, Hongkang Yu, Maged Elkashlan",https://arxiv.org/pdf/2407.05643.pdf,"Subjects:
Information Theory (cs.IT); Signal Processing (eess.SP)","Information Theory (cs.IT),  Signal Processing (eess.SP)"
1487,arXiv:2407.05639,Deep Learning-based Anomaly Detection and Log Analysis for Computer Networks,基于深度学习的计算机网络异常检测与日志分析,"Shuzhan Wang, Ruxue Jiang, Zhaoqi Wang, Yan Zhou",https://arxiv.org/pdf/2407.05639.pdf,"Subjects:
Machine Learning (cs.LG); Cryptography and Security (cs.CR)","Machine Learning (cs.LG),  Cryptography and Security (cs.CR)"
1488,arXiv:2407.05638,HPFF: Hierarchical Locally Supervised Learning with Patch Feature Fusion,HPFF：基于补丁特征融合的分层局部监督学习,"Junhao Su, Chenghao He, Feiyu Zhu, Xiaojie Xu, Dongzhi Guan, Chenyang Si",https://arxiv.org/pdf/2407.05638.pdf,"Subjects:
Computer Vision and Pattern Recognition (cs.CV)",Computer Vision and Pattern Recognition (cs.CV)
1489,arXiv:2407.05636,Robust Precoding Designs for Multiuser MIMO Systems with Limited Feedback,有限反馈多用户MIMO系统的鲁棒预编码设计,"Wentao Zhou, Di Zhang, Merouane Debbah, Inkyu Lee",https://arxiv.org/pdf/2407.05636.pdf,"Subjects:
Information Theory (cs.IT)",Information Theory (cs.IT)
1490,arXiv:2407.05633,AdaPI: Facilitating DNN Model Adaptivity for Efficient Private Inference in Edge Computing,AdaPI：促进边缘计算中高效私有推理的DNN模型自适应,"Tong Zhou, Jiahui Zhao, Yukui Luo, Xi Xie, Wujie Wen, Caiwen Ding, Xiaolin Xu",https://arxiv.org/pdf/2407.05633.pdf,"Subjects:
Machine Learning (cs.LG); Cryptography and Security (cs.CR)","Machine Learning (cs.LG),  Cryptography and Security (cs.CR)"
1491,arXiv:2407.05630,Enabling 6G Performance in the Upper Mid-Band Through Gigantic MIMO,通过巨型MIMO在中上频带实现6G性能,"Emil Björnson, Ferdi Kara, Nikolaos Kolomvakis, Alva Kosasih, Parisa Ramezani, Murat Babek Salman",https://arxiv.org/pdf/2407.05630.pdf,"Subjects:
Information Theory (cs.IT); Signal Processing (eess.SP)","Information Theory (cs.IT),  Signal Processing (eess.SP)"
1492,arXiv:2407.05627,New Directions in Text Classification Research: Maximizing The Performance of Sentiment Classification from Limited Data,文本分类研究的新方向：从有限数据中最大限度地提高情感分类的性能,"Surya Agustian, Muhammad Irfan Syah, Nurul Fatiara, Rahmad Abdillah",https://arxiv.org/pdf/2407.05627.pdf,"Subjects:
Computation and Language (cs.CL); Information Retrieval (cs.IR); Information Theory (cs.IT); Machine Learning (cs.LG); Social and Information Networks (cs.SI)","Computation and Language (cs.CL),  Information Retrieval (cs.IR),  Information Theory (cs.IT),  Machine Learning (cs.LG),  Social and Information Networks (cs.SI)"
1493,arXiv:2407.05626,A Stochastic Interacting Particle-Field Algorithm for a Haptotaxis Advection-Diffusion System Modeling Cancer Cell Invasion,癌症细胞侵袭模型的单轴降临扩散系统的随机交互粒子场算法,"Boyi Hu, Zhongjian Wang, Jack Xin, Zhiwen Zhang",https://arxiv.org/pdf/2407.05626.pdf,"Subjects:
Numerical Analysis (math.NA)",Numerical Analysis (math.NA)
1494,arXiv:2407.05623,Momentum Auxiliary Network for Supervised Local Learning,用于监督本地学习的动量辅助网络,"Junhao Su, Changpeng Cai, Feiyu Zhu, Chenghao He, Xiaojie Xu, Dongzhi Guan, Chenyang Si",https://arxiv.org/pdf/2407.05623.pdf,"Subjects:
Computer Vision and Pattern Recognition (cs.CV)",Computer Vision and Pattern Recognition (cs.CV)
1495,arXiv:2407.05622,On the Complexity of Learning Sparse Functions with Statistical and Gradient Queries,利用统计和梯度查询学习稀疏函数的复杂性,"Nirmit Joshi, Theodor Misiakiewicz, Nathan Srebro",https://arxiv.org/pdf/2407.05622.pdf,"Subjects:
Machine Learning (cs.LG); Data Structures and Algorithms (cs.DS)","Machine Learning (cs.LG),  Data Structures and Algorithms (cs.DS)"
1496,arXiv:2407.05621,EA4RCA:Efficient AIE accelerator design framework for Regular Communication-Avoiding Algorithm,EA4RCA：用于常规通信避免算法的高效AIE加速器设计框架,"W. B. Zhang, Y. Q. Liu, T. H. Zang, Z. S. Bao",https://arxiv.org/pdf/2407.05621.pdf,"Subjects:
Hardware Architecture (cs.AR)",Hardware Architecture (cs.AR)
