Unnamed: 0,id,title,title_zh,authors,url,subjects,subject_split
376,arXiv:2406.18815,MissionGNN: Hierarchical Multimodal GNN-based Weakly Supervised Video Anomaly Recognition with Mission-Specific Knowledge Graph Generation,任务GNN：基于分层多模式GNN的弱监督视频异常识别与任务特定知识图生成,"Sanggeon Yun, Ryozo Masukawa, Minhyoung Na, Mohsen Imani",https://arxiv.org/pdf/2406.18815.pdf,"Subjects:
Machine Learning (cs.LG)",Machine Learning (cs.LG)
377,arXiv:2406.18813,Towards Secure Management of Edge-Cloud IoT Microservices using Policy as Code,以策略为代码实现边缘云物联网微服务的安全管理,"Samodha Pallewatta, Muhammad Ali Babar",https://arxiv.org/pdf/2406.18813.pdf,"Subjects:
Cryptography and Security (cs.CR); Distributed, Parallel, and Cluster Computing (cs.DC); Software Engineering (cs.SE)","Cryptography and Security (cs.CR),  Distributed, Parallel, and Cluster Computing (cs.DC),  Software Engineering (cs.SE)"
378,arXiv:2406.18812,A Survey on Privacy Attacks Against Digital Twin Systems in AI-Robotics,人工智能机器人中针对数字孪生系统的隐私攻击研究综述,"Ivan A. Fernandez, Subash Neupane, Trisha Chakraborty, Shaswata Mitra, Sudip Mittal, Nisha Pillai, Jingdao Chen, Shahram Rahimi",https://arxiv.org/pdf/2406.18812.pdf,"Subjects:
Robotics (cs.RO); Artificial Intelligence (cs.AI)","Robotics (cs.RO),  Artificial Intelligence (cs.AI)"
379,arXiv:2406.18809,"Divide, Ensemble and Conquer: The Last Mile on Unsupervised Domain Adaptation for On-Board Semantic Segmentation",分而治之：无监督领域自适应车载语义分割的最后一公里,"Tao Lian, Jose L. Gómez, Antonio M. López",https://arxiv.org/pdf/2406.18809.pdf,"Subjects:
Computer Vision and Pattern Recognition (cs.CV)",Computer Vision and Pattern Recognition (cs.CV)
380,arXiv:2406.18805,Online Stackelberg Optimization via Nonlinear Control,基于非线性控制的在线Stackelberg优化,"William Brown, Christos Papadimitriou, Tim Roughgarden",https://arxiv.org/pdf/2406.18805.pdf,"Subjects:
Machine Learning (cs.LG); Computer Science and Game Theory (cs.GT)","Machine Learning (cs.LG),  Computer Science and Game Theory (cs.GT)"
381,arXiv:2406.18804,State and Input Constrained Output-Feedback Adaptive Optimal Control of Affine Nonlinear Systems,仿射非线性系统的状态和输入约束输出反馈自适应最优控制,"Tochukwu Elijah Ogri, Muzaffar Qureshi, Zachary I. Bell, Rushikesh Kamalapurkar",https://arxiv.org/pdf/2406.18804.pdf,"Subjects:
Systems and Control (eess.SY)",Systems and Control (eess.SY)
382,arXiv:2406.18802,All Random Features Representations are Equivalent,所有随机特征表示都是等价的,"Luke Sernau, Silvano Bonacina, Rif A. Saurous",https://arxiv.org/pdf/2406.18802.pdf,"Subjects:
Machine Learning (cs.LG); Artificial Intelligence (cs.AI)","Machine Learning (cs.LG),  Artificial Intelligence (cs.AI)"
383,arXiv:2406.18801,Ksurf: Attention Kalman Filter and Principal Component Analysis for Prediction under Highly Variable Cloud Workloads,Ksurf:Attention Kalman滤波器和主成分分析在高度可变云工作负荷下的预测,"Michael Dang'ana, Arno Jacobsen",https://arxiv.org/pdf/2406.18801.pdf,"Subjects:
Distributed, Parallel, and Cluster Computing (cs.DC)","Distributed, Parallel, and Cluster Computing (cs.DC)"
384,arXiv:2406.18800,Infinite Width Models That Work: Why Feature Learning Doesn't Matter as Much as You Think,工作的无限宽度模型：为什么特征学习没有你想象的那么重要,Luke Sernau,https://arxiv.org/pdf/2406.18800.pdf,"Subjects:
Machine Learning (cs.LG); Artificial Intelligence (cs.AI)","Machine Learning (cs.LG),  Artificial Intelligence (cs.AI)"
385,arXiv:2406.18794,Operator Learning of Lipschitz Operators: An Information-Theoretic Perspective,Lipschitz算子的算子学习：一个信息论的视角,Samuel Lanthaler,https://arxiv.org/pdf/2406.18794.pdf,"Subjects:
Machine Learning (cs.LG); Numerical Analysis (math.NA)","Machine Learning (cs.LG),  Numerical Analysis (math.NA)"
386,arXiv:2406.18792,A data-driven assessment of biomedical terminology evolution using information theoretical and network analysis approaches,使用信息理论和网络分析方法对生物医学术语演变进行数据驱动评估,"Jenny Copara, Nona Naderi, Gilles Falquet, Douglas Teodoro",https://arxiv.org/pdf/2406.18792.pdf,"Subjects:
Social and Information Networks (cs.SI)",Social and Information Networks (cs.SI)
387,arXiv:2406.18790,MUMU: Bootstrapping Multimodal Image Generation from Text-to-Image Data,MUMU：从文本到图像数据的自举多模式图像生成,"William Berman, Alexander Peysakhovich",https://arxiv.org/pdf/2406.18790.pdf,"Subjects:
Computer Vision and Pattern Recognition (cs.CV); Artificial Intelligence (cs.AI)","Computer Vision and Pattern Recognition (cs.CV),  Artificial Intelligence (cs.AI)"
388,arXiv:2406.18787,"Unified Uncertainties: Combining Input, Data and Model Uncertainty into a Single Formulation",统一的不确定性：将输入、数据和模型的不确定性组合成一个单一的公式,"Matias Valdenegro-Toro, Ivo Pascal de Jong, Marco Zullich",https://arxiv.org/pdf/2406.18787.pdf,"Subjects:
Machine Learning (cs.LG); Machine Learning (stat.ML)","Machine Learning (cs.LG),  Machine Learning (stat.ML)"
389,arXiv:2406.18786,Constable: Improving Performance and Power Efficiency by Safely Eliminating Load Instruction Execution,Constable：通过安全消除负载指令执行来提高性能和电源效率,"Rahul Bera, Adithya Ranganathan, Joydeep Rakshit, Sujit Mahto, Anant V. Nori, Jayesh Gaur, Ataberk Olgun, Konstantinos Kanellopoulos, Mohammad Sadrosadati, Sreenivas Subramoney, Onur Mutlu",https://arxiv.org/pdf/2406.18786.pdf,"Subjects:
Hardware Architecture (cs.AR)",Hardware Architecture (cs.AR)
390,arXiv:2406.18783,Psychological Profiling in Cybersecurity: A Look at LLMs and Psycholinguistic Features,网络安全中的心理剖析：LLMs及其心理语言学特征,"Jean Marie Tshimula, D'Jeff K. Nkashama, Jean Tshibangu Muabila, René Manassé Galekwa, Hugues Kanda, Maximilien V. Dialufuma, Mbuyi Mukendi Didier, Kalala Kalonji, Serge Mundele, Patience Kinshie Lenye, Tighana Wenge Basele, Aristarque Ilunga, Christian N. Mayemba, Nathanaël M. Kasoro, Selain K. Kasereka, Hardy Mikese, Pierre-Martin Tardif, Marc Frappier, Froduald Kabanza, Belkacem Chikhaoui, Shengrui Wang, Ali Mulenda Sumbu, Xavier Ndona, Raoul Kienge-Kienge Intudi",https://arxiv.org/pdf/2406.18783.pdf,"Subjects:
Computation and Language (cs.CL); Machine Learning (cs.LG)","Computation and Language (cs.CL),  Machine Learning (cs.LG)"
391,arXiv:2406.18777,Aligning Model Properties via Conformal Risk Control,通过一致风险控制调整模型属性,"William Overman, Jacqueline Jil Vallon, Mohsen Bayati",https://arxiv.org/pdf/2406.18777.pdf,"Subjects:
Machine Learning (cs.LG); Machine Learning (stat.ML)","Machine Learning (cs.LG),  Machine Learning (stat.ML)"
392,arXiv:2406.18776,Implicit Discourse Relation Classification For Nigerian Pidgin,尼日利亚洋泾浜的内隐话语关系分类,"Muhammed Saeed, Peter Bourgonje, Vera Demberg",https://arxiv.org/pdf/2406.18776.pdf,"Subjects:
Computation and Language (cs.CL)",Computation and Language (cs.CL)
393,arXiv:2406.18770,ADO-LLM: Analog Design Bayesian Optimization with In-Context Learning of Large Language Models,ADO-LLM:具有大型语言模型上下文学习的模拟设计贝叶斯优化,"Yuxuan Yin, Yu Wang, Boxun Xu, Peng Li",https://arxiv.org/pdf/2406.18770.pdf,"Subjects:
Machine Learning (cs.LG)",Machine Learning (cs.LG)
394,arXiv:2406.18765,WV-Net: A foundation model for SAR WV-mode satellite imagery trained using contrastive self-supervised learning on 10 million images,WV-Net：在1000万张图像上使用对比自监督学习训练的SAR WV模式卫星图像的基础模型,"Yannik Glaser, Justin E. Stopa, Linnea M. Wolniewicz, Ralph Foster, Doug Vandemark, Alexis Mouche, Bertrand Chapron, Peter Sadowski",https://arxiv.org/pdf/2406.18765.pdf,"Subjects:
Machine Learning (cs.LG); Artificial Intelligence (cs.AI); Computer Vision and Pattern Recognition (cs.CV)","Machine Learning (cs.LG),  Artificial Intelligence (cs.AI),  Computer Vision and Pattern Recognition (cs.CV)"
395,arXiv:2406.18763,Conformalized Link Prediction on Graph Neural Networks,基于图神经网络的保形链路预测,"Tianyi Zhao, Jian Kang, Lu Cheng",https://arxiv.org/pdf/2406.18763.pdf,"Subjects:
Machine Learning (cs.LG); Artificial Intelligence (cs.AI)","Machine Learning (cs.LG),  Artificial Intelligence (cs.AI)"
396,arXiv:2406.18762,Categorical Syllogisms Revisited: A Review of the Logical Reasoning Abilities of LLMs for Analyzing Categorical Syllogism,重新审视范畴三段论——LLM分析范畴三段学的逻辑推理能力述评,"Shi Zong, Jimmy Lin",https://arxiv.org/pdf/2406.18762.pdf,"Subjects:
Computation and Language (cs.CL)",Computation and Language (cs.CL)
397,arXiv:2406.18757,The Impact of Feature Representation on the Accuracy of Photonic Neural Networks,特征表示对光子神经网络精度的影响,"Mauricio Gomes de Queiroz, Paul Jimenez, Raphael Cardoso, Mateus Vidaletti Costa, Mohab Abdalla, Ian O'Connor, Alberto Bosio, Fabio Pavanello",https://arxiv.org/pdf/2406.18757.pdf,"Subjects:
Emerging Technologies (cs.ET); Artificial Intelligence (cs.AI); Machine Learning (cs.LG)","Emerging Technologies (cs.ET),  Artificial Intelligence (cs.AI),  Machine Learning (cs.LG)"
398,arXiv:2406.18752,Competitive Algorithms for Online Knapsack with Succinct Predictions,具有简洁预测的在线背包竞争算法,"Mohammadreza Daneshvaramoli, Helia Karisani, Adam Lechowicz, Bo Sun, Cameron Musco, Mohammad Hajiesmaili",https://arxiv.org/pdf/2406.18752.pdf,"Subjects:
Machine Learning (cs.LG); Computer Science and Game Theory (cs.GT)","Machine Learning (cs.LG),  Computer Science and Game Theory (cs.GT)"
399,arXiv:2406.18747,A Stem-Agnostic Single-Decoder System for Music Source Separation Beyond Four Stems,用于四个词干之外的音源分离的词干不可知单解码系统,"Karn N. Watcharasupat, Alexander Lerch",https://arxiv.org/pdf/2406.18747.pdf,"Subjects:
Sound (cs.SD); Artificial Intelligence (cs.AI); Information Retrieval (cs.IR); Machine Learning (cs.LG); Audio and Speech Processing (eess.AS)","Sound (cs.SD),  Artificial Intelligence (cs.AI),  Information Retrieval (cs.IR),  Machine Learning (cs.LG),  Audio and Speech Processing (eess.AS)"
400,arXiv:2406.18746,Lifelong Robot Library Learning: Bootstrapping Composable and Generalizable Skills for Embodied Control with Language Models,终身机器人库学习：用语言模型实现嵌入式控制的自举可组合和可泛化技能,"Georgios Tziafas, Hamidreza Kasaei",https://arxiv.org/pdf/2406.18746.pdf,"Subjects:
Robotics (cs.RO)",Robotics (cs.RO)
401,arXiv:2406.18745,QBI: Quantile-based Bias Initialization for Efficient Private Data Reconstruction in Federated Learning,QBI:基于分位数的偏差初始化用于联合学习中的高效私有数据重建,"Micha V. Nowak, Tim P. Bott, David Khachaturov, Frank Puppe, Adrian Krenzer, Amar Hekalo",https://arxiv.org/pdf/2406.18745.pdf,"Subjects:
Machine Learning (cs.LG)",Machine Learning (cs.LG)
402,arXiv:2406.18742,3D Feature Distillation with Object-Centric Priors,基于对象中心先验的三维特征提取,"Georgios Tziafas, Yucheng Xu, Zhibin Li, Hamidreza Kasaei",https://arxiv.org/pdf/2406.18742.pdf,"Subjects:
Computer Vision and Pattern Recognition (cs.CV); Robotics (cs.RO)","Computer Vision and Pattern Recognition (cs.CV),  Robotics (cs.RO)"
403,arXiv:2406.18741,Decentralized Semantic Traffic Control in AVs Using RL and DQN for Dynamic Roadblocks,基于RL和DQN的动态路障分布式语义交通控制,"Emanuel Figetakis, Yahuza Bello, Ahmed Refaey, Abdallah Shami",https://arxiv.org/pdf/2406.18741.pdf,"Subjects:
Machine Learning (cs.LG); Artificial Intelligence (cs.AI); Networking and Internet Architecture (cs.NI)","Machine Learning (cs.LG),  Artificial Intelligence (cs.AI),  Networking and Internet Architecture (cs.NI)"
404,arXiv:2406.18740,Re-Ranking Step by Step: Investigating Pre-Filtering for Re-Ranking with Large Language Models,逐步重新排序：研究使用大型语言模型进行重新排序的预过滤,"Baharan Nouriinanloo, Maxime Lamothe",https://arxiv.org/pdf/2406.18740.pdf,"Subjects:
Computation and Language (cs.CL); Information Retrieval (cs.IR)","Computation and Language (cs.CL),  Information Retrieval (cs.IR)"
405,arXiv:2406.18739,RetroGFN: Diverse and Feasible Retrosynthesis using GFlowNets,RetroGFN：利用GFlowNets进行多样可行的逆转录合成,"Piotr Gaiński, Michał Koziarski, Krzysztof Maziarz, Marwin Segler, Jacek Tabor, Marek Śmieja",https://arxiv.org/pdf/2406.18739.pdf,"Subjects:
Machine Learning (cs.LG)",Machine Learning (cs.LG)
406,arXiv:2406.18727,Demonic variance and a non-determinism score for Markov decision processes,马尔可夫决策过程的Demonic方差和一个非决定论得分,Jakob Piribauer,https://arxiv.org/pdf/2406.18727.pdf,"Subjects:
Logic in Computer Science (cs.LO)",Logic in Computer Science (cs.LO)
407,arXiv:2406.18726,Data-driven identification of port-Hamiltonian DAE systems by Gaussian processes,基于高斯过程的端口哈密顿DAE系统的数据驱动辨识,"Peter Zaspel, Michael Günther",https://arxiv.org/pdf/2406.18726.pdf,"Subjects:
Systems and Control (eess.SY); Machine Learning (cs.LG); Numerical Analysis (math.NA)","Systems and Control (eess.SY),  Machine Learning (cs.LG),  Numerical Analysis (math.NA)"
408,arXiv:2406.18725,Jailbreaking LLMs with Arabic Transliteration and Arabizi,用阿拉伯语转写和阿拉伯语破解LLMs,"Mansour Al Ghanim, Saleh Almohaimeed, Mengxin Zheng, Yan Solihin, Qian Lou",https://arxiv.org/pdf/2406.18725.pdf,"Subjects:
Machine Learning (cs.LG); Computation and Language (cs.CL)","Machine Learning (cs.LG),  Computation and Language (cs.CL)"
409,arXiv:2406.18722,Towards Open-World Grasping with Large Vision-Language Models,用大视觉语言模型实现对开放世界的把握,"Georgios Tziafas, Hamidreza Kasaei",https://arxiv.org/pdf/2406.18722.pdf,"Subjects:
Robotics (cs.RO); Computer Vision and Pattern Recognition (cs.CV)","Robotics (cs.RO),  Computer Vision and Pattern Recognition (cs.CV)"
410,arXiv:2406.18718,State-Based Automation for Time-Restricted Eating Adherence,基于状态的限时进食依从性自动化,"Samuel E. Armstrong, Aaron D. Mullen, J. Matthew Thomas, Dorothy D. Sears, Julie S. Pendergast, Jeffrey Talbert, Cody Bumgardner",https://arxiv.org/pdf/2406.18718.pdf,"Subjects:
Human-Computer Interaction (cs.HC); Systems and Control (eess.SY)","Human-Computer Interaction (cs.HC),  Systems and Control (eess.SY)"
411,arXiv:2406.18717,Dynamic Gaussian Marbles for Novel View Synthesis of Casual Monocular Videos,用于休闲单目视频新视图合成的动态高斯大理石,"Colton Stearns, Adam Harley, Mikaela Uy, Florian Dubost, Federico Tombari, Gordon Wetzstein, Leonidas Guibas",https://arxiv.org/pdf/2406.18717.pdf,"Subjects:
Computer Vision and Pattern Recognition (cs.CV)",Computer Vision and Pattern Recognition (cs.CV)
412,arXiv:2406.18709,SpY: A Context-Based Approach to Spacecraft Component Detection,SpY:一种基于上下文的航天器部件检测方法,"Trupti Mahendrakar, Ryan T. White, Madhur Tiwari",https://arxiv.org/pdf/2406.18709.pdf,"Subjects:
Computer Vision and Pattern Recognition (cs.CV)",Computer Vision and Pattern Recognition (cs.CV)
413,arXiv:2406.18708,Learn it or Leave it: Module Composition and Pruning for Continual Learning,学会它还是离开它：模块组成和持续学习的修剪,"Mingyang Wang, Heike Adel, Lukas Lange, Jannik Strötgen, Hinrich Schütze",https://arxiv.org/pdf/2406.18708.pdf,"Subjects:
Machine Learning (cs.LG); Computation and Language (cs.CL)","Machine Learning (cs.LG),  Computation and Language (cs.CL)"
414,arXiv:2406.18702,Simulating The U.S. Senate: An LLM-Driven Agent Approach to Modeling Legislative Behavior and Bipartisanship,模拟美国参议院：一种LLM驱动的代理方法来建模立法行为和两党关系,"Zachary R. Baker, Zarif L. Azher",https://arxiv.org/pdf/2406.18702.pdf,"Subjects:
Human-Computer Interaction (cs.HC); Computation and Language (cs.CL)","Human-Computer Interaction (cs.HC),  Computation and Language (cs.CL)"
415,arXiv:2406.18701,Fast Optimizer Benchmark,快速优化器基准,"Simon Blauth, Tobias Bürger, Zacharias Häringer, Jörg Franke, Frank Hutter",https://arxiv.org/pdf/2406.18701.pdf,"Subjects:
Machine Learning (cs.LG); Artificial Intelligence (cs.AI)","Machine Learning (cs.LG),  Artificial Intelligence (cs.AI)"
416,arXiv:2406.18700,On Fourier analysis of sparse Boolean functions over certain Abelian groups,关于某些阿贝尔群上稀疏布尔函数的傅立叶分析,"Sourav Chakraborty, Swarnalipa Datta, Pranjal Dutta, Arijit Ghosh, Swagato Sanyal",https://arxiv.org/pdf/2406.18700.pdf,"Subjects:
Computational Complexity (cs.CC)",Computational Complexity (cs.CC)
417,arXiv:2406.18699,From Pixels to Torques with Linear Feedback,从像素到具有线性反馈的力矩,"Jeong Hun Lee, Sam Schoedel, Aditya Bhardwaj, Zachary Manchester",https://arxiv.org/pdf/2406.18699.pdf,"Subjects:
Robotics (cs.RO)",Robotics (cs.RO)
418,arXiv:2406.18696,Sequence Graph Network for Online Debate Analysis,用于在线辩论分析的序列图网络,"Quan Mai, Susan Gauch, Douglas Adams, Miaoqing Huang",https://arxiv.org/pdf/2406.18696.pdf,"Subjects:
Computation and Language (cs.CL)",Computation and Language (cs.CL)
419,arXiv:2406.18695,Learning to Correct for QA Reasoning with Black-box LLMs,使用黑箱LLM学习纠正QA推理,"Jaehyung Kim, Dongyoung Kim, Yiming Yang",https://arxiv.org/pdf/2406.18695.pdf,"Subjects:
Machine Learning (cs.LG); Artificial Intelligence (cs.AI); Computation and Language (cs.CL)","Machine Learning (cs.LG),  Artificial Intelligence (cs.AI),  Computation and Language (cs.CL)"
420,arXiv:2406.18691,Geometric Features Enhanced Human-Object Interaction Detection,几何特征增强的人机交互检测,"Manli Zhu, Edmond S. L. Ho, Shuang Chen, Longzhi Yang, Hubert P. H. Shum",https://arxiv.org/pdf/2406.18691.pdf,"Subjects:
Computer Vision and Pattern Recognition (cs.CV)",Computer Vision and Pattern Recognition (cs.CV)
421,arXiv:2406.18690,Petal-X: Human-Centered Visual Explanations to Improve Cardiovascular Risk Communication,Petal-X：以人为中心的视觉解释，改善心血管风险沟通,"Diego Rojo, Houda Lamqaddam, Lucija Gosak, Katrien Verbert",https://arxiv.org/pdf/2406.18690.pdf,"Subjects:
Human-Computer Interaction (cs.HC); Artificial Intelligence (cs.AI); Machine Learning (cs.LG)","Human-Computer Interaction (cs.HC),  Artificial Intelligence (cs.AI),  Machine Learning (cs.LG)"
422,arXiv:2406.18684,CSI4Free: GAN-Augmented mmWave CSI for Improved Pose Classification,用于改进姿态分类的CSI4Free:GAN增强毫米波CSI,"Nabeel Nisar Bhat, Rafael Berkvens, Jeroen Famaey",https://arxiv.org/pdf/2406.18684.pdf,"Subjects:
Computer Vision and Pattern Recognition (cs.CV)",Computer Vision and Pattern Recognition (cs.CV)
423,arXiv:2406.18682,The Multilingual Alignment Prism: Aligning Global and Local Preferences to Reduce Harm,多语言对齐棱镜：对齐全局和局部偏好以减少危害,"Aakanksha, Arash Ahmadian, Beyza Ermis, Seraphina Goldfarb-Tarrant, Julia Kreutzer, Marzieh Fadaee, Sara Hooker",https://arxiv.org/pdf/2406.18682.pdf,"Subjects:
Computation and Language (cs.CL); Artificial Intelligence (cs.AI); Machine Learning (cs.LG)","Computation and Language (cs.CL),  Artificial Intelligence (cs.AI),  Machine Learning (cs.LG)"
424,arXiv:2406.18678,Few-shot Personalization of LLMs with Mis-aligned Responses,响应不一致LLM的少镜头个性化,"Jaehyung Kim, Yiming Yang",https://arxiv.org/pdf/2406.18678.pdf,"Subjects:
Machine Learning (cs.LG); Artificial Intelligence (cs.AI); Computation and Language (cs.CL)","Machine Learning (cs.LG),  Artificial Intelligence (cs.AI),  Computation and Language (cs.CL)"
425,arXiv:2406.18676,Understand What LLM Needs: Dual Preference Alignment for Retrieval-Augmented Generation,了解LLM的需求：检索增强生成的双偏好对齐,"Guanting Dong, Yutao Zhu, Chenghao Zhang, Zechen Wang, Zhicheng Dou, Ji-Rong Wen",https://arxiv.org/pdf/2406.18676.pdf,"Subjects:
Computation and Language (cs.CL); Artificial Intelligence (cs.AI); Machine Learning (cs.LG)","Computation and Language (cs.CL),  Artificial Intelligence (cs.AI),  Machine Learning (cs.LG)"
426,arXiv:2406.18675,Human-AI Collaborative Taxonomy Construction: A Case Study in Profession-Specific Writing Assistants,人工智能协同分类体系构建——以专业写作助理为例,"Minhwa Lee, Zae Myung Kim, Vivek A. Khetan, Dongyeop Kang",https://arxiv.org/pdf/2406.18675.pdf,"Subjects:
Human-Computer Interaction (cs.HC); Artificial Intelligence (cs.AI); Computation and Language (cs.CL)","Human-Computer Interaction (cs.HC),  Artificial Intelligence (cs.AI),  Computation and Language (cs.CL)"
427,arXiv:2406.18671,A Zero Auxiliary Knowledge Membership Inference Attack on Aggregate Location Data,一种对聚合位置数据的零辅助知识隶属推理攻击,"Vincent Guan, Florent Guépin, Ana-Maria Cretu, Yves-Alexandre de Montjoye",https://arxiv.org/pdf/2406.18671.pdf,"Subjects:
Cryptography and Security (cs.CR); Machine Learning (cs.LG)","Cryptography and Security (cs.CR),  Machine Learning (cs.LG)"
428,arXiv:2406.18670,Generalized Cuts and Grothendieck Covers: a Primal-Dual Approximation Framework Extending the Goemans--Williamson Algorithm,广义割和Grothendieck覆盖：扩展Goemans-Williamson算法的原对偶逼近框架,"Nathan Benedetto Proença, Marcel K. de Carli Silva, Cristiane M. Sato, Levent Tunçel",https://arxiv.org/pdf/2406.18670.pdf,"Subjects:
Data Structures and Algorithms (cs.DS); Discrete Mathematics (cs.DM); Optimization and Control (math.OC)","Data Structures and Algorithms (cs.DS),  Discrete Mathematics (cs.DM),  Optimization and Control (math.OC)"
429,arXiv:2406.18665,RouteLLM: Learning to Route LLMs with Preference Data,RouteLLM：学习使用偏好数据路由LLM,"Isaac Ong, Amjad Almahairi, Vincent Wu, Wei-Lin Chiang, Tianhao Wu, Joseph E. Gonzalez, M Waleed Kadous, Ion Stoica",https://arxiv.org/pdf/2406.18665.pdf,"Subjects:
Machine Learning (cs.LG); Artificial Intelligence (cs.AI); Computation and Language (cs.CL)","Machine Learning (cs.LG),  Artificial Intelligence (cs.AI),  Computation and Language (cs.CL)"
430,arXiv:2406.18664,Evaluating Copyright Takedown Methods for Language Models,评估语言模型的版权删除方法,"Boyi Wei, Weijia Shi, Yangsibo Huang, Noah A. Smith, Chiyuan Zhang, Luke Zettlemoyer, Kai Li, Peter Henderson",https://arxiv.org/pdf/2406.18664.pdf,"Subjects:
Computation and Language (cs.CL); Machine Learning (cs.LG)","Computation and Language (cs.CL),  Machine Learning (cs.LG)"
431,arXiv:2406.18630,Improving Hyperparameter Optimization with Checkpointed Model Weights,用检查点模型权重改进超参数优化,"Nikhil Mehta, Jonathan Lorraine, Steve Masson, Ramanathan Arunachalam, Zaid Pervaiz Bhat, James Lucas, Arun George Zachariah",https://arxiv.org/pdf/2406.18630.pdf,"Subjects:
Machine Learning (cs.LG); Artificial Intelligence (cs.AI); Machine Learning (stat.ML)","Machine Learning (cs.LG),  Artificial Intelligence (cs.AI),  Machine Learning (stat.ML)"
432,arXiv:2406.18629,Step-DPO: Step-wise Preference Optimization for Long-chain Reasoning of LLMs,Step-DPO：LLM长链推理的逐步偏好优化,"Xin Lai, Zhuotao Tian, Yukang Chen, Senqiao Yang, Xiangru Peng, Jiaya Jia",https://arxiv.org/pdf/2406.18629.pdf,"Subjects:
Machine Learning (cs.LG); Artificial Intelligence (cs.AI); Computation and Language (cs.CL)","Machine Learning (cs.LG),  Artificial Intelligence (cs.AI),  Computation and Language (cs.CL)"
433,arXiv:2406.18628,IDA-UIE: An Iterative Framework for Deep Network-based Degradation Aware Underwater Image Enhancement,IDA-UIE：一种基于深度网络的退化感知水下图像增强迭代框架,"Pranjali Singh, Prithwijit Guha",https://arxiv.org/pdf/2406.18628.pdf,"Subjects:
Computer Vision and Pattern Recognition (cs.CV); Image and Video Processing (eess.IV)","Computer Vision and Pattern Recognition (cs.CV),  Image and Video Processing (eess.IV)"
434,arXiv:2406.18627,AssertionBench: A Benchmark to Evaluate Large-Language Models for Assertion Generation,AssertionBench:评估断言生成的大型语言模型的基准,"Vaishnavi Pulavarthi, Deeksha Nandal, Soham Dan, Debjit Pal",https://arxiv.org/pdf/2406.18627.pdf,"Subjects:
Software Engineering (cs.SE); Machine Learning (cs.LG)","Software Engineering (cs.SE),  Machine Learning (cs.LG)"
435,arXiv:2406.18625,Automatic Prediction of Amyotrophic Lateral Sclerosis Progression using Longitudinal Speech Transformer,应用纵向语音变换器自动预测肌萎缩侧索硬化症进展,"Liming Wang, Yuan Gong, Nauman Dawalatabad, Marco Vilela, Katerina Placek, Brian Tracey, Yishu Gong, Alan Premasiri, Fernando Vieira, James Glass",https://arxiv.org/pdf/2406.18625.pdf,"Subjects:
Sound (cs.SD); Artificial Intelligence (cs.AI); Audio and Speech Processing (eess.AS)","Sound (cs.SD),  Artificial Intelligence (cs.AI),  Audio and Speech Processing (eess.AS)"
436,arXiv:2406.18621,Towards Deep Active Learning in Avian Bioacoustics,鸟类生物声学的深度主动学习,"Lukas Rauch, Denis Huseljic, Moritz Wirth, Jens Decke, Bernhard Sick, Christoph Scholz",https://arxiv.org/pdf/2406.18621.pdf,"Subjects:
Sound (cs.SD); Artificial Intelligence (cs.AI); Audio and Speech Processing (eess.AS)","Sound (cs.SD),  Artificial Intelligence (cs.AI),  Audio and Speech Processing (eess.AS)"
