Unnamed: 0,id,title,title_zh,authors,url,subjects,subject_split
495,arXiv:2407.07721,An hybrid framework OTFS OFDM based on mobile speed estimation,基于移动速度估计的混合框架OTFS-OFDM,"Amina Darghouthi, Abdelhakim Khlifi, Hmaied Shaiek, Fatma Ben Salah, Belgacem Chibani",https://arxiv.org/pdf/2407.07721.pdf,"Subjects:
Information Theory (cs.IT); Networking and Internet Architecture (cs.NI)","Information Theory (cs.IT),  Networking and Internet Architecture (cs.NI)"
496,arXiv:2407.07719,Model-based learning for multi-antenna multi-frequency location-to-channel mapping,基于模型的多天线多频定位到信道映射学习,"Baptiste Chatelier (IETR, MERCE-France, INSA Rennes), Vincent Corlay (MERCE-France), Matthieu Crussière (IETR, INSA Rennes), Luc Le Magoarou (IETR, INSA Rennes)",https://arxiv.org/pdf/2407.07719.pdf,"Subjects:
Information Theory (cs.IT); Machine Learning (cs.LG); Signal Processing (eess.SP)","Information Theory (cs.IT),  Machine Learning (cs.LG),  Signal Processing (eess.SP)"
497,arXiv:2407.07718,High-Performance Sorting-Based k-mer Counting in Distributed Memory with Flexible Hybrid Parallelism,灵活混合并行的分布式存储器中基于k-mer计数的高性能排序,"Yifan Li, Giulia Guidi",https://arxiv.org/pdf/2407.07718.pdf,"Subjects:
Distributed, Parallel, and Cluster Computing (cs.DC); Genomics (q-bio.GN)","Distributed, Parallel, and Cluster Computing (cs.DC),  Genomics (q-bio.GN)"
498,arXiv:2407.07715,Multi-User Localization and Tracking with Spatiotemporal Correlation in Multi-RIS-Assisted Systems,多RIS辅助系统中具有时空相关性的多用户定位与跟踪,"Ronghua Peng, Peng Gao, Jing You, Lixiang Lian",https://arxiv.org/pdf/2407.07715.pdf,"Subjects:
Information Theory (cs.IT); Signal Processing (eess.SP)","Information Theory (cs.IT),  Signal Processing (eess.SP)"
499,arXiv:2407.07713,Data-Driven Radio Environment Map Estimation Using Graph Neural Networks,基于图神经网络的数据驱动无线电环境图估计,"Ali Shibli, Tahar Zanouda",https://arxiv.org/pdf/2407.07713.pdf,"Subjects:
Networking and Internet Architecture (cs.NI); Machine Learning (cs.LG); Signal Processing (eess.SP)","Networking and Internet Architecture (cs.NI),  Machine Learning (cs.LG),  Signal Processing (eess.SP)"
500,arXiv:2407.07712,Deep-Graph-Sprints: Accelerated Representation Learning in Continuous-Time Dynamic Graphs,深度图精灵：连续时间动态图中的加速表示学习,"Ahmad Naser Eddin, Jacopo Bono, David Aparício, Hugo Ferreira, Pedro Ribeiro, Pedro Bizarro",https://arxiv.org/pdf/2407.07712.pdf,"Subjects:
Machine Learning (cs.LG); Social and Information Networks (cs.SI)","Machine Learning (cs.LG),  Social and Information Networks (cs.SI)"
501,arXiv:2407.07710,On the differential and Walsh spectra of $x^{2q+1}$ over $\mathbb{F}_{q^2}$,$x^{2q+1}$在$\mathbb上的微分谱和沃尔什谱{F}_{q^2}$,"Sihem Mesnager, Huawei Wu",https://arxiv.org/pdf/2407.07710.pdf,"Subjects:
Cryptography and Security (cs.CR); Information Theory (cs.IT); Number Theory (math.NT)","Cryptography and Security (cs.CR),  Information Theory (cs.IT),  Number Theory (math.NT)"
502,arXiv:2407.07708,Joint Constellation Shaping Using Gradient Descent Approach for MU-MIMO Broadcast Channel,基于梯度下降法的MU-MIMO广播信道联合星座整形,"Maxime Vaillant (MARACAS, INSA Lyon, CITI), Alix Jeannerot (MARACAS, INSA Lyon, CITI), Jean-Marie Gorce (INSA Lyon, MARACAS, CITI)",https://arxiv.org/pdf/2407.07708.pdf,"Subjects:
Information Theory (cs.IT); Machine Learning (cs.LG); Networking and Internet Architecture (cs.NI)","Information Theory (cs.IT),  Machine Learning (cs.LG),  Networking and Internet Architecture (cs.NI)"
503,arXiv:2407.07707,Group Projected Subspace Pursuit for Block Sparse Signal Reconstruction: Convergence Analysis and Applications,分组稀疏信号重构的群投影子空间追踪：收敛性分析及其应用,"Roy Y. He, Haixia Liu, Hao Líu",https://arxiv.org/pdf/2407.07707.pdf,"Subjects:
Information Theory (cs.IT); Optimization and Control (math.OC); Machine Learning (stat.ML)","Information Theory (cs.IT),  Optimization and Control (math.OC),  Machine Learning (stat.ML)"
504,arXiv:2407.07705,Field-Enhanced Filtering in MIMO Learned Volterra Nonlinear Equalisation of Multi-Wavelength Systems,多波长系统MIMO学习Volterra非线性均衡中的场增强滤波,"Nelson Castro, Sonia Boscolo, Andrew D. Ellis, Stylianos Sygletos",https://arxiv.org/pdf/2407.07705.pdf,"Subjects:
Information Theory (cs.IT); Machine Learning (cs.LG); Signal Processing (eess.SP)","Information Theory (cs.IT),  Machine Learning (cs.LG),  Signal Processing (eess.SP)"
505,arXiv:2407.07704,Evaluating the Role of Security Assurance Cases in Agile Medical Device Development,评估安全保障案例在敏捷医疗器械开发中的作用,"Max Fransson, Adam Andersson, Mazen Mohamad, Jan-Philipp Steghöfer",https://arxiv.org/pdf/2407.07704.pdf,"Subjects:
Cryptography and Security (cs.CR); Software Engineering (cs.SE)","Cryptography and Security (cs.CR),  Software Engineering (cs.SE)"
506,arXiv:2407.07702,Leveraging Self-Supervised Learning for MIMO-OFDM Channel Representation and Generation,利用自监督学习进行MIMO-OFDM信道表示和生成,"Zongxi Liu, Jiacheng Chen, Yunting Xu, Ting Ma, Jingbo Liu, Haibo Zhou, Dusit Niyato",https://arxiv.org/pdf/2407.07702.pdf,"Subjects:
Information Theory (cs.IT); Signal Processing (eess.SP)","Information Theory (cs.IT),  Signal Processing (eess.SP)"
507,arXiv:2407.07699,Transmission Design for XL-RIS-Aided Massive MIMO System with Visibility Regions,具有可视区域的XL-RIS辅助大规模MIMO系统的传输设计,"Luchu Li, Kangda Zhi, Cunhua Pan",https://arxiv.org/pdf/2407.07699.pdf,"Subjects:
Information Theory (cs.IT)",Information Theory (cs.IT)
508,arXiv:2407.07698,The V-Lab VR Educational Application Framework,V-Lab虚拟现实教育应用框架,"Vasilis Zafeiropoulos, George Anastassakis, Theophanis Orphanoudakis, Dimitris Kalles, Anastasios Fanariotis, Vassilis Fotopoulos",https://arxiv.org/pdf/2407.07698.pdf,"Subjects:
Human-Computer Interaction (cs.HC)",Human-Computer Interaction (cs.HC)
509,arXiv:2407.07695,African Democracy in the Era of Generative Disinformation: Challenges and Countermeasures against AI-Generated Propaganda,生成虚假信息时代的非洲民主：人工智能生成宣传的挑战与对策,Chinasa T. Okolo,https://arxiv.org/pdf/2407.07695.pdf,"Subjects:
Computers and Society (cs.CY); Artificial Intelligence (cs.AI)","Computers and Society (cs.CY),  Artificial Intelligence (cs.AI)"
510,arXiv:2407.07686,On the impact of VR/AR applications on optical transport networks: First experiments with Meta Quest 3 gaming and conferencing application,VR/AR应用对光传输网络的影响：Meta Quest 3游戏和会议应用的首次实验,"C. de Quinto, A. Navarro, G. Otero, N. Koneva, J. A. Hernández, M. Quagliotti, A. Sánchez-Macian, F. Arpanaei, P. Reviriego, Ó. González de Dios, J. M. Rivas-Moscoso, E. Riccardi, D. Larrabeiti",https://arxiv.org/pdf/2407.07686.pdf,"Subjects:
Networking and Internet Architecture (cs.NI)",Networking and Internet Architecture (cs.NI)
511,arXiv:2407.07684,Towards Human-Like Driving: Active Inference in Autonomous Vehicle Control,迈向类人驾驶：自动驾驶汽车控制中的主动推理,"Elahe Delavari, John Moore, Junho Hong, Jaerock Kwon",https://arxiv.org/pdf/2407.07684.pdf,"Subjects:
Robotics (cs.RO); Artificial Intelligence (cs.AI); Machine Learning (cs.LG); Neural and Evolutionary Computing (cs.NE)","Robotics (cs.RO),  Artificial Intelligence (cs.AI),  Machine Learning (cs.LG),  Neural and Evolutionary Computing (cs.NE)"
512,arXiv:2407.07683,The Language of Weather: Social Media Reactions to Weather Accounting for Climatic and Linguistic Baselines,天气语言：社交媒体对天气的反应，考虑气候和语言基线,"James C. Young, Rudy Arthur, Hywel T.P. Williams",https://arxiv.org/pdf/2407.07683.pdf,"Subjects:
Human-Computer Interaction (cs.HC); Computation and Language (cs.CL)","Human-Computer Interaction (cs.HC),  Computation and Language (cs.CL)"
513,arXiv:2407.07677,APTAS for bin packing with general cost structures,具有一般成本结构的装箱APTAS,"G. Jaykrishnan, Asaf Levin",https://arxiv.org/pdf/2407.07677.pdf,"Subjects:
Data Structures and Algorithms (cs.DS); Discrete Mathematics (cs.DM); Optimization and Control (math.OC)","Data Structures and Algorithms (cs.DS),  Discrete Mathematics (cs.DM),  Optimization and Control (math.OC)"
514,arXiv:2407.07674,Feasibility Study on Active Learning of Smart Surrogates for Scientific Simulations,科学模拟中智能代理主动学习的可行性研究,"Pradeep Bajracharya, Javier Quetzalcóatl Toledo-Marín, Geoffrey Fox, Shantenu Jha, Linwei Wang",https://arxiv.org/pdf/2407.07674.pdf,"Subjects:
Machine Learning (cs.LG)",Machine Learning (cs.LG)
515,arXiv:2407.07673,Towards Adaptive Pseudo-label Learning for Semi-Supervised Temporal Action Localization,半监督时间动作定位的自适应伪标签学习,"Feixiang Zhou, Bryan Williams, Hossein Rahmani",https://arxiv.org/pdf/2407.07673.pdf,"Subjects:
Computer Vision and Pattern Recognition (cs.CV)",Computer Vision and Pattern Recognition (cs.CV)
516,arXiv:2407.07672,StoryDiffusion: How to Support UX Storyboarding With Generative-AI,StoryDiffusion：如何用生成式人工智能支持用户体验故事板,"Zhaohui Liang, Xiaoyu Zhang, Kevin Ma, Zhao Liu, Xipei Ren, Kosa Goucher-Lambert, Can Liu",https://arxiv.org/pdf/2407.07672.pdf,"Subjects:
Human-Computer Interaction (cs.HC)",Human-Computer Interaction (cs.HC)
517,arXiv:2407.07671,Why should we ever automate moral decision making?,为什么我们要自动化道德决策？,Vincent Conitzer,https://arxiv.org/pdf/2407.07671.pdf,"Subjects:
Artificial Intelligence (cs.AI)",Artificial Intelligence (cs.AI)
518,arXiv:2407.07669,Joint UPF and Edge Applications Placement and Routing in 5G & Beyond,5G及以后的联合UPF和边缘应用布局和路由,"Endri Goshi, Hasanin Harkous, Shohreh Ahvar, Rastin Pries, Fidan Mehmeti, Wolfgang Kellerer",https://arxiv.org/pdf/2407.07669.pdf,"Subjects:
Networking and Internet Architecture (cs.NI)",Networking and Internet Architecture (cs.NI)
519,arXiv:2407.07668,How to Leverage Predictive Uncertainty Estimates for Reducing Catastrophic Forgetting in Online Continual Learning,如何利用预测不确定性估计来减少在线持续学习中的灾难性遗忘,"Giuseppe Serra, Ben Werner, Florian Buettner",https://arxiv.org/pdf/2407.07668.pdf,"Subjects:
Machine Learning (cs.LG); Artificial Intelligence (cs.AI)","Machine Learning (cs.LG),  Artificial Intelligence (cs.AI)"
520,arXiv:2407.07667,VEnhancer: Generative Space-Time Enhancement for Video Generation,VEnhancer：用于视频生成的生成时空增强,"Jingwen He, Tianfan Xue, Dongyang Liu, Xinqi Lin, Peng Gao, Dahua Lin, Yu Qiao, Wanli Ouyang, Ziwei Liu",https://arxiv.org/pdf/2407.07667.pdf,"Subjects:
Computer Vision and Pattern Recognition (cs.CV); Image and Video Processing (eess.IV)","Computer Vision and Pattern Recognition (cs.CV),  Image and Video Processing (eess.IV)"
521,arXiv:2407.07666,"A Proposed S.C.O.R.E. Evaluation Framework for Large Language Models : Safety, Consensus, Objectivity, Reproducibility and Explainability",大型语言模型的S.C.O.R.E.评估框架：安全性、一致性、客观性、可再现性和可解释性,"Ting Fang Tan, Kabilan Elangovan, Jasmine Ong, Nigam Shah, Joseph Sung, Tien Yin Wong, Lan Xue, Nan Liu, Haibo Wang, Chang Fu Kuo, Simon Chesterman, Zee Kin Yeong, Daniel SW Ting",https://arxiv.org/pdf/2407.07666.pdf,"Subjects:
Computation and Language (cs.CL); Artificial Intelligence (cs.AI)","Computation and Language (cs.CL),  Artificial Intelligence (cs.AI)"
522,arXiv:2407.07664,A Coding-Theoretic Analysis of Hyperspherical Prototypical Learning Geometry,超球面原型学习几何的编码理论分析,"Martin Lindström, Borja Rodríguez-Gálvez, Ragnar Thobaben, Mikael Skoglund",https://arxiv.org/pdf/2407.07664.pdf,"Subjects:
Machine Learning (cs.LG); Artificial Intelligence (cs.AI); Computer Vision and Pattern Recognition (cs.CV); Signal Processing (eess.SP); Machine Learning (stat.ML)","Machine Learning (cs.LG),  Artificial Intelligence (cs.AI),  Computer Vision and Pattern Recognition (cs.CV),  Signal Processing (eess.SP),  Machine Learning (stat.ML)"
523,arXiv:2407.07662,Mitigating Backdoor Attacks using Activation-Guided Model Editing,使用激活引导模型编辑减轻后门攻击,"Felix Hsieh, Huy H. Nguyen, AprilPyone MaungMaung, Dmitrii Usynin, Isao Echizen",https://arxiv.org/pdf/2407.07662.pdf,"Subjects:
Computer Vision and Pattern Recognition (cs.CV); Cryptography and Security (cs.CR)","Computer Vision and Pattern Recognition (cs.CV),  Cryptography and Security (cs.CR)"
524,arXiv:2407.07660,Boosting Medical Image Synthesis via Registration-guided Consistency and Disentanglement Learning,通过配准引导的一致性和去纠缠学习促进医学图像合成,"Chuanpu Li, Zeli Chen, Yiwen Zhang, Liming Zhong, Wei Yang",https://arxiv.org/pdf/2407.07660.pdf,"Subjects:
Computer Vision and Pattern Recognition (cs.CV); Artificial Intelligence (cs.AI)","Computer Vision and Pattern Recognition (cs.CV),  Artificial Intelligence (cs.AI)"
525,arXiv:2407.07656,Co-designing heterogeneous models: a distributed systems approach,协同设计异构模型：一种分布式系统方法,"Marius-Constantin Ilau, Tristan Caulfield, David Pym",https://arxiv.org/pdf/2407.07656.pdf,"Subjects:
Software Engineering (cs.SE); Cryptography and Security (cs.CR)","Software Engineering (cs.SE),  Cryptography and Security (cs.CR)"
526,arXiv:2407.07655,The Selective G-Bispectrum and its Inversion: Applications to G-Invariant Networks,选择性G-双谱及其反演：在G-不变网络中的应用,"Simon Mataigne, Johan Mathe, Sophia Sanborn, Christopher Hillar, Nina Miolane",https://arxiv.org/pdf/2407.07655.pdf,"Subjects:
Machine Learning (cs.LG)",Machine Learning (cs.LG)
527,arXiv:2407.07654,"Explicit inverse of symmetric, tridiagonal near Toeplitz matrices Part II: with weakly diagonally dominant Toeplitz",对称三对角Toeplitz矩阵的显式逆第二部分：弱对角占优Toeplitz,"Bakytzhan Kurmanbek, Yogi Erlangga, Yerlan Amanbek",https://arxiv.org/pdf/2407.07654.pdf,"Subjects:
Numerical Analysis (math.NA)",Numerical Analysis (math.NA)
528,arXiv:2407.07653,AffectGPT: Dataset and Framework for Explainable Multimodal Emotion Recognition,AffectGPT：可解释多模态情感识别的数据集和框架,"Zheng Lian, Haiyang Sun, Licai Sun, Jiangyan Yi, Bin Liu, Jianhua Tao",https://arxiv.org/pdf/2407.07653.pdf,"Subjects:
Human-Computer Interaction (cs.HC)",Human-Computer Interaction (cs.HC)
529,arXiv:2407.07645,On Sampling from Ising Models with Spectral Constraints,关于具有谱约束的Ising模型的采样,"Andreas Galanis, Alkis Kalavasis, Anthimos Vardis Kandiros",https://arxiv.org/pdf/2407.07645.pdf,"Subjects:
Data Structures and Algorithms (cs.DS); Probability (math.PR)","Data Structures and Algorithms (cs.DS),  Probability (math.PR)"
530,arXiv:2407.07642,Machine learning of discrete field theories with guaranteed convergence and uncertainty quantification,具有保证收敛性和不确定性量化的离散场论机器学习,Christian Offen,https://arxiv.org/pdf/2407.07642.pdf,"Subjects:
Numerical Analysis (math.NA); Dynamical Systems (math.DS)","Numerical Analysis (math.NA),  Dynamical Systems (math.DS)"
531,arXiv:2407.07641,Low communication protocols for fair allocation of indivisible goods,用于公平分配不可分割商品的低通信协议,Uriel Feige,https://arxiv.org/pdf/2407.07641.pdf,"Subjects:
Computer Science and Game Theory (cs.GT); Computational Complexity (cs.CC)","Computer Science and Game Theory (cs.GT),  Computational Complexity (cs.CC)"
532,arXiv:2407.07639,Explaining Graph Neural Networks for Node Similarity on Graphs,图上节点相似性的图神经网络解释,"Daniel Daza, Cuong Xuan Chu, Trung-Kien Tran, Daria Stepanova, Michael Cochez, Paul Groth",https://arxiv.org/pdf/2407.07639.pdf,"Subjects:
Machine Learning (cs.LG); Artificial Intelligence (cs.AI)","Machine Learning (cs.LG),  Artificial Intelligence (cs.AI)"
533,arXiv:2407.07638,Tuning Vision-Language Models with Candidate Labels by Prompt Alignment,通过提示对齐调整具有候选标签的视觉语言模型,"Zhifang Zhang, Beibei Li",https://arxiv.org/pdf/2407.07638.pdf,"Subjects:
Computer Vision and Pattern Recognition (cs.CV); Artificial Intelligence (cs.AI)","Computer Vision and Pattern Recognition (cs.CV),  Artificial Intelligence (cs.AI)"
534,arXiv:2407.07636,MoVEInt: Mixture of Variational Experts for Learning Human-Robot Interactions from Demonstrations,MoVEInt：从演示中学习人机交互的变分专家组合,"Vignesh Prasad, Alap Kshirsagar, Dorothea Koert, Ruth Stock-Homburg, Jan Peters, Georgia Chalvatzaki",https://arxiv.org/pdf/2407.07636.pdf,"Subjects:
Robotics (cs.RO); Human-Computer Interaction (cs.HC); Machine Learning (cs.LG)","Robotics (cs.RO),  Human-Computer Interaction (cs.HC),  Machine Learning (cs.LG)"
535,arXiv:2407.07631,Pessimism Meets Risk: Risk-Sensitive Offline Reinforcement Learning,悲观遭遇风险：对风险敏感的离线强化学习,"Dake Zhang, Boxiang Lyu, Shuang Qiu, Mladen Kolar, Tong Zhang",https://arxiv.org/pdf/2407.07631.pdf,"Subjects:
Machine Learning (cs.LG); Optimization and Control (math.OC); Statistics Theory (math.ST); Machine Learning (stat.ML)","Machine Learning (cs.LG),  Optimization and Control (math.OC),  Statistics Theory (math.ST),  Machine Learning (stat.ML)"
536,arXiv:2407.07630,A Review of the Challenges with Massive Web-mined Corpora Used in Large Language Models Pre-Training,大规模网络挖掘语料库在大型语言模型预训练中的应用挑战综述,"Michał Perełkiewicz, Rafał Poświata",https://arxiv.org/pdf/2407.07630.pdf,"Subjects:
Computation and Language (cs.CL)",Computation and Language (cs.CL)
537,arXiv:2407.07629,A Finite Element Method by Patch Reconstruction for the Quad-Curl Problem Using Mixed Formulations,基于混合公式的四边形卷曲问题的补丁重建有限元方法,"Ruo Li, Qicheng Liu, Shuhai Zhao",https://arxiv.org/pdf/2407.07629.pdf,"Subjects:
Numerical Analysis (math.NA)",Numerical Analysis (math.NA)
538,arXiv:2407.07627,Synthetic to Authentic: Transferring Realism to 3D Face Renderings for Boosting Face Recognition,合成到真实：将真实感转化为3D人脸渲染，以提高人脸识别能力,"Parsa Rahimi, Behrooz Razeghi, Sebastien Marcel",https://arxiv.org/pdf/2407.07627.pdf,"Subjects:
Computer Vision and Pattern Recognition (cs.CV)",Computer Vision and Pattern Recognition (cs.CV)
539,arXiv:2407.07625,The Complexity of Computing Robust Mediated Equilibria in Ordinal Games,序数博弈中计算鲁棒中介均衡的复杂性,Vincent Conitzer,https://arxiv.org/pdf/2407.07625.pdf,"Subjects:
Computer Science and Game Theory (cs.GT)",Computer Science and Game Theory (cs.GT)
540,arXiv:2407.07618,Cosserat Rods for Modeling Tendon-Driven Robotic Catheter Systems,用于肌腱驱动机器人导管系统建模的Cosserat杆,"Pierre-Frederic Villard, Thomas M. Waite, Robert D. Howe",https://arxiv.org/pdf/2407.07618.pdf,"Subjects:
Robotics (cs.RO)",Robotics (cs.RO)
541,arXiv:2407.07617,Psycho-linguistic Experiment on Universal Semantic Components of Verbal Humor: System Description and Annotation,言语幽默普遍语义成分的心理语言学实验：系统描述与注释,"Elena Mikhalkova, Nadezhda Ganzherli, Julia Murzina",https://arxiv.org/pdf/2407.07617.pdf,"Subjects:
Computation and Language (cs.CL)",Computation and Language (cs.CL)
542,arXiv:2407.07616,Satellite Image Time Series Semantic Change Detection: Novel Architecture and Analysis of Domain Shift,卫星图像时间序列语义变化检测：新架构与域移位分析,"Elliot Vincent, Jean Ponce, Mathieu Aubry",https://arxiv.org/pdf/2407.07616.pdf,"Subjects:
Computer Vision and Pattern Recognition (cs.CV)",Computer Vision and Pattern Recognition (cs.CV)
543,arXiv:2407.07614,MARS: Mixture of Auto-Regressive Models for Fine-grained Text-to-image Synthesis,MARS:细粒度文本到图像合成的混合自回归模型,"Wanggui He, Siming Fu, Mushui Liu, Xierui Wang, Wenyi Xiao, Fangxun Shu, Yi Wang, Lei Zhang, Zhelun Yu, Haoyuan Li, Ziwei Huang, LeiLei Gan, Hao Jiang",https://arxiv.org/pdf/2407.07614.pdf,"Subjects:
Computer Vision and Pattern Recognition (cs.CV)",Computer Vision and Pattern Recognition (cs.CV)
544,arXiv:2407.07613,Probabilistic learning rate scheduler with provable convergence,具有可证明收敛性的概率学习率调度器,"Dahlia Devapriya, Thulasi Tholeti, Janani Suresh, Sheetal Kalyani",https://arxiv.org/pdf/2407.07613.pdf,"Subjects:
Machine Learning (cs.LG)",Machine Learning (cs.LG)
545,arXiv:2407.07612,Teaching Transformers Causal Reasoning through Axiomatic Training,通过公理训练教授变压器因果推理,"Aniket Vashishtha, Abhinav Kumar, Abbavaram Gowtham Reddy, Vineeth N Balasubramanian, Amit Sharma",https://arxiv.org/pdf/2407.07612.pdf,"Subjects:
Machine Learning (cs.LG); Artificial Intelligence (cs.AI); Computation and Language (cs.CL)","Machine Learning (cs.LG),  Artificial Intelligence (cs.AI),  Computation and Language (cs.CL)"
546,arXiv:2407.07611,"Physics-Informed Geometric Operators to Support Surrogate, Dimension Reduction and Generative Models for Engineering Design",基于物理的几何算子支持工程设计的替代、降维和生成模型,"Shahroz Khan, Zahid Masood, Muhammad Usama, Konstantinos Kostas, Panagiotis Kaklis, Wei (Wayne)Chen",https://arxiv.org/pdf/2407.07611.pdf,"Subjects:
Machine Learning (cs.LG); Computational Engineering, Finance, and Science (cs.CE)","Machine Learning (cs.LG),  Computational Engineering, Finance, and Science (cs.CE)"
547,arXiv:2407.07606,The Computational Learning of Construction Grammars: State of the Art and Prospective Roadmap,构造语法的计算学习：最新进展和前瞻性路线图,"Jonas Doumen, Veronica Juliana Schmalz, Katrien Beuls, Paul Van Eecke",https://arxiv.org/pdf/2407.07606.pdf,"Subjects:
Computation and Language (cs.CL); Artificial Intelligence (cs.AI)","Computation and Language (cs.CL),  Artificial Intelligence (cs.AI)"
548,arXiv:2407.07605,Early Explorations of Lightweight Models for Wound Segmentation on Mobile Devices,移动设备上伤口分割轻量级模型的早期探索,"Vanessa Borst, Timo Dittus, Konstantin Müller, Samuel Kounev",https://arxiv.org/pdf/2407.07605.pdf,"Subjects:
Computer Vision and Pattern Recognition (cs.CV); Artificial Intelligence (cs.AI)","Computer Vision and Pattern Recognition (cs.CV),  Artificial Intelligence (cs.AI)"
549,arXiv:2407.07604,H-FCBFormer Hierarchical Fully Convolutional Branch Transformer for Occlusal Contact Segmentation with Articulating Paper,H-FCBFormer分层全卷积分支变换器用于咬合接触分割,"Ryan Banks, Bernat Rovira-Lastra, Jordi Martinez-Gomis, Akhilanand Chaurasia, Yunpeng Li",https://arxiv.org/pdf/2407.07604.pdf,"Subjects:
Computer Vision and Pattern Recognition (cs.CV); Artificial Intelligence (cs.AI)","Computer Vision and Pattern Recognition (cs.CV),  Artificial Intelligence (cs.AI)"
550,arXiv:2407.07603,iiANET: Inception Inspired Attention Hybrid Network for efficient Long-Range Dependency,iiANET：用于高效远程依赖的初始启发注意力混合网络,"Haruna Yunusa, Qin Shiyin, Abdulrahman Hamman Adama Chukkol, Isah Bello, Adamu Lawan",https://arxiv.org/pdf/2407.07603.pdf,"Subjects:
Computer Vision and Pattern Recognition (cs.CV)",Computer Vision and Pattern Recognition (cs.CV)
551,arXiv:2407.07599,Can social media shape the security of next-generation connected vehicles?,社交媒体能否塑造下一代联网汽车的安全性？,"Nicola Scarano, Luca Mannella, Alessandro Savino, Stefano Di Carlo",https://arxiv.org/pdf/2407.07599.pdf,"Subjects:
Social and Information Networks (cs.SI)",Social and Information Networks (cs.SI)
552,arXiv:2407.07598,Targeted Augmented Data for Audio Deepfake Detection,用于音频深度伪造检测的目标增强数据,"Marcella Astrid, Enjie Ghorbel, Djamila Aouada",https://arxiv.org/pdf/2407.07598.pdf,"Subjects:
Sound (cs.SD); Machine Learning (cs.LG); Audio and Speech Processing (eess.AS)","Sound (cs.SD),  Machine Learning (cs.LG),  Audio and Speech Processing (eess.AS)"
553,arXiv:2407.07596,Learning treatment effects while treating those in need,在治疗有需要的人的同时学习治疗效果,"Bryan Wilder, Pim Welle",https://arxiv.org/pdf/2407.07596.pdf,"Subjects:
Machine Learning (cs.LG); Methodology (stat.ME); Machine Learning (stat.ML)","Machine Learning (cs.LG),  Methodology (stat.ME),  Machine Learning (stat.ML)"
554,arXiv:2407.07591,A 'MAP' to find high-performing soft robot designs: Traversing complex design spaces using MAP-elites and Topology Optimization,寻找高性能软机器人设计的“MAP”：使用MAP精英和拓扑优化遍历复杂的设计空间,"Yue Xie, Josh Pinskier, Lois Liow, David Howard, Fumiya Iida",https://arxiv.org/pdf/2407.07591.pdf,"Subjects:
Robotics (cs.RO); Neural and Evolutionary Computing (cs.NE)","Robotics (cs.RO),  Neural and Evolutionary Computing (cs.NE)"
555,arXiv:2407.07589,MSC-LIO: An MSCKF-Based LiDAR-Inertial Odometry with Same-Plane-Point Tracking,MSC-LIO：基于MSCKF的激光雷达惯性测距，具有同平面点跟踪功能,"Tisheng Zhang, Man Yuan, Linfu Wei, Hailiang Tang, Xiaoji Niu",https://arxiv.org/pdf/2407.07589.pdf,"Subjects:
Robotics (cs.RO)",Robotics (cs.RO)
556,arXiv:2407.07587,Let Occ Flow: Self-Supervised 3D Occupancy Flow Prediction,Let-Occ Flow：自我监控的3D占用流量预测,"Yili Liu, Linzhan Mou, Xuan Yu, Chenrui Han, Sitong Mao, Rong Xiong, Yue Wang",https://arxiv.org/pdf/2407.07587.pdf,"Subjects:
Computer Vision and Pattern Recognition (cs.CV)",Computer Vision and Pattern Recognition (cs.CV)
