Unnamed: 0,id,title,title_zh,authors,url,subjects,subject_split
246,arXiv:2406.19102,Statements: Universal Information Extraction from Tables with Large Language Models for ESG KPIs,语句：从具有ESG KPI大型语言模型的表中提取通用信息,"Lokesh Mishra, Sohayl Dhibi, Yusik Kim, Cesar Berrospi Ramis, Shubham Gupta, Michele Dolfi, Peter Staar",https://arxiv.org/pdf/2406.19102.pdf,"Subjects:
Computation and Language (cs.CL); Artificial Intelligence (cs.AI); Information Retrieval (cs.IR)","Computation and Language (cs.CL),  Artificial Intelligence (cs.AI),  Information Retrieval (cs.IR)"
247,arXiv:2406.19101,DocKylin: A Large Multimodal Model for Visual Document Understanding with Efficient Visual Slimming,DocKylin：一个具有高效视觉精简的可视化文档理解的大型多模式模型,"Jiaxin Zhang, Wentao Yang, Songxuan Lai, Zecheng Xie, Lianwen Jin",https://arxiv.org/pdf/2406.19101.pdf,"Subjects:
Computer Vision and Pattern Recognition (cs.CV)",Computer Vision and Pattern Recognition (cs.CV)
248,arXiv:2406.19097,Fairness and Bias in Multimodal AI: A Survey,多模式人工智能中的公平与偏差：综述,"Tosin Adewumi, Lama Alkhaled, Namrata Gurung, Goya van Boven, Irene Pagliai",https://arxiv.org/pdf/2406.19097.pdf,"Subjects:
Computation and Language (cs.CL)",Computation and Language (cs.CL)
249,arXiv:2406.19096,In-situ Controller Autotuning by Bayesian Optimization for Closed-loop Feedback Control of Laser Powder Bed Fusion Process,基于贝叶斯优化的激光粉末床熔化过程闭环反馈控制原位控制器自整定,"Baris Kavas, Efe C. Balta, Michael R. Tucker, Raamadaas Krishnadas, Alisa Rupenyan, John Lygeros, Markus Bambach",https://arxiv.org/pdf/2406.19096.pdf,"Subjects:
Systems and Control (eess.SY)",Systems and Control (eess.SY)
250,arXiv:2406.19094,Understanding the Security Benefits and Overheads of Emerging Industry Solutions to DRAM Read Disturbance,了解新兴行业DRAM读取干扰解决方案的安全优势和管理费用,"Oğuzhan Canpolat, A. Giray Yağlıkçı, Geraldo F. Oliveira, Ataberk Olgun, Oğuz Ergin, Onur Mutlu",https://arxiv.org/pdf/2406.19094.pdf,"Subjects:
Cryptography and Security (cs.CR); Hardware Architecture (cs.AR)","Cryptography and Security (cs.CR),  Hardware Architecture (cs.AR)"
251,arXiv:2406.19092,Adaptive Stochastic Weight Averaging,自适应随机加权平均,"Caglar Demir, Arnab Sharma, Axel-Cyrille Ngonga Ngomo",https://arxiv.org/pdf/2406.19092.pdf,"Subjects:
Machine Learning (cs.LG)",Machine Learning (cs.LG)
252,arXiv:2406.19091,SubLock: Sub-Circuit Replacement based Input Dependent Key-based Logic Locking for Robust IP Protection,SubLock：用于稳健IP保护的基于子电路替换的输入相关密钥逻辑锁定,"Vijaypal Singh Rathor, Munesh Singh, Kshira Sagar Sahoo, Saraju P. Mohanty",https://arxiv.org/pdf/2406.19091.pdf,"Subjects:
Cryptography and Security (cs.CR)",Cryptography and Security (cs.CR)
253,arXiv:2406.19087,Dimensions underlying the representational alignment of deep neural networks with humans,深度神经网络与人类的表征对齐的基本维度,"Florian P. Mahner, Lukas Muttenthaler, Umut Güçlü, Martin N. Hebart",https://arxiv.org/pdf/2406.19087.pdf,"Subjects:
Computer Vision and Pattern Recognition (cs.CV); Artificial Intelligence (cs.AI); Machine Learning (cs.LG); Quantitative Methods (q-bio.QM)","Computer Vision and Pattern Recognition (cs.CV),  Artificial Intelligence (cs.AI),  Machine Learning (cs.LG),  Quantitative Methods (q-bio.QM)"
254,arXiv:2406.19084,Spatial Multiplexing in Near-Field Line-of-Sight MIMO Communications: Paraxial and Non-Paraxial Deployments,近场视线MIMO通信中的空间复用：傍轴和非傍轴部署,"Juan Carlos Ruiz-Sicilia, Marco Di Renzo, Placido Mursia, Aryan Kaushik, Vincenzo Sciancalepore",https://arxiv.org/pdf/2406.19084.pdf,"Subjects:
Information Theory (cs.IT); Signal Processing (eess.SP)","Information Theory (cs.IT),  Signal Processing (eess.SP)"
255,arXiv:2406.19077,Parameter Dependent Chen--Fliess Series and Their Nonrecursive Interconnections,参数相关Chen——Fless级数及其非递归关联,"W. Steven Gray, Natalie Pham",https://arxiv.org/pdf/2406.19077.pdf,"Subjects:
Systems and Control (eess.SY)",Systems and Control (eess.SY)
256,arXiv:2406.19073,AMBROSIA: A Benchmark for Parsing Ambiguous Questions into Database Queries,AMBROSIA：将歧义问题解析为数据库查询的基准,"Irina Saparina, Mirella Lapata",https://arxiv.org/pdf/2406.19073.pdf,"Subjects:
Computation and Language (cs.CL)",Computation and Language (cs.CL)
257,arXiv:2406.19071,EmPO: Theory-Driven Dataset Construction for Empathetic Response Generation through Preference Optimization,EmPO：通过偏好优化生成同情反应的理论驱动数据集构建,Ondrej Sotolar,https://arxiv.org/pdf/2406.19071.pdf,"Subjects:
Computation and Language (cs.CL); Artificial Intelligence (cs.AI)","Computation and Language (cs.CL),  Artificial Intelligence (cs.AI)"
258,arXiv:2406.19070,FAGhead: Fully Animate Gaussian Head from Monocular Videos,FAGhead：单目视频中的全动画高斯头,"Yixin Xuan, Xinyang Li, Gongxin Yao, Shiwei Zhou, Donghui Sun, Xiaoxin Chen, Yu Pan",https://arxiv.org/pdf/2406.19070.pdf,"Subjects:
Computer Vision and Pattern Recognition (cs.CV)",Computer Vision and Pattern Recognition (cs.CV)
259,arXiv:2406.19066,Dancing in the Shadows: Harnessing Ambiguity for Fairer Classifiers,在阴影中跳舞：为更公平的分类器处理歧义,"Ainhize Barrainkua, Paula Gordaliza, Jose A. Lozano, Novi Quadrianto",https://arxiv.org/pdf/2406.19066.pdf,"Subjects:
Machine Learning (cs.LG); Computers and Society (cs.CY)","Machine Learning (cs.LG),  Computers and Society (cs.CY)"
260,arXiv:2406.19065,STBench: Assessing the Ability of Large Language Models in Spatio-Temporal Analysis,STBench:评估大型语言模型在时空分析中的能力,"Wenbin Li, Di Yao, Ruibo Zhao, Wenjie Chen, Zijie Xu, Chengxue Luo, Chang Gong, Quanliang Jing, Haining Tan, Jingping Bi",https://arxiv.org/pdf/2406.19065.pdf,"Subjects:
Computation and Language (cs.CL)",Computation and Language (cs.CL)
261,arXiv:2406.19064,Distributed Utility Optimization in Vehicular Communication Systems,车载通信系统中的分布式效用优化,"Miguel A. Diaz-Ibarra, Daniel U. Campos-Delgado, Carlos A. Gutierrez, Jose M. Luna-Rivera, Francisco J. Cabrera-Almeida",https://arxiv.org/pdf/2406.19064.pdf,"Subjects:
Systems and Control (eess.SY)",Systems and Control (eess.SY)
262,arXiv:2406.19057,Segment Anything Model for automated image data annotation: empirical studies using text prompts from Grounding DINO,用于自动图像数据注释的Segment Anything模型：使用来自Grounding DINO的文本提示的实证研究,"Fuseini Mumuni, Alhassan Mumuni",https://arxiv.org/pdf/2406.19057.pdf,"Subjects:
Computer Vision and Pattern Recognition (cs.CV); Artificial Intelligence (cs.AI); Machine Learning (cs.LG); Robotics (cs.RO)","Computer Vision and Pattern Recognition (cs.CV),  Artificial Intelligence (cs.AI),  Machine Learning (cs.LG),  Robotics (cs.RO)"
263,arXiv:2406.19055,SimpleFusion: A Simple Fusion Framework for Infrared and Visible Images,SimpleFusion：一种简单的红外和可见光图像融合框架,"Ming Chen, Yuxuan Cheng, Xinwei He, Xinyue Wang, Yan Aze, Jinhai Xiang",https://arxiv.org/pdf/2406.19055.pdf,"Subjects:
Computer Vision and Pattern Recognition (cs.CV)",Computer Vision and Pattern Recognition (cs.CV)
264,arXiv:2406.19054,A look under the hood of the Interactive Deep Learning Enterprise (No-IDLE),看看交互式深度学习企业的引擎盖（无IDLE）,"Daniel Sonntag, Michael Barz, Thiago Gouvêa",https://arxiv.org/pdf/2406.19054.pdf,"Subjects:
Machine Learning (cs.LG); Artificial Intelligence (cs.AI); Human-Computer Interaction (cs.HC)","Machine Learning (cs.LG),  Artificial Intelligence (cs.AI),  Human-Computer Interaction (cs.HC)"
265,arXiv:2406.19053,Staff Scheduling for Demand-Responsive Services,需求响应服务的员工时间表,"Debsankha Manik, Rico Raber",https://arxiv.org/pdf/2406.19053.pdf,"Subjects:
Discrete Mathematics (cs.DM)",Discrete Mathematics (cs.DM)
266,arXiv:2406.19050,FedMap: Iterative Magnitude-Based Pruning for Communication-Efficient Federated Learning,FedMap：用于通信高效联合学习的基于迭代幅度的修剪,"Alexander Herzog, Robbie Southam, Ioannis Mavromatis, Aftab Khan",https://arxiv.org/pdf/2406.19050.pdf,"Subjects:
Machine Learning (cs.LG); Artificial Intelligence (cs.AI)","Machine Learning (cs.LG),  Artificial Intelligence (cs.AI)"
267,arXiv:2406.19049,Accuracy on the wrong line: On the pitfalls of noisy data for out-of-distribution generalisation,错误线上的准确性：关于分布外广义化的噪声数据陷阱,"Amartya Sanyal, Yaxi Hu, Yaodong Yu, Yian Ma, Yixin Wang, Bernhard Schölkopf",https://arxiv.org/pdf/2406.19049.pdf,"Subjects:
Machine Learning (cs.LG); Artificial Intelligence (cs.AI); Machine Learning (stat.ML)","Machine Learning (cs.LG),  Artificial Intelligence (cs.AI),  Machine Learning (stat.ML)"
268,arXiv:2406.19048,BiCo-Fusion: Bidirectional Complementary LiDAR-Camera Fusion for Semantic- and Spatial-Aware 3D Object Detection,BiCo融合：用于语义和空间感知三维物体检测的双向互补激光雷达相机融合,"Yang Song, Lin Wang",https://arxiv.org/pdf/2406.19048.pdf,"Subjects:
Computer Vision and Pattern Recognition (cs.CV); Artificial Intelligence (cs.AI)","Computer Vision and Pattern Recognition (cs.CV),  Artificial Intelligence (cs.AI)"
269,arXiv:2406.19042,Towards Credential-based Device Registration in DApps for DePINs with ZKPs,在带有ZKP的DePIN的DApp中实现基于凭证的设备注册,"Jonathan Heiss, Fernando Castillo, Xinxin Fan",https://arxiv.org/pdf/2406.19042.pdf,"Subjects:
Cryptography and Security (cs.CR); Distributed, Parallel, and Cluster Computing (cs.DC)","Cryptography and Security (cs.CR),  Distributed, Parallel, and Cluster Computing (cs.DC)"
270,arXiv:2406.19040,On Convex Optimization with Semi-Sensitive Features,关于具有半敏感特征的凸优化,"Badih Ghazi, Pritish Kamath, Ravi Kumar, Pasin Manurangsi, Raghu Meka, Chiyuan Zhang",https://arxiv.org/pdf/2406.19040.pdf,"Subjects:
Machine Learning (cs.LG); Cryptography and Security (cs.CR); Data Structures and Algorithms (cs.DS)","Machine Learning (cs.LG),  Cryptography and Security (cs.CR),  Data Structures and Algorithms (cs.DS)"
271,arXiv:2406.19039,Constructing and Analyzing Different Density Graphs for Path Extrapolation in Wikipedia,维基百科路径外推的不同密度图的构建与分析,"Martha Sotiroudi, Anastasia-Sotiria Toufa, Constantine Kotropoulos",https://arxiv.org/pdf/2406.19039.pdf,"Subjects:
Databases (cs.DB)",Databases (cs.DB)
272,arXiv:2406.19035,SD-BLS: Privacy Preserving Selective Disclosure and Unlinkable Revocation of Verifiable Credentials,SD-BLS：保护隐私的可验证证书的选择性披露和不可链接撤销,"Denis Roio, Rebecca Selvaggini, Andrea D'Intino",https://arxiv.org/pdf/2406.19035.pdf,"Subjects:
Cryptography and Security (cs.CR)",Cryptography and Security (cs.CR)
273,arXiv:2406.19032,Improving Weak-to-Strong Generalization with Reliability-Aware Alignment,利用可靠性感知对齐改进弱到强泛化,"Yue Guo, Yi Yang",https://arxiv.org/pdf/2406.19032.pdf,"Subjects:
Computation and Language (cs.CL)",Computation and Language (cs.CL)
274,arXiv:2406.19030,Using diffusion model as constraint: Empower Image Restoration Network Training with Diffusion Model,以扩散模型为约束：用扩散模型实现图像恢复网络训练,"Jiangtong Tan, Feng Zhao",https://arxiv.org/pdf/2406.19030.pdf,"Subjects:
Computer Vision and Pattern Recognition (cs.CV)",Computer Vision and Pattern Recognition (cs.CV)
275,arXiv:2406.19026,Completely decomposable rank-metric codes,完全可分解秩度量码,Paolo Santonastaso,https://arxiv.org/pdf/2406.19026.pdf,"Subjects:
Information Theory (cs.IT)",Information Theory (cs.IT)
276,arXiv:2406.19025,Isogeometric Shape Optimization of Multi-Tapered Coaxial Baluns Simulated by an Integral Equation Method,用积分方程法模拟多锥同轴巴伦的等几何形状优化,"Boian Balouchev, Jürgen Dölz, Maximilian Nolte, Sebastian Schöps, Riccardo Torchio",https://arxiv.org/pdf/2406.19025.pdf,"Subjects:
Computational Engineering, Finance, and Science (cs.CE)","Computational Engineering, Finance, and Science (cs.CE)"
277,arXiv:2406.19018,Efficient course recommendations with T5-based ranking and summarization,高效的课程推荐，基于T5的排名和总结,"Thijmen Bijl, Niels van Weeren, Suzan Verberne",https://arxiv.org/pdf/2406.19018.pdf,"Subjects:
Information Retrieval (cs.IR)",Information Retrieval (cs.IR)
278,arXiv:2406.19016,Robust Multi-Robot Global Localization with Unknown Initial Pose based on Neighbor Constraints,基于邻居约束的初始姿态未知的多机器人鲁棒全局定位,"Yaojie Zhang, Haowen Luo, Weijun Wang, Wei Feng",https://arxiv.org/pdf/2406.19016.pdf,"Subjects:
Robotics (cs.RO)",Robotics (cs.RO)
279,arXiv:2406.19015,Lithium-Ion Battery System Health Monitoring and Fault Analysis from Field Data Using Gaussian Processes,基于高斯过程的现场数据锂离子电池系统健康监测与故障分析,"Joachim Schaeffer, Eric Lenz, Duncan Gulla, Martin Z. Bazant, Richard D. Braatz, Rolf Findeisen",https://arxiv.org/pdf/2406.19015.pdf,"Subjects:
Machine Learning (cs.LG); Artificial Intelligence (cs.AI); Systems and Control (eess.SY); Applications (stat.AP)","Machine Learning (cs.LG),  Artificial Intelligence (cs.AI),  Systems and Control (eess.SY),  Applications (stat.AP)"
280,arXiv:2406.19014,The Impact of Autonomous Vehicles on Ride-Hailing Platforms with Strategic Human Drivers,自动驾驶汽车对具有战略人力司机的叫车平台的影响,"Shuqin Gao, Xinyuan Wu, Antonis Dimakis, Costas Courcoubetis",https://arxiv.org/pdf/2406.19014.pdf,"Subjects:
Computer Science and Game Theory (cs.GT)",Computer Science and Game Theory (cs.GT)
281,arXiv:2406.19009,On the Energy Consumption of Rotary Wing and Fixed Wing UAVs in Flying Networks,旋转翼和固定翼无人机在飞行网络中的能耗研究,"Pedro Ribeiro, André Coelho, Rui Campos",https://arxiv.org/pdf/2406.19009.pdf,"Subjects:
Networking and Internet Architecture (cs.NI); Signal Processing (eess.SP)","Networking and Internet Architecture (cs.NI),  Signal Processing (eess.SP)"
282,arXiv:2406.19008,VertiMRF: Differentially Private Vertical Federated Data Synthesis,VertiMRF：差分私有垂直联邦数据合成,"Fangyuan Zhao, Zitao Li, Xuebin Ren, Bolin Ding, Shusen Yang, Yaliang Li",https://arxiv.org/pdf/2406.19008.pdf,"Subjects:
Data Structures and Algorithms (cs.DS)",Data Structures and Algorithms (cs.DS)
283,arXiv:2406.19007,Towards a Formal Characterization of User Simulation Objectives in Conversational Information Access,会话信息访问中用户模拟目标的形式化表征,"Nolwenn Bernard, Krisztian Balog",https://arxiv.org/pdf/2406.19007.pdf,"Subjects:
Information Retrieval (cs.IR)",Information Retrieval (cs.IR)
284,arXiv:2406.19006,VideoMambaPro: A Leap Forward for Mamba in Video Understanding,VideoMambaPro：Mamba在视频理解方面的一次飞跃,"Hui Lu, Albert Ali Salah, Ronald Poppe",https://arxiv.org/pdf/2406.19006.pdf,"Subjects:
Computer Vision and Pattern Recognition (cs.CV)",Computer Vision and Pattern Recognition (cs.CV)
285,arXiv:2406.19002,Coded Cooperative Networks for Semi-Decentralized Federated Learning,用于半去中心化联邦学习的编码合作网络,"Shudi Weng, Ming Xiao, Mikael Skoglund",https://arxiv.org/pdf/2406.19002.pdf,"Subjects:
Information Theory (cs.IT)",Information Theory (cs.IT)
286,arXiv:2406.19000,Simpson's quadrature for a nonlinear variational symplectic scheme,一类非线性变分辛格式的Simpson求积,"François Dubois (LMO, LMSSC), Juan Antonio Rojas-Quintero",https://arxiv.org/pdf/2406.19000.pdf,"Subjects:
Numerical Analysis (math.NA)",Numerical Analysis (math.NA)
287,arXiv:2406.18999,Improving Taxonomic Image-based Out-of-distribution Detection With DNA Barcodes,利用DNA条形码改进基于分类图像的分布外检测,"Mikko Impiö, Jenni Raitoharju",https://arxiv.org/pdf/2406.18999.pdf,"Subjects:
Computer Vision and Pattern Recognition (cs.CV)",Computer Vision and Pattern Recognition (cs.CV)
288,arXiv:2406.18996,Zero-shot domain adaptation based on dual-level mix and contrast,基于双层混合和对比度的零样本域自适应,"Yu Zhe, Jun Sakuma",https://arxiv.org/pdf/2406.18996.pdf,"Subjects:
Computer Vision and Pattern Recognition (cs.CV); Machine Learning (cs.LG)","Computer Vision and Pattern Recognition (cs.CV),  Machine Learning (cs.LG)"
289,arXiv:2406.18995,FedMLP: Federated Multi-Label Medical Image Classification under Task Heterogeneity,任务异构条件下的联邦多标签医学图像分类,"Zhaobin Sun (1), Nannan Wu (1), Junjie Shi (1), Li Yu (1), Xin Yang (1), Kwang-Ting Cheng (2), Zengqiang Yan (1) ((1) School of Electronic Information and Communications, Huazhong University of Science and Technology, (2) School of Engineering, Hong Kong University of Science and Technology)",https://arxiv.org/pdf/2406.18995.pdf,"Subjects:
Machine Learning (cs.LG); Artificial Intelligence (cs.AI)","Machine Learning (cs.LG),  Artificial Intelligence (cs.AI)"
290,arXiv:2406.18992,Semi-supervised Concept Bottleneck Models,半监督概念瓶颈模型,"Lijie Hu, Tianhao Huang, Huanyi Xie, Chenyang Ren, Zhengyu Hu, Lu Yu, Di Wang",https://arxiv.org/pdf/2406.18992.pdf,"Subjects:
Computer Vision and Pattern Recognition (cs.CV); Artificial Intelligence (cs.AI); Machine Learning (cs.LG)","Computer Vision and Pattern Recognition (cs.CV),  Artificial Intelligence (cs.AI),  Machine Learning (cs.LG)"
291,arXiv:2406.18990,A Fast Learning-Based Surrogate of Electrical Machines using a Reduced Basis,基于约简基的电机快速学习代理,"Alejandro Ribés, Nawfal Benchekroun, Théo Delagnes",https://arxiv.org/pdf/2406.18990.pdf,"Subjects:
Machine Learning (cs.LG)",Machine Learning (cs.LG)
292,arXiv:2406.18985,Exploiting Structured Sparsity in Near Field: From the Perspective of Decomposition,从分解的角度挖掘近场结构稀疏性,"Xufeng Guo, Yuanbin Chen, Ying Wang, Chau Yuen",https://arxiv.org/pdf/2406.18985.pdf,"Subjects:
Information Theory (cs.IT); Signal Processing (eess.SP)","Information Theory (cs.IT),  Signal Processing (eess.SP)"
293,arXiv:2406.18984,Amplify Graph Learning for Recommendation via Sparsity Completion,基于稀疏度完成的放大图学习推荐,"Peng Yuan, Haojie Li, Minying Fang, Xu Yu, Yongjing Hao, Junwei Du",https://arxiv.org/pdf/2406.18984.pdf,"Subjects:
Information Retrieval (cs.IR)",Information Retrieval (cs.IR)
294,arXiv:2406.18980,E-Mapper: Energy-Efficient Resource Allocation for Traditional Operating Systems on Heterogeneous Processors,E-Mapper：异构处理器上传统操作系统的节能资源分配,"Till Smejkal, Robert Khasanov, Jeronimo Castrillon, Hermann Härtig",https://arxiv.org/pdf/2406.18980.pdf,"Subjects:
Operating Systems (cs.OS)",Operating Systems (cs.OS)
295,arXiv:2406.18977,RoboUniView: Visual-Language Model with Unified View Representation for Robotic Manipulaiton,RoboUniView：具有统一视图表示的机器人操作可视化语言模型,"Fanfan Liu, Feng Yan, Liming Zheng, Chengjian Feng, Yiyang Huang, Lin Ma",https://arxiv.org/pdf/2406.18977.pdf,"Subjects:
Robotics (cs.RO); Computation and Language (cs.CL); Computer Vision and Pattern Recognition (cs.CV)","Robotics (cs.RO),  Computation and Language (cs.CL),  Computer Vision and Pattern Recognition (cs.CV)"
296,arXiv:2406.18967,Structural Attention: Rethinking Transformer for Unpaired Medical Image Synthesis,结构注意：对非配对医学图像合成变换器的再思考,"Vu Minh Hieu Phan, Yutong Xie, Bowen Zhang, Yuankai Qi, Zhibin Liao, Antonios Perperidis, Son Lam Phung, Johan W. Verjans, Minh-Son To",https://arxiv.org/pdf/2406.18967.pdf,"Subjects:
Computer Vision and Pattern Recognition (cs.CV)",Computer Vision and Pattern Recognition (cs.CV)
297,arXiv:2406.18966,UniGen: A Unified Framework for Textual Dataset Generation Using Large Language Models,UniGen：使用大型语言模型生成文本数据集的统一框架,"Siyuan Wu, Yue Huang, Chujie Gao, Dongping Chen, Qihui Zhang, Yao Wan, Tianyi Zhou, Xiangliang Zhang, Jianfeng Gao, Chaowei Xiao, Lichao Sun",https://arxiv.org/pdf/2406.18966.pdf,"Subjects:
Computation and Language (cs.CL)",Computation and Language (cs.CL)
298,arXiv:2406.18964,DNLSAT: A Dynamic Variable Ordering MCSAT Framework for Nonlinear Real Arithmetic,DNLSAT:一种用于非线性实数运算的动态变序MCSAT框架,Zhonghan Wang,https://arxiv.org/pdf/2406.18964.pdf,"Subjects:
Symbolic Computation (cs.SC)",Symbolic Computation (cs.SC)
299,arXiv:2406.18963,Generation of Random (Generalized) Orthogonal Matrices,随机（广义）正交矩阵的生成,Ali Saraeb,https://arxiv.org/pdf/2406.18963.pdf,"Subjects:
Numerical Analysis (math.NA); Number Theory (math.NT); Probability (math.PR)","Numerical Analysis (math.NA),  Number Theory (math.NT),  Probability (math.PR)"
300,arXiv:2406.18962,Multi-modal Food Recommendation using Clustering and Self-supervised Learning,基于聚类和自监督学习的多模式食物推荐,"Yixin Zhang, Xin Zhou, Qianwen Meng, Fanglin Zhu, Yonghui Xu, Zhiqi Shen, Lizhen Cui",https://arxiv.org/pdf/2406.18962.pdf,"Subjects:
Information Retrieval (cs.IR)",Information Retrieval (cs.IR)
301,arXiv:2406.18961,Formation Under Communication Constraints: Control Performance Meets Channel Capacity,通信约束下的编队：控制性能满足信道容量,"Yaru Chen, Yirui Cong, Xiangyun Zhou, Long Cheng, Xiangke Wang",https://arxiv.org/pdf/2406.18961.pdf,"Subjects:
Multiagent Systems (cs.MA)",Multiagent Systems (cs.MA)
302,arXiv:2406.18960,A Surprisingly Simple yet Effective Multi-Query Rewriting Method for Conversational Passage Retrieval,一种简单有效的会话短文检索多查询重写方法,"Ivica Kostric, Krisztian Balog",https://arxiv.org/pdf/2406.18960.pdf,"Subjects:
Information Retrieval (cs.IR)",Information Retrieval (cs.IR)
303,arXiv:2406.18959,How Do Users Revise Architectural Related Questions on Stack Overflow: An Empirical Study,用户如何修改堆栈溢出的体系结构相关问题：一项实证研究,"Musengamana Jean de Dieu, Peng Liang, Mojtaba Shahin, Arif Ali Khan",https://arxiv.org/pdf/2406.18959.pdf,"Subjects:
Software Engineering (cs.SE)",Software Engineering (cs.SE)
304,arXiv:2406.18958,AnyControl: Create Your Artwork with Versatile Control on Text-to-Image Generation,AnyControl：使用文本到图像生成的多功能控件创建您的艺术作品,"Yanan Sun, Yanchen Liu, Yinhao Tang, Wenjie Pei, Kai Chen",https://arxiv.org/pdf/2406.18958.pdf,"Subjects:
Computer Vision and Pattern Recognition (cs.CV)",Computer Vision and Pattern Recognition (cs.CV)
305,arXiv:2406.18957,A Treatment of EIP-1559: Enhancing Transaction Fee Mechanism through Nth-Price Auction,处理EIP-1559：通过第N次价格拍卖增强交易费用机制,"Kun Li, Guangpeng Qi, Guangyong Shang, Wanli Deng, Minghui Xu, Xiuzhen Cheng",https://arxiv.org/pdf/2406.18957.pdf,"Subjects:
Distributed, Parallel, and Cluster Computing (cs.DC); Computer Science and Game Theory (cs.GT)","Distributed, Parallel, and Cluster Computing (cs.DC),  Computer Science and Game Theory (cs.GT)"
306,arXiv:2406.18954,Alignment For Performance Improvement in Conversation Bots,对话机器人中提高性能的对齐方式,"Raghav Garg, Kapil Sharma, Shrey Singla",https://arxiv.org/pdf/2406.18954.pdf,"Subjects:
Machine Learning (cs.LG); Artificial Intelligence (cs.AI)","Machine Learning (cs.LG),  Artificial Intelligence (cs.AI)"
307,arXiv:2406.18948,Supercloseness of the HDG method on Shishkin mesh for a singularly perturbed convection diffusion problem in 2D,二维奇摄动对流扩散问题Shishkin网格上HDG方法的超封闭性,"Xiaoqi Ma, Jin Zhang",https://arxiv.org/pdf/2406.18948.pdf,"Subjects:
Numerical Analysis (math.NA)",Numerical Analysis (math.NA)
308,arXiv:2406.18945,A Road Less Travelled and Beyond: Towards a Roadmap for Integrating Sustainability into Computing Education,一条更少人走的路及更远的路：走向将可持续性融入计算机教育的路线图,"Ana Moreira, Ola Leifler, Stefanie Betz, Ian Brooks, Rafael Capilla, Vlad Constantin Coroama, Leticia Duboc, Joao Paulo Fernandes, Rogardt Heldal, Patricia Lago, Ngoc-Thanh Nguyen, Shola Oyedeji, Birgit Penzenstadler, Anne Kathrin Peters, Jari Porras, Colin C. Venters",https://arxiv.org/pdf/2406.18945.pdf,"Subjects:
Software Engineering (cs.SE)",Software Engineering (cs.SE)
309,arXiv:2406.18944,Investigating and Defending Shortcut Learning in Personalized Diffusion Models,个性化扩散模型中的快捷学习研究与防御,"Yixin Liu, Ruoxi Chen, Lichao Sun",https://arxiv.org/pdf/2406.18944.pdf,"Subjects:
Computer Vision and Pattern Recognition (cs.CV); Artificial Intelligence (cs.AI); Cryptography and Security (cs.CR)","Computer Vision and Pattern Recognition (cs.CV),  Artificial Intelligence (cs.AI),  Cryptography and Security (cs.CR)"
310,arXiv:2406.18941,CLIP3D-AD: Extending CLIP for 3D Few-Shot Anomaly Detection with Multi-View Images Generation,CLIP3D-AD：扩展CLIP用于多视图图像生成的3D少镜头异常检测,"Zuo Zuo, Jiahao Dong, Yao Wu, Yanyun Qu, Zongze Wu",https://arxiv.org/pdf/2406.18941.pdf,"Subjects:
Computer Vision and Pattern Recognition (cs.CV)",Computer Vision and Pattern Recognition (cs.CV)
311,arXiv:2406.18940,Efficient Verifiable Differential Privacy with Input Authenticity in the Local and Shuffle Model,在局部和无序模型中具有输入真实性的有效可验证差分隐私,"Tariq Bontekoe, Hassan Jameel Asghar, Fatih Turkmen",https://arxiv.org/pdf/2406.18940.pdf,"Subjects:
Cryptography and Security (cs.CR)",Cryptography and Security (cs.CR)
