Unnamed: 0,id,title,title_zh,authors,url,subjects,subject_split
995,arXiv:2407.06635,Ensembled Cold-Diffusion Restorations for Unsupervised Anomaly Detection,用于无监督异常检测的冷扩散修复集成,"Sergio Naval Marimont, Vasilis Siomos, Matthew Baugh, Christos Tzelepis, Bernhard Kainz, Giacomo Tarroni",https://arxiv.org/pdf/2407.06635.pdf,"Subjects:
Computer Vision and Pattern Recognition (cs.CV); Machine Learning (stat.ML)","Computer Vision and Pattern Recognition (cs.CV),  Machine Learning (stat.ML)"
996,arXiv:2407.06631,"A Systematic Review of Echo Chamber Research: Comparative Analysis of Conceptualizations, Operationalizations, and Varying Outcomes",回声室研究的系统综述：概念化、操作化和不同结果的比较分析,"David Hartmann, Lena Pohlmann, Sonja Mei Wang, Bettina Berendt",https://arxiv.org/pdf/2407.06631.pdf,"Subjects:
Social and Information Networks (cs.SI); Computers and Society (cs.CY); Human-Computer Interaction (cs.HC); Networking and Internet Architecture (cs.NI)","Social and Information Networks (cs.SI),  Computers and Society (cs.CY),  Human-Computer Interaction (cs.HC),  Networking and Internet Architecture (cs.NI)"
997,arXiv:2407.06630,Toychain: A Simple Blockchain for Research in Swarm Robotics,Toychain：用于群体机器人研究的简单区块链,"Alexandre Pacheco, Ulysse Denis, Raina Zakir, Volker Strobel, Andreagiovanni Reina, Marco Dorigo",https://arxiv.org/pdf/2407.06630.pdf,"Subjects:
Robotics (cs.RO)",Robotics (cs.RO)
998,arXiv:2407.06629,Collision and Obstacle Avoidance for Industrial Autonomous Vehicles -- Simulation and Experimentation Based on a Cooperative Approach,工业自动驾驶汽车的碰撞与避障——基于协同方法的仿真与实验,"Juliette Grosset (ECAM, IMT Atlantique - SRCD, IRISA), Alain-Jérôme Fougères (ECAM), M Djoko-Kouam (ECAM, IETR), C Couturier, Jean-Marie Bonnin (IMT Atlantique - SRCD, IRISA)",https://arxiv.org/pdf/2407.06629.pdf,"Subjects:
Robotics (cs.RO)",Robotics (cs.RO)
999,arXiv:2407.06628,Masked Video and Body-worn IMU Autoencoder for Egocentric Action Recognition,用于自我中心动作识别的蒙面视频和体戴式IMU自动编码器,"Mingfang Zhang, Yifei Huang, Ruicong Liu, Yoichi Sato",https://arxiv.org/pdf/2407.06628.pdf,"Subjects:
Computer Vision and Pattern Recognition (cs.CV)",Computer Vision and Pattern Recognition (cs.CV)
1000,arXiv:2407.06627,Proofs for Free in the $\lambda\Pi$-Calculus Modulo Theory,$\lambda \Pi$微积分模理论中的自由证明,"Thomas Traversié (MICS, CentraleSupélec, Université Paris-Saclay)",https://arxiv.org/pdf/2407.06627.pdf,"Subjects:
Logic in Computer Science (cs.LO)",Logic in Computer Science (cs.LO)
1001,arXiv:2407.06626,Kuroda's Translation for the $\lambda\Pi$-Calculus Modulo Theory and Dedukti,黑田东彦对$\lambda \Pi$-微积分模理论和演绎的翻译,"Thomas Traversié (MICS, CentraleSupélec, Université Paris-Saclay)",https://arxiv.org/pdf/2407.06626.pdf,"Subjects:
Logic in Computer Science (cs.LO)",Logic in Computer Science (cs.LO)
1002,arXiv:2407.06625,Binding Contexts as Partitionable Multisets in Abella,Abella中作为可分割多集的绑定上下文,"Terrance Gray (University of Minnesota), Gopalan Nadathur (University of Minnesota)",https://arxiv.org/pdf/2407.06625.pdf,"Subjects:
Logic in Computer Science (cs.LO)",Logic in Computer Science (cs.LO)
1003,arXiv:2407.06624,A Beluga Formalization of the Harmony Lemma in the $\pi$-Calculus,微积分中调和引理的Beluga形式化,"Gabriele Cecilia (Università degli Studi di Milano), Alberto Momigliano (Università degli Studi di Milano)",https://arxiv.org/pdf/2407.06624.pdf,"Subjects:
Logic in Computer Science (cs.LO)",Logic in Computer Science (cs.LO)
1004,arXiv:2407.06623,SKYCASTLE: Taming LEO Mobility to Facilitate Seamless and Low-latency Satellite Internet Services,天空城堡：驯服低地球轨道移动性，促进无缝和低延迟的卫星互联网服务,"Jihao Li, Hewu Li, Zeqi Lai, Qian Wu, Weisen Liu, Xiaomo Wang, Yuanjie Li, Jun Liu, Qi Zhang",https://arxiv.org/pdf/2407.06623.pdf,"Subjects:
Networking and Internet Architecture (cs.NI)",Networking and Internet Architecture (cs.NI)
1005,arXiv:2407.06622,Reasoning about unpredicted change and explicit time,关于不可预测的变化和明确时间的推理,"Florence Dupin de Saint-Cyr (IRIT-ADRIA), Jérôme Lang (LAMSADE)",https://arxiv.org/pdf/2407.06622.pdf,"Subjects:
Artificial Intelligence (cs.AI)",Artificial Intelligence (cs.AI)
1006,arXiv:2407.06617,Mobius: An High Efficient Spatial-Temporal Parallel Training Paradigm for Text-to-Video Generation Task,Mobius：一种用于文本到视频生成任务的高效时空并行训练范式,"Yiran Yang, Jinchao Zhang, Ying Deng, Jie Zhou",https://arxiv.org/pdf/2407.06617.pdf,"Subjects:
Computer Vision and Pattern Recognition (cs.CV)",Computer Vision and Pattern Recognition (cs.CV)
1007,arXiv:2407.06613,Sparse-DeRF: Deblurred Neural Radiance Fields from Sparse View,稀疏去RF：从稀疏视角去模糊神经辐射场,"Dogyoon Lee, Donghyeong Kim, Jungho Lee, Minhyeok Lee, Seunghoon Lee, Sangyoun Lee",https://arxiv.org/pdf/2407.06613.pdf,"Subjects:
Computer Vision and Pattern Recognition (cs.CV)",Computer Vision and Pattern Recognition (cs.CV)
1008,arXiv:2407.06611,CEIA: CLIP-Based Event-Image Alignment for Open-World Event-Based Understanding,CEIA：基于CLIP的事件图像对齐，用于开放世界基于事件的理解,"Wenhao Xu, Wenming Weng, Yueyi Zhang, Zhiwei Xiong",https://arxiv.org/pdf/2407.06611.pdf,"Subjects:
Computer Vision and Pattern Recognition (cs.CV); Artificial Intelligence (cs.AI)","Computer Vision and Pattern Recognition (cs.CV),  Artificial Intelligence (cs.AI)"
1009,arXiv:2407.06606,Tailored Design of Audio-Visual Speech Recognition Models using Branchformers,基于分支形成器的视听语音识别模型的定制设计,"David Gimeno-Gómez, Carlos-D. Martínez-Hinarejos",https://arxiv.org/pdf/2407.06606.pdf,"Subjects:
Computer Vision and Pattern Recognition (cs.CV); Computation and Language (cs.CL)","Computer Vision and Pattern Recognition (cs.CV),  Computation and Language (cs.CL)"
1010,arXiv:2407.06605,Robust Meta-Learning of Vehicle Yaw Rate Dynamics via Conditional Neural Processes,基于条件神经过程的车辆横摆率动力学鲁棒元学习,"Lars Ullrich, Andreas Völz, Knut Graichen",https://arxiv.org/pdf/2407.06605.pdf,"Subjects:
Robotics (cs.RO)",Robotics (cs.RO)
1011,arXiv:2407.06604,A Matter of Mindset? Features and Processes of Newsroom-based Corporate Communication in Times of Artificial Intelligence,心态问题？人工智能时代基于新闻编辑室的企业传播特征与过程,"Tobias Rohrbach, Mykola Makhortykh",https://arxiv.org/pdf/2407.06604.pdf,"Subjects:
Computers and Society (cs.CY)",Computers and Society (cs.CY)
1012,arXiv:2407.06600,Integrating Clinical Knowledge into Concept Bottleneck Models,将临床知识整合到概念瓶颈模型中,"Winnie Pang, Xueyi Ke, Satoshi Tsutsui, Bihan Wen",https://arxiv.org/pdf/2407.06600.pdf,"Subjects:
Computer Vision and Pattern Recognition (cs.CV)",Computer Vision and Pattern Recognition (cs.CV)
1013,arXiv:2407.06597,TVR-Ranking: A Dataset for Ranked Video Moment Retrieval with Imprecise Queries,TVR排名：一种用于不精确查询的排名视频时刻检索的数据集,"Renjie Liang, Li Li, Chongzhi Zhang, Jing Wang, Xizhou Zhu, Aixin Sun",https://arxiv.org/pdf/2407.06597.pdf,"Subjects:
Artificial Intelligence (cs.AI)",Artificial Intelligence (cs.AI)
1014,arXiv:2407.06591,Rate-Loss Regions for Polynomial Regression with Side Information,带有边信息的多项式回归的速率损失区域,"Jiahui Wei (INSA Rennes, UR, IMT Atlantique, IETR, Lab-STICC\_CODES), Philippe Mary (INSA Rennes, UR, IETR), Elsa Dupraz (IMT Atlantique, Lab-STICC\_CODES)",https://arxiv.org/pdf/2407.06591.pdf,"Subjects:
Information Theory (cs.IT)",Information Theory (cs.IT)
1015,arXiv:2407.06590,Revolutionizing Battery Disassembly: The Design and Implementation of a Battery Disassembly Autonomous Mobile Manipulator Robot(BEAM-1),电池拆卸革命：电池拆卸自主移动机械手机器人（BEAM-1）的设计与实现,"Yanlong Peng, Zhigang Wang, Yisheng Zhang, Shengmin Zhang, Nan Cai, Fan Wu, Ming Chen",https://arxiv.org/pdf/2407.06590.pdf,"Subjects:
Robotics (cs.RO); Artificial Intelligence (cs.AI)","Robotics (cs.RO),  Artificial Intelligence (cs.AI)"
1016,arXiv:2407.06585,D-MASTER: Mask Annealed Transformer for Unsupervised Domain Adaptation in Breast Cancer Detection from Mammograms,D-MASTER：用于乳腺癌症乳腺钼靶检测的无监督区域适应的掩模退火变压器,"Tajamul Ashraf, Krithika Rangarajan, Mohit Gambhir, Richa Gabha, Chetan Arora",https://arxiv.org/pdf/2407.06585.pdf,"Subjects:
Computer Vision and Pattern Recognition (cs.CV)",Computer Vision and Pattern Recognition (cs.CV)
1017,arXiv:2407.06584,HiLMa-Res: A General Hierarchical Framework via Residual RL for Combining Quadrupedal Locomotion and Manipulation,HiLMa-Res：通过残差RL组合四足运动和操纵的通用层次框架,"Xiaoyu Huang, Qiayuan Liao, Yiming Ni, Zhongyu Li, Laura Smith, Sergey Levine, Xue Bin Peng, Koushil Sreenath",https://arxiv.org/pdf/2407.06584.pdf,"Subjects:
Robotics (cs.RO)",Robotics (cs.RO)
1018,arXiv:2407.06581,Vision language models are blind,视觉语言模型是盲目的,"Pooyan Rahmanzadehgervi, Logan Bolton, Mohammad Reza Taesiri, Anh Totti Nguyen",https://arxiv.org/pdf/2407.06581.pdf,"Subjects:
Artificial Intelligence (cs.AI); Computer Vision and Pattern Recognition (cs.CV)","Artificial Intelligence (cs.AI),  Computer Vision and Pattern Recognition (cs.CV)"
1019,arXiv:2407.06579,NoisyAG-News: A Benchmark for Addressing Instance-Dependent Noise in Text Classification,NoisyAG新闻：解决文本分类中实例相关噪声的基准,"Hongfei Huang, Tingting Liang, Xixi Sun, Zikang Jin, Yuyu Yin",https://arxiv.org/pdf/2407.06579.pdf,"Subjects:
Computation and Language (cs.CL)",Computation and Language (cs.CL)
1020,arXiv:2407.06576,Virtual Personas for Language Models via an Anthology of Backstories,从《背景故事选集》看语言模型的虚拟人物,"Suhong Moon, Marwa Abdulhai, Minwoo Kang, Joseph Suh, Widyadewi Soedarmadji, Eran Kohen Behar, David M. Chan",https://arxiv.org/pdf/2407.06576.pdf,"Subjects:
Computation and Language (cs.CL); Artificial Intelligence (cs.AI)","Computation and Language (cs.CL),  Artificial Intelligence (cs.AI)"
1021,arXiv:2407.06573,LLM for Mobile: An Initial Roadmap,移动LLM：初步路线图,"Daihang Chen, Yonghui Liu, Mingyi Zhou, Yanjie Zhao, Haoyu Wang, Shuai Wang, Xiao Chen, Tegawendé F. Bissyandé, Jacques Klein, Li Li",https://arxiv.org/pdf/2407.06573.pdf,"Subjects:
Software Engineering (cs.SE)",Software Engineering (cs.SE)
1022,arXiv:2407.06570,Attack GAN (AGAN ): A new Security Evaluation Tool for Perceptual Encryption,攻击GAN（AGAN）：一种新的感知加密安全评估工具,"Umesh Kashyap, Sudev Kumar Padhi, Sk. Subidh Ali",https://arxiv.org/pdf/2407.06570.pdf,"Subjects:
Computer Vision and Pattern Recognition (cs.CV)",Computer Vision and Pattern Recognition (cs.CV)
1023,arXiv:2407.06567,FinCon: A Synthesized LLM Multi-Agent System with Conceptual Verbal Reinforcement for Enhanced Financial Decision Making,FinCon：一个具有概念语言强化的综合LLM多代理系统，用于增强财务决策,"Yangyang Yu, Zhiyuan Yao, Haohang Li, Zhiyang Deng, Yupeng Cao, Zhi Chen, Jordan W. Suchow, Rong Liu, Zhenyu Cui, Denghui Zhang, Koduvayur Subbalakshmi, Guojun Xiong, Yueru He, Jimin Huang, Dong Li, Qianqian Xie",https://arxiv.org/pdf/2407.06567.pdf,"Subjects:
Computation and Language (cs.CL)",Computation and Language (cs.CL)
1024,arXiv:2407.06566,Robust and Explainable Framework to Address Data Scarcity in Diagnostic Imaging,强健且可解释的框架，用于解决诊断成像中的数据短缺问题,"Zehui Zhao, Laith Alzubaidi, Jinglan Zhang, Ye Duan, Usman Naseem, Yuantong Gu",https://arxiv.org/pdf/2407.06566.pdf,"Subjects:
Computer Vision and Pattern Recognition (cs.CV)",Computer Vision and Pattern Recognition (cs.CV)
1025,arXiv:2407.06564,Combining Knowledge Graphs and Large Language Models,知识图与大型语言模型的结合,"Amanda Kau, Xuzeng He, Aishwarya Nambissan, Aland Astudillo, Hui Yin, Amir Aryani",https://arxiv.org/pdf/2407.06564.pdf,"Subjects:
Computation and Language (cs.CL); Artificial Intelligence (cs.AI)","Computation and Language (cs.CL),  Artificial Intelligence (cs.AI)"
1026,arXiv:2407.06558,Sampling-Based Attack for Centrality Disruption in Complex Networks,基于采样的复杂网络中心性破坏攻击,"Fariba Afrin Irany, Soumya Sarakar, Animesh Mukherjee, Sanjukta Bhowmick",https://arxiv.org/pdf/2407.06558.pdf,"Subjects:
Social and Information Networks (cs.SI)",Social and Information Networks (cs.SI)
1027,arXiv:2407.06552,DLOVE: A new Security Evaluation Tool for Deep Learning Based Watermarking Techniques,DLOVE：一种新的基于深度学习的水印技术安全评估工具,"Sudev Kumar Padhi, Sk. Subidh Ali",https://arxiv.org/pdf/2407.06552.pdf,"Subjects:
Cryptography and Security (cs.CR); Computer Vision and Pattern Recognition (cs.CV)","Cryptography and Security (cs.CR),  Computer Vision and Pattern Recognition (cs.CV)"
1028,arXiv:2407.06551,OffsetBias: Leveraging Debiased Data for Tuning Evaluators,偏移偏差：利用去偏置数据调整评估器,"Junsoo Park, Seungyeon Jwa, Meiying Ren, Daeyoung Kim, Sanghyuk Choi",https://arxiv.org/pdf/2407.06551.pdf,"Subjects:
Computation and Language (cs.CL)",Computation and Language (cs.CL)
1029,arXiv:2407.06549,AutoTask: Task Aware Multi-Faceted Single Model for Multi-Task Ads Relevance,AutoTask：多任务广告相关性的任务感知多面单模型,"Shouchang Guo, Sonam Damani, Keng-hao Chang",https://arxiv.org/pdf/2407.06549.pdf,"Subjects:
Information Retrieval (cs.IR); Artificial Intelligence (cs.AI); Computation and Language (cs.CL); Machine Learning (cs.LG)","Information Retrieval (cs.IR),  Artificial Intelligence (cs.AI),  Computation and Language (cs.CL),  Machine Learning (cs.LG)"
1030,arXiv:2407.06547,Deciphering Assamese Vowel Harmony with Featural InfoWaveGAN,用特征InfoWaveGAN破译阿萨姆语元音和谐,"Sneha Ray Barman, Shakuntala Mahanta, Neeraj Kumar Sharma",https://arxiv.org/pdf/2407.06547.pdf,"Subjects:
Computation and Language (cs.CL)",Computation and Language (cs.CL)
1031,arXiv:2407.06546,Exploring the Causality of End-to-End Autonomous Driving,探究端到端自动驾驶的因果关系,"Jiankun Li, Hao Li, Jiangjiang Liu, Zhikang Zou, Xiaoqing Ye, Fan Wang, Jizhou Huang, Hua Wu, Haifeng Wang",https://arxiv.org/pdf/2407.06546.pdf,"Subjects:
Computer Vision and Pattern Recognition (cs.CV); Robotics (cs.RO)","Computer Vision and Pattern Recognition (cs.CV),  Robotics (cs.RO)"
1032,arXiv:2407.06545,Visual-Geometry GP-based Navigable Space for Autonomous Navigation,基于视觉几何GP的自主导航导航空间,"Mahmoud Ali, Durgkant Pushp, Zheng Chen, Lantao Liu",https://arxiv.org/pdf/2407.06545.pdf,"Subjects:
Robotics (cs.RO)",Robotics (cs.RO)
1033,arXiv:2407.06544,Multiple Instance Verification,多实例验证,"Xin Xu, Eibe Frank, Geoffrey Holmes",https://arxiv.org/pdf/2407.06544.pdf,"Subjects:
Machine Learning (cs.LG)",Machine Learning (cs.LG)
1034,arXiv:2407.06543,DriftGAN: Using historical data for Unsupervised Recurring Drift Detection,DriftGAN：使用历史数据进行无监督重复漂移检测,"Christofer Fellicious, Sahib Julka, Lorenz Wendlinger, Michael Granitzer",https://arxiv.org/pdf/2407.06543.pdf,"Subjects:
Machine Learning (cs.LG)",Machine Learning (cs.LG)
1035,arXiv:2407.06542,LIONs: An Empirically Optimized Approach to Align Language Models,LIONs：一种基于经验优化的语言模型对齐方法,"Xiao Yu, Qingyang Wu, Yu Li, Zhou Yu",https://arxiv.org/pdf/2407.06542.pdf,"Subjects:
Computation and Language (cs.CL)",Computation and Language (cs.CL)
1036,arXiv:2407.06541,Fast Distributed Optimization over Directed Graphs under Malicious Attacks using Trust,恶意攻击下基于信任的有向图快速分布式优化,"Arif Kerem Dayı, Orhan Eren Akgün, Stephanie Gil, Michal Yemini, Angelia Nedić",https://arxiv.org/pdf/2407.06541.pdf,"Subjects:
Systems and Control (eess.SY); Multiagent Systems (cs.MA); Robotics (cs.RO); Optimization and Control (math.OC)","Systems and Control (eess.SY),  Multiagent Systems (cs.MA),  Robotics (cs.RO),  Optimization and Control (math.OC)"
1037,arXiv:2407.06540,General and Task-Oriented Video Segmentation,通用和面向任务的视频分割,"Mu Chen, Liulei Li, Wenguan Wang, Ruijie Quan, Yi Yang",https://arxiv.org/pdf/2407.06540.pdf,"Subjects:
Computer Vision and Pattern Recognition (cs.CV); Artificial Intelligence (cs.AI)","Computer Vision and Pattern Recognition (cs.CV),  Artificial Intelligence (cs.AI)"
1038,arXiv:2407.06538,Enhancing Low-Resource NMT with a Multilingual Encoder and Knowledge Distillation: A Case Study,使用多语言编码器和知识蒸馏增强低资源NMT：案例研究,"Aniruddha Roy, Pretam Ray, Ayush Maheshwari, Sudeshna Sarkar, Pawan Goyal",https://arxiv.org/pdf/2407.06538.pdf,"Subjects:
Computation and Language (cs.CL)",Computation and Language (cs.CL)
1039,arXiv:2407.06537,Efficient and Accurate Memorable Conversation Model using DPO based on sLLM,基于sLLM的DPO高效准确的可记忆对话模型,"Youngkyung Seo, Yoonseok Heo, Jun-Seok Koh, Du-Seoung Chang",https://arxiv.org/pdf/2407.06537.pdf,"Subjects:
Computation and Language (cs.CL); Artificial Intelligence (cs.AI)","Computation and Language (cs.CL),  Artificial Intelligence (cs.AI)"
1040,arXiv:2407.06536,A Two-stage Evolutionary Framework For Multi-objective Optimization,多目标优化的两阶段进化框架,"Peng Chen, Jing Liang, Kangjia Qiao, Ponnuthurai Nagaratnam Suganthan, Xuanxuan Ban",https://arxiv.org/pdf/2407.06536.pdf,"Subjects:
Neural and Evolutionary Computing (cs.NE)",Neural and Evolutionary Computing (cs.NE)
1041,arXiv:2407.06533,LETS-C: Leveraging Language Embedding for Time Series Classification,LETS-C：利用语言嵌入进行时间序列分类,"Rachneet Kaur, Zhen Zeng, Tucker Balch, Manuela Veloso",https://arxiv.org/pdf/2407.06533.pdf,"Subjects:
Machine Learning (cs.LG); Artificial Intelligence (cs.AI); Computational Engineering, Finance, and Science (cs.CE); Computation and Language (cs.CL); Methodology (stat.ME)","Machine Learning (cs.LG),  Artificial Intelligence (cs.AI),  Computational Engineering, Finance, and Science (cs.CE),  Computation and Language (cs.CL),  Methodology (stat.ME)"
1042,arXiv:2407.06531,Decomposition Betters Tracking Everything Everywhere,分解可以更好地跟踪任何地方的一切,"Rui Li, Dong Liu",https://arxiv.org/pdf/2407.06531.pdf,"Subjects:
Computer Vision and Pattern Recognition (cs.CV)",Computer Vision and Pattern Recognition (cs.CV)
1043,arXiv:2407.06529,Advanced Financial Fraud Detection Using GNN-CL Model,基于GNN-CL模型的高级金融欺诈检测,"Yu Cheng, Junjie Guo, Shiqing Long, You Wu, Mengfang Sun, Rong Zhang",https://arxiv.org/pdf/2407.06529.pdf,"Subjects:
Machine Learning (cs.LG); Statistical Finance (q-fin.ST)","Machine Learning (cs.LG),  Statistical Finance (q-fin.ST)"
1044,arXiv:2407.06524,Improving Speech Enhancement by Integrating Inter-Channel and Band Features with Dual-branch Conformer,通过双分支融合器集成信道间和频带特征来提高语音增强,"Jizhen Li, Xinmeng Xu, Weiping Tu, Yuhong Yang, Rong Zhu",https://arxiv.org/pdf/2407.06524.pdf,"Subjects:
Sound (cs.SD); Multimedia (cs.MM); Audio and Speech Processing (eess.AS)","Sound (cs.SD),  Multimedia (cs.MM),  Audio and Speech Processing (eess.AS)"
1045,arXiv:2407.06521,Beamforming Design for Joint Target Sensing and Proactive Eavesdropping,联合目标感知和主动窃听的波束形成设计,"Qian Dan, Hongjiang Lei, Ki-Hong Park, Gaofeng Pan, Mohamed-Slim Alouini",https://arxiv.org/pdf/2407.06521.pdf,"Subjects:
Information Theory (cs.IT); Signal Processing (eess.SP)","Information Theory (cs.IT),  Signal Processing (eess.SP)"
1046,arXiv:2407.06518,Graph Neural Networks and Deep Reinforcement Learning Based Resource Allocation for V2X Communications,基于图神经网络和深度强化学习的V2X通信资源分配,"Maoxin Ji, Qiong Wu, Pingyi Fan, Nan Cheng, Wen Chen, Jiangzhou Wang, Khaled B. Letaief",https://arxiv.org/pdf/2407.06518.pdf,"Subjects:
Machine Learning (cs.LG); Networking and Internet Architecture (cs.NI)","Machine Learning (cs.LG),  Networking and Internet Architecture (cs.NI)"
1047,arXiv:2407.06516,VQA-Diff: Exploiting VQA and Diffusion for Zero-Shot Image-to-3D Vehicle Asset Generation in Autonomous Driving,VQA-Diff:利用VQA和扩散生成自动驾驶中的零样本图像到3D车辆资产,"Yibo Liu, Zheyuan Yang, Guile Wu, Yuan Ren, Kejian Lin, Bingbing Liu, Yang Liu, Jinjun Shan",https://arxiv.org/pdf/2407.06516.pdf,"Subjects:
Computer Vision and Pattern Recognition (cs.CV)",Computer Vision and Pattern Recognition (cs.CV)
1048,arXiv:2407.06513,Computer vision tasks for intelligent aerospace missions: An overview,智能航空航天任务的计算机视觉任务：概述,"Huilin Chen, Qiyu Sun, Fangfei Li, Yang Tang",https://arxiv.org/pdf/2407.06513.pdf,"Subjects:
Computer Vision and Pattern Recognition (cs.CV)",Computer Vision and Pattern Recognition (cs.CV)
1049,arXiv:2407.06512,"LuSNAR:A Lunar Segmentation, Navigation and Reconstruction Dataset based on Muti-sensor for Autonomous Exploration",LuSNAR：基于多传感器的自主探测月球分割、导航和重建数据集,"Jiayi Liu, Qianyu Zhang, Xue Wan, Shengyang Zhang, Yaolin Tian, Haodong Han, Yutao Zhao, Baichuan Liu, Zeyuan Zhao, Xubo Luo",https://arxiv.org/pdf/2407.06512.pdf,"Subjects:
Computer Vision and Pattern Recognition (cs.CV); Artificial Intelligence (cs.AI)","Computer Vision and Pattern Recognition (cs.CV),  Artificial Intelligence (cs.AI)"
1050,arXiv:2407.06509,Toward Verified Library-Level Choreographic Programming with Algebraic Effects,具有代数效应的可验证库级编排程序设计,"Gan Shen, Lindsey Kuper",https://arxiv.org/pdf/2407.06509.pdf,"Subjects:
Programming Languages (cs.PL)",Programming Languages (cs.PL)
1051,arXiv:2407.06507,Economic span selection of bridge based on deep reinforcement learning,基于深度加固学习的桥梁经济跨度选择,"Leye Zhang, Xiangxiang Tian, Chengli Zhang, Hongjun Zhang",https://arxiv.org/pdf/2407.06507.pdf,"Subjects:
Machine Learning (cs.LG); Artificial Intelligence (cs.AI)","Machine Learning (cs.LG),  Artificial Intelligence (cs.AI)"
1052,arXiv:2407.06506,Information Seeking and Communication among International Students on Reddit,Reddit上国际学生的信息寻求与交流,"Chaeeun Han, Sangpil Youm, Sou Hyun Jang",https://arxiv.org/pdf/2407.06506.pdf,"Subjects:
Computers and Society (cs.CY)",Computers and Society (cs.CY)
1053,arXiv:2407.06505,"Not all explicit cues help communicate: Pedestrians' perceptions, fixations, and decisions toward automated vehicles with varied appearance",并非所有明确的线索都有助于沟通：行人对外观各异的自动驾驶汽车的感知、注视和决定,"Wei Lyu, Yaqin Cao, Yi Ding, Jingyu Li, Kai Tian, Hui Zhang",https://arxiv.org/pdf/2407.06505.pdf,"Subjects:
Human-Computer Interaction (cs.HC)",Human-Computer Interaction (cs.HC)
1054,arXiv:2407.06504,Reprogramming Distillation for Medical Foundation Models,医学基础模型的重编程蒸馏,"Yuhang Zhou, Siyuan Du, Haolin Li, Jiangchao Yao, Ya Zhang, Yanfeng Wang",https://arxiv.org/pdf/2407.06504.pdf,"Subjects:
Computer Vision and Pattern Recognition (cs.CV)",Computer Vision and Pattern Recognition (cs.CV)
1055,arXiv:2407.06503,Preference-Guided Reinforcement Learning for Efficient Exploration,偏好导向强化学习促进高效探索,"Guojian Wang, Faguo Wu, Xiao Zhang, Tianyuan Chen, Xuyang Chen, Lin Zhao",https://arxiv.org/pdf/2407.06503.pdf,"Subjects:
Machine Learning (cs.LG)",Machine Learning (cs.LG)
1056,arXiv:2407.06501,STORYSUMM: Evaluating Faithfulness in Story Summarization,STORYSUMM：评估故事摘要的可信度,"Melanie Subbiah, Faisal Ladhak, Akankshya Mishra, Griffin Adams, Lydia B. Chilton, Kathleen McKeown",https://arxiv.org/pdf/2407.06501.pdf,"Subjects:
Artificial Intelligence (cs.AI); Computation and Language (cs.CL)","Artificial Intelligence (cs.AI),  Computation and Language (cs.CL)"
1057,arXiv:2407.06500,Insect-Scale Tailless Robot with Flapping Wings: A Simple Structure and Drive for Yaw Control,扑翼昆虫无尾机器人：一种简单的偏航控制结构和驱动,"Tomohiko Jimbo, Takashi Ozaki, Norikazu Ohta, Kanae Hamaguchi",https://arxiv.org/pdf/2407.06500.pdf,"Subjects:
Robotics (cs.RO)",Robotics (cs.RO)
1058,arXiv:2407.06499,Learning a Distributed Hierarchical Locomotion Controller for Embodied Cooperation,学习分布式分层运动控制器实现具体协作,"Chuye Hong, Kangyao Huang, Huaping Liu",https://arxiv.org/pdf/2407.06499.pdf,"Subjects:
Robotics (cs.RO)",Robotics (cs.RO)
1059,arXiv:2407.06498,Enhancing spatial auditory attention decoding with neuroscience-inspired prototype training,利用神经科学启发的原型训练增强空间听觉注意力解码,"Zelin Qiu, Jianjun Gu, Dingding Yao, Junfeng Li",https://arxiv.org/pdf/2407.06498.pdf,"Subjects:
Human-Computer Interaction (cs.HC)",Human-Computer Interaction (cs.HC)
1060,arXiv:2407.06496,It's Our Loss: No Privacy Amplification for Hidden State DP-SGD With Non-Convex Loss,这是我们的损失：非凸损失的隐藏状态DP-SGD没有隐私放大,Meenatchi Sundaram Muthu Selva Annamalai,https://arxiv.org/pdf/2407.06496.pdf,"Subjects:
Machine Learning (cs.LG); Cryptography and Security (cs.CR)","Machine Learning (cs.LG),  Cryptography and Security (cs.CR)"
