id,title,title_zh,authors,url,subjects,subject_split
arXiv:2512.09111,Semantic Trajectory Generation for Goal-Oriented Spacecraft Rendezvous,目标导向航天器交会对接的语义轨迹生成,"Yuji Takubo, Arpit Dwivedi, Sukeerth Ramkumar, Luis A. Pabon, Daniele Gammelli, Marco Pavone, Simone D'Amico",https://arxiv.org/pdf/2512.09111,"Subjects:
Robotics (cs.RO); Artificial Intelligence (cs.AI); Optimization and Control (math.OC)","Robotics (cs.RO),  Artificial Intelligence (cs.AI),  Optimization and Control (math.OC)"
arXiv:2512.09108,Evolving Excellence: Automated Optimization of LLM-based Agents,进化卓越：基于LLM代理的自动化优化,"Paul Brookes, Vardan Voskanyan, Rafail Giavrimis, Matthew Truscott, Mina Ilieva, Chrystalla Pavlou, Alexandru Staicu, Manal Adham, Will Evers- Hood, Jingzhi Gong, Kejia Zhang, Matvey Fedoseev, Vishal Sharma, Roman Bauer, Zheng Wang, Hema Nair, Wei Jie, Tianhua Xu, Aurora Constantin, Leslie Kanthan, Michail Basios",https://arxiv.org/pdf/2512.09108,"Subjects:
Software Engineering (cs.SE); Artificial Intelligence (cs.AI)","Software Engineering (cs.SE),  Artificial Intelligence (cs.AI)"
arXiv:2512.09106,Learning Unmasking Policies for Diffusion Language Models,扩散语言模型的去掩码策略学习,"Metod Jazbec, Theo X. Olausson, Louis Béthune, Pierre Ablin, Michael Kirchhof, João Monteiro, Victor Turrisi, Jason Ramapuram, Marco Cuturi",https://arxiv.org/pdf/2512.09106,"Subjects:
Machine Learning (cs.LG)",Machine Learning (cs.LG)
arXiv:2512.09105,"Cognitive Trust in HRI: ""Pay Attention to Me and I'll Trust You Even if You are Wrong""","人机交互中的认知信任：""关注我，即使你错了我也会信任你""","Adi Manor, Dan Cohen, Ziv Keidar, Avi Parush, Hadas Erel",https://arxiv.org/pdf/2512.09105,"Subjects:
Robotics (cs.RO); Human-Computer Interaction (cs.HC)","Robotics (cs.RO),  Human-Computer Interaction (cs.HC)"
arXiv:2512.09104,SURA: Secure Unsourced Random Access,SURA：安全无源随机接入,"Mohammad Javad Ahmadi, Rafael F. Schaefer, H. Vincent Poor",https://arxiv.org/pdf/2512.09104,"Subjects:
Information Theory (cs.IT)",Information Theory (cs.IT)
arXiv:2512.09103,Natural Geometry of Robust Data Attribution: From Convex Models to Deep Networks,鲁棒数据归属的自然几何：从凸模型到深度网络,"Shihao Li, Jiachen Li, Dongmei Chen",https://arxiv.org/pdf/2512.09103,"Subjects:
Machine Learning (cs.LG); Optimization and Control (math.OC)","Machine Learning (cs.LG),  Optimization and Control (math.OC)"
arXiv:2512.09101,Masked Generative Policy for Robotic Control,机器人控制的掩码生成策略,"Lipeng Zhuang, Shiyu Fan, Florent P. Audonnet, Yingdong Ru, Gerardo Aragon Camarasa, Paul Henderson",https://arxiv.org/pdf/2512.09101,"Subjects:
Robotics (cs.RO); Artificial Intelligence (cs.AI)","Robotics (cs.RO),  Artificial Intelligence (cs.AI)"
arXiv:2512.09097,Characterizing Human Feedback-Based Control in Naturalistic Driving Interactions via Gaussian Process Regression with Linear Feedback,基于高斯过程回归与线性反馈的自然驾驶交互中人类反馈控制特征分析,"Rachel DiPirro, Rosalyn Devonport, Dan Calderone, Chishang ""Mario'' Yang, Wendy Ju, Meeko Oishi",https://arxiv.org/pdf/2512.09097,"Subjects:
Systems and Control (eess.SY); Robotics (cs.RO)","Systems and Control (eess.SY),  Robotics (cs.RO)"
arXiv:2512.09095,Food Image Generation on Multi-Noun Categories,多名词类别的食物图像生成,"Xinyue Pan, Yuhao Chen, Jiangpeng He, Fengqing Zhu",https://arxiv.org/pdf/2512.09095,"Subjects:
Computer Vision and Pattern Recognition (cs.CV)",Computer Vision and Pattern Recognition (cs.CV)
arXiv:2512.09092,Explaining the Unseen: Multimodal Vision-Language Reasoning for Situational Awareness in Underground Mining Disasters,解释不可见：地下采矿灾害情境感知的多模态视觉-语言推理,"Mizanur Rahman Jewel, Mohamed Elmahallawy, Sanjay Madria, Samuel Frimpong",https://arxiv.org/pdf/2512.09092,"Subjects:
Computer Vision and Pattern Recognition (cs.CV)",Computer Vision and Pattern Recognition (cs.CV)
arXiv:2512.09090,A Taxonomy of Numerical Differentiation Methods,数值微分方法分类法,"Pavel Komarov, Floris van Breugel, J. Nathan Kutz",https://arxiv.org/pdf/2512.09090,"Subjects:
Numerical Analysis (math.NA); Computational Engineering, Finance, and Science (cs.CE)","Numerical Analysis (math.NA),  Computational Engineering, Finance, and Science (cs.CE)"
arXiv:2512.09088,Calibrated Trust in Dealing with LLM Hallucinations: A Qualitative Study,应对LLM幻觉的校准信任：质性研究,"Adrian Ryser, Florian Allwein, Tim Schlippe",https://arxiv.org/pdf/2512.09088,"Subjects:
Artificial Intelligence (cs.AI)",Artificial Intelligence (cs.AI)
arXiv:2512.09087,A posteriori error estimates for mixed-dimensional Darcy flow using non-matching grids,混合维度达西流动的后验误差估计：非匹配网格方法,"Jhabriel Varela, Christian E. Schaerer, Eirik Keilegavlen, Inga Berre",https://arxiv.org/pdf/2512.09087,"Subjects:
Numerical Analysis (math.NA)",Numerical Analysis (math.NA)
arXiv:2512.09086,Inferring Operator Emotions from a Motion-Controlled Robotic Arm,从运动控制机械臂推断操作者情绪,"Xinyu Qi, Zeyu Deng, Shaun Alexander Macdonald, Liying Li, Chen Wang, Muhammad Ali Imran, Philip G. Zhao",https://arxiv.org/pdf/2512.09086,"Subjects:
Robotics (cs.RO); Human-Computer Interaction (cs.HC)","Robotics (cs.RO),  Human-Computer Interaction (cs.HC)"
arXiv:2512.09085,Mental Models of Autonomy and Sentience Shape Reactions to AI,自主性与感知心智模型如何塑造人们对AI的反应,"Janet V.T. Pauketat, Daniel B. Shank, Aikaterina Manoli, Jacy Reese Anthis",https://arxiv.org/pdf/2512.09085,"Subjects:
Human-Computer Interaction (cs.HC); Artificial Intelligence (cs.AI); Computers and Society (cs.CY)","Human-Computer Interaction (cs.HC),  Artificial Intelligence (cs.AI),  Computers and Society (cs.CY)"
arXiv:2512.09084,GS-KAN: Parameter-Efficient Kolmogorov-Arnold Networks via Sprecher-Type Shared Basis Functions,GS-KAN：基于Sprecher型共享基函数的参数高效Kolmogorov-Arnold网络,Oscar Eliasson,https://arxiv.org/pdf/2512.09084,"Subjects:
Machine Learning (cs.LG)",Machine Learning (cs.LG)
arXiv:2512.09081,AgentComp: From Agentic Reasoning to Compositional Mastery in Text-to-Image Models,AgentComp：从代理推理到文本到图像模型的组合式掌握,"Arman Zarei, Jiacheng Pan, Matthew Gwilliam, Soheil Feizi, Zhenheng Yang",https://arxiv.org/pdf/2512.09081,"Subjects:
Computer Vision and Pattern Recognition (cs.CV)",Computer Vision and Pattern Recognition (cs.CV)
arXiv:2512.09080,Almost-Optimal Approximation Algorithms for Global Minimum Cut in Directed Graphs,有向图全局最小割的近似最优算法,Ron Mosenzon,https://arxiv.org/pdf/2512.09080,"Subjects:
Data Structures and Algorithms (cs.DS)",Data Structures and Algorithms (cs.DS)
arXiv:2512.09076,Beyond the Hype: Comparing Lightweight and Deep Learning Models for Air Quality Forecasting,超越炒作：轻量级与深度学习模型在空气质量预测中的比较,"Moazzam Umer Gondal, Hamad ul Qudous, Asma Ahmad Farhan",https://arxiv.org/pdf/2512.09076,"Subjects:
Machine Learning (cs.LG); Artificial Intelligence (cs.AI); Machine Learning (stat.ML)","Machine Learning (cs.LG),  Artificial Intelligence (cs.AI),  Machine Learning (stat.ML)"
arXiv:2512.09074,Modular Deep-Learning-Based Early Warning System for Deadly Heatwave Prediction,基于模块化深度学习的致命热浪预测预警系统,"Shangqing Xu, Zhiyuan Zhao, Megha Sharma, José María Martín-Olalla, Alexander Rodríguez, Gregory A. Wellenius, B. Aditya Prakash",https://arxiv.org/pdf/2512.09074,"Subjects:
Machine Learning (cs.LG)",Machine Learning (cs.LG)
arXiv:2512.09071,Adaptive Thresholding for Visual Place Recognition using Negative Gaussian Mixture Statistics,基于负高斯混合统计的自适应阈值视觉地点识别方法,"Nick Trinh, Damian Lyons",https://arxiv.org/pdf/2512.09071,"Subjects:
Computer Vision and Pattern Recognition (cs.CV); Robotics (cs.RO)","Computer Vision and Pattern Recognition (cs.CV),  Robotics (cs.RO)"
arXiv:2512.09070,Banach neural operator for Navier-Stokes equations,用于纳维-斯托克斯方程的巴拿赫神经算子,Bo Zhang,https://arxiv.org/pdf/2512.09070,"Subjects:
Neural and Evolutionary Computing (cs.NE); Machine Learning (cs.LG); Machine Learning (stat.ML)","Neural and Evolutionary Computing (cs.NE),  Machine Learning (cs.LG),  Machine Learning (stat.ML)"
arXiv:2512.09069,KD-OCT: Efficient Knowledge Distillation for Clinical-Grade Retinal OCT Classification,KD-OCT：面向临床级视网膜光学相干断层扫描分类的高效知识蒸馏,"Erfan Nourbakhsh, Nasrin Sanjari, Ali Nourbakhsh",https://arxiv.org/pdf/2512.09069,"Subjects:
Computer Vision and Pattern Recognition (cs.CV); Artificial Intelligence (cs.AI); Machine Learning (cs.LG)","Computer Vision and Pattern Recognition (cs.CV),  Artificial Intelligence (cs.AI),  Machine Learning (cs.LG)"
arXiv:2512.09067,Contrast transfer functions help quantify neural network out-of-distribution generalization in HRTEM,对比传递函数在高分辨率透射电子显微镜中量化神经网络分布外泛化能力,"Luis Rangel DaCosta, Mary C. Scott",https://arxiv.org/pdf/2512.09067,"Subjects:
Machine Learning (cs.LG); Materials Science (cond-mat.mtrl-sci)","Machine Learning (cs.LG),  Materials Science (cond-mat.mtrl-sci)"
arXiv:2512.09066,ORCA: Open-ended Response Correctness Assessment for Audio Question Answering,ORCA：面向音频问答的开放响应正确性评估系统,"Šimon Sedláček, Sara Barahona, Bolaji Yusuf, Laura Herrera-Alarcón, Santosh Kesiraju, Cecilia Bolaños, Alicia Lozano-Diez, Sathvik Udupa, Fernando López, Allison Ferner, Ramani Duraiswami, Jan Černocký",https://arxiv.org/pdf/2512.09066,"Subjects:
Sound (cs.SD); Artificial Intelligence (cs.AI); Computation and Language (cs.CL)","Sound (cs.SD),  Artificial Intelligence (cs.AI),  Computation and Language (cs.CL)"
arXiv:2512.09065,ShelfAware: Real-Time Visual-Inertial Semantic Localization in Quasi-Static Environments with Low-Cost Sensors,ShelfAware：基于低成本传感器的准静态环境实时视觉-惯性语义定位,"Shivendra Agrawal, Jake Brawer, Ashutosh Naik, Alessandro Roncone, Bradley Hayes",https://arxiv.org/pdf/2512.09065,"Subjects:
Robotics (cs.RO); Artificial Intelligence (cs.AI)","Robotics (cs.RO),  Artificial Intelligence (cs.AI)"
arXiv:2512.09062,SIP: Site in Pieces- A Dataset of Disaggregated Construction-Phase 3D Scans for Semantic Segmentation and Scene Understanding,SIP：碎片化场地数据集——面向语义分割与场景理解的施工阶段三维扫描数据集,"Seongyong Kim, Yong Kwon Cho",https://arxiv.org/pdf/2512.09062,"Subjects:
Computer Vision and Pattern Recognition (cs.CV); Machine Learning (cs.LG)","Computer Vision and Pattern Recognition (cs.CV),  Machine Learning (cs.LG)"
arXiv:2512.09059,A Diffusion-Based Framework for High-Resolution Precipitation Forecasting over CONUS,面向美国本土的高分辨率降水预测扩散框架,"Marina Vicens-Miquel, Amy McGovern, Aaron J. Hill, Efi Foufoula-Georgiou, Clement Guilloteau, Samuel S. P. Shen",https://arxiv.org/pdf/2512.09059,"Subjects:
Machine Learning (cs.LG)",Machine Learning (cs.LG)
arXiv:2512.09056,ConceptPose: Training-Free Zero-Shot Object Pose Estimation using Concept Vectors,ConceptPose：基于概念向量的免训练零样本物体姿态估计,"Liming Kuang, Yordanka Velikova, Mahdi Saleh, Jan-Nico Zaech, Danda Pani Paudel, Benjamin Busam",https://arxiv.org/pdf/2512.09056,"Subjects:
Computer Vision and Pattern Recognition (cs.CV)",Computer Vision and Pattern Recognition (cs.CV)
arXiv:2512.09054,Improving Multi-Class Calibration through Normalization-Aware Isotonic Techniques,通过归一化感知等温技术改进多类校准,"Alon Arad, Saharon Rosset",https://arxiv.org/pdf/2512.09054,"Subjects:
Machine Learning (cs.LG)",Machine Learning (cs.LG)
arXiv:2512.09049,EMMap: A Systematic Framework for Spatial EMFI Mapping and Fault Classification on Microcontrollers,EMMap：微控制器空间电磁场干扰图谱绘制与故障分类系统框架,"Gandham Sai Santhosh, Siddhartha Sanjay Naik, Ritwik Badola, Chester Rebeiro",https://arxiv.org/pdf/2512.09049,"Subjects:
Cryptography and Security (cs.CR)",Cryptography and Security (cs.CR)
arXiv:2512.09016,Learning to Remove Lens Flare in Event Camera,事件相机镜头眩光去除学习方法,"Haiqian Han, Lingdong Kong, Jianing Li, Ao Liang, Chengtao Zhu, Jiacheng Lyu, Lai Xing Ng, Xiangyang Ji, Wei Tsang Ooi, Benoit R. Cottereau",https://arxiv.org/pdf/2512.09016,"Subjects:
Computer Vision and Pattern Recognition (cs.CV)",Computer Vision and Pattern Recognition (cs.CV)
arXiv:2512.09015,Luxical: High-Speed Lexical-Dense Text Embeddings,Luxical：高速词法密集文本嵌入,"DatologyAI: Luke Merrick, Alex Fang, Aldo Carranza, Alvin Deng, Amro Abbas, Brett Larsen, Cody Blakeney, Darren Teh, David Schwab, Fan Pan, Haakon Mongstad, Haoli Yin, Jack Urbanek, Jason Lee, Jason Telanoff, Josh Wills, Kaleigh Mentzer, Paul Burstein, Parth Doshi, Paul Burnstein, Pratyush Maini, Ricardo Monti, Rishabh Adiga, Scott Loftin, Siddharth Joshi, Spandan Das, Tony Jiang, Vineeth Dorna, Zhengping Wang, Bogdan Gaza, Ari Morcos, Matthew Leavitt",https://arxiv.org/pdf/2512.09015,"Subjects:
Computation and Language (cs.CL); Machine Learning (cs.LG)","Computation and Language (cs.CL),  Machine Learning (cs.LG)"
arXiv:2512.09014,Prototyping and Evaluating a Real-time Neuro-Adaptive Virtual Reality Flight Training System,实时神经自适应虚拟现实飞行训练系统原型与评估,"Evy van Weelden, Jos M. Prinsen, Caterina Ceccato, Ethel Pruss, Anita Vrins, Maryam Alimardani, Travis J. Wiltshire, Max M. Louwerse",https://arxiv.org/pdf/2512.09014,"Subjects:
Human-Computer Interaction (cs.HC)",Human-Computer Interaction (cs.HC)
arXiv:2512.09013,Graph Deep Learning for Intracranial Aneurysm Blood Flow Simulation and Risk Assessment,图深度学习在颅内动脉瘤血流模拟与风险评估中的应用,"Paul Garnier, Pablo Jeken-Rico, Vincent Lannelongue, Chiara Faitini, Aurèle Goetz, Lea Chanvillard, Ramy Nemer, Jonathan Viquerat, Ugo Pelissier, Philippe Meliga, Jacques Sédat, Thomas Liebig, Yves Chau, Elie Hachem",https://arxiv.org/pdf/2512.09013,"Subjects:
Machine Learning (cs.LG); Fluid Dynamics (physics.flu-dyn)","Machine Learning (cs.LG),  Fluid Dynamics (physics.flu-dyn)"
arXiv:2512.09011,An Approach for Detection of Entities in Dynamic Media Contents,动态媒体内容实体检测方法,"Nzakiese Mbongo, Ngombo Armando",https://arxiv.org/pdf/2512.09011,"Subjects:
Computer Vision and Pattern Recognition (cs.CV)",Computer Vision and Pattern Recognition (cs.CV)
arXiv:2512.09010,Towards Lossless Ultimate Vision Token Compression for VLMs,面向视觉语言模型的无损终极视觉标记压缩研究,"Dehua Zheng, Mouxiao Huang, Borui Jiang, Hailin Hu, Xinghao Chen",https://arxiv.org/pdf/2512.09010,"Subjects:
Computer Vision and Pattern Recognition (cs.CV); Artificial Intelligence (cs.AI)","Computer Vision and Pattern Recognition (cs.CV),  Artificial Intelligence (cs.AI)"
arXiv:2512.09006,Llama-based source code vulnerability detection: Prompt engineering vs Fine tuning,基于Llama的源代码漏洞检测：提示工程与微调对比,"Dyna Soumhane Ouchebara, Stéphane Dupont",https://arxiv.org/pdf/2512.09006,"Subjects:
Software Engineering (cs.SE); Artificial Intelligence (cs.AI); Cryptography and Security (cs.CR)","Software Engineering (cs.SE),  Artificial Intelligence (cs.AI),  Cryptography and Security (cs.CR)"
arXiv:2512.09005,"A Survey of Body and Face Motion: Datasets, Performance Evaluation Metrics and Generative Techniques",人体与面部运动综述：数据集、性能评估指标与生成技术,"Lownish Rai Sookha, Nikhil Pakhale, Mudasir Ganaie, Abhinav Dhall",https://arxiv.org/pdf/2512.09005,"Subjects:
Computer Vision and Pattern Recognition (cs.CV); Human-Computer Interaction (cs.HC)","Computer Vision and Pattern Recognition (cs.CV),  Human-Computer Interaction (cs.HC)"
arXiv:2512.09001,"A Physics-Constrained, Design-Driven Methodology for Defect Dataset Generation in Optical Lithography",基于物理约束的设计驱动型光刻工艺缺陷数据集生成方法,"Yuehua Hu, Jiyeong Kong, Dong-yeol Shin, Jaekyun Kim, Kyung-Tae Kang",https://arxiv.org/pdf/2512.09001,"Subjects:
Computer Vision and Pattern Recognition (cs.CV); Artificial Intelligence (cs.AI)","Computer Vision and Pattern Recognition (cs.CV),  Artificial Intelligence (cs.AI)"
arXiv:2512.08999,Diffusion Model Regularized Implicit Neural Representation for CT Metal Artifact Reduction,扩散模型正则化的隐式神经表示用于CT金属伪影减少,"Jie Wen, Chenhe Du, Xiao Wang, Yuyao Zhang",https://arxiv.org/pdf/2512.08999,"Subjects:
Computer Vision and Pattern Recognition (cs.CV)",Computer Vision and Pattern Recognition (cs.CV)
arXiv:2512.08996,Demo: Generative AI helps Radiotherapy Planning with User Preference,演示：生成式AI通过用户偏好辅助放疗规划,"Riqiang Gao, Simon Arberet, Martin Kraus, Han Liu, Wilko FAR Verbakel, Dorin Comaniciu, Florin-Cristian Ghesu, Ali Kamen",https://arxiv.org/pdf/2512.08996,"Subjects:
Computer Vision and Pattern Recognition (cs.CV); Artificial Intelligence (cs.AI); Machine Learning (cs.LG)","Computer Vision and Pattern Recognition (cs.CV),  Artificial Intelligence (cs.AI),  Machine Learning (cs.LG)"
arXiv:2512.08995,PoultryTalk: A Multi-modal Retrieval-Augmented Generation (RAG) System for Intelligent Poultry Management and Decision Support,PoultryTalk：面向智能家禽管理与决策支持的多模态检索增强生成系统,"Kapalik Khanal, Biswash Khatiwada, Stephen Afrifa, Ranjan Sapkota, Sanjay Shah, Frank Bai, Ramesh Bahadur Bist",https://arxiv.org/pdf/2512.08995,"Subjects:
Human-Computer Interaction (cs.HC); Information Retrieval (cs.IR)","Human-Computer Interaction (cs.HC),  Information Retrieval (cs.IR)"
arXiv:2512.08991,Deterministic World Models for Verification of Closed-loop Vision-based Systems,确定性世界模型用于闭环视觉系统验证,"Yuang Geng, Zhuoyang Zhou, Zhongzheng Zhang, Siyuan Pan, Hoang-Dung Tran, Ivan Ruchkin",https://arxiv.org/pdf/2512.08991,"Subjects:
Computer Vision and Pattern Recognition (cs.CV); Machine Learning (cs.LG)","Computer Vision and Pattern Recognition (cs.CV),  Machine Learning (cs.LG)"
arXiv:2512.08989,Enhancing Knowledge Transfer in Hyperspectral Image Classification via Cross-scene Knowledge Integration,通过跨场景知识整合增强高光谱图像分类的知识迁移,"Lu Huo, Wenjian Huang, Jianguo Zhang, Min Xu, Haimin Zhang",https://arxiv.org/pdf/2512.08989,"Subjects:
Computer Vision and Pattern Recognition (cs.CV)",Computer Vision and Pattern Recognition (cs.CV)
arXiv:2512.08987,3DID: Direct 3D Inverse Design for Aerodynamics with Physics-Aware Optimization,3DID：基于物理感知优化的直接3D逆向设计方法,"Yuze Hao, Linchao Zhu, Yi Yang",https://arxiv.org/pdf/2512.08987,"Subjects:
Computer Vision and Pattern Recognition (cs.CV); Artificial Intelligence (cs.AI)","Computer Vision and Pattern Recognition (cs.CV),  Artificial Intelligence (cs.AI)"
arXiv:2512.08986,Explainable Fundus Image Curation and Lesion Detection in Diabetic Retinopathy,可解释性眼底图像整理与糖尿病视网膜病变病灶检测,"Anca Mihai, Adrian Groza",https://arxiv.org/pdf/2512.08986,"Subjects:
Computer Vision and Pattern Recognition (cs.CV); Artificial Intelligence (cs.AI)","Computer Vision and Pattern Recognition (cs.CV),  Artificial Intelligence (cs.AI)"
arXiv:2512.08985,An Efficient Test-Time Scaling Approach for Image Generation,图像生成的高效测试时扩展方法,"Vignesh Sundaresha, Akash Haridas, Vikram Appia, Lav R. Varshney",https://arxiv.org/pdf/2512.08985,"Subjects:
Computer Vision and Pattern Recognition (cs.CV)",Computer Vision and Pattern Recognition (cs.CV)
arXiv:2512.08984,RAG-HAR: Retrieval Augmented Generation-based Human Activity Recognition,RAG-HAR：基于检索增强生成的人类活动识别,"Nirhoshan Sivaroopan, Hansi Karunarathna, Chamara Madarasingha, Anura Jayasumana, Kanchana Thilakarathna",https://arxiv.org/pdf/2512.08984,"Subjects:
Computer Vision and Pattern Recognition (cs.CV); Artificial Intelligence (cs.AI)","Computer Vision and Pattern Recognition (cs.CV),  Artificial Intelligence (cs.AI)"
arXiv:2512.08983,HSCP: A Two-Stage Spectral Clustering Framework for Resource-Constrained UAV Identification,HSCP：面向资源受限无人机识别的两阶段谱聚类框架,"Maoyu Wang, Yao Lu, Bo Zhou, Zhuangzhi Chen, Yun Lin, Qi Xuan, Guan Gui",https://arxiv.org/pdf/2512.08983,"Subjects:
Computer Vision and Pattern Recognition (cs.CV); Artificial Intelligence (cs.AI)","Computer Vision and Pattern Recognition (cs.CV),  Artificial Intelligence (cs.AI)"
arXiv:2512.08982,Consist-Retinex: One-Step Noise-Emphasized Consistency Training Accelerates High-Quality Retinex Enhancement,Consist-Retinex：一步噪声强调一致性训练加速高质量Retinex增强,"Jian Xu, Wei Chen, Shigui Li, Delu Zeng, John Paisley, Qibin Zhao",https://arxiv.org/pdf/2512.08982,"Subjects:
Computer Vision and Pattern Recognition (cs.CV); Artificial Intelligence (cs.AI)","Computer Vision and Pattern Recognition (cs.CV),  Artificial Intelligence (cs.AI)"
arXiv:2512.08981,Mitigating Bias with Words: Inducing Demographic Ambiguity in Face Recognition Templates by Text Encoding,以文字消解偏见：通过文本编码诱导人脸识别模板中的人口统计模糊性,"Tahar Chettaoui, Naser Damer, Fadi Boutros",https://arxiv.org/pdf/2512.08981,"Subjects:
Computer Vision and Pattern Recognition (cs.CV); Artificial Intelligence (cs.AI)","Computer Vision and Pattern Recognition (cs.CV),  Artificial Intelligence (cs.AI)"
arXiv:2512.08980,Training Multi-Image Vision Agents via End2End Reinforcement Learning,通过端到端强化学习训练多图像视觉智能体,"Chengqi Dong, Chuhuai Yue, Hang He, Rongge Mao, Fenghe Tang, S Kevin Zhou, Zekun Xu, Xiaohan Wang, Jiajun Chai, Wei Lin, Guojun Yin",https://arxiv.org/pdf/2512.08980,"Subjects:
Computer Vision and Pattern Recognition (cs.CV); Artificial Intelligence (cs.AI)","Computer Vision and Pattern Recognition (cs.CV),  Artificial Intelligence (cs.AI)"
arXiv:2512.08979,What Happens When: Learning Temporal Orders of Events in Videos,What Happens When：学习视频中事件的时间顺序,"Daechul Ahn, Yura Choi, Hyeonbeom Choi, Seongwon Cho, San Kim, Jonghyun Choi",https://arxiv.org/pdf/2512.08979,"Subjects:
Computer Vision and Pattern Recognition (cs.CV); Artificial Intelligence (cs.AI)","Computer Vision and Pattern Recognition (cs.CV),  Artificial Intelligence (cs.AI)"
arXiv:2512.08978,Institutional AI Sovereignty Through Gateway Architecture: Implementation Report from Fontys ICT,通过网关架构实现机构AI主权：Fontys ICT实施报告,"Ruud Huijts, Koen Suilen",https://arxiv.org/pdf/2512.08978,"Subjects:
Computers and Society (cs.CY); Artificial Intelligence (cs.AI)","Computers and Society (cs.CY),  Artificial Intelligence (cs.AI)"
arXiv:2512.08977,"Hacia una moderna ""republica de las ideas"" via un nuevo ecosistema de comunicacion cientifica (Toward a modern ""Republic of Ideas"" via a new Ecosystem of Scientific Communication)","通过新型科学传播生态系统构建现代""思想共和国""",Enrique Lopez-Gonzalez,https://arxiv.org/pdf/2512.08977,"Subjects:
Other Computer Science (cs.OH)",Other Computer Science (cs.OH)
arXiv:2512.08976,Peek-a-Boo Reasoning: Contrastive Region Masking in MLLMs,Peek-a-Boo推理：多模态大语言模型中的对比区域掩码,"Isha Chaturvedi, Anjana Nair, Yushen Li, Adhitya Rajendra Kumar, Kevin Zhu, Sunishchal Dev, Ashwinee Panda, Vasu Sharma",https://arxiv.org/pdf/2512.08976,"Subjects:
Machine Learning (cs.LG); Artificial Intelligence (cs.AI)","Machine Learning (cs.LG),  Artificial Intelligence (cs.AI)"
arXiv:2512.08973,Enhancing Automatic Speech Recognition Through Integrated Noise Detection Architecture,通过集成噪声检测架构增强自动语音识别,Karamvir Singh,https://arxiv.org/pdf/2512.08973,"Subjects:
Sound (cs.SD); Artificial Intelligence (cs.AI); Machine Learning (cs.LG); Audio and Speech Processing (eess.AS)","Sound (cs.SD),  Artificial Intelligence (cs.AI),  Machine Learning (cs.LG),  Audio and Speech Processing (eess.AS)"
arXiv:2512.08969,Learning Robust Representations for Malicious Content Detection via Contrastive Sampling and Uncertainty Estimation,通过对比采样与不确定性估计学习鲁棒表示以进行恶意内容检测,"Elias Hossain, Umesh Biswas, Charan Gudla, Sai Phani Parsa",https://arxiv.org/pdf/2512.08969,"Subjects:
Machine Learning (cs.LG); Artificial Intelligence (cs.AI)","Machine Learning (cs.LG),  Artificial Intelligence (cs.AI)"
arXiv:2512.08968,StructuredDNA: A Bio-Physical Framework for Energy-Aware Transformer Routing,StructuredDNA：面向节能的Transformer路由的生物物理框架,Mustapha Hamdi,https://arxiv.org/pdf/2512.08968,"Subjects:
Machine Learning (cs.LG)",Machine Learning (cs.LG)
arXiv:2512.08967,CluCERT: Certifying LLM Robustness via Clustering-Guided Denoising Smoothing,CluCERT：通过聚类引导的去噪平滑验证大语言模型鲁棒性,"Zixia Wang, Gaojie Jin, Jia Hu, Ronghui Mu",https://arxiv.org/pdf/2512.08967,"Subjects:
Machine Learning (cs.LG); Artificial Intelligence (cs.AI)","Machine Learning (cs.LG),  Artificial Intelligence (cs.AI)"
arXiv:2512.08965,Financial Instruction Following Evaluation (FIFE),金融指令遵循评估（FIFE）,"Glenn Matlin, Siddharth, Anirudh JM, Aditya Shukla, Yahya Hassan, Sudheer Chava",https://arxiv.org/pdf/2512.08965,"Subjects:
Machine Learning (cs.LG); Artificial Intelligence (cs.AI); Computation and Language (cs.CL)","Machine Learning (cs.LG),  Artificial Intelligence (cs.AI),  Computation and Language (cs.CL)"
